Paper ID,Title,Sim1,Sim2
7BC02CE4,"The cost of variability",0.107028388278,0.133928571429
7CC036A6,"Design and quantitative evaluation of a novel FlexRay Bus Guardian",0.141121031746,0.164880952381
7BF00854,"Randomization adaptive self-stabilization",0.0991684173669,0.142857142857
798251FA,"Searchlight: helping mobile devices find their neighbors",0.11875,0.201111111111
768D22E1,"Broadcast analysis in dense duty-cycle sensor networks",0.45808531746,0.78125
76213A3C,"An experimental investigation of VoIP and video streaming over fixed WiMAX",0.122222222222,0.143560606061
7CF1F447,"Evaluation of fault-tolerant distributed Web systems",0.14806547619,0.178571428571
627BCB91,"Long baseline clock comparison with multichannel GPS time receivers",0.229166666667,0.355158730159
6069F5C9,"Operational VLBI clock synchronization and platform parameter determination",0.353918650794,0.307142857143
7D6C9F4B,"An Efficient One-way Delay Measurement Algorithm in Packet Switching Network",0.236607142857,0.290277777778
018F2834,"Self-* Pulse Synchronization for Autonomous TDMA MAC in VANETs",0.330998862249,0.545454545455
7F255677,"Tightly Synchronized Distributed Measurement and Event Triggers",0.167162698413,0.191904761905
812B6AA2,"Low frequency clock synchronization technique for low signal to noise ratio (SNR) signal recoery from noise environment",0.372916666667,0.265833333333
5A68FCE2,"Robust multi-hop time synchronization in sensor networks",0.673214285714,1.0
803399FC,"A loading effect insensitive and high precision clock synchronization circuit",0.35689484127,0.327777777778
6302CC67,"Formal development of a clock synchronization circuit",0.357841810967,0.379166666667
098DAB98,"A New Brobabilistic AIgorithm for Clock Synchronization",0.416313932981,0.722222222222
7B1A39D5,"Experimental validation of a new moving horizon estimator approach for networked control systems with unsynchronized clocks",0.337962962963,0.346818613485
7F0B6B94,"Re-examine the two principles of special relativity and the Sagnac effect using GPS' range measurement equation",0.134672619048,0.151083638584
09030D28,"A Spacelab experiment on clock synchronization and one-way ranging",0.345436507937,0.422222222222
5DC496DF,"Synchronization and Communication Results in Safety-Critical Real-Time Systems",0.376488095238,0.381944444444
76594B60,"Clock Synchronization in Mobile Ad Hoc Networks Based on an Iterative Approximate Byzantine Consensus Protocol",0.453472222222,0.375054112554
7A455BF5,"Proximity synchronization for mobile wireless sensor networks",0.667162698413,0.822222222222
7FDE2729,"A dynamic high speed multi-media local area network (MLAN) protocol architecture",0.240575396825,0.312698412698
740205CA,"Power packet dispatching with second‐order clock synchronization",0.350496031746,0.341904761905
747D2D34,"무선 센서 네트워크에서 비잔틴 오류를 허용하는 클럭 동기화 기법",0,0
7D3F1205,"A fault-tolerant distributed algorithm for termination detection using roughly synchronized clocks",0.109962606838,0.160042735043
7FBF73B7,"An analysis of orthogonal frequency-division multiple access",0.0897253787879,0.104166666667
7CECD81E,"UWB-over-fiber sensor network for accurate localization based on optical time-division multiplexing",0.350942460317,0.614583333333
756CE695,"VLBI clock synchronization",0.343353174603,0.583333333333
0A4A2C1E,"An Evaluation of Low Cost Hardware-assisted Internal Clock Synchronization in PC Cluster Environment",0.355505952381,0.272959183673
7BC8EE8A,"The design and testing of a new FPGA Data Acquisition System",0.270899470899,0.322294372294
811FEFFA,"Time synchronization via lunar radar",0.462103174603,0.733333333333
7666EEF0,"Low Noise Ultrashort Pulse Generation by Direct RF Modulation at 22 GHz From an AlGaInAs Multiple Quantum-Well Laser at 1.55 $\mu{\rm m}$",0.168898809524,0.166666666667
5FC23D38,"Entangled States as Reference Frames",0.107941017316,0.119588744589
0C41E327,"A monolithic 1 GHz 0.6�m CMOS low jitter PLL",0.123062354312,0.166666666667
75A3847A,"Cooperative Analog and Digital (CANDI) Time Synchronization for large two-dimension multihop networks",0.549702380952,0.777777777778
309DB9D2,"An Illustrated Guide to Relativity: Consequences",0.0987644300144,0.0883190883191
60ADED81,"Time synchronization measurements with a combination of a GPS receiver and the internet",0.475148809524,0.402721088435
803E2AB7,"Clock synchronization for fractal modulation",0.343353174603,0.430555555556
812AD91C,"ADDLL/VDD-biasing co-design for process characterization, performance calibration, and clock synchronization in variation-tolerant designs",0.368154761905,0.290816326531
5F4A4ACC,"Basic computations in wireless networks",0.354910714286,0.714285714286
85BF1BB4,"Self-adaptive clock synchronisation based on clock precision difference",0.343353174603,0.320105820106
7FA200DD,"A Passive Self-Configuration MAC Protocol for IEEE 802.11-Based Multi-Hop MANETs",0.100795038295,0.1056998557
62CD41E9,"Length standards and the twin paradox in the special theory of relativity",0.116713147963,0.111575924076
63A81A36,"Expanding Universe and its manifestations beyond the General Relativity",0.124801587302,0.140659340659
7A078443,"A clock synchronization algorithm for the performance analysis of multicomputer systems",0.371279761905,0.301587301587
5AC5A438,"Patents on Synchronization Techniques in Wireless OFDM Systems",0.362103174603,0.373214285714
76F17E32,"Quantum generated one-time-pad encryption with 1.25 Gbps clock synchronization",0.348561507937,0.385416666667
77D1A777,"An improvement on distributed detection in clock synchronization for MLAT sensor network",0.567911255411,0.572222222222
7E899246,"Adaptive multimedia playout method based on semantic structure of media stream",0.147569444444,0.188425925926
5DDEBC98,"Bluetooth Throughput Improvement Using a Slave to Slave Piconet Formation",0.138893398268,0.197685185185
77830939,"Timed consistent network updates",0.222222222222,0.422619047619
75B22254,"The complexity of crash failures",0.127232142857,0.150793650794
75100629,"An alternative polychronous model and synthesis methodology for model-driven embedded software",0.0943962287712,0.1118997669
5ED1B5A6,"A 833 Mb/s 2.5 V 4 Mb double data rate SRAM",0.136507936508,0.152777777778
7D1CDFD7,"A multimedia synchronization protocol for multicast groups",0.36994047619,0.492063492063
63EA673F,"A high performance CCD Linear Imaging Array",0.128273809524,0.147619047619
80A3DACF,"Broadband photonic switching using guided-wave fabrics",0.111607142857,0.244444444444
78B00549,"Inertial systems and the transformations of space and time.",0.272916666667,0.404166666667
77FE6498,"Optimized multiparty quantum clock synchronization",0.343353174603,0.356060606061
5A0FBD62,"Determining the User-Level Transmission Delay in Networks of Workstations",0.241418650794,0.35
58FDA7B1,"Self-Stabilizing Clock Synchronization in the Presence of Byzantine Faults",0.352529761905,0.305086580087
77F62BC6,"A Medium Fast Time-of-Flight Front End",0.12538243007,0.175
5CBF11AD,"Clocked and asynchronous instruction pipelines",0.123169191919,0.141666666667
7F93D715,"Building an AMBA AHB Compliant Memory Controller",0.10084013209,0.150673400673
178CABEE,"IMPROVED CLOCK ESTIMATION FOR PAIRWISE BROADCAST SYNCHRONIZATION IN WIRELESS SENSOR NETWORKS WITH GAUSSIAN DELAY MODEL",0.774305555556,0.575757575758
587921B3,"Low-Cost Hybrid Internal Clock Synchronization Mechanism for COTS PC Cluster (Research Note)",0.351537698413,0.264285714286
062BE562,"Interferometric Processing of the Data from the VEGA Balloon Probe and Flyby Station",0.13933531746,0.128240740741
7B1FC280,"Robust time-based localization for asynchronous networks with clock offsets",0.241418650794,0.358630952381
7A2B5C5F,"Distributed clock synchronization: Joint frequency and phase consensus",0.343353174603,0.293055555556
8053A4F7,"Performance evaluation of PTPd, a IEEE 1588 implementation, on the x86 Linux platform for typical application scenarios",0.124751984127,0.130333951763
77182A4A,"TEAM: Trust-extended authentication mechanism for vehicular ad hoc networks",0.226832195582,0.310476190476
7D28ADE6,"PLL-based BiCMOS on-chip clock generator for very high-speed microprocessor",0.0901976495726,0.166666666667
795957F2,"Digital Clock Synchronization Via Switched Long Distance Telephone Lines",0.349454365079,0.307142857143
813815D2,"Path Selection Based on Single Direction Delay Difference",0.127827380952,0.161507936508
63D2C1DF,"Multichannel multipoint distribution service system synchronization using global positioning system clock",0.376488095238,0.302579365079
7F9D9677,"A Servo-Clock Model for Chains of Transparent Clocks Affected by Synchronization Period Jitter",0.3568001443,0.275336568194
7EC2D47F,"An extended phase-locked loop for clock synchronization applications",0.35808531746,0.377380952381
7E12A1DF,"Sub-Clock Extraction of Optical Signals at High Rates using an Opto-Electronic Phase-Locked Loop Based on Three-Wave Mixing in Periodically-Poled Lithium Niobate",0.159627525253,0.195486111111
7718B745,"Relativity and Indeterminacy",0.102564102564,0.100961538462
047AAD48,"PhD TUTORIAL: A small trapped-ion quantum register",0.089103482302,0.109006734007
7ECC3159,"Fault detection and recovery coverage improvement by clock synchronized duplicated systems with optimal time diversity",0.256200396825,0.236619441165
752645BF,"CIRF: Constructive interference-based reliable flooding in asynchronous duty-cycle wireless sensor networks",0.452876984127,0.769230769231
5DCA8C6A,"Providing Runtime Clock Synchronization With Minimal Node-to-Node Time Deviation on XT4s and XT5s",0.456547619048,0.506666666667
7EC7638C,"A DLL based 10-320 MHz clock synchronizer",0.133920940171,0.216666666667
7FA2FA93,"A provably correct design of a fault-tolerant clock synchronization circuit",0.377728174603,0.416666666667
79BEE757,"The Hardware Design of Measurement System of Transmission Lines Based on Wireless Communication",0.276041666667,0.29537037037
7F0F6C3A,"Superluminal Signals and the Resolution of the Causal Paradox",0.141717657343,0.172619047619
5FD48095,"A reply to "Quantum Clock Synchronization"",0.346329365079,0.444444444444
7A096063,"Time-Triggered Ethernet and IEEE 1588 Clock Synchronization",0.343353174603,0.430555555556
7DECC3A7,"Consensus Computation in Unreliable Networks: A System Theoretic Approach",0.371279761905,0.498571428571
0BED772E,"The Chrono-Geometrical Structure of General Relativity and Clock Synchronization",0.352876984127,0.360897435897
79D0AF8D,"Pseudo-isochronous cell forwarding",0.0993055555556,0.105555555556
7E1A1B85,"Self-timed neural model implementation: an example using CMAC",0.108573717949,0.168560606061
5B53B678,"The PSL/Sugar Specification Language A Language for all Seasons",0.141717657343,0.191964285714
7D12D10D,"A Multi Way Tree for Token Based Authentication",0.119689338439,0.175324675325
7C12138E,"Elementary relativity with 'everyday' clock synchronization",0.343353174603,0.41452991453
7CD851F5,"Clock synchronization through second order coherence of thermal light",0.348561507937,0.293888888889
7CDD1F41,"Joint location and parameter tracking of mobile nodes in wireless networks",0.346681096681,0.408531746032
8093D58B,"s T from the SSCR LLLL(fn) with Application to Clock Sources for High-Speed ADCs",0.10873466811,0.117469336219
771BF423,"The design and analysis of low-cost real-time fieldbus systems",0.142676767677,0.208333333333
2D3981BC,"Precision Time Synchronization System over Wireless Networks for TDOA-based Real Time Locating Systems",0.58244047619,0.601388888889
7E41BD02,"Research on the authentication strategy of ASP mode-based networked manufacturing system",0.146329365079,0.157016594517
125F1A55,"Design and Implementation of Precision Time Synchronization in Wireless Networks Using ZigBee",0.691964285714,0.602430555556
7BEB9A8E,"Multi-node Echo Method",0.0966021825397,0.111111111111
5A82A5F3,"Joint Sequential Target Estimation and Clock Synchronization in Wireless Sensor Networks",0.667162698413,0.633503401361
7D9D8581,"Implementation and measurements of efficient communication facilities for distributed database systems",0.161458333333,0.179166666667
77D9510F,"An improved Kerberos protocol based on fast RSA algorithm",0.105778769841,0.200396825397
7E055BAF,"Use of femtosecond synchronization system with long-term stability over optical infrastructure",0.376488095238,0.295105820106
7FF3CA8C,"A 3.3 V 600 MHz-1.30 GHz CMOS phase-locked loop for clock synchronization of optical chip-to-chip interconnects",0.348908730159,0.326666666667
6E92ED6B,"NASA Langley's research program in formal methods",0.109962606838,0.118055555556
5A196453,"A Fault Tolerant Clock Synchronization Algorithm for Systems with Low-Precision Oscillators",0.371279761905,0.314087301587
6163F27F,"Theoretical Predictions for VLF Radio Propagation",0.225496031746,0.331755050505
7E51CB89,"Over-Sampling PLL for Low-Jitter and Responsive Clock Synchronization",0.343353174603,0.583333333333
7ECD62CD,"Slave to Master Clock synchronization via TCP/IP for time distribution and remote calibration applications",0.464880952381,0.341490299824
80081FB9,"A Linear Time Synchronization Algorithm for Underwater Wireless Sensor Networks",0.783482142857,0.854166666667
5E980045,"Reconfiguration and transient recovery in state machine architectures",0.133252164502,0.177489177489
80C2FDA8,"Clock Synchronization Through Discrete Control Correction",0.3443001443,0.347916666667
7847BA6A,"Cross-Layered Synchronization Protocol for Wireless Sensor Networks",0.667162698413,0.828571428571
7A185230,"Dust in the York canonical basis of ADM tetrad gravity: The problem of vorticity",0.129365079365,0.122606837607
7E30CCD7,"High Precision Frequency and Clock Synchronization Techniques on an International Basis",0.343353174603,0.290740740741
7A88E5CB,"NONEQUIVALENCE OF ETHER THEORIES AND SPECIAL RELATIVITY. COMMENT ON RECENT INTERPRETATION OF LORENTZ' ETHER THEORY",0.112992909868,0.105505605506
78C5951B,"Clock Synchronization, Dirac Observables and Gauge Variables in Canonical Gravity and the Objectivity of Spacetime.",0.348908730159,0.253846153846
7FB14081,"Zero skew clock routing in multiple-clock synchronous systems",0.114965763403,0.194444444444
05BB90C9,"Time/frequency dissemination and clock synchronization",0.348561507937,0.430555555556
762599B1,"Achieving Glitch-Free Clock Domain Crossing Signals Using Formal Verification, Static Timing Analysis, and Sequential Equivalence Checking",0.158333333333,0.177222222222
785A2B50,"A case study in clock synchronization for distributed camera systems",0.414186507937,0.365740740741
773E5033,"ASIC implementations of five SHA-3 finalists",0.099104020979,0.107954545455
265E2B87,"SBAS 신호 동기 알고리듬에 관한 연구",0.0739634011499,0.1
79932A6F,"Design of Can Bus Clock Synchronous System Based on STM32",0.142676767677,0.258333333333
5DAE8638,"Submicrosecond comparison of intercontinental clock synchronization by VLBI and the NTS satellite",0.356349206349,0.324126984127
80443262,"The method of time synchronization based on the combination of COMPASS GEO pseudo-range and two-way data",0.469246031746,0.434920634921
0548F601,"SYNCHRONIZATION OF CLOCKS IN THE GENERAL RELATIVITY THEORY.",0.329365079365,0.311188811189
5B542775,"Towards Relativistic Atomic Physics and Post-Minkowskian Gravitational Waves",0.109796626984,0.141666666667
78AA1E43,"Dark Matter as a Relativistic Inertial Effect in Einstein Canonical Gravity?",0.0987644300144,0.0883190883191
7B645B6B,"Clocks, power and synchronization in duty-cycled wireless sensor nodes",0.56001984127,0.557463369963
79CC7CAA,"Evaluation of clock synchronization methods for measurement and control using embedded Linux SBCs",0.357738095238,0.255912297579
7CC55C19,"Design of adaptive line protection under smart grid",0.134764194139,0.173611111111
76403E83,"Distributed Cooperative Sensing Scheme for Wireless Sleep EEG Measurement",0.124347527473,0.144848484848
77104C17,"Wait and Watch Technique: Removing Time synchronization overhead in Wireless Sensor Network",0.780357142857,0.611419753086
7F683BD1,"Synchronous parametric amplification for regeneration of 160Gbit/s OTDM signal",0.14365530303,0.150673400673
056C55BD,"Clock synchronization experiment via Symphonie satellite",0.35496031746,0.366666666667
59CF1454,"Inner potential of generating pulses as a consequence of recurrent principles and specific computing architecture",0.119498556999,0.138950731808
7E319127,"Data Transmission for Military Communication; Parameters and Capabilities",0.136607142857,0.14
7F8A8DDA,"Fully digital hysteresis modulation with switching time prediction",0.214136904762,0.326704545455
7F57FAE5,"Artificial neural networks for smart detection of digitally modulated signals",0.245884324009,0.379166666667
7F976586,"A new algorithm for fast synchronization in a burst mode PSK demodulator",0.425881834215,0.429828042328
7AF1E164,"Traps and pitfalls in secure clock synchronization",0.369543650794,0.402777777778
7EA73180,"Sufficient conditions on trellis-coded modulation for code-independent synchronizer performance",0.126537698413,0.141964285714
5C6669E9,"A new, nearly free, clock synchronization technique",0.403880070547,0.7
58D70CD5,"Resilience to dropping nodes in mobile ad hoc networks with link-state routing",0.225198412698,0.330555555556
6F4B4AFF,"Relativistic effects in GPS",0.120242604618,0.154761904762
79636BDE,"Searchlight: helping mobile devices find their neighbors",0.11875,0.201111111111
5A1243FD,"Accuracy and Fairness in Dead Reckoning Based Distributed Multiplayer Games",0.129464285714,0.172294372294
7DB0BCC4,"Research on RSS based Indoor Location Method",0.123759920635,0.16246031746
061C0F13,"ETS-VIII高精度時刻同期実験(宇宙応用シンポジウム-観測・通信衛星の軌道上評価と将来衛星搭載機器開発-)",0,0
639A1DB8,"Synchroniser l'heure de son PC sur une horloge atomique de l'Observatoire Royal de Belgique",0.091281512605,0.1114996115
7C18D0FE,"Bin-MAC: A Hybrid MAC for Ultra-compact Wireless Sensor Nodes",0.334615384615,0.553977272727
792663B0,"Impedance simulator for automatic calibration of LCR meters over the entire complex plan",0.141121031746,0.13367003367
7CF9D732,"A 2 V clock synchronizer using digital delay-locked loop",0.107638888889,0.2
7D57462A,"MONTAGNE: An FPL for Synchronous and Asynchronous Circuits",0.100614316239,0.25
606DDDF3,"Development of TDMA baseband equipment for SS/TDMA applications",0.13556547619,0.164285714286
791A752E,"Self-stabilization—beyond the token ring circulation (brief announcement)",0.112045940171,0.12962962963
62A065A0,"The LASSO experiment",0.0755196192696,0.1
5CCABC57,"Clock synchronization state graphs based on clock precision difference",0.350496031746,0.276443001443
7E9D803D,"A reliable multi-channel MAC protocol with efficient multicast support for ad hoc networks",0.241217116217,0.31341991342
5BD8A852,"SILENT: serialized low energy transmission coding for on-chip interconnection networks",0.227430555556,0.276725589226
09B2A800,"Definition of Antenna Microwave Time Delay for VLBI Clock Synchronization",0.470089285714,0.393707482993
5C58861E,"Implementation of asynchronous performance measurement (APM) protocol for the Internet",0.12996031746,0.144047619048
7AC34334,"Assessment of the Signal/Noise Ratio of Received Noise-Like Signals in Channels with Signal Depression and an Unstable System of Clock Synchronization",0.383680555556,0.261944444444
034BD336,"Logical clock synchronization method for duplicated database control",0.346329365079,0.313888888889
773A103C,"Efficient algorithms and performance bounds for clock synchronization in Wireless Sensor Networks",0.676339285714,0.56681547619
6020FECA,"Source structure errors in radio-interferometric clock synchronization for ten measured distributions",0.362053571429,0.260218253968
76529112,"Research on Time Synchronization in Cluster Robots Based on Wireless Network",0.689732142857,0.609375
80B178D0,"Time synchronization for an Ethernet-based real-time token network",0.552678571429,0.791666666667
763798CD,"Comments on "Analysis of self-stabilizing clock synchronization by means of stochastic Petri nets"",0.35689484127,0.290674603175
7DB9B07E,"Wave pipelines via look-up tables",0.123157051282,0.155555555556
81227405,"A Novel Clock Recovery Scheme for ATSC Receivers",0.108450577201,0.135822510823
7C16742B,"Clock transport synchronization and the dragging of inertial frames for elliptical orbits",0.362103174603,0.328333333333
71C4FB95,"АЛГОРИТМ ТАКТОВОЙ СИНХРОНИЗАЦИИ И ОЦЕНИВАНИЯ МОЩНОСТИ ШУМА, ИНВАРИАНТНЫЙ К МНОГОЛУЧЁВОСТИ И ВИДУ МОДУЛЯЦИИ",0,0
7A355BA2,"A New Method of Clock Synchronization without Light Signals",0.433249158249,0.505555555556
7D39F53B,"Clock synchronization and isotropy of the one-way speed of light",0.343353174603,0.308571428571
5FFD24FD,"Nature of Relativistic Effects and Delayed Clock Synchronization",0.343353174603,0.363095238095
763A1004,"A Study of High-Precision Internal Clock Maintenance Method",0.116666666667,0.119949494949
7C90388E,"Fully distributed clock synchronization in wide-range TDMA Ad-Hoc networks",0.450496031746,0.591666666667
758DBEC0,"Brief announcement: linear time byzantine self-stabilizing clock synchronization",0.459523809524,0.583333333333
7EF696FD,"An ASIC supporting external clock synchronization for distributed real-time systems",0.362103174603,0.4375
785300FF,"Clock Synchronization from Satellite Tracking",0.353823953824,0.366666666667
5AC17A8D,"Power consumption measurement and clock synchronization on low-power wireless sensor networks",0.681547619048,0.572023809524
753A7A32,"Clock Synchronization Via Relay II, Preliminary Report",0.343353174603,0.298571428571
7A7D8CFD,"An Effective Delay Analysis System for a Large Scale Computer Design",0.159722222222,0.1875
48CABBC1,"ポスター講演 圧縮センシングを用いた差分遅延トモグラフィにおける基準経路選択に関する研究 (知的環境とセンサネットワーク) -- (特集セッション 無線分散ネットワーク)",0,0
77A5A642,"A 55nm 1GHz one-cycle-locking de-skewing circuit",0.100614316239,0.25
763279D2,"A Perspective of Fault-Tolerant Clock Synchronization",0.343353174603,0.425925925926
7C803D14,"The accuracy of the clock synchronization achieved by TEMPO in Berkeley UNIX 4.3BSD",0.343353174603,0.295905483405
788F1DE3,"A PI controller based on asymmetric gossip communications for clocks synchronization in wireless sensors networks",0.56001984127,0.423277648278
5CEABA7B,"Simulation of an all optical time division multiplexing router employing symmetric Mach-Zehnder (SMZ)",0.217159576535,0.332070707071
0061E68E,"DCNET Internet Clock Service",0.118204365079,0.150793650794
7FE5F9C5,"Asynchronous power management scheme for wireless ad-hoc networks",0.229662698413,0.344155844156
75FAEEE7,"Asymmetry Mitigation in IEEE 802.3 Ethernet for High-Accuracy Clock Synchronization",0.3443001443,0.303333333333
59D7F829,"A codec LSI for HDTV signals",0.167613636364,0.25
61C0D21B,"Design of a phase-lock loop with time delay for a synchronous multiple-access system via on-board signal processing satellite",0.270833333333,0.307142857143
782DB082,"LTSs for translation validation of (multi-clocked) SIGNAL specifications",0.105778769841,0.130952380952
5870B685,"Probabilistic internal clock synchronization",0.343353174603,0.583333333333
7C7A5DCD,"On clock offset and skew estimation with exponentially distributed delays",0.129067460317,0.151904761905
7BCFA381,"Energy Efficient Global Clock Synchronization for Wireless Sensor Networks",0.667162698413,0.709595959596
77E0267A,"A hardware design approach of sorting for FlexRay-based clock synchronization",0.46746031746,0.469444444444
5D6A32E8,"Knowledge, Timed Precedence and Clocks",0.139034576535,0.119925213675
008E17BE,"ΑΠΟΦΥΓΗ ΑΝΑΜΟΝΗΣ ΣΤΟΝ ΣΥΝΤΟΝΙΣΜΟ ΚΑΙ ΣΤΗΝ ΕΠΙΚΟΙΝΩΝΙΑ ΠΟΛΥΕΠΕΞΕΡΓΑΣΤΙΚΩΝ ΣΥΣΤΗΜΑΤΩΝ. ΑΛΓΟΡΙΘΜΙΚΑ ΘΕΜΑΤΑ",0,0
606185F8,"Clock synchronization by the Symphonie and Laser Synchronization from Stationary Orbit (LASSO) geostationary satellites",0.352876984127,0.423931623932
79C29837,"Data communications network for a merchant bank",0.22812950938,0.300404040404
623F30E0,"Observables in Relativistic Quantum Mechanics",0.0805036976912,0.0839160839161
7881DCF0,"An end-to-end demonstration of a receiver array based free-space photon counting communications link",0.139831349206,0.169151334776
79A651D7,"Low Jitter, High Speed Clock Synchronizer for Nuclear Instrumentation",0.17178030303,0.206666666667
7C489DC9,"Operational transformation algorithm with conflict detection and awareness methods for real-time collaborative editing in P2P environments",0.126282051282,0.136805555556
80328E41,"DLOTOS: a LOTOS extension for clock synchronization in distributed systems",0.362103174603,0.381944444444
615D5A37,"Statistical analysis of time transfer data from Timation 2",0.238541666667,0.359027777778
63EAB9FD,"DIVA - towards microarcsecond global astrometry",0.0645271266401,0.0714285714286
7BD7E579,"Quantum limited measurements with optical frequency combs",0.171130952381,0.222222222222
81060E67,"Ultra-precise clock synchronization of remote atomic clocks with PRARE onboard ERS-2",0.343353174603,0.41452991453
75AE3C6F,"A New Distributed Approach for Achieving Clock Synchronization in Heterogeneous Networks",0.613403880071,0.736111111111
76A1C8BE,"A 28 nm Dual-Port SRAM Macro With Screening Circuitry Against Write-Read Disturb Failure Issues",0.13244047619,0.149126984127
