Paper ID,Title,Sim1,Sim2
7EB314BC,"Research and design of railway clearance measurement system based on non-contact sensors",0.250496031746,0.292013888889
009D38B1,"Time keeping office and NTP servers.",0.221180555556,0.385416666667
5A16146E,"A study of time dissemination via satellite in India",0.237301587302,0.302606837607
81053507,"Relating Sampling Period and Control Delay in Distributed Control Systems",0.147817460317,0.18112244898
06D0E832,"Telemetering of a missile bus 1553 B",0.0943643162393,0.152525252525
64224FFA,"A scan design for asynchronous sequential logic circuits using SR-latches",0.137468434343,0.229166666667
7A34CBA9,"IR-UWB technology on next generation RFID systems",0.160168650794,0.191666666667
7FBC5DE3,"Causality analysis of synchronous programs with refined clocks",0.156395687646,0.140758547009
7D77D463,"Designing on-chip clock generators",0.0901976495726,0.177777777778
79A60E76,"Procedure Analysis of IEC 870-5-101 Clock Synchronization and One of Its Improved Algorithms",0.357738095238,0.316666666667
77FC4594,"Practical implementations of non-blocking synchronization primitives",0.339091810967,0.412037037037
81790429,"Improved transient response of controllers by synchronizing the modulator with the load step: application to v2ic",0.104461163836,0.145779220779
813BAC56,"Reliable Re-Encryption in Unreliable Clouds",0.0822276681652,0.0909090909091
7B1A37B5,"Accelerated virtual switching with programmable NICs for scalable data center networking",0.131001984127,0.141964285714
7CA163AC,"A robust gradient clock synchronization algorithm for wireless sensor networks",0.672371031746,0.641666666667
7E683845,"Distributed deadlock detection and resolution based on hardware clocks",0.124496336996,0.164730507588
784590F8,"Measurement of packet processing time of an Internet host using asynchronous packet capture at the data-link layer",0.267261904762,0.261071428571
5FDEE4E6,"Clock synchronization in an N-modular redundant system",0.362103174603,0.472222222222
7AF716C7,"A distance-bounding concept for bilateral IEEE 802.15.4 communication",0.119139194139,0.138888888889
83CEBD43,"Synchronization to Microsecond Accuracy of Clocks in India through Television Transmission",0.374751984127,0.292506105006
78B53E13,"A method of task synchronization in a distributed system using FlexRay",0.371279761905,0.36746031746
7AD01898,"Satellite test of special relativity using the global positioning system",0.146329365079,0.180769230769
5CFC9815,"Interval-based clock synchronization is resilient to mobility",0.343353174603,0.410714285714
74CFDCB9,"Qualitative analysis of the impact of clock timing error and/or frequency offsets on an OFDM waveform demodulator",0.15689484127,0.159523809524
5EA34E6B,"Fault‐Tolerant Clock Synchronization",0.343353174603,0.583333333333
830D3EB9,"스페이스와이어 링크의 시각 동기 성능 개선",0,0
7CA2CEC3,"Introduction to the Special Issue on Real-Time Systems",0.141571969697,0.158333333333
7A6DA72E,"Orbit determination for geostationary satellites with the combination of transfer ranging and pseudorange data",0.154910714286,0.158994708995
76B947D5,"Nuclear Magnetic Resonance Implementation of a Quantum Clock Synchronization Algorithm",0.350297619048,0.266414141414
5DB71019,"On the Feasibility of Response Time Predictions --- An Experimental Evaluation",0.217159576535,0.288975468975
0A396374,"Clock synchronization for packet networks using a weighted least-squares error filtering technique and enabling circuit emulation service: Research Articles",0.475446428571,0.304120879121
840EFDB7,"Flease - Lease Coordination Without a Lock Server",0.133920940171,0.14375
7B73BED1,"Opportunistic Digital Array Radar and its technical characteristic analysis",0.146974206349,0.175
7B372781,"A New data coding method for wireless command transmission BPSK modulator in implantable neural signal acquisition system",0.368783068783,0.336468253968
046E65E9,"Open Architecture for Quality of Service Monitoring at a National Research and Education Network",0.257936507937,0.26343537415
7B27DF3B,"Die-to-Die Clock Synchronization for 3-D IC Using Dual Locking Mechanism",0.352529761905,0.308994708995
7DF9EE35,"Layered Diagnosis and Clock-Rate Correction for the TTEthernet Clock Synchronization Protocol",0.345436507937,0.281216931217
7F90C116,"Coding, decoding, and recovery of clock synchronization in digital multiplexing system",0.373511904762,0.304563492063
78CA78E9,"Synthesis of a control unit from instruction set specification in VHDL environment",0.123856005106,0.155102040816
79DDE037,"BAPUC: A broadcast authentication protocol for ubiquitous computing",0.222222222222,0.371428571429
7D8FFD5D,"The Spatial Diversity Algorithm of Sampling Clock Synchronization in MIMO-OFDM Systems",0.367311507937,0.313762626263
0978D1C3,"A new TDMA system for domestic service and its high speed PSK modem",0.251984126984,0.389880952381
06E56F09,"A New Fault - Tolerant for Clock - Synchronization",0.424470899471,0.577380952381
793D8F30,"Experimental Characterization and Analysis of an Asynchronous Approach for Reduction of Substrate Noise in Digital Circuitry",0.261607142857,0.273185941043
775DA0C8,"An Analysis and Demonstration of Clock Synchronization by VLBI",0.348561507937,0.350694444444
795B8FFA,"De-Synchronized Clocks in Preemption Games with Risky Prospects",0.112194749695,0.105128205128
6DB704B1,"On Distributed Algorithms in a Broadcast Domain",0.227430555556,0.359027777778
7E844464,"PET system synchronization and timing resolution using high-speed data links",0.369246031746,0.285912698413
5EF47626,"LazySync: A New Synchronization Scheme for Distributed Simulation of Sensor Networks",0.613536155203,0.702651515152
5A0B15AA,"Formal verification of a time-triggered hardware interface",0.114972527473,0.127777777778
8090FB8A,"Improving Two-Way Ranging Precision with Phase-offset Measurements",0.110987103175,0.194444444444
7CB026DC,"Three theories for delays, clocks and security in wireless networks",0.345734126984,0.400657213157
76CF66D0,"How do two moving clocks fall out of sync? A tale of trucks, threads, and twins",0.134623015873,0.195180860806
79FF000D,"On timeliness of a fair non-repudiation protocol",0.0965570887446,0.121428571429
7CE8A61A,"Non Data Aided Timing Recovery Algorithm for Digital Underwater Communications",0.131398809524,0.163571428571
1949CFF9,"Dynamic Replica Control Based on Fairly Assigned Variation of Data for Loosely Coupled Distributed Database Systems(Computer Systems)",0.171130952381,0.213636363636
62B83C75,"SIRIO-2 - Conception and present status",0.115079365079,0.126984126984
7ED4AF42,"Normality versus system mobility",0.147817460317,0.172619047619
00ACCAA7,"High-Accuracy Time Services and Fault-Tolerant Clock Synchronization",0.459672619048,0.572916666667
5ED85D2E,"Synchronizing Clocked Transition Systems",0.123926767677,0.187037037037
78471A94,"Exploring pausible clocking based GALS design for 40-nm system integration",0.166666666667,0.202272727273
764DBBE5,"Simultaneous clock synchronization in double broadcast domain of WSN",0.450496031746,0.569444444444
8018BA02,"A design method for skew tolerant latch design",0.134027777778,0.194444444444
06C3FE57,"Schemes for global clock synchronization using very long baseline interferometry of stellar sources.",0.343353174603,0.340404040404
7A07CC1F,"A Distributed Real-Time Operating System with Location-Transparent System Calls for Task Management and Inter-task Synchronization",0.373511904762,0.330952380952
75C14F7A,"A Gossiping Approach to Sampling Clock Synchronization in Wireless Acoustic Sensor Networks",0.674603174603,0.651360544218
7E0F03AB,"470 MHz digital filter on delta-sigma modulated signals",0.180262445887,0.25
7C4C4AFF,"Limits to clock synchronization induced by completely dephasing communication channels",0.34375,0.287962962963
8125B108,"The Effect of Large Clock Drifts on Performance of Event and Time Triggered Network Interfaces",0.36369047619,0.333774250441
37587F0D,"One-Way Delay Estimation Using One-Way Delay Variation and Round-Trip Time",0.217948717949,0.318055555556
76711F85,"TimeSync: enabling scalable, high-fidelity hybrid network emulation",0.222222222222,0.55
7A8D1FCA,"Clock frequency synchronization using high‐speed digital networks",0.450496031746,0.533333333333
5CF7AB5E,"A look at Einsteins clocks synchronization",0.330998862249,0.319735819736
808D655E,"Design and implementation of IEEE1588 time synchronization messages timestamping based on FPGA",0.510562354312,0.534722222222
75AB92C4,"Algorithms for synchronization of spatial diversity clocks from the signals of satellite navigation systems",0.385416666667,0.273976023976
5A852310,"Algorithmic problems in ad hoc networks",0.225198412698,0.425925925926
774D93A9,"Coupled distributed arithmetic coding",0.0991684173669,0.180952380952
76F1DE62,"Poster: clock synchronization for distributed wireless protocols at the physical layer",0.467162698413,0.451587301587
625C953B,"Relativistic effects of the rotation of the earth on remote clock synchronization",0.345436507937,0.304126984127
5F1DF734,"Cascaded Clock-Synchronized Diode Amplifier",0.0943643162393,0.188888888889
7D0292C8,"TMR processing without explicit clock synchronisation",0.343353174603,0.430555555556
8162EB2B,"Stability of phase locked oscillations in the circadian clock",0.117948717949,0.133888888889
62830468,"A Comparison of Intercontinental Clock Synchronization by VLBI and the NTS Satellite",0.356349206349,0.324126984127
7F7ED2E8,"Adaptive clock synchronization schemes for real-time traffic in broadband packet networks",0.450496031746,0.442929292929
80C161B5,"Phase and frequency detectors for clock synchronization in high-speed optical transmission systems",0.461061507937,0.404761904762
0462686F,"Ananlysis of clock synchronization algorithms",0.348561507937,0.430555555556
7F681E01,"A fully digital feedforward demodulator for vector signal analyzers",0.167613636364,0.195833333333
7C3B6FAC,"All-optical clock and data separation technique for asynchronous packet-switched optical time-division-multiplexed networks",0.23621031746,0.321904761905
5B7DE08C,"About using TV broadcasting satellites for the time scale synchronization",0.489880952381,0.496296296296
788F3A59,"A GALS ASIC implementation from a CAL dataflow description",0.113782051282,0.127525252525
0513E335,"Special relativity and conventionality of clock synchronization",0.343353174603,0.333624708625
5D0A4995,"Trace-based evaluation of clock synchronization algorithms for wireless loudspeakers",0.465029761905,0.433531746032
5B4B5C1F,"Comment on "Quantum key distribution with 1.25 Gbps clock synchronization" by J.C. Bienfang et al., quant-ph/0405097",0.346329365079,0.361111111111
7E3A1695,"Immersive second-screen experiences using hybrid media synchronization",0.37251984127,0.423611111111
7931D614,"The Implementation of IEEE 1588-2008 Precision Time Protocol on the STM32F107",0.213764880952,0.344742063492
7ACD725C,"Analysis and resolution of key issues in OFDM system simulation",0.14806547619,0.153571428571
7E2370F2,"Delay Asymmetry Correction Model for Master-Slave Synchronization Protocols",0.330312049062,0.263961038961
5939D3C5,"A Fault-Tolerant Real-Time Multicast Protocol RFRM/X",0.0965570887446,0.142857142857
7DE75557,"Probes of Lorentz Violation in Neutrino Propagation",0.0942113442113,0.0991161616162
76530748,"Relativistic Atomic Physics: from Atomic Clock Synchronization towards Relativistic Entanglement",0.35689484127,0.375
7F3A6D00,"Differential Sorting of the Vesicular Glutamate Transporter 1 into a Defined Vesicular Pool Is Regulated by Light Signaling Involving the Clock Gene Period2",0.108333333333,0.171035353535
7B514201,"On joint synchronization of clock offset and skew for Wireless Sensor Networks under exponential delay",0.667162698413,0.633503401361
0BBEB365,"Clock synchronization through a geostationary repeater using a radio interferometric technique",0.455853174603,0.451851851852
764516FA,"A Lorentz-invariant look at quantum clock synchronization protocols based on distributed entanglement",0.35689484127,0.299268192125
0A999256,"A possibility of clock synchronization between two stations by the way of an artificial satellite",0.356349206349,0.292063492063
021F5CD7,"Verification of Fault-Tolerant Clock Synchronization Algorithms",0.348561507937,0.347916666667
7DBAED10,"Implementation of Flexible Access System",0.130208333333,0.152777777778
765C9B4D,"It's about Time: Leveraging Clock Synchronization for Distributed Real-Time Programming",0.459672619048,0.430429292929
8061CC4F,"Efficient and accurate representation of asynchronous network structure changing phenomena in digital real time simulators",0.365178571429,0.433333333333
7BD762A6,"XY-expansion: Joint search and clock synchronization for wireless sensor and actor networks",0.681547619048,0.632034632035
7675EEBE,"Time Division Flooding Synchronization Protocol for Sensor Networks",0.673214285714,0.636281179138
81D82F3F,"110 GB/s simultaneous bi-directional transceiver logic synchronized with a system clock",0.114965763403,0.205555555556
7C2AB401,"High speed quantum key distribution system",0.149305555556,0.154671717172
5A12C12C,"Channel Modeling and Time Delay Estimation for Clock Synchronization Among Seaweb Nodes",0.457936507937,0.354166666667
0C08B4F2,"양방향 측위기법을 이용한 스마트 의사위성 항법시스템 개발에 관한 연구",0,0
81339811,"Frequency Modulation and First-Order Delta Sigma Modulation: Signal Representation With Unity Weight Dirac Impulses",0.135863095238,0.125440917108
7D174BE3,"Demand-Driven Weak Clock Synchronization for Distributed Applications",0.352529761905,0.377380952381
7966A3B1,"Comments on “IEEE 1588 Clock Synchronization Using Dual Slave Clocks in a Slave”",0.346329365079,0.309116809117
5FF37D44,"On the different forms of the Maxwell's electromagnetic equations in a uniform media",0.150252525253,0.161706349206
797429D4,"A clock synchronization system with IEEE 1588–2008 adapters over existing Gigabit Ethernet equipment",0.362103174603,0.313492063492
7F663B69,"Using IEEE 1588 and boundary clocks for clock synchronization in telecom networks",0.483829365079,0.485042735043
8078514C,"On the implementation of a capacity estimator for wireless ad hoc networks",0.352529761905,0.41712962963
7BBF19FF,"Master Timing of CAS Ground Stations",0.122867063492,0.122546897547
0278CD26,"On the problem of clock synchronization in general relativity.",0.343353174603,0.338675213675
7D81196F,"Measuring Response Intervals in a System With a 911 Primary and an Emergency Medical Services Secondary Public Safety Answering Point",0.171875,0.159166666667
5BE1BC8A,"Distributed time-management in transputer networks",0.222222222222,0.6
5C0AEA2D,"Hamiltonian ADM Gravity in Non-Harmonic Gauges with Well Defined Non-Euclidean 3-Spaces: How Much Darkness can be Explained as a Relativistic Inertial Effect?",0.123504273504,0.177032094889
75E63A0C,"A new synchronization scheme based on time division multiplexing and wavelength division multiplexing technology for practical quantum key distribution system",0.536375661376,0.362373737374
7B51762A,"A Power Management Protocol for Multi-Hop Ad Hoc Networks",0.232638888889,0.319047619048
79782621,"TBoPS: A Tree Based Distributed Beacon Only Period Scheduling Mechanism for IEEE 802.15.4",0.116713147963,0.17784992785
7BDF22A2,"Comparison of the communication protocols DLMS/COSEM, SML and IEC 61850 for smart metering applications",0.119139194139,0.140211640212
79B30521,"Clock Synchronization and Sub-clock Extraction of Optical Signals at High Rates using an Opto-Electronic PLL Based on Three-Wave Mixing in PPLN",0.36240530303,0.300694444444
778E73D5,"Invited Article Foreword",0.103621031746,0.133928571429
5ADB5CF0,"Proving the Properties of Communicating Imperfectly-Clocked Synchronous Systems",0.162103174603,0.216666666667
5DAA7DF5,"Formal Verification of the Interactive Convergence Clock Synchronization Algorithm",0.365922619048,0.328333333333
7E09323F,"Pattern-Driven Support for Designing Component-Based Architectural Models",0.110987103175,0.152525252525
7D43AE95,"Synchronous Parallel Optical I/O on CMOS: A Case Study of the Uniformity Issue",0.156837606838,0.215277777778
7B9421C1,"Conveyor belt clock synchronization",0.343353174603,0.335227272727
7B873C5E,"Distributed Real-Time System Monitor Based on Clock Synchronization: Distributed Real-Time System Monitor Based on Clock Synchronization",0.362103174603,0.338888888889
81F94FC0,"Switched real-time ethernet with earliest deadline first scheduling protocols and traffic handling",0.134474206349,0.160260770975
76D7CBD7,"Research and design of industrial Ethernet switch based on IEEE1588 standard",0.155456349206,0.196031746032
80895CFB,"Asynchronous channel hopping for establishing rendezvous in cognitive radio networks",0.350942460317,0.515
5F8E17F6,"Mirage: a model for latency in communication",0.129464285714,0.119338994339
5B2838C7,"Decoupled Carrier and Bit Clock Synchronizing Subsystems for the Coherent MSK/GMSK Receiver",0.154265873016,0.176360544218
7EA129BE,"Research on Failure Detector in Remote Disaster-tolerant System",0.234871031746,0.379464285714
816C26F0,"Parallel simulation of Markovian queueing networks",0.227430555556,0.430555555556
0A39D9AA,"Consensus Computation in Unreliable Networks",0.231398809524,0.414285714286
7F45B5F0,"Improving TCP Vegas Fairness in Presence of Backward Traffic",0.122222222222,0.147222222222
77E1339D,"Verification of a Byzantine-Fault-Tolerant Self-Stabilizing Protocol for Clock Synchronization",0.343353174603,0.352380952381
63E45612,"Precise time transfer using MKIII VLBI technology",0.212921626984,0.392361111111
5E37E054,"Multi-band acoustic modem for the communications and navigation aid AUV",0.121527777778,0.125694444444
7F1DB692,"Pipeline damage locating based on GPS fiducial clock synchronization and clock subdivision technology",0.359672619048,0.264730639731
795921E1,"Clock Synchronization Using Expectation-Maximization Algorithm in Wireless Sensor Network",0.672371031746,0.660714285714
7D9056F1,"Modeling technique and a simulation tool for analysis of clock synchronization in communication networks",0.474404761905,0.338888888889
024D9735,"Real-time systems using local-area networks. Technical report",0.25496031746,0.431547619048
06CD7FA7,"Scalable Network Based Clock Synchronization for Digital PET System",0.469246031746,0.476851851852
7672B448,"A 2-locking-cycle skew-compensation circuit with the capability of tracking runtime-variations",0.131490384615,0.208333333333
80BCC300,"Reliable monitoring of network-related performance parameters in wireless environments",0.235714285714,0.290238095238
7A6BB990,"Synchronization sensitivity of multicarrier systems",0.362103174603,0.45
76A41C53,"Ultra fast quantum key distribution over a 97 km installed telecom fiber with wavelength division multiplexing clock synchronization",0.343353174603,0.261678004535
7CED8499,"A new scheme for synchronization of inactive nodes in a sender-receiver protocol",0.403880070547,0.471753246753
78BE96A4,"Modeling distributed real-time systems with MAST 2",0.114965763403,0.205555555556
61BACA16,"Implementation of phasor measurements in state estimator at Sevillana de Electricidad",0.117162698413,0.120643939394
7EC3ECFA,"A communications system with instantaneous multiple access",0.124198717949,0.144444444444
79B35850,"York Map, Non-Inertial Frames and the Physical Interpretation of the Gauge Variables of the Gravitational Field",0.125694444444,0.127839620697
7A39C90C,"Clock Synchronization of Wireless Distributed System Based on IEEE 1588",0.46626984127,0.491666666667
80D42121,"A Wireless Sensor MAC Protocol for Bursty Data Traffic",0.352876984127,0.438961038961
011C731E,"Influence of relativity theory effects on VLBI clock synchronization",0.343353174603,0.267059329559
585C5582,"μLAN: local network between hardware devices",0.245734126984,0.437037037037
5DC72B11,"A Complex Electronics System Built-in-Test Based on Time-Triggered CAN Bus",0.114965763403,0.215064102564
7913EB96,"The Recursive Time Synchronization Protocol for Wireless Sensor Networks",0.780357142857,0.857142857143
82C685B3,"Opportunistic clock synchronization for ad hoc networks",0.453472222222,0.583333333333
7DD07AE1,"The algorithm of rapid signal capture and synchronization recognition in wireless communication and its implementation",0.34375,0.278439153439
76684966,"Is the International Atomic Time TAI a coordinate time or a proper time?",0.209796626984,0.833333333333
7A5D9294,"A Clock Synchronization Algorithm for TTEthernet",0.348561507937,0.430555555556
76913DBD,"Single-Event Characterization of Multi-Gigabit Transceivers (MGT) in Space-Grade Virtex-5QV Field Programmable Gate Arrays (FPGA)",0.12812950938,0.136219336219
00FF6DD7,"Circuits Without Clocks: What Makes Them Tick?",0.100614316239,0.215064102564
7EFD0521,"WizSync: Exploiting Wi-Fi Infrastructure for Clock Synchronization in Wireless Sensor Networks",0.667162698413,0.712962962963
80776CFA,"Estimation of clock parameters and performance benchmarks for synchronization in Wireless Sensor Networks",0.673214285714,0.515873015873
78E69109,"Food availability but not melatonin affects nocturnal restlessness in a wild migrating passerine",0.107532051282,0.111111111111
7C8506BC,"Clock synchronization in WSN: Simulation vs. implementation",0.350297619048,0.354166666667
5F243F45,"Time Warp on a Shared Memory Multiprocessor",0.226388888889,0.342171717172
7A3858D4,"A circular twin paradox",0.092854020979,0.107954545455
7F5F336A,"Symbol timing recovery for wavelet-based linear modulations",0.12619047619,0.144742063492
7FC54858,"Sub-clock extraction of optical signals at high rates using an opto-electronic phase-locked loop based on three-wave mixing in periodically-poled lithium niobate",0.159627525253,0.195486111111
7D691E7C,"Clock synchronization protocol for distributed satellite networks",0.46001984127,0.451587301587
785B17A8,"Use of a fiber Fabry-Perot tunable filter for high-speed optical packet switching: towards an experimental prototype",0.176785714286,0.185
7B6EE57C,"The programmable logic implementation of GPS/GLONASS clock synchronization",0.347172619048,0.430555555556
7C0F5767,"Time Synchronization by Television",0.482738095238,0.777777777778
80B2CAD6,"Synchronized Control of Aggregated Reservation States for Resource Management in Diffserv Networks",0.237248862249,0.259477427335
5E5D74A0,"Introduction to Distributed Algorithms: Fault Tolerance in Asynchronous Systems",0.141121031746,0.154828042328
8541A734,"Sparse Sensing for Statistical Inference: Theory, Algorithms, and Applications",0.0991684173669,0.139935064935
58907B2C,"Twenty-five years of satellite beacon studies in India",0.112045940171,0.116452991453
5FDE7C15,"A synchronized ensemble of genetic clocks coupled by improved quorum sensing",0.107772435897,0.167289377289
7EFC2F3C,"An energy aware coverage-preserving scheme for wireless sensor networks",0.452876984127,0.636363636364
7A9BEDE1,"The high speed bus technology development program",0.138888888889,0.133888888889
771C65AE,"Research and implementation of the burst-mode optical signal bit-error test",0.145979020979,0.144230769231
80FECF00,"Master failures in the Precision Time Protocol",0.221127830503,0.297546897547
62E6FF7A,"a Josephson Bit-Serial Decoder for Application in a Crossbar Switch.",0.124107142857,0.152380952381
785CF91E,"An energy-efficient clock synchronization protocol for Wireless Sensor Networks",0.667162698413,0.718253968254
786849E4,"Distributed synchronization in a wireless mesh communication network",0.574404761905,0.57962962963
7EDE701C,"An Environment for Design Software and Hardware Aspects of Clock Synchronization and Communication in DRTES",0.380654761905,0.264583333333
7D8315EE,"Low power optimization for a 40nm RFCMOS wireless connectivity chip",0.239538239538,0.297142857143
761E71DC,"Energy Efficiency in Wireless Sensor and Actor Networks by Distributed Time Sychnronization Algorithm",0.575148809524,0.559185606061
58EFE930,"Clock synchronization of MPEG-2 services over packet networks",0.455704365079,0.498333333333
75360F96,"Multi-module synchronic data acquisition based on T-CLK",0.131398809524,0.225396825397
7E69892F,"Research on Time Synchronization of WIA-PA Industrial Wireless Networks",0.676339285714,0.825
7FD592AB,"Terminal system and capability for ARPA-NASA high-speed SONET/ATM experiments over NASA's Advanced Communications Technology Satellite",0.144097222222,0.15
7FE00CB8,"Clock synchronization of distributed computers in building automation networks using an AC power supply",0.466121031746,0.37619047619
79D8C771,"On a reliable data communication broadcast system",0.276488095238,0.404166666667
7DA64162,"A novel technique to reduce the metastability of Bang-Bang Phase Frequency Detectors",0.237889194139,0.261111111111
7F205035,"Simple baseband synchronisation scheme for tamed frequency modulation",0.329365079365,0.345643939394
80E2767B,"Bit Synchronization in the Presence of Asymmetric Channel Noise",0.343948412698,0.315
759C022B,"A Reliable and Self-Aware Clock for reference time failure detection in internal synchronization environment",0.459672619048,0.382482993197
7F6AEDBB,"IEEE1588 Clock servo algorithm",0.111426767677,0.152777777778
73FDB54F,"A CMOS delayed locked loop (DLL) for reducing clock skew to under 500 ps",0.110763888889,0.171666666667
76464D0C,"Joint node localization and time-varying clock synchronization in wireless sensor networks",0.672371031746,0.715277777778
6346B316,"Measurement of one-way velocity of light and light-year",0.129555860806,0.166666666667
