Paper ID,Title,Sim1,Sim2
7C85446A,"Distributed clock synchronization algorithm for industrial networks",0.455704365079,0.498333333333
7571DCC3,"Reproducible IEEE 1588-performance tests with emulated environmental influences",0.102564102564,0.100961538462
7D5A3C1E,"Practical implications of relativity for a global coordinate time scale",0.217948717949,0.282051282051
7A2F6BB2,"Comparative analysis of synchronization strategies in sensor network with misbehaving clocks",0.565228174603,0.548805361305
5F5BB6E4,"Basestation-to-mobile clock synchronization in the presence of carrier frequency offset",0.343353174603,0.283531746032
78C806C4,"Short paper: detection of GPS spoofing attacks in power grids",0.141369047619,0.135600907029
752AE328,"On the Performance Gains of Cooperative Transmission Concepts in Intensity Modulated Direct Detection Visible Light Communication Networks",0.236607142857,0.231128747795
780F8312,"End-to-end one-way delay estimation using one-way delay variation and round-trip time",0.217948717949,0.318055555556
6A877AF0,"Analysis and optimization of PLL's with signal injection in synchronization systems",0.367311507937,0.315
58B5612F,"Performance of a dedicated VLBI system for TDRSS navigation",0.141121031746,0.191964285714
80EC38C0,"Electrical subharmonic hybrid mode locking of a colliding pulse mode-locked laser at 28 GHz",0.157738095238,0.17380952381
7D2C15F9,"Relativity in Astrometry, Celestial Mechanics and Geodesy",0.0690838675214,0.0729853479853
7D1C4FDD,"Practical Multi-Channel MAC for Ad Hoc Networks",0.226832195582,0.419191919192
7A40288F,"Synchronous links organization evaluating platform in PTN networks",0.234623015873,0.333571428571
63FD63B9,"Preliminary error budget for an optical ranging system: Range, range rate, and differenced range observables",0.171279761905,0.145299938157
7F7B4F08,"Joint carrier phase and symbol timing synchronization for burst satellite communications",0.362103174603,0.227469135802
806DD724,"Asynchronous Assertion Monitors for multi-Clock Domain System Verification",0.133722527473,0.13746031746
7E80C0F3,"A new clock synchronization architecture of network for Internet of Things",0.51278659612,0.517006802721
7747DF77,"Suboptimum bit synchronization in high-speed communications",0.329365079365,0.408333333333
72AE973A,"Distributed source-destination synchronization",0.329365079365,0.6
63A0B5A5,"Deterministic and Energy-Optimal Wireless Synchronization",0.452876984127,1.0
61161574,"The navigation experiment NAVEX: Experimental results of clock synchronization",0.348561507937,0.300555555556
5B748897,"A 330 MHz low-jitter and fast-locking direct skew compensation DLL",0.112980769231,0.133333333333
7F406453,"Symbol synchronization algorithms for M-PSK operating at one sample per symbol",0.341716269841,0.327222222222
7563C55D,"Hybrid clock synchronization: the pull‐in range of a ring network",0.450496031746,0.477777777778
5EC472B7,"Research on Distributed Time Synchronization in Expressway Toll System",0.478422619048,0.431818181818
03416AC4,"The effect of parameters of real receivers on noise immunity",0.131746031746,0.13246031746
7D887F91,"A streaming-protocol retransmission scheme without client-server clock synchronization",0.343353174603,0.419191919192
75335F30,"Building Ring-Like Overlays on Wireless Ad Hoc and Sensor Networks",0.455853174603,0.593253968254
7D5D3815,"The measuring information processing at operational analysis of jitters on an input of clock synchronization devices of telecommunication networks",0.496180555556,0.328282828283
7F9FF99D,"Collecting distributed garbage cycles by back tracing",0.115079365079,0.176904761905
7B35D02F,"Functional modeling techniques for efficient SW code generation of video codec applications",0.144448953824,0.150793650794
85886C0E,"Self-adaptive clock synchronization for computational grid",0.343353174603,0.425925925926
789F9EE3,"Propagation time estimation between underwater acoustic modems during data exchange via synchronous instant messages",0.303125,0.313383838384
7B24446D,"Evaluation of circuits for synchronization of electronic clocks with standard time and frequency signals",0.489583333333,0.412349555207
811F5C31,"Assessment of Precise Time Protocol in a Prototype System for the ITER Neutral Beam Test Facility",0.268154761905,0.258722527473
2D23DB35,"以彈性quorum機制解決IEEE 802.11無線隨意網路的時間不同步問題",0,0
620445B6,"Clock recovery for QPSK-TDMA receivers",0.108450577201,0.150793650794
772316F0,"Questions on universal constants and four-dimensional symmetry from a broad viewpoint. I",0.125939338439,0.127626262626
755287BE,"Ramp time synchronization",0.452435064935,0.714285714286
80E5DD00,"Optimal FIR filtering of clock models",0.104130591631,0.122895622896
79C2304E,"Clock Compensation Strategy in Train Ethernet",0.104477813853,0.129848484848
7B30CAFA,"A sensor network architecture for military and crisis management",0.353174603175,0.477142857143
7FB93137,"A predictive synchronizer for periodic clock domains",0.114736652237,0.159259259259
765DDE0F,"Evaluation of EtherCAT Clock Synchronization in Distributed Control Systems",0.371279761905,0.336904761905
778448EA,"The analysis of Clock Synchronization Protocol on Ethernet",0.348561507937,0.311904761905
7704E213,"An Analysis of a Low Information Rate Time Control Unit",0.252827380952,0.29880952381
5AEA7BA6,"Low-complexity training for rapid timing acquisition in ultra wideband communications",0.110987103175,0.133630952381
767C5C6F,"Light-Sync: A low overhead synchronization algorithm for underwater acoustic networks",0.441716269841,0.708333333333
639553FB,"A Demonstration of DSN Clock Synchronization by VLBI",0.346825396825,0.425925925926
8111E7A0,"Implementation of a VI-Based Synchronic Testing System for Underwater Transducer Array",0.158779761905,0.183181818182
1469D623,"Canonical Gravity and Relativistic Metrology: from Clock Synchronization to Dark Matter as a Relativistic Inertial Effect",0.343353174603,0.253755503756
80D8F069,"A Duty-Cycle-Distortion-Tolerant Half-Delay-Line Low-Power Fast-Lock-in All-Digital Delay-Locked Loop",0.0889946219716,0.2
7F9A7D87,"A synchronization and compensation protocol for multimedia communication systems",0.376488095238,0.331904761905
78408BA8,"Π 2 -- a generic proxy platform for wireless access and mobility in CORBA",0.12748015873,0.111492673993
5B83D40D,"ZigBee를 이용한 무선 네트워크 환경에서의 정밀 시각 동기 기법 설계 및 구현",0,0
807E9ECB,"A hybrid TDoA-ToA localization method",0.101810515873,0.118055555556
0D093140,"Deep very low frequency seismic activity in low frequency tremor zone: Monitoring by broadband seismic array analysis in Western Japan",0.15560966811,0.141049382716
81621142,"Experience with RAPID prototypes",0.0966021825397,0.105555555556
7C42DFA4,"Multi-Phase Correlator-based Realistic Clock Synchronization for Wireless Networks on IEEE 802.15.4",0.562996031746,0.791666666667
81A15792,"TOF clock system for BES III",0.127083333333,0.160416666667
8150BCDB,"An optimization approach for robust transformation of measured range data into position estimates in wireless networks",0.471428571429,0.422839506173
7965108B,"Analysis and solution of frequency difference in IEEE1588 clock synchronization systems",0.367311507937,0.284863945578
7CC25360,"A Self-Stabilizing Synchronization Protocol for Arbitrary Digraphs: A Self-Stabilizing Distributed Clock Synchronization Protocol For Arbitrary Digraphs",0.343353174603,0.3820861678
7CEBAD79,"A distributed FIFO scheme for on chip communication",0.122169497169,0.117171717172
76DBBF1C,"Research of the Wireless Distributed Test System Based on WLAN",0.231218434343,0.301465201465
5CDA863E,"Synchronization in DMT based VDSL modems",0.346478174603,0.5
7F105457,"Sensitivity of Multiband ZP-OFDM Ultra-Wide-Band and Receivers to Synchronization Errors",0.350942460317,0.346428571429
7B318B93,"Analysis and design of networked control loops with synchronization at the actuation instants",0.357142857143,0.280952380952
7D4B4535,"A probabilistic approach to clock synchronization of cascaded network elements",0.551091269841,0.640384615385
7AB6717C,"A Time Synchronization Algorithm in CSCW",0.44568452381,0.708333333333
7BB4B1F9,"Clock synchronization in software MPEG-2 decoder",0.343353174603,0.347916666667
80B95B14,"Formal Refinement Checking in a System-level Design Methodology",0.125587606838,0.175480769231
5C8A569A,"Report Dagstuhl Seminar on Time Services SchloßDagstuhl, March 11. – March 15. 1996",0.216889880952,0.293571428571
7CF103EF,"Slot Synchronization in Optical PPM Communications",0.329365079365,0.433333333333
079F3968,"On Transmission Scheduling in a Server-Less Video-on-Demand System",0.133333333333,0.166666666667
7E078205,"Multifunction-timing card lTTEV2 for CoDaC systems of Wendelstein 7-X",0.127083333333,0.1875
7736B40A,"Unified Time Service for virtualized Teleimmersive environments",0.223305860806,0.422619047619
102217DC,"Clock Synchronization in Industrial Automation Networks - Comparison of Different Syntonization Methods",0.453968253968,0.414814814815
7FD1E439,"Efficient fault tolerant broadcasting algorithm for the cube-connected cycles network",0.231398809524,0.304365079365
78D42E4B,"Garbage collection of timestamped data in Stampede",0.151187354312,0.185416666667
5C267B80,"A new MAC protocol based on token ring in wireless sensor networks",0.513668430335,0.584776334776
5BAFB49E,"A 4 GHz Clock Synchronized Non Coherent Energy Collection UWB Transceiver",0.154071969697,0.174848484848
7D4C763F,"Ordering in time: A new routing approach for wireless networks",0.619047619048,0.85
7F779A73,"Temporal imaging system with simple external clock synchronization",0.362103174603,0.395833333333
75E17016,"Synchronized Blitz: A Lower Bound on the Forwarding Rate of Fully Meshed Traffic in Packet Switches",0.156998556999,0.186111111111
0BC1E8B8,"Relativistic theory for clock syntonization and the realization of geocentric coordinate times.",0.117948717949,0.119696969697
80F46B2F,"Experimental demonstration of an active quantum key distribution network with over gbps clock synchronization",0.480158730159,0.401875901876
813DF726,"Joint non-linear ranging and affine synchronization basis for a network of mobile nodes",0.436507936508,0.483181818182
0A33B4FC,"Keynote: A Perspective of Fault-Tolerant Clock Synchronization",0.346329365079,0.361111111111
0E963C3B,"The influence of effects of relativity theory on clock synchronization using a very long-base interferometer.",0.348908730159,0.266961163836
75606B93,"A Kalman filter based synchronization scheme for telescope array receivers in deep-space optical communication links",0.391071428571,0.284307359307
76832C90,"Joint Node Localization and Time-Varying Clock Synchronization in Wireless Sensor Networks",0.672371031746,0.715277777778
633604F3,"Clock Synchronization Capabilities of the VLBA",0.343353174603,0.430555555556
808EE98C,"Node failure detection and membership in CANELy",0.119139194139,0.136507936508
7A860FCC,"Dynamical Clock Synchronization in Einstein's Theory:. Implications for the Aces Mission of ESA",0.343353174603,0.239239332096
7981C67D,"Structured multistage approaches for the design of on-board channelisers",0.219337606838,0.379464285714
5AF684CD,"Gravity-Based Local Clock Synchronization in Wireless Sensor Networks",0.667162698413,0.833333333333
79D55C41,"Security in wireless mobile ad hoc and sensor networks [Guest Editorial]",0.455853174603,0.499098124098
78610C0C,"Efficient at-most-once messages based on synchronized clocks",0.172967657343,0.303418803419
607CBC16,"Synchronization in Moving Pulse-Coupled Oscillator Networks",0.456051587302,0.633333333333
06892212,"A New Form of clock Synchronization",0.416313932981,0.577380952381
7FFF912D,"Rapid-prototyping of high-assurance systems",0.114965763403,0.25
0BA1680E,"A Design of Network Digital Audio Public Address System",0.275793650794,0.365
78E36207,"Clock Synchronization via Relay II Satellite",0.352876984127,0.31
76D2A243,"Final Results of a World-Wide Clock Synchronization Experiment (Project WOSAC)",0.345436507937,0.344444444444
03EBF5EB,"A Functional Programming Framework of Heterogeneous Model of Computation for System Design",0.148958333333,0.158279220779
5C89E57C,"Real-Time Support on Top of Ethernet",0.122371031746,0.134259259259
760C5254,"A Primer on Energy-Efficient Synchronization of WSN Nodes over Correlated Rayleigh Fading Channels",0.338439338439,0.296753246753
5B8A8DF9,"Input/Output Automata: Basic, Timed, Hybrid, Probabilistic, Dynamic,...",0.0916666666667,0.1125
16FD4C52,"Um Servi�o de Tempo Global para Sistemas Distribu�dos de Larga Escala",0.0844362745098,0.1
58AE7E04,"Source structure errors in the synchronization of clocks by radio interferometry",0.469196428571,0.421815221815
772ABA26,"Maximum likelihood network topology identification from edge-based unicast measurements",0.236607142857,0.268055555556
7FE772B3,"Clocked and asynchronous instruction pipelines",0.123169191919,0.141666666667
5CC373F7,"Sniffing out the correct physical layer capture model in 802.11b",0.13189484127,0.158441558442
62F155D7,"Periodic phase adjustment distributed clock synchronization in the hard realtime environment",0.347321428571,0.293253968254
7AE202BE,"“Clock rate synchronizable” reference frames in curved space–times",0.13814484127,0.155952380952
7A316A5E,"Next generation wireless systems using Markov decision process model",0.273511904762,0.309415584416
7A750D13,"Conventionalism in special relativity",0.0925888347763,0.0940170940171
8089887A,"A Simple and Robust Clock Synchronization Scheme",0.343353174603,0.419191919192
7928BDD4,"Improving IEEE 1588v2 time synchronization performance with phase locked loop",0.462103174603,0.412074829932
7FE25D7D,"Asynchronous-QDI 2D IIR digital filter circuits",0.117471988796,0.291666666667
083C5648,"Calculation of the FlexRay Clock Precision",0.122371031746,0.140211640212
7ACA1150,"The relativity principle and the nature of time",0.228273809524,0.329945054945
756F8235,"Ultrafast, single-shot phase and amplitude measurement via a temporal imaging approach",0.223305860806,0.347916666667
60FAF6AA,"Satellite-aided navigation - Availability and application of the Global Positioning System",0.146329365079,0.159126984127
8145DC43,"Fully distributed clock skew and offset estimation in wireless sensor networks",0.452876984127,0.519217687075
7B979413,"Clock period optimization technique using multiple clocking domains",0.130014430014,0.152154195011
7F8B87BB,"A low complexity impulse radio based UWB transceiver model for automated arrhythmia analysis",0.247767857143,0.274041434756
7F506251,"A Time Synchronization Protocol in WSN Applied in RAMR",0.44255952381,0.619047619048
5E83DCF9,"Lower Bounds for Function Based Clock Synchronization",0.343353174603,0.36
5B0E344F,"Time Synchronization in Wireless Sensor Networks",0.780357142857,1.0
7930FA39,"Mitigation of Asymmetric Link Delays in IEEE 1588 Clock Synchronization Systems",0.3630501443,0.301388888889
77AF52EB,"An integrated architecture for dependable embedded systems",0.114965763403,0.196428571429
616DC3BD,"Lorentz transformations: Einstein's derivation simplified",0.115972222222,0.160227272727
5D35FBBB,"Clock synchronization in real-time distributed systems based on FIP field bus",0.362103174603,0.334595959596
7929CB48,"An Asynchronous Wakeup Power-Saving Protocol for Multi-Hop Ad Hoc Networks",0.225198412698,0.436507936508
7A0EB73A,"Relativistic effects on time scales and signal transmission",0.223801892552,0.348214285714
01E8EC71,"The Time-Triggered Communication Protocol TTP�/C",0.121371336996,0.154761904762
79C654EF,"Joint Estimation of Clock Skew and Offset in Pairwise Broadcast Synchronization Mechanism",0.450496031746,0.422420634921
7B71C008,"Rhodopsin 5– and Rhodopsin 6–Mediated Clock Synchronization in Drosophila melanogaster Is Independent of Retinal Phospholipase C-β Signaling",0.343353174603,0.306349206349
5ABAEC7A,"Design of large-scale Photonic Page Buffer ICs",0.116117909868,0.143055555556
5A246014,"Formal Verification of a Fault Tolerant Clock Synchronization Algorithm",0.352529761905,0.306904761905
7A53F2B1,"Reliable Asynchronous Links for SoC",0.0818643162393,0.125
7B7A8A54,"HAWKING RADIATION VIA TUNNELING FROM KERR BLACK HOLES",0.0916666666667,0.131547619048
5B8BEFC4,"Improving Clock Synchronization for MPEG-2 Services over ATMM Networks",0.455704365079,0.508333333333
78815536,"Performance Evaluation of Elastic GALS Interfaces and Network Fabric",0.254910714286,0.276659451659
0A4EBC2B,"NBS develops new clock synchronization technique.",0.416313932981,0.503333333333
77C611EA,"Reactively secure signature schemes",0.100525342713,0.116883116883
7B8B4EF5,"Nonequivalence of ether theories and special relativity",0.0925888347763,0.0929810929811
59EC5EDA,"Approaching hybrid wind-diesel systems and controller area network",0.25496031746,0.330404040404
0A281EB7,"A New Form of Clock Synchronizer",0.220153920154,0.377380952381
5E300E50,"DESIGN GUIDELINES FOR DEPLOYING CLOSED LOOP SYSTEMS",0.156746031746,0.201904761905
791FD316,"A test theory of special relativity: II. First order tests",0.0952001633987,0.0911130536131
7693C8C7,"Integration aspects of wireless industrial automation",0.116907051282,0.116666666667
76D96DBC,"An optimal control approach to clock synchronization",0.443948412698,0.5625
600E1775,"A relativistic analysis of clock synchronization",0.348561507937,0.430555555556
618245FD,"Measured tunneling photon wavepacket dynamic vector velocity equivalence to the cosmic microwave background Doppler shift",0.126633782884,0.136396103896
621BB400,"Some popular problems of substation automation in China",0.111165223665,0.107722832723
77FBCED5,"Energy Conservation in Large-Scale Sensor Networks through Wakeup Mechanism and Clustering Aggregation",0.359577922078,0.392918985776
6323D8D5,"Clock synchronization system for on-board regenerative satellite communication",0.376488095238,0.356666666667
7EC939D7,"Experimental Evaluation of the Jitter Generated in Timing Transfer",0.108754960317,0.156349206349
7A6039B8,"A 500 MHz, 32 bit, 0.4 μm CMOS RISC processor",0.112980769231,0.129166666667
5C3180B6,"Time and frequency reference for a trajectory measurement system",0.27306547619,0.345238095238
732940CF,"A priority forwarding router chip for real-time interconnection networks",0.223856005106,0.304444444444
7FD9C3EA,"A Novel Vehicle Detection Method Based on Wireless Magneto-resistive Sensor",0.222718253968,0.348888888889
763F7FC1,"Technique for frequency transfer over packet networks",0.230257936508,0.315555555556
7F7D3443,"A voltage-scalable biomedical signal processor running ECG using 13pJ/cycle at 1MHz and 0.4V",0.141717657343,0.215
8103F08B,"Evaluation of a new algorithm for fault-tolerant clock synchronization",0.424470899471,0.486904761905
7978E99C,"Comment on "Quantum Clock Synchronization Based on Shared Prior Entanglement"",0.359871031746,0.343253968254
7B1C5264,"Implementing wait-free objects on priority-based systems",0.147817460317,0.222222222222
607A9DCE,"On methods for clock synchronization.",0.343353174603,0.425925925926
76DFD911,"A VHF-level fully integrated multi-phase switching converter using bond-wire inductors, on-chip decoupling capacitors and DLL phase synchronization",0.374751984127,0.345238095238
746FA68B,"Switched real-time ethernet with earliest deadline first scheduling protocols and traffic handling",0.134474206349,0.160260770975
797A48C6,"ポスター講演 圧縮センシングを用いた差分遅延トモグラフィにおける基準経路選択に関する研究 (ネットワークシステム) -- (特集セッション 無線分散ネットワーク)",0,0
7E20FA52,"A test of precision GPS clock synchronization",0.346478174603,0.304273504274
7AC115E6,"Functional Evolution of the Photolyase/Cryptochrome Protein Family: Importance of the C Terminus of Mammalian CRY1 for Circadian Core Oscillator Performance",0.136954365079,0.139914450629
821414DF,"Maximum-Likelihood Estimator of Clock Offset between Nanomachines in Bionanosensor Networks",0.23621031746,0.352380952381
77FAFDB2,"Quantum key distribution with 1.25 Gbps clock synchronization",0.343353174603,0.342171717172
63289DA3,"Temporal distribution and clock synchronization",0.343353174603,0.425925925926
763B165D,"Software-based photon counting telemetry receiver for an infrared communications satellite",0.126339285714,0.154437229437
754A0ABF,"Broken Lorentz invariance and conventionality of clock synchronization",0.343353174603,0.294696969697
0240A8BC,"Mechanical verification of a schematic byzantine fault-tolerant clock synchronization algorithm",0.348561507937,0.296515151515
7BDADF1B,"A Power management for probabilistic clock Synchronization in Wireless Sensor Networks",0.674603174603,0.636054421769
06264A45,"Optimal Clock Synchronization under Different Delay Assumptions (Preliminary Version)",0.343353174603,0.308333333333
61C73D87,"Timing and time signal distribution in digital communications networks",0.335416666667,0.464444444444
7F296F93,"A test structure for the measurement of fast internal signals in CMOS VLSI circuits",0.181547619048,0.188717948718
59E7BEE2,"The Asynchronous Bounded-Cycle Model",0.0805036976912,0.0909090909091
17A9DB08,"Verifying Compiler Based Refinement of BluespecTM",0.105594405594,0.199810606061
807240DE,"A referenceless all-digital fast frequency acquisition full-rate CDR circuit for USB 2.0 in 65nm CMOS technology",0.153273809524,0.171130952381
7902B7D7,"Quantum methods for clock synchronization: Beating the standard quantum limit without entanglement",0.35689484127,0.258838383838
7518B18F,"0.56 V, –20 dBm RF-Powered, Multi-Node Wireless Body Area Network System-on-a-Chip With Harvesting-Efficiency Tracking Loop",0.352876984127,0.400566893424
78CCC3EE,"Clock synchronization by accelerated observers: metric construction for arbitrary congruences of world lines",0.358134920635,0.26485260771
7EF66AF1,"Optimal Anycast Technique for Delay-Sensitive Energy-Constrained Asynchronous Sensor Networks",0.345734126984,0.7
75FF2BE8,"Constant darkness is a circadian metabolic signal in mammals",0.141717657343,0.199810606061
7CD6BE39,"The application analysis of IEEE1588 in smart substation",0.115228174603,0.136904761905
7A21C0C7,"Study on distributed internal synchronization in a LAN network",0.452380952381,0.490793650794
7EBFDCF4,"Measurement of characteristics of voice over IP in a wireless LAN environment",0.244047619048,0.246779014636
036D10FB,"Theory of Clock Synchronization and Mutual Exclusion in Networked Control Systems",0.362103174603,0.292929292929
811F7E16,"A Composable Algorithm for Clock Synchronization in Multi-Cluster Real-Time Systems",0.367311507937,0.385416666667
5909B319,"Ultra-fast clock recovery for burst-mode optical packet communication",0.150595238095,0.169047619048
7C2C112B,"Fairness in dead-reckoning based distributed multi-player games",0.110987103175,0.2
5973774F,"Stability analysis of distributed clock synchronization in the time-triggered architecture",0.349950396825,0.306904761905
7FB43D8E,"Clock synchronization for wavelet-based multirate transmissions",0.348561507937,0.430555555556
33C49936,"Design and Implementation of PTP Gateway to Extend IEEE 1588 to Zigbee networks",0.253571428571,0.34
7D228346,"Effectiveness of on-die decoupling capacitance in improving chip performance",0.113836163836,0.144642857143
7D653EF9,"A tight clock synchronization technique for multiprocessor systems",0.362103174603,0.336666666667
7D68E60D,"Current differential relaying coping with communications channel asymmetry",0.109962606838,0.15
8120569A,"Clock synchronization in virtual rings",0.344742063492,0.436507936508
77BFDB4E,"Resilient distributed parameter estimation in heterogeneous time-varying networks",0.222222222222,0.441666666667
7CA80F1C,"The Distributed Deadline Synchronization Protocol for real-time systems scheduled by EDF",0.362103174603,0.347142857143
0943BA2C,"Conjunto de Experi�ncias de Baixo Custo para o Ensino de Sincroniza��o de Rel�gios",0.0844362745098,0.1
755B2CB9,"An Accuracy Enhanced IEEE 1588 Synchronization Protocol for Dynamically Changing and Asymmetric Wireless Links",0.452876984127,0.412414965986
7BA086C3,"Architecture for a large-scale ion-trap quantum computer",0.112621753247,0.161255411255
7DC91F93,"Research on Distributed Time Synchronization in Expressway Toll System",0.478422619048,0.431818181818
7E71F9F5,"All-Optical Phase Control of a Square-Wave Photonic Clock",0.117948717949,0.138888888889
73B3A0F3,"A scheme for reliable real‐time messaging with bounded delays",0.102564102564,0.152191558442
588F8C70,"TDOA 기반의 실시간 위치 측정 시스템을 위한 고정밀 무선 시각 동기 시스템",0,0
7D58ED2C,"A Design for Clock Synchronization Using CPPLL",0.364186507937,0.4375
02C728FF,"A scheme for implementing quantum clock synchronization algorithm in cavity QED",0.348561507937,0.236268939394
7E952EF8,"Postnatal ontogenesis of clock genes in mouse suprachiasmatic nucleus and heart",0.110917207792,0.108074795575
7FECF5C9,"Token-based medium access control solution for underwater acoustic broadcast",0.265376984127,0.320238095238
733DDD12,"A conceptual design for a Reliable Optical Bus (ROBUS)",0.127051767677,0.208333333333
59D231B1,"Nonlinear quantum metrology",0.0805036976912,0.0909090909091
76FE182A,"A distributed clock synchronization method based on 2-hop neighbors' time information for ad hoc networks",0.570833333333,0.454320987654
60B4D34F,"An analysis of radio interferometry with the block O system",0.249255952381,0.343571428571
