5BCB8C30,"Machine Discovery Based on the Co-occurrence of References in a Search Engine",0.40625,0.28798185941
5900F800,"Beyond a Visuocentric Way of a Visual Web Search Clustering Engine: The Sonification of WhatsOnWeb",0.410714285714,0.30119047619
7E0775CE,"A task level metric for measuring web search satisfaction and its application on improving relevance estimation",0.452380952381,0.28544973545
758F2455,"On extracting session data from activity logs",0.473214285714,0.388181818182
80417D3D,"Efficient browsing of Web search results on mobile devices based on block importance model",0.402777777778,0.243560606061
7F995092,"Search engines and the production of academic knowledge",0.416666666667,0.372023809524
5D1A2FAD,"Keyword Search in Social Networks",0.425,0.6
5DB93340,"A frequency mining-based algorithm for re-ranking web search engine retrievals",0.335227272727,0.295952380952
7FCF36E0,"Personalization in professional academic search",0.402777777778,1.0
7F3F0AE2,"The effectiveness of web search engines for retrieving relevant ecommerce links",0.40625,0.30467032967
7D139314,"Domain-specific search strategies for the effective retrieval of healthcare and shopping information",0.410714285714,0.273683261183
794AD0FB,"Impact of internet search engines on OPAC users: a study of Punjabi University, Patiala (India)",0.345643939394,0.209435626102
7D78F771,"Speechbot: an experimental speech-based search engine for multimedia content on the web",0.458333333333,0.339285714286
60C45CB4,"A Hybrid Information Retrieval System for Medical Field Using MeSH Ontology",0.355158730159,0.251924001924
80A6EF50,"A Novel Method for Hierarchical Clustering of Search Results",0.4375,0.368055555556
7EE9BC01,"Optimizing the catalog search process for e-procurement platforms",0.569444444444,0.496666666667
8018EE89,"Geo-referencing with semi-automatic gazetteer expansion using lexico-syntactical patterns and co-reference analysis",0.372916666667,0.306666666667
5B75D879,"Facilitating Efficient Integrated Semantic Web Search with Visualization and Data Mining Techniques",0.625,0.348958333333
81596E14,"Modeling user search behavior",0.347222222222,0.5
7CFF9C2B,"Charge State Determination of Peptide Tandem Mass Spectra Using Support Vector Machine (SVM)",0.416666666667,0.254761904762
8005D559,"Comparison of two approaches to building a vertical search tool: a case study in the nanotechnology domain",0.40625,0.244668911336
5F02A7B2,"Methods for Preventing Search Engine-Based Web Server Attacks",0.40625,0.31712962963
5CE9A754,"Effectiveness Evaluation and Comparison of Web Search Engines and Meta-search Engines",0.326388888889,0.301904761905
7663A97B,"Factors required for mobile search going mainstream",0.402777777778,0.375555555556
7E4E8326,"Good abandonment in mobile and PC internet search",0.402777777778,0.42380952381
81697008,"Detecting search engine spam from a trackback network in blogspace",0.38125,0.30967032967
7D8A9941,"Automatic extraction of dynamic record sections from search engine result pages",0.40625,0.232426303855
5878C214,"WebDocBall: A Graphical Visualization Tool for Web Search Results",0.402777777778,0.323611111111
7784EEC3,"Supporting intelligent Web search",0.40625,0.486111111111
7B82D34B,"Efficient multi-keyword search over p2p web",0.40625,0.5625
76F65C74,"Online result cache invalidation for real-time web search",0.40625,0.284829059829
7EE6C1AC,"Using Semantic Graphs for Image Search",0.577380952381,0.563492063492
7EF4670B,"A probabilistic model based approach for blended search",0.402777777778,0.358181818182
7E42CAE3,"Finding Related Search Engine Queries by Web Community Based Query Enrichment",0.416666666667,0.271164021164
5A633CB0,"Correlation Search of Web Services",0.355158730159,0.366964285714
7CA27FBE,"The impact of images on user clicks in product search",0.331755050505,0.266474266474
801566D7,"A General Classification of (Search) Queries and Terms",0.40625,0.379464285714
808472EA,"Autotagging to improve text search for 3d models",0.423611111111,0.383838383838
7F2CC9FA,"A fuzzy ontology-based abstract search engine and its user studies",0.402777777778,0.337301587302
774ED892,"On the effectiveness of anonymizing networks for web search privacy",0.360714285714,0.353977272727
62BDA97E,"Use link-based clustering to improve Web search results",0.458333333333,0.363888888889
5F917189,"A 3D geometry search engine in support of learning",0.402777777778,0.363003663004
7F9C52AF,"Exploiting Semantic Query Context to Improve Search Ranking",0.486111111111,0.366402116402
5DB6F87A,"Reliability of a Distributed Search Engine for Fresh Information Retrieval in Large-Scale Intranet",0.410714285714,0.240022675737
5CEE4738,"Using probabilistic latent semantic analysis for personalized web search",0.572916666667,0.58125
7AB4A687,"Symbolic Dynamics Methods and Simulation of Internet Search",0.402777777778,0.290793650794
7C5B75EE,"When experts agree: using non-affiliated experts to rank popular topics",0.355158730159,0.324735449735
815C8689,"Popularity and findability through log analysis of search terms and queries: the case of a multilingual public service website",0.410714285714,0.243302068302
7E479EDA,"Adverse Selection in Online Search",0.402777777778,0.6
765FB72C,"Falconer: once SIOC meets semantic search engine",0.402777777778,0.31994047619
776130A1,"A Case Study of Collaboration and Reputation in Social Web Search",0.40625,0.2875
8048211B,"Using visual spatial search interface for WWW applications",0.569444444444,0.47967032967
7D8EE886,"Design and Implementation of a Crawling System in Shopping Search Engine",0.359027777778,0.261456400742
5868757B,"Spatio-textual indexing for geographical search on the web",0.40625,0.441666666667
056897EE,"Querying the Semantic Web with Corese Search Engine",0.40625,0.330357142857
5F98208B,"MINERVA: collaborative P2P search",0.402777777778,0.541666666667
8139AE02,"Quality Uncertainty and the Performance of Online Sponsored Search Markets: An Empirical Investigation",0.416666666667,0.290816326531
80EC94A8,"Semantic Similarity Search on Semistructured Data with the XXL Search Engine",0.625,0.639285714286
5F725BF5,"Using homology relations within a database markedly boosts protein sequence similarity search",0.577380952381,0.355853174603
616D3E38,"Web spam detection using SVM classifier",0.347916666667,0.278566433566
7BC471DD,"Performance of compressed inverted list caching in search engines",0.402777777778,0.295899470899
7D710FEE,"A Framework Enabling Semantic Search in Health Service Ecosystems",0.433333333333,0.312373737374
80BC3364,"Improving Information Retrieval Precision by Finding Related Queries with Similar Information Need Using Information Scent",0.404761904762,0.240079365079
7C4C3BFD,"Database search strategies for proteomic data sets generated by electron capture dissociation mass spectrometry.",0.598214285714,0.340995670996
81600D98,"Effective Keyword Search for Software Resources Installed in Large-Scale Grid Infrastructures",0.40625,0.274537037037
5D761830,"Design and implementation of semantic web search system using ontology and anchor text",0.572916666667,0.316406124739
7F32BC9A,"Software component recommendation using collaborative filtering",0.342171717172,0.325505050505
7F7C734D,"Do you want to take notes?: identifying research missions in Yahoo! search pad",0.410714285714,0.283381433381
77BC5777,"Optimizing search engine revenue in sponsored search",0.569444444444,0.636507936508
7D2F0B41,"A General Boosting Method and its Application to Learning Ranking Functions for Web Search",0.410714285714,0.32705026455
7E167CE3,"Rethinking the Presentation of Results from Web Search",0.347222222222,0.381944444444
586E949A,"An Article Language Model for BBS Search",0.361111111111,0.339393939394
7AC07F5B,"Altered Mascot search results by changing the m/z range of MS/MS spectra: analysis and potential applications",0.4375,0.288496071829
6F813673,"Squiggle: an experience in model-driven development of real-world semantic search engines",0.402777777778,0.28373015873
81432808,"Brand positioning strategy using search engine marketing",0.569444444444,0.373757988044
7E3EF870,"The History of the Internet Search Engine : Navigational Media and the Traffic Commodity",0.458333333333,0.256014223871
7FAB70C8,"‘Sciencenet’—towards a global search and share engine for all scientific knowledge",0.416666666667,0.340773809524
76CFD5F8,"Web service clustering using multidimensional angles as proximity measures",0.381944444444,0.2882996633
59FC1C2B,"Prediction of keyword auction using Bayesian network",0.383333333333,0.364393939394
6E794A10,"Improving Prepositional Phrase Attachment Disambiguation Using the Web as Corpus",0.389583333333,0.266053391053
76021E62,"A fuzzy ranking approach for improving search results in Turkish as an agglutinative language",0.458333333333,0.314814814815
75539DA5,"Search characteristics in different types of Web-based IR environments: Are they the same?",0.40625,0.326515151515
7CE8E856,"Data fusion with estimated weights",0.355158730159,0.358630952381
7FB497E8,"A cognitive evaluation of four online search engines for answering definitional questions posed by physicians.",0.402777777778,0.277315541601
7DE91DD2,"Multimodal Fusion for Video Search Reranking",0.326388888889,0.571428571429
5F4866B3,"The evolution of web content and search engines",0.402777777778,0.330952380952
805112E8,"Evaluating the Effectiveness of Personalized Web Search",0.40625,0.3625
7E6A3532,"No clicks, no problem: using cursor movements to understand and improve search",0.611111111111,0.395528083028
805BCE5D,"Optimizing Visual Search Reranking via Pairwise Learning",0.611111111111,0.703703703704
8147B5DD,"Efficient Aggregation of Ranked Inputs",0.28125,0.297619047619
7CE7B764,"Evaluation of web search for the information practitioner",0.346428571429,0.358441558442
7DC95861,"Reliable distributed search engine based on multiple meta servers",0.402777777778,0.337619047619
7C285C1B,"MuSE: multimedia search engine",0.326388888889,0.330357142857
5CDABD24,"Discovering user preferences by using time entries in click-through data to improve search engine results",0.833333333333,0.380086580087
702AB26D,"The Democratizing Effects of Search Engine Use: On Chance Exposures and Organizational Hubs",0.402777777778,0.262400793651
7675B5F7,"The Social, Political, Economic, and Cultural Dimensions of Search Engines: An Introduction",0.40625,0.330357142857
069F8F34,"MATH GO! PROTOTYPE OF A CONTENT BASED MATHEMATICAL FORMULA SEARCH ENGINE",0.458333333333,0.296681096681
7F7CE87D,"Visualizing Web search results in 3D",0.347222222222,0.425925925926
5CF3F87B,"MultiCrawler: a pipelined architecture for crawling and indexing semantic web data",0.402777777778,0.313888888889
80C75621,"Specialisation dynamics in federated web search",0.40625,0.324107142857
7D59AD16,"Content-based video indexing for the support of digital library search",0.410714285714,0.396825396825
5BAE4440,"BDEI: Biodiversity Information Organization using Taxonomy (BIOT)",0.369444444444,0.310238095238
58D2C4BF,"Clustering of search engine keywords using access logs",0.604166666667,0.415945165945
59810052,"Conceptual Models for Search Engines",0.402777777778,0.387445887446
48C816E2,"Personalized Web Search by Using Learned User Profiles in Re-ranking",0.58125,0.541666666667
805B8899,"Interest and Evaluation of Aggregated Search",0.338492063492,0.358441558442
7979187A,"Web-based geographic search engine for location-aware search in Singapore",0.402777777778,0.534523809524
7FF88D7C,"Automatic Maintenance ofWeb Directories using Click-Through Data",0.569444444444,0.543402777778
75618215,"Click-tracking blocker: Privacy preservation by disabling search engines' click-tracking",0.390277777778,0.290945165945
58915C92,"Personalized ranking of search results with learned user interest hierarchies from bookmarks",0.419047619048,0.256699649557
77E40F18,"Immediate search in the IDE as an example of socio-technical congruence in search-driven development",0.40625,0.3375
5D8F97FA,"Towards automatic incorporation of search engines into a large-scale metasearch engine",0.402777777778,0.313492063492
7E1DF3A0,"Discussion on Web Crawlers of Search Engine",0.326388888889,0.340584415584
80B3349F,"ONLINE CONTINUING DENTAL EDUCATION",0.236111111111,0.291666666667
8125E079,"Impact of search engines on page popularity",0.346428571429,0.288095238095
79D7153F,"Information used and perceived usefulness in evaluating web source code search results",0.577380952381,0.37876984127
7DDC1D26,"A social network-based meta search engine",0.402777777778,0.535714285714
6CC6C70F,"Cloudle: an ontology-enhanced cloud service search engine",0.326388888889,0.353084415584
771A0D48,"Guidelines for Search Features Development – A Comparison between General Users and Users with Low Reading Skills",0.40625,0.215656565657
811DA9EA,"A search filter for increasing the retrieval of animal studies in Embase.",0.402777777778,0.306666666667
7E1B910F,"An Evaluation of Major Image Search Engines on Various Query Topics",0.410714285714,0.278042328042
77F0D5D8,"Query classification and study of university students' search trends",0.345643939394,0.272789115646
588892E6,"Search Computing: Integrating Ranked Data in the Life Sciences",0.598214285714,0.39512987013
068DD4DA,"Learning to compete in heterogeneous web search environments",0.40625,0.383333333333
7754706A,"Information retrieval in the Web: beyond current search engines",0.410714285714,0.284523809524
00EAFDB6,"USING CONCEPT HIERARCHIES TO ENHANCE USER QUERIES IN WEB-BASED INFORMATION RETRIEVAL",0.363095238095,0.252267573696
80BD397C,"The LAILAPS Search Engine: A Feature Model for Relevance Ranking in Life Science Databases",0.346428571429,0.206357223024
5ED17B89,"Integrating Lightweight Reasoning into Class-Based Query Refinement for Object Search",0.40625,0.336904761905
7C5003DC,"Models of malicious behavior in sponsored search",0.402777777778,0.474747474747
7EB3523B,"LeeDeo: Web-Crawled Academic Video Search Engine",0.410714285714,0.404761904762
7C8E95F6,"Web Search---Your Way",0.346428571429,0.571428571429
7B0C44D1,"Are Web-based informational queries changing?",0.204274891775,0.269841269841
7E9A5755,"Avatar semantic search: a database approach to information retrieval",0.410714285714,0.303571428571
776AB6FB,"Improved search engines and navigation preference in personal information management",0.452380952381,0.289342403628
7ED2E9D8,"Using WordNet and lexical operators to improve Internet searches",0.614583333333,0.436778499278
80086BFB,"Ranking function optimization for effective Web search by genetic programming: an empirical study",0.410714285714,0.287074829932
7CEBA2B9,"Language identification of search engine queries",0.361111111111,0.309523809524
63929C32,"Search Engine Bias and the Demise of Search Engine Utopianism",0.335227272727,0.352551020408
75EEB0F7,"Can all tags be used for search?",0.569444444444,0.777777777778
5F649E02,"Recognition of Common Areas in a Web Page Using a Visualization Approach",0.361111111111,0.260185185185
79420162,"Towards Improving Meta-Search through Exploiting an Integrated Search Model",0.486111111111,0.418181818182
59C9D00F,"A Search Engine Index for Multimedia Content",0.394047619048,0.336507936508
7FD26405,"A subjective measure of web search quality",0.416666666667,0.350694444444
80204C07,"Coverage, relevance, and ranking: The impact of query operators on Web search engine results",0.346428571429,0.217592592593
78FDFEA8,"Using sampled data and regression to merge search engine results",0.791666666667,0.462400793651
7E167E84,"Temporal Ranking of Search Engine Results",0.402777777778,0.323412698413
7D7F68A1,"Result enrichment in commerce search using browse trails",0.604166666667,0.391955266955
0653F48F,"Automatically Detecting Boolean Operations Supported by Search Engines, Towards Search Engine Query Language Discovery",0.416666666667,0.273571428571
71E71838,"Assessing the Effectiveness and Usability of Personalized Internet Search through a Longitudinal Evaluation",0.40625,0.286904761905
5C6762DB,"What’s Changed? Measuring Document Change in Web Crawling for Search Engines",0.427083333333,0.274553571429
7AC24CB5,"Efficient Search Engine Measurements",0.402777777778,0.468253968254
7921A21B,"Sentences, Hierarchical Clustering for Shopping Search",0.4375,0.39375
79DC76D6,"A new visual search interface for web browsing",0.40625,0.323208041958
7E4855CF,"A Novel Approach for Re-Ranking of Search Results Using Collaborative Filtering",0.569444444444,0.569444444444
7CDDD8B0,"Can search engines be used as tools for web‐link analysis? A critical view",0.369444444444,0.304648526077
78FCEBE6,"Entity Search Strategies for Mashup Applications",0.425,0.385227272727
0B8E846D,"A Study of Metaindex Mechanisms for Selecting and Ranking Remote Search Engines",0.402777777778,0.306349206349
5BC1134E,"A topic-specific web search system focusing on quality pages",0.389880952381,0.285984848485
7EF838AE,"Summarizing local context to personalize global web search",0.414583333333,0.319444444444
7921B87F,"Tools-at-hand and learning in multi-session, collaborative search",0.402777777778,0.555555555556
7BF5A526,"ExSearch: a novel vertical search engine for online barter business",0.410714285714,0.334821428571
80F1364B,"Integrated Search Engine",0.355158730159,0.412698412698
7A151C1B,"Using Cross-Document Random Walks for Topic-Focused Multi-Document",0.34375,0.5625
7FCCF531,"Ranking Web Search Results from Personalized Perspective",0.402777777778,0.368055555556
7DA2DCEC,"A Metadata Search Approach to Keyword Search in Relational Databases",0.5,0.558333333333
58E8E6A8,"Query-log based Authority Analysis for Web Information Search",0.410714285714,0.35746031746
7DDEB9D8,"Keyword generation for search engine advertising using semantic similarity between terms",0.591666666667,0.37806122449
7DD38F85,"Navigating information spaces: A case study of related article search in PubMed",0.416666666667,0.277551020408
80EA415D,"Visualizing Query Occurrence in Mobile Web Search Interfaces",0.410714285714,0.285241147741
7EEB32B0,"Enhancing web search by promoting multiple search engine use",0.402777777778,0.46626984127
591C0303,"Precision Evaluation of Search Engines",0.326388888889,0.345634920635
7D091179,"Economic Trends in Enterprise Search Solutions",0.402777777778,0.398148148148
7B52ACA5,"Clustering e-commerce search engines based on their search interface pages using WISE-cluster",0.569444444444,0.466460622711
5F41471C,"Web Dragons: Inside the Myths of Search Engine Technology",0.326388888889,0.287852147852
7B60E99F,"BioTCM-SE: a semantic search engine for the information retrieval of modern biology and traditional Chinese medicine.",0.410714285714,0.240995115995
7F5F5078,"Optimizing data aggregation for cluster-based internet services",0.591666666667,0.554285714286
057A2F70,"Mining web query hierarchies from clickthrough data",0.355158730159,0.302142857143
775DD98C,"Context sensitive stemming for web search",0.40625,0.5625
5FB10204,"Discovering the Context of WWW Pages to Improve the Effectiveness of Local Search Engines",0.447916666667,0.249454365079
621B97BF,"An Efficient Person Name Bipolarization Using KPCA",0.347916666667,0.416666666667
615A8F18,"Search Engines and Expertise about Global Issues: Well-defined Landscape or Undomesticated Wilderness?",0.40625,0.24880952381
7D02A0E6,"Modified rough set based aggregation for effective evaluation of web search systems",0.5,0.386796536797
7FCA2C84,"Clustering search engine query log containing noisy clickthroughs",0.402777777778,0.286976911977
76D31FFB,"Using navigation data to improve IR functions in the context of web search",0.833333333333,0.485912698413
7DEBE8C3,"Query based site selection for distributed search engines",0.402777777778,0.290136054422
7EA08682,"From e-sex to e-commerce: Web search changes",0.335227272727,0.436507936508
7DCE0621,"Design of a Parallel and Distributed Web Search Engine",0.40625,0.349107142857
80878F83,"Metadata domain-knowledge driven search engine in "HyperManyMedia" E-learning resources",0.435714285714,0.367857142857
77FCA0EB,"Semantically driven snippet selection for supporting focused web searches",0.40625,0.360238095238
7AA42520,"Automatic query wefinement using lexical affinities with maximal information gain",0.363095238095,0.301098901099
7FA2C1F5,"Support Vector Data Description for image categorization from Internet images",0.394047619048,0.25441468254
7C1275C5,"An FPGA-based accelerator for LambdaRank in Web search engines",0.326388888889,0.379365079365
7DEB3FE5,"The Role of Search Engine Optimization in Search Marketing",0.326388888889,0.423214285714
79DF5358,"Improving intranet search-engines using context information from databases",0.396825396825,0.400297619048
7EB535A0,"Web Information Retrieval Support Systems: The Future of Web Search",0.346428571429,0.298881673882
7E629074,"A Service Search Engine for the Industrial Digital Ecosystems",0.425,0.380357142857
7E19CE8B,"Promotional ranking of search engine results: giving new web pages a chance to prove their values",0.40625,0.230112942613
0AB7AF6B,"A Component-Based Digital Library Service for Finding Missing Documents",0.21875,0.260416666667
7C060F55,"Using Search Engine Count Estimates as Indicators of Academic Impact: A Web-based Replication of Haggbloom et al.’s (2002) Study",0.572916666667,0.318562610229
7E29994A,"Improve Search by Optimization or Personalization, A Case Study in Sogou Log",0.427083333333,0.313762626263
7FFEC47E,"Applying Web usage mining for personalizing hyperlinks in Web-based adaptive educational systems",0.411111111111,0.309595959596
7FDE2317,"Tagging and searching: Search retrieval effectiveness of folksonomies on the World Wide Web",0.40625,0.280952380952
7CEB2F21,"Web search with personalization and knowledge",0.361111111111,0.583333333333
79D3E555,"Search result visualization with characters for children",0.338492063492,0.280404040404
78163739,"Children's web search with Google: the effectiveness of natural language queries",0.416666666667,0.248063840921
815717FE,"Portfolio: a search engine for finding functions and their usages",0.410714285714,0.326312576313
7E401E8E,"Web page scoring systems for horizontal and vertical search",0.402777777778,0.356060606061
7CACECF3,"Heuristic and Systematic Use of Search Engines",0.402777777778,0.468253968254
7C1708DA,"Using local precision to compare search engines in consumer health information retrieval",0.355158730159,0.230257936508
7CD31788,"Facilitating discovery on the private web using dataset digests",0.385416666667,0.328333333333
76DB1B25,"Novel Search Engine: Combination of Link and Popularity Rank for Multimedia Retrieval",0.458333333333,0.25818452381
803C6A68,"Using Monte-Carlo simulation for automatic new topic identification of search engine transaction logs",0.577380952381,0.358982683983
805F59C8,"On improving wikipedia search using article quality",0.625,0.52
799307DF,"Quantifying performance and quality gains in distributed web search engines",0.416666666667,0.259353741497
797299D5,"Application of automatic topic identification on excite web search engine data logs",0.625,0.388837353123
75D7ECB8,"XDSearch: an efficient search engine for XML document schemata",0.40625,0.326884920635
7D8DC9F2,"Removing web spam links from search engine results",0.40625,0.286299348799
80C65F27,"Ontology and search engine for cloud computing system",0.326388888889,0.242544492544
59C4BA8D,"Using concept lattices for text retrieval and mining",0.347222222222,0.252777777778
7D9263F1,"Distributed RankBoost Acceleration Using FPGA and MPI for Web Relevance Ranking",0.363095238095,0.319365079365
7E5C550C,"A Framework for Media Adaptation Using the Web and the Semantic Web",0.347916666667,0.25946969697
7DAE41E3,"Keyword proximity search on XML graphs",0.346428571429,0.411255411255
80119701,"Improving Index Compression Using Cluster Information",0.423611111111,0.324735449735
7D4D9792,"Performance of MPEG-7 low level audio descriptors with compressed data",0.410714285714,0.289947089947
07C6423A,"Implementation of a modern web search engine cluster",0.4375,0.317857142857
7FF8D0BD,"Filtering Internet image search results towards keyword based category recognition",0.458333333333,0.309523809524
79A04630,"Semantic similarity between search engine queries using temporal correlation",0.577380952381,0.41369047619
0AF946C8,"Ontology-Based Intelligent Mobile Search Oriented to Global e-Commerce",0.402777777778,0.447619047619
8167716E,"Topical clustering of search results",0.4375,0.453703703704
7E732753,"Query Expansion Using Topic and Location",0.363095238095,0.307142857143
7C6F921F,"Toward a qualitative search engine",0.402777777778,0.535714285714
75A63A77,"XRANK: ranked keyword search over XML documents",0.379464285714,0.458333333333
7D278690,"PARADISE Based Search Engine at TREC 2009 Web Track",0.40625,0.288293650794
7615613D,"Web dynamics and their ramifications for the development of web search engines",0.350694444444,0.232709750567
7FC85960,"Learning preference relations using Support Vector Regression",0.410714285714,0.300566893424
7F94C381,"Automatic Extraction of Publication Time from News Search Results",0.40625,0.261167073667
7930AED2,"Analysis of characteristics and trends of Web queries submitted to NAVER, a major Korean search engine",0.402777777778,0.250742115028
7C608689,"Travel queries on cities in the United States: Implications for search engine marketing for tourist destinations",0.402777777778,0.192692307692
751C68BC,"FPGA Acceleration of RankBoost in Web Search Engines",0.326388888889,0.404761904762
7AD1706F,"Design and Development of a Cross Search Engine for Multiple Heterogeneous Databases Using UML and Design Patterns",0.572916666667,0.326370851371
802B8D9F,"A Framework for Extracting Information from Semi-Structured Web Data Sources",0.375992063492,0.284794372294
