7B0E7DA6,"The Relationship between Searches Performed in Online Databases and the Number of Full-Text Articles Accessed: Measuring the Interaction between Database and E-Journal Collections",0.5,0.282828282828
7E844B7F,"Mining search topics from a code search engine usage log",0.400297619048,0.38933982684
7E4D6A8D,"Ranking specialization for web search: a divide-and-conquer approach by using topical RankSVM",0.569444444444,0.511904761905
5D762591,"Integrating organizational knowledge into search engine",0.416666666667,0.35119047619
78988399,"On personalizing Web search using social network analysis",0.6,0.53
80349827,"Personalized Concept-Based Clustering of Search Engine Queries",0.425,0.342857142857
7E2B15B6,"Semantic Framework for Free-Form Search of Grid Resources",0.40625,0.405303030303
7DAE2CBB,"A Comparative Investigation on Different P2P Search Systems in Dynamic Environments",0.40625,0.324810606061
58889C44,"Advanced Data Clustering Methods of Mining Web Documents",0.402777777778,0.310185185185
7D65F3AD,"Finding OERs with Social-Semantic search",0.402777777778,0.666666666667
5C8FA9C2,"Classifying and Ranking: The First Step Towards Mining Inside Vertical Search Engines",0.402777777778,0.325396825397
7DA1F7FB,"Ordinary search engine users assessing difficulty, effort, and outcome for simple and complex search tasks",0.402777777778,0.3639329806
7568AEB6,"Searching for the Next U.S. President: Differences in Search Engine Results for the 2008 U.S. Presidential Candidates",0.410714285714,0.260152545867
79815880,"Generating hierarchical summaries for web searches",0.40625,0.375
80C6B1A6,"Enhanced feature selection models using gradient-based and point injection techniques",0.369444444444,0.267803030303
6EEB4EF9,"The adaptability of english based web search algorithms to chinese search engines",0.40625,0.45496031746
7D8E1AF3,"USING EYE TRACKING TO EVALUATE ALTERNATIVE SEARCH RESULTS INTERFACES",0.569444444444,0.388766788767
61629353,"Is Relevance Relevant? User Relevance Ratings May Not Predict the Impact of Internet Search on Decision Outcomes",0.410714285714,0.256132756133
7E68B74F,"Schema-Aware Keyword Search over XML Streams",0.338492063492,0.555555555556
7EED6856,"Improving web spam classification using rank-time features",0.427083333333,0.312694250194
76B8BF80,"HSWS: enhancing efficiency of web search engine via semantic web",0.40625,0.330357142857
832BA5C4,"Exploration of Image Search Results Quality Assessment",0.361111111111,0.264814814815
5C3DD21F,"Interactive Search Results",0.402777777778,0.555555555556
7E811E84,"A Vertical Search Engine for Energy Conservation and Environmental Protection",0.402777777778,0.321356421356
7F3C034B,"MoReCOTS: a specialized search engine for COTS components on the Web",0.40625,0.321834415584
81150584,"Online learning for recency search ranking using real-time user feedback",0.569444444444,0.413780663781
75E52E80,"Surviving a search engine overload",0.402777777778,0.372023809524
766F1406,"Analysing Google rankings through search engine optimization data",0.625,0.388256584685
788F7B6A,"Ontological knowledge engine and health screening data enabled ubiquitous personalized physical fitness (UFIT).",0.425,0.262755102041
7CF57D06,"COBS: Realizing Decentralized Infrastructure for Collaborative Browsing and Search",0.402777777778,0.315210932858
7EFB954A,"Using web helper agent profiles in query generation",0.377380952381,0.282142857143
788D35E1,"A Search Architecture for Grid Software Components",0.326388888889,0.318560606061
7A611369,"Identification of ambiguous queries in web search",0.402777777778,0.436507936508
7E251B3E,"Query Optimization in Relevance Feedback Using Hybrid GA-PSO for Effective Web Information Retrieval",0.358630952381,0.24716553288
5D37C1AC,"A Service-Based Architecture for Multi-domain Search on the Web",0.350694444444,0.402777777778
5D16922F,"Bottom-Up Discovery of Clusters of Maximal Ranges in HTML Trees for Search Engines Results Extraction",0.4375,0.229677729678
806672C2,"A New Suffix Tree Similarity Measure and Labeling for Web Search Results Clustering",0.40625,0.240759637188
81657656,"An improved topic relevance algorithm for vertical search engines",0.410714285714,0.311428571429
7E11BF9E,"Graph Matching using Commute Time Spanning Trees",0.363095238095,0.30119047619
765C7542,"Search engine optimization: From analysis based on an engineering meta-model towards integrative approaches",0.402777777778,0.299489795918
7D4D8748,"Detecting Link Spam Using Temporal Information",0.355158730159,0.308956043956
7FEBCDC1,"Metasearch Engines and Information Retrieval: Computational Complexity of Ranking Multiple Search Results",0.410714285714,0.257369614512
7FB105F4,"Agents for Social Search in Long-Term Digital Preservation",0.40625,0.458333333333
75942FD9,"Agglomerative clustering of a search engine query log",0.4375,0.311038961039
7D1E1FFF,"Keeping up with the changing Web",0.202083333333,0.263888888889
7DDEAD60,"Intelligent Medical Search Engine by Knowledge Machine",0.416666666667,0.330357142857
7F09611E,"Estimating Size of Search Engines in an Uncooperative Environment",0.40625,0.297619047619
764B69F6,"A decentralized search engine for dynamic Web communities",0.425,0.372023809524
7DF3667F,"Optimizing Search Engine Result using an Intelligent Model",0.777777777778,0.545574795575
77EEBBD4,"Optimizing visual search with implicit user feedback in interactive video retrieval",0.619047619048,0.46746031746
7EA75169,"Automatic Extraction of Data from 2-D Plots in Documents",0.402777777778,0.329861111111
7A3D2C80,"AGORA: a search engine for software components",0.326388888889,0.272467532468
7FCD4D62,"To what degree can log data profile a web searcher?",0.347222222222,0.304365079365
80D54550,"Mashing Up Search Services",0.402777777778,0.466666666667
7FB0D3F1,"Architecture and Implementation of Object-Level Vertical Search",0.402777777778,0.40873015873
5A097FAE,"Query Classification and Expansion for Translation Mining Via Search Engines",0.326388888889,0.255612244898
7EC700E7,"Efficient internet search engine service provisioning exploiting a collaborative web result ranking mechanism",0.447916666667,0.264563492063
800DD3C0,"Distributed randomized PageRank computation based on web aggregation",0.3125,0.320833333333
85F1159F,"K-Means Clustering For Segment Web Search Results",0.350694444444,0.302777777778
8057C596,"The UI issues for the search engine",0.335227272727,0.39880952381
7ECC5AB2,"Online Search Scope Reconstruction by Connectivity Inference",0.410714285714,0.288975468975
80C810C1,"The Case for a Portuguese Web Search Engine",0.40625,0.340773809524
7510D861,"Finding information on the World Wide Web: the retrieval effectiveness of search engines",0.410714285714,0.247619047619
7AA5C7FB,"An advanced direct searching technique applied on compressed video content repositories",0.402777777778,0.333405483405
0A2F51AA,"Governing social practice",0.236111111111,0.291666666667
761F6E31,"Statistical analysis and implications of SNS search in under-developed countries",0.40625,0.352083333333
7ECEFCCC,"An efficient approach to Web page classification using non-linear cellular automata",0.379166666667,0.294444444444
7EBCA4EE,"Converting Topics of User Query Sequences for Cooperative Web Search",0.419047619048,0.300595238095
802A591D,"Ranking Metrics and Search Guidance for Learning Object Repository",0.410714285714,0.31567044067
7EA3EFF7,"Focused Crawling Using Context Graphs",0.355158730159,0.410714285714
7E609182,"Applying Collective Intelligence for Search Improvement on Thai Herbal Information",0.577380952381,0.413961038961
790D344B,"Towards a Social Graph Approach for Modeling Risks in Big Data and Internet of Things (IoT)",0.416666666667,0.254818594104
6FD31BEB,"Processing XML Keyword Search by Constructing Effective Structured Queries",0.402777777778,0.398214285714
7B78D2B3,"Feature selection for ranking using boosted trees",0.369444444444,0.302056277056
5FA91F37,"Proximity Scoring Using Sentence-Based Inverted Index for Practical Full-Text Search",0.569444444444,0.490404040404
8076342D,"Tree-Based Microaggregation for the Anonymization of Search Logs",0.326388888889,0.545454545455
7CFD0442,"Evaluating the use of search engine development tools in IT education",0.359027777778,0.306632653061
7F4AD5C4,"Clustering web search results using conceptual grouping",0.625,0.522222222222
5FC50B0B,"Page segment recommendation using N-gram for sensemaking tasks based on note taking",0.381944444444,0.273611111111
79526EA3,"Generating page clippings from web search results using a dynamically terminated genetic algorithm",0.577777777778,0.373169191919
7F2D542B,"Search results presentation and interface design: A comparative evaluation study of five web search engines in Arabic language",0.416666666667,0.306163281163
754674A5,"Private web search",0.40625,0.5625
58945C8E,"Exploiting Browsing History for Exploratory Search",0.447916666667,0.46875
7D543C0F,"BioText Search Engine: beyond abstract search",0.402777777778,0.690476190476
7F747B25,"QA-Pagelet: data preparation techniques for large-scale data analysis of the deep Web",0.458333333333,0.459722222222
7CF84E17,"Adverse selection in online trust certifications and search results",0.40625,0.312222222222
7EAAD77D,"Automatic performance evaluation of web search engines",0.402777777778,0.353571428571
7EE98F0E,"Optimizing web search using web click-through data",1.0,1.0
76D05187,"UNiquant, a program for quantitative proteomics analysis using stable isotope labeling.",0.369444444444,0.297777777778
7FCAEC42,"Building taxonomy of web search intents for name entity queries",0.425,0.279138321995
7FDDC530,"Collaborative search in electronic health records",0.40625,0.402777777778
08485EC4,"Understanding how people use search engines: a statistical analysis for e-Business",0.404166666667,0.370952380952
7C65221B,"Query-page intention matching using clicked titles and snippets to boost search rankings",0.569444444444,0.356944444444
7B0ABFE0,"Analyzing the behavior of professional video searchers using RAI query logs",0.410714285714,0.307771593486
5A8075E1,"Using Search Logs to Recommend Images to New Users",0.569444444444,0.409331409331
7EA2EC34,"Data collection system for link analysis",0.369444444444,0.383181818182
5C9E6371,"A Web-Based Search Engine for Chinese Calligraphic Manuscript Images",0.40625,0.326884920635
7BB3D617,"Sponsored search auction without bias",0.347222222222,0.358333333333
7E9C3DCF,"Topic-sensitive PageRank: a context-sensitive ranking algorithm for Web search",0.350694444444,0.359027777778
7714E593,"Improving Web Site Performance Using Commercially Available Analytical Tools",0.396825396825,0.328571428571
80D2B3FC,"Search of spoken documents retrieves well recognized transcripts",0.40625,0.333333333333
7D4D8FF4,"Assieme: finding and leveraging implicit references in a web search interface for programmers",0.402777777778,0.268839031339
7EFB9739,"Locality in search engine queries and its implications for caching",0.375992063492,0.271825396825
80147FCE,"Integrating COTS Search Engines into Eclipse: Google Desktop Case Study",0.358630952381,0.232921245421
7C6BD7DC,"Aggregation of web search engines based on users' preferences in WebFusion",0.5,0.354497354497
83B63DDA,"Query reformulation for specific domain search: Keywords, ontology, domain name",0.40625,0.266865079365
80052E45,"Personalized Search Based on User Search Histories",0.414583333333,0.541666666667
7DDFF174,"3D Visualization of Hierarchical Clustered Web Search Results",0.402777777778,0.344444444444
7D26D6A4,"Different Degrees of Explicitness in Intentional Artifacts: Studying User Goals in a Large Search Query Log",0.410714285714,0.257147366522
78B0FD76,"Category ranking for personalized search",0.445833333333,0.458333333333
7A3C73AD,"Ranking model adaptation for domain-specific search",0.379464285714,0.366477272727
80C3E417,"Approximation algorithms for diversified search ranking",0.402777777778,0.348611111111
06436CD1,"An Implicit-Feedback Based Ranking Methodology for Web Search Engines",0.402777777778,0.370421245421
5A8A89C6,"Private information disclosure from web searches",0.410714285714,0.447619047619
80153DFE,"Performance management in competitive distributed Web search",0.40625,0.326904761905
084B58CD,"MONSTERS AT THE GATE: WHEN SOFTBOTS VISIT WEB SEARCH ENGINES",0.347222222222,0.280086580087
79689250,"Automatic query reformulation with syntactic operators to alleviate search difficulty",0.427083333333,0.336904761905
75ED703B,"How Big is the World you can Explore? A Study of Chinese College Students’ Search Behavior via Search Engines",0.416666666667,0.296428571429
7E48B133,"Exploiting structure for intelligent Web search",0.447916666667,0.43125
7F924230,"Does topic metadata help with Web search?",0.402777777778,0.555555555556
80097500,"Data Fusion in Information Retrieval Using Consensus Aggregation Operators",0.577380952381,0.386755952381
844AD12E,"Seasonal and Geographic Patterns in Tanning Using Real-Time Data From Google Trends",0.572916666667,0.414209401709
816194D1,"Data Mining for Navigation Generating System with Unorganized Web Resources",0.425,0.27012987013
814D0144,"A web-based platform for multimedia content authoring exploiting keyword search engine and Data Cloud",0.660714285714,0.379148629149
8140DBBF,"Searchius: A Collaborative Search Engine",0.402777777778,0.535714285714
754D28B2,"The power of search engine ranking for tourist destinations.",0.383928571429,0.274603174603
7F63DAFA,"Static index pruning in web search engines: Combining term and document popularities with query views",0.410714285714,0.229497354497
7D600956,"Exploring HTML Tags and Metadata to Improve the Expressiveness of Web Search Engine's Queries",0.520833333333,0.286820586821
810E2A48,"Define: Web Search, Semantic Dreams in the Age of the Engine",0.410714285714,0.286038961039
7E92893F,"A New Approach to Design Graph Based Search Engine for Multiple Domains Using Different Ontologies",0.577380952381,0.348500881834
7E0684BF,"DTM - Extracting Data Records from Search Engine Results Page Using Tree Matching Algorithm",0.791666666667,0.377808302808
5878974C,"Effective Time Ratio: A Measure for Web Search Engines with Document Snippets",0.410714285714,0.241893424036
814C077E,"Efficient semantic-based content search in P2P network",0.458333333333,0.511111111111
8075BAC5,"The Mining and Extraction of Primary Informative Blocks and Data Objects from Systematic Web Pages",0.402777777778,0.237471655329
7B0426D3,"Can people collaborate to improve the relevance of search results?",0.458333333333,0.347883597884
801C3173,"Using annotations in enterprise search",0.569444444444,0.577777777778
80686216,"Affordable access to multimedia by exploiting collateral data",0.444444444444,0.418560606061
064ADF8C,"What would 'google' do? users' mental models of a digital library search engine",0.402777777778,0.321356421356
7EB192C7,"An Interactive Approach for Filtering Out Junk Images From Keyword-Based Google Search Results",0.402777777778,0.246198246198
7FCA2DBB,"Learning search tasks in queries and web pages via graph regularization",0.410714285714,0.296768707483
761B997F,"Guiding the content of tourism web advertisements on a search engine results page",0.431547619048,0.247134038801
7D1CC075,"Combining local and global visual feature similarity using a text search engine",0.572916666667,0.42288961039
78CEE965,"Assessing bias in search engines",0.359027777778,0.342857142857
7FD04E7F,"“THAT’s What I Was Looking For”: Comparing User-Rated Relevance with Search Engine Rankings",0.425,0.305257936508
5F4BA6D9,"Focused crawling using latent semantic indexing – an application for vertical search engines",0.569444444444,0.431632653061
7F97C269,"Putting Search in Context: Using Dynamically-Weighted Information Fusion to Improve Search Results",0.619047619048,0.454585537919
7A87785F,"Web search strategies and retrieval effectiveness: an empirical study",0.40625,0.345643939394
7EA7DA0D,"Measuring improvement in user search performance resulting from optimal search tips",0.402777777778,0.400170068027
7E155B22,"Optimal allocation of heterogeneous robots in world wide web search engines",0.40625,0.24741045991
7DAFCAC0,"Increasing Search Engine Efficiency Using Cooperative Web",0.572916666667,0.420238095238
798DA979,"DB-IR integration and its application to a massively-parallel search engine",0.335227272727,0.380357142857
7DE4892F,"IR-Tree: An Efficient Index for Geographic Document Search",0.40625,0.412037037037
7F6B29EB,"RuralCafe: web search in the rural developing world",0.402777777778,0.403703703704
792AD2AD,"Using the web to look for work: Implications for online job seeking and recruiting",0.40625,0.322916666667
78C857CE,"Inferring search behaviors using partially observable markov model with duration (POMD)",0.572916666667,0.405735930736
7D4189D2,"Using query logs and click data to create improved document descriptions",0.577380952381,0.4024427953
77FB2B81,"Automatic keyword prediction using Google similarity distance",0.347916666667,0.331755050505
7FF925DB,"Dear search engine: what's your opinion about...?: sentiment analysis for semantic enrichment of web search results",0.40625,0.342956349206
77C43139,"Improving Web search efficiency via a locality based static pruning method",0.447916666667,0.298015873016
80C91B11,"Refining image retrieval using one-class classification",0.402777777778,0.338888888889
77C14875,"Interactive Internet search: keyword, directory and query reformulation mechanisms compared",0.402777777778,0.271130952381
7B40C470,"The impact of search engine optimization on online advertising market",0.40625,0.299603174603
80CF7075,"Translate Chinese organization names using examples and web",0.372916666667,0.276851851852
7F31C65C,"Greedy and Randomized Feature Selection for Web Search Ranking",0.402777777778,0.350505050505
7AA047A6,"SCPS: A Social-Aware Distributed Cyber-Physical Human-Centric Search Engine",0.402777777778,0.535714285714
7F0B3F55,"Noise Injection for Search Privacy Protection",0.326388888889,0.33841991342
7EBE35FF,"Handling Advertisements of Unknown Quality in Search Advertising",0.416666666667,0.333333333333
7DEA9D12,"A Boolean Model in Information Retrieval for Search Engines",0.410714285714,0.277705627706
7DE4CA6F,"A Personalization Strategy for Multimedia Resources in the Vertical Search System",0.40625,0.326704545455
7C3508B4,"A Monte-Carlo simulation application for automatic new topic identification of search engine transaction logs",0.410714285714,0.265232683983
594B7F74,"New Quality Metrics for Web Search Results",0.416666666667,0.338675213675
7FEFD048,"Relational click prediction for sponsored search",0.402777777778,0.350108225108
7E7D8E56,"K-Means for Search Results Clustering Using URL and Tag Contents",0.577380952381,0.484126984127
5FDE6CF9,"Google's PageRank and Beyond: The Science of Search Engine Rankings",0.326388888889,0.271892551893
7C7A93BC,"Mapping Queries to the Linking Open Data Cloud: A Case Study using DBpedia",0.583333333333,0.372970779221
7533AB14,"Overlapping factors in search engine optimization and web accessibility",0.350694444444,0.24433106576
7E339A42,"Architecture of a grid-enabled Web search engine",0.350694444444,0.31994047619
599E003C,"Solving problems two at a time: classification of web pages using a generic pair-wise multiple classifier system",0.385416666667,0.222745310245
7D7DED05,"Personalized News Search in WWW: Adapting on User's Behavior",0.39375,0.315145502646
7B08DE90,"On-line index maintenance using horizontal partitioning",0.347222222222,0.326388888889
79F93579,"Identifying User Goals from Web Search Results",0.379464285714,0.371527777778
7DA69873,"INFOSEARCH: A SYSTEM FOR SEARCHING AND RETRIEVING DOCUMENTS USING COMPLEX QUERIES",0.358630952381,0.323683261183
752D6B60,"Marie-4: a high-recall, self-improving Web crawler that finds images using captions",0.358630952381,0.300535113035
803CFBD4,"BOSS: context-enhanced search for biomedical objects.",0.410714285714,0.40873015873
75771289,"WEC: Improving Durability of SSD Cache Drives by Caching Write-Efficient Data",0.425,0.325384615385
8012F645,"Understanding queries in a search database system",0.40625,0.33841991342
80F51330,"A Quantitative Study of Forum Spamming Using Context-based Analysis",0.377380952381,0.377380952381
7E7DB52D,"GRAPE: A Graph-Based Framework for Disambiguating People Appearances in Web Search",0.381944444444,0.279701779702
7F9CE7DC,"Shape-similarity search of 3D models by using enhanced shape functions",0.577380952381,0.471753246753
5C389A60,"A Comparison of Information Seeking Using Search Engines and Social Networks",0.591666666667,0.404421768707
7EF85C68,"Weighted ontology for subject search in Learning Content Management System",0.402777777778,0.340404040404
5D077CA4,"Key concepts identification and weighting in search engine queries",0.402777777778,0.265343915344
7FBE98B0,"eXtract: a snippet generation system for XML search",0.360714285714,0.298181818182
6F0F9A69,"A new approach to build a geographical taxonomy of adjacency automatically using the latent semantic indexing method",0.372916666667,0.27766955267
7FB10601,"WebFusion: Fundamentals and Principals of a Novel Meta Search Engine",0.402777777778,0.316468253968
7F560526,"Using Google Scholar to Estimate the Impact of Journal Articles in Education.",0.402777777778,0.274254317111
814E488A,"XSeek: a semantic XML search engine using keywords",0.569444444444,0.690476190476
7F243985,"Domain specific searches using conceptual spectra",0.583333333333,0.569444444444
75BE5D13,"Beyond the session timeout: automatic hierarchical segmentation of search topics in query logs",0.410714285714,0.262770562771
642E493A,"Correlation of Expert and Search Engine Rankings",0.346428571429,0.287301587302
770C9451,"The influence of task and gender on search and evaluation behavior using Google",0.591666666667,0.398157051282
78A4DC3B,"An empirical analysis of sponsored search performance in search engine advertising",0.40625,0.423214285714
7F427012,"Strategic bidder behavior in sponsored search auctions",0.402777777778,0.4
7B3C742C,"Questions as a Factor in Web Search Strategy.",0.326388888889,0.336219336219
7CE10FC4,"Multimedia search over integrated social and sensor networks",0.425,0.455555555556
7B6B639E,"Searching for Truth: Internet Search Patterns as a Method of Investigating Online Responses to a Russian Illicit Drug Policy Debate",0.402777777778,0.223343827889
7C171ADF,"Design and implementation of competent web crawler and indexer using web services",0.372916666667,0.246834415584
735C334A,"Can electronic search engines optimize screening of search results in systematic reviews: an empirical study",0.619047619048,0.447871572872
80989D41,"Using query logs to establish vocabularies in distributed information retrieval",0.355158730159,0.270987182752
7DECF19E,"Optimal threshold control by the robots of web search engines with obsolescence of documents",0.40625,0.233494679923
7E0B9BA0,"pFilter: global information filtering and dissemination using structured overlay networks",0.383333333333,0.289285714286
778971E3,"Intelligent Social Media Indexing and Sharing Using an Adaptive Indexing Search Engine",0.569444444444,0.373757988044
7F47A05A,"Predicting the Quality of Answers Using Surface Linguistic Features",0.364583333333,0.270905483405
7F7CA35B,"Distributed Information Search with Adaptive Meta-Search Engines",0.410714285714,0.353571428571
5D13C4B2,"Mining the Query Logs of a Chinese Web Search Engine for Character Usage Analysis",0.40625,0.280614177489
7D70F145,"ABSTRACT OF PhD THESIS Automatic Semantic Role Labeling using Selectional Preferences with Very Large Corpora Determinación Automática de Roles Semánticos usando Preferencias de Selección sobre Corpus muy Grandes",0.369444444444,0.241582491582
6E2EF74F,"Integrating databases, search engines and web applications: a model-driven approach",0.358630952381,0.296626984127
76903480,"Implementation of a Federated Search System: Resource Accessibility Issues",0.341964285714,0.248247783962
80E7C2EA,"An Unsupervised Approach to Cluster Web Search Results Based on Word Sense Communities",0.416666666667,0.270044191919
800BF133,"DigSee: disease gene search engine with evidence sentences (version cancer)",0.335227272727,0.212053571429
7A1A57BB,"Edgel index for large-scale sketch-based image search",0.402777777778,0.407407407407
7EC00F52,"Exploiting knowledge-in-the-head and knowledge-in-the-social-web: effects of domain expertise on exploratory search in individual and social search environments",0.447916666667,0.424603174603
7CCB4F13,"On caching search engine query results",0.375992063492,0.315079365079
7D5367E9,"Query biased snippet generation in XML search",0.366964285714,0.371428571429
80580C10,"The influence of caption features on clickthrough patterns in web search",0.335227272727,0.296753246753
7E16E14F,"Using XPath to Discover Informative Content Blocks of Web Pages",0.402777777778,0.306944444444
75CBEC70,"Combining Keyword Search Advertisement and Site- Targeted Advertisement in Search Engine Advertising",0.379464285714,0.354910714286
59A2235A,"Web Data Clustering",0.347222222222,0.458333333333
7EB04ED4,"Distributed image search in camera sensor networks",0.38125,0.278561253561
7E1C0817,"Web searching on the Vivisimo search engine",0.40625,0.38244047619
7AE35977,"DEFINING TOPIC BOUNDARIES IN SEARCH ENGINE TRANSACTION LOGS USING GENETIC ALGORITHMS",0.577380952381,0.338455988456
7644AE7A,"Competitive caching of query results in search engines",0.402777777778,0.331349206349
7CCFB808,"Learning to re-rank web search results with multiple pairwise features",0.402777777778,0.383838383838
5F1D8D5E,"An Agent-Based Personalized Search on a Multi-search Engine Based on Internet Search Service",0.402777777778,0.530952380952
