7E6299D4,"McRank: Learning to Rank Using Multiple Classification and Gradient Boosting",0.389880952381,0.350793650794
807777B3,"Concordance-Based Entity-Oriented Search",0.326388888889,1.0
8056578B,"Persona: a contextualized and personalized web search",0.40625,0.441666666667
79E396F5,"Using micro information units for internet search",0.577380952381,0.471428571429
76A9C92F,"Discovery of similarity computations of search engines",0.335227272727,0.339285714286
5F22211E,"Using social annotation and web log to enhance search engine",0.572916666667,0.363043702329
80D4FA9A,"Automatically mining result records from search engine response pages",0.40625,0.260600907029
7D735E11,"Design and Implementation of Amharic Search Engine",0.402777777778,0.353571428571
81774194,"Topical web crawling using weighted anchor text and web page change detection techniques",0.364583333333,0.222530864198
7E60FA59,"An Architectural Framework of a Crawler for Locating Deep Web Repositories Using Learning Multi-agent Systems",0.347916666667,0.252746212121
76314643,"The role of exploratory talk in classroom search engine tasks",0.402777777778,0.28491045991
7DCE3D6B,"Internet search engines – fluctuations in document accessibility",0.335227272727,0.250661375661
5D3565A0,"Using a Layered Markov Model for Decentralized Web Ranking",0.35625,0.301136363636
8151DD8D,"The Effects of Query Bursts on Web Search",0.350694444444,0.304365079365
7FFEF7C6,"Boosting the ranking function learning process using clustering",0.410714285714,0.362698412698
77FFB8D1,"Query-related data extraction of hidden web documents",0.402777777778,0.340277777778
8046A71D,"Exploratory search in multi-domain information spaces with liquid query",0.416666666667,0.363095238095
79554898,"Applying test-driven code search to the reuse of auxiliary functionality",0.577380952381,0.563492063492
75388F54,"Learning from search engine and human supervision for web image search",0.402777777778,0.443121693122
76E0C288,"Discovery of ads web hosts through traffic data analysis",0.373214285714,0.334722222222
79A4C7C2,"The pros and cons of Microsoft Academic Search from a bibliometric perspective",0.402777777778,0.328282828283
7CB5B79A,"When experts agree: using non-affiliated experts to rank popular topics",0.355158730159,0.324735449735
813C2A23,"Do developers search for source code examples using multiple facts?",0.358630952381,0.28244047619
7B689B7D,"A Web Search on Environmental Topics: What Is the Role of Ranking?",0.410714285714,0.385238095238
7B7B9CE7,"Assessing data access issues in online platforms",0.3625,0.298333333333
58BD487E,"goDiscovery: Web Service Discovery Made Efficient",0.21875,0.277777777778
7E7B1902,"Grouper: a dynamic clustering interface to Web search results",0.4375,0.281339031339
7F444B18,"The Politics of Search: A Decade Retrospective",0.360714285714,0.366964285714
81159999,"Translating Query for Deep Web Using Ontology",0.358630952381,0.298015873016
761D51E0,"XML-Based Meta-Retrieval of Networked Data Sources",0.338492063492,0.55
7DBB2107,"A semantic index structure for integrating OGC services in a spatial search engine",0.402777777778,0.274867724868
7C55AD62,"Finding Related Pages Using the Link Structure of the WWW",0.347916666667,0.285515873016
77149882,"A machine learning approach to web page filtering using content and structure analysis",0.366666666667,0.255555555556
75858A69,"Internet Search Patterns of Human Immunodeficiency Virus and the Digital Divide in the Russian Federation: Infoveillance Study",0.416666666667,0.228972763348
79652A2F,"A dataset for API usage",0.159722222222,0.333333333333
7D34B238,"An Implementation of XML Documents Search System based on Similarity in Structure and Semantics",0.40625,0.250054112554
7836C54E,"SMS-based contextual web search",0.40625,0.5625
5BED1B66,"Object-Oriented Mediator Queries to Internet Search Engines",0.326388888889,0.326298701299
7E1475F9,"Search engine for Amharic Web content",0.458333333333,0.38244047619
7DEA3E8C,"Forecasting Click-Through Rates Based on Sponsored Search Advertiser Bids and Intermediate Variable Regression",0.402777777778,0.277164502165
7F598D03,"Distributed search in P2P networks",0.38125,0.466666666667
7F407572,"Annotating Images by Mining Image Search Results",0.392361111111,0.305555555556
782759C1,"Query selection for improved Greek web searches",0.40625,0.366964285714
809F7B04,"Combinatorial Topology-based Semantic Clustering Applied to PubMed",0.379166666667,0.625
76F96504,"Development of Health Information Search Engine Based on Metadata and Ontology",0.5,0.295882936508
75A6D5C4,"Clustering user queries of a search engine",0.347222222222,0.345238095238
02A56229,"Enabling Search over Large Collections of Telugu Document Images – An Automatic Annotation Based Approach",0.508333333333,0.324652777778
80DD895B,"Solving Multiple Choices for English Exams by Web Search",0.40625,0.335
779E81F6,"PhyloFinder: An intelligent search engine for phylogenetic tree databases",0.40625,0.316964285714
12BFCB7F,"The Anatomy of a Search Engine",0.326388888889,0.379365079365
7B29DCC1,"Query clustering using content words and user feedback",0.358630952381,0.309126984127
5D653C73,"Multiple Evidence Combination in Web Site Search Based on Users' Access Histories",0.458333333333,0.274305555556
803D7892,"Random Sampling from a Search Engine's Corpus",0.375992063492,0.358134920635
7F93B827,"Search, interrupted: understanding and predicting search task continuation",0.355158730159,0.427551020408
5DC0F9C4,"Cost-effective web search in bootstrapping for named entity recognition",0.425,0.327222222222
5A19D8DC,"Automated extraction of hit numbers from search result pages",0.390277777778,0.275925925926
7C5AEB34,"Adaptive content recommendation for mobile users: Ordering recommendations using a hierarchical context model with granularity",0.402777777778,0.229854096521
7611EAFB,"A case study of using geographic cues to predict query news intent",0.364583333333,0.256519274376
0AA0E3F3,"Query log analysis of an electronic health record search engine.",0.40625,0.244789734075
5B7E9137,"Peer-to-Peer Information Search: Semantic, Social, or Spiritual?",0.410714285714,0.571428571429
7A7734B7,"Approximate distributed metric-space search",0.359027777778,0.6
7DE56440,"UKSearch - Web Search with Knowledge-Rich Indices",0.350694444444,0.412037037037
80DF2CE3,"A Framework for Prefetching Relevant Web Pages using Predictive Prefetching Engine (PPE)",0.347916666667,0.274134199134
785A4FDA,"HIT-WSD: using search engine for multilingual Chinese-English lexical sample task",0.569444444444,0.486507936508
81324051,"Search Engine Query Clustering Using Top-k Search Results",0.569444444444,0.498866213152
791F0F5A,"The effect of a website directory when employed in browsing the results of a search engine",0.569444444444,0.372307256236
7F353B6C,"Learning to efficiently rank",0.25,0.291666666667
76443F87,"A spontaneous code recommendation tool based on associative search",0.410714285714,0.334126984127
7E9C688A,"Learning Query Reformulations for Personalized Web Search Using a Probabilistic Inference Network",0.591666666667,0.413157081014
7F6566F3,"Evaluate and Compare Chinese Internet Search Engines Based on Users' Experience",0.402777777778,0.312830687831
589588CD,"GeoST: geographic, thematic and temporal information retrieval from heterogeneous web data sources",0.402777777778,0.290238095238
80F2CE0B,"Generating New Features Using Genetic Programming to Detect Link Spam",0.372916666667,0.277547452547
7DA435A9,"Post-rank reordering: resolving preference misalignments between search engines and end users",0.335227272727,0.213935370185
7B770463,"A revenue sharing mechanism for federated search and advertising",0.341964285714,0.270304232804
80F4E2C0,"The retrieval of highly scattered facts and architectural images: Strategies for search and design",0.40625,0.268392255892
5CB6B573,"Using SiteRank for P2P Web Retrieval",0.347916666667,0.402777777778
7542CF7B,"Search Computing: Managing Complex Search Queries",0.402777777778,0.558441558442
7BFCC0CD,"The influence of the document ranking in expert search",0.40625,0.340277777778
7F13295A,"From x-rays to silly putty via Uranus: serendipity and its role in web search",0.326388888889,0.289134199134
783C0F43,"Search-logger analyzing exploratory search tasks",0.402777777778,0.527777777778
7CFA36C0,"A study of relevance propagation for web search",0.355158730159,0.315476190476
7D1D9E2C,"Search Engines, the New Bottleneck for Content Access",0.402777777778,0.31369047619
7CD6DD8F,"Data mining of search engine logs",0.560714285714,0.452467532468
7C5E6B3B,"Airing Grievances Online: Search Engine Algorithms and the Fate of Minorities at Risk",0.366964285714,0.246924603175
7F30032A,"Using Query Word Senses and User Feedback to Improve Precision of Search Engine",0.614583333333,0.331750040083
68723C0D,"Top-k ranked document search in general text databases",0.40625,0.371527777778
7FC7C4D0,"WebRat: supporting agile knowledge retrieval through dynamic, incremental clustering and automatic labelling of Web search result sets",0.458333333333,0.325396825397
76A1F8B9,"Do search terms matter for online consumers? The interplay between search engine query specification and topical organization",0.425,0.302483627484
784AC977,"Internet search tactics",0.326388888889,0.387445887446
7B64280B,"Search engine predilection towards news media providers",0.335227272727,0.246374458874
5CFC04D2,"Diversified caching for replicated web search engines",0.40625,0.322619047619
7CCB7A34,"Formal definitions of web information search",0.410714285714,0.417989417989
7C90EE96,"A method to assess search engine results",0.359027777778,0.29873015873
751A9ADF,"Auctioning Keywords in Oline Search",0.347222222222,0.583333333333
795B9740,"LambdaRank acceleration for relevance ranking in web search engines (abstract only)",0.410714285714,0.293650793651
5992BF1F,"Towards a Domain Oriented and Independent Semantic Search Model",0.402777777778,0.350505050505
75591D77,"Entity resolution using search engine results",0.591666666667,0.415608465608
7FB6AB67,"A Performance Evaluation Framework for Library Search Engines",0.326388888889,0.301038961039
7D4CFC4A,"Filtering Short Queries by Means of Fuzzy Semantic-Lexical Relations for Meta-searchers Using WordNet",0.377380952381,0.290548340548
815EAB56,"Prospecting an Inclusive Search Mechanism for Social Network Services",0.425,0.34
7DA718F1,"Relative effect of spam and irrelevant documents on user interaction with search engines",0.40625,0.264077126577
771A15EA,"Using Twitter data to improve news results on search engine",0.833333333333,0.472966269841
808494D1,"An Experiment About Using Copulative and Comparative Sentences as Constraining Relations",0.363095238095,0.352678571429
80830405,"Visual bracketing for Web search result visualization",0.402777777778,0.403703703704
7F3039F4,"Modeling and predicting user behavior in sponsored search",0.338492063492,0.394047619048
79551E63,"Detecting splogs via temporal dynamics using self-similarity analysis",0.364393939394,0.367857142857
593898EC,"Space-Limited Ranked Query Evaluation Using Adaptive Pruning",0.369444444444,0.3875
5B3BA594,"Patterns of search: analyzing and modeling Web query refinement",0.350694444444,0.311904761905
7E731A9E,"SE4SC: a specific search engine for software components",0.402777777778,0.315584415584
7527E52D,"Finding open access articles using Google, Google Scholar, OAIster and OpenDOAR",0.3375,0.25293040293
5E3B13EA,"Improving Search Engines Performance on Multithreading Processors",0.427083333333,0.334523809524
80736A08,"A Flexible Schema Method to Model the Web Data",0.402777777778,0.302777777778
756961CF,"ResIn: a combination of results caching and index pruning for high-performance web search engines",0.431547619048,0.247574955908
7D1CC063,"DBLP-SSE: A DBLP Search Support Engine",0.326388888889,0.468253968254
7DE7BE04,"Evaluation of different visualizations of Web search results",0.402777777778,0.352777777778
5A76095B,"Google shared. A case study in social search",0.40625,0.310622710623
815D5339,"A distributed search engine for fresh information retrieval",0.410714285714,0.324404761905
8130637C,"A regression framework for learning ranking functions using relative relevance judgments",0.355158730159,0.272850958565
769ACCB1,"Random sampling from a search engine's index",0.375992063492,0.358134920635
7E81446C,"QueryFind: search ranking based on users' feedback and expert's agreement",0.40625,0.291666666667
5AD3D2EB,"Multi-modal Services for Web Information Collection Based on Multi-agent Techniques",0.3,0.255238095238
7A9327F9,"Improving XML search by generating and utilizing informative result snippets",0.611111111111,0.465740740741
7E1628F5,"Design and Evaluation of the iMed Intelligent Medical Search Engine",0.402777777778,0.367857142857
7DE2726D,"A comparison of social bookmarking with traditional search",0.402777777778,0.583333333333
75B54638,"The Use of Web Search Engines in Information Science Research",0.346428571429,0.307936507937
81406058,"Large-scale bot detection for search engines",0.402777777778,0.312087912088
7F3D8395,"Hardware/Software Codesign for an Iris Biometric Search Engine",0.326388888889,0.535714285714
787CD895,"Web searching in Chinese: A study of a search engine in Hong Kong",0.40625,0.339285714286
7F520349,"A large scale study of European mobile search behaviour",0.40625,0.354166666667
7EDCB620,"A Latent Model for Visual Disambiguation of Keyword-based Image Search",0.402777777778,0.323232323232
755C4061,"Toward reusing code changes",0.238095238095,0.269841269841
0BFE0C2B,"SPATIAL DATA INTERPRETATION FOR THE INTELLIGENT ACCESS TO SPATIAL INFORMATION IN THE INTERNET",0.402777777778,0.281746031746
75EE7682,"Using Google as a super corpus to drive written language learning: a comparison with the British National Corpus",0.375,0.231827431827
08814921,"A GRAPH BASED APPROACH TO COMPARING SEARCH ENGINES",0.410714285714,0.327380952381
59717BF4,"Automatic Search Engine Performance Evaluation with the Wisdom of Crowds",0.416666666667,0.284325396825
7E1DF517,"UNIBA-SENSE at CLEF 2008: SEmantic N-levels Search Engine",0.402777777778,0.535714285714
7EE38AA6,"A new statistical method for performance evaluation of search engines",0.402777777778,0.305079365079
7C047529,"Users' views on country‐specific search engine results",0.338492063492,0.280952380952
8004208A,"Automatic New Topic Identification in Search Engine Transaction Logs Using Multiple Linear Regression",0.577380952381,0.346482683983
812DF152,"Hybrid Architecture for Web Search Systems Based on Hierarchical Taxonomies",0.40625,0.326515151515
76932184,"Unsupervised extraction of template structure in web search queries",0.402777777778,0.290793650794
771F7340,"A study of metadata element co‐occurrence",0.220643939394,0.333333333333
7869B67B,"Think local, search global? Comparing search engines for searching geographically specific information",0.410714285714,0.428231292517
75CF13FA,"Search structures and algorithms for personalized ranking",0.402777777778,0.352777777778
58A7D464,"A document-centered approach to a natural language music search engine",0.416666666667,0.309523809524
779A678C,"Presenting implicit relevance feedback in educational search engine",0.410714285714,0.315079365079
7A56F5D1,"Towards intelligent search assistance for inquiry-based learning",0.402777777778,0.481481481481
7D0B14C5,"Automated functional testing of search engine",0.411111111111,0.361607142857
7F489871,"A Heuristic Search for Relevant Images on the Web",0.40625,0.412037037037
7D5289A3,"Search Engine Result Visualisation: Challenges and Opportunities",0.341964285714,0.253108465608
7B8A29DA,"Next-generation Web searches for visual content",0.458333333333,0.486111111111
59E45980,"Crawling, Indexing and Retrieval of Three-Dimensional Data on the Web in the Framework of MPEG-7",0.40625,0.255892255892
7F6DFDD4,"A Bayesian 3-D Search Engine Using Adaptive Views Clustering",0.569444444444,0.469841269841
5D261E21,"How do users express goals on the web? - an exploration of intentional structures in web search",0.40625,0.249305555556
7E8999AB,"Search Engines that Learn from Implicit Feedback",0.402777777778,0.378968253968
5A75FE33,"Defining Algorithmic Ideology: Using Ideology Critique to Scrutinize Corporate Search Engines",0.569444444444,0.363095238095
7819F274,"A framework for hierarchical clustering based indexing in search engines",0.4375,0.324278499278
7EE66F6E,"Thumbs-up: a game for playing to rank search results",0.375992063492,0.388888888889
5D32A20D,"Adapting to the User’s Internet Search Strategy",0.375992063492,0.353084415584
7F41469B,"Joining the results of heterogeneous search engines",0.402777777778,0.378968253968
5BF74EF2,"An Approach to Content-Based Image Retrieval Based on the Lucene Search Engine Library",0.402777777778,0.263256584685
7C0511AF,"Model characterization curves for federated search using click-logs: predicting user engagement metrics for the span of feasible operating points",0.572916666667,0.277342606888
7A2BB02A,"An approach to use query-related web context on document ranking",0.364583333333,0.273148148148
7DF79BAB,"Clustering by directions algorithm to narrow search queries",0.410714285714,0.322294372294
7A92F68C,"A link-based visual search engine for Wikipedia",0.402777777778,0.535714285714
7AC10670,"Mining User preference using Spy voting for search engine personalization",0.569444444444,0.44708994709
806CD10E,"Design and Implementation-Algorithms of Amharic Search Engine System for Amharic Web Contents",0.410714285714,0.271699134199
80A6569A,"A Multi-agent System Using Ontological User Profiles for Dynamic User Modelling",0.364583333333,0.267466329966
815FF455,"A Commodity Information Search Model of E-Commerce Search Engine Based on Semantic Similarity and Multi-Attribute Decision Method",0.410714285714,0.314130591631
75E76B1B,"Applying reinforcement learning for web pages ranking algorithms",0.385416666667,0.288492063492
7FD77FBF,"Contextual paradigm for ad hoc retrieval of user-centric web data",0.402777777778,0.288888888889
7EA15456,"Reducing the information overload: a method on helping students research engineering topics using the Internet",0.377380952381,0.227417027417
77077195,"Using boosted trees for click-through rate prediction for sponsored search",0.577380952381,0.38169449598
0EBED3B3,"Reachability Based Web Page Ranking Using Wavelets",0.347916666667,0.358333333333
783720A1,"Location-aware click prediction in mobile local search",0.402777777778,0.411255411255
5A7174CC,"Evaluating Search Engines by Clickthrough Data",0.58125,0.567857142857
7E068021,"Toward a Code Search Engine Based on the State-of-Art and Practice",0.410714285714,0.37619047619
7FEEC2A0,"JUST-IN-TIME LATENT SEMANTIC ADAPTATION ON LANGUAGE MODEL FOR CHINESE SPEECH RECOGNITION USING WEB DATA",0.591666666667,0.352335858586
7BF17714,"Is Relevance Relevant? Market, Science, and War: Discourses of Search Engine Quality",0.416666666667,0.271031746032
5EF82256,"A Search Engine for Mathematical Formulae",0.402777777778,0.39417989418
7C736D30,"Analyzing Positioning Strategies in Sponsored Search Auctions Under CTR-Based Quality Scoring",0.416666666667,0.303463203463
7FFECAB1,"Application-Specific Disk I/O Optimisation for a Search Engine",0.335227272727,0.330357142857
7E437373,"Query Expansion on a Corporate Intranet: Using LSI to Increase Precision in Explorative Search",0.569444444444,0.417923280423
7EB7E03E,"A novel method for bilingual web page acquisition from search engine web records",0.40625,0.245124716553
76763963,"Using the Robots.txt and Robots Meta tags to implement online copyright and a related amendment",0.347222222222,0.316524216524
7D1797AA,"Improving web search result categorization using knowledge from web taxonomy",0.633333333333,0.382638888889
7FE74A22,"Designing Ranking Systems for Hotels on Travel Search Engines by Mining User-Generated and Crowd-Sourced Content",0.452380952381,0.278354978355
7F561450,"Search Engine Competition with Network Externalities",0.360714285714,0.311428571429
7D695F9A,"Nash Bargaining Based Ad Networks for Sponsored Search Auctions",0.425,0.272821969697
80BF33E3,"Variability of patient spine education by Internet search engine",0.40625,0.322619047619
5DE34032,"Analyzing and Classifying User Search Histories for Web Search Engine Optimization",0.40625,0.40306122449
7DA21852,"E-learning Document Search Method with Supplemental Keywords Derived from Keywords in Meta-Tag and Descriptions which are Included in the Header of the First Search Result",0.40625,0.34297979798
7ED3A320,"Inferring and using location metadata to personalize web search",0.675,0.575
7D60690A,"Essie: A Concept-based Search Engine for Structured Biomedical Text",0.402777777778,0.39417989418
7B7BD9C1,"Sizing sketches: a rank-based analysis for similarity search",0.3625,0.320384615385
601A7256,"Symbolic Computing with Incremental Mindmaps to Manage and Mine Data Streams - Some Applications",0.4375,0.357407407407
7F2FCB93,"Techniques for Specialized Search Engines",0.402777777778,0.390476190476
815D3640,"INTEGRATING WEB PORTALS INTO A CONCEPT-BASED SEARCH ENGINE USING ONTOLOGIES",0.572916666667,0.364447060876
7D0223C3,"A Co-occurrence Based Hierarchical Method for Clustering Web Search Results",0.40625,0.314814814815
80DB263A,"Macro-clustering: improved information retrieval using fuzzy logic",0.396825396825,0.328571428571
781A15F6,"Random walk based rank aggregation to improving web search",0.541666666667,0.405753968254
5FE553DF,"A machine learning approach to building domain-specific search engines",0.402777777778,0.31746031746
81612130,"Using Google AdWords in the MBA MIS Course.",0.379166666667,0.298951048951
7FA6DD0A,"Searching for content in mobile DTNs",0.236111111111,0.333333333333
7B089F09,"Ranking web sites using domain ontology concepts",0.350694444444,0.255952380952
7EEBD0E3,"Discovering and Exploiting Cumulative Cues for Informational Web Search",0.447916666667,0.427083333333
77617267,"Blog search engines",0.326388888889,0.39417989418
7866435B,"Effective rank aggregation for metasearching",0.28125,0.321428571429
5916499C,"Spelling Correction for Search Engine Queries",0.347222222222,0.30119047619
72A0065F,"Understanding the Information Search Process within a Tourism Domain-specific Search Engine",0.410714285714,0.429421768707
7DEA0662,"Automatic recognition of handwritten medical forms for search engines",0.402777777778,0.323412698413
803F8DD1,"The utility of tweeted URLs for web search",0.350694444444,0.331755050505
58D640F1,"Visual media retrieval framework using web service",0.379166666667,0.30303030303
7E04CD0C,"Approximate Keyword Search in Web Search Engines",0.326388888889,0.690476190476
7EE3F39D,"Information search and re-access strategies of experienced web users",0.410714285714,0.293975468975
7EB7F03F,"The Market Structure for Internet Search Engines",0.331755050505,0.37619047619
805BEFA6,"Search Engines for Semantic Web Knowledge",0.416666666667,0.340773809524
7F7ED4A8,"A boundary search based ACO algorithm coupled with stochastic ranking",0.402777777778,0.411111111111
7F040450,"CrossSearch, a user-friendly search engine for detecting chemically cross-linked peptides in conjugated proteins",0.402777777778,0.287852147852
5931C934,"Squiggle : a Semantic Search Engine for indexing and retrieval of multimedia content",0.458333333333,0.268140589569
7EAE7413,"Top- k aggregation using intersections of ranked inputs",0.447916666667,0.366178266178
0958DC0A,"Improving User's Web Search Experience by Interactive Re-ranking and Zooming Interfaces",0.444444444444,0.326495726496
8048724F,"A framework for optimizing the cost and performance of next-generation IP routers",0.355158730159,0.254449254449
81266FC3,"Visualizing the structure of Web communities based on data acquired from a search engine",0.625,0.396428571429
7C09167A,"An interaction framework for mobile web search",0.40625,0.353977272727
7C3172E1,"Analyzing the emotional outcomes of the online search behavior with search engines",0.402777777778,0.480158730159
7D55F348,"Context ontology driven relevant search using data mining techniques (CODT)",0.791666666667,0.445634920635
7D0CB418,"Relevancy rankings: pay for performance search engines in the hot seat",0.410714285714,0.233560090703
7D4253A1,"Techniques for Organizing and Presenting Search Results: A Survey",0.375992063492,0.312962962963
81218193,"Research on Web mining-based intelligent search engine",0.326388888889,0.42380952381
7E66299C,"Semantic Map Based Web Search Result Visualization",0.402777777778,0.325555555556
7D959C93,"Caching search engine results over incremental indices",0.402777777778,0.30873015873
764F7743,"Clustering and exploring search results using timeline constructions",0.604166666667,0.460185185185
7F7E761C,"Creating Location-Based Services by Utilising a Web of Places",0.372916666667,0.351666666667
7D5E70B6,"Search on the Semantic Web",0.40625,0.5625
06A0809A,"Travel Queries on Cities in the United States: Implications for Search Engine Marketing in Tourism",0.402777777778,0.207621082621
7518408A,"Online adaptive firewall allocation in internet data center",0.416666666667,0.288023088023
80A17545,"Effects of search success on search engine re-use",0.335227272727,0.469841269841
0A64407B,"Query Reformulation on the Internet: Empirical Data and the Hyperindex Search Engine",0.625,0.457142857143
5C5BD32F,"Open Architecture for Distributed Search Systems",0.402777777778,0.391414141414
7AB04C2B,"Query routing for Web search engines: architectures and experiments",0.347222222222,0.267857142857
8106F131,"Trademark image retrieval using multiple features",0.350694444444,0.282070707071
771A0E99,"Community search assistant",0.345643939394,0.422222222222
78C5D9CF,"An ontology-driven approach to web search: analysis of its sensitivity to ontology quality and search tasks",0.361111111111,0.38125
