7C85F7F3,"Mining for insights in the search engine query stream",0.341964285714,0.258399470899
7C957CD3,"An analysis of P3P-enabled web sites among top-20 search results",0.350694444444,0.303888888889
7DD7DEBD,"Cross-lingual query suggestion using query logs of different languages",0.369047619048,0.302308802309
811F874E,"Context-Aware Automatic Query Refinement Using Indian-Logic Based Ontology",0.358630952381,0.34246031746
7A075AA4,"A comparative analysis of the search feature effectiveness of the major English and Chinese search engines",0.40625,0.414556277056
7E988A64,"Business-Based SMS Mobile Search",0.326388888889,0.55
7F48E77D,"Search Less, Find More? Examining Limited Consumer Search with Social Media and Product Search Engines",0.402777777778,0.446657046657
812F4683,"An Efficient Lossless Compression Method for Internet Search Data in Hardware Accelerators",0.625,0.39537037037
5AEAEC1D,"Web search behavior of university students: a case study at University of the Punjab",0.345643939394,0.273863636364
78AE309C,"Towards a reputation-based model of social web search",0.40625,0.405303030303
5D17F235,"Characterization of Search Engine Caches",0.326388888889,0.314865689866
808FC053,"An Improved Shark-Search Algorithm Based on Multi-information",0.197727272727,0.266666666667
7F9698B3,"SketchBrain: An Interactive Information Seeking Interface for Exploratory Search",0.410714285714,0.367445054945
78B02544,"A semantics-based method for clustering of Chinese web search results",0.40625,0.302777777778
7F25E819,"A Prototype Process-Based Search Engine",0.326388888889,0.390476190476
80FCD18B,"Effective site finding using link anchor information",0.355158730159,0.291865079365
7D068F65,"Automatic question answering using the web: Beyond the Factoid",0.358630952381,0.318571428571
815E99C0,"A search engine for finding highly relevant applications",0.402777777778,0.41369047619
7EC5B3FC,"Retroactive answering of search queries",0.402777777778,0.571428571429
7E6AAEBB,"Ranking of Wikipedia articles in search engines revisited: Fair ranking for reasonable quality?",0.416666666667,0.271315192744
80A9CBF1,"Perceiving linkspam based on DBSpamClust",0.25,0.333333333333
76ACDB98,"Usability and perception of young users and adults on targeted web search engines",0.40625,0.236394557823
5C00951C,"Graphs from Search Engine Queries",0.346428571429,0.339285714286
0950AB8A,"Towards personalized advertising in sponsored search",0.39375,0.385416666667
805A0E31,"Web Navigation Prediction Using Multiple Evidence Combination and Domain Knowledge",0.425,0.289574314574
7BF28D76,"Retrieval of software components using a distributed web system",0.347916666667,0.24145021645
7612574E,"Evaluating the stability of the search tools Hotbot and Snap: a case study",0.3625,0.279761904762
755BB3FE,"Purposive behavior of honeybees as the basis of an experimental search engine",0.410714285714,0.321288515406
7FBD74E8,"Intent based clustering of search engine query log",0.4375,0.285662749948
804C3A1A,"Semantic-Enhanced Information Search and Retrieval",0.346428571429,0.40873015873
77F1AED1,"Stochastic simulations of web search engines: RBF versus second-order regression models",0.402777777778,0.292467532468
7F0252D9,"Timestamp-based cache invalidation for search engines",0.326388888889,0.314865689866
7B666BEB,"SkyFinder: attribute-based sky image search",0.326388888889,0.400673400673
7DEEC649,"An Incremental Algorithm for Clustering Search Results",0.402777777778,0.369444444444
7A00A2C9,"Search engines and Web dynamics",0.350694444444,0.316964285714
808B3C93,"Site-Specific versus General Purpose Web Search Engines: A Comparative Evaluation",0.402777777778,0.345634920635
5CAF994F,"Evaluating hierarchical clustering of search results",0.4375,0.390277777778
7D133744,"Shuffling a stacked deck: the case for partially randomized ranking of search engine results",0.40625,0.237988400488
80E9FA04,"Extracting Relevance Information from User Click through Data Using Conditional Random Field",0.577380952381,0.359126984127
5C181B94,"Content-Addressable Search Engines and DES-like Systems",0.326388888889,0.387445887446
7D45F2EF,"User-Based Evaluations of Search Engines: Hygiene Factors and Motivation Factors",0.361111111111,0.251473922902
7EBA6AAA,"Investigating the querying and browsing behavior of advanced search engine users",0.402777777778,0.335978835979
7FC8569D,"Query types and search topics of German Web search engine users",0.410714285714,0.364512471655
591344E2,"Automated Keyphrase Extraction: Assisting Students in the Search for Online Materials",0.39375,0.317222222222
07C5B26F,"What Data for Data-Driven Learning?.",0.338492063492,0.555555555556
5911E438,"Computing geographical serving area based on search logs and website categorization",0.425,0.292748917749
7BF64AD4,"Integrating search engines with data mining for customer-oriented information search",0.619047619048,0.530612244898
59CE7EA6,"Towards Semantic Search",0.402777777778,1.0
7C5CBF21,"Predictive caching and prefetching of query results in search engines",0.402777777778,0.331349206349
7E16E420,"Standard parameters for searching behaviour in search engines and their empirical evaluation",0.40625,0.302182539683
76BD339C,"Similarity content search in content centric networks",0.458333333333,0.414583333333
7A8E4621,"Exploiting query term correlation for list caching in web search engines",0.446428571429,0.322751322751
7A72456D,"An efficient query processing through clickthroughs in personalized mobile search engines",0.40625,0.334821428571
7F822FD9,"Multitasking Web search on Alta Vista",0.326388888889,0.545454545455
789BEE7E,"Music search engines: Specifications and challenges",0.346428571429,0.290079365079
7E2C1849,"Keyword suggestion using conceptual graph construction from Wikipedia rich documents",0.377380952381,0.315793650794
7AC08B2D,"New versions of PageRank employing alternative Web document models",0.347916666667,0.288181818182
801E4CE1,"Contextual Ranking of Keywords Using Click Data",0.577380952381,0.563492063492
7E3435C9,"Fast Matching for All Pairs Similarity Search",0.4375,0.40625
7D0A9803,"Using Missing Documents in Metasearch Aggregation: An Application of OWA Operator",0.479166666667,0.388888888889
77F9B0A6,"Online learning from click data for sponsored search",0.625,0.528571428571
5BEB0421,"Where the Speed Matters... Zero-Response-Time Search Engine for Small Collections",0.5,0.35467032967
7FAC2CC5,"Fancy a Drink in Canary Wharf?: A User Study on Location-Based Mobile Search",0.402777777778,0.260968660969
80AD18D5,"A vector model for routing queries in web search engines",0.347222222222,0.259199134199
7A3E375D,"Strategy hubs: next-generation domain portals with search procedures",0.338492063492,0.287231287231
5AC93CE5,"Distributed Web Search as a Stochastic Game",0.402777777778,0.511111111111
7E4B2DE7,"Querying Web data - the WebQA approach",0.361111111111,0.354166666667
60B0E5E0,"Using Social Annotations for Search Results Clustering",0.569444444444,0.477777777778
7DB50BF4,"Aggregating Subjective and Objective Measures of Web Search Quality using Modified Shimura Technique",0.583333333333,0.361954365079
6552A729,"OOXsearch: a search engine for answering loosely structured XML queries using OO programming",0.569444444444,0.389115646259
7648DB53,"WMS-extracting multiple sections data records from search engine results pages",0.625,0.359410430839
7E2A8791,"Web Information Organization Using Keyword Distillation Based Clustering",0.381944444444,0.33955026455
7D1BDBF8,"The Metadata Triumvirate: Social Annotations, Anchor Texts and Search Queries",0.5,0.296371882086
7CC309BF,"Dynamic test collections: measuring search effectiveness on the live web",0.5,0.346153846154
5EE13C5D,"Database selection and result merging in P2P web search",0.350694444444,0.278703703704
80E606A2,"Comparison the efficiency of some search engines on Arabic keywords and roots",0.40625,0.297619047619
7D446798,"Persistent cache in Cooperative Search Engine",0.402777777778,0.382783882784
7DA0DB60,"Data-driven optimization of search service composition for answering multi-domain queries",0.3625,0.307142857143
811774F4,"Large-scale near-duplicate web video search: Challenge and opportunity",0.410714285714,0.300793650794
5E10E034,"An excellent feature selection model using gradient-based and point injection techniques",0.369444444444,0.267803030303
78D7E120,"Head Lice Surveillance on a Deregulated OTC-Sales Market: A Study Using Web Query Data",0.625,0.370887445887
705CFB19,"Detecting hot events from web search logs",0.416666666667,0.385227272727
7E5EA84E,"Meta-Model Search: Using XPath to Search Domain-Specific Models",0.569444444444,0.606060606061
7E64A571,"Application of Machine Learning Techniques to the Re-ranking of Search Results",0.402777777778,0.312962962963
815A342A,"A Categorization Scheme for Semantic Web Search Engines",0.425,0.297467532468
7D5730B4,"A Neural Framework for Web Ranking Using Combination of Content and Context Features",0.402777777778,0.291824494949
7A6C5CA5,"Placing search in context: the concept revisited",0.375992063492,0.334444444444
763C283C,"Identifying clusters of user behavior in intranet search engine log files",0.410714285714,0.300968872397
7FD66C99,"Deep into web general vs vertical search engine design based on secure and QoS",0.402777777778,0.340952380952
5F2F1145,"Searching for Music Using Natural Language Queries and Relevance Feedback",0.369047619048,0.291383219955
76122740,"A semantic approach for question classification using WordNet and Wikipedia",0.379166666667,0.330086580087
7D247268,"Incremental Text Indexing for Fast Disk-Based Search",0.402777777778,0.437037037037
773FA33E,"Measuring search engine quality in image queries in 10 non-English languages: an exploratory study",0.389880952381,0.259424603175
801C5870,"Proof: A DHT-Based Peer-to-Peer Search Engine",0.326388888889,0.39417989418
59B08B0A,"Accessibility and Usability of Search Engine Interfaces: Preliminary Testing",0.40625,0.251577126577
5E296627,"Conceptual Knowledge Retrieval with FooCA: Improving Web Search Engine Results with Contexts and Concept Hierarchies",0.416666666667,0.224702380952
80465BD9,"Enhanced identification of eligibility for depression research using an electronic medical record search engine",0.572916666667,0.346775793651
7ECECC7D,"Integrating code search into the development session",0.363095238095,0.306904761905
7EBB612B,"Information Assistant: a novel initiative topic search engine",0.410714285714,0.291428571429
7DB094A1,"Sponsored Search Engines in Competition: Advertisers Behavior and Engines Optimal Ranking Strategies",0.410714285714,0.218163780664
80B427DA,"A Relation-Based Page Rank Algorithm for Semantic Web Search Engines",0.410714285714,0.270436507937
5AC3C4EC,"Apply Feedback Control Theory to Design Soft Real-Time Search Engine System",0.572916666667,0.336169733045
814B2B35,"Web caching in Semantic Web based multiple search engines",0.40625,0.31746031746
75555B8B,"Characterizing the value of personalizing search",0.390277777778,0.395833333333
7D6A4122,"Lessons learned from building the iMED intelligent medical search engine",0.402777777778,0.359523809524
7DDF9561,"Query-level learning to rank using isotonic regression",0.347222222222,0.365277777778
80122B38,"ConnectA! : An Intelligent Search Engine based on Authors' Connectivity",0.410714285714,0.329523809524
5F039425,"Web Search Based on Web Communities Feedback Data",0.625,0.525
5F4B20E5,"Measuring Search Engine Quality",0.389880952381,0.372023809524
76695A95,"Revealing relationships in search engine results",0.389880952381,0.319841269841
7FF3BC58,"A Novel Visualization Model for Web Search Results",0.402777777778,0.325505050505
59FC2E70,"Ranking the linked data: the case of DBpedia",0.389880952381,0.416666666667
7FAB8718,"Content-based search of model repositories with graph matching techniques",0.383928571429,0.279112554113
78DCF275,"Effective Scheme for File Search Engine in Mobile Environments",0.40625,0.321834415584
7F67997B,"Automated Artice Generation Using the Web",0.377777777778,0.39375
80BAFEB7,"User Behaviour during Web Search as Part of Information Gathering",0.369444444444,0.326904761905
80F56020,"A MULTILINGUAL AND LOCATION EVALUATION OF SEARCH ENGINES FOR WEBSITES AND SEARCHED FOR KEYWORDS",0.402777777778,0.335238095238
762C82EB,"Protein segment finder: an online search engine for segment motifs in the PDB",0.402777777778,0.223984745413
78E2DA1E,"A Strategic Perspective on Search Engines: Thought Candies for Practitioners and Researchers",0.40625,0.225053121482
6EAC329C,"The Compass Filter: Search Engine Result Personalization Using Web Communities",0.583333333333,0.357709750567
7F2951C1,"Construction of customized sub-databases from NCBI-nr database for rapid annotation of huge metagenomic datasets using a combined BLAST and MEGAN approach.",0.372916666667,0.285090702948
802456F3,"Explicit verses implicit: an analysis of a multiple search result visualization",0.40625,0.307222222222
76BC0941,"MedSearch: a specialized search engine for medical information retrieval",0.410714285714,0.324404761905
80EBD3E8,"Ranking music data by relevance and importance",0.375992063492,0.329365079365
5913DA68,"Linguistics in Large-Scale Web Search",0.40625,0.405303030303
81A74707,"MuZeeker: adapting a music search engine for mobile phones",0.410714285714,0.308241758242
027B92DC,"Brand Names as Keywords in Sponsored Search Advertising",0.335227272727,0.334027777778
80F02416,"Travel Information Search - The Presence of Social Media",0.410714285714,0.300324675325
79C1DDD5,"Competing for users' attention: on the interplay between organic and sponsored search results",0.402777777778,0.285714285714
7CA58E88,"Extract knowledge from semi-structured websites for search task simplification",0.361111111111,0.319841269841
6AA1CE2E,"Cha-Cha: a system for organizing intranet search results",0.375992063492,0.318975468975
77E70107,"INTELLIGENT SEARCH ENGINE-BASED UNIVERSAL DESCRIPTION, DISCOVERY AND INTEGRATION FOR WEB SERVICE DISCOVERY",0.40625,0.314285714286
61C72986,"An Analysis of Chinese Search Engine Filtering",0.402777777778,0.42380952381
5D8FDD5B,"A Three Level Search Engine Index Based in Query Log Distribution",0.410714285714,0.250450937951
7F96415D,"Subject categorization of query terms for exploring Web users' search interests",0.425,0.267125334982
8128E3BC,"Study on the Click Context of Web Search Users for Reliability Analysis",0.331755050505,0.283333333333
7F8E1087,"Google Scholar Search Performance: Comparative Recall and Precision",0.402777777778,0.299511599512
7DCA7D4D,"Mobile processors for energy-efficient web search",0.40625,0.416666666667
810CE8DD,"Mining broad latent query aspects from search sessions",0.402777777778,0.327289377289
7DF5C4FF,"Engineering new paths to water data",0.425,0.366666666667
77850989,"Semi-join computation on distributed file systems using map-reduce-merge model",0.381944444444,0.308585858586
7F12CFA4,"Web links and search engine ranking: The case of Google and the query “jew”",0.335227272727,0.235129949416
7CF81A66,"A classification of mutational approaches for genetic search",0.402777777778,0.472222222222
80C01977,"A nonredundant ternary CAM circuit for network search engines",0.425,0.287852147852
5BC28460,"Towards User Context Enhance Search Engine Logs Mining",0.326388888889,0.315584415584
81620CA9,"Web Search Engine Evaluation Using Clickthrough Data and a User Model",0.791666666667,0.496206967636
7A633980,"Personalized click prediction in sponsored search",0.390277777778,0.370941558442
792C8D57,"A knowledge-based search engine powered by wikipedia",0.347222222222,0.412698412698
5BAB9F17,"An analysis of time-instability in web search results",0.338492063492,0.437037037037
7C111AE0,"CrowdReranking: exploring multiple search engines for visual search reranking",0.402777777778,0.567857142857
7697D89B,"The impact of users’ verbal/imagery cognitive styles on their Web search behavior",0.410714285714,0.404761904762
5C8754D2,"POP2.0: A search engine for public information services in local government",0.410714285714,0.311428571429
7EDBEB9E,"Fully automatic wrapper generation for search engines",0.425,0.337087912088
7D59B1E0,"Using cues to forage for information on the Web",0.355158730159,0.303571428571
7A51F35A,"Improving search engines by query clustering",0.458333333333,0.359523809524
7C1CF27C,"An Evaluation of Popular Search Engines on Finding Turkish Documents",0.40625,0.345952380952
5FA3CBFE,"Creating Customized Metasearch Engines on Demand Using SE-LEGO",0.347916666667,0.355952380952
7DB910E0,"elGiza, a research-pyramid based search tool for vertical literature digital libraries",0.40625,0.323717948718
7BFF2EA3,"Reassessing google flu trends data for detection of seasonal and pandemic influenza: a comparative epidemiological study at three geographic scales.",0.416666666667,0.206827431827
59A87370,"A Query-Dependent Duplicate Detection Approach for Large Scale Search Engines",0.402777777778,0.287619047619
597E6AA4,"Enhancing Information Retrieval Using Problem Specific Knowledge",0.375,0.251133786848
806535DC,"A data-mining approach for optimizing performance of an incremental crawler",0.402777777778,0.350108225108
7E89D689,"A Web Search Analysis Considering the Intention behind Queries",0.347222222222,0.324126984127
7D3E9262,"Need help? The effects of training on Web searches",0.350694444444,0.303240740741
7E4E4627,"Real-Time Search for Real-World Entities: A Survey",0.425,0.455555555556
756D83CA,"Podcast search: user goals and retrieval technologies",0.335227272727,0.303888888889
802BB344,"A Community-Based Approach to Personalizing Web Search",0.390277777778,0.472222222222
7E957841,"BioMart: driving a paradigm change in biological data management",0.416666666667,0.31746031746
5989F7BD,"Toward a Web Search Information Behaviour Model",0.346428571429,0.339691558442
7786F694,"Evaluation of information providers and popular search engines on the base of postgraduate students' perspectives",0.410714285714,0.224954906205
753A28D6,"A New Retrieval Model Based on TextTiling for Document Similarity Search",0.40625,0.292929292929
80C09112,"PRELIMINARY INVESTIGATION OF COLLECTING MALAYSIA WEB PAGES USING AUTOMATED TRAVERSING TOOL",0.35625,0.229232804233
7D992FE8,"Personal search engine based on user interests and modified page rank",0.410714285714,0.260371572872
6C06765F,"Algorithmic Challenges in Web Search Engines",0.40625,0.39880952381
7EFFAF32,"Efficient relational keyword search system",0.402777777778,0.545454545455
77E9A73C,"Web search clickstreams",0.326388888889,1.0
7DC134D9,"Content free clustering for search engine query log",0.4375,0.311038961039
75F64C79,"An interactive agent-based system for concept-based web search",0.40625,0.405303030303
80E261A3,"Authenticating the query results of text search engines",0.338492063492,0.287301587302
8068BB7A,"Mining Historic Query Trails to Label Long and Rare Search Engine Queries",0.402777777778,0.290197897341
752FEF39,"Scheduling in a meta search engine by Genetic Algorithm",0.402777777778,0.367857142857
7E6E1CF4,"Generation of Semantic Interactive Environment for Personalized Search",0.433333333333,0.39375
7AA4A5B4,"Choice overload in search engine use?",0.326388888889,0.317619047619
5F225FD5,"Accessibility of web search engines",0.326388888889,0.39417989418
75A7127A,"An alternative approach to natural language query expansion in search engines: Text analysis of non-topical terms in Web documents",0.416666666667,0.224761904762
77242F22,"An interactive WWW search engine for user-defined collections",0.5,0.410714285714
598AE889,"Ontology-based personalized search and browsing",0.390277777778,0.44696969697
781AEA14,"Identification of alternative splice variants in Aspergillus flavus through comparison of multiple tandem MS search algorithms",0.40625,0.242159576535
7D23EA4E,"BJTU TRECVID 2007 Video Search",0.346428571429,0.571428571429
5951FC16,"Using OWA fuzzy operator to merge retrieval system results",0.347916666667,0.298737373737
7DAC8B99,"Incorporating Document Keyphrases in Search Results",0.358630952381,0.350694444444
7518AF70,"An Economic Model for Comparing Search Services",0.402777777778,0.385227272727
6E90F24A,"Identifying and ranking possible semantic and common usage categories of search engine queries",0.458333333333,0.359523809524
7AA63D14,"Identifying similarities, periodicities and bursts for online search queries",0.40625,0.297619047619
7CF1E39A,"Adaptive time-to-live strategies for query result caching in web search engines",0.402777777778,0.277717652718
7AEA0D76,"eBizSearch: a niche search engine for e-business",0.326388888889,0.390476190476
5D50B22A,"Search engine results over time-a case study on search engine stability",0.341964285714,0.335912698413
7E6DA932,"Compress the route table stored in TCAM by using memory filter",0.361111111111,0.248290598291
0ADB0895,"The Re:Search Engine Helping People Return to Information on the Web",0.410714285714,0.273660714286
7E6297EA,"Detecting Disease Outbreaks in Mass Gatherings Using Internet Data",0.583333333333,0.358035714286
8046E9EC,"A vector space search engine for Web services",0.361111111111,0.274404761905
7F9C6E40,"A Text Similarity Meta-Search Engine Based on Document Fingerprints and Search Results Records",0.40625,0.251984126984
7E03BE48,"Identification of factors predicting clickthrough in Web searching using neural network analysis",0.391666666667,0.284871031746
70124B4A,"Enriching Ontology for Deep Web Search",0.427083333333,0.371527777778
026364DE,"Semantic Search with GoPubMed",0.402777777778,1.0
813C389B,"Masked Queries for Search Accuracy in Peer-to-Peer File-Sharing Systems",0.410714285714,0.344155844156
7AAD22E1,"Consumer web page search, clicking behavior and reaction time",0.379464285714,0.26681547619
810C5049,"The impact of metadata implementation on webpage visibility in search engine results (part II)",0.444444444444,0.242936507937
81113DFF,"An Optimal Mechanism for Sponsored Search Auctions on the Web and Comparison With Other Mechanisms",0.40625,0.260714285714
7E5B718B,"A User Interests-Sensitive Ranking Algorithm Based on Rough and Fuzzy Set",0.258333333333,0.279166666667
59699732,"Semantic, Hierarchical, Online Clustering of Web search results",0.4375,0.453703703704
63EDEF7C,"‘Googling’ Terrorists: Are Northern Irish Terrorists Visible on Internet Search Engines?",0.402777777778,0.279365079365
7EEE652D,"The eGenVar data management system--cataloguing and sharing sensitive data and metadata for the life sciences.",0.416666666667,0.390679112554
801E5B07,"GoWeb: a semantic search engine for the life science web.",0.40625,0.284285714286
76F14E49,"Fine-Grained Image Search",0.402777777778,0.555555555556
7C5CD6B0,"Student vs. Search Engine: Undergraduates Rank Results for Relevance",0.383928571429,0.251247165533
7C7359C9,"MS Amanda, a universal identification algorithm optimized for high accuracy tandem mass spectra.",0.425,0.272850958565
594B6005,"Search Engines: Applications of ML",0.326388888889,0.355357142857
7672C7FE,"Interest-based personalized search",0.390277777778,0.625
7F6D3D22,"Estimating advertisability of tail queries for sponsored search",0.347222222222,0.31341991342
7F729D6A,"Suggesting Software Components for Reuse in Search Engines Using Discovered Knowledge Techniques",0.583333333333,0.321741221741
819BF817,"Auctioning Keywords in Online Search",0.402777777778,0.583333333333
18822A5A,"DESIGN WITH EMOTION: IMPROVING WEB SEARCH EXPERIENCE FOR OLDER ADULTS",0.40625,0.309444444444
8111C4FF,"One Search Engine or Two for Question-Answering",0.326388888889,0.535714285714
7E655972,"A k-Nearest-Neighbour Method for Classifying Web Search Results with Data in Folksonomies",0.569444444444,0.477777777778
7CF71B8F,"A Specialized Search Assistant for Learning Objects",0.410714285714,0.394047619048
7FCE98D8,"A Framework for Intelligent Data Acquisition and Real-Time Database Searching for Shotgun Proteomics",0.425,0.268344155844
76849C63,"CONSENTO: a consensus search engine for answering subjective queries",0.402777777778,0.302857142857
7EF003A7,"Internet-Scale Code Search",0.346428571429,0.571428571429
7FF3B599,"Comparing performance metrics in organic search with sponsored search advertising",0.40625,0.432463369963
7DF75D3B,"Identifying task-based sessions in search engine query logs",0.375992063492,0.27201964702
7A508772,"Friends, romans, countrymen: lend me your URLs. using social chatter to personalize web search",0.577777777778,0.331537598204
7B75A93E,"A knowledge-based search engine to navigate the information thicket of nanotoxicology",0.39375,0.332857142857
79C66173,"A search engine for the global PKI",0.402777777778,0.535714285714
68465BF4,"Mining world knowledge for analysis of search engine content",0.402777777778,0.281632653061
76B7FC01,"Semantic sentence structure search engine",0.40625,0.324107142857
7D7555AC,"Improving Web search using image snippets",0.611111111111,0.508888888889
803B832B,"Large-scale visual search based on voting in reduced pose space with application to mobile search and video collections",0.5,0.417724867725
7589E322,"Comparing rankings of search results on the web",0.379464285714,0.319444444444
815B2D24,"Comparison of three vertical search spiders",0.402777777778,0.411111111111
76D98D23,"Who uses web search for what: and how",0.569444444444,0.722222222222
762B0252,"Large-scale validation and analysis of interleaved search evaluation",0.402777777778,0.391666666667
7DF01EE5,"Assessment for Ontology-Supported Deep Web Search",0.40625,0.408333333333
7C781BDE,"Motivation for using search engines: A two-factor model",0.375,0.332251082251
78E8BC35,"Evaluation and optimization of the catalog search process of e-procurement platforms",0.326388888889,0.301388888889
81151B04,"Link analysis using time series of web graphs",0.383333333333,0.29623015873
