Paper ID,Title,Sim1,Sim2
17A49415,"特集1 米国発! IP電話に規制は必要か 電話網の維持や緊急電話など日本も再考が必至",0,0
7C9ACB76,"Spectral Analysis of Speech Quality in VoIP for G.729A and AMR-WB Speech Coders",0.138737373737,0.15
7FDADB37,"Deterministic Edge-to-Edge Delay Bounds for a Flow under Latency Rate Scheduling in a DiffServ Network",0.13094017094,0.137301587302
7809B40B,"ACM SIGCOMM computer communication review",0.122222222222,0.131481481481
7D3C0069,"Application layer network performance evaluation of VoIP traffic on a test-bed with IPv4 and IPv6 LAN infrastructure",0.149126984127,0.133933080808
7F567AA3,"A teletraffic analysis of dial-up connections over PSTN",0.122222222222,0.145833333333
6089083E,"Fast RTP Detection and Codecs Classification in Internet Traffic",0.142222222222,0.125505050505
7FCD2434,"Providing Integrated Services over Low-bitrate Links",0.133737373737,0.159259259259
8146D496,"Voice over Wireless Mesh Networks: A Case Study in the Brazilian Amazon Region during the Rainy Season",0.169365079365,0.135549371264
81ACFEE2,"Commercial satellite applications for heterojunction microelectronics technology",0.147222222222,0.139583333333
75C477AF,"ProCompSys - Professional Computer Systems - IT@work! | 52428 Jülich : Aktuelles Bedrohungen 2007-04",0.165793650794,0.167989417989
7AD8FB94,"Effect of free bandwidth on VoIP Performance in 802.1lb WLAN networks",0.136753246753,0.113975468975
75EA54AE,"An architecture for residential Internet telephony service",0.155555555556,0.144444444444
5C40125B,"Reconstruction of missing speech packet using trend-considered excitation",0.13094017094,0.184116809117
7F4EF5D3,"Understanding the topology of a telephone network via internally-sensed network tomography",0.137777777778,0.149305555556
7F4E4B79,""NetPhone"-Reintegrating the net phone",0.112904040404,0.111111111111
8063BB22,"A two-stream approach for adaptive rate control in multimedia applications",0.137606837607,0.139365079365
7BA36750,"Telephone adapter for internet telephony systems",0.108261183261,0.113015873016
10730832,"Strengths and Weaknesses of using the Current Phone System of UIC as bases for Proposed VoIP",0.135793650794,0.155725623583
7D6F15F5,"Implementando un mecanismo contra telefonía en internet no solicitada basándose en identidad Session Initiation Protocol (SIP)",0.0985858585859,0.0947811447811
5ADB3FD1,"Servidor VoIP com sistema de segurança doméstica integrada de baixo custo",0,0
7EA234B3,"The design and implementation of SIP-B2BUA and its applications",0.101217948718,0.163888888889
5B9D6C11,"Um sistema de conferência centralizada com controle de posse da palavra para educação à distância.",0.0811854811855,0.0871212121212
80817A34,"Performance Evaluation of Multimedia Application QoS over Wireless and Wired IPv6 Networks",0.124444444444,0.140939153439
7D7E9D83,"A method of interconnection between private VoIP networks and PSTN",0.117606837607,0.100673400673
795C1B9E,"Design and implementation of telephone-initiated multimedia healthcare embedded system for senior residents",0.151904761905,0.147959183673
70C91F2F,"ANALISIS PENGARUH SOFT HANDOVER PADA MOBILE STATION TERHADAP KUALITAS LAYANAN VOIP DI JARINGAN UMTS",0.135793650794,0.121428571429
7BD20CB2,"Optimal path selection for file downloading in P2P overlay networks on MANETs",0.142777777778,0.122757335257
71E9EDD4,"Measurement and analysis of users' perception of QoS for IP telephony service",0.145793650794,0.161772486772
0A5A4085,"Advanced Consideration of a Caller Pre-Validation Against Direct Spam Over Internet Telephony",0.122626262626,0.100808080808
6D1B43D9,"Constructive approach in teaching of VoIP in line with good laboratory and manufacturing practice",0.166666666667,0.167063492063
7D756A61,"Issues concerning usability of 802.11 networks for real-time service transport",0.155793650794,0.166402116402
7E7B1C21,"Policy Analysis and Studies on a Model for Determining an Optimal VoIP Access Charge",0.114768368886,0.150444793302
0B0A4FB0,"Videoconference client for windows mobile",0.0989704739705,0.0982142857143
7C5CA314,"Performance Analysis of SCTP Protocol in WiFi Network",0.11595959596,0.116919191919
7105225D,"Nuevos modelos para el acceso universal de los servicios de telecomunicaciones en America Latina : lecciones del pasado y recommendaciones para una nueva generacion de programas de acceso universal para el siglo XXI - informe principal",0.115788655789,0.0919191919192
7F7F98F8,"Optimization of speech codecs on set of indicators of quality",0.122222222222,0.12095959596
5C691BA5,"On Steganography in Lost Audio Packets",0.297606837607,0.481481481481
84D95EE5,"Unified Communication 與 VoIP Cloud API 系統使用開放源碼的可行性分析",0.137606837607,0.155555555556
78D6CEE9,"Effect of the traffic shaping function of the EF class in a DiffServ queue architecture",0.135476190476,0.133395176252
809C38B4,"Carrier ethernet network control plane based on the Next Generation Network",0.125404040404,0.133238636364
798F8A8B,"Test environment for QoS testing of VoIP over LTE",0.0946897546898,0.0941798941799
8512677B,"Desarrollo de un sistema de multiconferencia inmersiva con audio 3D para móviles",0.0998290598291,0.0951178451178
742FFA42,"A convergence of wired and wireless over hybrid fiber coax",0.135793650794,0.116964285714
78966B55,"Consistency Techniques for Finding an Optimal Relaxation of a Feature Subscription",0.131753246753,0.139744514745
5CBF42C3,"Incoming traffic modeling of heterogeneous Public Safety Network",0.122222222222,0.105555555556
7EC25047,"Simulation and Analysis the Performance of AODV and DSR for VOIP and Video Conferencing Using OPNET",0.13094017094,0.180555555556
08D7F67A,"ENUM: Is It Time to Get Ready for",0.113181818182,0.263888888889
80EC65D2,"Virtual social clubs: meeting places for the Internet community",0.169848484848,0.142051282051
80CE367B,"Reducing International Roaming Call Costs with Multiple Mobile Phone Numbers",0.115788655789,0.111388888889
22E57252,"Output-Based Aid in Telecommunications: New Models for Universal Access in Latin America",0.123888888889,0.0951016576017
7FB47F83,"Demonstration of Call-to-Web Session Linkage System",0.126587301587,0.12003968254
5E654163,"What makes a killer application for the cellular telephony services?",0.140404040404,0.202777777778
80B83DD9,"A new approach to the implementation of VoIP for SOHO network",0.136031746032,0.130456349206
7CA37E24,"The use of FEC method for packet loss concealment for CELP based coders in packet networks",0.155404040404,0.148063973064
7B47F794,"Call progress time measurement in IP telephony",0.138975468975,0.144907407407
73273B9D,"QoS mapping of VoIP communication using self-organizing neural network",0.137606837607,0.188888888889
7EF6C3EE,"Tariff system design for IP conference communication solutions",0.138571428571,0.13281024531
16713723,"Voice Packet Processing Scheme for Voice Quality and Bandwidth Efficiency in VoIP",0.129126984127,0.109704184704
7B17814A,"VoP (voice over packet)",0.0998290598291,0.10101010101
17F80041,"高品質VoIPサービスを想定した超広帯域音声符号化技術(超高速モバイル通信時代のマルチメディアアプリケーション及び一般-((AVM)画像符号化,通信,ストリーム技術,及び一般/(MoMuC)パーソナルマルチメディア,モバイルP2P,モバイルコンテンツ))",0,0
7957CE5C,"Capacity Improvement of WDB Algorithm for Voice Service over WLAN",0.111212121212,0.125084175084
7F408129,"Demonstration of IPv6 Network Mobility in Aeronautical Communications Network",0.126178266178,0.11341991342
724F04C4,"A multicast communication system over Internet and its application",0.135793650794,0.160714285714
75DDFC37,"A study on XCAP client system for SIP-based IMPP services",0.130086580087,0.144345238095
7E35D569,"A Graphical Model Based Decoder for Recognition of Loss-concealed VoIP Speech",0.138737373737,0.159848484848
81062506,"Video telephony for end-consumers: measurement study of Google+, iChat and Skype",0.136666666667,0.15376984127
7833B9EB,"A new technique for improving quality of speech in voice over IP using time-scale modification",0.147222222222,0.171382189239
7D6F7D54,"Embedded node around a DSP core for mobile sensor networks over 802.11 infrastructure",0.129444444444,0.115614478114
58BE3F6C,"Analisa Keamanan Voice Over Internet Protocol (VOIP) (Studi Kasus PT. Ciptama Pancatunggal)",0.0930303030303,0.0954545454545
7FC14C44,"자기유사성을 고려한 VoIP 트래픽 생성 시뮬레이션 방법의 연구",0,0
784BBA24,"A Comparative Study of Voice Over Wireless Networks Using NS-2 Simulation with an Integrated Error Model",0.13094017094,0.157693001443
7475CECD,"Next generation intelligent network based on CORBA and agent technologies",0.155238095238,0.177777777778
74B1A3EB,"VoIP traffic in wireless mesh networks: a MOS‐based routing scheme",0.104444444444,0.101388888889
80E34427,"Satisfying Arbitrary Delay Requirements in Multihop Networks",0.122606837607,0.125694444444
84D7CB56,"Bezpečené propojení SIP serverů",0.0824675324675,0.1
7EFA283A,"Resynchronization of the Adaptive Codebook in a Constrained celp Codec After a Frame Erasure",0.293566433566,0.541666666667
7BB406E2,"Performance Measurements and Analysis of M/M/c Queuing Model Based SIP Proxy Servers in Local and Wide Area Networks",0.175,0.170679012346
60824BBF,"Diseño de la Infraestructura Común de Telecomunicaciones e implantación de las TIC en el CEIP "Plaça dels Països Catalans" de Lleida",0.0822843822844,0.1
7C23256F,"GSM and PSTN gateway for asterisk EPBX",0.0924553224553,0.0972222222222
7E801B69,"Cable systems and test trials with cable modems in Slovenia",0.135793650794,0.119501133787
5D51F83F,"Security concerns for cloud computing in aircraft data networks",0.104444444444,0.0970006184292
5CC5DA77,"Towards a Distributed Wireless VoIP Infrastructure 1",0.11303030303,0.0954545454545
7FB84D70,"Enhancing the Serviceability and the Availability of IMS-Based Multimedia Services: Avoiding Core Service Failures",0.132467532468,0.160365560366
80233CB7,"Interaction of RSVP and Mobile IPv6 Protocols: An Evaluation of Performance on Wireless Networks",0.135555555556,0.126725589226
32156BDA,"Enterprise network convergence: path to cost optimization",0.124273504274,0.154100529101
7B780758,"Distributed processing for the Load Minimization of an SIP Proxy Server",0.14126984127,0.130220573078
7E1437C7,"Construction of a robust multicast tree for application-level multicast",0.124848484848,0.128787878788
5E2CBFDB,"An architecture for virtualized home gateways",0.116666666667,0.148148148148
7D4F9CAA,"Quality of service monitoring: a timely idea",0.143888888889,0.140277777778
5E0CCB54,"Making Self-organizing Systems Secure",0.130079365079,0.238095238095
37BD069B,"A method for trustworthy SIP-based VoIP transmission",0.116753246753,0.121428571429
7F50F4F0,"Detection of time-varying directional flows in wireless networks",0.124444444444,0.103282828283
77B18A14,"QoE-based energy conservation for VoIP over WLAN",0.0985858585859,0.100673400673
7C5CB2EF,"An analytical study of precedence and QOE for voice service in degraded IP networks",0.137606837607,0.119853294853
2646350B,"Performance Monitoring of VoIP Flows for Large Network Operations( New Challenge for Internet Technology and its Architecture)",0.151111111111,0.127601410935
699065C3,"Effect of exponential averaging on the variability of a RED queue",0.129935064935,0.133441558442
5857DCF2,"Regulating Voice Over Internet Protocol: An E.U./U.S. Comparative Approach",0.116753246753,0.131168831169
8080DF4E,"Token bucket based statistical regulator for S-BIND modeled on-line traffic",0.124444444444,0.153703703704
7E3A305E,"다양한 환경에서 단말혼합 방법의 다자간 VoIP 운용",0,0
6E7945E8,"An advanced IN control architecture for providing VoIP supplementary services",0.148888888889,0.158333333333
2E227B6A,"Broadband telephoning : it's 'OK' now",0.2,0
7B3F4AFC,"The study of signal strength threshold for VoIP handoff process in 802.11g/n networks",0.147606837607,0.131084656085
80DFA45D,"Scheme to measure One-Way Delay Variation with detection and removal of clock skew",0.121363636364,0.121608946609
8445BA81,"14. Telefonia Corporativa (IP)",0.073486317604,0.0833333333333
79D5E11B,"Using Bayesian classifiers for estimating quality of VOIP",0.126111111111,0.184027777778
7C0F7E18,"Assigning service requests in voice-over-internet gateway multiprocessors",0.137777777778,0.152626262626
5B48E9B9,"Diseño del modelo de una red WIFI con servicios de telefonía ip con enlaces de larga distancia en zonas rurales como solución a la demanda de telefonía tradicional",0.12341991342,0.105339105339
7A22C0AD,"Application neuronetwork technologies in IP-telephony",0.101217948718,0.183333333333
74CF2EA9,"Experimentally derived interactions between TCP traffic and service quality over DOCSIS cable links",0.149444444444,0.137152777778
84F40BB8,"Deployment of a sustainable, production-grade VoIP system based on open source software component in an educational institution",0.333571428571,0.277551020408
3928CDE8,"Adaptive Time-segmentation for Packet Loss Channels",0.126178266178,0.117989417989
7BA858EE,"Using SysML to model complex systems for security",0.13246031746,0.183441558442
793661D3,"A society-integrated testbed architecture for peer-to-peer telecommunications",0.105555555556,0.145833333333
7C00F953,"Research and implementation based on SIP technique of web",0.171666666667,0.169318181818
05F7FFDC,"エコー監視と冗長経路による無線アドホック VoIP パケット保証方式の実装(セッション2)",0,0
13D0E24E,"Design of Internet Phon(VoIP) System for Voice Security based on VPN",0.149126984127,0.145083487941
7EA67314,"An efficient multichannel line echo canceler algorithm for PSTN and VoIP/VoDSL applications",0.132467532468,0.179166666667
79B59048,"Performance quality evaluation with VoIP traffic aggregation in Mobile Ad-Hoc Networks",0.137222222222,0.127314814815
5D0203E3,"Voice over Internet Protocol (VoIP) in the Emergency Department (ED): A Process Innovation",0.143975468975,0.123244216101
75C3EBCA,"Brave new world of telecom",0.133956043956,0.136904761905
7764A748,"The Top-level Domain Name Controversy",0.0974675324675,0.105303030303
7BDE3097,"Borderless education with high speed networks",0.147606837607,0.153703703704
02383409,"The NESPOLE! voIP multilingual corpora in tourism and medical domains",0.110404040404,0.0976430976431
263D8E47,"大規模バックボーンネットワークにおけるアプリケーション異常トラヒック検出方式の提案(セキュリティ,オーバーレイネットワーク,VPN,DDoS,ネットワークセキュリティ,P2P通信,ネットワークソフトウェア,一般)",0,0
7E0DBFEB,"Information and communications technology for poverty reduction. lessons from rural India",0.133162393162,0.117243867244
0585AD36,"Experimental test-bed for VoIP/VoWLAN voice quality measurements",0.153888888889,0.155303030303
2F0316E8,"A Comparative Study of Basic VOIP Infrastructure setup between Proprietary Devices and Open-Source Tools",0.135793650794,0.116753246753
5B583BC1,"Optimizing Soft Real-Time Scheduling Performance for Virtual Machines with SRT-Xen",0.140555555556,0.145833333333
7CA6DFAA,"Simplifying the Session Management Using SIP Single Port",0.168975468975,0.211904761905
0EA2ADAA,"Implementation of VoIP Module for Embedded System",0.140793650794,0.126322751323
81111097,"Supporting isochronous ATM traffic over IEEE 802.14 based HFC access networks",0.117606837607,0.166833166833
040A088E,"Estudio de factibilidad para la implementación de la tecnología Voip (voz sobre Ip) en la red de datos de la Universidad de Cuenca",0.0778846153846,0.0833333333333
7551025A,"Rapid and generalized identification of packetized voice traffic flows",0.126178266178,0.113997113997
7E4D3F7C,"Concept identification in object-oriented domain analysis: why some students just don't get it",0.138737373737,0.184585652443
7B381888,"WISECOM: A rapidly deployable satellite backhauling system for emergency situations",0.138015873016,0.12251984127
7C46BD71,"Fully Mobile Telephony Using VoIP Computer Software",0.115788655789,0.159722222222
7856B3A0,"Multiple descriptions coding in MELP coder for voice over IP",0.123585858586,0.113181818182
7D0168EE,"The ITU-T BICC protocol: the vital step toward an integrated voice-data multiservice platform",0.127222222222,0.120643939394
5D8CC0E2,"Conception of Next Generation Networks",0.117606837607,0.107407407407
804FBEC9,"Discrimination in NGN service markets: Opportunity or barrier to digital inclusion?",0.145555555556,0.158405483405
73DC2B7D,"An Executive's Guide to Information Technology: ICANN (Internet Corporation for Assigned Names and Numbers) to ISP (Internet service provider)",0.132222222222,0.127338772339
7E82442D,"Virtual Talk: a model-based virtual phone using a layered audio-visual integration",0.135555555556,0.175505050505
7D55FFCF,"Converged service provision in multidomain environments for the Future Internet",0.138181818182,0.160952380952
80488033,"A framework for improving the effectiveness of IT in employment screening",0.127606837607,0.131111111111
7DD3B132,"A new approach in using RAPTOR to evaluate reliability and availability for VoIP systems",0.144365079365,0.1548855906
769A434E,"Research on voice codec algorithms of SIP phone based on embedded system",0.149126984127,0.158792001649
615EA479,"Beyond technical documentation: users helping each other",0.130238095238,0.161255411255
7474D27C,"Security-auditing in a softswitch",0,0
5DC1DBF7,"Simulink based VoIP Analysis",0.114768368886,0.25
2DB19B2F,"A Study of Interception for a Spam Attack of VoIP Service",0.101217948718,0.171428571429
32E8FD5C,"Modeling and Simulation for Performance Evaluation of VoIP Spam Detection Mechanism",0.120555555556,0.123593073593
587BC95A,"Extension of a real time simulator to provide live displays, voice over IP and CPDLC for a global CNS system - [Not available for publication]",0.147142857143,0.119808802309
84A657DD,"Control of real-time multimedia applications in best-effort networks",0.137606837607,0.138492063492
0E0D2CF4,"Suitable IP Currency Quality Measurement Model in Ubiquitous Environment",0.153888888889,0.122095959596
75D3621B,"Packet Loss Concealment Using Dual-Side Waveform Similarity Overlap-and-Add",0.119829059829,0.141077441077
7306D72D,"The state of the art in Japan's telecommunications energy systems-Strategy for Total Power Management",0.150714285714,0.131235827664
7EE368A2,"Demonstration of robust multi-hop wireless packet broadcasts for moving vehicles using aggregated redundancy",0.138015873016,0.168456890332
75C444F3,"Using Captchas to Mitigate the VoIP Spam Problem",0.104848484848,0.156565656566
75DFD681,"Framework for Modeling Call Holding Time for VoIP Tandem Networks: Introducing the Call Cease Rate Function",0.122606837607,0.144047619048
7AE30272,"Active queue management with adaptive codec bit rate variation in WLAN for efficient VoIP performance",0.128975468975,0.112255205112
7EA300D6,"Header compression for VoIP over multi-hop wireless mesh networks",0.104444444444,0.0957886557887
0628FEBF,"Multicast Traffic Coordinator Framework for Real-Time Multimedia over Residential Networks",0.126178266178,0.109682539683
77ECCEEC,"Universal Service: Problems, Solutions, and Responsive Policies",0.143888888889,0.124810606061
7EB64D81,"Fujitsu's Internet business strategy: everything on the Internet",0.0912121212121,0.0935606060606
73BA1EAC,"Consumer devices: providing Internet capabilities for a mass audience",0.115793650794,0.119444444444
247E67AD,"A Case of VoIP Implementation at A Financial Services Office",0.141904761905,0.144345238095
0C0799B7,"PERANCANGAN DAN IMPLEMENTASI VOIP BERBASIS J2SE MENGGUNAKAN SIP, SDP DAN RTP",0.0824675324675,0.1
5E995878,"高品質VoIPシステム(アプリケーション品質,モバイルP2P,ユビキタスネットワーク,アドホックネットワーク,センサネットワーク,一般)",0,0
5C617AFE,"Enhancing the Blockage of Spam over Internet Telephony (SPIT) Using Adaptive PMG Algorithm",0.149126984127,0.14733044733
7752D71E,"SIPE-SAP: SIP extension for signaling attacks protection",0.123181818182,0.176893939394
776031BA,"Computing the Number of Calls Dropped Due to Failures",0.129696969697,0.161515151515
80385431,"Rapid fault detection and recovery for IP telephony",0.133737373737,0.110404040404
5F6F1C51,"A dynamic delayed acknowledgment mechanism to improve TCP performance for asymmetric links",0.144444444444,0.130892255892
760FFE2C,"Performance Analysis of Persistent Scheduling for VoIP Services in Mobile WiMAX Systems",0.149126984127,0.160238095238
58E12B4C,"IP telephony: an overview",0.0952525252525,0.10101010101
798E56B3,"In-home networking (Guest Editorial)",0.0900743700744,0.111111111111
79EAE2B8,"Study and Improvement of Wireless VoIP Performance in Multi-Service Environment",0.121038961039,0.119742063492
7A1CBD59,"A study on broadcasting and telecom convergence service usage index",0.122467532468,0.158603896104
8069A7E4,"IP next generation label switching",0.126178266178,0.151322751323
7BEC3E4A,"Bounds on end-to-end delay and jitter in input-buffered and internally-buffered IP networks",0.13595959596,0.114444444444
80DC50DE,"Kritiska framgångsfaktorer i teknologiska förändringstider",0.106111111111,0.125
7D4BB239,"Multi-channel reliability and spectrum usage in real homes: empirical studies for home-area sensor networks",0.170555555556,0.147757335257
788D22CF,"A Study on Compensation of Amplitude in Multi Pulse",0.0897893772894,0.104076479076
4311FD1A,"Budúcnosť Skype na iných platformách, ako tej od Microsoftu",0.071105365223,0.0769230769231
77565617,"Reduction in Computational Complexity of a Fast Encryption Algorithm for Application in Voice Oriented System",0.215793650794,0.192068001443
6ECBA7F1,"FSRC: fair and stable rate control - a TCP-friendly adaptive rate control scheme for packet audio applications",0.137606837607,0.118959435626
7C3EDE53,"Computationally efficient E-model improvement of MOS estimate including jitter and buffer losses",0.11468975469,0.142352092352
438E6A5A,"Rozwój sieci i usług telekomunikacyjnych w Obradach Krajowego Sympozjum Telekomunikacji KST'2000",0.106111111111,0.118055555556
5B683DFB,"Aspekt bezpieczeństwa wykorzystania technologii VoIP w centrach logistycznych",0,0
77D4D3AE,"Transmission Performance of VoIP Traffic over MANETs",0.1084004884,0.119742063492
813D3686,"Restoration measurements on an IP/MPLS backbone: the effect of fast reroute on link failure",0.161753246753,0.137698412698
767EE0D3,"A new approach to developing attack taxonomies for network security - including case studies",0.126178266178,0.162157287157
7FA858AF,"The notion of cost and quality in packet switched networks: An abstract approach",0.13246031746,0.125855493713
7C504F0B,"A java-enabled evolution",0.125086580087,0.166666666667
373777DD,"Wpływ języka na jakość transmisji mowy w sieciach IP",0.073486317604,0.0833333333333
76A617AB,"Echo cancellation in VoIP with improved least square lattice method",0.120404040404,0.140277777778
8032FC2E,"Nationwide All IP Network: Necessity and Possibility for BTTB PSTN",0.0998290598291,0.0976430976431
323C5FB0,"Protokół ZRTP : telekomunikacja wspomagana kryptografią",0,0
68B3F89D,"A study of subjective speech quality measurement over VoIP network",0.153888888889,0.159126984127
79DE4905,"A novel resource scheduling algorithm to improve TCP performance for 3GPP LTE systems",0.159126984127,0.152551020408
80E51A87,"Mini round robin: an enhanced frame-based scheduling algorithm for multimedia networks",0.137777777778,0.12358276644
755C7CEA,"ProCompSys - Professional Computer Systems - IT@work! | 52428 Jülich : Aktuelles Bedrohungen 2009-07",0.165793650794,0.167989417989
76A1278E,"Design of property management system server based on the Asterisk",0.149126984127,0.16335978836
766BFA7A,"Evaluating the NGN performance based on duplicate transmission of voice packets",0.126178266178,0.167201779702
7AC27CE0,"A Protocol Enhancement for IEEE 802.11 Distributed Power Saving Mechanisms No Data Acknowledgement",0.126111111111,0.120021645022
7AE25E2F,"Intelligent and Pervasive Multimedia Systems",0.144365079365,0.142857142857
7B2B67F8,"Implementation of G.729A on Embedded SIMD Processor",0.109551282051,0.104166666667
7B9A81A7,"Mobility-based traffic offload from WiMAX to WLAN",0.0998290598291,0.111111111111
7B609D95,"Application layer QoS for videotelephony",0.146904761905,0.183333333333
76398732,"Throughput fairness analysis of reservation protocols of WiMedia MAC",0.122308802309,0.118975468975
75AE37B8,"Order Statistics for Voice Activity Detection in VoIP",0.139134199134,0.145887445887
00DCAFE1,"Implementación de telefonía virtual IP en una empresa. Integración de servicios en escritorio remoto",0.0981017022193,0.0833333333333
84FC2BED,"Call capacity for voice over Internet Protocol on wireless mesh networks",0.104444444444,0.0963924963925
7B81AEF3,"Saving energy by means of dynamic load management in embedded multicore systems",0.149126984127,0.152698412698
1711578B,"仮想の"音の部屋"によるコミュニケーション・メディアvoiscapeの主観評価",0,0
11447970,"Distributed VoIP system for ad-hoc network with pseudo SIP server",0.124365079365,0.125661375661
59948662,"Decrypting the Fourth Amendment: Warrantless NSA Surveillance and the Enhanced Expectation of Privacy Provided by Encrypted Voice Over Protocol",0.116753246753,0.1158248002
751F9035,"Dynamic ECDH mechanism for enhancing privacy of voice calls on mobile phones over VoIP server",0.126111111111,0.106685774543
0393DE7C,"Framework of applying a non-homogeneous Poisson process to model VoIP traffic on tandem networks",0.147606837607,0.165079365079
