Paper ID,Title,Sim1,Sim2
7F4964CB,"The development of multimedia telecommunication systems that integrate ITU in CS 2/4 and implement TINA interfaces",0.131349206349,0.130291005291
7D3C3318,"Secure steganography in audio using inactive frames of VoIP streams",0.720833333333,0.866666666667
58756384,"Providing Enhanced Differentiated Services for Real-Time Traffic in the Internet",0.135555555556,0.144126984127
6C00986D,"QoS and channel aware packet bundling for VoIP traffic in cellular networks",0.126178266178,0.11746031746
79F28091,"Next Generation Mashups: How to Create my Own Services in a Convergent World",0.151904761905,0.188492063492
5E5FFF43,"EBAY’s Acquisition of Skype SA: Valuing the Voice of the Buyer",0.120233100233,0.1368997669
7922BB8E,"Fiber to 30 million homes",0.111666666667,0.145833333333
2533FCEE,"China's information revolution : managing the economic and social transformation",0.124829059829,0.144444444444
0E026290,"4.音声通信とIP技術 : 4-2 VoIPの標準化動向( 通信インフラとしてのIP技術)",0,0
43FD58A8,"Two-stage SPIT detection scheme with betweenness centrality and social trust",0.133571428571,0.105642135642
79EA4177,"Falling through the cracks",0.122455322455,0.208333333333
5A262068,"Adaptive source and channel re-encoding to maximize tandem link performance",0.31,0.318333333333
783307A5,"NGL02-5: Minutes Trading in The International Long-Distance Voice Market",0.138181818182,0.189393939394
6FB47643,"Cellular handset evolution - convergence of high-speed data services",0.155238095238,0.13746031746
321CE18B,"Flow management for voice/data transport over UDP/TCP based networks",0.144365079365,0.18253968254
2FC37911,"VeTo: reference manual",0.113181818182,0.107954545455
59E8ADCD,"Effect of pulse jamming on IEEE 802.11 wireless LAN performance",0.120793650794,0.115793650794
7CA0D416,"A comparative study of direct and indirect static peering for inter-domain sip calls",0.126753246753,0.114285714286
32E9610E,"Error control in Voice over IP over Bluetooth",0.105800865801,0.110227272727
7CCF32CB,"AegeanBoard: An Interactive Whiteboard Messenger for iPad",0.120788655789,0.125
7A76462E,"Hearing voices one packet at a time",0.11594017094,0.144255050505
31292C8D,"High Load Diminution by Regulating Timers in SIP Servers",0.13880952381,0.129437229437
5FB27FC4,"The research on the total delay and packet length of the trunking communication system based on IP network",0.155793650794,0.151058201058
75E4F932,"A cryptic encoding method for G.729 using variation in bit‐reversal sensitivity",0.188181818182,0.229848484848
7A9E7277,"On the performance of a hybrid intrusion detection architecture for voice over IP systems",0.145555555556,0.11939033189
178FDED8,"Re-Engineering Campus-Wide Internet Telephony Using Voice over Internet Protocol",0.117070707071,0.13771043771
045023A7,"Real-time, Head-tracked 3D Audio with Unlimited Simultaneous Sounds",0.117606837607,0.105555555556
7D961310,"User modeling and uplink scheduling in IP-based ITS network",0.129126984127,0.130158730159
800F8350,"Developments in telecommunications networks",0.113888888889,0.115740740741
5A07D0B0,"Building complex Voice over IP (VoIP) applications based on open-source",0.167222222222,0.181515151515
800AE044,"Competition in European Telecom Markets",0.159444444444,0.162037037037
795B8EA9,"Modeling of packet switching network with relative prioritization for different traffic types",0.122222222222,0.118376068376
67567A08,"Unify OpenStage IP-Telefone, HFA, SIP, VoIP | Teufel NET Österreich",0.0881818181818,0.1
7FB5FF4B,"Airborne Solutions for True Net-Centric Connectivity at the Tactical Edge",0.130238095238,0.126322751323
02D28E94,"Calliflower’s Online Meeting Solutions",0.102070707071,0.1125
818553E9,"Improving Speech Quality of VoIP by Packet Prioritization",0.136111111111,0.162037037037
7C6F6FBB,"Analysis of BT network based on active measurement",0.147606837607,0.215277777778
7E02284F,"Delay-sensitive application support in 802.11 based multi-hop network",0.147606837607,0.223611111111
7D56758B,"SIP 프로토콜 상태정보 기반 공격 탐지 기능을 제공하는 가상 프록시 서버 설계 및 구현",0.0824675324675,0.1
7A611E6E,"Validating feature‐based specifications",0.0848484848485,0.107954545455
253BFF5B,"A Novel Media Access Control Using Multiple Queues for Voice over IP in Ad Hoc Networks : D^2VTS Algorithm(Special Issue on Mobile Multimedia Communications)",0.149126984127,0.126224630071
784D2850,"A consolidated power saving architecture accommodating push-type applications for dual-mode devices",0.157777777778,0.157407407407
7A1A6E6B,"A Conversation with Cullen Jennings and Doug Wadkins",0.0906493506494,0.1
7C9D2578,"Comparison of VoIP and PSTN services by statistical analysis",0.114768368886,0.15873015873
322A9085,"Design and development of an user agent for streaming lectures - a South African case study",0.155238095238,0.151984126984
7EE6B27D,"Towards an optimal network survivability threshold",0.117606837607,0.105555555556
7C57CD05,"Using Optimized Virtual Network Embedding for Network Dimensioning",0.117606837607,0.177777777778
76353368,"Sicherheitsbetrachtungen zu SIP-basiertem Voice over IP unter Berücksichtigung der aktuellen Standardisierungsaktivitäten bei der IETF",0.0830303030303,0.0909090909091
73C305BB,"ATM over hybrid fiber-coax networks",0.117606837607,0.10101010101
793F813F,"Telecommunications and network convergence: theory and practice",0.141666666667,0.14246031746
7FF0A03E,"Implementation of an Internet video conferencing application over ATM",0.124444444444,0.125404040404
77525F70,"Building lawful interception capabilities: need for legal safeguards",0.155793650794,0.126753246753
0B1D87FA,"Video-Conferencing Set-ups Your Business Can Afford",0.0870707070707,0.116883116883
7BAEFA3C,"VOIP in a university call center",0.113737373737,0.122222222222
8081CCA9,"Broadband powerline communication an Indian experience",0.132467532468,0.15
005DFE03,"LTE上りリンクにおけるSub-frame Bundlingを適用したVoIPトラヒック無線リソース割当法に関するNRTトラヒック混在下における一検討(電波センシング・セキュリティ特集セッション,無線アクセス技術,一般)",0,0
789DFD67,"Virtual walled-garden model for IMS services provisioning",0.114768368886,0.138888888889
76607E34,"A method to compute the packet size and to transmit the packets for the efficient VoIP communication using the MIL-STD-188-220C",0.137606837607,0.169444444444
307E7010,"DOI: 10.1109/IAS.2008.29 Abusing SIP authentication",0.0941341991342,0.104099821747
810AF5CA,"Timing Attacks on a Centralized Presence Model",0.132467532468,0.127083333333
76B9E9E5,"The IEEE 1904.1 standard: SIEPON architecture and model",0.12,0.12037037037
7C8D0145,"A technique for classification of VoIP flows in UDP media streams using VoIP signalling traffic",0.333571428571,0.284188827046
7F2F14F1,"A packet snif.ng and synchronization technique to boost P2P satellite networks",0.118015873016,0.124873737374
7ABB6FE8,"mVoIP Service attack and authentication mechanism on a Smart work device",0.168571428571,0.168127705628
77ABBA7C,"The relevance of the CLP measure of a VoIP system with Regard to QoV.",0.118015873016,0.111219336219
7FB7F050,"QoS-aware Active Queue Management scheme for multimedia services",0.121515151515,0.125324675325
8165FDC9,"Design validation of service delivery platform using modeling and simulation",0.147222222222,0.168204365079
81EE4851,"Voice Over Internet Protocol (VoIP) And One University Application",0.118181818182,0.116363636364
5F61B052,"Lightweight peer-to-peer secure multi-party VoIP protocol",0.104848484848,0.0909090909091
612CCD10,"The Iridium Communications Systems",0.112157287157,0.114959114959
624A8637,"Diseño de una infraestructura de telecomunicaciones municipal",0.2,0
7EC2495A,"Evaluating coverage quality through best covered pathes in wireless sensor networks",0.134444444444,0.155050505051
7FEDA56F,"Peer-to-Peer SIP Features to Eliminate a SIP Sign-Up Process",0.142467532468,0.220833333333
7EFCD05A,"Identifying Skype Traffic by Random Forest",0.11094017094,0.153703703704
5D4F8348,"Assessment of VoIP network using an R-value embedded simulation model",0.13094017094,0.15867003367
5E990FA6,"VoIP 망에서의 QoS 성능측정에 관한 연구",0,0
5AB0CE08,"Development of interactive voice response models based on IP-PBX Asterisk",0.126111111111,0.137836700337
047FE1B1,"Adaptive optimization schemes for mobile VoIP applications Battery life and call quality aspects",0.143888888889,0.128052503053
7954BD6D,"Universal service in an IP‐enabled NGN environment",0.132467532468,0.15
5F69858D,"IMPLEMENTASI SER (SIP EXPRESS ROUTER) SEBAGAI LOCAL GATEWAY PADA JARINGAN VOIP BERBASIS SIP",0.11873015873,0.107407407407
7FDDE92E,"Performance analysis of IP paging protocol in IEEE 802.11 networks",0.113162393162,0.108990546491
7EB51308,"IP and telecommunication integration: de jure and de facto standards have entered a new era",0.142777777778,0.178968253968
7DC2717F,"GSM to G.729 speech transcoder",0.099696969697,0.166666666667
7FCAA4B4,"Assessment of user behavior and QoE in multi-view video and audio IP transmission",0.129829059829,0.135642135642
79B961F7,"Evaluation of popular VoIP services",0.121515151515,0.166666666667
7B29D4FC,"Packets in peril [voice over IP security issues]",0.116197691198,0.10937950938
7E1CBFA6,"A Practical Solution for Delivering Voice over IP",0.120555555556,0.110524891775
7B525CF6,"Security Analysis of Identity Based Cryptography and Certificate Based in Wimax Network Using Omnet++ Simulator",0.137777777778,0.176515151515
7F7530A4,"An i-mode portable healthcare monitor",0.103566433566,0.116666666667
782B99FB,"Techno-Economic Analysis of the Open Broadband Access Network Wholesale Business Case",0.13094017094,0.117693417693
75DC8621,"Web Services Methods for Communication over IP",0.163333333333,0.15
0F7A69E7,"MyGlobalTalk BlackBerry Beta 2.0 Pre-release Offers free $20 credit | Gear Live",0.125800865801,0.139393939394
79059BCE,"Real-Time Communications in the Web: Issues, Achievements, and Ongoing Standardization Efforts",0.188333333333,0.153114478114
7AC489A8,"Studying the effect of transmission rate and packet size parameters on VoIP performance",0.140324675325,0.142899114774
8021AF33,"Visualizing remote voice conversations",0.110649350649,0.119191919192
7D1B19EB,"The intelligent broadband access network",0.117606837607,0.0940170940171
8091FF07,"A Virtual Multiple Terminal Scheduling Scheme in the Infrastructure Based Wireless LAN to Enhance the VoIP Capacity",0.129696969697,0.138501082251
7D782A07,"Destination buffering for low-bandwidth audio transmissions using redundancy-based error control",0.138571428571,0.180952380952
7D43EA76,"Asymmetric channel cooperative compression",0.113122710623,0.121428571429
0AB52C29,"The session initiation protocol (sip): a key component for internet telephony",0.124444444444,0.097113997114
7DF2F542,"Economics of network pricing with multiple ISPs",0.117606837607,0.0883190883191
75BCEB86,"Diffusion of VoIP in Chinese large enterprises: the cases of Air China and Harvest Fund",0.145086580087,0.128637566138
72CFB05B,"A scheduling algorithm for relative delay differentiation",0.125800865801,0.131060606061
24D62E04,"Why Good Technologies Disappoint",0.114768368886,0.183333333333
302C1850,"IP Telephony: The Total solution guide",0.126111111111,0.109006734007
83276B2D,"Provision of IPTV on Optical Fibre Networks",0.123888888889,0.102513227513
79C7FBED,"Taking advantage of real-time collaboration tools",0.135793650794,0.154464285714
7AF1D13F,"Development of a MOS estimation model for G.729 using listening-opinion tests with Thai speech referring to packet loss effects",0.125800865801,0.134086900754
5E299563,"BUILDING COOPERATION IN VOIP NETWORK THROUGH A REWARD MECHANISM",0.130555555556,0.150555555556
771CE0D7,"A self learning model for detecting SIP malformed message attacks",0.143888888889,0.159798534799
85440EAD,"〈속보논문〉 VoIP 서비스를 위한 통합 패킷 스케줄링",0,0
7ACFF012,"Speech quality as a function of IP network performance",0.122222222222,0.127777777778
7867702B,"Indoor propagation model in 2.4 GHz with QoS parameters estimation in VoIP calls, considering different types of walls and floors",0.140555555556,0.11339031339
77C19595,"Determination of time domain mitigation parameters for coexistence of WiMedia and WiMax systems",0.129126984127,0.116209584067
792330D4,"An ALG-Based NAT Traversal Solution for SIP-Based VoIP",0.103888888889,0.1125
81A3CA9E,"Technology: Tools and Applications of Technology",0.123888888889,0.164583333333
7BCFE460,"Blending of external applications with advanced telephony services in the IP Multimedia Subsystem (IMS)",0.144444444444,0.140476190476
6713A56C,"The Vizzavi joint-venture: an exogamic marriage between Vivendi and Vodafone as a way of entering the e-economy",0.117606837607,0.175925925926
7CB84898,"A VoIP SPAM reduction framework",0.0885664335664,0.0997474747475
7ED5131C,"A case study of an approach to the deployment of ATM and IP into an international telephony network",0.144444444444,0.12812950938
806F3565,"Wireless IP network architecture for cdma2000",0.12,0.115277777778
7B62D5BB,"Effect of Speech Activity Detection in IEEE 802.11 Wireless Networks",0.16246031746,0.15747955748
221E71B5,"米国 制度・政策 1996年電気通信法成立10周年--新たな通信法成立へ向けて",0,0
7F81BC5C,"Effect of Triangular Routing in Mixed IPv4/IPv6 Networks",0.131753246753,0.126984126984
7DE03CF5,"Fairness in Multi-Player Online Games on Deadline-Based Networks",0.147606837607,0.148148148148
7B74BADB,"Cloud based low cost educational robot",0.121111111111,0.161616161616
0E54377E,"Technologische, organisatorische und wirtschaftliche Konzeption für die Sprach-Daten-Integration auf der Basis von Voice over IP an der Technischen",0.106178266178,0.121338383838
7D48B34E,"User Acceptance of Virtual Worlds",0.140793650794,0.126984126984
5D4ADE90,"Diseño e implementación de un sistema de distribución automática de llamadas entrantes (acd) para un callcenter",0.0911732711733,0.0972222222222
620342D0,"Performance of VoIP over IEEE 802.11G DSSS-OFDM Mode with IEEE 802.11E QOS Support",0.129829059829,0.162037037037
724791A0,"End-to-end performance evaluation of internetworked ATM LANs",0.129696969697,0.120643939394
170AF60B,"Rural connectivity options for microfinance institutions : a technical note",0.117606837607,0.0928418803419
7A581C2A,"Next-generation wireless data services: architecture and experience",0.133333333333,0.128888888889
807AEB6C,"Simple IP network based on QoS free concept",0.118888888889,0.143737373737
80477497,"Future applications and the Aeronautical Telecommunication Network",0.149444444444,0.136805555556
5985987D,"Authentication threats in PSTN-VoIP architecture using multi-service gateways",0.143571428571,0.168975468975
7F49DBFB,"Analysis of control and multimedia real-time traffic over SIP and RTP on 802.11n wireless links for utilities networks",0.137777777778,0.110989010989
7CE9AFAC,"Business mobile - Subject - Off the hook",0.109696969697,0.0909090909091
7A74ECAC,"Designing attacks on SIP call set-up",0.126753246753,0.15
2D15782F,"reliable data delivery in",0.119829059829,0.111111111111
7C7679DD,"Low bit-rate frequency extension coding",0.110649350649,0.119191919192
7B5BE88C,"A link adaptation scheme for improving voice quality and overall throughput over WLANs",0.141666666667,0.118907828283
78231A12,"Internet telephony in India",0.0905108780109,0.107407407407
7F820C32,"QoS in IEEE 802.16e for VoIP and Video with Mechanism of Soft Handover FBSS in Highway",0.132222222222,0.115277777778
012E1D17,"Loop Qualification for VDSL2",0.0830303030303,0.0909090909091
7574E03E,"VoIP Applications over WLAN with Multistage Interference Cancellation Smart Antennas",0.122222222222,0.109018759019
066AA18B,"EVALUATION OF AN EFFICIENT APPROACH TO PROVIDE QOS TO VOIP",0.121515151515,0.169841269841
802B61EC,"Performance of a Multi-Interface based Wireless Mesh Backbone to support VoIP Service Delivery",0.136363636364,0.172127525253
7619C15F,"Enhanced lossless coding tools for prediction residual",0.309444444444,0.329861111111
7D573B27,"Bandwidth-Conserving Real-Time VoIP Teleconference System",0.131178266178,0.113095238095
7F599B69,"Interworking among intelligent networks and different networks: service control interfaces and their applications",0.142606837607,0.141203703704
6C7EB246,"Telephony acoustics at Mitel",0.0900743700744,0.0912698412698
7B4C0461,"Service quality, service value, customer satisfaction and behavioural intentions of internet telephony",0.149444444444,0.123053181387
66216547,"In Rollout Under Open Competition And In Multi-Operator Enviroment, Case Private Telco's In Implementation",0.126178266178,0.112599206349
8008C1B2,"Implementation of wideband VoIP middleware using embedded systems",0.140793650794,0.191964285714
16DBE5D7,"PHS高速化技術 1Mビット/秒への高速化を狙う バックボーンIP化で音声定額も",0,0
7A0B22D5,"A VoIP enabled cooperative network for agricultural commerce in Amazon Peru",0.139682539683,0.145238095238
7D94FCD1,"Adaptive polling MAC schemes for IEEE 802.11 wireless LANs",0.111515151515,0.0916666666667
71C71012,"Management, monitoring and multimedia services on embedded systems",0.149126984127,0.144047619048
78B81A0B,"SPCp1-01: Voice Activity Detection for VoIP-An Information Theoretic Approach",0.164273504274,0.153823953824
0A405F63,"An improved medium access control protocol for real-time applications in WLANs and its firmware development",0.155793650794,0.112005355755
7E0C5C48,"A bit-rate/bandwidth scalable speech coder based on ITU-T G.723.1 standard",0.138737373737,0.184027777778
7A21DE9B,"Improving the VoIP performances during vertical handovers between WiMAX and WLAN",0.12803030303,0.141477272727
7C2FF878,"Wireless Communication's Role in Patient Response Time: A Study of Vocera Integration with a Nurse Call System",0.158571428571,0.141005291005
7885C41A,"Study of SIP protocol through VoIP solution of “Asterisk”",0.11246031746,0.114691558442
75DEB459,"Packet loss replacement in voip using a recursive low-order autoregressive model-based speech",0.13094017094,0.167222222222
783CB907,"Speaker Recognition and Speaker Characterization over Landline, VoIP and Wireless Channels",0.111197691198,0.108286951144
7C701953,"A Pre-registered Handoff Scheme in IEEE 802.11r Wireless Local Area Networks",0.145,0.116468253968
807632F0,"Cameron and Tyler Winklevoss on the Future of Bitcoin",0.0998290598291,0.0972222222222
7545ECF5,"The realpush network: a new push-type content delivery system using reliable multicasting",0.138015873016,0.161904761905
24599AAE,"Diseño de una red para proveer servicios de voz y datos en la ciudad de Guayaquil usando el acceso inalámbrico del estándar wimax",0.110649350649,0.0916666666667
44D7F57D,"SIMULASI DAN ANALISIS KINERJA KOMUNIKASI VOIP DENGAN ENKAPSULASI DATA MENGGUNAKAN VPN",0.0998290598291,0.111111111111
8029EBD4,"Telecommunications development in Slovenia",0.106111111111,0.115740740741
8066B3B0,"SCTP-based handoff based on MIH triggers information in campus networks",0.127222222222,0.141997354497
74349FF4,"Evaluation of DiffServ-aware constraint-based routing schemes for multiprotocol label switching networks",0.119511599512,0.140793650794
7F348D39,"Performance of RAB Mapping and ROHC for the Support of VOIP over UMTS",0.129829059829,0.162037037037
01C09116,"Design of Multiple VoIP Service Networks for P2P Network Environments based on Portable Internet",0.142222222222,0.160317460317
02BED8D5,"MAC AND APPLICATION LAYER PROTOCOLS FOR HIGH PERFORMANCE NETWORKING",0.166904761905,0.133181818182
5DBE4396,"Denial of Service Issues in Voice Over IP Networks",0.119829059829,0.13595959596
7F650400,"Analysis of IEEE 802.11e for Delay Sensitive Traffic in Wireless LANs",0.135555555556,0.115555555556
065C0514,"PRACTICAL ESTIMATION OF VOIP QOS BASED ON CORRELATED ANALYSIS OF TRANSPORT PROTOCOL IMPAIRMENTS AND PERCEPTUAL SPEECH QUALITY",0.151904761905,0.154220779221
863AAE2A,"Distributed 3D Audio Rendering",0.0953449328449,0.155555555556
5A2D9801,"波形複製におけるピッチ変動を考慮したVoIPにおけるパケット損失の一隠蔽法(VR,ヒューマンファクタ,一般)",0,0
6F95CDD5,"Enhanced authentication services for Internet systems using mobile networks",0.149126984127,0.164622414622
75C71E0A,"Optimising no acknowledgment policy on WLANs supporting voice over internet protocol",0.11303030303,0.130871212121
71A7F1EB,"Secure Framework for SIP-based VoIP Network",0.0998290598291,0.0972222222222
2D6376FD,"System telekomunikacyjny Hicom 300 E w sieciach konwergentnych",0.10936008436,0.121693121693
863D56ED,"An Introduction to Standards-Based VoIP",0.0752380952381,0.111111111111
7B641662,"Voice over MPLS compared to voice over other packet transport technologies",0.149126984127,0.142075517076
80CFA9EC,"Tree Based Flooding Protocol for Multi-hop Wireless Networks",0.122222222222,0.136195286195
774A2F2A,"Challenges in Implementing a SIP-Based Application Server",0.1268997669,0.1625
639373DA,"IP Telephony: Challenges for NTT's Fixed-line Telecom Business",0.105404040404,0.106755050505
80FB13B6,"Mobile application platform strategies: business model engineering for the data intensive mobile age",0.149444444444,0.121433080808
7589F81F,"SIP Back to Back User Benchmarking",0.130238095238,0.117989417989
5881742D,"Actualización de aplicaciones y migración de plataformas de voz sobre ip en una institución financiera bursátil",0.073486317604,0.0833333333333
7563945E,"Multipath routing with adaptive playback scheduling for Voice over IP in Service Overlay Networks",0.149444444444,0.136016414141
7EF04CEF,"Wireless workgroup teleconferencing: design issues with WLAN IP telephony, PCS, and WPBX technologies",0.115555555556,0.111560044893
229350C4,"Basic trust calculation to prevent spam in VoIP network based on call duration: single hop consideration (インターネットアーキテクチャ)",0.137606837607,0.166939233606
75B1A5CE,"Analysis of routing protocols of VoIP VPN over MPLS network",0.11594017094,0.133838383838
76A8A89F,"Casual Multi-user Web Collaboration by Lowering Communication Barriers",0.186666666667,0.191904761905
77A86FEB,"Speech over VoIP Networks: Advanced Signal Processing and System Implementation",0.16380952381,0.13955026455
76B58950,"Speech enhancement by speech intelligibility index in sensor network",0.125,0.124494949495
7D1DB227,"What designers of wafer scale systems should know about local sparing",0.130079365079,0.171825396825
79F2EF0B,"Dynamic management of Internet telephony servers: a case study based on JavaBeans and JDMK",0.130793650794,0.153287981859
75C98841,"An early application of the Bell Labs Security framework to analyze vulnerabilities in the Internet telephony domain",0.140404040404,0.134624017957
7E10CE13,"Design and development of the intelligent SSW and SIP application server system",0.155793650794,0.135257335257
7D67CEF9,"A VoIP-based Dynamic Password Distribution Scheme",0.108181818182,0.0914141414141
7E67B8E0,"Fuzzy Trust for Peer-to-Peer Systems",0.133975468975,0.121428571429
7F3AC5DA,"Schedulability analysis of flows scheduled with FIFO: application to the expedited forwarding class",0.126178266178,0.157093253968
79A85209,"Assessing Voice Quality of Ground-to-Air Radio Networking System",0.129365079365,0.131753246753
5CDED434,"Developing VoIP Router honeypots",0.106507936508,0.146011396011
806B7842,"SIP as an enabler for convergence in future wireless communication networks",0.142222222222,0.130793650794
7D6079DE,"Secure Human Communications Based on Biometrics Signals",0.126111111111,0.155167748918
7AEB3AB1,"Voice over internet protocol with prepaid calling card solutions",0.120555555556,0.123585858586
5D17C30D,"Χωρητικότητα φωνής (Συνδέσεων VoIP) Ασυρμάτων IEEE 802.11 τοπικών δικτύων",0,0
7770FA2B,"Optimizing Voice over Multi-protocol Label Switching (VoMPLS)",0.110086580087,0.135822510823
7ACF8A26,"WLAN MAC Layer Prediction/Collision Avoidance Mechanism Based on Service Attribute and Cross-Layer Control",0.145404040404,0.158116883117
5C551E3A,"A flexible, module-based SoC-approach for low-power VoIP-applications",0.2,0
5B7247AC,"アドホックネットワークにおける低遅延ルート切り替え方式に関する一検討( モバイルネットワーク, アドホックネットワーク及び一般)",0,0
75FB0D76,"Performance Analysis of IMS Network: the Proposal of new Algorithms for S-CSCF Assignment",0.13094017094,0.141203703704
7F1A0EA3,"Presence based network topology tracing system for VoIP networks",0.135793650794,0.158701814059
79208D58,"MPEG-4 low-delay general audio coding",0.297606837607,0.555555555556
7C39B2CA,"3G Technology is Integrating Network Market",0.147606837607,0.205555555556
5D1B662F,"인터넷전화 서비스의 향후 패러다임 제안",0,0
789BA2E2,"Comparative analysis of routing protocols for VoIP in a Wireless Mesh Backbone: a user perspective",0.146904761905,0.121490414348
757F8809,"Dynamical management of dejitter buffers based on speech quality",0.137222222222,0.173571428571
30DBAB1D,"Tańszy głos w sieci",0.0911732711733,0.111111111111
79ACEA59,"Unified communications in universities information environments",0.117606837607,0.100673400673
8055C251,"Experiment with the validation of WAP systems",0.122546897547,0.136904761905
6E6806EC,"Multi-service aspects of universal personal telecommunication",0.122606837607,0.100961538462
799F115B,"Projects Improving QoS of the Voice Real-Time Data Based on IP Network",0.147606837607,0.168542568543
74904B7C,"Low cost system monitoring applied to consumer PC platforms",0.135238095238,0.158286951144
