Paper ID,Title,Sim1,Sim2
7E7CB4C2,"States Class Forming Optimization Task for Estimating of QoS",0.140793650794,0.163624338624
7F10DA84,"Implementing QoS in SIEPON",0.166666666667,0.25
7D881422,"Guest Editorial Price-Based Access Control and Economics of Networking",0.100404040404,0.0912393162393
79532BE1,"Capacity Analysis of VoIP Service in Cognitive Radio System",0.155793650794,0.140086580087
26606F83,"West Bank and Gaza telecommunications sector note : introducing competition in the Palestinian telecommunications sector",0.138571428571,0.109874252731
808D49CA,"Experiences in Online Teaching and Learning",0.116753246753,0.114285714286
7C3B487C,"Requirements and Service Scenario for High Quality Mobile VoIP Service in Convergence Network",0.143888888889,0.1410430839
779BCF57,"Hybrid Window and Rate Based Congestion Control for Delay Sensitive Applications",0.188888888889,0.181240981241
7DDBC9CC,"Towards characterizing cloud backend workloads: insights from Google compute clusters",0.119134199134,0.156944444444
77FB42D1,"Demonstrator for voice communication over LTE",0.112467532468,0.127272727273
22B4FA5D,"ProCompSys - Professional Computer Systems - IT@work! | 52428 Jülich : Kontakt Danke",0.165793650794,0.167989417989
755590E2,"A Fast Failure Detection and Failover Scheme for SIP High Availability Networks",0.13094017094,0.108585858586
7CF954A0,"Methods for lawful interception in IP telephony networks based on H.323",0.133015873016,0.159682539683
17DD1C34,"シミュレーションと実測データによるVoIP品質に関する考察(MoMuC研究会学生特別セッション,移動通信ワークショップ)",0,0
07CAE60D,"VoIP SPAM and a defence against this type of threat",0.116197691198,0.108922327672
7C095933,"Performance evaluation of QoE in VoIP traffic under fading channels",0.113162393162,0.129126984127
5855C1E8,"ProCompSys - Professional Computer Systems - IT@work! | 52428 Jülich : Kontakt",0.165793650794,0.167989417989
7933B8FC,"Using a novel blending method over multiple network connections for secure communication",0.143888888889,0.163425925926
78B14F59,"Voices, I hear voices [VoIP security]",0.104848484848,0.130681818182
588C8B10,"VoIP with IPv6 packet transmission over WLAN",0.111197691198,0.114959114959
809D9059,"Toward an architecture for monitoring private clouds",0.132063492063,0.159259259259
7FBDA2FD,"Triple-play switchboard IP phone business achievement based on sip call",0.148888888889,0.144002525253
7BB54555,"Unitary beamforming techniques enhancing VoIP call admittance capacity",0.114545454545,0.10031968032
78EB710A,"An ant based multi constraints QoS aware service selection algorithm in Wireless Mesh Networks",0.142222222222,0.147660364327
0F67F957,"NETWORK TOMOGRAPHY: A REVIEW AND RECENT DEVELOPMENTS",0.13094017094,0.118055555556
79990888,"Grading based identity negotiation in P2P Services",0.13094017094,0.180404040404
4590BDEC,"Voive over IP Ready? Bereit für VoIP? | Teufel NET Schweiz",0.110653594771,0.105555555556
753040DE,"Congestion-based automatic calling for improving call establishment in VoLTE",0.131111111111,0.168055555556
7F674A4E,"Employing IP-Based Technologies for Pervasive Connectivity and Interoperability",0.13094017094,0.177777777778
7DC2CC23,"Adapted optimization criterion for FDM-based DMT-ADSL equalization",0.13094017094,0.168055555556
0C93E0AC,"Development of the Integrated Multimedia IP-PBX System",0.144365079365,0.132275132275
76888D1C,"CitiTime: a system for rapid creation of portable next-generation telephony services",0.165793650794,0.167658730159
0AA1C8A5,"ステガノグラフィを用いたVoIPにおけるパケット損失の一隠蔽法(光ネットワーク制御技術, IPサービスとそれを支えるネットワーク技術, 一般)",0,0
775C8F96,"A knowledge-base tool for testing VoIP gateway",0.109126984127,0.14537037037
80618550,"A mailbox-based scheme for improving mobile IP performance",0.123181818182,0.135416666667
80AD95F8,"Factors Affecting Audio and Text-Based Communication Media Choice in Global Software Development Projects",0.165793650794,0.143257976591
7D9CAC7C,"Design and implementation of information gathering tool for VoIP collaboration",0.125,0.130291005291
7217789F,"Development of an Internet home control system",0.126349206349,0.130158730159
7F425D53,"The NetScript active network system",0.135793650794,0.126984126984
5D905161,"Voice over wireless LAN via IIEE 802.16 wireless MAN and IEEE 802.11 wireless distribution system",0.138571428571,0.109794372294
75F48665,"A New Distributed Application and Network Layer Protocol for VoIP in Mobile Ad Hoc Networks",0.166904761905,0.139971139971
14EFD180,"ネットワーキングの現場ノウハウ IP電話導入のためのネットワーク設定法(3)機器を2重化し通話障害を避ける LAN構成の管理にも気を配る",0,0
77DF8E01,"The Design of Network Communication System for Smart Phones Based on VoIP",0.155793650794,0.177513227513
7949F32C,"Slow and Steady: Modelling and Performance Analysis of the Network Entry Process in IEEE 802.16",0.147606837607,0.146494708995
7F1F6136,"A new methodology to adapt SIP Protocol for voice traffic transported over IP Network",0.117606837607,0.128755812089
7D85D8F7,"DLB: a novel real-time QoS control mechanism for multimedia transmission",0.13246031746,0.127678571429
7E99061E,"Subjective audio quality over a secure IEEE 802.11n network",0.126111111111,0.115740740741
78B9C1D5,"Automatic multimedia session migration by means of a context-aware mobility framework",0.13094017094,0.118716931217
7C9046FB,"Intel VoIP over WLAN architecture",0.105555555556,0.166666666667
810CE7AE,"Standardization activities in the ITU for a QoE assessment of IPTV",0.139134199134,0.174747474747
807CBD1F,"HSDPA delay analysis in live networks using VoIP traffic from end user perspective",0.155238095238,0.153968253968
7652A7AC,"Lessons learned on the usage of call logs for security and management in IP telephony",0.152222222222,0.148504890172
15C9628E,"移動体通信網を拡張するIP網収容アーキテクチャの一検討(SIP,ネットワーク制御,QoS,ルーティング,マルチキャスト及び一般)",0.0824675324675,0.1
8078896D,"QoS optimization and performance analysis of NGN",0.099696969697,0.134259259259
74E5ADD0,"Multi-agent system for monitoring the quality of speech in computer networks",0.140476190476,0.142791005291
7C9EAA2A,"Guest Editorial Broadband IP Networks via Satellites&#8212;Part II",0.119444444444,0.106481481481
7D164187,"Downlink mixed-traffic scheduling with packet division multiplexing",0.113162393162,0.118233618234
7A645373,"Kingston Borough council has chosen Internet telephony to cut communications costs",0.128975468975,0.148515512266
5FF055CF,"Beyond POTS [electricity generation/selling control]",0.102626262626,0.107407407407
7D5B55E4,"Factors affecting the adoption of Voice over Internet Protocol (VoIP) and other converged IP services in South Africa",0.150555555556,0.155519480519
25A0257D,"Capacity of VoIP over HSDPA with Frame Bundling(Wireless Communication Technologies)",0.32,0.313737373737
7B5B06F5,"Ukrywanie informacji w ruchu telefonii IP",0.0924553224553,0.0972222222222
757E9723,"Successful development and test of SATCOM On-The-Move (OTM) Ku-band Kaband Systems for the Army's Warfighter Information Network-Tactical (WIN-T)",0.138015873016,0.103968253968
7E2CE5F7,"High-bandwidth interface for multimedia communications over fixed wireless systems",0.144365079365,0.125405844156
7C020EDF,"A New Paradigm of CAC Dimensioning for VoIP Traffic over Wireless Access Networks",0.117606837607,0.0980108780109
7F59CDEC,"Policy Analysis and Studies on a Model for Determining an Optimal VoIP Access Charge",0.114768368886,0.150444793302
80A85C65,"A review of communication and Java technologies in the ATTAIN project",0.133571428571,0.158571428571
231843E1,"The challenges of classification",0.112467532468,0.15
58A6F2F8,"Distributed Algorithms for the Placement of Network Services",0.119511599512,0.151111111111
63ECE43B,"Training of line echo canceller with PRBS signals",0.147222222222,0.18125
76D9D323,"SYNTONY: network protocol simulation based on standard-conform UML 2 models",0.13094017094,0.157070707071
7B7C613E,"A novel multiple description coding scheme based on AMR-WB in converged IP network",0.117606837607,0.173015873016
7CABC32B,"A heuristic analysis approach to admission control for voice in packet switched wireless networks",0.135555555556,0.127831890332
80D7943F,"QOS of efficient GA-EMAN routing method for future mobile tele-emergency system",0.135793650794,0.121428571429
857024E8,"RasPBX 기반의 IP-PBX 시스템",0,0
81D7E2C1,"Abusing SIP authentication",0.0941341991342,0.119191919192
7D19F373,"Addressing digital divide: experiment on tele-medicine applications using broadband wireless system in rural areas",0.173571428571,0.169845779221
79058D62,"Network Instrumentation for End-to-End Measurements",0.176904761905,0.175925925926
8569554A,"IP 컨택 센터에서 통화 처리 모의 실험을 위한 VoIP 트래픽 생성기",0.073486317604,0.0833333333333
7544C58F,"A heuristic energy efficient scheduling scheme for VoIP in 3GPP LTE networks",0.117606837607,0.126388888889
325F7F0D,"Підвищення якості передачі звуку в системах онлайн конференц зв'язку",0,0
7A3993CB,"Broadband Infrastructure Investment in Stimulus Packages : Relevance for Developing Countries",0.11094017094,0.124410774411
7B7ADAF7,"Asterisk as a Public Switched Telephone Network Gateway for an IMS test bed",0.124444444444,0.112585034014
594E4959,"Pemanfaatan Asterisk Pada Voice Over Internet Protocol (Voip)",0.0912121212121,0.0912878787879
5EE4E606,"Quality of service analysis using the Georgia Tech network simulator",0.149444444444,0.154407051282
6652DF80,"The Internet and beyond: how to position ourselves to face the future challenges",0.160238095238,0.168888888889
7EAEEECF,"A call processing scheme for number portability of Wibro-VoIP by using NPSS",0.140086580087,0.139466089466
7DDA719B,"Capturing router congestion and delay",0.102070707071,0.117171717172
85D49B7A,"Wireless Data Services: Global wireless technologies: network, access, and software",0.135555555556,0.114476495726
05874923,"Development of the SOHO IP-PBX with VPN function",0.102051282051,0.111111111111
7CC4F81C,"A study of global numbering plan with active anti-spit capability on VoIP",0.121038961039,0.106547619048
7E48F91F,"An 8-12 Kbit/S Embedded CELP Coder Interoperable with ITU-T G.729 CIDER: First Stage of the New G.729.1 Standard",0.125404040404,0.122777777778
7DF76BFF,"Low bit-rate facial motion picture coding using image warping",0.129444444444,0.156018518519
7ADBEC08,"An architecture methodology for secure video conferencing",0.12,0.116402116402
7F8F2387,"Applying a layered policy model to IP based voice services",0.121515151515,0.181818181818
7C27E8BC,"Improvement the performance of voice quality over UMTS system in packet switching networks",0.132142857143,0.119994588745
5A2E0A2F,"Potencjał funkcjonalny Platformy Lokalizacyjnej systemu ratownictwa 112",0,0
8093A561,"Impact of the current global revolution in communication systems and networks on the social and economic lives in the Middle East",0.155793650794,0.126757369615
59F08AC5,"Telephony over IP: theoretical modelling and lab experiments",0.150793650794,0.13246031746
7A80784F,"Identification of Multi-Reflective Echo Paths using Sub-Rate Adaptive Filtering in Presence of Moderate Aliasing",0.121038961039,0.179761904762
80CED820,"Congestion control for small queues: Analysis and evaluation of a new protocol",0.125800865801,0.117676767677
22029596,"An Efficient Scheme for Supporting Personal Mobility in SIP-Based VoIP Services( Mobile Multimedia Communications)",0.13094017094,0.154701779702
71220604,"Capacity dimensioning based on traffic measurement in the Internet",0.152222222222,0.164225589226
78DD9269,"A Multiservice Voice, Data, and Video Network Enabled by Optical Ethernet",0.130404040404,0.127525252525
5F7F0006,"Millimeter wave line-of-sight digital radio at 38 GHz",0.116363636364,0.106547619048
7BFA2935,"Beyond the interoperability of telephony, VoIP and networking: self-realisation marketing contribution to value creation in telecommunications sector",0.137222222222,0.129141845809
76C3AF86,"Coverage analysis of Skype VoIP services over 3G cellular networks",0.13094017094,0.133838383838
5F7A5280,"VoIP-based calibration of the DQX model",0.116363636364,0.166666666667
76B7009C,"Guest editorial - Consumer communications and networking series",0.112626262626,0.118737373737
19AFE484,"Voice Stream Multiplexing between IP Telephony Gateways (Special Issue on Internet Technology and Its Applications)",0.327222222222,0.236363636364
7E89CB98,"Joint Connection Level and Packet Level Analysis of Cognitive Radio Networks with VoIP Traffic",0.140555555556,0.118402777778
7EF10082,"Standardization efforts in IP telephony",0.132222222222,0.136111111111
764621C0,"Telecommunications markets, industry, and infrastructure in Korea",0.148571428571,0.13841991342
81601904,"Policy management for ENUM system enabling privacy and security",0.154365079365,0.131146631147
78CB0ACE,"The design of IP telephony media gateway which is based on soft-switching technology",0.149126984127,0.181051587302
7CBA3E82,"Interactions between the physical layer and upper layers in wireless networks",0.160238095238,0.142222222222
78510C0D,"A call quality assessment and analysis framework for video telephony applications in enterprise networks",0.134444444444,0.126590909091
8138CF7A,"A study on internet telephony service for enhanced emergency services",0.140404040404,0.138624338624
75F9CC36,"Evaluation of SIP Signalling and QoS for VoIP over MANETs Reactive Routing Protocols",0.1268997669,0.114393939394
6E6D3EEA,"Real-time signaling transport protocol for VoIP",0.13246031746,0.133477633478
7CA01B8E,"VoIP service continuity across HRPD and 3G-1x networks",0.119829059829,0.131481481481
765C7C61,"Softswitch Multicriteria Analysis for Software Quality based on IPCC Reference Architecture",0.153888888889,0.160984848485
7817F74E,"A Study on methods of MCID(Multimedia Caller IDentification) supplementary service based on SIP",0.138888888889,0.161451247166
6C3275B8,"Desktop voice over IP development with PSTN integration",0.105800865801,0.122895622896
7650E3B5,"An E-Titan's Evolving Strategy and Business Model: Striving for Success in Challenging Times",0.121038961039,0.123917748918
779D497A,"Performance Evaluation of SigComp in MANETs",0.105081585082,0.130555555556
808B92B9,"Fall of the dial tone empire: what will happen to thy loyal servant, battery 'n' dirt?",0.134696969697,0.142635539064
77D8A9E2,"A framework for fast handoff in IEEE 802.11 based systems",0.13246031746,0.157738095238
807116A1,"Hybrid next generation mobile system analysis based on Internet applications",0.200238095238,0.198185941043
58D63356,"An energy-aware framework for coordinated dynamic software management in mobile computers",0.128975468975,0.105158730159
8570FB9C,"A survey of Attacks on VoIP networks and Countermeasures",0.119829059829,0.136219336219
3519397B,"MelcoSoft.Net Hacked!",0.125,0.166666666667
75A6F148,"Link Layer Packet Loss Classification for Link Adaptation in WLAN",0.149126984127,0.121085858586
790B49AF,"eTVRA, a Threat, Vulnerability and Risk Assessment Tool for eEurope",0.118975468975,0.118506493506
3C78E0CD,"Diseño e implementación de un centro de llamadas utilizando una plataforma de comunicaciones basado en sipxecs",0.0900743700744,0.111111111111
3E274134,"Ocena jakości usług telefonii pakietowej",0,0
77799C0C,"Using the phone with a single input signal only: evaluation of 3dscan's telephone module",0.137777777778,0.157407407407
7CA6FE65,"Z-Phone: Design and implementation of embedded Voice over Zigbee applications",0.128181818182,0.145643939394
7DF1615B,"The Internet: what will grow up to be?",0.106613190731,0.227777777778
79CCA1E6,"Optical network research and development in European Community programs: from RACE to ACTS",0.13094017094,0.113888888889
7EB3A559,"A real-time scheduling architecture for IEEE 802.16 — WiMAX systems",0.153888888889,0.15873015873
0C28D8DB,"Disseny i implementació de cinc sistemes d'internet i telefonia via satèl·lit al sàhara occidental",0.125404040404,0.12037037037
84AE01ED,"DATA STEGANOGRAPHY ON VOIP THROUGH COMBINATION OF RESIDUE NUMBER SYSTEM AND DNA SEQUENCES",0.298015873016,0.23397237683
7DE92F8F,"Fast authentication for mobility support in wireless mesh networks",0.152222222222,0.125673400673
8067CE46,"Advanced services: Changing how we communicate",0.141435035553,0.222222222222
7BF7B260,"An identity-based security mechanism for P2P VoIP",0.100555555556,0.107954545455
5D700296,"Design and Realization of Call Center System based on H.323",0.15746031746,0.165476190476
81162901,"Demonstration of Spam and Security Mechanism in SIP-Based VoIP Services",0.117222222222,0.123268398268
752927BF,"Virtual networks in the Internet",0.122222222222,0.105555555556
011EFA99,"Integrated Packet Scheduling for VoIP Service",0.13094017094,0.169444444444
38E27FCA,"Internet jako narzędzie wspomagania długookresowych relacji z pacjentem",0.0995454545455,0.1125
7E4E132B,"Dynamics of contention free period reservation in IEEE 1901 networks",0.12746031746,0.103015873016
79DF8D40,"KT's local advertisement service and system: Moving toward cross-media",0.155793650794,0.175238095238
0DD706A4,"Voice over internet protocol (VOIP)",0.0912121212121,0.0939393939394
83EDD498,"• Novel Survey on Detection of DDoS Attack Using Traceback Technique in VoIP Networks",0.137606837607,0.16151996152
715AE461,"Agile Testing: My Agile Process",0.138181818182,0.180555555556
805F4D99,"Simulating the National Telephone Network: A Socio-technical Approach to Assessing Infrastructure Criticality",0.133015873016,0.13327307613
70CA5F4D,"Diseño de una red de telecomunicaciones para la interconexión de datos y telefonía",0.0999358974359,0.0833333333333
764D7BE4,"Downlink Coordinated Beamswitching for VoIP Traffic",0.102606837607,0.138888888889
5E933E2D,"VoIP for Global Communications",0.102733100233,0.0909090909091
5DE8EBBC,"VoIP technology as an example of integration of business services on the example of Philips' European service center in Lodz",0.153737373737,0.139090909091
7E71E8E9,"Wireless link adaptation policies: QoS for deadline constrained traffic with imperfect channel estimates",0.130793650794,0.10404965405
7F0302C0,"Modeling of packets loss in VoIP Networks and measurement of speech quality",0.142222222222,0.137698412698
7760FEA1,"A Design of Encryption Method for Strong Security about Tapping/Interception of VoIP Media Information between Different Private Networks",0.215793650794,0.174665017522
5F14CF17,"Demonstration of an Application-Aware Resilience Mechanism for Dynamic Heterogeneous Networks",0.13246031746,0.117469336219
791C3E03,"Deconstructing Superblocks Using Niceness",0.0999358974359,0.175925925926
14DDF55E,"FiWi Access Networks: Broadband access",0.0998290598291,0.0883190883191
7D7713F5,"A multi-channel remote controller for home and office appliances",0.115079365079,0.134126984127
85DD0B25,"Capacity evaluations of VoIP traffic for multicell WLAN",0.11595959596,0.114898989899
79387216,"Design and Implementation of a VIPSec Based Application",0.124551282051,0.20625
0860EAB3,"Implantación de una centralita VoIP basada en Asterisk en un parque de innovación",0.0766025641026,0.0833333333333
0492AAF4,"ProCompSys - Professional Computer Systems - IT@work! | 52428 Jülich : Leistungen Bauherrenberatung Heimnetz, Büro- und Unternehmens-Netzwerk",0.165793650794,0.167989417989
77328965,"Convergence and the Google Way",0.1084004884,0.106878306878
755AD7C0,"Extending the Substation LAN Beyond Substation Boundaries: Current Capabilities and Potential New Protection Applications of Wide-Area Ethernet",0.170555555556,0.150841750842
7B621C96,"Fast heuristics for multi-path selection for multiple description encoded video streaming",0.29094017094,0.275925925926
7DAABADA,"The Evolution of ICT as A to Z General: Purpose Technologies for Business Innovation",0.16380952381,0.132016594517
7D7290C3,"A second wind for wiring [ADSL]",0.100681818182,0.116883116883
7CF2640F,"Evaluation of advanced switching technologies for integrated voice/data applications",0.128181818182,0.169047619048
79E9B9E6,"A Study of WLAN Campus in an Educational Establishment",0.129935064935,0.117469336219
69A0AED0,"Low-earth orbit global cellular communications network",0.133737373737,0.122895622896
8098F710,"Preliminary investigations on HyperLAN antenna for wearable applications",0.140404040404,0.129344729345
5C793C30,"P2P audio/video protocol with global positioning data in real time for mobile devices",0.147606837607,0.135404040404
7257C1E7,"유무선 VoIP 취약점 분석과 해킹공격 및 보안 연구",0,0
5FAC0F7D,"Studies toward improved VoIP services for future combat systems",0.159126984127,0.165476190476
597C8849,"Independent call system",0.130079365079,0.121428571429
7FFE956F,"Modifying the IEEE 802.11 MAC Protocol for Multi-hop Reservation in MIMC Tactical Ad Hoc Networks",0.12746031746,0.129701779702
7F51C39D,"Unstructured peer-to-peer session over IP using SIP",0.107852147852,0.172222222222
7ED44CD1,"Ultra wide band antenna for a multimode cellular phone",0.124444444444,0.111111111111
7A5A09E5,"A case for packet-switched telecommunication infrastructure for low-density traffic rural areas",0.158571428571,0.133975468975
58EC4761,"Securing Email, Chat, and Voice over IP",0.101753246753,0.11803030303
771DBBDD,"Inter-cell interference coordination with adaptive frequency-reuse for VoIP and data traffic in downlink of 3GPP-LTE",0.117606837607,0.0972222222222
5FC2140A,"Trends in VoIP and QoS",0.0952380952381,0.142857142857
5C17412C,"Scalable one chip design for a multiplex tap with timestamping [QoS validation applications]",0.152222222222,0.160238095238
6CAEE584,"Service- & Projektpersonal | Teufel NET Österreich",0.0808989050166,0.1
1022B1F4,"MelcoSoft.Net Security Updates",0.0830303030303,0.0909090909091
7B77F64C,"Unify OpenScape Voice, VoIP, ALL-IP, Softswitch | Teufel NET Deutschland",0.111356421356,0.10101010101
788ECA2F,"Analysis and enhancement of QoS in cognitive radio network for efficient VoIP performance",0.135555555556,0.122777777778
7A2718DE,"How the Rapid Development of VoIP Technologies Affects Consumer Welfare and the Market",0.165404040404,0.163283475783
8111FD1D,"Identity Authentication Scheme for the Distributed Centers System",0.132698412698,0.13247955748
76955012,"Concurrent GC leveraging transactional memory",0.0924675324675,0.108333333333
7F56E54D,"QoS provisioning across a DiffServ domain using policy-based management",0.116753246753,0.183441558442
7CCAD71F,"The security research of SIP-based Denial of Service attack",0.106363636364,0.164848484848
1415B707,"車車間通信における音声配信方法の提案(携帯端末,モバイルアプリケーション,モバイルコンピューティング)",0,0
5EF429A3,"IEEE 802.16e 시스템에서 VoIP 트래픽을 고려한 혼합 전원 절약 모드",0,0
7DA4530B,"A reliability model for distributed adaptation",0.110649350649,0.0914141414141
79C4E246,"LTE downlink scheduler with reconfigurable traffic prioritization",0.107626262626,0.118055555556
754946F5,"Efficient mapping of VoIP traffic in wireless OFDMA systems using semi-fixed allocations",0.135793650794,0.157864357864
0ABE8883,"Internet Telephony at the Threshold",0.100404040404,0.103703703704
7177DDEA,"The development of global IPv6 products: an exploration",0.138015873016,0.114959114959
778E21E4,"Convergence of telephony and television: More than a computer on your TV",0.130793650794,0.113015873016
813EA5AD,"Policy evaluation for network management",0.113162393162,0.125992063492
0B7AE2C9,"SIP based Single-line VoIP Residential Gateway",0.115555555556,0.181481481481
3D5E7339,"HiPath 5000 - platforma VoIP",0,0
5CBC2ED7,"Performance evaluation of an open source speaker recognition system under the effect of speech compression in a real world VoIP environment",0.330476190476,0.20808408763
7FE78C8C,"Predictable Reliability and Packet Loss Domain Separation for IP Media Delivery",0.138015873016,0.108286951144
80DF1F05,"Channel Modeling Applied to Robust Automatic Speech Recognition",0.121515151515,0.180086580087
8054743D,"Scheduling algorithms for multimedia traffic over high-rate WPANs",0.119511599512,0.155158730159
8175A5D3,"Academic VoIP Blog for Elementary Schools",0.104848484848,0.0871212121212
24D4C641,"Integración de Comunicaciones Unificadas para una empresa con delegaciones distribuidas",0.0830303030303,0.0871212121212
5C77989C,"Attaining VoIP–Grade QoS via Deflection: A Buffer Space Tradeoff Study",0.125793650794,0.139606227106
5F3B425A,"Roles of the network in next generation IP services",0.13094017094,0.127777777778
80013A6E,"Taking a Peek at Bandwidth Usage on Encrypted Links",0.143737373737,0.188492063492
77F084E5,"Research on the Monitoring and Controlling Model of SIP Network",0.13094017094,0.153240740741
78C28BE1,"Security and performance challenges for user-centric wireless networking",0.103181818182,0.103977272727
7E65E272,"An Enhanced Reservation Based Medium Access Control for Voice over Wireless Mesh Networks",0.12746031746,0.142522292522
77581DAF,"Protecting Voice over IP Communication Using Electronic Identity Cards",0.137606837607,0.189225589226
5980C8B6,"A lost speech reconstruction method using linguistic information",0.13094017094,0.158888888889
795D77A4,"Competitive relationships between traditional and contemporary telecommunication services in Taiwan",0.151904761905,0.139880952381
76B538E6,"TUI or GUI--It's a Matter of Somatics",0.0621929824561,0.0666666666667
