793EFB94,"A modified adaptive Lasso for identifying interactions in the Cox model with the heredity constraint",0.320555555556,0.282204700062
7BFAA845,"An adaptive algorithm for image restoration using combined penalty functions",0.146031746032,0.186054421769
79FF3343,"Fast derivative computation using smooth X-splines",0.104848484848,0.25
7E41BF23,"Segmentation of ARX-models using sum-of-norms regularization",0.123571428571,0.208333333333
5F75854A,"Learning Compressible Models",0.268414918415,0.666666666667
7794FD26,"Feature selection with neural networks",0.155793650794,0.180952380952
78E15D8C,"A MOM-based algorithm for moving force identification: Part I - Theory and numerical simulation",0.178333333333,0.190708101422
7F8A3005,"Regularization of Inverse Visual Problems Involving Discontinuities",0.120793650794,0.181547619048
7B905D28,"Improved fiber tractography with Bayesian tensor regularization",0.13746031746,0.194444444444
7DA9D824,"Robust feature selection based on regularized brownboost loss",0.153571428571,0.219047619048
801BF0B3,"3D curve inference for diffusion MRI regularization and fibre tractography",0.155086580087,0.153048340548
7BD64644,"Discrepancy based model selection in statistical inverse problems",0.330476190476,0.330952380952
79E1E6A6,"The cost of uniqueness in groundwater model calibration",0.318571428571,0.366964285714
80AB5471,"Universal Glucose Models for Predicting Subcutaneous Glucose Concentration in Humans",0.315476190476,0.369047619048
7FB563E4,"Regularization without preliminary knowledge of smoothness and error behaviour",0.168571428571,0.165
75E7F6FF,"A limitation in the use of spatially stationary strain variance estimation in the regularization of shear modulus reconstruction",0.164126984127,0.143253968254
58378F86,"φ-regular functions in Asplund spaces",0.178333333333,0.25
7B237078,"Remote sensing of surface reflective properties: Role of regularization and a priori knowledge",0.166666666667,0.144642857143
754BA754,"On the solution of some nonlinear inverse problems in geophysics",0.18841991342,0.242063492063
7EEDDB68,"Codomain scale space and regularization for high angular resolution diffusion imaging",0.173571428571,0.184126984127
79F1432A,"Clustering Curves on a Reduced Subspace",0.290404040404,0.436507936508
779449BA,"Functional regression modeling via regularized Gaussian basis expansions",0.275072150072,0.305555555556
7D9E2F21,"Predictor estimation via Gaussian regression",0.250330687831,0.334027777778
7F626867,"Adaptive Multiple-Frame Image Super-Resolution Based on U-Curve",0.111197691198,0.238095238095
7ECE76F2,"Model Estimation of Cerebral Hemodynamics Between Blood Flow and Volume Changes: A Data-Based Modeling Approach",0.331666666667,0.230151946819
5BD0B0D5,"A riemannian framework for the processing of tensor-valued images",0.300555555556,0.436507936508
7B3508C9,"Statistical signal restoration with 1/ f wavelet domain prior models",0.31,0.35625
7A9D308A,"Gaussian filtering of images: A regularization approach",0.281415343915,0.358630952381
789593A3,"A regularized discriminative framework for EEG analysis with application to brain–computer interface",0.288181818182,0.350108225108
79638FA6,"Viscoelastic properties of waxy maize starch and selected non-starch hydrocolloids gels",0.157864357864,0.186111111111
7588FD73,"Identification of switched linear regression models using sum-of-norms regularization",0.31746031746,0.358333333333
7DC9793F,"Simultaneously Structured Models With Application to Sparse and Low-Rank Matrices",0.300555555556,0.358630952381
7E767C12,"An advanced regularization methodology for use in watershed model calibration",0.324126984127,0.331515151515
7D45364D,"Target Detection With Semisupervised Kernel Orthogonal Subspace Projection",0.292222222222,0.281111111111
7C81E0C5,"Review: A unified framework for regularized linear estimation in communication systems",0.317222222222,0.310404040404
7971787D,"Prediction error identification of linear systems: A nonparametric Gaussian regression approach",0.267466329966,0.269781144781
777F37D5,"On a quadratic eigenproblem occurring in regularized total least squares",0.0770188145188,0.212121212121
7ACFC23B,"A MOM-based algorithm for moving force identification: Part II - Experiment and comparative studies",0.178333333333,0.1910430839
7961548A,"Using dimensional reduction for hadronic collisions",0.107157287157,0.206349206349
80E77ADC,"On application of asymptotic generalized discrepancy principle to the analysis of epidemiology models",0.309126984127,0.282661782662
7C385321,"Wavelet estimation by Bayesian thresholding and model selection",0.300404040404,0.35625
7664BD66,"Autoregressive frequency detection using Regularized Least Squares",0.113571428571,0.18341991342
76C3996A,"Multitask multiclass support vector machines: Model and experiments",0.300404040404,0.315555555556
7B4A441D,"An inverse problem approach to pattern recognition in industry",0.305086580087,0.283531746032
7DA92E38,"Regularized discriminant analysis for the small sample size problem in face recognition",0.301587301587,0.271541950113
80D72754,"A new regularized transform-domain NLMS adaptive filtering algorithm",0.0941891441891,0.196428571429
7E9D53A7,"UNIFORMLY BOUNDED COMPOSITION OPERATORS ON A BANACH SPACE OF BOUNDED WIENER-YOUNG VARIATION FUNCTIONS",0.181904761905,0.196428571429
78698F0C,"Adaptive regularized image interpolation using a probabilistic gradient measure",0.134920634921,0.191137566138
8117B53C,"Regularization in Tomographic Reconstruction Using Proximal Forward-Backward Algorithm",0.129365079365,0.185714285714
7D224321,"Cauchy problems of Laplace's equation by the methods of fundamental solutions and particular solutions",0.198015873016,0.246031746032
784DF927,"Regularized virtual fields method for mechanical properties identification of composite materials",0.173015873016,0.187962962963
754548B7,"High order structural image decomposition by using non-linear and non-convex regularizing objectives",0.138975468975,0.189194139194
7869EC64,"A multi-output two-stage locally regularized model construction method using the extreme learning machine",0.288975468975,0.292630385488
7983FC16,"A new spatial regularization scheme for the identification of the geometric shape of an inclusion in a finite body",0.165476190476,0.165674603175
7A6DAEF6,"Tikhonov Regularization with a Solution Constraint",0.198571428571,0.263888888889
7EC21E0B,"Large Vocabulary Mandarin Continuous Speech Recognition under Noisy Environment",0.468975468975,0.578125
7FC0C78E,"Regularization studies of linear discriminant analysis in small sample size scenarios with application to face recognition",0.306349206349,0.229585537919
75D2A4BD,"Solving a final value fractional diffusion problem by boundary condition regularization",0.15746031746,0.178174603175
7B434F7B,"The method of fundamental solutions for inverse boundary value problems associated with the two-dimensional biharmonic equation",0.209126984127,0.213624338624
760D3D78,"Multi-label Classiﬁcation Using Hypergraph Orthonormalized Partial Least Squares",0.0770188145188,0.212121212121
7CED1964,"Kernel Regularized Bone Surface Reconstruction from Partial Data Using Statistical Shape Model",0.300793650794,0.255118646785
7D15C7DD,"Classification of galactograms using fractal properties of the breast ductal network",0.135642135642,0.184126984127
7D43AE80,"On the regularization of forgetting recursive least square",0.120793650794,0.25
7E72D3CC,"Flexible covariance estimation in graphical Gaussian models",0.394191919192,0.545833333333
770EB885,"Elastic-net regularization in learning theory",0.122308802309,0.19696969697
7EEF539F,"New Learning Based Super-Resolution: Use of DWT and IGMRF Prior",0.118585858586,0.288888888889
7679D2AE,"THE METHOD OF FUNDAMENTAL SOLUTIONS FOR AN INVERSE INTERNAL BOUNDARY VALUE PROBLEM FOR THE BIHARMONIC EQUATION",0.209126984127,0.206349206349
7A01FB33,"Selection of regularization parameter for optical topography",0.15746031746,0.164583333333
7B8406B1,"Variable selection for functional regression models via the L1 regularization",0.324126984127,0.372916666667
75F1E2FF,"Efficient model selection for regularized linear discriminant analysis",0.300404040404,0.447619047619
7DC530A8,"Using mesh adaption for the identification of a spatial field of material properties",0.168975468975,0.207142857143
78C114F8,"Inverse scattering scheme based on the moment method in the spectral domain, part I: Theory",0.193571428571,0.202106782107
792EC3C5,"Determination of pore size distributions by regularization and finite element collocation",0.181904761905,0.161678004535
7B3D2D5B,"Dynamic force identification based on enhanced least squares and total least-squares schemes in the frequency domain",0.155476190476,0.171660482375
7AA19F1F,"Regularization in model updating",0.31746031746,0.444444444444
76838897,"Angular smoothing and radial regularization of ODF fields: Application on deterministic crossing fiber tractography",0.161904761905,0.176666666667
78B70189,"Function approximation on non-Euclidean spaces",0.178333333333,0.194444444444
7D2B5DB5,"3D MFIE accuracy improvement using regularization",0.134848484848,0.197916666667
7B291343,"Smoothing impact of isostatic crustal thickness models on local integral inversion of satellite gravity gradiometry data",0.304365079365,0.257374768089
7C9DF954,"An Extension of Possibilistic Fuzzy C-means using Regularization",0.120793650794,0.203703703704
7BD2EAB3,"Spectral analysis of nonlocal regularization in two‐dimensional finite element models",0.312698412698,0.377380952381
76661B2F,"Convergence results for the discrete regularization of linear-quadratic control problems with bang–bang solutions",0.215238095238,0.210317460317
84349968,"Weight-decay regularization in reproducing Kernel Hilbert spaces by variable-basis schemes",0.182142857143,0.185846560847
7BCC10ED,"Regularization of bending and crossing white matter fibers in MRI Q-ball fields",0.158658008658,0.158405483405
7BB52E57,"Approximating minimum norm solutions of rank‐deficient least squares problems",0.187137862138,0.225108225108
760C4416,"A one-dimensional inverse problem in composite materials: Regularization and error estimates",0.186753246753,0.182142857143
7BA74C29,"Estimation in generalized linear models for functional data via penalized likelihood",0.300793650794,0.34380952381
7FFC4CBF,"When do memory limitations lead to regularization? An experimental and computational investigation",0.122626262626,0.218571428571
7D7F26E6,"Subspace identification using predictor estimation via Gaussian regression",0.417929292929,0.454166666667
779D8DE4,"Robust PSD determination of micro and meso-pore adsorbents via novel modified U curve method",0.155793650794,0.167328042328
766EBE18,"Sparse Bayesian representation in time–frequency domain",0.145555555556,0.183333333333
790017EF,"Eigenstructure assignment in undamped vibrating systems: A convex-constrained modification method based on receptances",0.118181818182,0.185846560847
79CFFCCD,"Spatially constrained inversion of radiative transfer models for improved LAI mapping from future Sentinel-2 imagery",0.312698412698,0.270105820106
7E998AAE,"STABLE NUMERICAL DIFFERENTIATION: WHEN IS IT POSSIBLE?",0.0948484848485,0.216666666667
7ED6BA01,"Choosing Near-Optimal Regularization Parameter for the Inverse Problem of Electrocardiography",0.157142857143,0.172619047619
804433CC,"A Bayesian framework for regularization",0.304126984127,0.583333333333
7BD213AB,"Recognition of handwritten Chinese characters by critical region analysis",0.300324675325,0.344155844156
7E99B753,"A Computationally Stable Approach to Gaussian Process Interpolation of Deterministic Computer Simulation Data",0.278312890813,0.263497217069
76D17534,"A framework based on spin glass models for the inference of anatomical connectivity from diffusion‐weighted MR data – a technical review",0.324126984127,0.326078643579
786275E3,"TROP-ELM: A double-regularized ELM using LARS and Tikhonov regularization",0.120793650794,0.192307692308
7D481E87,"Bayesian online multi-task learning using regularization networks",0.127308802309,0.244047619048
7CABB544,"A novel locally regularized automatic construction method for RBF neural models",0.288975468975,0.375992063492
8118E97E,"Geodesic Active Fields—A Geometric Framework for Image Registration",0.288975468975,0.428571428571
78BEDEBD,"Quantile regression with ℓ 1—regularization and Gaussian kernels",0.250330687831,0.412037037037
7907D102,"Regularized solution of the Cauchy problem for the Laplace equation using Meyer wavelets",0.195238095238,0.220568783069
7A26A010,"Bayesian Online Multitask Learning of Gaussian Processes",0.268855218855,0.437037037037
780ABBB3,"Uncertainty-based learning of acoustic models from noisy data",0.298015873016,0.417989417989
75BECA36,"Optimally pruned extreme learning machine with ensemble of regularization techniques and negative correlation penalty applied to automotive engine coldstart hydrocarbon emission identification",0.155238095238,0.175198412698
7611E4A0,"Restoring Images Degraded by Spatially Variant Blur",0.111197691198,0.196428571429
779B8D26,"Stochastic regularization of feedwater flow rate evaluation for the venturi meter fouling problem in nuclear power plants",0.158181818182,0.144563492063
804F7527,"A meshless method for the stable solution of singular inverse problems for two-dimensional Helmholtz-type equations",0.201587301587,0.206349206349
78907943,"Fast surface interpolation using multiresolution wavelet transform",0.118975468975,0.181547619048
7FBD9721,"SURE-Based Non-Local Means",0.118585858586,0.2
794ED06C,"Two soft-thresholding based iterative algorithms for image deblurring",0.117546897547,0.206349206349
78869908,"Regularization approach for inverting the exponential radon transforms (ERT)",0.153571428571,0.183333333333
8113BCCD,"Eigenfeature Regularization and Extraction in Face Recognition",0.29380952381,0.355158730159
7881B8BF,"Regularized locality preserving discriminant analysis for face recognition",0.291178266178,0.308994708995
80380B97,"Maximum mutual information based reduction strategies for cross-correlation based joint distributional modeling",0.132936507937,0.201058201058
79D5B605,"Cross-Lingual Subspace Gaussian Mixture Models for Low-Resource Speech Recognition",1.0,1.0
8098C8FD,"Unifying regularization and Bayesian estimation methods for enhanced imaging with remotely sensed Data-part I: theory",0.156349206349,0.15266955267
80E8792D,"A framework for state-space estimation with uncertain models",0.27303030303,0.7
77C7A6A6,"Localization analysis of variationally based gradient plasticity model",0.320238095238,0.325396825397
8128B217,"Regularization of eddy-current formulations using discrete grad-div operators",0.131904761905,0.202380952381
7534C2DF,"The method of fundamental solutions for the detection of rigid inclusions and cavities in plane linear elastic bodies",0.223015873016,0.181235827664
7F419F38,"A variational framework for simultaneous motion and disparity estimation in a sequence of stereo images",0.298015873016,0.243594104308
8549CE99,"Flexible Multi-Task Learning with Latent Task Grouping",0.15746031746,0.233333333333
7962F7E6,"Positive solutions of the Dirichlet problem for the prescribed mean curvature equation",0.198571428571,0.230158730159
