Paper ID,Title,Sim1,Sim2,,
7BF9CD89,The rate adapting poisson model for information retrieval and object recognition,0.180952381,0.1333953084,,
80060D7C,Conditional Random Fields: Probabilistic Models for Segmenting and Labeling Sequence Data,0.1574074074,0.1333953084,,
7C64693F,Mixed Graphical Models with Missing Data and the Partial Imputation EM Algorithm,0.1574074074,0.1333851334,,
5C02A1D5,An Object-Oriented Pattern Matching Language,0.1944444444,0.1333333333,,
5999B5AC,Maximum Entropy Correlated Equilibria,0.15,0.1333333333,,
7603FAD4,Tag refinement by regularized LDA,0.1259259259,0.1333333333,,
7A036719,Colonization of rose by Sphaerotheca pannosa (Wallr.) L�v. var. rosae Wor.,0.1222222222,0.1333333333,,
7FD68FFA,Model-based overlapping clustering,0.1142857143,0.1333333333,,
791B9A66,How to prove the Maxwell conjecture via spatial coupling — A proof of concept,0.1439393939,0.1332750583,,
7CDE52F1,A Directed Acyclic Graphical Approach and Ensemble Feature Selection for a Better Drug Development Strategy Using Partial Knowledge from KEGG Signalling Pathways,0.25,0.1332688145,,
5A9B9C82,The spatial-temporal difference of water resources utilization relative efficiency in Beijing based on DEA& ESDA,0.1574074074,0.1332010582,,
7F72C8F2,Group and topic discovery from relations and text,0.1698412698,0.133015873,,
7C935DAC,Group and topic discovery from relations and text,0.1698412698,0.133015873,,
7D8E9920,Estimation of Traffic Risk of Level Crossing Based on Stochastic Petri Nets Models and Social Economic Data,0.1574074074,0.1329998705,,
7F07B6AE,A Model Integrated Framework for Designing Self-managing Computing Systems,0.1068376068,0.1329059829,,
7A6E4ED1,Faster Mass Spectrometry-Based Protein Inference: Junction Trees Are More Efficient than Sampling and Marginalization by Enumeration,0.162037037,0.1328941121,,
71F4616F,Remarks Concerning Graphical Models for Time Series and Point Processes,0.1805555556,0.1328814043,,
7E027EAC,Map approach to learning sparse Gaussian Markov networks,0.1574074074,0.1328449328,,
811F792A,Learning Rich Hidden Markov Models in Document Analysis: Table Location,0.15,0.1328205128,,
661504AB,Learning Partially Observable Markov Models from First Passage Times,0.15,0.1328205128,,
7A9296B5,Using Bayesian graphical models to model biases in observational studies and to combine multiple sources of data: application to low birth weight and water disinfection by-products,0.2407407407,0.1328187685,,
5AA890FB,Understanding the Role of Formal Specification Techniques in Requirements Engineering,0.167989418,0.1327838828,,
75D2B6E3,Lifted Graphical Models: A Survey,0.1346153846,0.1327838828,,
6BAC4FD1,On Identifying Significant Edges in Graphical Models,0.1346153846,0.1327838828,,
7F169439,Bayesian Model Scoring in Markov Random Fields,0.1346153846,0.1327838828,,
7EF78802,A Haptic Enabled DNA Model Sensing,0.1346153846,0.1327838828,,
7BFB9EE9,Factors affecting automated syndromic surveillance,0.1346153846,0.1327838828,,
77F7165C,One-to-one feature matching with inaccurate maps,0.1346153846,0.1327838828,,
5CA5C288,The multiple model labeled multi-Bernoulli filter,0.1346153846,0.1327838828,,
5AF73C76,A holistic approach for measuring the survivability of SCADA systems,0.1346153846,0.1327838828,,
797BB34E,Comparing barrier algorithms,0.1179487179,0.1327838828,,
5C4EB8AB,Model Checking for Managers,0.1179487179,0.1327838828,,
78F5B703,Improving code recommender systems by incorporating domain knowledge and graphical models,0.1785714286,0.1327541506,,
77BAAE88,Evaluating the Rarity of Handwriting Formations,0.1296296296,0.1327228327,,
78B21105,Shared Kernel Information Embedding for discriminative inference,0.1976190476,0.1326739927,,
583BC29D,Extending Factor Graphs so as to Unify Directed and Undirected Graphical Models,0.1785714286,0.1326739927,,
78F52477,Towards combining web classification and web information extraction: a case study,0.180952381,0.1326118326,,
76A0AD1B,Object localization in medical images based on graphical model with contrast and interest-region terms,0.1574074074,0.1326016576,,
81126000000000,People recognition in ambiguously labeled Photo Collections,0.1666666667,0.1324675325,,
7C4262E5,Supporting efficient development of cognitive models at multiple skill levels: exploring recent advances in constraint-based modeling,0.1574074074,0.1324328449,,
7DA65A95,GNAnalyzer: A Novel System for Analyzing Gene Networks from Microarray Data with Bayesian Networks,0.1574074074,0.1324175824,,
812B1577,Space-Time Hierarchical-Graph Based Cooperative Localization in Wireless Sensor Networks,0.1574074074,0.1323412698,,
5AAB50A6,Feedback message passing for inference in gaussian graphical models,0.1944444444,0.1322843823,,
7780380E,Feedback Message Passing for Inference in Gaussian Graphical Models,0.1944444444,0.1322843823,,
7F94E3C6,Learning spatial weighting via quadratic programming for facial expression analysis,0.1439393939,0.1322843823,,
23B5A221,Structure Learning for Generative Models of Protein Fold Families,0.1439393939,0.1322843823,,
80C6D5CD,Iterative Proportional Scaling Based on a Robust Start Estimator,0.1439393939,0.1322843823,,
7C9862B7,Blocking Gibbs sampling in very large probabilistic expert systems,0.1439393939,0.1322843823,,
7D0DF58C,Recognizing primitive interactions by exploring actor-object states,0.1439393939,0.1322510823,,
7A087994,Handling the effect of non-response in graphical models for longitudinal data,0.1574074074,0.1322358197,,
5ED3EA5D,Superpixel-Based Graphical Model for Remote Sensing Image Mapping,0.1574074074,0.1322358197,,
7C5E72AE,Approximately counting the number of constrained arrays via the sum-product algorithm,0.1574074074,0.1322358197,,
8323411F,"Exploring effects of rainfall intensity on soil erosion at the catchment scale using modified semmed model at the Zuli River Basin, western of loess Plateau, China",0.2333333333,0.1322032135,,
80B22E95,"Service level management using QoS monitoring, diagnostics, and adaptation for networked enterprise systems",0.25,0.132187765,,
79881193,Assembly Organization Model of Collaborative Design Based on Object-Oriented Petri Net,0.1574074074,0.1321581197,,
7FE5E94B,Modeling methodology of sensor human-simulated and its application in sensing area of irregular graphics,0.1785714286,0.1321428571,,
853E8A12,Analyzing Knowledge Structure: An Application of Graphical Models to a Medical Licensure Exam,0.1666666667,0.1321386946,,
806618C3,A study of statistical models for query translation: finding a good unit of translation,0.1574074074,0.1321326821,,
09A62525,DATA AUGMENTATION ALGORITHM FOR GRAPHICAL MODELS WITH MISSING DATA,0.1574074074,0.1321225071,,
80E7BF9D,Value-adding business process modelling : determining the suitability of a business process modelling technique for a given application,0.1574074074,0.1319034501,,
79CC34D5,Target Damage Distribution Probability Calculation Arithmetic Based on Space Tangential Differential Unit Area,0.1726190476,0.1317540484,,
7BF92BFE,Operations and evaluation measures for learning possibilistic graphical models,0.1439393939,0.1317482517,,
7D7B5490,Maximum Entropy Relaxation for Graphical Model Selection Given Inconsistent Statistics,0.1439393939,0.1317482517,,
78A4A4A6,MATCHING PARAMETERIZED SHAPES BY NONPARAMETRIC BELIEF PROPAGATION,0.15,0.1317307692,,
7C8F5F98,Maximum weight matching via max-product belief propagation,0.15,0.1317307692,,
5EE5FD05,DEUM: A Framework for an Estimation ofDistribution Algorithm based on Markov Random Fields,0.15,0.1317216117,,
06CE513D,Model-Based Design of ECU Software - A Component Based Approach,0.15,0.1317216117,,
783DA5E4,Feature suppression based CAD mesh model simplification,0.167989418,0.1317155067,,
60D92FA8,Image Retrieval Algorithm Based on Color Block Histogram,0.1574074074,0.1316859067,,
76E30231,Joint training for open-domain extraction on the web: exploiting overlap when supervision is limited,0.15,0.1315656566,,
84DB5482,Learning parameters in discrete naive Bayes models by computing fibers of the parametrization map,0.1439393939,0.1315636744,,
7135D185,Bayesian Network Enhanced Prediction for Multiple Facial Feature Tracking,0.1574074074,0.1315628816,,
7D806093,Rendering Chaotic Attractor Spectrum of Forced Duffing Equation,0.167989418,0.131547619,,
7BEED1D8,Estimation of distribution algorithms based on copula functions,0.1574074074,0.1315332815,,
6F0DF34B,Kansei interaction between flavor and texture in eating quality,0.15,0.1313636364,,
7FDF5613,Service flow simulation using reinforcement learning models and scene transition nets,0.2272727273,0.1313556235,,
7BC1F116,Conditions for Non‐confounding and Collapsibility without Knowledge of Completely Constructed Causal Diagrams,0.1666666667,0.13125,,
7EEB994E,Design of scalable decoders for sensor networks via Bayesian network learning,0.1574074074,0.1312067562,,
7FF4827C,Structure Learning on Large Scale Common Sense Statistical Mo dels of Human State,0.1439393939,0.1311854812,,
5C4606F5,A sampling based approach to facial feature extraction,0.1439393939,0.1311854812,,
7F2441CB,Learning Parameters for Relational Probabilistic Models with Noisy-Or Combining Rule,0.1439393939,0.1311854812,,
5E0399D2,User Evaluation of a Graphical Modeling Tool for IMS Learning Design,0.1439393939,0.1311854812,,
61E21450,High-rate low-density parity check codes based on anti-Pasch affine geometries,0.1785714286,0.1310744811,,
59C4505E,Comparative validation of graphical models for learning tumor segmentations from noisy manual annotations,0.167989418,0.1310744811,,
77A70147,Modeling distributed real-time applications with specification PEARL,0.167989418,0.1310714286,,
7E0EB9EB,Sex allocation within broods: the intrabrood sharing-out hypothesis,0.162037037,0.1310606061,,
7B0609EF,DT-Planner: an environment for managing dynamic decision problems,0.15,0.1310606061,,
7A4AD01E,A Novel Fault Diagnosis Algorithm Based on Graphical Model,0.1439393939,0.131002331,,
7CE95B3C,Rigorous EBNF-based definition for a graphic modeling language,0.1944444444,0.130952381,,
59B27D12,Integrating formal and informal specification techniques. why? how?,0.167989418,0.130952381,,
73A9C4AA,Action categorization based on arm pose modeling,0.1574074074,0.1308922559,,
752FA0C0,Tracking self-occluding articulated objects in dense disparity maps,0.1574074074,0.1308621934,,
8017C3F2,Graphical model based control of intelligent robot systems,0.15,0.1307692308,,
7F3A7DC2,Graphical model based control of intelligent robot systems,0.15,0.1307692308,,
5F33C551,Evaluating Weighted DFS Branch and Bound over Graphical Models,0.15,0.1307692308,,
78611793,Models are code too: Near-miss clone detection for Simulink models,0.1388888889,0.1307692308,,
7BC84F16,Do mRNA and rRNA Binding Sites of E. coli Ribosomal Protein S15 Share Common Structural Determinants?,0.15,0.1307169021,,
7667C892,A modeling method based on CCS for workflow,0.1439393939,0.1306818182,,
79E2B75F,Constructing structural VAR models with conditional independence graphs,0.1785714286,0.1306227106,,
85560AC1,Constructing Structural VAR Models with Conditional Independence Graphs,0.1785714286,0.1306227106,,
05D7B109,Specifying Consistency Constraints for Modelling Languages,0.1587301587,0.1305555556,,
756D2AF4,Generalized Second Law of Thermodynamics on the Event Horizon for Interacting Dark Energy,0.1666666667,0.1304334554,,
59780625,Refined definition of the beam brightness as the arithmetic mean of the distribution function,0.1976190476,0.1303870732,,
75254C12,Bayesian Multi‐net Classifier for classification of remote sensing data,0.1574074074,0.1303418803,,
7D65DDBA,The effect of vegetation on pesticide dissipation from ponded treatment wetlands: Quantification using a simple model,0.2407407407,0.130329547,,
7EB5B002,Investigating Topic Models' Capabilities in Expression Microarray Data Classification,0.180952381,0.1303252303,,
80C8D141,A Multiple‐Record Systems Estimation Method that Takes Observed and Unobserved Heterogeneity into Account,0.1574074074,0.1303252303,,
77C05926,A Max-Product EM Algorithm for Reconstructing Markov-Tree Sparse Signals From Compressive Samples,0.1865079365,0.1303196803,,
76A0094C,Correlated equilibria in graphical games,0.15,0.1303030303,,
81868666,Computing Lower and Upper Expectations under Epistemic Independence,0.15,0.1303030303,,
7DD13DF4,Computing lower and upper expectations under epistemic independence,0.15,0.1303030303,,
788F5619,A review of some Bayesian Belief Network structure learning algorithms,0.1574074074,0.1302706553,,
7F38C810,Models for Patch Based Image Restoration,0.1439393939,0.1302331002,,
81F715B6,Learning the Structure of Probabilistic Graphical Models with an Extended Cascading Indian Buffet Process,0.1439393939,0.1302331002,,
7D9AA02E,Multi-view image denoising based on graphical model of surface patch,0.1439393939,0.1302331002,,
782C43AA,Incorporating Object Tracking Feedback into Background Maintenance Framework,0.1272727273,0.1302331002,,
5CD8FBDB,Learning the structure of image collections with latent aspect models,0.1666666667,0.1301545677,,
7E3FD773,Emulating output queueing with the Central-stage Buffered Clos packet switching network,0.1296296296,0.1300453515,,
065B3209,A Hybrid Graphical Model for Aligning Polyphonic Audio with Musical Scores,0.1785714286,0.1299450549,,
7899E519,Sparse autoregressive model estimation for learning granger causality in time series,0.1666666667,0.1299284049,,
7DD10D21,Disaster management model based on Modified Fuzzy Cognitive Maps,0.1439393939,0.1299034299,,
7FF00E40,Study on the DFG model method based on SOPC technology,0.1439393939,0.1299034299,,
7E4489DC,Research on Personal Credit Evaluation Model Based on Bayesian Network and Association Rules,0.1805555556,0.1298999612,,
78DD597D,Graphical Model-based Approaches to Target Tracking in Sensor Networks: An Overview of Some Recent Work and Challenges,0.167989418,0.129880437,,
77CC9AA2,Graphical modeling based gene interaction analysis for microarray data,0.1574074074,0.1298238798,,
78C02B88,Approach to the correlation discovery of Chinese linguistic parameters based on Bayesian method,0.1574074074,0.1297017797,,
803D202E,Evaluating the impact of AND/OR search on 0-1 integer linear programming,0.1222222222,0.1296969697,,
7CE865A9,An integrated framework with UML and Object-Z for developing a precise and understandable specification: the light control case study,0.167989418,0.129696494,,
7DA6AFC7,Eigenvalue spectra and bounds for certain classes of dynamic systems having tree bond graphs,0.1785714286,0.1296877725,,
597273A8,Eigenvalue Spectra and Bounds for Certain Classes of Dynamic Systems having Tree Bond Graphs,0.1785714286,0.1296877725,,
6A5DBB7B,A model for design of globalized instruction for healthcare interventions in developing countries,0.180952381,0.1296814297,,
76558ADD,Model based user interface development with HCI patterns: variatio delectat,0.15,0.1296703297,,
7D6785E8,Modeling High-Dimensional Discrete Data with Multi-Layer Neural Networks,0.1574074074,0.1296296296,,
7AB84DDC,Directed Information Graphs: A generalization of Linear Dynamical Graphs,0.1976190476,0.1296103896,,
0C636321,Sparse Message Passing and Efficiently Learning Random Fields for Stereo Vision,0.1944444444,0.1295863858,,
813F3B9B,Automatic Mutual Nonrigid Registration of Dense Surfaces by Graphical Model Based Inference,0.1388888889,0.1294871795,,
7DB22FE1,Information-Theoretic Limits of Selecting Binary Graphical Models in High Dimensions,0.15,0.129458042,,
5F4F0484,AND/OR Branch-and-Bound for Solving Mixed Integer Linear Programming Problems,0.15,0.129458042,,
064D21C1,Computationally e cient methods for selecting among mixtures of graphical models,0.15,0.129458042,,
7963AE86,A Unifying Learning Framework for Building Artificial Game-Playing Agents,0.15,0.129458042,,
5EB237CF,Information-theoretic limits of selecting binary graphical models in high dimensions,0.15,0.129458042,,
7B9B8F2B,Connections between the lines: augmenting social networks with text,0.1666666667,0.1294444444,,
77EAC0FF,Modeling Protein Expression and Protein Signaling Pathways,0.1865079365,0.1293997669,,
78C4E2D7,SPIN: searching personal information networks,0.1976190476,0.1293447293,,
074FAD48,Discovering Linguistic Dependencies with Graphical Models,0.1574074074,0.1293447293,,
7CF1D0CA,Boosted Bayesian network classifiers,0.1574074074,0.1293447293,,
7A016082,Item Screening in Graphical Loglinear Rasch Models,0.1574074074,0.1293447293,,
77AC4EA1,A computational model to protect patient data from location-based re-identification,0.1574074074,0.1293447293,,
5F4A3D50,Smoothing LDA Model for Text Categorization,0.1296296296,0.1293447293,,
751F1B5F,An Unsupervised Algorithm to Extract Face Texture from Video,0.1785714286,0.1293406593,,
7BF3A1EC,Graphical model-based recursive motion prediction planning algorithm in stochastic dynamic environment,0.1785714286,0.1293406593,,
7A03929D,A Bayesian Framework to Rank and Combine Candidate Recurrence Models for Specific Faults,0.1439393939,0.1292873793,,
80F0AEE0,A fuzzy logic approach to infer transcriptional regulatory network in saccharomyces cerevisiae using promoter site prediction and gene expression pattern recognition,0.2407407407,0.1292337292,,
75B60884,Distributed Opportunistic Two-Hop Relaying With Backoff-Based Contention Among Spatially Random Relays,0.1583333333,0.1291666667,,
5979EFEB,A decomposition algorithm for learning Bayesian network structures from data,0.1574074074,0.1291059159,,
7D1162CE,A multi-modal graphical model for robust recognition of group actions in meetings from disturbed videos,0.1785714286,0.1290780648,,
8355FEC7,Modified random walker segmentation method of welding arc thermograms for welding process diagnostics,0.1666666667,0.1290527827,,
805E5B4D,A Message-Passing Approach to Combating Desynchronization Attacks,0.1407407407,0.128968254,,
597B49BF,Respecting Markov Equivalence in Computing Posterior Probabilities of Causal Graphical Features,0.1666666667,0.128956044,,
7C07DDDA,Process Oriented Information Systems Architectures in Healthcare,0.1698412698,0.128951049,,
7B24834E,Workflow Model of Equipment Maintenance Support Based on Petri-Net,0.1439393939,0.128951049,,
7AC9E26B,Estimating bedrock and surface layer boundaries and confidence intervals in ice sheet radar imagery using MCMC,0.25,0.1289335664,,
74FC81D4,Scalable Probabilistic Databases with Factor Graphs and MCMC,0.1865079365,0.1288156288,,
586B7157,Fitting Product of HMM to Human Motions,0.1785714286,0.1288156288,,
7C0E3ECE,Berry-Esseen bounds for estimating undirected graphs,0.1785714286,0.1288156288,,
7A294B5F,A graphic model for imaging of mathematical formulas,0.167989418,0.1288156288,,
791BF77A,Consistent model selection based on parameter estimates,0.1439393939,0.1288045288,,
7DC391AD,A New Graphical Game Model Based on MAIDs and AIDs,0.1439393939,0.1288045288,,
8104831D,P-brush: Continuous valued MRFs with normed pairwise distributions for image segmentation,0.1439393939,0.1287878788,,
79BAF6D2,Importance sampling for model-based reinforcement learning,0.1272727273,0.1287878788,,
7EF21572,From e3-value to REA: Modeling Multi-party E-business Collaborations,0.1082251082,0.1287878788,,
7F39101F,Reachability analysis of service process model based on polychromatic sets,0.1574074074,0.1287555038,,
5B861735,Decomposed Utility Functions and Graphical Models for Reasoning about Preferences,0.1574074074,0.1287555038,,
58D519B1,Multilocus linkage analysis by blocked Gibbs sampling,0.1574074074,0.1287393162,,
7E6F15D7,Beat Tracking the Graphical Model Way,0.1574074074,0.1287393162,,
75BF84DE,Extracting Protein Regulatory Networks with Graphical Models,0.1574074074,0.1287393162,,
767D07FD,"Modeling, analyzing, and synthesizing expressive piano performance with graphical models",0.1439393939,0.1286664724,,
5CD947A2,On the Representation of Codes in Forney Graphs,0.1369047619,0.1285714286,,
7B78FDAB,Familial tendency to foetal loss analysed with Bayesian graphical models by Gibbs sampling,0.15,0.1284188034,,
7F7A914A,Interval State Estimation in Signed Directed Graph Based on Sensitivity Matrix Method,0.1785714286,0.1284030784,,
5A1FCA87,COVERS 3.0 - A C++ Based Graphical Modeling and Simulation Tool,0.1388888889,0.1283882784,,
7799FCEB,Image Segmentation Based on Inhomogeneous Markov Random Field and Dirichlet Process Mixture,0.15,0.1283189033,,
7F7CBE28,Maximum a posteriori image restoration based on a new directional continuous edge image prior,0.15,0.1283189033,,
7A364046,Personalized password guessing: a new security threat,0.167989418,0.1282683983,,
7A5DBB0F,The Factor Graph Approach to Model-Based Signal Processing,0.1865079365,0.1282417582,,
75E25F35,A Scalable Modeling Language for Specifying Access Control in Tree Based Structures,0.1944444444,0.1281994048,,
7ED08972,A DOMAIN-SPECIFIC LANGUAGE TO DESIGN ENTERPRISE APPLICATION INTEGRATION SOLUTIONS,0.1666666667,0.1281818182,,
7E91859D,OO-METHOD: An OO Software Production Environment Combining Conventional and Formal Methods,0.15,0.1281818182,,
7A12A061,Creating non-minimal triangulations for use in inference in mixed stochastic/deterministic graphical models,0.1439393939,0.1281177156,,
7ABF07F1,Graphical modeling system supporting dynamic processing in a raster GIS,0.15,0.127972028,,
815996CF,Study on power system heterogeneous graphics exchange based on IEC 61968 location package and SVG,0.1785714286,0.127960928,,
7E7FEA71,Workflow Simulation for Maintenance Support of Electronic Instrument Based on HLA,0.1439393939,0.1278521479,,
80F721EC,Statistical modeling of biomedical corpora: mining the Caenorhabditis Genetic Center Bibliography for genes related to life span,0.1583333333,0.1278231028,,
7B1A89F9,Distributed Implementation of Collaborative Beamforming in Highly-Scattered Environments,0.15,0.1277777778,,
75D7FAA8,Techniques on developing context‐aware web services,0.1333333333,0.1275641026,,
5C53ED56,Understanding and improving belief propagation,0.1333333333,0.1275641026,,
7980CB47,Approximating high dimensional probability distributions,0.1666666667,0.1275252525,,
786A65BC,The Relationship between Modeling and Physiology Achievement.,0.130952381,0.1275252525,,
7681D397,Designing a Java graphics library for CS 1,0.1507936508,0.1273809524,,
813BFF82,Identifying significant edges in graphical models of molecular networks,0.1574074074,0.1273656899,,
02E0620E,Comparing barrier algorithms. Interim report,0.1574074074,0.1273656899,,
7DC3D521,Introduction to graphical models with an application in finding coplanar points,0.1388888889,0.1272893773,,
0F70A3A1,■ A Conceptual Model and Predicate Language for Data Selection and Projection Based on Provenance (long paper),0.1944444444,0.1272755023,,
8041E4C7,"Who, where, when and what: discover spatio-temporal topics for twitter users",0.155952381,0.1272727273,,
80F5447C,Evaluating FPGAs: capacity and utilization,0.1161616162,0.1272727273,,
5B80CA82,Management of Tracking for Mixed and Augmented Reality Systems,0.1439393939,0.1271853147,,
0852577A,A Dynamic Graphical Model to Represent Complex Survival Distributions,0.1439393939,0.1271853147,,
7A401BF5,Improved tree model for arabic speech recognition,0.1439393939,0.1271853147,,
7D368C19,Message-passing for Graph-structured Linear Programs: Proximal Methods and Rounding Schemes,0.1439393939,0.1271853147,,
5FF42FD5,An investigation into the utilization of a constructivist teaching strategy to improve preservice elementary teachers geological content knowledge: Is there a relationship between intellectual level and content understanding?,0.1666666667,0.127176395,,
6196904A,COLBERT: A Scoring Based Graphical Model for Expert Identification,0.1388888889,0.1271493213,,
75D20F05,Classification of input and output variables for a Bayesian model to analyze animal-related outages in overhead distribution systems,0.1976190476,0.1271068438,,
7ACE9AAE,Modeling Information Diffusion in Networks with Unobserved Links,0.1976190476,0.1270707071,,
5936A073,Simulation Based Optimization of Vertex Packing Decoding Algorithms,0.1346153846,0.1269950288,,
5B35BC52,Financial Networks as Directed Cyclic Graphs,0.1785714286,0.126984127,,
80EF5138,HSN-PAM: Finding Hierarchical Probabilistic Groups from Large-Scale Networks,0.1785714286,0.126984127,,
79BAEA39,Essential Graphs and Bayesian Networks,0.1785714286,0.126984127,,
7F38B3E6,Formal and graphical annotations for digital objects,0.167989418,0.126984127,,
80F7104C,WEIGHTED LASSO IN GRAPHICAL GAUSSIAN MODELING FOR LARGE GENE NETWORK ESTIMATION BASED ON MICROARRAY DATA,0.1574074074,0.126984127,,
8033839E,An introduction to factor graphs,0.1428571429,0.126984127,,
0C656F3E,Consistency Checking of RM-ODP Specifications,0.1263227513,0.126984127,,
7E16D608,A philosophy and software tool for teaching and learning signal processing and communication systems,0.15,0.1269314019,,
807FDDCC,A performance comparison of the bayesian graphical model and the Possibilistic graphical model applied in a brain MRI cases retrieval contribution,0.2333333333,0.1269304769,,
75600ED9,Decentralised data fusion in 2-tree sensor networks,0.1407407407,0.1269119769,,
76CF1D7A,"Divide, Conquer and Coordinate: Globally Coordinated Switching Linear Dynamical System",0.15,0.1268997669,,
77C30D36,Grouped graphical Granger modeling methods for temporal causal modeling,0.1439393939,0.1268939394,,
6A8B0CF8,"Approximating the Problem, not the Solution: An Alternative View of Point Set Matching",0.1439393939,0.1268037518,,
79AFFE9D,"Approximating the problem, not the solution: An alternative view of point set matching",0.1439393939,0.1268037518,,
624F5C99,Reusing domains for the construction of reverse engineering tools,0.1851851852,0.1267713768,,
7F161AD0,A low power architecture design method based on DFG model,0.1574074074,0.1267713768,,
