Paper ID,Title,Sim1,Sim2,,
58CD2468,Object-oriented programming for graphical modeling on the example of logistics network design,0.1574074074,0.0886039886,,
81135BBC,Independence in multi-way contingency tables : S.N. Roy's breakthroughs and later developments,0.15,0.0885714286,,
772AAFD3,"Computations of Bi-variable spatial relationships between the political divisions of Karnataka, India via Mahalanobis Distance",0.1666666667,0.0885664336,,
7EDA2D05,Prediction and expansion of biological networks from perturbation data with cyclical graphical models,0.1574074074,0.0884717135,,
7A2B2575,The Research of Simulation Technology in Nuclear Power Plant and the Application of Fuzzy Control in Temperature Control System,0.1574074074,0.0884676435,,
765AA460,Partial Gaussian Graphical Model Estimation,0.15,0.0884615385,,
5F985E92,Bayesian adjustment for multiplicity,0.15,0.0884615385,,
5CF27103,Human posture analysis under partial self-occlusion,0.15,0.0884615385,,
5DC305F8,On the Testability of Causal Models with Latent and Instrumental Variables,0.15,0.0884615385,,
842C2F17,A non-parametric hierarchical clustering model,0.15,0.0884615385,,
7F80B646,Executable Object-Oriented Graphical Models of Real-Time Software,0.15,0.0884615385,,
78B3A1C0,The analysis of contingency tables by graphical models,0.15,0.0884615385,,
7A2DCFC9,Discriminative graphical models for faculty homepage discovery,0.15,0.0884615385,,
02DC39A4,An environment for graphical models,0.15,0.0884615385,,
80ECB207,A Tighter Bound for Graphical Models,0.15,0.0884615385,,
072054D9,LifeNet: A Propositional Model of Ordinary Human Activity,0.15,0.0884615385,,
0B07C21B,Graphical models for structural VARMA representations,0.15,0.0884615385,,
81383FBC,Nonparametric belief propagation,0.15,0.0884615385,,
76E03002,Vines-a new graphical model for dependent random variables,0.15,0.0884615385,,
7D2B698F,Fractional Belief Propagation,0.15,0.0884615385,,
7A8D4C96,From the Guest Editor Special Issue on Graph-Based Representations,0.15,0.0884615385,,
857D83B8,Some examples of the conditional exponential models,0.15,0.0884615385,,
7F4908D3,Pairwise Clustering and Graphical Models,0.15,0.0884615385,,
80F78F03,Joint estimation of multiple graphical models,0.15,0.0884615385,,
7EBC63F1,Joint estimation of linear non-Gaussian acyclic models,0.15,0.0884615385,,
7CF6C4AF,An integrated color smalltalk-80 system,0.15,0.0884615385,,
8310A9DF,"On Message-Passing, MAP Estimation in Graphical Models and DCOPs",0.15,0.0884615385,,
58D05767,A new algorithm for maximum likelihood estimation in Gaussian graphical models for marginal independence,0.15,0.0884615385,,
819EE26B,Optimal Control in Large Stochastic Multi-agent Systems,0.15,0.0884615385,,
5CA38B16,Executable Object-Oriented Graphical Models of Real-Time Software,0.15,0.0884615385,,
7E807501,A Tighter Bound for Graphical Models,0.15,0.0884615385,,
7BF0668A,Binary models for marginal independence,0.15,0.0884615385,,
7FF97154,Statistical Models for Causation,0.15,0.0884615385,,
7CD67A42,A communication model for interactive POMDPs,0.15,0.0884615385,,
7B9B961C,Probabilistic graphical models in artificial intelligence,0.15,0.0884615385,,
7AAD6555,Multigraph representations of hierarchical loglinear models,0.15,0.0884615385,,
7B343035,Hardware-Efficient Belief Propagation,0.1037037037,0.0884615385,,
0C266AF7,Causal Discovery in Non-Ideal Frameworks,0.1037037037,0.0884615385,,
060FB969,Multy Edge Graphs for Multivariate Markov Chains,0.1369047619,0.0884271978,,
8169BC27,The Multi-Dimensional (MD) Physical Spaces: An Alternative Graphical Modeling Approach for Economics,0.1666666667,0.0884199134,,
7F0BA141,Bayesian feature selection in high‐dimensional regression in presence of correlated noise,0.15,0.0884149184,,
7E7FFD4B,On graphical modeling of preference and importance,0.1439393939,0.0883838384,,
793E1F7D,Unsupervised Image Layout Extraction,0.1439393939,0.0883838384,,
785E6D5B,Variational Bayesian Methods For Multimedia Problems,0.1439393939,0.0883838384,,
7F334842,Complete Identification Methods for the Causal Hierarchy,0.1439393939,0.0883838384,,
78B52A0A,In-vitro sub-cellular sampling of metabolites in biological samples,0.1439393939,0.0883838384,,
7854C618,Reconciliation of categorical opinions from multiple sources,0.1439393939,0.0883838384,,
78F8E65B,Image-based view synthesis for enhanced perception in teleoperation,0.1439393939,0.0883838384,,
7A10F3C0,Effectiveness of combinations of Gaussian graphical models for model building,0.1574074074,0.0883760684,,
8119E5AF,Anomalous diffusion and fractional self-similarity of ultra cold atoms in one dimension,0.15,0.0883522727,,
782FAF94,A Bayesian network model for surface roughness prediction in the machining process,0.1574074074,0.0883514634,,
799D0EC7,Integration of Epidemiological Evidence in a Decision Support Model for the Control of Campylobacter in Poultry Production,0.15,0.0883401321,,
7CB312F4,Model-Based Development of Integrated Computer Systems: Modeling the Execution Platform,0.1346153846,0.0883394383,,
81743882,Copula Gaussian graphical model for discrete data,0.1574074074,0.0883190883,,
80075029,Bayesian inference for categorical data analysis,0.1574074074,0.0883190883,,
7DE0DCAC,Sequential Monte Carlo for Bayesian matching of objects with occlusions,0.1574074074,0.0883190883,,
741EB60C,Complexity of Inference in Graphical Models,0.1574074074,0.0883190883,,
83A3E0CC,Scalable Algorithms for Population Genomic Inference,0.1574074074,0.0883190883,,
22C7BD37,Hierarchical probabilistic graphical models for large-scale data analysis,0.1574074074,0.0883190883,,
6360DE20,On model misspecification and KL separation for Gaussian graphical models,0.1574074074,0.0883190883,,
7F8FC766,MGraph: graphical models for microarray data analysis.,0.1574074074,0.0883190883,,
7DF4A78D,New closed-form bounds on the partition function,0.1574074074,0.0883190883,,
773A4194,Optimal design in collaborative design network,0.1574074074,0.0883190883,,
77E713D0,Transitive history-based query disambiguation for query reformulation,0.1506734007,0.0883190883,,
78D9D0D7,Markov properties of nonrecursive causal models,0.1157407407,0.0883190883,,
70029D1B,Efficient selection of disambiguating actions for stereo vision,0.15,0.0882886558,,
8150739D,Preliminary evaluation of global hand function measurement device,0.1574074074,0.0882561883,,
8061CCDE,Gender differences in living with schizophrenia. A cross-sectional European multi-site study,0.1574074074,0.0882561883,,
79A74410,Behavior of compiled bases in compilation-based inference methods for min-based possibilistic networks,0.1157407407,0.0882561883,,
7A1445B2,Growth and structure of the World Wide Web: Towards realistic modeling,0.15,0.0881818182,,
7EA41B76,"Hybrid body representation for integrated pose recognition, localization and segmentation",0.15,0.0881818182,,
59D1216D,Bayes linear analysis for graphical models: The geometric approach to local computation and interpretive graphics,0.1785714286,0.0880647131,,
8354B49F,Optimal primary-user mobility aware parameters design of spectrum sensing in cognitive radio networks,0.1574074074,0.088058172,,
5D9677AF,"Geometry, moments and conditional independence trees with hidden variables",0.1574074074,0.0880555556,,
790E9191,Hierarchical Graphical Models: An Application to Pulmonary Function and Cholesterol Levels in the Normative Aging Study,0.1574074074,0.0880349809,,
80DF1142,Reconstruction algorithm for high contrast velocity travel time tomography,0.1574074074,0.088017538,,
7E858056,The graphical models toolkit: An open source software system for speech and time-series processing,0.15,0.088014763,,
78BC71F4,El Ni�o as a Window of Opportunity for the Restoration of Degraded Arid Ecosystems,0.1574074074,0.0880050505,,
800C762D,A probabilistic image jigsaw puzzle solver,0.1583333333,0.0879139243,,
5EA67BEE,"Non-local characterization of scenery images: statistics, 3D reasoning, and a generative model",0.167989418,0.0878926629,,
796DBCF6,"Belief networks, hidden Markov models, and Markov random fields: a unifying view",0.1574074074,0.0878824879,,
5974D6E2,Efficient Belief Propagation for Utility Maximization and Repeated Inference,0.15,0.0878663004,,
7760660C,Kernel conditional random fields: representation and clique selection,0.15,0.0878521479,,
584E2B82,Stochastic control with graphical models: the influence view approach,0.15,0.0878521479,,
7702FA69,An investigation of local patterns for estimation of distribution genetic programming,0.15,0.0878521479,,
7E9636BC,"An algebraic graphical model for decision with uncertainties, feasibilities, and utilities",0.1574074074,0.0878399378,,
7A970FAF,Bayesian inference for general Gaussian graphical models with application to multivariate lattice data,0.1574074074,0.0878399378,,
597E0566,An automated translator for model checking time constrained workflow systems,0.1439393939,0.0878399378,,
086A007F,The use of interactive computer vision and robot hand controllers for enhancing manufacturing safety,0.15,0.0878288378,,
7DDCA2F7,Maximum likelihood estimates of allele frequencies and error rates from samples of related individuals by gene counting,0.15,0.0878251378,,
80951F84,Graphical models for localization of the seizure focus from interictal intracranial EEG,0.1666666667,0.0878205128,,
7EE6B867,A Formal Service Contract Model for Accountable SaaS and Cloud Services,0.1583333333,0.0878205128,,
75436151,Efficiency of influence diagram models with continuous decision variables,0.15,0.0878205128,,
7B473D41,Markov chain Monte Carlo methods for probabilistic network model determination,0.1574074074,0.0878010878,,
7A883B04,Nonparametric Convergence Assessment for MCMC Model Selection,0.15,0.0877913753,,
5E8152A9,diSNei: A Collaborative Environment for Medical Images Analysis and Visualization,0.15,0.0877913753,,
7B983ACB,"Graphical Models for Causation, and the Identification Problem",0.15,0.0877913753,,
13F18B26,Nonparametric Convergence Assessment for MCMC Model Selection,0.15,0.0877913753,,
13F3694E,"Myth, Confusion, and Science in Causal Analysis",0.1037037037,0.0877913753,,
7D4D8874,SampleSearch: Importance sampling in presence of determinism,0.1037037037,0.0877913753,,
004ECFFE,Parameter Priors for Directed Acyclic Graphical Models and the Characteriration of Several Probability Distributions,0.1666666667,0.0877664003,,
75CF408F,The indirect effect of safety investment on safety performance for building projects,0.15,0.0876433091,,
781CDC07,Neural networks from the ground up [Book Review],0.1574074074,0.087633547,,
7C1F1731,Unsupervised segmentation and approximation of digital curves with rate-distortion curve modeling,0.15,0.0876190476,,
78741161,Analysis of multivariate frequency data by graphical models and generalizations of the multidimensional row-column association model.,0.1574074074,0.087615559,,
7536FF63,Graphical probabilistic modeling and applications in multimedia content analysis,0.1574074074,0.0876068376,,
75191F45,Quantification of margins and uncertainties: A probabilistic framework,0.1574074074,0.0875929626,,
7753139E,Deformable Bayesian Network: A Robust Framework for Underwater Sensor Fusion,0.1574074074,0.0875929626,,
75F1DF57,Integrated approaches in fusion data analysis,0.1574074074,0.0875929626,,
7582DC24,Guest Editors' Introduction to the Special Section on Probabilistic Graphical Models,0.1666666667,0.0875686813,,
5F2746E1,Semantic analysis of flow patterns in business process modeling,0.15,0.0875679876,,
70BA601D,Stereo Image Processing and Virtual Reality in an Intelligent Robot Control System,0.15,0.0875679876,,
7922A8A9,Study on spatial-temporal distribution and tendency variation characteristics of annual precipitation in Jiangxi Province,0.1574074074,0.0875299304,,
7F709D45,Accelerated Dual Decomposition for MAP Inference,0.1346153846,0.0875080802,,
78740D73,Extremal rays and duals for cones of positive definite matrices with prescribed zeros,0.1574074074,0.0875,,
7FA71FA0,Happiness and Life Satisfaction in Advanced European Countries,0.15,0.0875,,
76A43366,A WSAD-Based Fact Extractor for J2EE Web Projects,0.1142857143,0.0875,,
378B6284,Graphical modelling and light intensity and distribution calculations of headlamps with mixed reflecting surface structure,0.15,0.0874797078,,
7A31679A,"Demo of the Generic Smart Alarm: a framework for the design, analysis, and implementation of smart alarms and other clinical decision support systems",0.1785714286,0.0874791875,,
8170680F,Exponential Family Predictive Representations of State,0.15,0.0874458874,,
7AB44742,Multi-scale Conditional Random Fields for first-person activity recognition,0.15,0.0874458874,,
0198A6AA,Studies in parallel image processing,0.15,0.0874458874,,
8223CACB,A Bayesian approach towards affordance learning in artificial agents,0.15,0.0874458874,,
7D8A44FE,Semiparametric estimation of marginal mark distribution,0.15,0.0874458874,,
81300982,Graphical modelling of multivariate time series,0.15,0.0874458874,,
7619FA11,Delta-Dual Hierarchical Dirichlet Processes: A pragmatic abnormal behaviour detector,0.15,0.0874458874,,
7A71F6AA,Sparse covariance estimation in heterogeneous samples,0.15,0.0874458874,,
5932098B,Bayesian parameter estimation via variational methods,0.15,0.0874458874,,
811F9651,Universality for the noisy Slepian-Wolf problem via spatial coupling,0.15,0.0874458874,,
75680B46,Likelihood-Based Selection and Sharp Parameter Estimation,0.15,0.0874458874,,
594207FB,Tree-reweighted belief propagation algorithms and approximate ML estimation by pseudo-moment matching,0.15,0.0874358974,,
079C8E7C,Structure Learning of Markov Logic Networks through Iterated Local Search,0.1574074074,0.0874357124,,
77882798,"Base stations from current mobile cellular networks: Measurement, spatial modeling and analysis",0.1574074074,0.0874357124,,
7AAD08B1,From business process models to pervasive applications: Synchronization and optimization,0.1574074074,0.0874357124,,
80B8CBC0,Experimental and observational patterns of density-dependent settlement and survival in the marine fish Gobiosoma,0.15,0.0874331551,,
75AE7073,Multivariate reconstruction of lymphocyte profiles in a two-dimensional graphical model as a tool for the investigation of lymphocyte subset distribution in health and disease.,0.1666666667,0.0874310874,,
75F73F44,Discovery of root causes of system failures by means of analysis of repair records,0.1203703704,0.0874283124,,
7D190FAF,Graphical models for driver behavior recognition in a SmartCar,0.1439393939,0.0874125874,,
78A198E6,A model driven visualization platform for workflow,0.0972222222,0.0874084249,,
5B472BA3,An empirical comparative study of approximate methods for binary graphical models; application to the search of associations among causes of death in French death certificates,0.1574074074,0.0873813056,,
80408C1D,Impact of mobility on energy provisioning in wireless rechargeable sensor networks,0.1574074074,0.0873304936,,
5F65DAC7,A Bayesian Approach to Attention Control and Concept Abstraction,0.15,0.0873160173,,
810B6B6A,The joint graphical lasso for inverse covariance estimation across multiple classes,0.1574074074,0.0873015873,,
5BAC4AE7,Comparison of low complexity turbo-like coding structures,0.1574074074,0.0873015873,,
7F1C3888,Sparse inverse covariance estimation with the graphical lasso,0.1574074074,0.0873015873,,
5AE231DF,The logic of Bayesian networks and influence diagrams,0.1574074074,0.0873015873,,
814C7133,Computer Graphics Modeling Of The Musculoskeletal System Of The Human Arm,0.1785714286,0.0872893773,,
7EBF023A,Dynamic analysis and design of static series compensators for unbalanced AC voltage supplies,0.1574074074,0.0872771673,,
7FDFFAE3,Influence Diagrams for Capacity Planning and Pricing under Uncertainty,0.1157407407,0.0872414622,,
771FD39C,Suitable Location Model Selection in the Terminology of Graphical Models,0.15,0.0871328671,,
76F6AF36,Non stationary Bayesian image restoration,0.1439393939,0.0871212121,,
5BFAC0F9,Advances in Bayesian Learning,0.1439393939,0.0871212121,,
782632C6,On boundary solutions and identifiability in categorical regression with non‐ignorable non‐response,0.1439393939,0.0871212121,,
7A6DF55A,The implementation and evaluation of a virtual haptic back,0.1439393939,0.0871212121,,
01C06155,Functional Modeling of Structured Images,0.1439393939,0.0871212121,,
7C42E698,Seamless tangible interaction through selective stylization,0.1439393939,0.0871212121,,
769E07DE,Spatial Conceptions in Chinese and Canadian Children,0.1439393939,0.0871212121,,
7F58C94A,Some recent advances in the process world view,0.1439393939,0.0871212121,,
75894C32,Hidden Markov model-based probabilistic assessment of droughts,0.1439393939,0.0871212121,,
7B41CD3C,The Wishart Distributions on Homogeneous Cones,0.1439393939,0.0871212121,,
7F3E0583,Exact and Approximate Sampling by Systematic Stochastic Search,0.1439393939,0.0871212121,,
7.8353E+072,Symbolic Modeling of Epistasis,0.1439393939,0.0871212121,,
3591691,Classification et extension automatique d'annotations d'images en utilisant un réseau Bayésien,0.0939393939,0.0871212121,,
76C72039,Practical safety in flexible access control models,0.15,0.0870879121,,
76231E5F,Bayesian networks for student model engineering,0.1574074074,0.0870726496,,
5E96D355,Planning in Multiagent Expedition with Collaborative Design Networks,0.1574074074,0.0870726496,,
7C0E9FDD,"An algorithm with linear complexity for interactive, physically-based modeling of large proteins",0.1574074074,0.0870726496,,
58C24D67,Graphical Models for Protein Function and Structure Prediction,0.1574074074,0.0870726496,,
7A7B6E32,Dependence trees with copula selection for continuous estimation of distribution algorithms,0.1574074074,0.0870393495,,
81395C8C,Mining Genetic Epidemiology Data with Bayesian Networks Application to APOE Gene Variation and Plasma Lipid Levels,0.1574074074,0.0870245441,,
7EC8658B,Performance Evaluation of the Parallel Polytree Approximation Distribution Algorithm on Three Network Technologies,0.1574074074,0.0870161584,,
7FF5263B,Mining entity types from query logs via user intent modeling,0.1785714286,0.0870058513,,
78386761,Estimation of transformation of flood runoff hydrographs and water stages in the Lower Volga and its delta,0.15,0.0869900932,,
7A7666DB,Probabilistic inference over sensor networks for clusters: Extension to multiple states,0.1574074074,0.086966737,,
813185F4,Decomposition of Logic Functions in Reed-Muller Spectral Domain,0.1574074074,0.0869479105,,
7728A143,Estimation and Application of a Bayesian Network Model for Discrete Travel Choice Analysis,0.1574074074,0.0869352869,,
58693E1F,Interactive session: preaching what you practice model-based reasoning in engineering,0.15,0.0868997669,,
78AD8363,"A hypothesize-and-bound algorithm for simultaneous object classification, pose estimation and 3D reconstruction from a single 2D image",0.15,0.0868997669,,
8171A476,A Graphical Framework for Spectrum Modeling and Decision Making in Cognitive Radio Networks,0.1574074074,0.0868728494,,
5DA9EEA4,On factorization of positive functions,0.1574074074,0.0868055556,,
806A71F0,iSAM2: Incremental smoothing and mapping with fluid relinearization and incremental variable reordering,0.1574074074,0.0868055556,,
7CEC5799,Applications of belief propagation in CSMA wireless networks,0.1157407407,0.0867735043,,
80D41112,Applications of Belief Propagation in CSMA Wireless Networks,0.1157407407,0.0867735043,,
7698D6DC,A Constrained L1 Minimization Approach to Sparse Precision Matrix Estimation,0.15,0.0867532468,,
80108BDB,Multimodality of the likelihood in the bivariate seemingly unrelated regressions model,0.15,0.0867521368,,
7EE47C26,On the identification of discrete graphical models with hidden nodes,0.15,0.0867521368,,
047589A5,Graphical Models for Conditional Independence Structures,0.15,0.0867521368,,
6AA2A895,A Parallel Implementation Of Hierarchical Belief Propagation,0.15,0.0867521368,,
75277D5F,Local computations in Dempster--Shafer theory of evidence,0.15,0.0867521368,,
317A4598,KOLTUN V.: A probabilistic model for component-based shape synthesis,0.15,0.0867521368,,
80E2A44F,Graphical models-based track association algorithm,0.15,0.0867521368,,
812C1569,Sufficient Conditions for Convergence of the Sum–Product Algorithm,0.15,0.0867521368,,
7E14A0F0,Graphical modeling and decoding of human actions,0.15,0.0867521368,,
755D5E8E,Graphical regression models for polytomous variables,0.15,0.0867521368,,
5CAF4274,A multi-layer hybrid framework for dimensional emotion classification,0.15,0.0867521368,,
77D615A3,Towards robust graphical models for GNSS-based localization in urban environments,0.15,0.0867521368,,
7F4EA2A0,Bayesian Compressive Sensing Via Belief Propagation,0.15,0.0867521368,,
77C9D6F1,Probabilistic Graphical Models and Their Applications in Intelligent Environments,0.15,0.0867521368,,
5D5A6EED,Bayesian Compressive Sensing via Belief Propagation,0.15,0.0867521368,,
754C096A,COGENT: A visual design environment for cognitive modeling,0.15,0.0867521368,,
031D863E,Graphical Models Oxford Statistical Science Series 17,0.15,0.0867521368,,
792AB279,Conditional independence structures and graphical models,0.15,0.0867521368,,
7CBD3130,A probabilistic model for component-based shape synthesis,0.15,0.0867521368,,
7767012C,Possibility theory: Conditional independence,0.15,0.0867521368,,
7DC48B6A,Tabu Search-Enhanced Graphical Models for Classification in High Dimensions,0.15,0.0867521368,,
7A5CF40A,A Domain-Specific Metamodel for Multimedia Processing Systems,0.1142857143,0.0867521368,,
803799AB,Self-Adaptive Evidence Propagation on Manycore Processors,0.1037037037,0.0867521368,,
811DC226,Modeling and Inference of Sequence-Structure Specificity,0.1037037037,0.0867521368,,
5AF5517A,Enumeration Conservation Law and Natural Parallelism of the D -algorithms for Test Generation and Modeling in Engineering Diagnostics,0.162037037,0.0867467663,,
0FD8C4B7,Relational Logistic Regression: The Directed Analog of Markov Logic Networks,0.1574074074,0.0867410367,,
80FBF509,An application of online learning algorithm for Bayesian network parameter,0.1574074074,0.0867410367,,
7A404709,Graphic modeling of epithelial transport system: causality of dissipation,0.1666666667,0.0867216117,,
6CCA4BE1,Split Bregman Method for Sparse Inverse Covariance Estimation with Matrix Iteration Acceleration,0.15,0.0866522367,,
06D71796,Directed graphical models of classifier combination: application to phone recognition,0.1574074074,0.0866420616,,
5BCA3625,Sonar image quality assessment for an autonomous underwater vehicle,0.1666666667,0.0866341991,,
7A3AED52,Contextual Modeling of Personality States' Dynamics in Face-to-Face Interactions,0.1666666667,0.0866341991,,
78EC20E2,Probabilistic framework for evaluation of smart grid resilience of cascade failure,0.1439393939,0.0865967366,,
75EFA24E,Approaches to selection and their effect on fitness modelling in an Estimation of Distribution Algorithm,0.1083333333,0.0865634366,,
74E4D962,DEPEND: a simulation environment for system dependability modeling and evaluation,0.1037037037,0.0864996115,,
7B3A502D,Small Baseline Subset (SBAS) pixel density vs. geology and land use in semi-arid regions in Syria,0.1666666667,0.0864989177,,
307A52A1,Probabilistic Graphical Models for Prognosis and Diagnosis of Breast Cancer,0.167989418,0.0864899806,,
77F4FEAB,New probabilistic graphical models for genetic regulatory networks studies,0.1574074074,0.0864875865,,
45AF6488,Graphical models and point set matching,0.1574074074,0.0864875865,,
069DE568,Function Optimization with Latent Variable Models,0.1574074074,0.0864875865,,
8169165B,Power Watershed: A Unifying Graph-Based Optimization Framework,0.1574074074,0.0864875865,,
7DB7213B,Fast matching of large point sets under occlusions,0.1574074074,0.0864875865,,
7B3F1CBC,On dual power assignment optimization for biconnectivity,0.1574074074,0.0864875865,,
5C93D1E1,A brief introduction to graphical models and bayesian networks,0.1574074074,0.0864875865,,
7DE25D91,Bayesian evolutionary algorithms for continuous function optimization,0.1574074074,0.0864875865,,
77ADA1E0,Statistical analysis of complex health and social data,0.1574074074,0.0864875865,,
0063708E,From neural networks to graphical models: a brief introduction,0.1574074074,0.0864875865,,
7F98C3CD,Graphical models of separation logic,0.1574074074,0.0864875865,,
7E1FB6E3,Knwoledge revision in Markov networks,0.1157407407,0.0864875865,,
75E570D1,Markov logic networks,0.1157407407,0.0864875865,,
7DC98D38,Profile likelihood in directed graphical models from BUGS output,0.1666666667,0.0864350356,,
7F70E6CF,An Efficient Approach to Graphical Modeling of Time Series,0.15,0.0864177489,,
7CDBA90A,Configuration of work environments with smart furniture,0.15,0.0864177489,,
0647561D,Inference in Sensor Networks: Graphical Models and Particle Methods,0.1574074074,0.0863673364,,
789D79C3,Uptake of cationic dyes by sulfonated coal: Sorption mechanism,0.1439393939,0.0863636364,,
79D57CD8,Experiments with graphical model implementations of multiple target multiple Bernoulli filters,0.167989418,0.0863553114,,
0C2C26A0,A comparison study of inferences on graphical model for registering surface model to 3D image,0.1439393939,0.0863407426,,
80A5EFA2,A Distributed Recursive Maximum Likelihood Implementation for Sensor Registration,0.15,0.0863369963,,
484AC565,Dynamic Bayesian learning by expectation propagation,0.1439393939,0.0862470862,,
7F5744CE,Graphical model: The means for simulation-based learning,0.1439393939,0.0862470862,,
63E7C4CF,Gaussian Models in Automatic Speech Recognition,0.1439393939,0.0862470862,,
59027CA4,Unsupervised learning of visual feature hierarchies,0.1439393939,0.0862470862,,
7D1F9246,VIEW: a VIsual sciEntificWorkflow management system,0.1439393939,0.0862470862,,
7E8023E0,Maximum entropy relaxation for multiscale graphical model selection,0.1439393939,0.0862470862,,
