Paper ID,Title,Sim1,Sim2,,
5A17FAFA,INFRAWEBS Designer – A Graphical Tool for Designing Semantic Web Services,0.15,0.1050549451,,
5E30878B,Spatial distribution of charged particle emission in a copper-chromium high-current vacuum arc,0.1439393939,0.1050505051,,
815175FA,Automatic extraction of femur contours from calibrated x-ray images: A Bayesian inference approach,0.15,0.105028305,,
7CAE85B8,Three new graphical models for statistical language modelling,0.1944444444,0.105006105,,
775C0E14,A Deep Hybrid Model for Weather Forecasting,0.1805555556,0.105006105,,
7E5E9CA0,A top down approach to semi-structured database design,0.1805555556,0.105006105,,
7E9BF569,Rethinking cognitive architecture via graphical models,0.1346153846,0.105006105,,
77EF1503,A modelling language for cooperative plans in highly dynamic domains,0.1944444444,0.104978355,,
7541B476,Knowledge discovery from database and its application in remote sensing inversion,0.1805555556,0.1049603175,,
7FB3A0E9,Signal processing with factor graphs: examples,0.1785714286,0.1049450549,,
76222EFA,Control of group of mobile autonomous agents via local strategies,0.1785714286,0.1049450549,,
7AB23632,Chordal Graph Models of Contingency Tables,0.1369047619,0.1049450549,,
75F71BD7,Extended Semantics and Optimization Algorithms for CP‐Networks,0.1068376068,0.1049450549,,
02B6B56F,Motion Context: A New Representation for Human Action Recognition,0.1785714286,0.1049350649,,
7CC3C794,Joint pose estimation and action recognition in image graphs,0.1785714286,0.1049350649,,
75C47612,Functioning and disability in people living with spinal cord injury in high- and low-resourced countries: a comparative analysis of 14 countries,0.1666666667,0.1048738299,,
830AFAC7,Decision Networks for Modeling and Analysis of Attack/Defense Scenarios in Critical Infrastructures,0.1574074074,0.1048238798,,
62517657,Tuning parameter selection for penalized likelihood estimation of inverse covariance matrix,0.15,0.1048237477,,
7A63EEE8,Case-control association testing by graphical modeling for the Genetic Analysis Workshop 17 mini-exome sequence data,0.1574074074,0.1048150262,,
7727C3B4,Research on a method for analysis of ship traffic density in harbor water area based on GIS,0.1574074074,0.1047986476,,
79A74039,Fault tree analysis of dust suppression mechanism in a spray system with wetting agent,0.1333333333,0.1047931235,,
5C10069D,"The effects of periphyton, fish and fertilizer dose on biological processes affecting water quality in earthen fish ponds",0.1666666667,0.1047294209,,
7F7E817E,Jointly interventional and observational data: estimation of interventional Markov equivalence classes of directed acyclic graphs,0.1785714286,0.1047016476,,
77F87401,Towards an Integrated Protein–Protein Interaction Network: A Relational Markov Network Approach,0.1574074074,0.1046916047,,
7A7A764E,MODELING DRINKING WATER QUALITY VIOLATIONS WITH BAYESIAN NETWORKS1,0.1666666667,0.1046703297,,
79DB8EE6,MAP decoding for LDPC codes over the binary erasure channel,0.1785714286,0.1045238095,,
814D9781,A Novel Graphical Model Approach to Segmenting Cell Images,0.1439393939,0.1045188145,,
7E9DE0C2,A Probabilistic Graphical Model-based Approach for Minimizing Energy Under Performance Constraints,0.1439393939,0.1045188145,,
7606CF8F,Evaluating Harker and O'Leary's distance approximation for ellipse fitting,0.1161616162,0.1045188145,,
7D2A5727,A 3D object classifier for discriminating manufacturing processes,0.1296296296,0.1045066045,,
79464F12,Prototypical applications of cybernetic systems in architectural contexts : A tribute to Gordon Pask,0.1805555556,0.104458042,,
7E0E410A,Monitoring the occurrence of wound infections after cardiac surgery,0.1574074074,0.1043925519,,
2238973,Leveraging Domain Knowledge in Multitask Bayesian Network Structure Learning,0.1666666667,0.1043771044,,
083FB75D,Ranking by Dependence - A Fair Criteria,0.1574074074,0.1043771044,,
68FCD9B9,A hierarchical graphical model for record linkage,0.1666666667,0.1043447293,,
59DF4E25,Knowledge Graph Inference for spoken dialog systems,0.1785714286,0.1043406593,,
80D90664,LORA: robust and simple routing algorithms for ad hoc mobile wireless networks,0.1805555556,0.1043002137,,
789C4E8A,An Algebraic Watchdog for Wireless Network Coding,0.1574074074,0.1043002137,,
7A9B2DC7,"A Unified Approach to the Characterization of Equivalence Classes of DAGs, Chain Graphs with no Flags and Chain Graphs",0.1785714286,0.1042929293,,
75B6B340,Mismatched estimation and relative entropy in vector Gaussian channels,0.15,0.1042857143,,
7B6BC907,Testing-based translation validation of generated code in the context of IEC 61508,0.1369047619,0.1042748918,,
7CB0875C,Static and dynamic modeling of a diesel fed fuel cell power supply,0.1574074074,0.1042568543,,
63519E3D,The landscape of innovation and supply: a graphical model for visualising the interrelationship between the innovation functions and the supply chain,0.1666666667,0.1042511655,,
80F25241,Loopy Belief Propagation: Convergence and Effects of Message Errors,0.1944444444,0.1042346542,,
80F8BB3C,Modelling heterogeneous location habits in human populations for location prediction under data sparsity,0.1574074074,0.1042055167,,
7F324CBD,"Power watersheds: A new image segmentation framework extending graph cuts, random walker and optimal spanning forest",0.1785714286,0.1041876179,,
5AC47C7B,Graphical structures in extreme multivariate events,0.1666666667,0.1041666667,,
7B9DAF13,Mathematical foundations of event trees,0.1666666667,0.1041666667,,
7E3636C8,A new reconstruction of multivariate normal orthant probabilities,0.1666666667,0.1041666667,,
7F4D2B7F,A mean field approach to MAP in belief networks,0.1574074074,0.1041269841,,
8339754B,Probabilistic graphical model for detecting spammers in microblog websites,0.1346153846,0.1040865385,,
7E75DDCC,A simple model for evaluating the costs and benefits of aquatic macrophytes,0.1346153846,0.1040865385,,
803C5207,Teaching Real Business Cycles to Undergraduates,0.1574074074,0.1040764791,,
59EA189E,Interaction graphs for multivariate binary data,0.1369047619,0.1040764791,,
5C7F6EA2,Formalism-Independent Specification of Ontology Mappings - A Metamodeling Approach,0.1263227513,0.1040764791,,
81196DC3,Engineering adaptable service oriented systems: A model driven approach,0.1388888889,0.1040554683,,
7F7BD68E,Workflow-centric distribution of organizational knowledge: the case of document flow coordination,0.1666666667,0.104040404,,
811331A4,Modeling by construction: a new methodology for constructing models for decision support,0.1439393939,0.104012654,,
7F342DE6,"Comments on ‘The BUGS project: Evolution, critique, and future directions’",0.1805555556,0.1039869281,,
7C8540FF,Introduction to the special issue on Graphical Models and Information Retrieval,0.1976190476,0.103956044,,
76003C8C,Robust Estimation of Latent Tree Graphical Models: Inferring Hidden States With Inexact Parameters,0.15,0.103956044,,
7E144371,A Recursive Method for Structural Learning of Directed Acyclic Graphs,0.1785714286,0.1038961039,,
7AD2AA26,A GRAPHICAL MODEL OF DISRUPTIVE SELECTION ON OFFSPRING SIZE AND A POSSIBLE CASE OF SPECIATION IN FRESHWATER GOBIES CHARACTERIZED BY EGG-SIZE DIFFERENCE,0.1574074074,0.1038504705,,
7EAD364B,Coordinated Rate Control in Wireless Sensor Network,0.1216931217,0.1038029101,,
5928E982,Visualization of Business Process Modeling Anti Patterns,0.1142857143,0.1037878788,,
6CBFD423,Structural Markov graph laws for Bayesian model uncertainty,0.1785714286,0.1037851038,,
80B9604E,Comparison of linear signal processing techniques to infer directed interactions in multivariate neural systems,0.15,0.1037656788,,
7B55B7B0,A simplified conceptual model of the human cervical spine for evaluating force transmission in upright static posture,0.15,0.1037656788,,
7F6EC92F,Cluster inference methods and graphical models evaluated on NCI60 microarray gene expression data.,0.1574074074,0.1037635975,,
7AA167D7,Differentiation and evaluation of evidence value of styrene acrylic urethane topcoat car paints analysed by pyrolysis-gas chromatography,0.15,0.1037560479,,
7D289F41,"Information geometry in optimization, machinelearning and statistical inference",0.1976190476,0.1037545788,,
5AF3B584,Incorporating Expressive Graphical Models in Variational Approximations: Chain-Graphs and Hidden Variables,0.15,0.1037545788,,
79318A11,Convex approaches to model wavelet sparsity patterns,0.1142857143,0.1037545788,,
77BB36BD,Relationship strength estimation for online social networks with the study on Facebook,0.1666666667,0.1037301587,,
747D4004,Generators for Synthesis of QoS Adaptation in Distributed Real-Time Embedded Systems,0.1666666667,0.1037179487,,
8166A247,"Max-Product for Maximum Weight Matching: Convergence, Correctness, and LP Duality",0.1574074074,0.1037037037,,
74A96950,Ambiguous climate impacts on competition between submerged macrophytes and phytoplankton in shallow lakes,0.1574074074,0.1036556037,,
7FC07E04,Reduction of Graphical Model and Genetic Algorithm for Computing Approximate Nash Equilibrium in Static Games,0.15,0.1036130536,,
7E64C272,Structural analysis of steering wheel grip comfort by semantic differential method,0.15,0.1035724779,,
04BC702D,INFORMATION STRUCTURE FOR INTEGRATION OF FACILITY PROJECTS AT OPERATIONAL AIRPORTS,0.1976190476,0.1035714286,,
788AD094,CoBayes: bayesian knowledge corroboration with assessors of unknown areas of expertise,0.1726190476,0.1035714286,,
7.9628E+101,Conditional models for contextual human motion recognition,0.1785714286,0.1035631036,,
7D12D92A,On the optimality of solutions of the max-product belief-propagation algorithm in arbitrary graphs,0.1785714286,0.1035631036,,
7C2EDA5B,3-D IFS fractals as real-time graphics model,0.1785714286,0.1035631036,,
7BD88746,Random graph models for temporal processes in social networks*,0.1785714286,0.1035631036,,
8038EF0E,Conditional models for contextual human motion recognition,0.1785714286,0.1035631036,,
7ED2FD7E,VHS to VRML: 3D graphical models from video sequences,0.1785714286,0.1035631036,,
7CD43F3F,Video analysis for Cartoon-style Special Effects,0.1785714286,0.1035631036,,
7DAACEE4,Statistical Characterization of Protein Ensembles,0.167989418,0.1035631036,,
02E13CBD,Enhancing the Predictive Performance of Bayesian Graphical Models,0.1439393939,0.1035631036,,
77EBFAF0,Label propagation in video sequences,0.1369047619,0.1035631036,,
796A67CF,Chain graphs for multilevel models,0.1369047619,0.1035631036,,
79E7D2E8,Discrete chain graph models,0.1369047619,0.1035631036,,
80FB3ACA,Design of turbo codes interleaver by loop distributions,0.1369047619,0.1035631036,,
59AA9D70,Interaction Model: Overview,0.117989418,0.1035631036,,
766DEF7A,Piecewise training for structured prediction,0.1022727273,0.1035631036,,
79172C9C,Zeta: a resolution modeling system,0.117989418,0.1035561661,,
78556A36,Graphical modeling and optimization of air interface standards for Software Defined Radios,0.1574074074,0.103546627,,
800DE994,Extension of Path Probability Method to Approximate Inference over Time,0.130952381,0.1035214785,,
5E17CDAE,On a new conservation law resulting from sedimentary basin dynamics,0.1574074074,0.1034401709,,
765AE53C,Modeling random CSMA wireless networks in general fading environments,0.1574074074,0.1034401709,,
7B763A5D,Probabilistic graphical detector fusion for localization of faces and facial parts,0.1439393939,0.1034199134,,
7AD5581B,Joint Chinese Word Segmentation and POS Tagging System with Undirected Graphical Models: Joint Chinese Word Segmentation and POS Tagging System with Undirected Graphical Models,0.15,0.1034188034,,
802C0034,Raising the level of abstraction in the development of GMF-based graphical model editors,0.1574074074,0.1032865283,,
802DA681,Gradient-based boosting for statistical relational learning: The relational dependency network case,0.1574074074,0.1032828283,,
58FA960D,Directed Evidential Networks with Conditional Belief Functions,0.1574074074,0.1032828283,,
5A8AACE3,Spatial correlation of vertical gradient of refractivity on large scales,0.1574074074,0.1032828283,,
80410DD5,Conditional State Space Models for Discriminative Motion Estimation,0.1785714286,0.1032417582,,
7D5B9E48,Belief propagation for continuous state spaces: stochastic message-passing with quantitative guarantees,0.1726190476,0.1032417582,,
77EC3FF4,Quantized stochastic belief propagation: Efficient message-passing for continuous state spaces,0.1666666667,0.1032417582,,
6886B4DC,Optimal nonmyopic value of information in graphical models: efficient algorithms and theoretical limits,0.1976190476,0.1032367632,,
7A9310E4,Meta-modeling: a knowledge-based approach to facilitating process model construction and reuse,0.1161616162,0.1032367632,,
79D4621D,Boosting learning and inference in Markov logic through metaheuristics,0.1161616162,0.1032367632,,
7E58377F,Human Body Articulation for Action Recognition in Video Sequences,0.1785714286,0.1031866282,,
7EC35CB6,Artificial life for computer graphics,0.1785714286,0.1031746032,,
7707FA85,Adaptive updates for MAP configurations with applications to bioinformatics,0.167989418,0.1031746032,,
59123860,Textual Modelling Embedded into Graphical Modelling,0.130952381,0.1031746032,,
5C76E742,A Bayesian Approach to Modelling Graphical Vector Autoregressions,0.130952381,0.1031746032,,
7A8BE763,A Bayesian Approach to Modelling Graphical Vector Autoregressions,0.130952381,0.1031746032,,
7832EBC2,Computing rank dependent utility in graphical models for sequential decision problems,0.1439393939,0.1031662782,,
7EE5954C,Distributed Cognitive Radio Network Management via Algorithms in Probabilistic Graphical Models,0.1574074074,0.1030610593,,
7EBE70BB,Detecting dynamic occlusion in front of static backgrounds for AR scenes,0.1574074074,0.1030610593,,
7C55587A,Testing coefficients of AR and bilinear time series models by a graphical approach,0.15,0.1030112744,,
7D44BA64,On the relationship between deterministic and probabilistic directed Graphical models: From Bayesian networks to recursive neural networks,0.1666666667,0.103010878,,
80FADDD2,Bayesian network inference with qualitative expert knowledge for group decision making,0.1785714286,0.1030061209,,
7EB16982,Joint Sulcal Detection on Cortical Surfaces With Graphical Models and Boosted Priors,0.1388888889,0.103003663,,
768EB119,Overlapping Decomposition for Gaussian Graphical Modeling,0.1388888889,0.1029411765,,
809FD34A,Overlapping decomposition for causal graphical modeling,0.1388888889,0.1029411765,,
7FD29EBA,tRNA-like recognition of group I introns by a tyrosyl-tRNA synthetase,0.1507936508,0.1028860029,,
70CB78F8,Methodologies for Cross-Domain Data Fusion: An Overview,0.1263227513,0.1028860029,,
80F34584,"Graphical models, potential outcomes and causal inference: Comment on Ramsey, Spirtes and Glymour",0.1805555556,0.1028554779,,
7D8003E9,"Graphical models, potential outcomes and causal inference: Comment on Linquist and Sobel",0.1805555556,0.1028554779,,
798E5678,A probabilistic graphical model for joint answer ranking in question answering,0.1805555556,0.1028554779,,
7CB54F32,Geometrical Dependence of Thermally Excited Mag-Noise Spatial Distribution in Magnetic Tunnel Junction Sensors,0.1574074074,0.1028397528,,
7EAA7CF7,Scalable pattern mining with Bayesian networks as background knowledge,0.1666666667,0.1027777778,,
783D2945,Spatial mapping of non-uniform time-to-breakdown and physical evidence of defect clustering,0.1574074074,0.1027777778,,
743FEBF6,Multiple-Population Moment Estimation: Exploiting Interpopulation Correlation for Efficient Moment Estimation in Analog/Mixed-Signal Validation,0.1574074074,0.1027777778,,
7BF4609B,Bayesian Equalization for LDPC Channel Decoding,0.15,0.1027777778,,
7F9927F9,A model-based representation of configuration knowledge,0.130952381,0.1027777778,,
800516B5,Example-based 3D object reconstruction from line drawings,0.1203703704,0.1027777778,,
5DA4588B,A Meta-Model for the Dialog Flow Notation,0.1203703704,0.1027777778,,
75E8D4F0,Non-existence of Markovian time dynamics for graphical models of correlated default,0.1439393939,0.1027331002,,
7F05BC87,Distributed Evidence Propagation in Junction Trees on Clusters,0.1222222222,0.102724359,,
7A402AA3,Sculpting proteins interactively: Continual energy minimization embedded in a graphical modeling system,0.1388888889,0.1026949241,,
8138D709,Belief Propagation and LP Relaxation for Weighted Matching in General Graphs,0.1785714286,0.1026723277,,
7F4D4046,Variational Bayesian image processing on stochastic factor graphs,0.1785714286,0.1026723277,,
69FF2EB3,Gaussian Process Structural Equation Models with Latent Variables,0.167989418,0.1026723277,,
7A210146,Weighted Control of Traction Drives With Parallel-Connected AC Machines,0.1222222222,0.1026244589,,
7C94D419,A Dynamic Bayesian Network Model for the Production and Inventory Control,0.162037037,0.1026068376,,
8122A0CB,"A method and program for estimating graphical models for linkage disequilibrium that scale linearly with the number of loci, and their application to gene drop simulation",0.1574074074,0.1025658103,,
7A7CD9B8,Adventitious lung sounds imaging by ICA-TVAR scheme,0.15,0.1025641026,,
7F2C1029,Paradata and Bayesian networks: a tool for monitoring and troubleshooting the data production process,0.1574074074,0.102556174,,
7EB7257B,Exact inference and learning for cumulative distribution functions on loopy graphs,0.1785714286,0.1025419025,,
7E12C9CA,The Extraction and Complexity Limits of Graphical Models for Linear Codes,0.1785714286,0.1025419025,,
76494098,The Extraction and Complexity Limits of Graphical Models for Linear Codes,0.1785714286,0.1025419025,,
08468AE2,2005 Special Issue: On the relationship between deterministic and probabilistic directed Graphical models: From Bayesian networks to recursive neural networks,0.1666666667,0.102509065,,
772C765A,Simultaneous graphics and multislice raster image display for interactive image-guided surgery,0.1785714286,0.1024350649,,
78720DB5,Spatial patterns of SMOS downscaled soil moisture maps over the remedhus network (Spain),0.1574074074,0.1024200337,,
7E756CDB,SwingStates: adding state machines to Java and the Swing toolkit,0.1142857143,0.1023809524,,
779B0F80,"Doubly-Colored Graphs as Graphical Models for Subductions of Coset Representations, Double Cosets, and Unit Subduced Cycle Indices",0.1785714286,0.1023206952,,
7229CCF7,Max-product dynamical systems and applications to audio-visual salient event detection in videos,0.1785714286,0.1022893773,,
76E81A99,Message error analysis of loopy belief propagation,0.1944444444,0.1022843823,,
5E6FB799,High-dimensional probability density estimation with randomized ensembles of tree structured bayesian networks,0.1666666667,0.1022443826,,
7DE5AF62,"The Reactive Scope Model - a new model integrating homeostasis, allostasis, and stress.",0.1574074074,0.1022403522,,
77B46927,"[Bayesian Analysis in Expert Systems]: Comment: Graphical Models, Causality and Intervention",0.1805555556,0.1022241647,,
7BC1FABD,"Bayesian data mining, with application to benchmarking and credit scoring",0.1805555556,0.1022222222,,
80655C8D,Compiling constraint networks into AND/OR multi-valued decision diagrams (AOMDDs),0.1574074074,0.1022222222,,
7EF3CB96,Recursive object model (ROM)-Modelling of linguistic information in engineering design,0.1976190476,0.1022181522,,
760ADA2E,Video segmentation with joint object and trajectory labeling,0.1785714286,0.1021825397,,
75166BC5,Training Initialization of Hidden Markov Models in Human Action Recognition,0.167989418,0.1021020646,,
7FFDA4E7,"Automated fault tolerance evaluator for system design, simulation, and analysis",0.1272727273,0.1020541958,,
810CFB08,"A UAS capability description framework: Reactive, adaptive, and cognitive capabilities in robotics",0.1805555556,0.1020512821,,
7FEB43A7,Equivalent textual description and lexical analysis of Petri Net,0.1805555556,0.1020299145,,
7CE8557A,Modeling a real-time multitasking system in a timed PQ net,0.1346153846,0.1020299145,,
7822A268,Effectiveness of potent antiretroviral therapy on progression of human immunodeficiency virus: Bayesian modelling and model checking via counterfactual replicates,0.15,0.102022977,,
5B4AD847,Object Oriented Programming and Finite Element Analysis: Achieving Control Over the Calculation Process,0.1574074074,0.1020153458,,
7FE0C7D7,"Partial correlation analysis indicates causal relationships between GC-content, exon density and recombination rate in the human genome",0.1666666667,0.1019764957,,
752AB5A6,Parameterizations and Fitting of Bi‐directed Graph Models to Categorical Data,0.1785714286,0.101953602,,
5B63AB2D,Gibbs and Markov properties of graphs,0.1369047619,0.101953602,,
6CD8BE0D,"Automated Intervertebral Disc Detection from Low Resolution, Sparse MRI Images for the Planning of Scan Geometries",0.1574074074,0.1019507045,,
6BCAFA14,Particle tracking proxies for prediction of CO₂ plume migration within a model selection framework,0.1407407407,0.1019209186,,
81436EA3,A contextual maximum likelihood framework for modeling image registration,0.15,0.1019036519,,
7EC6C175,Measures of nonspecificity for decomposing possibility distributions,0.1082251082,0.1018939394,,
5FBA2F23,Decomposing utility functions in Bounded Max-Sum for distributed constraint optimization,0.1574074074,0.1018925519,,
59D8E069,Collective Classification with Relational Dependency Networks,0.1574074074,0.1018518519,,
606A459B,Truncating the loop series expansion for Belief Propagation,0.1222222222,0.1018086081,,
082C9620,Editorial: Introduction to the special issue on Graphical Models and Information Retrieval,0.1976190476,0.1017815518,,
78EE7869,Modeling challenges with influence diagrams: Constructing probability and utility models,0.130952381,0.1017399267,,
0A8AA500,Copula-based Approaches to Characterization of Droughts,0.117989418,0.1017316017,,
7BF16325,A Modeling and Analysis Approach for Mobile Information Systems,0.1976190476,0.1017216117,,
7803924C,SIMOBJECT: from rapid prototype to finished model—a breakthrough in graphical model building,0.1388888889,0.1017216117,,
814FF196,SIMOBJECT: from rapid prototype to finished model—a breakthrough in graphical model building,0.1388888889,0.1017216117,,
7BA6D9BD,A computer-graphic display for real-time operator feedback during interventional x-ray procedures,0.125,0.1017045455,,
7E5E735B,Spatial compactness meets topical consistency: jointly modeling links and content for community detection,0.1574074074,0.1016414141,,
815419D2,A Probabilistic Algorithm Integrating Source Localization and Noise Suppression of MEG and EEG data,0.1666666667,0.1016292735,,
0103F709,Redistributive impact of the Atlanta mass transit system: a comment,0.1388888889,0.1016219891,,
77F89B85,Data mining of association structures to model consumer behaviour,0.1216931217,0.1015873016,,
78EEB089,A review of representation issues and modeling challenges with influence diagrams,0.1142857143,0.1014652015,,
786333FB,Aspect-oriented model-driven skeleton code generation: A graph-based transformation approach,0.1369047619,0.1014430014,,
73227B6B,Scheduling flexible manufacturing systems with the consideration of setup times,0.15,0.1014346764,,
80866B61,Hypergraph: an alternative graphical model for computing transfer functions in circuits and systems,0.1574074074,0.1014245014,,
79F03B15,Stochastic ordering and robustness in classification from a Bayesian network,0.1574074074,0.1013888889,,
5C60ECF7,Probabilistic Estimation of Peers’ Quality and Behaviors for Subjective Trust Evaluation,0.1666666667,0.1013636364,,
05894B87,Expected posterior priors for model comparison in a class of discrete graphical models.,0.1574074074,0.1013024013,,
799FD6B8,A characterization of the Dirichlet distribution through global and local parameter independence,0.167989418,0.1012987013,,
794F48AA,Isolated word recognition in the Sigma cognitive architecture,0.1642857143,0.1012987013,,
7EC1C043,A Study on Reliability in Graph Discovery,0.1369047619,0.1012987013,,
5F75C2F6,The author-recipient-topic model for topic and role discovery in social networks: Experiments with Enron and academic email,0.1976190476,0.1012210012,,
815ED5F1,A graphical simulation software for instruction in cardiovascular mechanics physiology,0.1976190476,0.1012179487,,
804309B5,Modeling Experts and Novices in Citizen Science Data for Species Distribution Modeling,0.1216931217,0.1011994949,,
7AA79541,Convergence of Min-Sum Message Passing for Quadratic Optimization,0.1944444444,0.1011904762,,
7EACEAD2,A software platform for fractionated spacecraft,0.1142857143,0.1011904762,,
02D2BD86,Fiber Connectivity Integrated Brain Activation Detection,0.1216931217,0.1011303511,,
75C37236,Determinants of Individual Tourist Expenditure as a Network: Empirical Findings from Uruguay,0.1574074074,0.1011111111,,
7F8FB6C0,Random Redundant Soft-In Soft-Out Decoding of Linear Block Codes,0.1785714286,0.101037851,,
80CCB8A4,Object Detection in Video with Graphical Models,0.1785714286,0.101037851,,
7CA39FD4,Fast globally optimal 2D human detection with loopy graph models,0.1785714286,0.101037851,,
7E0CC681,Interactive object-based analysis and manipulation of digital video,0.1785714286,0.101037851,,
7.7008E+064,Molecular graphics modeling of organometallic reactivity,0.1785714286,0.101037851,,
7C896D6A,Discriminative graphical models for sparsity-based hyperspectral target detection,0.167989418,0.101037851,,
809CBCBE,Segmentation-Based View-Dependent 3-D Graphics Model Transmission,0.1369047619,0.101037851,,
76E8733E,Endocardial Surface Delineation in 3-D Transesophageal Echocardiography,0.1216931217,0.101037851,,
7D0BC0CF,A new look at the generalized distributive law,0.1574074074,0.101010101,,
5F2CA706,Unsupervised Learning of Dense Hierarchical Appearance Represe,0.1574074074,0.101010101,,
