Paper ID,Title,Sim1,Sim2
76096697,"Experimental performance evaluation of location distinction for MIMO links",0.254369588745,0.326904761905
7DD8B072,"An analysis of CDMA 3G wireless communications standards",0.239384920635,0.368055555556
7A253BB3,"Radio resource management and protocol engineering for IEEE 802.16 [Guest Editorial]",0.132305194805,0.148881673882
7D851088,"Video communication with QoS guarantees over HIPERLAN/2",0.114393939394,0.122895622896
147CB50A,"SEQ PU Supersite - Introduction",0.0951853701854,0.105555555556
71D1A26B,"Tritium monitor and collection system",0.156651334776,0.175297619048
7477B437,"Neighbourhood backoff algorithm for optimizing bandwidth in single hop wireless ad-hoc networks",0.11498466811,0.116865079365
58818C94,"Planetary Crusts: Their Composition, Origin and Evolution: The oceanic crust of the Earth",0.115121336996,0.126785714286
7B2FDB41,"Mobile nursing cart with software defined radio for healthcare enterprises",0.13778998779,0.169387755102
77B43BC6,"ITRI WAVE/DSRC Communication Unit",0.114393939394,0.138888888889
798B4637,"The Design of Heart Sounds and Electrocardiogram Monitor System Based Atmega64",0.170341810967,0.168452380952
7D4C68CC,"Does monitoring end-tidal isoflurane concentration improve titration during general anesthesia?",0.117866161616,0.133792001649
5B9120C7,"DISTI | PROIZVODI - Servers",0.0825558632544,0.142857142857
055FD9EE,"DISTI | VIJESTI - Sarajevo Film Festival FAMILY DAY - Saturday 31.07.2010. starting at 11:00h",0.156502525253,0.144975394975
71EA18D5,"System performance of the EDGE concept for enhanced data rates in GSM and TDMA/136",0.291666666667,0.313746438746
0CEDA5B5,"Analyse des performances d'un systeme de transmission de sequences video comprimees H.263 et turbo-codees sur un lien UMTS/TDD descendant",0.227335858586,0.26071012321
7FAB1F57,"Research on PHY layer supporting MESH model in IEEE 802.16",0.280460858586,0.416666666667
5B3DE3A7,"Scalable multi-media information distribution architecture",0.130808080808,0.140740740741
7CEC2D59,"A scheme of Dual Carrier Modulation with Soft-decoding for MB-OFDM MIMO systems",0.266717657343,0.385416666667
809E1EA8,"Performance Analysis of OFDM System Using Adaptive FEC Code Control Technique for Mobile Wireless Communication",0.381502525253,0.358641975309
8010A55F,"Transmission of high speed data in cdma2000",0.110227272727,0.112037037037
816F9688,"Design and performance analysis of HomePNA 2.0 transceiver chip circuit",0.342866161616,0.490793650794
7E16D26C,"Caching in wireless networks",0.126497113997,0.167989417989
809C6C90,"Automated Channel and Performance Measurements for Narrowband MV- and LV-Power-Lines",0.220086163836,0.366964285714
7BF084E7,"60 GHz wireless communications: emerging requirements and design recommendations",0.13170544733,0.136646224146
7C0676BD,"Cooperative BICM-OFDM systems for frequency-selective relay channels",0.158920940171,0.180555555556
80E83BA9,"SCoTS-a system for testing equipment conformance to SMDS generic requirements",0.15718482906,0.208333333333
7C56A173,"System modeling and analysis of the IEEE 802.15.4 physical layer design",0.360557844933,0.51746031746
780B7490,"Minimizing Power Consumption of the DVB-H Receiver",0.115237193362,0.128472222222
82FDDC31,"Surveillance des greffes libres à l'aide d'une sonde Doppler implantable",0.1178495116,0.162698412698
854AAD11,"Porcine reproductive and respiratory syndrome virus (PRRSV) in serum and oral fluid samples from individual boars",0.132147366522,0.120426332926
807C9C48,"A scalable communication architecture for the sensor broadcast problem",0.155113636364,0.163737373737
78EFF025,"Communications and GNSS based Navigation: A Comparison of Current and Future Trends",0.130113636364,0.156349206349
78E05CA2,"Distributed spinning frame monitor system based on DSP and PROFIBUS",0.156994047619,0.176587301587
7C57D50E,"Multicarrier Symbol Design for HF Transmissions from the Antarctica Based on Real Channel Measurements",0.12748466811,0.142233560091
056DA82C,"The Equine Distress Monitor Project",0.119044497169,0.141774891775
7DDB16BF,"An 800 Mb/s physical layer LSI with hybrid port architecture for consumer electronics networking",0.241460622711,0.286574074074
7F5B6D8D,"Flow: A Stream Processing System Simulator",0.152819749695,0.185238095238
80B8AE60,"A Distributed Approach to Interference Alignment in OFDM-Based Two-Tiered Networks",0.108491161616,0.112037037037
12122DBE,"Itsy Bitsy Spider Monitor Cleaner | Gear Live",0.0971346872082,0.121031746032
7C10AF79,"Cross-Layer Design Combining Adaptive Modulation and Coding with ARQ on Frequency Domain Subcarrier of OFDM",0.105755355755,0.111844636845
75DE610C,"Performance increase through the use of multiple sub-carriers in WSN",0.228977272727,0.437037037037
0C34DD49,"Device descriptions: The key to fieldbus interoperability",0.141117909868,0.195833333333
7633BF2D,"Variational segmentation of elongated volumetric structures",0.145982142857,0.222222222222
37A62506,"Metody symulacyjne wybranych monitorów w badaniach homologacyjnych i kontrolnych pojazdów wyposażonych w systemy diagnostyki pokładowej EOBD/OBD II",0.0998106060606,0.0986111111111
7814EA79,"IT Surveillance and Social Implications in the Workplace",0.131837606838,0.166666666667
7B6ACEB3,"Toward realistic WiFi simulation with smartphone “Physics”",0.114220848596,0.142857142857
7B3D91D2,"Magnetic Induction for Underwater Wireless Communication Networks",0.147970779221,0.173611111111
80159CC8,"The role of channel distribution information in the cross-layer design of opportunistic scheduler for MIMO networks",0.128125,0.133531746032
7EC5BF70,"Achieving Secondary Synchronization for downlink in the Long Term Evolution standard",0.11920544733,0.119769119769
7DFB7CB3,"Fixed point Dual Carrier Modulation performance for wireless USB",0.3630501443,0.433531746032
79A46F52,"Performance Analysis and Evaluation of PCIe 2.0 and Quad-Data Rate InfiniBand",0.320643939394,0.563492063492
7ECF44F7,"Intel ® IBIST, the full vision realized",0.0923083860584,0.126984126984
7740CA7C,"Probabilistic graphical models for resilience of all-optical networks under crosstalk attacks",0.125852272727,0.132070707071
7CE83910,"Integrated design and operation of a transparent optical network: a systematic approach to include physical layer awareness and cost function [Topics in Optical Communications]",0.300843253968,0.223415704666
5A3879F1,"UTILIZING PHYSICAL LAYER INFORMATION TO IMPROVE RFID TAG IDENTIFICATION",0.245738636364,0.271494708995
2367C974,"DISTI | VIJESTI - Internet Explorer 9 localization",0.132586163836,0.180555555556
7AE21D2E,"Broadcast confidential and public messages",0.113099747475,0.118055555556
5EF65493,"Study of a SONET STS-3c based ATM user network interface design",0.124116161616,0.154126984127
76D88ABB,"Procedures for Circuit-Switched Service in Synchronous Public Data Networks",0.128084415584,0.168055555556
5E93CE7D,"Enhancing multiband OFDM performance: capacity-approaching codes and bit loading",0.209532828283,0.327777777778
811656D9,"ASIP architecture implementation of channel equalization algorithms for MIMO systems in WCDMA downlink",0.163699494949,0.182142857143
75D1C371,"An obstacle-aware human mobility model for ad hoc networks",0.114646464646,0.122222222222
783E4224,"Wireless monitoring system for granary based on 1-wire",0.149037247475,0.215277777778
76985694,"Security analysis of WiMAX network: With Misbehavior Node attack",0.211268939394,0.293737373737
7D768A1E,"An integrated restoration system for SDH-based ATM transport networks",0.147727272727,0.177188552189
775F77E4,"On the Mitigation of Impulsive Noise in Power-Line Communications With LT Codes",0.115331890332,0.11626984127
598773E6,"Analysis of the Generic Cell Rate Algorithm Monitoring ON/OFF-Traffic",0.223516414141,0.340277777778
7D1861F2,"Are IEEE 802.11 Wireless Networks Appropriate for Video Streaming in the Presence of Interference? An Experimental Answer",0.13060966811,0.126543209877
7DE61337,"Speech Quality Aware Admission Control for Fixed IEEE 802.16 Wireless MAN",0.154518398268,0.150566893424
800881A6,"Securing physical-layer communications for cognitive radio networks",0.134081890332,0.149305555556
7F073F3C,"Performance analysis for optical CDMA networks with random access schemes",0.443560606061,0.647222222222
7C552F11,"A Communication Protocol Design for an Industry Ethernet Ring Network",0.124012445887,0.118377654092
026CB9B8,"DISTI | VIJESTI - F-Secure Anti Theft for mobile",0.119892260517,0.153703703704
7E639051,"Thin Layer approach to increase reliability in ad hoc network",0.244002525253,0.25867003367
7AA58E14,"A Non-Blocking Buffer Mechanism for Real-Time Event Message Communication",0.142708333333,0.148737373737
7A6BC7E9,"Adaptive low-bitrate streaming over IEEE 802.15.4 low rate wireless personal area networks (LR-WPAN) based on link quality indication",0.135818001443,0.136860670194
59342620,"Physical layer design consideration for Underwater Acoustic Sensor Networks",0.256651334776,0.334126984127
85964F96,"eflight.ch / IISI EXP-BM2 Battery Monitor 2",0.0825558632544,0.107142857143
08E1BE70,"Planar waveguide based optical performance monitoring techniques and their applications in all-optical networks",0.248863636364,0.265079365079
7A476203,"Forward link performance of packet data in presence of soft handoff in cellular CDMA",0.219949494949,0.284444444444
78DD1053,"Dual methods for channel- and QoS-aware resource allocation in MIMO-OFDMA networks",0.108838383838,0.103282828283
5BEF3AF1,"Design and implementation of a software defined HiperLAN/2 physical layer model for simulation purposes",0.260912698413,0.241071428571
71E666C9,"Applying formal methods to a protocol standard and its implementations",0.113099747475,0.128472222222
6F76E66B,"@Sensor - Mobile application to monitor a WSN",0.146073717949,0.180555555556
5D1C34D1,"Cosmogenic Nuclides: Cosmic rays",0.0707093253968,0.0666666666667
0BE75F3F,"Type-II Hybrid ARQ protocol and map receiver for DS-CDMA systems",0.147161865912,0.197727272727
7E5C0D29,"Scalable RF propagation modeling on the IBM Blue Gene/L and Cray XT5 supercomputers",0.106284340659,0.106111111111
7DE8AD22,"Designing Multi-layer WDM Networks with Reliability Constraints",0.0990214646465,0.102588383838
7D99CEF3,"System-Level Assessment of Non-Orthogonal Spectrum Sharing via Transmit Beamforming",0.0955492424242,0.108333333333
804ADF6D,"Demystifying Challenges, Opportunities and Issues of Big Data Frameworks",0.12178030303,0.115812890813
58665B87,"DISTI | VIJESTI - Sarajevo Film Festival - Dell & Disti 4 Partners",0.158585858586,0.183838383838
77748028,"Ethernet Passive Optical Networks—A New Communications Standard [Standards]",0.118456890332,0.121693121693
7A966F67,"New time domain equalizer for multitone vehicle to vehicle communications",0.147718253968,0.174146224146
764F78F7,"Mutual information based calculation of the Precoding Matrix Indicator for 3GPP UMTS/LTE",0.115435606061,0.127070707071
7C287846,"A Cross-Layer Adaptive Wireless Resource Allocation Scheme",0.131209415584,0.141477272727
76D0370F,"Efficient Detectors for Joint Compressed Sensing Detection and Channel Decoding",0.151443001443,0.145975056689
77EF07F2,"Distinguishing drug-induced minor morphological changes from major cellular damage via label-free impedimetric toxicity screening",0.117518939394,0.131349206349
80CA4036,"Convergence between optical wireless and impulse radio UWB",0.141626082251,0.222222222222
7E6D27E4,"Wireless video distribution to handheld devices",0.125748556999,0.145833333333
7D9A7CA3,"MEMS single-chip microswitch array for re-configuration of telecommunication networks",0.159532828283,0.199786324786
5B3CB37E,"Entwicklung von Leuchtdichteverteilungs- und Steuerungskonzepten für den Bildschirmarbeitsplatz",0.0680093572363,0.0909090909091
76E1CE78,"WiMAX on 3.5 GHz Cell Size Calculation",0.109867909868,0.122916666667
7E83DF71,"A multiple correlation peak value detecting method for frame synchronization of DVB-S2",0.114195526696,0.116865079365
7F9FA2D8,"Identification of Shark Species Composition and Proportion in the Hong Kong Shark Fin Market Based on Molecular Genetics and Trade Records",0.118614718615,0.113742318288
7D6B7094,"SIRUP: Switch Insertion in RedUndant Pipeline Structures for Yield and Yield/Area Improvement",0.15928030303,0.14342046842
5C492C51,"An OFDM Based Aeronautical Communication System",0.173169191919,0.222222222222
807DABED,"A study on the performance of a frame relay network adapter for an information service access point",0.361661255411,0.325793650794
7C192C09,"A comprehensive and practical model for HARQ in LTE system",0.160814879565,0.25
7967BDE8,"Early In Vitro Detection of Interleukin-2-Like Activities by Pretreatment with Allogeneic Blood Lymphocytes in Miniature Swine.",0.145887445887,0.135383597884
7E9A60A4,"A comparative study of Simple Mail Transfer Protocol (SMTP), Post Office Protocol (POP) and X.400 Electronic Mail Protocols",0.138943001443,0.124772727273
796C726E,"Increasing GMR-1 System Throughput with Turbo Interference Cancellation Techniques",0.151294191919,0.154166666667
81441857,"Ad hoc and sensor networks",0.128282828283,0.153703703704
5CD9F84A,"UWB antenna impedance matching in biomedical implants",0.109936815635,0.150108225108
5C3B3ECD,"Demonstration of a multiple hd video stream wireless transmission",0.138595779221,0.147222222222
75E91D9C,"A comparison between different FHSS techniques for use in a multiple access secure wireless sensor network",0.27619047619,0.30873015873
7CECE844,"Performance Evaluation of multi-hop Detect-and-Forward and Amplify-and-Forward wireless transmission systems",0.26185966811,0.370238095238
7F4215DD,"Design and simulation of baseband transceiver system based on STBC-OFDM",0.157928876679,0.196428571429
78AD85B9,"Edge node based greedy routing algorithm (ENBGCR)for cooperative wireless ad hoc networks",0.135966810967,0.136607142857
0F9F7CBE,"DISTI | VIJESTI - Budite u korak sa cloudom: zašto trebate imati Microsoft Office 365?",0.104981997169,0.121794871795
785522AC,"A MIMO-OFDM prototype for next-generation wireless WANs",0.118444749695,0.175925925926
78A0DA95,"User cooperation in wireless networks",0.136661255411,0.175925925926
5DBAD695,"An Empirical Comparison of Transparency on One and Two Layer Displays",0.256490384615,0.3625
763A3EF8,"Robuste funkbasierte Sensornetze – Aktuelle Forschungsaktivitäten und innovative Lösungsansätze für infrastrukturlose Positionierungssysteme",0.166666666667,0
7B2BE540,"Research of the file system of volume holographic storage based on virtual storage layer",0.28428030303,0.28740530303
7BAB2116,"Computer-aided inspection for substrate design",0.12280982906,0.172619047619
7708D2A0,"Cross-Layer Design for Integrated Mobile Multimedia Networks with Strict Priority Traffic",0.112459415584,0.116197691198
5C874D46,"Design and Implementation of Frequency Offset Estimation, Symbol Timing and Sampling Clock Offset Control for an IEEE 802.11a Physical Layer",0.247970779221,0.187503006253
5D676132,"The Monitor-“Client” Relationship",0.10615530303,0.125
5F1C0811,"A predictive scheduling algorithm for the uplink traffic in IEEE 802.16 networks",0.112459415584,0.126587301587
75C91858,"Performance analysis of high-speed MIL-STD-1553 bus system using DMT technology",0.379419191919,0.47380952381
58DD7C8A,"Energy-aware Wireless Multi-hop Networks",0.12113997114,0.180555555556
7C59375D,"Session MA8b3: Physical layer security II",0.232231310356,0.314393939394
7F71DDDF,"ESS normal conducting linac status and plans",0.117171717172,0.125694444444
7943359E,"A self-organizing network for mixed category perception",0.111963383838,0.115740740741
795CE6A1,"Integration of well-based subsurface monitoring technologies: Lessons learned at SECARB study, Cranfield, MS",0.129924242424,0.146476539334
8067F64A,"Performance studies of a selfhealing network protocol in Telecom Canada long haul networks",0.298863636364,0.284880050505
7F17B679,"Experiences of IP Reuse in System-on-Chip Design for ADSL",0.10212530525,0.122619047619
7873A963,"Evaluation of Mobile WiMAX handover procedure",0.115919497169,0.144588744589
7DB1152F,"Numerical detection of surface waves in diffraction gratings",0.16810966811,0.171753246753
62D7260A,"Design of a communication protocol for underwater acoustic modems and networks",0.144696969697,0.142308802309
7D879EAD,"Equipment safety in the wireless networking laboratory environment",0.143643162393,0.167592592593
7B36E2DD,"Lunch Speech II. HomePlug Standards for Worldwide Multimedia In-Home Networking and Broadband Powerline Access",0.229274891775,0.285642135642
7E6A18AC,"A Cross-Layer-Based MAC Protocol",0.0867451992452,0.10101010101
5FCE636D,"Positioning Accuracy of Linac Radiosurgery",0.0990214646465,0.118055555556
77E7033E,"Development of New Ultrasonic Dressing Equipment",0.149900793651,0.168253968254
7A7B8BC3,"Demo of "Vis Magna": A Custom and Interactive Tool for the Visualization of VANET Protocols",0.152430555556,0.14595959596
7C46F83A,"Design of optical WDM networks",0.110723304473,0.126984126984
7DF76FE7,"Effective bandwidth-based QoS provisioning for real-time audio/video streaming over MIMO-OFDM wireless networks",0.129473304473,0.149305555556
7600D191,"Implementation of a Reconfiguration Algorithm for Cognitive Radio",0.133871336996,0.172619047619
7EEB67FD,"QoS-constrained physical layer optimization for correlated flat-fading wireless channels",0.243990384615,0.32
5940E747,"Virtue, Commerce, and History: The varieties of Whiggism from Exclusion to Reform: A history of ideology and discourse",0.11185966811,0.108998717332
5D908118,"Risk and Prevention on Information Security of E-Governmental Administration",0.120341810967,0.127308802309
7A30E346,"A Serial Communications Interface for Microprocessor-Based Power Distribution Apparatus",0.142613636364,0.136666666667
765A6747,"Rednet: a wireless ATM local area network using infrared links",0.133838383838,0.16746031746
7CF09B70,"Practical considerations of using antenna diversity in DECT",0.104106310356,0.136752136752
7CAF411D,"A comparison of PHY layer on the Ecma-392 and IEEE 802.1 laf standards",0.251294191919,0.453703703704
79CBB38C,"Ewolucja sieci bezprzewodowych standardu IEEE 802.11",0,0
7EE77D1A,"DS-MAC: Differential service Medium Access Control design for wireless medical information systems",0.374210858586,0.419614512472
85E42F30,"PlanningWA :: URBAN GROWTH MONITOR SUPPORTS STRATEGIC DIRECTIONS",0.107727342102,0.139880952381
7974AACE,"Adaptive processing gain data with space diversity and truncated ARQ in presence of soft handoff in cellular CDMA",0.125297619048,0.11150030525
7DA32FB5,"Capacity-Optimized Topology Control for MANETs with Cooperative Communications",0.11185966811,0.106349206349
72778785,"Physical layer amendments for MIMO features in 802.11a",0.247632575758,0.419191919192
7DF30E4A,"Secure optical bit- and block-cipher transmission using a single multiport encoder/decoder",0.100274725275,0.145833333333
7368BC4C,"Catalogue of the Osteological Portions of Specimens Contained in the Anatomical Museum of the University of Cambridge: CATALOGUE OF OSTEOLOGICAL SPECIMENS, ETC.",0.135069444444,0.124823633157
8262F532,"Physical layer security for cooperative communication system with untrusted relay based on jamming signals",0.26865530303,0.259627525253
5B1AF827,"Neutron flux profile monitor for use in a fission reactor",0.139691558442,0.140476190476
7C2361D1,"Accumulation of chromium and copper by the aquatic moss fontinalis antipyretica L. ex hedw transplanted in a metal‐contaminated river",0.107727342102,0.117328042328
802EA793,"100 Gigabit Ethernet - Applications, Features, Challenges",0.113162878788,0.131060606061
799B558B,"Special Section on Channel Modeling and Estimation",0.116961163836,0.112797619048
77EDD36B,"Urban network effects simulation",0.110723304473,0.114959114959
7F70D383,"Fast recovery from link failures using resilient routing layers",0.250202922078,0.271957671958
75DBA600,"Secret-Sharing LDPC Codes for the BPSK-Constrained Gaussian Wiretap Channel",0.136268939394,0.189814814815
81056A1F,"Capacity Analysis on OFDM Based Two-Hop Regenerative Wireless Networks with Selective Relaying",0.24310966811,0.323737373737
7ABE5A4B,"Differentiated Protection of Video Layers to Improve Perceived Quality",0.259429112554,0.267233560091
7D142231,"Routing in Degree-Constrained FSO Mesh Networks",0.0972853535354,0.104377104377
02FAFD76,"Physical Layer Design for DVB-S2 CCM Mode",0.24623466811,0.417989417989
7CE1625F,"Design of drawing beeline machine based on monitor",0.14523046398,0.161706349206
766D2063,"Teaching simplified network protocols",0.101253607504,0.111219336219
817E0D69,"New level sensor system for ship stability analysis and monitor",0.272276334776,0.320105820106
7B15914D,"All-optical flip flop using two gain-clamped RSOAs",0.0899760472371,0.113636363636
8024BBA9,"An energy analysis of IEEE 802.15.6 scheduled access modes",0.332449494949,0.552777777778
63BD4C53,"DISTI | Album - SFF & Disti party",0.0874562937063,0.1
7EC6A9F1,"Information theoretic approach to finite state Markov modelling of time varying channels",0.123318001443,0.127551020408
7E4667BF,"Bidirectional Gigabit transmission over a single SI-POF for home networking",0.106395687646,0.105303030303
7FA52342,"Wireless switch protocol",0.109463453213,0.169191919192
6F8CBAAB,"A structured system methodology for FPGA based system-on-a-chip design",0.159416971917,0.181547619048
7C185EDA,"Understanding tabletop collaborative interaction using hierarchy model",0.119193306693,0.160714285714
0B23854A,"An overview of standards for communications networks",0.100505050505,0.106060606061
79723395,"Integrated semiconductor-optical-amplifier-based switch fabrics for high-capacity interconnects [Invited]",0.140773809524,0.184027777778
7FB66C61,"The use of MIL-STD-188-141A in HF data networks",0.113501082251,0.130555555556
5D0AB03E,"Wireless random scheduling protocol with realistic channel",0.144230769231,0.238636363636
7E977465,"FEC Performance of Concatenated Reed-Solomon and Convolutional Coding with Interleaving",0.211951243201,0.344444444444
7624820C,"An educational image processing/machine vision system",0.16240530303,0.189814814815
785957D8,"The LTE link-layer design",0.085409035409,0.142857142857
7982753B,"Optical Networks [Book Reviews]",0.116373556999,0.121693121693
79EA3A32,"Next Generation Triple Play Access Network Feasibility and Challenges",0.218813131313,0.250673400673
77776039,"Link performance prediction for HSUPA in a multipath channel",0.213406385281,0.341964285714
7ABF7839,"MiXiM: the physical layer an architecture overview",0.232231310356,0.430303030303
84981483,"IEEE 802. 16技術概觀",0,0
72A00B75,"A cross-layer scheduling algorithm for H.264 video transmission over wireless networks",0.129369588745,0.147156084656
7D8C8F2F,"VLSI suitable synchronization algorithms and architecture for IEEE 802.11a Physical Layer",0.24623466811,0.363492063492
812D9D85,"VLSI Node Processor Architecture for Ethernet",0.112645687646,0.131547619048
81477BD4,"A network perspective of MIMO antenna techniques with multiuser scheduling",0.128968253968,0.133015873016
8130588B,"Incorporating retransmission diversity in quality-of-service guaranteed multi-user scheduling",0.0903693528694,0.110297110297
849A3993,"Encontro Anual das Equipes Colaboradoras do Programa Segundo Tempo (São Paulo, 2010) - Projeto político-pedagógico do Programa Segundo Tempo",0.0980623543124,0.126666666667
6E3486D4,"The impact and correction of timing error, frequency offset and phase noise in IEEE 802.11a and ETSI HiperLAN/2",0.106358225108,0.116323953824
76DF8991,"Efficient QoS control for 3G mobile multimedia applications",0.110467657343,0.130555555556
6FC883F8,"Influence of mobility models on the performance of routing protocols in ad-hoc wireless networks",0.246581890332,0.242613636364
7A3FB089,"A reliable sequence controller design methodology based on SMT framework",0.131998556999,0.136183261183
7F899CF7,"Cross layer consideration for improved reliability of vehicular safety messaging",0.252683080808,0.286447811448
7EAA42A3,"A novel PAPR reduction scheme for OFDM systems: selective mapping of partial tones (SMOPT)",0.16240530303,0.156111111111
39A21198,"Research of routing protocol for wireless sensor network in coal mine goaf",0.169349747475,0.190183080808
7FE15B9A,"LTE peak rates analysis",0.0874562937063,0.0884615384615
800A1FDC,"On the characteristics of concentration-encoded multi-level amplitude modulated unicast molecular communication",0.128977272727,0.136111111111
74D2F3E2,"Wavelength monitoring of tunable DWDM sources using a FP etalon and a FP laser diode",0.12306998557,0.15746031746
80EE781E,"Novel Rate-Distance Adaptation of Multiple Access Protocols in Cognitive Radio",0.239637445887,0.360227272727
7E603BB9,"Research on Cross-Layer Design for MANET",0.124748862249,0.206349206349
7B67EF2A,"Microholograms Recorded in a Thermoplastic Medium for Three-Dimensional Data Storage",0.242266414141,0.336805555556
7AD5AD8E,"Electrical two-wire cables in measure and simulation plus their impact on FlexRay™ timing properties",0.114691558442,0.113107263107
6FF41859,"An Efficient Distance Bounding RFID Authentication Protocol: Balancing False-Acceptance Rate and Memory Requirement",0.116224747475,0.110975829726
7F44E91B,"A toolset for visualization and analysis of parallel real-time embedded systems based on fast prototyping techniques",0.272916666667,0.303703703704
7A17E0FE,"Hiding Data in OFDM Symbols of IEEE 802.11 Networks",0.10422979798,0.125
