Paper ID,Title,Sim1,Sim2
7E9E5BFE,"Advances in Spectral Optical Code-Division Multiple-Access Communications",0.103506562882,0.118055555556
5864DAE2,"Ultra wideband frequency spectrum and multipath channel model",0.117424242424,0.122916666667
7EF04CEF,"Wireless workgroup teleconferencing: design issues with WLAN IP telephony, PCS, and WPBX technologies",0.152191558442,0.16455026455
79FE3FD7,"Physical layer monitoring in 8-branched PON-based i-FTTH",0.235222763348,0.555555555556
812237C8,"60 GHz SiGe-BiCMOS Radio for OFDM Transmission",0.120421245421,0.1875
7522EBF2,"Integrated Design of Hierarchical QAM Modulation and Retransmission Diversity for Multimedia Wireless Networks",0.137702922078,0.131537444037
75DCA2EB,"DESIGN OF WRAPPER FOR SELF-MANAGEMENT OF COTS COMPONENTS",0.122925685426,0.160714285714
7D0C6F07,"Admission Control and System Capacity Assessment of WiMAX with ACM and nb-LDPC Codes Simulation Study with ViMACCS ns2 Patch",0.171433080808,0.158998717332
7B7AC671,"A self-stabilizing autonomic recoverer for eventual Byzantine software",0.125088453213,0.166666666667
7665BD3F,"Twelve-channel optical fiber connector assembly: from commercial off-the-shelf to space flight use",0.17435966811,0.178240740741
224F0E71,"DISTI | VIJESTI - Disti akcija - Dell Vostro V13 i Dell Studio 1558",0.0998106060606,0.111111111111
802C73D2,"A Wireless Wearable Embedded System for Logistics Based On IEEE 802.15.4.",0.164129273504,0.212962962963
7E1F07E7,"Blind Identification of MIMO-OFDM Channels Driven by Colored Source with Unknown Statistics",0.120287698413,0.119841269841
24742BBB,"DISTI | VIJESTI - Coding Challange 2011 prezentacija radova",0.111111111111,0.111111111111
3C59D1E6,"Algebraic Specification of Communication Protocols: Two Simple Protocols for Local Area Networks",0.135470779221,0.116908884766
7B5783F7,"On the Capacity and System Design of Relay-Aided Underwater Acoustic Communications",0.165773809524,0.169552669553
5E663195,"Secure Physical Layer Network Coding: Challenges and Directions",0.250946969697,0.300555555556
6E617B59,"Wireless Sensor Network in Application to Air Purifier",0.140877525253,0.181481481481
7980B686,"The external consistency of abstract data types",0.11167027417,0.121693121693
7BED0940,"Research and development of service robot platform based on artificial psychology",0.164488636364,0.192857142857
7877191E,"Productivity of multiprogrammed computers—progress in developing an analytic prediction method",0.109586940837,0.124206349206
8044E2ED,"Low-power low-complexity MIMO-OFDM baseband processor for wireless LANs",0.105746336996,0.166666666667
78978C47,"Bayesian interim analysis in clinical trials",0.209649725275,0.583333333333
594355DC,"Group cell FuTURE B3G TDD system",0.162301587302,0.178075396825
784B5683,"RTL Designs of IEEE802.11n Wireless LAN system",0.147512210012,0.223214285714
795C4275,"A Novel Coding Scheme for Secure Communications in Distributed RFID Systems",0.172222222222,0.184027777778
7E959C0E,"A Cross Layer Approach with CSMA/CA based Protocol and CDMA Transmission for Underwater Acoustic Networks",0.245738636364,0.266955266955
7D7E85FB,"Low-Power Sensor Stack Tunability for Multi-Radio Support",0.144751082251,0.183333333333
81C3B356,"Physical layer link modelling for a dynamic network simulation system",0.256651334776,0.299735449735
8003D652,"A Channel State Aware Uplink Bandwidth Allocation Algorithm for Wireless Networks",0.137702922078,0.132998350855
0065CD7C,"RTCA Special Committee 186, Working Group 5 UAT MOPS Meeting #2",0.140426587302,0.151904761905
7BC17842,"Combined bio-inspired/evolutionary computational methods in cross-layer protocol optimization for wireless ad hoc sensor networks",0.142361111111,0.144498556999
807ADDAB,"Medium access control and network layer design for 60 GHz wireless personal area networks:",0.360818001443,0.338492063492
258C9BF0,"DISTI | PROIZVODI - Precision serija notebook-a",0.0803883616384,0.0909090909091
7EE50A4D,"Investigation on Dynamic Spectrum Allocation with Virtual Antenna Array Deployment in Decentralized Cognitive Radio System",0.170138888889,0.182431457431
6F7DB590,"The challenges facing physical layer security",0.235657051282,0.328977272727
7C852814,"Minimum Length Scheduling in Single-Hop Multiple Access Wireless Networks",0.285723304473,0.394444444444
66BF1923,"An Example of Network Video Monitoring System Based on DM6446",0.166666666667,0.159722222222
7C7F4AA7,"Equitable MAC Layer Performance Comparison of Cooperative Diversity Protocols for Wireless Networks",0.370738636364,0.361256798757
7ED83764,"Het terugdringen van sociaal-economische verschillen ingezondheid tussen 2000 en 2020. Inhoud en organisatie van de SEGV monitor",0.0825558632544,0.142857142857
80C9E6D4,"A GEO Satellite System for Broadcast Audio and Multimedia Services Targeting Mobile Users in Europe",0.180262445887,0.172045855379
801494F8,"Radio Frequency-Based Body Temperature and Walking Steps Monitor of Dairy Cow",0.138997113997,0.151165674603
7D340F38,"End-to-End QoS Model for Mobile WiMAX Systems",0.160814879565,0.25
7DC425F8,"An Efficient Cross-Layer Based Flooding Algorithm with Retransmission Node Selection for Wireless Sensor Networks",0.147077922078,0.161061507937
6ECB22F4,"Capacity evaluation of the EDGE concept for enhanced data rates in GSM and TDMA/136",0.140575396825,0.130485255485
76DA7146,"Efficient wireless security through jamming, coding and routing",0.12528998779,0.134848484848
7DF9D942,"Trellis-coded complementary code keying for high-rate wireless LAN systems",0.154671717172,0.205555555556
81765B2F,"Cross-Layer Modeling for QoS-Driven Multimedia Multicast/Broadcast over Fading Channels in [Advances in Mobile Multimedia]",0.116014194139,0.128571428571
7F3D056F,"Fieldbus interface control IC",0.0895396270396,0.0923076923077
6C75CC1A,"A Better Service",0.115899725275,0.25
5EFC0D08,"Test challenges for SONET/SDH physical layer OC3 devices and beyond",0.244349747475,0.330555555556
5FB233FE,"Integrating multiuser dynamic OFDMA into IEEE 802.11a and prototyping it on a real-time software-def",0.166666666667,0.111111111111
03158634,"DISTI | VIJESTI - Sample of a wireless solution in healtcare",0.112752525253,0.111111111111
73524D5D,"A novel channel modeling technique for performance analysis of Bluetooth baseband packets",0.340679112554,0.413161375661
7F3FC941,"There might be a role for CD200 in the pathogenesis of autoimmune and inflammatory skin disorders",0.125637210012,0.142308802309
80CF2C0A,"CORMAN: A Novel Cooperative Opportunistic Routing Scheme in Mobile Ad Hoc Networks",0.109438131313,0.111805555556
055A4475,"DISTI | VIJESTI - Najbolji Antivirus u 2010. godini",0.166666666667,0
81673F8A,"Burst and persistent emission properties during the recent active episode of the anomalous X-ray pulsar 1E 1841-045",0.125401334776,0.131349206349
7B285FD3,"Design of Portable Car Body Posture Monitoring System",0.161153083028,0.171693121693
7CCBA057,"On the secrecy outage capacity of physical layer security in large-scale MIMO relaying systems with imperfect CSI",0.250157828283,0.260894660895
809130B7,"Approaching the Limits of FlexRay",0.0855966949717,0.107954545455
78C9EB62,"HJam: Attachment transmission in WLANs",0.10399496337,0.133928571429
5C2731A7,"Hardware-software co-design of embedded systems using CoWare's N2C methodology for application development",0.164930555556,0.17
77A7D5F6,"Blind channel estimation based robust physical layer key generation in MIMO networks",0.245738636364,0.266203703704
756A91AF,"Organizing and accessing methods for massive medical microscopic image data",0.111963383838,0.123015873016
5CEB3F73,"Impact of SAW RF and IF filter characteristics on UMTS transceiver system performance",0.268308080808,0.305627705628
7E7C24AC,"Call Admission Control Based on Adaptive Physical Rate for EDCA in IEEE 802.11e WLAN System",0.157196969697,0.155725623583
7E6F06DC,"Service delivery framework for DVB-H and EPS",0.116846694972,0.172222222222
806D6E74,"Link Adaptation with Position/Motion Information in Vehicle-to-Vehicle Networks",0.0958964646465,0.105555555556
801AF032,"Multi-rate aware topology control in multi-hop ad hoc networks",0.10422979798,0.0956349206349
75A6B228,"Mostly Digital Wireless UltraWide Band Communication Architecture for Software Defined Radio",0.155113636364,0.171995464853
7F00DCE7,"Achievable Rates of Compress-and-Forward Cooperative Relaying on Gaussian Vector Channels",0.108516483516,0.114926739927
8082AC35,"Thermal component model for electrothermal analysis of IGBT module systems",0.284722222222,0.358333333333
7E061505,"Mapping link SNRs of real-world wireless networks onto an indoor testbed",0.122528860029,0.143055555556
78CCAE09,"Divergent cortical connections to entorhinal cortex from area TF in the macaque",0.120193001443,0.108922327672
80D59655,"Optimal Cross-Layer Scheduling of Transmissions Over a Fading Multiaccess Channel",0.102506868132,0.130952380952
7FF19FF9,"Cognitive radio network management",0.137702922078,0.167989417989
85A204FA,"Quantum key distribution with unconditional security for all optical fiber network",0.121085858586,0.118181818182
7D5AEC32,"Roadmap for Next Generation Air Monitoring",0.110669191919,0.111111111111
8045621C,"Technical discussion on the wireless internetworking technologies and protocols",0.137851731602,0.156655844156
5E15CCF5,"Practical Vertical Handover Mechanisms between Satellite and Terrestrial Networks",0.138005050505,0.140782828283
003E8445,"Kodirni postopki na podlagi mre? z",0.0943917193917,0.142857142857
77962BE7,"Multicarrier technology for 4G WiMax system [WiMAX/LTE Update]",0.147512210012,0.189033189033
812D2C80,"Off-the-shelf transparent HomePlug range extension",0.090805028305,0.0909090909091
8072794B,"Beyond 100G - high-capacity transport technologies for next generation optical core networks",0.161165223665,0.159682539683
7967BC02,"An enhanced forward-link scheduling algorithm for cdma2000 1× EV-DO",0.0973137973138,0.142857142857
804448B9,"A Proof-of-concept demonstrator for Cognitive Radio",0.115549136321,0.1875
7F27D337,"System optimization from field channel measurement and performance evaluation on future B3G TDD system",0.279419191919,0.293204365079
5A7EE03C,"OFDM-Based Overlay Systems: A Promising Approach for Enhancing Spectral Efficiency [Topics in Radio",0.158933080808,0.174206349206
0563D3F7,"Remotely controlled supervisory device for refrigerators",0.141733440171,0.203703703704
7B19502F,"Intersystem Access Control Protocol Description",0.202840909091,0.322727272727
7C42DFA4,"Multi-Phase Correlator-based Realistic Clock Synchronization for Wireless Networks on IEEE 802.15.4",0.129473304473,0.15376984127
791DF61B,"On the Emissivity of Layered Materials",0.108920940171,0.125
7BD5C06E,"Tutorial 3: WiMax Systems and Mesh Networks",0.154671717172,0.222222222222
5D0DB4D8,"The baric probe: a novel long-term implantable intracranial pressure monitor with ultrasound-based interrogation",0.108773518149,0.114691558442
83337E70,"Linguistic Awareness in Multilinguals: Crystallizing linguistic awareness in multilingual education",0.168002830503,0.33125
7B9B6EB0,"Stryker Brigade Combat Team IPv6 transition modeling and simulation study",0.121222527473,0.134236794951
79DF9AAF,"Performance monitoring techniques supporting cognitive optical networking",0.214034576535,0.344444444444
5CB0EB64,"Real-time Multi-resolution Data Transmission over Correlated Fading Channels using Hierarchical Constellations",0.112310606061,0.123148148148
04F2E531,"Rate of Heat Loss by Large Australian Monitor Lizards",0.109586940837,0.107157287157
8060BA68,"Real-time enabled debugging for distributed systems",0.138757249695,0.178075396825
7980632E,"Downlink System Performance of Cooperative Multiple Points Transmission with Realistic RRM Structure",0.289637445887,0.386904761905
7F43CA1D,"On the performance and policies of mobile peer-to-peer network protocols",0.223074494949,0.331755050505
7BBBF74F,"Low latency adaptive streaming of HD H.264 video over 802.11 wireless networks with cross-layer feedback",0.113005050505,0.111666666667
7D53CC45,"Effective power control in UWB systems using spreading code’s spatial resolution properties",0.154671717172,0.154256854257
80D03ECE,"Cross-Layer Design of Embedded Modulation and Retransmission Diversity for Prioritized Packet Transmission in Wireless Networks",0.137702922078,0.128619396477
7F79BBE9,"A test bed for wireless optical LANs",0.110706654457,0.148148148148
0A2B9A19,"DISTI | VIJESTI - There are no more IPv4 addresses to allocate",0.0855998168498,0.116666666667
5A47E4A5,"Zeroforcing precoding based MAC design to address hidden terminals in MU-MIMO WLANs",0.129456654457,0.145767195767
805C33B1,"Dynamic Programming Networks for Large-Scale 3D Chip Integration",0.123665223665,0.132936507937
7D6F75B9,"UWB Modem with Low Power Options",0.126199494949,0.129344729345
84467FAC,"Cross-layer modeling of wireless systems using AMC with cooperative-ARQ error control",0.165133477633,0.177142857143
586CBC24,"Statistical Properties of Fading Processes in WCDMA Systems",0.172276334776,0.186111111111
80DAC781,"Low-latency Memory-efficient 150-Mbps Turbo FEC Encoder and Decoder",0.101537698413,0.2
7EBC8899,"An Enhanced HyperTransport Controller with Cache Coherence Support for Multiple-CMP",0.144994588745,0.156060606061
81471679,"Smart grid cybersecurity exposure analysis and evalution framework",0.222367909868,0.419191919192
1A221FE1,"Multiuser MIMO on multicores (無線通信システム)",0,0
7B644400,"Gbps wireless communication system design and transmitter implementation",0.174810606061,0.202976190476
806FB5B2,"Multi-port impedance matching technique for power line communications",0.100505050505,0.102626262626
7DC9977A,"RECOMAC: A Cross-Layer Cooperative Network Protocol for Wireless Ad Hoc Networks",0.129473304473,0.132626262626
83E4034A,"Intelligent Care Management Systems",0.16810966811,0.242063492063
6F959DCA,"Méthodes de Traitement Numérique du Signal pour la Réduction d'Auto-Interférences dans un Terminal Mobile",0.0938041125541,0.1
7F87AF39,"Access improvements in dynamic channel assignment methods for TDMA wireless systems",0.287152777778,0.336574074074
7DE52118,"Full system verification of CAN network at high speed transmission rate using VHDL-AMS",0.162752525253,0.149603174603
7EF8EB8B,"CLR performance improvement of CBR traffic in wireless ATM access networks",0.34935966811,0.382020757021
7CAF01C3,"DeWorm: A Simple Protocol to Detect Wormhole Attacks in Wireless Ad Hoc Networks",0.140679112554,0.140614478114
7E820C8B,"In-home PLC ready for triple play",0.096925990676,0.0954545454545
7954A55F,"Interpreting at the Tokyo War Crimes Tribunal",0.10580044955,0.142857142857
8008F6E5,"Proportional Time Sharing with Frame Size Adaptation for MB-OFDM based UWB WPANs",0.107503607504,0.121904761905
7DF6AD7C,"Extension design of PLS codes in DVB-S2 based satellite broadcasting system",0.161165223665,0.154701779702
72E742E8,"Norms and the Law: .commons",0.0958964646465,0.105555555556
802BE0B1,"CRISP: A flexible integrated development platform for RFID systems",0.149900793651,0.179166666667
7B017763,"Next-Generation Optical Network Architecture and Multidomain Issues",0.140773809524,0.151322751323
5A205084,"Channel Equalization in HSDPA Receivers: Trade-Off between Performance and Complexity with a Variable Oversampling",0.241720779221,0.285383597884
7B639D69,"Relay selection for joint scheduling, routing and power allocation in multiflow wireless networks",0.139935064935,0.130411255411
860A53E5,"Physical-Layer Security for Full Duplex Communications With Self-Interference Mitigation",0.122276334776,0.117171717172
0B670731,"Development of the FDDI Physical Layer",0.234970238095,0.55
7D14B4F8,"A study on DSSS transceivers using OQPSK modulation by IEEE 802.15.4 in AWGN and flat Rayleigh fading channels",0.134962606838,0.144841269841
7D986F90,"An approach to an IP over WDM transmission network modelling",0.105366161616,0.114444444444
5C781366,"Cooperative Jamming for Wireless Physical Layer Security",0.237641178266,0.400673400673
5F574FC4,"DISTI | PROIZVODI - aa",0.0664763341234,0.0769230769231
58C572D8,"Flexible layer one for the GSM/EDGE radio access network (GERAN)",0.354324494949,0.590277777778
759B2C8C,"SACRP: A Spectrum Aggregation-Based Cooperative Routing Protocol for Cognitive Radio Ad-Hoc Networks",0.129473304473,0.150673400673
80B1457C,"A new spectrum distance function to monitor machine condition",0.136616161616,0.131355218855
80E1422C,"Mixed-signal baseband processing chain for a MB-OFDM receiver",0.113385225885,0.133477633478
7533EDA7,"Gram-Schmidt orthogonalization neural nets for OCR",0.0982208124478,0.166666666667
7E840790,"Computer system for power wheelchair",0.146338383838,0.196825396825
57DF8191,"Principles of Digital Communication: Introduction to digital communication",0.126001082251,0.144047619048
784EC5EE,"Non-Bayesian Rate-Adaptive Wireless Communication Using ARQ-Feedback",0.146834415584,0.194444444444
6362F843,"Understanding Weightless: The physical layer",0.22931547619,0.583333333333
771AC48F,"Introduction to the Issue on Signal Processing and Networking for Dynamic Spectrum Access",0.240922619048,0.346428571429
7F33B32B,"An OSI compatible architecture for integrated multichannel metropolitan and regional networks",0.126199494949,0.137037037037
7D6F97E3,"Design of monitoring and Fault Diagnosis System on-line for certain gas turbo-generator set",0.165133477633,0.149041434756
80E25C5E,"Local Climate and Energy Program | State and Local | US EPA",0.119696969697,0.117171717172
858A1C55,"Sicherheitssysteme24 e.K. / SLA-19AV SANTEC LCD CCTV Monitor 19' (48 cm)",0.0975618131868,0.123015873016
75D2361B,"Connectivity and Topology Control in Wireless Ad Hoc Networks with Realistic Physical Layer",0.239741161616,0.249092970522
7A2FDAAE,"The IEEE 802.6 physical layer convergence procedures",0.26240530303,0.455555555556
2731B2F6,"DISTI | VIJESTI - Hardware Base recenzija Alienware M15x i M17x laptop-a",0.121489845938,0.225
77E804A6,"Bed Bug (Cimex lectularius L.) Population Composition as Determined by Baited Traps",0.138005050505,0.143650793651
7F7AE524,"The Effect of Node Density and Propagation Model on Throughput Scaling of Wireless Networks",0.144151334776,0.144593253968
76B46150,"Xpec: A cross-layer spectrum assignment in Cognitive Radio networks",0.14310966811,0.165277777778
7C849503,"Research on the key technology and application of the packet transmission network",0.136268939394,0.165013227513
050C163E,"ElectroTechnology - WA Police service letter to the control station",0.148409576535,0.158080808081
76973D00,"Cross-Layer Design of Rateless Random Network Codes for Delay Optimization",0.10238997114,0.113015873016
05C41633,"DISTI | VIJESTI - Zlatna medalja i dvije bronzane na Informatičkoj olimpijadi",0.0998106060606,0.111111111111
790A07C6,"Comparison of Physical-Layer and Application-Layer Diversity for Video Streaming Over Wireless Rayleigh Fading Channels",0.125852272727,0.129024216524
75ADF5BD,"Resource allocation and scheduling in MIMO-OFDMA with time-varying channel and bursty arrivals",0.0980217698968,0.116753246753
7D3FD5C9,"Mobile video transmission via Wyner-Ziv video coding and rate compatible modulation",0.115435606061,0.118055555556
7D08C0AB,"OOK Q-factor degradation in scalable optical switches",0.116262210012,0.138888888889
7AD2D82E,"Monitoring and prioritising alerts for exception analytics",0.0930118492618,0.103703703704
7E26E355,"A Novel Gnutella Application Layer Multicast Protocol for Collaborative Virtual Environments over Mobile Ad-Hoc Networks",0.250946969697,0.293737373737
09A11B86,"DISTI | PROIZVODI - Laptopi",0,0
792C04F8,"Implementation of the Real-Time Parameters Monitoring System for Underground Equipments Based on Panoramic Images",0.168898809524,0.193027210884
702196A1,"An excess signaling concept with Walsh-Hadamard spreading and joint detection",0.126282051282,0.152777777778
7D07F4D3,"Performance analysis of the frame aggregation mechanisms in IEEE 802.15.3c",0.340331890332,0.480555555556
383DF02B,"DISTI | VIJESTI - Sarajevo nekad i sad",0.0998106060606,0.10101010101
76777B8F,"An intelligent testing and monitoring management system in smart grid",0.172718253968,0.173015873016
77E55244,"Demonstration of high-spectral-efficiency 40-Gb/s optical communications system using 4 bits per symbol coding",0.170486111111,0.159126984127
75EC4244,"Designing an S-LINK to PCI interface using an IP core",0.102840909091,0.118333333333
7AB02020,"Communication Protocol of Home Network Based on Power Line Carrier Technology",0.240877525253,0.221035754369
800B540A,"Analysis of the operation and design of handheld terminals (HHT) within MUOS network",0.231502525253,0.310793650794
77A997DE,"Modeling Architecture for DTDMA Channel Access Protocol for Mobile Network Nodes using Directional Antennas",0.250946969697,0.2338664422
5F2685BC,"A real-time control architecture for a semi-autonomous underwater vehicle",0.132532051282,0.183333333333
80D88951,"Empirical-Stochastic LMS-MIMO Channel Model Implementation and Validation",0.101221694972,0.135416666667
77CB3509,"Network Coding for Energy Efficient Wireless Multimedia Transmission in Ad Hoc Network",0.110227272727,0.111904761905
7A76B3AA,"Using technology to control intimate partners: An exploratory study of college undergraduates",0.140518162393,0.167006802721
79F20138,"TCP throughput efficiency enhancement in IEEE 802.11n network",0.11185966811,0.112222222222
7BA10E34,"Physical-layer Modeling and Simulation of WDM Fiber Optic Network Architectures for Aerospace Platforms",0.134081890332,0.150113378685
7E7D018B,"Novel network test-bed simulators",0.126199494949,0.155555555556
75DAC6C2,"Adaptation of FDDI physical layer chip to Playthrough protocol",0.235657051282,0.325505050505
7FFC8D44,"Manet gateways: radio interoperability via the internet, not the radio",0.133722527473,0.179365079365
6B5F65D3,"Facing 802.11 Anomaly and Improving 802.11 WLANs QoS Using a Crosslayer Design Based Unselfish Behavior",0.129369588745,0.146279761905
78CDFFE4,"Developing PC-Based Automobile Diagnostic System Based on OBD System",0.141733440171,0.22380952381
7FB9AC76,"Data Rate and Fragmentation Aware Ad hoc Routing",0.10422979798,0.104848484848
7EA836D1,"Receiver architectures for HomePNA 2.0",0.0998552305538,0.183333333333
035C7563,"Das Ganze Konzert. David Bowie: Ziggy Stardust@Hammersmith",0.096925990676,0.122222222222
76A9638E,"Static lightpath establishment with transmission impairments consideration in WDM all-optical networks",0.122876082251,0.129126984127
7CEB6BCC,"Routing Metrics of Cognitive Radio Networks: A Survey",0.14935966811,0.161111111111
7E1483AB,"Peak-to-average power ratio reduction of OFDM signals using broadband pulse shaping",0.114488636364,0.125
76C3FA80,"Guest Editors' Introduction: Special Issue on Cyber-Physical Systems (CPS)",0.17619047619,0.168571428571
8166A895,"SAMOA: a cell based optical ATM system using TCM transmission mode for the user network interface",0.17803030303,0.152708907254
7B15F239,"Compress-And-Forward Cooperative Relaying in MIMO-OFDM Systems",0.141733440171,0.333333333333
71ABA8AF,"Biorthogonal multicode modulation for high-rate high-reliability personal communications requiring controlled peak-to-average transmit power ratio",0.108838383838,0.125
7F181A04,"A model for virtual physical layer communication over deployed wireless sensor networks",0.267708333333,0.324074074074
7AE6A9F8,"Tutorial: XG-PON",0.166666666667,0
7561AA1A,"Toward a future access network: XL-PON, PIEMAN, and fully tuneable networks",0.218813131313,0.333333333333
7FF888B4,"Non-regenerative MIMO relaying with channel state information [cellular example]",0.120486111111,0.114444444444
5F99DB27,"Comparison of 802.11ac and 802.11n PHY layers",0.244250541126,0.625
7C4DADE9,"Mitigating interference in IEEE 802.15.4 Ad Hoc network applied in electrostatic detection",0.109438131313,0.114351851852
37F1E536,"Reviving the Fourth Estate: The Fourth Estate: A Changing Doctrine",0.108743686869,0.120555555556
076A3398,"Energy Saving Mechanism in Ad Hoc Network",0.102935606061,0.109444444444
7D8474C1,"Application of Functional Unit Networks to Next Generation Radio Networks",0.140679112554,0.143518518519
7D08D7F6,"Architectures for network processing",0.124612193362,0.151322751323
06A6D146,"CWDM OVERLAY ON AN EPON SYSTEM: A DEMONSTRATION AND ECONOMIC RAMIFICATIONS FOR FTTH",0.153025793651,0.187310606061
7D83F674,"MemoryIO: An Extended I/O Technology in Embedded Systems",0.157928876679,0.238095238095
7FEFF3D9,"Bluetooth indoor channel simulation",0.102506868132,0.133928571429
7D105693,"Signal Integrity Analysis of a 1.5 Gbit/s LVDS Video Link",0.217866161616,0.330555555556
014B499C,"Cross-Layer Optimization of OFDM Systems for 4G Wireless Communications",0.148611111111,0.198611111111
83298A4D,"Philips 170B6 LCD Monitor",0.0921743697479,0.142857142857
7943A718,"A Cross-Layer Transmission on Video telephony over WCDMA Network",0.14053030303,0.170138888889
7F5EFBFF,"51.84 Mb/s 16-CAP ATM LAN standard",0.110723304473,0.122895622896
7E85429B,"A 5 GHz WLAN MAC performance comparison based on physical layer measurements",0.370738636364,0.408503401361
7CB3AC2E,"Allocation Fairness for MIMO Precoded UTRA-LTE TDD System",0.136745199245,0.169191919192
7EFC726E,"Content protection technology for a novel removable drive",0.121834415584,0.149206349206
5A1B4B3F,"The Impact of Reader to Tag Collision on RFID Tag Identification",0.11810966811,0.130952380952
7DA029E9,"Dual code Tx diversity with antenna selection for spatial multiplexing in MIMO-WCDMA networks",0.114691558442,0.106582306582
