Paper ID,Title,Sim1,Sim2
6CECC4E4,"Throughput vs. temporal fair MAC protocols in multi-rate WLANs: Analysis and performance evaluation",0.342667748918,0.379200164914
58D35122,"Microbiological burden on the surfaces of the AIMP spacecraft, part 2",0.154419191919,0.187310606061
267454AD,"SISTEMA INTELIGENTE DE VIDEOCAMARAS PARA LA VIGILANCIA Y CONTROL DE TRAFICO Y DETECCION DE INCIDENTES",0.0874562937063,0.0916666666667
7C5509C9,"Cross-layer Design for Multiuser OFDMA Systems with Cooperative Game and MMPP Queuing Considerations",0.182693001443,0.210714285714
7D287BEA,"Effect of wireless channel process on queueing delay - approximate analysis using peakedness function",0.23060966811,0.242361111111
7DF10203,"Improving Delivery Ratio and Power Efficiency in Unicast Geographic Routing with a Realistic Physical Layer for Wireless Sensor Networks",0.240877525253,0.22873015873
7F0B226A,"The Impacts of Physical Layer Parameters on the Connectivity of Ad-Hoc Networks",0.2536751443,0.301587301587
80C00624,"Powering networks on chips",0.0972853535354,0.101851851852
0D93E4FC,"A TWO MONTHS TEST OF AN ARTIFICIAL CLOSED AQUATIC ECOSYSTEM CONTAINING Ceratophyllum demersum L. AND Bulinus australianus",0.10422979798,0.119511599512
7D7BA465,"A radio resource scheduling algorithm considering wireless channel characteristics in IEEE 802.16 OFDMA systems",0.212752525253,0.23112244898
7F10DA84,"Implementing QoS in SIEPON",0.142857142857,0.142857142857
7E317AE0,"Impact of multiple access on uplink scheduling",0.22335997336,0.352678571429
5BD96445,"Physical layer effects on MAC layer performance of IEEE 802.11 a and b WLAN on the Martian surface",0.353377525253,0.400458668316
5B599A42,"Delay Compensation Strategies for an Efficient Radio Resource Management in DVB-S2 Systems",0.16810966811,0.16037414966
7A513B90,"Closed-Loop Antenna Selection for Wireless LANs with Directional & Omni-Directional Elements",0.141774891775,0.168571428571
801AF55A,"An FPGA-based wireless network capstone project",0.142762445887,0.173611111111
76F01487,"Location Based Radio Resource Allocation (LBRRA) in WIMAX and WLAN network",0.141973304473,0.151649144506
6C3D7815,"Communication protocols for sensor networks",0.14678030303,0.154671717172
09C725D4,"Packet Level Simulation of Bluetooth Physical Layer",0.24623466811,0.34126984127
7C2ACF4A,"Enhancing Power System Automation Through the Use of Real-Time Ethernet",0.172276334776,0.166402116402
5FDD8894,"SEQ Peri-Urban Supersite Network",0.0958964646465,0.111111111111
6A8177D5,"A Bayesian Decision Theory Approach for the Techno-Economic Analysis of an All-Optical Router",0.236954365079,0.311904761905
63FC4D82,"End-to-end QoS architecture for continuous media services",0.241262210012,0.447619047619
7C095933,"Performance evaluation of QoE in VoIP traffic under fading channels",0.213501082251,0.298015873016
7716B170,"A disc of scatterers based radio channel model for secure key generation",0.145887445887,0.160383597884
7594982A,"Services and protocols of the data link layer",0.250401334776,0.308975468975
7514502C,"Secure communication in an OFDM-PON system by using frequency hopping",0.173169191919,0.178333333333
7870E573,"Detection of misbehavior in cooperative diversity",0.11243964369,0.122863247863
268791F2,"DISTI | VIJESTI - Dist official IT supplier of the 16th Sarajevo Film Festival",0.155366161616,0.172727272727
5AFDAE82,"Modeling the DOCSIS 1.1/2.0 MAC protocol",0.0902174214674,0.104377104377
777407D1,"The application of Labview in mine hydrology wireless monitoring system",0.153712606838,0.186507936508
7A07F550,"Interference cancelation vs. interference suppression in ad hoc networks",0.100946969697,0.104444444444
80692C87,"Influence of Channel Models and MIMO on the Performance of a System based on IEEE 802.16",0.280460858586,0.315277777778
7F73B6FC,"A new model of application response time for VoIP over WLAN and fixed WiMAX",0.139091810967,0.142526455026
0A02CF07,"HIPERLAN/2 AND IEEE 802.11A FOR THE WIRELESS LOCAL LOOP",0.0982208124478,0.166666666667
78F6BD3F,"Performance evaluation of joint downlink scheduling in multi-cellular OFDMA systems based on IEEE 802.16a",0.313943001443,0.428571428571
6306A693,"Performance of space-diversity trellis codes in HIPERMAN and 802.16a broadband wireless access systems",0.374558080808,0.472883597884
59A46291,"A non-intrusive beam power monitor for high power pulsed or continuous wave lasers",0.1380501443,0.134863945578
7F8C5C80,"Efficient interleaving method in wireless ATM networks",0.134081890332,0.134848484848
7C096AD6,"A problem solving framework for group decision support system",0.183978174603,0.171660482375
273F073A,"Resource Management in Layer 1 Virtual Private Networks(Network)",0.247970779221,0.293015873016
812361C5,"A software-based receiver running on a single DSP for terrestrial digital multimedia broadcasting",0.121222527473,0.131944444444
7C30BB01,"LAN Protocol Validation and Evaluation",0.117018398268,0.144841269841
769466D8,"A simple series for personal computer computation of the error function Q(.)",0.139637445887,0.132926332926
795D0045,"Multicomponent complex formation between vinpocetine, cyclodextrins, tartaric acid and water-soluble polymers monitored by NMR and solubility studies",0.124116161616,0.123196248196
7FFA38E3,"Enhanced wafer matching heuristics for 3-D ICs",0.101291070041,0.110709290709
7526034A,"Marmote SDR: Experimental Platform for Low-Power Wireless Protocol Stack Research",0.165170940171,0.194848484848
7F572C54,"A Hand-Held Smart Wet Etch Monitor: Design, Theory, and Test",0.122573953824,0.126118326118
7C651C2A,"Chlorine Dioxide: A New Agent for Dialysis Monitor Disinfection in a Pediatric Center",0.156651334776,0.162641723356
7B660814,"Performance Comparison of High Rate Ultra-Wideband OFDM System between Two Different Modulation Techniques",0.287752525253,0.312962962963
01A67C9C,"DISTI | VIJESTI - Kako Palo Alto Networks® Next-generation Firewall klasifikuje saobraćaj?",0.100274725275,0.125
7720E14C,"Enhanced wireless multiple-access and scheduling techniques using positional and environmental information",0.173223304473,0.225555555556
7942DD2E,"Using impulse Radio UWB for medical monitoring sensor networks: a performance evaluation",0.254220779221,0.290249433107
7E051B98,"QoS Architecture for a Mobile Ad Hoc Network",0.126199494949,0.137037037037
5D905161,"Voice over wireless LAN via IIEE 802.16 wireless MAN and IEEE 802.11 wireless distribution system",0.170391414141,0.205892255892
7EBDBF91,"Low power circuits for NoC-based SoC design",0.132693001443,0.151322751323
7972C120,"Software Defined Radio Prototyping Platforms Enable a Flexible Approach to Design [Application Notes]",0.146073717949,0.146560846561
149E2A36,"Sustainability Performance Indicators",0.209532828283,0.400673400673
777BA80D,"Testbed methods to study physical layer path establishment in long haul optical wavelength switched networks",0.250347222222,0.227777777778
79AAC9CD,"On the Physical Layer Security of Backscatter Wireless Systems",0.242647977023,0.418560606061
7949F32C,"Slow and Steady: Modelling and Performance Analysis of the Network Entry Process in IEEE 802.16",0.328977272727,0.419907407407
751BD568,"RHIC control system",0.141117909868,0.216666666667
80F6A8C2,"Space-time processing for broadband wireless access",0.239186507937,0.464285714286
7FF854F9,"A comparison of fieldbus protocols: LIN 1.3, LIN 2.0, and TTP/A",0.119932844933,0.168560606061
09B3D891,"An Ontology-Based Method for Universal Design of User Interfaces",0.143700396825,0.150992063492
7A863113,"Towards a WirelessHART module for the ns-3 simulator",0.126199494949,0.1625
79B79631,"Choice of physical layer code rate and modulation for DVB-SH",0.250157828283,0.294444444444
766F4115,"QoS-TEOS: QoS guaranteed throughput-efficiency optimal distributed scheduling in WiMAX mesh networks",0.145896464646,0.183585858586
7EBAB2DE,"Denial of Service Attacks and Detection Methods in Wireless Mesh Networks",0.151339285714,0.155956890332
5D01F0A9,"Conserve energy through multiple-packets transmission in heterogeneous mobile ad hoc networks",0.110227272727,0.102606837607
7E086856,"Robust EZW image transmission scheme using distributed-alamouti codes in relay networks",0.117960858586,0.121031746032
78E14EE4,"A multi-layer architecture of wireless network for digital video transmission",0.142613636364,0.159444444444
7B6D471E,"Design of Meteorological Monitoring System for High-Speed Railway",0.157928876679,0.164682539683
7D3D4F22,"A novel load-sharing algorithm for energy efficient MAC protocol compliant with 802.11 WLAN",0.11710546398,0.117546897547
715B8CEB,"Cross-layer design for QoS wireless communications",0.127274114774,0.167989417989
7E3BB4D5,"Coding With Scrambling, Concatenation, and HARQ for the AWGN Wire-Tap Channel: A Security Gap Analysis",0.20499465812,0.25021043771
860B16D0,"An NLOS-capable 60 GHz MIMO demonstrator: System concept & performance",0.283933080808,0.361666666667
3BB29FCD,"Obtainment of diagnostic signals based on emission NOX in light of ecological manageability of engine",0.132990620491,0.125798160173
762052C5,"Control of plasma equipment by regulating radio frequency impedance matching",0.145379273504,0.16654040404
7F6BF725,"A Self-Adaptive Monitoring and Analysis System for Students' Behaviors in Laboratory Course",0.272970779221,0.303174603175
7D63300C,"Analog/RF physical layer issues for UWB systems",0.264732142857,0.492063492063
79E6DA7E,"Full Rank Solutions for the MIMO Gaussian Wiretap Channel With an Average Power Constraint",0.140183080808,0.142466329966
5BAF0C46,"Trends in Wireless Communications",0.119391719392,0.157407407407
782627BD,"Error propagation in a multi-way relay channel",0.09835997336,0.115575396825
775E5DA5,"A Decentralized Cross-Layer Approach to Cooperative Video Transmission",0.107251082251,0.125992063492
7BDC8146,"Backbone orientational order in fatty acid monolayers at the air-water interface",0.108143939394,0.105303030303
764504E8,"Design Considerations for Next Generation Satellite Terminal",0.12113997114,0.124389499389
4BC5049E,"Link-Budget Design and Analysis showing Impulse- based UWB Performance Trade-Off flexibility as Inte",0.323062354312,0.383735312307
7DD48199,"Designing a Self-Healing Approach to Radio Link Failures in Mobile Handsets",0.128382034632,0.128439153439
03D95FFF,"MAC Sublayer and Physical Layer Management For Token Bus Broadband LAN",0.247970779221,0.324126984127
590CDC56,"Performance Evaluation of IEEE 802.11 Wireless Networks for Real-time Networked Control Systems",0.272276334776,0.322883597884
7D2DCF36,"A New Realistic Relay Selection Method Based on Correlated Shadowing for Multihop Cellular Networks",0.1193001443,0.123346560847
76CEE1A4,"Compressive optical MONTAGE photography",0.121177433677,0.154761904762
7D30D95A,"Topology Formation in IEEE 802.15.4: Cluster-Tree Characterization",0.0958964646465,0.0911495911496
7AFF5DEF,"Specific primary user sensing for wireless security in IEEE 802.22 network",0.132598304473,0.148719336219
7EC22904,"Defending method against jamming attack in wireless ad hoc networks",0.136954365079,0.134126984127
7A7B5DFE,"Robust video monitoring system for transport applications based on joint use of multiple description coding and multiple antennas",0.172276334776,0.188888888889
791128EF,"Performance of multiuser CDMA receivers with bursty traffic and delay constraints",0.22435966811,0.292222222222
76B60860,"A new model for physical layer security in cellular networks",0.250157828283,0.342171717172
7F61F8A6,"On throughput enhancement of multi-hop wireless networks using interference alignment",0.131746031746,0.137962962963
7ED5709F,"A physical layer performance simulation system for UMTS",0.367762445887,0.619047619048
611239DF,"Protocol and Topology Issues for Wide-Area Satellite Interconnection of Terrestrial Optical LANs",0.132494588745,0.112554112554
5DADFDAB,"Optimize channel estimation for WCDMA",0.0890567765568,0.104166666667
2E95646A,"Pagers GENERAL DESCRIPTION",0.120979020979,0.15
7EA0C923,"The Performance of Network Coding at the Physical Layer with Imperfect Self-Information Removal",0.353377525253,0.464444444444
60D78950,"Optical Ethernet: introduction to the feature issue",0.130262445887,0.138095238095
80FEF50E,"Research and Implementation of PLC Editor System",0.181490384615,0.239583333333
695F2783,"Method of and apparatus for determining deposition-point temperature",0.108838383838,0.12962962963
7DBA2110,"Implementation of 10gigabit packet switching using IXP network processors",0.108491161616,0.12037037037
7AFAD20E,"Five-level DVB-H protocol analysis for interoperability testing purposes",0.212910353535,0.296515151515
752C3871,"An Adaptive-Transmission Cross-Layer Protocol with Selective MAC Layer Spatial Reuse Capabilities for Ad Hoc Networks",0.239741161616,0.252188552189
5E0F2122,"CMOS RFIC ARCHITECTURES FOR IEEE 802.15.4 NETWORKS",0.0958964646465,0.111111111111
06962B6E,"DISTI | VIJESTI - Allied Telesis Enhances Network Interface Card for Virtual Machines",0.136616161616,0.153703703704
7FA069CC,"B-ISDN architecture and protocol",0.108272977023,0.145454545455
7DD8F12B,"Security Analysis for Wireless Networks Based on ZigBee",0.24310966811,0.323737373737
7A8F9C67,"Distributed wireless network utility maximization",0.128526334776,0.137606837607
7D5F64B9,"Hardware-Based TCP Processor for Gigabit Ethernet",0.0938384532135,0.100108225108
80637673,"Network Planning for Next-Generation Metropolitan-Area Broadband Access under EPON-WiMAX Integration",0.230411255411,0.355158730159
7952BB49,"Effect of realistic channel conditions on the energy efficiency of network coding-aided cooperative MAC protocols",0.119002525253,0.105808080808
5978B0F6,"Design of TD-SCDMA Communications Test Set Physical Layer",0.252232142857,0.301587301587
7B4767D2,"Network-level cooperation with enhancements based on the physical layer",0.255262445887,0.358333333333
7EAC2D7C,"Design of SNACK mechanism for wireless TCP with new snoop",0.115369352869,0.114213564214
26E9285D,"FETAL HEART RATE ANALYZING SYSTEM USING MICROCOMPUTER (TOCOPUTER)",0.159880050505,0.174272486772
5C6F3358,"DISTI | Kontakt informacije",0,0
733AA6DA,"ARQ protocol for infrared wireless LANs: packet-level ACK or no-packet-level ACK?",0.11988011988,0.169191919192
7A6A5E15,"Channel estimation methods for diversity and MIMO in LR-WPAN systems",0.154861111111,0.14594017094
7ECCD417,"A High Resolution In Situ Ultrasonic Corrosion Monitor",0.102077089577,0.103563103563
7549DFFB,"Adaptive Connection Admission Control and Packet Scheduling for QoS Provisioning in Mobile WiMAX",0.118456890332,0.118015873016
79174E47,"A Cross-Layer Design for Broadcast Algorithm in MANETs",0.107747113997,0.134920634921
7717E4E5,"An experimental mixed purpose network",0.111963383838,0.118055555556
00F8116A,"DISTI | VIJESTI - Disti's new web portal is online",0.127472527473,0.177777777778
7F816DF2,"Performance evaluation of wimax system using Convolutional Product Code (CPC)",0.272276334776,0.333994708995
7C81B9F3,"Performance Analysis of DCF under two access mechanisms in IEEE802.11a WLAN",0.445098304473,0.650793650794
2FB8FDD3,"End of editable fields",0.0918822496947,0.133928571429
5B4608E9,"DISTI | PROIZVODI - Dell Desktop Optiplex 7020",0.079274422473,0.0972222222222
80FE2B39,"GMIP: A Novel Optical Interconnect Gridded Memory Service Protocol",0.127670940171,0.155303030303
58A7EB6A,"A New Protection Model to Provide Availability-Guaranteed Service for Reliable Optical WDM Networks",0.138501082251,0.170555555556
5ADDDBE1,"DISTI | PROIZVODI - aaa",0.0607741013072,0.0666666666667
7E694B97,"Topology Reconstruction and Characterisation of Wireless Ad Hoc Networks",0.12113997114,0.117797017797
7D089902,"WLC23-1: Code Shift Keying Modulation For Low-Rate UWB Communications Under Dense Multipath",0.108838383838,0.116666666667
7F93EFDE,"The Role of Collaboration Grids in the Roadmaps of Networked Organizations",0.11810966811,0.14126984127
7EC4E832,"3D electromagnetic chip package simulation for high-speed serial interface application",0.119349747475,0.126349206349
6E1ECE2D,"DISTI | PARTNERI - Adobe",0.0712838019823,0.0833333333333
7EA8D770,"Positioning routing in the protocol stack (or 'passing the bus-selection buck')",0.103419497169,0.113975468975
7C673F7D,"Orthogonal Frequency-Division Multiplexing-Based Cooperative Spectrum Sensing for Cognitive Radio Networks",0.129473304473,0.150992063492
7EADE1DB,"Characteristics of baseband digital signal transmission for intrabody communications",0.113576007326,0.134259259259
77AD9937,"Frequency-domain on-off accumulative transmission over frequency-selective fading channels",0.100274725275,0.12037037037
768955F3,"Chaotic sequences for reduction of PAPR in OFDMA system",0.153960622711,0.178451178451
75E2F73B,"Making the Case for Random Access Scheduling in Wireless Multi-hop Networks",0.233387445887,0.31746031746
7ADE2D10,"Synchronous ethernet: a method to transport synchronization",0.118456890332,0.126984126984
58B1D364,"A novel power line communication system for outdoor electric power grids",0.175694444444,0.155555555556
5EB23958,"A Survey of Mobile WiMAX IEEE 802.16m Standard",0.124116161616,0.180555555556
80D77AFF,"A Cross Layer Broadcast Protocol for Multihop Emergency Message Dissemination in Inter-Vehicle Communication",0.251294191919,0.249210858586
7DBF5747,"An experimental analysis of the effects of noise on Wi-Fi video streaming",0.221834415584,0.288975468975
76662979,"Coupled 802.11 Flows in Urban Channels: Model and Experimental Evaluation",0.119193306693,0.136904761905
7D225512,"RF Fingerprints for Secure Authentication in Single-Hop WSN",0.0874562937063,0.0969696969697
01879044,"Implementation of a Dual-Mode SDR Smart Antenna Base Station Supporting WiBro and TDD HSDPA",0.140518162393,0.188333333333
77603C90,"Experimental demonstration of an improved EPON architecture using OFDMA for bandwidth scalable LAN emulation",0.127323717949,0.140277777778
5976EE75,"An overview of the ETSI-BRAN HIPERACCESS physical layer air interface specification",0.232231310356,0.278585858586
775F975B,"Viral load assay sensitivity and low level viremia in HAART treated HIV patients",0.151199494949,0.140674603175
5FBA3322,"Wireless optical networking challenges and solutions",0.10405982906,0.105555555556
7CF1D6A8,"Reducing Handoff Latency for WiMAX Networks Using Mobility Patterns",0.114835858586,0.121428571429
7C1A0474,"A Primary User authentication system for mobile cognitive radio networks",0.172032828283,0.207070707071
79385303,"An integrated energy aware wireless transmission system for QoS provisioning in wireless sensor network",0.160669191919,0.194907407407
440B3351,"DISTI | VIJESTI - Materijali sa prezentacija dostupni za preuzimanje",0.0692135989011,0.0769230769231
73EFAAC4,"Optimum packet size and throughput of TCP-IP traffic over wireless ATM links",0.119056637807,0.131111111111
1A1FAAB6,"Design and Implementation of Internet Performance Monitor with Realtime TCP Behavior Analysis (Special Issue on Internet Technology)",0.346036255411,0.331084656085
43FCB4F4,"Electrotechnology Toolbox - Unit 202a Tutorial 10 - Security System Indicator Lights - Summary",0.154671717172,0.132948532949
7F87C756,"Some aspects regarding radio resources management in multi-antenna systems",0.167365620491,0.185317460317
5D242D48,"Introduction to Mobile WiMAX",0.0750744047619,0.1
7CBEB8B7,"Thin film sensors on the basis of chalcogenide glass materials prepared by pulsed laser deposition technique",0.172127525253,0.162341269841
8053AF45,"Experimental evaluation of DOCSIS 1.1 upstream performance",0.215919497169,0.571428571429
7F637CE8,"Monitor arbeidsongevallen in Nederland 2006",0.0825558632544,0.116883116883
5F906923,"On the design of D2D synchronization in 3GPP Release-12",0.10238997114,0.126984126984
76A05EE5,"Implementation of unified architecture of 802.11a and 802.16a PHY layers using Verilog HDL (R & D)",0.242254273504,0.247893772894
799DB841,"A Channel Characteristics Projection Method in MISO Systems",0.164930555556,0.155423280423
5D102580,"Evaluation of open-source software frameworks for high fidelity simulation of cognitive radio networks",0.150351731602,0.142403628118
7A404A62,"Design and simulation of Orthogonal Frequency Division Multiplexing transceiver system using Differential Phase Shift Keying (DPSK) for Wireless Local Area Network",0.161165223665,0.15251970252
7A7306C7,"A brief overview of the challenges of the multicore roadmap",0.096925990676,0.0954545454545
7E741E60,"Verification of an Audio Control Protocol",0.0912878787879,0.0969696969697
7A210459,"Optimal Transmission Rate Control Policies in a Wireless Link Under Partial State Information",0.140679112554,0.129166666667
8112F722,"Uplink Capacity of Multi-Class IEEE 802.16j Relay Networks with Adaptive Modulation and Coding",0.115435606061,0.107070707071
7ED99DE1,"CSI-Based Indoor Localization",0.0890567765568,0.125
7F10CC1B,"Throughput Optimization for Wireless LANs in the Presence of Packet Error Rate Constraints",0.134577922078,0.136860670194
775DA09E,"Simulation and Comparison of Advanced Modulation Formats for Wavelength Reuse in High-SpeedWDM-PON System",0.17280982906,0.165476190476
81D708D8,"Noncontact Monitoring of Respiration by Dynamic Air-Pressure Sensor",0.133486652237,0.157407407407
5D73A9CE,"Evaluation of Gb/s Laser Based Fibre LAN Links: Review of the Gigabit Ethernet Model",0.148466810967,0.148466810967
7DEE967F,"Channel Cognitive Multi-channel MAC protocol in Wireless Mesh Network",0.135470779221,0.12984006734
7E53B8DF,"Design of cyclic delay diversity for single carrier cyclic prefix (SCCP) transmissions with block-iterative GDFE (BI-GDFE) receiver",0.238038003663,0.241195709053
0979D389,"Performance Comparison with Different Pulse Waveforms in Ultra-Wideband Based Wireless Sensor Networks",0.267613636364,0.284722222222
7FA1DB47,"Joint Antenna and User Selection Algorithm for Uplink of Multiuser MIMO Systems using Sequential Monte Carlo Optimization",0.165133477633,0.169196428571
0D8A3728,"Die Wunder des Brian Cox, Rockstar-Scientist",0.0768538752914,0.0811688311688
752E61C7,"Interference from MB-OFDM UWB Systems: Exact, Approximate, and Asymptotic Analysis",0.267956349206,0.477777777778
80888568,"Data link control for multiple input multiple output wireless systems",0.166278860029,0.181051587302
7705F917,"Trends in the path to 4G",0.09864996115,0.118055555556
7B0358EF,"Performance analysis of an ATM MUX with a new space priority mechanism under ON-OFF arrival processes",0.334974747475,0.37886002886
78CF6B9D,"Joint Topology Control and Authentication Design in Mobile Ad Hoc Networks With Cooperative Communications",0.115331890332,0.103916718202
5BFFDA6B,"A multibanded system architecture for ultra-wideband communications",0.146527777778,0.214814814815
7DE0B471,"Forearm Loss Caused by Automated Non-Invasive Blood Pressure Cuff Malfunction: A Hearsay Report",0.110723304473,0.112770562771
78CA7F6E,"Segmented video distribution over WiMAX: Proposed approach and experimental methodology",0.10718482906,0.111111111111
75CAA980,"Application Research of Intelligent Monitoring System Based on Abnormal Events",0.210069444444,0.226851851852
5C07B608,"Data in the optical domain technology: A network-level perspective",0.115331890332,0.113997113997
7A40F037,"System verification of flexray communication networks through behavioral simulations",0.173169191919,0.170793650794
751337F5,"A Study on the Performance of Wavelet OFDM in Power Line",0.226893939394,0.317222222222
5BFA74B7,"Dynamic Rate Adaptation (DRA) and Adaptive Coding and Modulation (ACM) efficiency comparison for a DVB-RCS system",0.176294191919,0.163492063492
5FA6E577,"An effective data transfer method by integrating priority control into multirate mechanisms for IEEE 802.11 wireless LANs",0.137996031746,0.12923681257
007715C4,"Reconciling Principle and Practice in a LAN Course: A Simulation and Lab Mixed Approach",0.1318001443,0.141213151927
7D53AB18,"Error-Resilient Video Encoding and Transmission in Multirate Wireless LANs",0.129369588745,0.159126984127
80BCFD62,"Improve secure communications in cognitive two-way relay networks using sequential second price auction",0.113099747475,0.11871263657
7BB97AD8,"Testing Lagrangian atmospheric dispersion modelling to monitor CO 2 and CH 4 leakage from geosequestration",0.0908202908203,0.122777777778
7957F427,"Enhanced performance of wavelength converted all-optical networks through dynamic dispersion compensation",0.217866161616,0.253306878307
5E0F227B,"The WINLAB network centric cognitive radio hardware platform: WiNC2R",0.136616161616,0.202777777778
7DB7C483,"Information and inference in the wireless physical layer",0.24623466811,0.417989417989
74C57EBF,"Enhancing an optical access network with ADSL technology",0.225306637807,0.338492063492
7E31905E,"Cross-Layer Approaches for Planning and Operating Impairment-Aware Optical Networks",0.115435606061,0.128472222222
7F271F03,"Optical layer traffic grooming in all-optical WDM networks",0.239741161616,0.333333333333
6DC40477,"Parasitological Data as Monitors of Environmental Health",0.109586940837,0.108465608466
7FB051C9,"H.264/AVC interleaving for 3G wireless video streaming",0.10422979798,0.115740740741
58D48CC7,"Multi-rate multi-tone-CDMA with multiuser detection for wireless multimedia communications",0.109756562882,0.12037037037
78380C66,"Impulse Response Model and Parameters for Indoor Channel Modeling at 60GHz",0.124558080808,0.131349206349
7C377742,"Toxicity and metabolism of acephate in adult and larval insects",0.132598304473,0.152777777778
77777256,"Intelligent diagnostic for PROFIBUS DP networks",0.112563131313,0.138888888889
