Paper ID,Title,Sim1,Sim2
7E7903AA,"Rate-distortion optimized bitstream switching for peer-to-peer live streaming",0.104718198468,0.145454545455
8027C4E4,"Low Complexity Rate Distortion Optimization for HEVC",0.368246336996,0.585227272727
80280910,"Rate-Distortion Optimized Interactive Light Field Streaming",0.101282051282,0.141666666667
7F684A1E,"Rate control using enhanced frame complexity measure for H.264 video",0.386698717949,0.429931972789
814DB031,"Rate-distortion optimized network communication using general MDC",0.138335622711,0.206349206349
7CF3D159,"Precompression Quality-Control Algorithm for JPEG 2000",0.0822176597912,0.1
7D6008B2,"Compression of 3-D Point Visual Data Using Vector Quantization and Rate-Distortion Optimization",0.141311813187,0.140538033395
7B28FB41,"RDTC Optimized Streaming for Remote Browsing in Image-Based Scene Representations",0.231849747475,0.301363636364
7E4A5F1C,"Complexity Modeling of Spatial and Temporal Compensations in H.264/AVC Decoding",0.151488095238,0.140277777778
7EA5080C,"Wavelet-Based Joint Estimation and Encoding of Depth-Image-Based Representations for Free-Viewpoint Rendering",0.125248015873,0.115277777778
7F421F6E,"Two-Stage Mode Selection of H.264/AVC Video Encoding with Rate Distortion Optimization",0.483573717949,0.511796536797
806055A3,"Predictive RD optimized motion estimation for very low bit-rate video coding",0.452819749695,0.647222222222
7FC7311B,"Fast Bit Rate Estimation for Mode Decision of H.264/AVC",0.241510225885,0.340277777778
7A76E578,"Full rate distortion optimizaton of MPEG-2 video coding",0.483573717949,0.777777777778
7E02D333,"Unbalanced Multiple-Description Video Coding with Rate-Distortion Optimization",0.368097527473,0.69696969697
81563CB9,"Optimized transmission of H.26L/JVT coded video over packet-lossy networks",0.362541971917,0.563492063492
81155B40,"A New Rate Control Algorithm for H.264",0.249496336996,0.433333333333
7CFB1CBA,"Optimal multidimensional bit-rate control for video communication",0.278663003663,0.447619047619
7FEB2EE0,"Distributed Collaboration for Enhanced Sender-Driven Video Streaming",0.267055860806,0.353977272727
7DD4A386,"Rate-Distortion Optimized Motion-Compensated Prediction for Packet Loss Resilient Video Coding",0.475240384615,0.566738816739
7587EA31,"Motion estimation for depth maps coding based on rendered view distortion",0.486607142857,0.477430555556
77DC56B0,"A Direct Inter-Mode Selection Algorithm for P-Frames in Fast H.264/AVC Transcoding",0.119791666667,0.1125
808A4297,"Optimal mode selection and synchronization for robust video communications over error-prone networks",0.279407051282,0.289087301587
7DFD90A3,"Rate control for robust video transmission over burst-error wireless channels",0.387847222222,0.424537037037
7D8C9B4A,"Video streaming with diversity",0.253514194139,0.441666666667
752C5C44,"Intra/Inter Macroblock Mode Decision for Error-Resilient Transcoding",0.122909035409,0.138888888889
7E962A77,"Generalized rate-distortion optimization for motion-compensated video coders",0.255262445887,0.347727272727
593CF03E,"Fast H.264 mode selection using depth information for distributed game viewing",0.155597527473,0.186111111111
80A44F9B,"Rate-distortion optimized layered coding with unequal error protection for robust Internet video",0.481398809524,0.505952380952
7E8CDDE5,"Efficient Inter Mode Prediction Based on Model Selection and Rate Feedback for H.264/AVC",0.250202922078,0.27398989899
7EB01D91,"Inter-View Direct Mode for Multiview Video Coding",0.373305860806,0.722222222222
7E27F6E5,"Low cost architecture for JPEG2000 encoder without code-block memory",0.127926587302,0.126322751323
7DEE704C,"Proactive optimization of real-time video",0.263930860806,0.545454545455
815FDFC1,"An efficient inter-frame coding with intra skip decision in H.264/AVC",0.112231691919,0.111111111111
7870A32E,"Compression of 3-D triangle mesh sequences based on vertex-wise motion vector prediction",0.272264194139,0.250946969697
7D8F9EBF,"Fast Inter Mode Decision Algorithm Based on Macroblock Tracking in H.264/AVC Video",0.270528083028,0.300336700337
031B95EE,"A rate control scheme for H.264/AVC CBR transmission",0.234218559219,0.29468975469
003BB491,"Depth Map Compression for Depth-Image-Based Rendering",0.114583333333,0.131944444444
7D4A0994,"Rate-distortion optimized motion estimation for error resilient video coding",0.454555860806,0.65
7D0F00F6,"A Fully Scalable Motion Model for Scalable Video Coding",0.512382987383,0.848484848485
7DD6A5FF,"Rate-distortion optimized video summary generation and transmission over packet lossy networks",0.265319749695,0.307936507937
70F095F2,"A fast rate-distortion optimization algorithm for motion-compensated video coding",0.265319749695,0.325505050505
75C153E9,"Layered coding vs. multiple descriptions for video streaming over multiple paths",0.369486416361,0.422558922559
7DAEF3C8,"A Novel Inter-frame Mode Decision Prediction Algorithm for H.264/AVC",0.139575702076,0.117171717172
8177236F,"High-Throughput Architecture for H.264/AVC CABAC Compression System",0.111174242424,0.163888888889
7F29B18B,"Rate-distortion optimized quantization in multistage audio coding",0.131986416361,0.129861111111
7745BAD6,"Fast rate-distortion optimization in the H.264/AVC standard",0.132978479853,0.116883116883
5DBAE95F,"A Study on Motion Prediction and Coding for In-Band Motion Compensated Temporal Filtering",0.368097527473,0.554112554113
7E580C55,"Applications of Video Distortion Estimation Algorithms for Efficient Video Streaming",0.376430860806,0.422685185185
80CF73C3,"Adaptive Rate-Distortion Optimization for H.264",0.10084013209,0.0909090909091
7FF29D73,"Rate-distortion optimized bitstream extractor for motion scalability in scalable video coding",0.712169312169,1.0
81290EA3,"Context Adaptive Lagrange Multiplier (CALM) for Rate-Distortion Optimal Motion Estimation in Video Coding",0.348653083028,0.414351851852
811D8DB5,"Robust Low-Delay Video Transmission using H.264/AVC Redundant Slices and Flexible Macroblock Ordering",0.265319749695,0.33746031746
754171E4,"A Scalable Information Security Technique: Joint Authentication-Coding Mechanism for Multimedia over Heterogeneous Wireless Networks",0.248589065256,0.237996031746
5B04B18A,"An Efficient Mode Decision Algorithm for Combined Scalable Video Coding",0.44417311084,0.518253968254
7E7DA49A,"Novel Statistical Modeling, Analysis and Implementation of Rate-Distortion Estimation for H.264/AVC Coders",0.125694444444,0.109444444444
7E1C9035,"Rate-Distortion Cost Estimation for H.264/AVC",0.10119047619,0.133928571429
7E0EFA49,"Video encoder optimization for efficient video analysis in resource-limited systems",0.27931547619,0.478181818182
7ED2AD5B,"Block INTER mode decision for fast encoding of H.264",0.150793650794,0.136111111111
7EA6573E,"Bidirectional scalable motion for scalable video coding",0.512382987383,1.0
809871CB,"Rate-distortion optimized frame level rate control for H.264/AVC",0.23282967033,0.455555555556
7D056771,"Perceptually-Friendly H.264/AVC Video Coding Based on Foveated Just-Noticeable-Distortion Model",0.368097527473,0.606060606061
7DE4B63B,"The Virtue of Patience in Low-Complexity Scheduling of Packetized Media With Feedback",0.125,0.137777777778
7E3E8340,"SSIM-Based Perceptual Rate Control for Video Coding",0.381837606838,0.577777777778
80B2BF1C,"Advanced inpainting-based macroblock prediction with regularized structure propagation in video compression",0.283482142857,0.304848484848
805E5CEA,"Branch and bound algorithms for rate-distortion optimized media streaming",0.133482142857,0.146753246753
5E22AA9B,"JPEG2000 low complexity allocation method of quality layers",0.180555555556,0.200793650794
7D40802E,"Complexity constrained rate-distortion optimization of sign language video using an objective intelligibility metric",0.284722222222,0.297276334776
7D5D8AB5,"Convex Programming Formulations for Rate Allocation in Video Coding",0.358573717949,0.421957671958
682D2184,"Wavelet-Based Video Compression Using Long-Term Memory Motion-Compensated Prediction and Context-Based Adaptive Arithmetic Coding",0.272264194139,0.302188552189
5C6988A2,"Pruned Mode Decision based on Variable Block Sizes Motion Compensation for H.264",0.281746031746,0.270436507937
7CFD6498,"On fast coding tree block and mode decision for high-Efficiency Video Coding (HEVC)",0.281746031746,0.25
6A6B0DCF,"Optimized Packet Scheduling in Multiview Video Navigation Systems",0.378273809524,0.440476190476
78B25355,"Rate-distortion optimized tree-structured compression algorithms for piecewise polynomial images",0.234623015873,0.308888888889
76293C61,"SSIM based perceptual distortion rate optimization coding",0.456788003663,0.684848484848
807F2586,"Trellis-Based Approaches to Rate-Distortion Optimized Audio Encoding",0.130597527473,0.130303030303
776C571A,"Rate-distortion optimized rate-allocation for motion-compensated predictive video codecs using PixelRank",0.368097527473,0.777777777778
7F20CFF2,"Intra/inter algorithm for B frame processing in H.264/AVC encoder",0.114930555556,0.104861111111
8161680E,"A block based encoding algorithm for matching pursuit image coding",0.233333333333,0.282638888889
777C115B,"A Fast Intra Skip Detection Algorithm for H.264/AVC Video Encoding",0.263930860806,0.295384615385
7D9D27A6,"A Rate-Distortion Optimization Algorithm for Rate Control in H.264",0.23282967033,0.347727272727
8000110E,"Error resilience of video transmission by rate-distortion optimization and adaptive packetization",0.122916666667,0.113005050505
8111AABF,"Highly Parallel Rate-Distortion Optimized Intra-Mode Decision on Multicore Graphics Processors",0.286153083028,0.386111111111
