Paper ID,Title,Sim1,Sim2
7D09D29E,"Automatic SystemC Code Generation from UML Models at Early Stages of Systems on Chip Design",0.388662131519,0.35431547619
7725A618,"High-quality code generation via bottom-up tree pattern matching",0.260714285714,0.383928571429
7E475FCC,"Run-time code generation as a central system service",0.301388888889,0.389880952381
758DA239,"Efficient scheduling of DSP code on processors with distributed register files",0.270899470899,0.313571428571
5C9A23A1,"How Hard is Compiler Code Generation?",0.247426647427,0.492063492063
5ED99CC2,"Compilation techniques for multimedia processors",0.125462962963,0.115277777778
7C90CD12,"Direct implementation of compiler specifications or the pascal p-code compiler revisited",0.117919117919,0.133506493506
7DF377E1,"Quibbs, a Code Generator for Quantum Gibbs Sampling",0.256355218855,0.313181818182
7E1492C7,"Metasynthesis for Designing Automotive SoCs",0,0.2
75352088,"An Efficient Code Generation Algorithm for Non-orthogonal DSP Architecture",0.299735449735,0.396825396825
7ACBB9A1,"Optimal and near-optimal global register allocations using 0–1 integer programming",0.122757335257,0.178888888889
7659FCEF,"Affix grammar driven code generation",0.247426647427,0.29380952381
801051DD,"Jumbo: run-time code generation for Java and its applications",0.288762626263,0.373214285714
7E48F133,"Modular JADE Agents Design and Implementation Using ASEME",0.126797739298,0.176904761905
596355BC,"Using C as a Compiler Target Language for Native Code Generation in Persistent Systems",0.271296296296,0.278327922078
07654F83,"Efficient Tree Pattern Matching: An Aid to Code Generation",0.118772893773,0.128083028083
7A22F71B,"Higher-order transformations with nested concrete syntax",0.121891534392,0.142857142857
76B324E6,"Automatic floating-point to fixed-point conversion for DSP code generation",0.360204081633,0.566964285714
6DF7FD1B,"From High-Level Task Descriptions to Executable Robot Code",0.294444444444,0.385416666667
817117D0,"Improving the Size of Communication Buffers in Synchronous Models With Time Constraints",0.161574074074,0.151252319109
7C178BDC,"Proving the correctness of heuristically optimized code",0.247426647427,0.389880952381
58BA3246,"Code Generation for a Dual Instruction Set Processor Based on Selective Code Transformation",0.261375661376,0.396130952381
591697EB,"Bi-dimensional composition with domain specific languages",0.131339031339,0.162037037037
60570996,"MySQL4OCL: A Stored Procedure-Based MySQL Code Generator for OCL",0.256355218855,0.5625
75B3F3EC,"A type system for reflective program generators",0.119318181818,0.126893939394
80B4FA32,"Information sources using chaotic dynamics",0.11734006734,0.177564102564
79FB97A6,"Source coherence impairments in a direct detection direct sequence optical code-division multiple-access system",0.279100529101,0.271957671958
7D61A877,"Optimizing stack frame accesses for processors with restricted addressing modes",0.109331409331,0.143027210884
8004F871,"Capacity analysis of m-user self-encoded multiple access system in AWGN channels",0.143392255892,0.147070707071
776E499D,"An llVM backend for GHC",0,0
7DF2A908,"Conflict Modelling and Instruction Scheduling in Code Generation for In-House DSP Cores",0.287566137566,0.290646258503
7D7BF72E,"Analysing Switch-Case Tables by Partial Evaluation",0.139087301587,0.219444444444
7D3744FA,"Interface synthesis in heterogeneous system-level DSP design tools",0.130026455026,0.129945054945
7A994170,"A framework for remote dynamic program optimization",0.108101851852,0.116666666667
7E75583F,"Efficient instruction scheduling for a pipelined architecture",0.120707070707,0.17037037037
753E618B,"A portable global optimizer and linker",0,0
7EC01F48,"Obstacles in software process technology evolution: analysis of the code generation case",0.424146224146,0.345811287478
808DE823,"Tutorial: Compiling concurrent languages for sequential processors",0.148667073667,0.165277777778
5B45E30C,"Transformation of UML state machines for direct execution",0.125132275132,0.123511904762
75657BC8,"Parallel code generation for super-scalar architectures",0.25404040404,0.417989417989
7C0A1704,"Translating concurrent action oriented specifications to synchronous guarded actions",0.16455026455,0.190793650794
804329AD,"Metadata driven code generation using .NET framework",0.10456950457,0.16880952381
810DB1F1,"Effective Code Generation for Distributed and Ping-Pong Register Files: A Case Study on PAC VLIW DSP Cores",0.273478835979,0.244994588745
7C423BA2,"An approach to systems verification",0.128240740741,0.148148148148
7880BBD6,"Lower bound on latency for VLIW ASIP datapaths",0.10456950457,0.133928571429
5CCE9F39,"A standard ML compiler",0.0819902319902,0.0954545454545
7B1CF815,"The Design and Application of a Retargetable Peephole Optimizer",0.140614478114,0.187037037037
5C7E56C8,"Code partitioning for synthesis of embedded applications with phantom",0.286431623932,0.33
8093A0B8,"Model-Based Design of Embedded Control Systems by Means of a Synchronous Intermediate Model",0.155753968254,0.148611111111
7E440ADF,"AN APPROACH TO THE DEVELOPMENT OF HYBRID OBJECT-ORIENTED DESIGN TOOL",0.128511303511,0.158630952381
7722B4E0,"Code generation and reorganization in the presence of pipeline constraints",0.253571428571,0.267328042328
5BB7D3C8,"Model Driven Development of Graphical User Interfaces for Enterprise Business Applications --- Experience, Lessons Learnt and a Way Forward",0.150072150072,0.149567953414
76E9E3F6,"A code generator generator language",0.264351851852,0.375
80C08524,"A Solution Based on Modeling and Code Generation for Embedded Control System",0.2632996633,0.268204365079
751147E6,"Model-Driven development with SDL – process, tools, and experiences",0.286970899471,0.348214285714
7880E88C,"A greedy concurrent approach to incremental code generation",0.260515873016,0.436507936508
7D2516FF,"An Implementation of the Haskell Language",0.139143264143,0.196428571429
071884B7,"Formalization and automatic derivations of code generators",0.382709750567,0.483181818182
780F8104,"A type system for reflective program generators",0.119318181818,0.126893939394
7D38BBCB,"A Code Generation Framework for Time-Triggered Real-Time Systems",0.2632996633,0.352380952381
7522A69F,"Current status of a portable LISP compiler",0.105485255485,0.108225108225
7EC4BEAF,"Building models of real-time systems from application software",0.1625,0.161666666667
5B298FD8,"Automatic Generation of Optimized Code for Marshalling Routines",0.423299319728,0.568571428571
7CCEC64C,"Description-driven code generation using attribute grammars",0.247426647427,0.389880952381
599405BF,"Adaptive Compression of Syntax Trees and Iterative Dynamic Code Optimization: Two Basic Technologies for Mobile Object Systems",0.293915343915,0.260365428223
818CB766,"Constraint analysis for DSP code generation",0.270899470899,0.360714285714
5970CE12,"S2A: a compiler for multi-modal UML sequence diagrams",0.0921976171976,0.100673400673
697B6AF6,"100% Coverage for Safety-Critical Software – Efficient Testing by Static Analysis",0.127744708995,0.169444444444
7F36A1D7,"Code Generation = A* + BURS",0.250673400673,0.411255411255
7EF8E770,"Model-Based Development of Embedded Systems: The SysWeaver Approach",0.121027583528,0.152777777778
7FC9CF84,"Forge: generating a high performance DSL implementation from a declarative specification",0.127447089947,0.147817460317
75BD6705,"Partial translation: towards a portable and efficient prolog implementation technology",0.125039081289,0.152678571429
7F586777,"Partial Evaluation for Code Generation from Domain-Specific Languages",0.288481888482,0.398214285714
09BEE36E,"Pattern-Based Code Generation for Well-Defined Application Domains",0.285515873016,0.375992063492
7B9D4680,"The essence of compiling with continuations",0.168452380952,0.214285714286
5A4C69F0,"From Crosscutting Concerns to Web Systems Models",0.10271950272,0.136666666667
139B2D60,"Parallel Code Generation from Dataflow Specification for MPSoc System",0.2632996633,0.363095238095
5D33FDA6,"Integer Loop Code Generation for VLIW",0.25404040404,0.344742063492
801E626E,"Aspect-oriented multi-view modeling",0.0843212343212,0.1
58971E3F,"Turning Inductive into Equational Specifications",0.0912386224886,0.196428571429
5B67C8AF,"Runtime Code Generation in C++ as a Foundation for Domain-Specific Optimisation",0.256339031339,0.358630952381
7E7DBC50,"Distributed, Modular HTL",0,0.2
76B67A8F,"Table-Driven Code Generation",0.247426647427,0.571428571429
7DD506F9,"Heuristic tradeoffs between latency and energy consumption in register assignment",0.135241147741,0.137572150072
80D47089,"Distributed-code generation from hybrid systems models for time-delayed multirate systems",0.120442520443,0.144047619048
7ABE0AB3,"Buffer optimization in multitask implementations of Simulink models",0.110582010582,0.114691558442
7D123395,"SecureMDD: A Model-Driven Development Method for Secure Smart Card Applications",0.141534391534,0.15
78EE79D2,"Code generation in a machine-independent compiler",0.248342398342,0.411255411255
6D3C91A9,"An MDA Framework Supporting OCL",0.084200984201,0.216666666667
5A60C849,"Issues of the Automatic Generation of HPF Loop Programs",0.249546485261,0.304365079365
7CE0258A,"Automatic isolation of compiler errors",0.377825745683,0.553977272727
7F6B2AFE,"Defining visual notations and their manipulation through meta-modelling and graph transformation",0.146626984127,0.201904761905
809ACA57,"Extracting knowledge from association relationships to build navigational models",0.150320512821,0.181944444444
7A18B987,"Optimized code generation of multiplication-free linear transforms",0.247426647427,0.436507936508
751D6047,"Optimal code generation for expression trees",0.248342398342,0.332722832723
78A9C51E,"SystemJ: A GALS language for system level design",0.163624338624,0.170086580087
76290515,"Domain specific model-based development of software for programmable logic controllers",0.112820512821,0.123421717172
75B593F6,"On the use of LISP in implementing denotational semantics",0.15830026455,0.191287878788
6CA4B354,"Automatic Synthesis and Verification of Real-Time Embedded Software",0.234004884005,0.308888888889
7FD0FC0B,"Constraint analysis for DSP code generation",0.270899470899,0.360714285714
80434674,"Just-In-Time Data Virtualization: Lightweight Data Management with ViDa",0.12876984127,0.150793650794
59A7061E,"Code Generation: Evaluating Polynomials",0.247426647427,0.422619047619
76DD9FA9,"Towards a performance-portable description of geometric multigrid algorithms using a domain-specific language",0.170889295889,0.270833333333
80FFA1FE,"Recompilation for debugging support in a JIT-compiler",0.15830026455,0.25
82AA62C9,"Runtime Code Generation and Data Management for Heterogeneous Computing in Java",0.274873737374,0.292063492063
5A91502C,"Code Instruction Selection Based on SSA-Graphs",0.285714285714,0.433333333333
584DC27B,"Dynamic Look Ahead Compilation: A Technique to Hide JIT Compilation Latencies in Multicore Environment",0.108405483405,0.141439909297
804A1A21,"A case study using empirical optimization for a large, engineering application",0.140740740741,0.206944444444
5FAC4317,"Finding Synchronization-Free Parallelism Represented with Trees of Dependent Operations",0.124394586895,0.187606837607
7A327C96,"DESOLA: An active linear algebra library using delayed evaluation and runtime code generation",0.290476190476,0.286054421769
808914C9,"Register Allocation and Optimal Spill Code Scheduling in Software Pipelined Loops Using 0-1 Integer Linear Programming Formulation",0.277513227513,0.233011937557
80DC5EE6,"A code generation interface for ANSI C",0.247426647427,0.329945054945
80EFBBC0,"CMS-Based Web-Application Development Using Model-Driven Languages",0.131339031339,0.236111111111
6F0D5174,"A technique for code generation of USN applications based on nano-qplus",0.287367724868,0.36746031746
811DA5EC,"Constraint analysis for DSP code generation",0.270899470899,0.360714285714
80FE0294,"A Lightweight MDSD Process Applied in Small Projects",0.269411375661,0.527777777778
7F2EDA20,"HW/SW partitioning and code generation of embedded control applications on a reconfigurable architecture platform",0.293981481481,0.252232142857
81140E1E,"Energy efficient special instruction support in an embedded processor with compact isa",0.174603174603,0.181060606061
7E99C7C2,"C Compiler Design for an Industrial Network Processor",0.128958078958,0.133441558442
7E595B83,"IP reuse in an MDA MPSoPC co-design approach",0.106355218855,0.133333333333
7DA2CF18,"A type-based compiler for standard ML",0.0819902319902,0.0954545454545
6A723F64,"FrameKit and the prototyping of CASE environments",0.126851851852,0.145833333333
7FBFE34C,"Neural networks and dynamic complex systems",0.120442520443,0.154761904762
769F3CFD,"Timing analysis of esterel programs on general-purpose multiprocessors",0.13167989418,0.1375
80EE113A,"The Test and Training Enabling Architecture (TENA) Supporting the Decentralized Development of Distributed Applications and LVC Simulations",0.166402116402,0.212847222222
75991E92,"A framework for interprocedural optimization in the presence of dynamic class loading",0.119642857143,0.123571428571
760428C0,"A global progressive register allocator",0.0872252747253,0.1125
7D3091F2,"Serialized parallel code generation framework for MPSoC",0.247426647427,0.352380952381
79D48163,"Using logic programming and coroutining for electronic CAD",0.117522292522,0.208080808081
5F37DF07,"Unboxed values as first class citizens in a non-strict functional language",0.134722222222,0.154464285714
7E754B1E,"Separate compilation and execution of imperative synchronous modules",0.116865079365,0.117063492063
04AF2110,"Contribution of model-driven engineering to crop modeling",0.137247474747,0.160227272727
7D93DF3D,"An automatic code generation tool for partitioned software in distributed systems",0.368542568543,0.436507936508
76783851,"High-performance implementations of the Descartes method",0.110776260776,0.116883116883
7B6281C3,"Optimal Code Generation for Expression Trees",0.248342398342,0.332722832723
7E6BB7ED,"New Code Generation Algorithm for QueueCore An Embedded Processor with High ILP",0.293121693122,0.394047619048
79E4C4A3,"Optimizing Address Code Generation for Array-Intensive DSP Applications",0.285515873016,0.345238095238
7CF8AA38,"Event-driven Scheduling for Parallel Stream Processing",0.126797739298,0.14537037037
812E903E,"The impact of If-conversion and branch prediction on program execution on the Intel/sup R/ Itanium/sup TM/ processor",0.115906084656,0.118127705628
7DBB5C01,"An MCU description methodology for initialization code generation software",0.247426647427,0.28373015873
76B63FC4,"Generic control flow reconstruction from assembly code",0.256355218855,0.3375
026CDA56,"Scheduling, Compaction and Binding in a Retargetable Code Generator using Constraint Logic Programming",0.279828042328,0.253928170595
7FFADCB1,"Formal loop merging for signal transforms",0.0703197945845,0.138888888889
8082FA1E,"The Challenges of Building Advanced Mechatronic Systems",0.110984848485,0.138888888889
812111B8,"Symbolic binding for clustered VLIW ASIPs",0.0943181818182,0.125
813B353D,"Native Code Generation Using the Transterpreter",0.247426647427,0.492063492063
75DAE574,"Denali: A practical algorithm for generating optimal code",0.293121693122,0.415064102564
7774389E,"Scheduliing expression trees with register variables on delayed-load architectures",0.101725589226,0.109829059829
585D1303,"Retargetable code generation and optimization using attribute grammars",0.253571428571,0.336904761905
7F625C79,"An efficient code generation technique for tiled iteration spaces",0.25867003367,0.309126984127
7C5E9364,"Experience with a clustered parallel reduction machine",0.129298941799,0.136904761905
760E1148,"Look-ahead allocation in the presence of branches",0.0943181818182,0.109006734007
7F62F8F2,"Performance portable optimizations for loops containing communication operations",0.168981481481,0.174272486772
790AB21D,"Global optimization techniques for automatic parallelization of hybrid applications",0.258800186741,0.371527777778
5CEB56F7,"RCGES: Retargetable Code Generation for Embedded Systems",0.2632996633,0.436507936508
80D18D34,"Program Synthesis from Formal Requirements Specifications Using APTS",0.123600936101,0.16880952381
597006A2,"Finding Coarse Grained Parallelism in Computational Geometry Algorithms",0.140707671958,0.212222222222
7F8F1C1F,"A Phase-Coupled Compiler Backend for a New VLIW Processor Architecture Using Two-step Register Allocation",0.0963642838643,0.145244107744
7BAABF10,"Reducing program image size by extracting frozen code and data",0.251593314093,0.28112244898
77F6B094,"A generative geometric kernel",0.0804750804751,0.1
779FA1BC,"A retargetable technique for predicting execution time of code segments",0.267989417989,0.272156084656
6EFA342A,"Combining offline and online optimizations: register allocation and method inlining",0.110416666667,0.147222222222
795AE80B,"Compiling with code-size constraints",0.0789736407383,0.133333333333
7927B1CC,"Efficient Computation of Expressions with Common Subexpressions",0.176031144781,0.305555555556
80E27028,"Compiling for vector-thread architectures",0.0777447089947,0.138888888889
7F265C40,"Peephole optimization as a targeting and coupling tool",0.108852258852,0.136904761905
7582EC64,"Memory data organization for improved cache performance in embedded processor applications",0.151587301587,0.143367346939
7A9C5316,"Space-efficient closure representations",0.114087301587,0.133928571429
7A2D43ED,"Numerical computation of molecular integrals via optimized (vectorized) FORTRAN code",0.329034391534,0.377777777778
80DB4457,"Fast, frequency-based, integrated register allocation and instruction scheduling",0.137566137566,0.159027777778
80E31280,"Constraint analysis for code generation: basic techniques and applications in FACTS",0.292658730159,0.278117913832
7F106D44,"An efficient model for DSP code generation: performance, code size, estimated energy",0.261375661376,0.346036255411
7E09E3E2,"Memory-efficient multithreaded code generation from Simulink for heterogeneous MPSoC",0.247426647427,0.571428571429
5E69FDD6,"Code generation for embedded Java with Ptolemy",0.250673400673,0.331547619048
7787DE4A,"Optimized implementation of synchronous models on industrial LTTA systems",0.127248677249,0.136507936508
7EE6F0DF,"A Modular Compiler Architecture for a Data Manipulation Language",0.155092592593,0.152308802309
7688238E,"Certifiable program generation",0.108736171236,0.133928571429
7CC53B2C,"A code generation method for system-level synthesis on ASIC, FPGA and manycore CGRA",0.252509065009,0.341964285714
787751B5,"Simple and effective link-time optimization of Modula-3 programs",0.110505698006,0.108974358974
5EE1875E,"A functional intermediate form for diverse source languages",0.13367003367,0.153703703704
7E7D47F1,"Automatic generation of hypertext system repositories: a model driven approach",0.25731292517,0.26343537415
76221248,"Validate, simulate, and implement ARINC653 systems using the AADL",0.0915861915862,0.25
75628C4A,"Adaptive parallel tiled code generation and accelerated auto-tuning",0.10456950457,0.161706349206
7D8C0780,"Memory management for dataflow programming of multirate signal processing algorithms",0.181818181818,0.2
8086896C,"Automatic code generation and tuning for stencil kernels on modern shared memory architectures",0.366161616162,0.327425044092
7517A40F,"Improving balanced scheduling with compiler optimizations that increase instruction-level parallelism",0.103561253561,0.163383838384
7A81797E,"C++ reflection for high performance problem solving environments",0.118915343915,0.150793650794
7A7BDD5C,"Experience on knowledge-based software engineering: A logic-based requirements language and its industrial applications",0.165598290598,0.189087301587
60B228EB,"Optimizing Nested Loops Using Local CPS Conversion",0.112836700337,0.176851851852
7971105E,"Parsing and compiling using Prolog",0.0912386224886,0.214285714286
7929DFCB,"Fast, automatic, procedure-level performance tuning",0.259325396825,0.464285714286
813D804E,"A model-driven validation & verification environment for embedded systems",0.164351851852,0.163888888889
80480322,"A tool-supported approach to testing UML design models",0.116738816739,0.166666666667
76F53CA5,"Simulink ® -based heterogeneous multiprocessor SoC design flow for mixed hardware/software refinement and simulation",0.128312890813,0.15
762392A5,"A language for writing code generators",0.264351851852,0.39375
6CA3165A,"Instruction selection for ARM/Thumb processors based on a multi-objective ant algorithm",0.174603174603,0.205555555556
7E41EABF,"Extending Graham-Glanville Techniques for Optimal Code Generation",0.249278499278,0.363492063492
7D04C2E9,"Field-testing IMPACT EPIC research results in Itanium 2",0.124735449735,0.151322751323
803D6344,"A Graphical Framework for High Performance Computing Using An MDE Approach",0.115707671958,0.188571428571
7DD54458,"Efficient multiway radix search trees",0.160704110704,0.205128205128
813CE87A,"An inverse radiative transfer model of the vegetation canopy based on automatic differentiation",0.266383219955,0.292006802721
7B67D910,"Automating the selection of code templates",0.287566137566,0.390277777778
5AE33175,"Towards provably correct code generation via horn logical continuation semantics",0.165079365079,0.191774891775
8080F6B5,"Experimental Evaluation and Improvements to Linear Scan Register Allocation",0.138392857143,0.140277777778
7E008C72,"Automatic detection and diagnosis of faults in generated code for procedure calls",1.0,1.0
802B5824,"Code generation in ALPAL using symbolic techniques",0.249278499278,0.396825396825
7ED1D6B9,"Rapid architecture prototyper (RAP)",0.0856939356939,0.111111111111
7DD8789F,"Extracting compiler provenance from program binaries",0.106691919192,0.129545454545
7B77EDE9,"Efficient compilation of lazy evaluation",0.13955026455,0.141666666667
78E903FC,"Clearwater: extensible, flexible, modular code generation",0.247426647427,0.571428571429
806BF39F,"MobCon: A Generative Middleware Framework for Java Mobile Applications",0.138762626263,0.135227272727
7740D3C3,"Mapping UML designs to Java",0.113961038961,0.183333333333
7C718351,"VikiBuilder: end-user specification and generation of visual wikis",0.10456950457,0.142857142857
812AAA5E,"A portable-approach to dynamic optimization in run-time specialization",0.104437229437,0.133928571429
7A338EC6,"Trade-offs in loop transformations",0.130092592593,0.140211640212
7947FF2D,"A practical automatic polyhedral parallelizer and locality optimizer",0.204611459969,0.541666666667
7C9CAA94,"A systematic approach to advanced debugging through incremental compilation (Preliminary Draft)",0.115796703297,0.130952380952
7F7155B5,"Avoidance and suppression of compensation code in a trace scheduling compiler",0.28663003663,0.257034632035
5D197475,"A Flexible Tradeoff Between Code Size and WCET Using a Dual Instruction Set Processor",0.271626984127,0.310714285714
5BEE07E6,"Convergent Compilation Applied to Loop Unrolling",0.0626390322211,0.205555555556
7B449F08,"Recovery of jump table case statements from binary code",0.273478835979,0.320555555556
7B3C7E9D,"An effective and efficient code generation algorithm for uniform loops on non-orthogonal DSP architecture",0.299735449735,0.339682539683
7F552086,"Engineering a simple, efficient code-generator generator",0.125535113035,0.1625
7BD6FAA4,"DCG: an efficient, retargetable dynamic code generation system",0.2632996633,0.436507936508
7F3B8154,"Skewed pipelining for parallel simulink simulations",0.113961038961,0.2
789B7F98,"Code-generation technique for large-language compilers",0.0952279202279,0.10101010101
77B00869,"Incremental dynamic semantics for language-based programming environments",0.122757335257,0.138636363636
7601E901,"Optimizations for quadrature representations of finite element tensors through automated code generation",0.273214285714,0.256452922078
77058BE4,"Recipes for adjoint code construction",0.270899470899,0.455555555556
7F55B7B7,"CSX: an extended compression format for spmv on shared memory systems",0.128577441077,0.142361111111
7772FA0C,"Compilation reuse and hybrid compilation: an experiment",0.0960937210937,0.103174603175
77AE0B42,"Retargetable generation of code selectors from HDL processor models",0.250673400673,0.254232804233
78ED0B30,"Link-time compaction and optimization of ARM executables",0.0977904040404,0.104344729345
811038BB,"Developing Tools with Fujaba XProM",0.0830357142857,0.196428571429
80556CDA,"Generating fast code from concurrent program dependence graphs",0.251593314093,0.343571428571
7607E728,"On the Sethi-Ullman algorithm",0.136183261183,0.333333333333
7CBA93F4,"Optimizing the performance of streaming numerical kernels on the IBM Blue Gene/P PowerPC 450 processor",0.117989417989,0.141904761905
7F35A4D2,"ADAPT: Automated De-coupled Adaptive Program Transformation",0.115906084656,0.172619047619
76B2869B,"Resource Management in Dataflow-Based Multithreaded Execution",0.125,0.138888888889
7C214373,"Scan detection and parallelization in "inherently sequential" nested loop programs",0.255892255892,0.359027777778
7D7EAEF1,"Vmgen: a generator of efficient virtual machine interpreters",0.0830357142857,0.117063492063
7A431168,"Adjoint code generator",0.256355218855,0.5625
7AD01FC8,"Towards an operation model for generated web applications",0.146296296296,0.17
81069B3F,"Evaluation of code generation strategies for scalar replaced codes in fine-grain configurable architectures",0.292328042328,0.388662131519
7D736A6D,"Integrating a new cluster assignment and scheduling algorithm into an experimental retargetable code generation framework",0.293121693122,0.283482142857
