Paper ID,Title,Sim1,Sim2
7EC5F87C,"Impact of subsequent screening episodes on the positive predictive value for advanced neoplasia and on the distribution of anatomic subsites of colorectal cancer: A population-based study on behalf of the French colorectal cancer screening program",0.164583333333,0.111490429505
815DFAD9,"A GenLOT-based progressive image coder for low resolution images",0.123232323232,0.0991161616162
80E8B45C,"Improved algorithm for efficient computation of the forward and backward MDCT in MPEG audio coder",0.366666666667,0.256235827664
76C96C5B,"Prevalence and risk of colorectal neoplasms in asymptomatic, average-risk screenees 40 to 49 years of age",0.123232323232,0.0919191919192
7D8D1E83,"Directional Discrete Cosine Transforms for Image Coding",0.158333333333,0.122895622896
813C84C7,"Experimental results for slow-speed testing",0.119230769231,0.0954545454545
7B298622,"Removable visible image watermarking algorithm in the discrete cosine transform domain",0.358441558442,0.323232323232
75B5D3A7,"Endoscopic and surgical treatment of malignant colorectal polyps: a population-based comparative study",0.144155844156,0.101488095238
8074067B,"Edge detection and filtering of images corrupted by nonstationary noise using robust statistics",0.149206349206,0.124140938427
78636C50,"Aberrant crypt foci in patients with neoplastic and nonneoplastic colonic disease",0.114685314685,0.0806493506494
79A61A48,"Analysis of Mutations in DNA Isolated From Plasma and Stool of Colorectal Cancer Patients",0.144155844156,0.0854874802485
7E960DB7,"A novel 2-D DCT realization using low-cost residue/quotient technique",0.116666666667,0.130303030303
7D02B6A3,"A jointly optimal fractal/DCT compression scheme",0.350505050505,0.545454545455
7FCBF510,"An efficient unified systolic architecture for the computation of discrete trigonometric transforms",0.179166666667,0.160714285714
7CD3808A,"Watermarking of uncompressed and compressed video",0.108946608947,0.126984126984
7ED1DABD,"Modelling and using imperfect context information",0.135227272727,0.131755050505
7B321D1A,"A novel rate predictor based on quantized DCT indices and its rate control mechanism",0.123232323232,0.110483960484
7F7D27B2,"Comparative performance of fast cosine transform with fixed-point roundoff error analysis",0.363492063492,0.344155844156
80658C55,"Prepartum Monensin for the Reduction of Energy Associated Disease in Postpartum Dairy Cows",0.127886002886,0.0946700642353
7D1C3A3C,"A New Hybrid DCT-Wiener-Based Interpolation Scheme for Video Intra Frame Up-Sampling",0.123232323232,0.0949494949495
79017A65,"Efficient discrete cosine transform and quantization algorithm based on eliminating redundant computations in H.264 video encoding",0.366666666667,0.256105699856
7910774A,"Monensin for Lactating Dairy Cows Grazing Mixed-Alfalfa Pasture and Supplemented with Partial Mixed Ration",0.111188811189,0.0918652086354
7E6F5D19,"Efficient transform domain transcoding: intra frame of H.264/AVC to JPEG",0.111188811189,0.0787878787879
7E08C49C,"Color Image Enhancement Based on Sparse Representation",0.13125,0.132222222222
7FB4DDB4,"On the security of image encryption schemes based on Multiple Parameters Transforms",0.144155844156,0.119853294853
7AD308E2,"The Stool DNA Test Is More Accurate Than the Plasma Septin 9 Test in Detecting Colorectal Neoplasia",0.306547619048,0.206003891941
7DB8FA89,"Applying Discrete Cosine Transform and Grey Relational Analysis to Surface Defect Detection of LEDs",0.144155844156,0.122574484339
7D512A3A,"Fast Algorithm for Modulated Complex Lapped Transform",0.358441558442,0.339691558442
7E17E5A1,"High Prevalence of Sessile Serrated Adenomas With BRAF Mutations: A Prospective Study of Patients Undergoing Colonoscopy",0.133333333333,0.110592185592
050F40CA,"An improved method for face recognition based on SVM in frequency domain",0.123232323232,0.111642061642
16577DCD,"Disparities in prevalence, location, and shape characteristics of colorectal neoplasia between South Korean and U.S. patients",0.116666666667,0.0926406926407
650E0ACE,"Object Localization Using Color, Texture and Shape",0.147916666667,0.133333333333
77ECCAD3,"Multiple-watermarking scheme for still images using the discrete cosine transform and modified code division multiple-access techniques",0.123232323232,0.120189879565
7DF610AB,"Efficient Deblocking With Coefficient Regularization, Shape-Adaptive Filtering, and Quantization Constraint",0.121338383838,0.0981481481481
7C9D6BD7,"Local and equatorial characterization of unit balls of subspaces of Lp, p>0 and properties of the generalized cosine transform",0.123232323232,0.0910353535354
79B86612,"L/M-fold image resizing in block-DCT domain using symmetric convolution",0.123232323232,0.125404040404
7FC113F6,"SEAMLESS P2P-MDVC with well-balanced descriptions",0.116666666667,0.1
808CDED9,"Architecture-oriented regular algorithms for discrete sine and cosine transforms",0.358441558442,0.393939393939
8155DC0E,"Outage behavior of bidirectional half-duplex relaying schemes",0.177777777778,0.134006734007
76C12F69,"APC and Oncogenic KRAS Are Synergistic in Enhancing Wnt Signaling in Intestinal Tumor Formation and Progression",0.123232323232,0.10908878703
7F1F2B6E,"Optical techniques for image compression",0.350505050505,0.403703703704
7E3EDA30,"Statistical distributions of DCT coefficients and their application to an interframe compression algorithm for 3-D medical images",0.591666666667,0.4132996633
7D6C67D4,"An error concealment algorithm for images subject to channel errors",0.563492063492,0.495696763554
76FCE5A9,"Aminosalicylate Therapy in the Prevention of Dysplasia and Colorectal Cancer in Ulcerative Colitis",0.163492063492,0.108835412953
7D3C3AFB,"A method of estimating coding PSNR using quantized DCT coefficients",0.123232323232,0.130404040404
7D9E7D92,"Karhunen-Loeve transform-based fast algorithms for image restoration",0.331168831169,0.329861111111
7CBB7C31,"Demosaicing of images obtained from single-chip imaging sensors in YUV color space",0.122916666667,0.116534391534
810E438A,"A high-performance full-motion video compression chip set",0.350505050505,0.326388888889
7E64B26C,"PHLPP Is a Negative Regulator of RAF1, Which Reduces Colorectal Cancer Cell Motility and Prevents Tumor Progression in Mice",0.116666666667,0.0953023713473
80475B25,"A detection algorithm for zero-quantized DCT coefficients in JPEG",0.331168831169,0.39696969697
78DE60A1,"High colonoscopic prevalence of proximal colon serrated polyps in average-risk men and women.",0.116666666667,0.0857533670034
7C2520CB,"Steganalysis of DCT-embedding based adaptive steganography and YASS",0.158333333333,0.183333333333
7EC4927F,"An Analog 2-D DCT Processor",0.0839160839161,0.0871212121212
7D951468,"No-Reference Metric Design With Machine Learning for Local Video Compression Artifact Level",0.371428571429,0.24677386106
7F9FC2D5,"A new hardware-efficient algorithm and architecture for computation of 2-D DCTs on a linear array",0.366666666667,0.358134920635
774F58B7,"Meshed capillary vessels found on narrow-band imaging without optical magnification effectively identifies colorectal neoplasia: a North American validation of the Japanese experience",0.147916666667,0.127072310406
7DE26CC4,"Variable temporal-length 3-D discrete cosine transform coding",0.158333333333,0.128787878788
75B69319,"Simultaneous compression and encryption of color video images",0.371428571429,0.293015873016
7D10419F,"Improving the performance of 2D Discrete Wavelet Transform using data-level parallelism",0.144742063492,0.145086580087
7F92CC8C,"Implementation of the discrete cosine transform and its inverse by digital filtering",0.138492063492,0.114959114959
7E55DFC6,"Compression artifact reduction based on total variation regularization method for MPEG-2",0.363492063492,0.263553906411
7E6280F6,"A low cost algorithm for fast inverse motion compensation in the MPEG-2 standard",0.358441558442,0.276911976912
7852F7B5,"Feature extraction using discrete cosine transform and discrimination power analysis with a face recognition technology",0.155158730159,0.120405150405
7E9F636C,"On fast algorithms for computing the inverse modified discrete cosine transform",0.358441558442,0.302308802309
7C67873F,"The effect of lossy discrete cosine transform compression on subtle bone fractures",0.350505050505,0.263982683983
7C8B3FE0,"No-reference image quality assessment based on DCT domain statistics",0.13125,0.117323879824
7FD200CF,"Personal recognition using hand shape and texture",0.116666666667,0.112467532468
7BFA0C49,"A Combined DWT and DCT Watermarking Scheme Optimized Using Genetic Algorithm",0.358441558442,0.353977272727
8068BB9B,"A Perturbation Method for Decoding LDPC Concatenated with CRC",0.10101010101,0.101388888889
6C895742,"Generalized Gaussian density for skin detection in DCT domai",0.116666666667,0.10873015873
5C9FB936,"Security Evaluation of Generalized Patchwork Algorithm from Cryptanalytic Viewpoint",0.377777777778,0.300404040404
7D3FE579,"Issues and solution on distortion drift in reversible video data hiding",0.191666666667,0.125175221604
75CAF448,"Biochemical markers in oncology. Part I: Molecular basis. Part II: Clinical uses",0.177777777778,0.113194444444
09C566BD,"Vision-based classification of solder joint defects",0.133333333333,0.108333333333
7F1A203B,"A Fast Computational Algorithm for the Discrete Sine Transform",0.358441558442,0.545454545455
755AD116,"Lapped Orthogonal Transform Coding by Amplitude and Group Partitioning",0.161111111111,0.127142857143
7A065B48,"A novel DCT domain CRT-based watermarking scheme for image authentication surviving JPEG compression",0.350505050505,0.263973063973
80F24934,"Rate and Distortion Modeling of CGS Coded Scalable Video Content",0.147916666667,0.114177489177
80AC090D,"B2B contract implementation using Windows DNS",0.138492063492,0.124404761905
7CFF68AB,"A Novel Approach for Face Recognition Using DCT Coefficients Re-scaling for Illumination Normalization",0.150694444444,0.121486846487
75872507,"DCT based simple classification scheme for fractal image compression",0.383333333333,0.313737373737
7FEA9A90,"Cross-Layer Iterative Decoding of Irregular LDPC Codes using Cyclic Redundancy Check Codes",0.144155844156,0.121236171236
7D00FACF,"American Gastroenterological Association Technical Review on the Diagnosis and Management of Lynch Syndrome",0.150694444444,0.116753246753
7F6B9F87,"Combined source-channel coding for the transmission of still images over a code division multiple access (CDMA) channel",0.158333333333,0.132879273504
7FF46D65,"A low bit rate hybrid coding scheme based on new classes of block overlap transforms",0.123232323232,0.116571969697
80CC5D90,"Fast Discrete Cosine Transform via Computation of Moments",0.179166666667,0.150673400673
7F419C27,"Topoisomerase-1 and -2A gene copy numbers are elevated in mismatch repair-proficient colorectal cancers",0.123232323232,0.108970254769
7FE01CB7,"Classification of Line and Character Pixels on Raster Maps Using Discrete Cosine Transformation Coefficients and Support Vector Machine",0.2,0.118448218448
81056A9B,"Flip CRC Modification for Message Length Detection",0.129166666667,0.120555555556
80BE2202,"System architecture of an adaptive reconfigurable DSP computing engine",0.102564102564,0.0884271978022
7C1C0517,"Advanced imaging in colonoscopy and its impact on quality",0.149206349206,0.119742063492
815A4010,"Image compression with adaptive local cosines: a comparative study",0.3625,0.27968975469
7660CD3D,"Block-adaptive DCT-Wiener image up-sampling",0.0959595959596,0.111111111111
7B4FA89F,"A new integer image coding technique based on orthogonal polynomials",0.123232323232,0.122685185185
80110858,"DCT-domain coder for digital video applications",0.158333333333,0.12037037037
7E714675,"Progression of flat low-grade dysplasia to advanced neoplasia in patients with ulcerative colitis",0.111188811189,0.0863636363636
5A509ABF,"Hardware Implementation Aspects of New Low Complexity Image Coding Algorithm for Wireless Capsule Endoscopy",0.360714285714,0.190376984127
801E4503,"Fixed-point round-off error analysis for the discrete cosine transform",0.363492063492,0.411255411255
805DF0B5,"Image coding with windowed modulated filter banks",0.104482323232,0.108134920635
7DFFD2C1,"Surveillance of long-standing colitis: The role of image-enhanced endoscopy",0.113386613387,0.120941558442
815FFE2A,"Image enhancement using a contrast measure in the compressed domain",0.128977272727,0.124873737374
806EE22D,"Parallel-pipeline 8×8 forward 2-D ICT processor chip for image coding",0.158333333333,0.111111111111
786758B3,"An illumination angle classification method in the face recognition based on the similarity of light estimated images",0.158333333333,0.111950334277
80C35378,"Highly efficient, limited range multipliers for LUT-based FPGA architectures",0.116666666667,0.0874458874459
7D2C0394,"On the use of color appearance modeling for efficient compressed-domain image enhancement",0.177777777778,0.128703703704
7D126292,"Robust Video Data Hiding Using Forbidden Zone Data Hiding and Selective Embedding",0.177777777778,0.144322344322
7F6ED0AA,"Spatiotemporal Visual Considerations for Video Coding",0.158333333333,0.125925925926
7C11A0FB,"Pathological reassessment of hyperplastic colon polyps in a city-wide pathology practice: implications for polyp surveillance recommendations",0.177777777778,0.0952681577682
77E8F1CA,"High-Efficiency Green Function-Based Thermal Simulation Algorithms",0.358441558442,0.571428571429
7D42A18C,"A fast encoding algorithm for fractal image compression using the DCT inner product",0.585714285714,0.421815221815
7F0B3D6F,"Dual watermarking method for secure image authentication and recovery",0.136219336219,0.113997113997
74594E53,"A SVD Based Scheme For Post Processing of DCT Coded Images",0.123232323232,0.117323879824
7A178E74,"Discrete cosine transform filtering",0.111188811189,0.0909090909091
7F42E484,"FPGA Implementation of an ASIP for high throughput DFT/DCT 1D/2D engine",0.138492063492,0.0906746031746
7EE0F4E9,"A research on improving the performance of OFDMA system by using DCT / IFFT structure",0.149206349206,0.13543956044
7F91462A,"On using game theory to optimize the rate control in video coding",0.177777777778,0.138099747475
773885C5,"Local Cosine Transform — A Method for the Reduction of the Blocking Effect in JPEG",0.136219336219,0.112157287157
8175D7E7,"Multiframe resolution-enhancement methods for compressed video",0.123232323232,0.111111111111
7699548F,"Bit reduction of DCT basis for transform coding",0.136111111111,0.130158730159
7FA7E8FE,"Gesture recognition based on 3D accelerometer for cell phones interaction",0.163492063492,0.120895176252
7AF2FDCC,"Association Between Early Stage Colon Neoplasms and False-negative Results From the Fecal Immunochemical Test",0.116666666667,0.0828331390831
7E6FA2FD,"Automatic generation of fast discrete signal transforms",0.13125,0.118055555556
79F945C7,"Undersampled Boundary Pre-/Postfilters for Low Bit-Rate DCT-Based Block Coders",0.106547619048,0.0833333333333
8118133E,"Watermarking MPEG-4 2D mesh animation with time-series analysis",0.119155844156,0.121428571429
5E7D7801,"Two-Dimensional Fast Orthogonal Neural Network for Image Recognition",0.123232323232,0.104377104377
7EB45324,"An Effective Postprocessing Method for Lowbit Rate Block DCT Coded Images",0.123232323232,0.108333333333
77550396,"Prevention, Early Detection, and Overdiagnosis of Colorectal Cancer Within 10 Years of Screening Colonoscopy in Germany",0.163492063492,0.109457267756
7EA45493,"A one chip VLSI for real time two-dimensional discrete cosine transform",0.149206349206,0.1056998557
7DD03F22,"An Efficient Matrix-Based DCT Splitter/Merger for MPEG-2-to-AVC/H.264 Transform Kernel Conversion",0.147916666667,0.121794871795
7FE2F8B4,"Transform coding of signals using approximate trigonometric expansions",0.158333333333,0.154166666667
7CFA492C,"Bit-4 of frequency domain-DCT steganography technique",0.133333333333,0.122222222222
64818568,"Discrete Cosine Transfom",0.111188811189,0.0909090909091
7B6644F3,"Long-term risk of cancer in ulcerative colitis: A population-based cohort study from Copenhagen County",0.133333333333,0.0844474153298
76129C41,"Unsupervised segmentation of OSF by fusion of RGA and DCT with contextual information",0.149206349206,0.112433862434
7901ACDA,"Exploiting image indexing techniques in DCT domain",0.114898989899,0.111919191919
7CE619A3,"History matching with an ensemble Kalman filter and discrete cosine parameterization",0.116666666667,0.107251082251
76D04F48,"A fast recursive algorithm for computing the discrete cosine transform",0.358441558442,0.411255411255
7F225B39,"A new convolutional formulation of discrete cosine transform for systolic implementation",0.138492063492,0.103563103563
755CD8A0,"Insulin, Glucose, Insulin Resistance, and Incident Colorectal Cancer in Male Smokers",0.163492063492,0.0903807676917
7D2E28F6,"A 100-MHz 2-D discrete cosine transform core processor",0.116666666667,0.0914141414141
7F4C16EA,"Reduction of blocking effects in image coding with a lapped orthogonal transform",0.158333333333,0.127308802309
7E3B3195,"On the discrete cosine transform computation",0.179166666667,0.170454545455
7F349DE1,"Spatio-temporal scalability based on motion-compensated DCT temporal filters",0.116666666667,0.12380952381
7B4E2211,"TGF-beta signalling in colon carcinogenesis",0.0612599206349,0.0625
760072A6,"Fast DCT-based algorithms for signal convolution and translation",0.358441558442,0.394444444444
76EF9A91,"S-transform based on analytic discrete cosine transform for time–frequency analysis",0.144155844156,0.144588744589
806D9BCA,"Resolution enhancement of low quality videos using a high-resolution frame",0.13125,0.119781144781
7AF9665D,"Systolic Architecture for Implementation of 2-D Discrete Sine Transform",0.138492063492,0.101731601732
80FD89F7,"A Secure Semi-Fragile JPEG Image Authentication Scheme Based on Discrete Cosine Transform",0.123232323232,0.116767676768
7ED58097,"A power efficient implementation of the discrete cosine transform",0.138492063492,0.114959114959
8087B6EF,"Entropy Coding for a Hybrid Scheme with Motion Compensation in Subprimary Rate Video Transmission",0.147916666667,0.110917207792
775BF572,"Color information security system using discrete cosine transform in gyrator transform domain radial-Hilbert phase encoding",0.123232323232,0.11151317818
77EF60E6,"Performance improvements of imaging-based screening tests.",0.132936507937,0.124389499389
841A1691,"Enhancing digital image integrity by exploiting JPEG bitstream attributes",0.123232323232,0.12
7FCDF47D,"A DCT-Based Speech Enhancement System With Pitch Synchronous Analysis",0.163492063492,0.128956043956
7B3E7630,"Speaker recognition utilizing distributed DCT-II based Mel frequency cepstral coefficients and fuzzy vector quantization",0.121338383838,0.121782538449
76D922F5,"Downsampling versus folding in the DCT domain",0.0889665889666,0.0909090909091
7F830CB2,"A DSP for DCT-based and wavelet-based video codecs for consumer applications",0.136111111111,0.12037037037
76F6FDC4,"All-optical symmetric cosine and sine transforms using multimode interference structures",0.111188811189,0.107316017316
7DEA2495,"Low-Complexity Inverse Transforms of Video Codecs in an Embedded Programmable Platform",0.123232323232,0.0978835978836
80FC312C,"A multichip module design for portable video compression systems",0.371428571429,0.336195054945
80812A58,"A Video Coding Scheme Based on Joint Spatiotemporal and Adaptive Prediction",0.123232323232,0.123585858586
796DD057,"The impact of hyoscine-N-butylbromide on adenoma detection during colonoscopy: meta-analysis of randomized, controlled studies",0.152678571429,0.133994708995
7FEDD8AB,"New joint demosaicing and arbitrary-ratio resizing algorithm for color filter array based on DCT approach",0.358441558442,0.241553287982
7BA3F48C,"Patient preferences of a resect and discard paradigm",0.116666666667,0.0939393939394
7D09F950,"Simultaneous storage of medical images in the spatial and frequency domain: A comparative study",0.135227272727,0.103908128908
7D7C4CB0,"Efficient coding and mapping algorithms for software-only real-time video coding at low bit rates",0.366666666667,0.241544566545
7F7D2483,"Adaptive Modulation for OFDM-Based Multiple Description Progressive Image Transmission",0.147916666667,0.115277777778
7D82A214,"Computing running DCTs and DSTs based on their second-order shift properties",0.128282828283,0.141587301587
775E9F19,"Theoretical Complex Cepstrum of DCT and Warped DCT Filters",0.0991071428571,0.0982142857143
7E8BD133,"Performance comparison of full 2-D DCT, 2-D Walsh and 1-D transform over row mean and column mean for iris recognition",0.144742063492,0.103986291486
7F009C6A,"Transform coding algorithms for seismic data compression",0.585714285714,0.559027777778
7E041A3E,"Palmprint recognition by fusion of multi-color components",0.121933621934,0.108225108225
76FB3E9A,"Machine learning based adaptive watermark decoding in view of anticipated attack",0.158333333333,0.133219954649
7D4940E7,"Efficacy of a Nationwide Screening Colonoscopy Program for Colorectal Cancer",0.128282828283,0.0966131907308
7E06CF55,"DCT convolution and its application in compressed domain",0.158333333333,0.119191919192
7DC2BF13,"Low-delay, low-complexity rate reduction and continuous presence for multipoint videoconferencing",0.136219336219,0.117989417989
81660CEE,"A Compression Approach of Power Quality Monitoring Data Based on Two-dimension DCT",0.3625,0.254761904762
75655994,"Findings in the Distal Colorectum Are Not Associated With Proximal Advanced Serrated Lesions",0.123232323232,0.132063492063
7DC93325,"Combined VQ-DCT coding of images using interblock noiseless coding",0.158333333333,0.153888888889
80FD1C24,"Efficient Thermal Aware Placement Approach Integrated with 3D DCT Placement Algorithm",0.358441558442,0.294444444444
7C6D5746,"Fast large-scale image enlargement method with a novel evaluation approach: benchmark function-based peak signal-to-noise ratio",0.163492063492,0.122916666667
7F2F6AE8,"An edge-oriented progressive image coding",0.158333333333,0.138888888889
77CCE018,"Real-time clothing recognition in surveillance videos",0.135227272727,0.100985819736
8124AA26,"Narratological Constructs in the Gestalt of the 3D Game environment: Aboriginal Knowledge and its Connection to the Data Landscape Metaphor",0.18125,0.118981481481
7BC527BB,"Adherence to recommended intervals for surveillance colonoscopy in average-risk patients with 1 to 2 small (<1 cm) polyps on screening colonoscopy",0.146428571429,0.110238095238
75358CDD,"Colorectal neoplasia detection among black and Latino individuals undergoing screening colonoscopy: a prospective cohort study",0.133333333333,0.118424036281
7FBB8BC8,"CpG Island Methylator Phenotype Is Associated With Response to Adjuvant Irinotecan-Based Therapy for Stage III Colon Cancer",0.126388888889,0.108149303492
7F2B40CA,"A Novel Representation of Palm-Print for Recognition",0.13125,0.107954545455
806FBFCC,"The efficient memory-based VLSI array designs for DFT and DCT",0.144155844156,0.126984126984
7D2206CE,"Manipulation and compositing of MC-DCT compressed video",0.133630952381,0.140211640212
7D405BF7,"Mechanical Derivation of Fused Multiply–Add Algorithms for Linear Transforms",0.358441558442,0.538461538462
7D463073,"The design and implementation of DCT/IDCT chip with novel architecture",0.146428571429,0.110119047619
75637365,"Type-II/III DCT/DST algorithms with reduced number of arithmetic operations",0.369444444444,0.419191919192
795FB7EE,"Facies recognition using a smoothing process through Fast Independent Component Analysis and Discrete Cosine Transform",0.211111111111,0.171601731602
7F6CBA0A,"Artificial neural network for discrete cosine transform and image compression",0.350505050505,0.328282828283
7E3F326A,"Parallel Zigzag Scanning and Huffman Coding for a GPU-based MPEG-2 Encoder",0.116666666667,0.105303030303
7B96CA47,"The decimation-in-frequency algorithms for a family of discrete sine and cosine transforms",0.358441558442,0.318181818182
806058FF,"Biased reconstruction for JPEG decoding",0.121933621934,0.112433862434
8102CEAA,"Hardware Architecture for Protocol Processing",0.0979166666667,0.0834415584416
7A969D87,"Face recognition using entropy based feature enhancement and Parallel Dual Pose testing",0.127083333333,0.124167499167
80FFB575,"Hardware testing for error tolerant multimedia compression based on linear transforms",0.585714285714,0.430158730159
80BD2EE4,"Adaptive Local Cosine transform for Seismic Image Compression",0.350505050505,0.400673400673
7DA0CCA4,"VLSI implementation of a configurable IP Core for quantized discrete cosine and integer transforms",0.138492063492,0.104935064935
7D56A34B,"Constrained SOVA decoding in concatenated codes",0.121933621934,0.114959114959
815363DD,"Compression of QRS complexes using Hermite expansion",0.35625,0.353977272727
8008637B,"Improving the performance of machine learning based face recognition algorithm with Multiple Weighted Facial Attribute Sets",0.14126984127,0.119000752334
7B444020,"Suppression of electromyogram interference on the electrocardiogram by transform domain denoising.",0.0916666666667,0.0864177489177
7D41DD60,"A new post-viterbi processor based on soft-reliability information",0.123232323232,0.131481481481
7E90C658,"Rate Bounds on SSIM Index of Quantized Image DCT Coefficients",0.10101010101,0.0986790986791
7D96CF06,"Efficient Channel Estimation for MIMO Single-Carrier Block Transmission With Dual Cyclic Timeslot Structure",0.147916666667,0.116666666667
77E6F18C,"Spectroscopic Microvascular Blood Detection From the Endoscopically Normal Colonic Mucosa: Biomarker for Neoplasia Risk",0.116666666667,0.0848484848485
78F79FAB,"Unified feature analysis in JPEG and JPEG 2000-compressed domains",0.144155844156,0.108225108225
