Paper ID,Title,Sim1,Sim2
779E1290,"Adaptive Image Digital Watermarking with DCT and FCM",0.123232323232,0.111111111111
7E02D333,"Unbalanced Multiple-Description Video Coding with Rate-Distortion Optimization",0.128977272727,0.12037037037
7B5FFC8F,"On computing Chebyshev optimal nonuniform interpolation",0.123232323232,0.126984126984
7FFD9BE1,"An affine Invariant hyperspectral texture descriptor based upon heavy-tailed distributions and fourier analysis",0.144155844156,0.1203000703
7D3AA311,"A method for protecting digital images from being copied illegally",0.123232323232,0.135238095238
5EC098C8,"Real-Time Color Image Watermarking Based on D-SVD Scheme",0.123232323232,0.125505050505
802342C8,"Combining Level Set and orthogonal transforms for speckle reduction and detail preservation in SAR images",0.158333333333,0.139455782313
7CF38A1A,"A complete pipelined parallel CORDIC architecture for motion estimation",0.123232323232,0.0886243386243
7EF163AB,"Transcoding of MPEG-2 video in the frequency domain",0.10101010101,0.100673400673
7EBA0CB4,"On accelerating the computation of 2-D Discrete Cosine Transform in image processing",0.179166666667,0.132626262626
7F640FAD,"Error masking probability of 1's complement checksums",0.349206349206,0.287137862138
80B5D1B8,"MPEG-2 standard system: A new blind watermarking approach using spread spectrum method",0.135227272727,0.119322344322
8043C9BC,"Double Bits Error Correction Using CRC Method",0.128977272727,0.134027777778
805E2670,"Digital Watetmarking Algorithm Using Two Dimensions Modulated Complex Lapped Transform",0.358441558442,0.313571428571
80DB81A8,"Robust video hashing using the 3D-DWT",0.123232323232,0.140740740741
59072DAA,"Speech enhancement using warped discrete cosine transform",0.163492063492,0.148181818182
5D285E4B,"On Perceptual Encryption: Variants of DCT Block Scrambling Scheme for JPEG Compressed Images",0.157142857143,0.12579880437
7A4D6D70,"A high throughput-rate architecture for 8*8 2D DCT",0.0991071428571,0.0714285714286
80EEA706,"Novel DCT-Based Real-Valued Discrete Gabor Transform and Its Fast Algorithms",0.358441558442,0.400641025641
7A6D7FA4,"A Comparative Study of Image Compression Algorithms",0.585714285714,0.559027777778
58D6ABC9,"Image compression and gamma correction using DCT",0.35625,0.302606837607
7FBD00BE,"Efficient asynchronous bundled-data pipelines for DCT matrix-vector multiplication",0.127083333333,0.0982142857143
7B8DA1D6,"Development of Colorectal Tumors in Colonoscopic Surveillance in Lynch Syndrome",0.133333333333,0.1
7E06237F,"Endoscopic trimodal imaging detects colonic neoplasia as well as standard video endoscopy.",0.135227272727,0.111111111111
797A1D9A,"Design of image-adaptive quantization tables for JPEG",0.119155844156,0.117989417989
812FECF5,"Transform Kernel Selection Strategy for the H.264/AVC and Future Video Coding Standards",0.169444444444,0.12612017612
802E818C,"Integer lapped transforms and their applications to image coding",0.144047619048,0.129126984127
7FBA4A7D,"Utilization and Yield of Surveillance Colonoscopy in the Continued Follow-Up Study of the Polyp Prevention Trial",0.169444444444,0.14012345679
7C0DF4A1,"New Systolic Algorithm and Array Architecture for Prime-Length Discrete Sine Transform",0.358441558442,0.318362193362
7CEC31E2,"Study on the algorithm of the Fractional Cosine Transform based on adaptive LMS algorithm",0.358441558442,0.298566433566
80D38B01,"Transform methods for seismic data compression",0.350505050505,0.407407407407
7D8EB59A,"Hamming Coding of DCT-Compressed Images Over Noisy Channels",0.158333333333,0.138888888889
7F519C55,"Feature extraction and discriminating feature selection for 3D face recognition",0.144742063492,0.109365634366
7D65C2B4,"Reconfigurable discrete cosine transform processor for object-based video signal processing",0.13125,0.0998106060606
7DC0885B,"A 200 MHz 13 mm/sup 2/ 2-D DCT macrocell using sense-amplifying pipeline flip-flop scheme",0.127083333333,0.128977272727
7CFA4056,"A scaled DCT architecture with the CORDIC algorithm",0.358441558442,0.535714285714
7B42F66F,"Diagnosis and management of dysplasia in patients with inflammatory bowel diseases",0.150694444444,0.103174603175
7DFF41D3,"Design architecture of generic DFT/DCT 1D and 2D engine controlled by SW instructions",0.144155844156,0.102949134199
81679AD6,"Efficient, low-complexity image coding with a set-partitioning embedded block coder",0.123232323232,0.100694444444
8069FC21,"Galois field computation LSI: a reconfigurable chip for high-speed communication",0.20625,0.16369047619
8179A37C,"Hemorrhoids detected at colonoscopy: an infrequent cause of false-positive fecal immunochemical test results",0.340277777778,0.249142061642
7DBF8D1F,"On the Detection of Multiplicative Watermarks for Speech Signals in the Wavelet and DCT Domains",0.166964285714,0.120707070707
7F8B9BFD,"DCT Coefficient Prediction for JPEG Image Coding",0.104482323232,0.104482323232
789F5106,"Object-based texture coding of moving video in MPEG-4",0.158333333333,0.144444444444
79488923,"Analysis of pruning in fast cosine transform",0.144155844156,0.114959114959
7A1904AD,"Recursive algorithm, architectures and FPGA implementation of the two-dimensional discrete cosine transform",0.360714285714,0.326298701299
7ED7B1F1,"Secure semi-blind watermarking based on iteration mapping and image features",0.123232323232,0.122626262626
81606F83,"Phoneme recognition using spectral envelope and modulation frequency features",0.116666666667,0.103927025356
80E65D8A,"High-speed parallel CRC circuits",0.111188811189,0.0787878787879
7DB79EB4,"Wyner–Ziv Video Coding With Classified Correlation Noise Estimation and Key Frame Coding Mode Selection",0.171428571429,0.119576719577
7F877EB8,"DCT/DST and Gauss-Markov fields: conditions for equivalence",0.0916666666667,0.0849206349206
7D617C47,"Low Bit Rate Video Coding Using DCT-Based Fast Decimation/Interpolation and Embedded Zerotree Coding",0.123232323232,0.128174603175
7CF0F46F,"Illumination compensation method for local matching Gabor face classifier",0.123232323232,0.0971393685679
7C188BC9,"Features of Adenoma and Colonoscopy Associated With Recurrent Colorectal Neoplasia Based on a Large Community-Based Study",0.133333333333,0.119406247347
7D2CA668,"A New Fractal Watermarking Scheme Based on Image Normalization",0.150694444444,0.142171717172
7B6EB92B,"Error Analysis and Efficient Realization of the Multiplier-Less FFT-Like Transformation (ML-FFT) and Related Sinusoidal Transformations",0.385714285714,0.300072150072
7FAEFB63,"Illumination Watermarking Technique Using Orthogonal Transforms",0.116666666667,0.133333333333
5D484B10,"Forward error correction in passive UHF Gen2 communications",0.363492063492,0.408333333333
7B0DBBE2,"A UNIVERSAL ALGORITHM FOR PARALLEL CRC COMPUTATION AND ITS IMPLEMENTATION",0.366666666667,0.464285714286
808DCD61,"A fast approximate algorithm for scaling down digital images in the DCT domain",0.358441558442,0.336219336219
788DA68A,"Fast decimation-in-time algorithms for a family of discrete sine and cosine transforms",0.358441558442,0.318181818182
5E597846,"A Parallel Architecture for Motion Estimation and DCT Computation in MPEG-2 Encoder",0.179166666667,0.128968253968
5876645C,"Fingerprint enhancement based on discrete cosine transform",0.127083333333,0.128977272727
7A7E9D21,"Rubik's cube watermark technology for grayscale images",0.119155844156,0.105158730159
7E6A40F6,"Discrete cosine transform domain restoration of defocused images",0.123232323232,0.0940656565657
7F038F30,"Structurally Orthogonal Finite Precision Implementation of the Eight Point DCT",0.138492063492,0.1056998557
78ED28C7,"Thermal aware placement in 3D ICs using quadratic uniformity modeling approach",0.135227272727,0.123005698006
7A523D46,"FPGA implementation of a novel DCT architecture reducing constant cosine terms",0.138492063492,0.10961038961
7874AFDB,"Discrete and continuous cosine transform generalized to Lie groups SU(2)×SU(2) and O(5)",0.14126984127,0.135822510823
7F5B10B0,"Reduced-complexity shape-adaptive DCT for region-based image coding",0.131060606061,0.138888888889
7EC7392A,"Rapid Development of Colorectal Neoplasia in Patients With Lynch Syndrome",0.127083333333,0.09375
7FA005E7,"Fast Radix- $q$ and Mixed-Radix Algorithms for Type-IV DCT",0.358441558442,1.0
7917F8A7,"Discrete Cosine Transform",0.111188811189,0.0909090909091
7A88040C,"Risk of Colorectal Cancer for Carriers of Mutations in MUTYH , With and Without a Family History of Cancer",0.116666666667,0.0799602358426
79F462B9,"The XYZ Algorithm For Real-Time Compression of Full-Motion Video",0.585714285714,0.703703703704
8043DEC5,"Dynamic context management for coarse-grained reconfigurable array DSP architecture",0.150694444444,0.116402116402
7CDADCA0,"Extensive but hemiallelic methylation of the hMLH1 promoter region in early-onset sporadic colon cancers with microsatellite instability.",0.116666666667,0.0767322383499
7CD1E36A,"2-D DCT systolic array implementation",0.138492063492,0.126984126984
5A33C8AB,"Radial Basis Function Network for Traffic Scene Classification in Single Image Mode",0.158333333333,0.113782051282
7798BF6A,"Prediction-based watermarking schemes using ahead/post AC prediction",0.111188811189,0.118181818182
7F81BB45,"Gender Differences in Fecal Immunochemical Test Performance for Early Detection of Colorectal Neoplasia",0.14126984127,0.100855625856
81074325,"Hidden digital watermarks in images",0.123232323232,0.0972222222222
7F278AA3,"Digital watermarking-based DCT and JPEG model",0.111188811189,0.0909090909091
7C4FB5F8,"Evaluation of a risk index for advanced proximal neoplasia of the colon.",0.163492063492,0.10553030303
7BF89C19,"The Management of Small Polyps Found by Virtual Colonoscopy: Results of a Decision Analysis",0.155158730159,0.130220573078
5D624D78,"A FPGA-based Library for On-Line Signal Processing",0.13125,0.0972222222222
8020C321,"SDTV Quality Assessment Using Energy Distribution of DCT Coefficients",0.13125,0.117323879824
7866640D,"Fast construction of Fejér and Clenshaw-Curtis rules for general weight functions",0.144155844156,0.113492063492
7FFE9FB3,"Optimized multichannel filter bank with flat frequency response for texture segmentation",0.116666666667,0.0958333333333
80C910F3,"Cosine Transform Generalized to Lie Groups SU(2)XSU(2) AND O(5): Application to Textural Image Processing",0.152777777778,0.131581117295
7A0C246E,"Application of a conversion factor to estimate the adenoma detection rate from the polyp detection rate",0.15625,0.123958333333
812A500E,"DCT-based processing of dynamic features for robust speech recognition",0.163492063492,0.120454545455
77325897,"Predictive and Protective Factors Associated With Colorectal Cancer in Ulcerative Colitis: A Case-Control Study",0.140277777778,0.11050207962
808DC177,"Analysis of IMDCT fast algorithms",0.327672327672,0.422619047619
5F3325E3,"Fast PCA and LDA for JPEG Images",0.123232323232,0.111111111111
804E324D,"Quadrature Doppler Ultrasound Signal Denoising Based on Matching Pursuits with Different Time-Frequency Dictionaries",0.144155844156,0.130322601375
7B0A3A93,"Subsite-specific colorectal cancer risk in the colorectal endoscopy era",0.133333333333,0.0936831550802
8140859D,"Optimal Coding of Vectorcardiographic Sequences Using Spatial Prediction",0.158333333333,0.137121212121
7F90CCAE,"The JPEG still picture compression standard",0.350505050505,0.555555555556
7F81E955,"Novel architecture for two-dimensional high throughput rate real-time discrete cosine transform and the VLSI design",0.144155844156,0.0965945165945
80025162,"Multiplication-free approximate algorithms for compressed-domain linear operations on images",0.369444444444,0.425925925926
7F4A2785,"Semi-fragile Watermarking Technique for Image Tamper Localization",0.120643939394,0.111111111111
7E56317C,"Joint Optimization of the Frequency-Domain and Time-Domain Transformations in Deriving Generalized Static and Dynamic MFCCs",0.163492063492,0.152678571429
7D238C74,"Advanced H.264/AVC-Based Perceptual Video Coding: Architecture, Tools, and Assessment",0.158333333333,0.104126984127
7D53A3E6,"Detection and correction of transmission errors in DPCM images",0.336219336219,0.300555555556
8119B5ED,"Enhancing Poisson's Equation-Based Approach for DCT Prediction",0.111111111111,0.109006734007
7CF8BD52,"Multiple constraint bit allocation for foveated visual coding",0.158333333333,0.110227272727
7660C49A,"Methodology for behavioral synthesis-based algorithm-level design space exploration: DCT case study",0.169047619048,0.122741147741
7DA647B6,"A 0.9-V, 150-MHz, 10-mW, 4 mm/sup 2/, 2-D discrete cosine transform core processor with variable threshold-voltage (VT) scheme",0.116666666667,0.0855303030303
7E52E3C6,"A 3D DCT architecture for compression of integral 3D images",0.350505050505,0.39417989418
78CB48CE,"Quantifying the benefit of screening colonoscopy",0.110500610501,0.113972832723
7B390B01,"Transform-domain and DSP based secure speech communication system",0.185416666667,0.181730769231
80FAF6CE,"The New Extended JPEGg Coder With Variable Quantizer Using Block Wavelet Transform",0.1375,0.122916666667
5EC53E06,"A Low Power 8 × 8 Direct 2-D DCT Chip Design",0.144155844156,0.112433862434
84A128EA,"Automatic speaker recognition dynamic feature identification and classification using distributed discrete cosine transform based mel frequency cepstral coefficients and fuzzy vector quantization",0.158333333333,0.123938027784
79172CF3,"Performance Comparison of Two Phase Face Recognition Algorithms based in Frequency Domain",0.363492063492,0.214066489066
77D77F7C,"Effect of colonoscopy on colorectal cancer incidence and mortality: an instrumental variable analysis",0.144155844156,0.0963238830886
7EA5D233,"Performance evaluation of DWT, DCT, and WHT for compression of ultrasonic signals",0.385714285714,0.366964285714
7DD9549D,"Scattering of elastic waves in heterogeneous media using the direct solution method",0.149206349206,0.1203000703
705F545F,"Five decade evolution of feedback shift register: algorithms, architectures and applications",0.350694444444,0.215431096681
7A62A2FA,"Integral representations and integral transforms of some families of Mathieu type series",0.13125,0.0998106060606
79153B4B,"Edge-based motion compensated classified DCT with quadtree for image sequence coding",0.123232323232,0.109848484848
7D7E8698,"BTC-VQ-DCT hybrid coding of digital images",0.158333333333,0.138888888889
7A9AEB50,"Robust and Fragile Watermarking Scheme Based on DCT and Hash Function for Color Satellite Images",0.123232323232,0.107998350855
7DE954FB,"A Unified Architecture for H.264 Multiple Block-Size DCT with Fast and Low Cost Quantization",0.119735819736,0.0911495911496
787D1F4E,"Colonoscopy Is Associated With a Reduced Risk for Colon Cancer and Mortality in Patients With Inflammatory Bowel Diseases",0.124786324786,0.103853759135
8162FD2F,"A new parallel algorithm for CRC generation",0.358441558442,0.555555555556
7A46DF88,"Statistical motion learning for improved transform domain Wyner-Ziv video coding",0.158333333333,0.13595959596
7DC12A58,"A new activity model for scene adaptive quantization",0.20625,0.132235819736
81403762,"Image Indexing and Retrieval in Compressed Domain Using Color Clusters",0.144155844156,0.116615130901
75E25045,"Improved DCT-based method for online detection of oscillations in univariate time series",0.149206349206,0.118590668591
7E2DBA1F,"A low-complexity parametric transform for image compression",0.350505050505,0.555555555556
75DF9CD7,"Comparative analysis of a twin-class M -QAM transmission system for wireless video applications",0.158333333333,0.124592999593
7CBBA66A,"Efficacy of Intramammary Tilmicosin and Risk Factors for Cure of Staphylococcus aureus Infection in the Dry Period",0.128282828283,0.0881014410426
79BA8E16,"The Molen compiler for reconfigurable processors",0.077380952381,0.0801282051282
761B234C,"Risk of Cancer in Cases of Suspected Lynch Syndrome Without Germline Mutation",0.164583333333,0.0953311394488
811ACDFE,"A Reconfigurable Multi-Transform VLSI Architecture Supporting Video Codec Design",0.144155844156,0.131349206349
5F5D20F5,"A Novel Algorithm for Segmentation of Lung Images",0.358441558442,0.315277777778
77F50821,"Large-scale wave-front reconstruction for adaptive optics systems by use of a recursive filtering algorithm",0.377777777778,0.287435897436
79AFE154,"Image watermark detection techniques using quadtrees",0.123232323232,0.118888888889
7733375C,"Prevalence of adenomas and advanced adenomas in patients in the 40- to 49-year age group undergoing screening colonoscopy because of a family history of adenoma/polyp in a first-degree relative",0.14126984127,0.104783479048
80C9391F,"Enhancing the Error Detection Capabilities of DCT Based Codecs using Compressed Domain Dissimilarity Metrics",0.363492063492,0.21218004218
7A60AC93,"Two-dimensional DCT/IDCT architecture",0.0991071428571,0.0714285714286
7E51CCEF,"Pattern recognition in compressed DCT domain",0.111188811189,0.0909090909091
77A1CAFE,"Clinical Subtypes and Molecular Characteristics of Serrated Polyposis Syndrome",0.111188811189,0.0871212121212
77EF4BD8,"Integer sinusoidal transforms for image processing",0.104482323232,0.103703703704
44BDBF0D,"Uptake of Colon Capsule Endoscopy vs Colonoscopy for Screening Relatives of Patients With Colorectal Cancer",0.133333333333,0.0912629445718
80F00883,"Screening and Surveillance for the Early Detection of Colorectal Cancer and Adenomatous Polyps, 2008: A Joint Guideline From the American Cancer Society, the US Multi-Society Task Force on Colorectal Cancer, and the American College of Radiology",0.158333333333,0.0930979151567
0124B7C5,"Memory-efficient and high-performance 2-D DCT and IDCT processors based on CORDIC rotation",0.136219336219,0.142063492063
7F0A9124,"A tutorial overview on the properties of the discrete cosine transform for encoded image and video processing",0.123232323232,0.102525252525
788159BF,"Risk factors for colorectal neoplasia in persons aged 30 to 39 years and 40 to 49 years",0.128282828283,0.0953102453102
7EC6EDB7,"Multiframe error concealment for MPEG-coded video delivery over error-prone networks",0.34126984127,0.287626262626
7669646B,"A proposed hardware reference model for spatial transformation and quantization in H.264",0.163492063492,0.114892977393
7FAC18EC,"Entropy classification and discrete-cosine-transform-based image indexing system",0.133333333333,0.119511599512
7E82293B,"Efficient channel code rate selection algorithms for forward error correction of packetized multimedia bitstreams in varying channels",0.377777777778,0.249691358025
7D611549,"An efficient joint implementation of three stages for fast computation of color space conversation in image coding/decoding",0.179166666667,0.132709750567
7FCDDD3D,"A comparative study of signal restoration techniques for the reduction of random noise",0.152678571429,0.11880952381
76673282,"Perceptually tuned subband coder for JPEG",0.106547619048,0.113095238095
76643D10,"A Computing Method for Linear Convolution and Linear Correlation in the DCT Domain",0.123232323232,0.100808080808
7CB5FFD9,"An Immunoconjugate of Anti-CD24 and Pseudomonas Exotoxin Selectively Kills Human Colorectal Tumors in Mice",0.102564102564,0.0990553306343
7E22537C,"CRC-assisted error correction in a trellis coded system with bit stuffing",0.344742063492,0.230631868132
57F79647,"A video watermarking technique based on pseudo 3D DCT and quantization index modulation",0.123232323232,0.109699031128
7F8514A7,"A new orthogonal transform for signal coding",0.158333333333,0.166666666667
5B144CD3,"Digital Image Steganography Based on Combination of DCT and DWT",0.158333333333,0.147222222222
7FFE4EFD,"On face detection in the compressed domain",0.116666666667,0.0892773892774
7D4BC228,"A Bayesian approach for the estimation and transmission of regularization parameters for reducing blocking artifacts",0.147916666667,0.114637445887
7CBF6A9E,"The DCT-based oscillation detection method for a single time series",0.149206349206,0.108975468975
7F79A51C,"Risk for Coronary Heart Disease Increases Risk for Colorectal Neoplasm",0.123232323232,0.0869889369889
7C6CA560,"“Am I your sibling?” Inferring kinship cues from facial image pairs",0.13125,0.110079365079
7D94E713,"Low power design of two-dimensional DCT",0.144155844156,0.126984126984
7617862C,"DC coefficient restoration by cosine and sine transforms",0.0839160839161,0.0890151515152
7E7F62C5,"A Novel ICA-Based Extraction Scheme for Image Watermarking",0.123232323232,0.0976430976431
8137D921,"Partial Budget of the Discounted Annual Benefit of Mastitis Control Strategies1",0.116666666667,0.093951048951
7F17A0EE,"Cryptanalysis of Chu's DCT based watermarking scheme",0.111188811189,0.127272727273
7832DF65,"Sliding transforms for efficient implementation of transform domain adaptive filters",0.138492063492,0.112012987013
8153EBB5,"Image Restoration Based on Bi-Regularization and Split Bregman Iterations",0.123232323232,0.121111111111
7D23D7E0,"A DCT Approximation for Image Compression",0.323232323232,0.398148148148
8023AC5C,"Automating the modeling and optimization of the performance of signal transforms",0.14126984127,0.129464285714
7ECD6FA1,"Parallel 3-dimensional DCT computation on k-ary n-cubes",0.179166666667,0.25
6D0F7255,"On Computing the Discrete Cosine Transform",0.111188811189,0.116883116883
7B1F21E5,"Inter-Conversion Matrix for Transcoding Block DCT and DWT-Based Compressed Images",0.123232323232,0.0981481481481
79489BE6,"Text-independent speaker identification using Radon and discrete cosine transforms based features from speech spectrogram",0.163492063492,0.131442631443
80A0FFD6,"High-throughput VLSI architectures for the 1-D and 2-D discrete cosine transforms",0.111188811189,0.0811688311688
80BD7A23,"A video rate 16*16 discrete cosine transform IC",0.123232323232,0.0975135975136
814099A2,"Analysis of the DCT coefficient distributions for document coding",0.133333333333,0.122308802309
79EEB461,"Pigment-producing granulomatous myopathy in Atlantic salmon: A novel inflammatory response",0.106547619048,0.0691311612364
4507A50C,"Therapeutic targeting of inflammation and tryptophan metabolism in colon and gastrointestinal cancer",0.116666666667,0.0780581550802
7635C031,"A programmable 800 Mbit/s CRC check/generator unit for LANs and MANs",0.10101010101,0.0856481481481
80313458,"Adaptive DCT coding of video signals",0.158333333333,0.134259259259
78DBE3B5,"PLX: An Instruction Set Architecture and Testbed for Multimedia Information Processing",0.114898989899,0.112063492063
813F3D9E,"A method for updating a cyclic redundancy code",0.123232323232,0.113997113997
7F023928,"Recovery of corrupted DCT coded images based on reference information",0.136219336219,0.130164742665
7888D49D,"Robust copyright protection scheme for digital images using overlapping DCT and SVD",0.177777777778,0.136321548822
7EE805F6,"Pulse discrete cosine transform for saliency-based visual attention",0.123232323232,0.10101010101
80EBD440,"A Fast Algorithm for Reconstructing Motion-Compensated Blocks in Compressed Domain",0.358441558442,0.321338383838
80BBC93D,"Exploiting the JPEG compression scheme for image retrieval",0.342171717172,0.288023088023
7E291568,"DCT Based Texture Classification Using Soft Computing Approach",0.158333333333,0.155753968254
79D17D8D,"A DCT-based ownership identification method with gray-level and colorful signatures",0.147916666667,0.123421717172
7FD3E7A7,"React Scatterplot Smoothers: Superefficiency through Basis Economy",0.10101010101,0.0949074074074
7F7D5ED8,"A Study on Spatial and Transform Domain Watermarking Techniques",0.133333333333,0.105303030303
7D83EFE7,"Automatically linking multimedia meeting documents by image matching",0.147916666667,0.128888888889
81648E5D,"Fast scene change detection using direct feature extraction from MPEG compressed videos",0.185416666667,0.130424513758
80CCA4D2,"A fast down-sampling method for arbitrary-ratio spatial scalability based on type-II DCT",0.123232323232,0.137037037037
7DFF685B,"Recompression of JPEG images by requantization",0.0959595959596,0.111111111111
7F59E984,"Embedded image coding algorithm based on all phase biorthogonal transform and SPIHT",0.358441558442,0.276851851852
7EA2C03D,"Performance enhancement of PCA-based face recognition system via gender classification method",0.133838383838,0.110162407037
7F11E126,"Optical computing techniques for image/video compression",0.350505050505,0.414285714286
7E0BE56F,"Hierarchical HDTV/SDTV compatible coding using Kalman statistical filtering",0.2,0.1625
8055714D,"New low complexity DCT based video compression method",0.350505050505,0.355555555556
5957A2B1,"Face Recognition Using the Discrete Cosine Transform",0.111188811189,0.114685314685
816BC1D4,"A general construction of constrained parity-check codes for optical recording",0.144155844156,0.113997113997
7C2FF05D,"Random noise suppression based on discrete cosine transform",0.149206349206,0.129274891775
7A7D2D89,"Digital Watermarking Trends",0.0991071428571,0.0714285714286
80200DD3,"Scalable variable complexity approximate forward DCT",0.123232323232,0.118055555556
7FE935EC,"Embedded reconfigurable DCT architectures using adder-based distributed arithmetic",0.0991071428571,0.134821428571
8161D4E4,"Data Hiding in H.264/AVC Streams with Limited Intra-Frame Distortion Drift",0.191666666667,0.128023088023
7823100D,"Handwritten digit recognition based on DCT features and SVM classifier",0.111188811189,0.10993006993
7F2BF648,"Implementation and trade-offs of a DCT architecture using high-level synthesis",0.150694444444,0.132857142857
7BC363B2,"Perceptual-based DWPT-DCT framework for selective blind audio watermarking",0.123232323232,0.104377104377
75D815FF,"Sessile Serrated Adenomas: An Evidence-Based Guide to Management",0.128472222222,0.100816993464
