Paper ID,Title,Sim1,Sim2
5F41905C,"Performance and Computational Complexity Comparison of Block-Based Fingerprint Enhancement",0.144742063492,0.120793650794
7E2396A2,"Optimal Bit Allocation for Joint Texture-Aware Contour-Based Shape Coding and Shape-Adaptive Texture Coding",0.158333333333,0.113762626263
80A8BFCD,"Pseudo Random Number Based authentication to counter denial of service attacks on 802.11",0.169444444444,0.138947510823
7E0C8C58,"Low-power multiplierless DCT architecture using image correlation",0.123232323232,0.123412698413
765FCAF4,"Determinants of adherence to screening by colonoscopy in individuals with a family history of colorectal cancer",0.146428571429,0.104976498175
809ABD03,"Covariance analysis of motion-compensated frame differences",0.121933621934,0.100992063492
7E1E2A71,"Hierarchical DCT coding of HDTV for ATM networks",0.158333333333,0.106877599525
75C86B94,"An EDBoost algorithm towards robust face recognition in JPEG compressed domain",0.358441558442,0.28031968032
7D49B8E1,"Effect of a Monensin Controlled Release Capsule on Metabolic Parameters in Transition Dairy Cows",0.136219336219,0.0962627046866
77426832,"Technological form defects identification using discrete cosine transform method",0.147916666667,0.126599326599
76A716F2,"A post-processor for reducing temporal busyness in low-bit-rate video applications",0.158333333333,0.130158730159
77D9CD38,"Compressed History Matching: Exploiting Transform-Domain Sparsity for Regularization of Nonlinear Dynamic Data Integration Problems",0.166964285714,0.120801420801
7F627B04,"Hybrid image upsampling method in the discrete cosine transform domain",0.123232323232,0.10101010101
8094275A,"Semi-fragile Image Authentication Using Robust Image Hashing with Localization",0.147916666667,0.131818181818
755071D7,"Improvement of the Discrete Cosine Transform calculation by means of a recursive method",0.204166666667,0.163737373737
7FA5E533,"Techniques for early stopping and error detection in turbo decoding",0.363492063492,0.281071428571
7875E913,"Authentication and recovery of an image by sharing and lattice-embedding",0.113997113997,0.113997113997
5DA3084F,"Development of integer cosine transforms by the principle of dyadic symmetry",0.127083333333,0.103181818182
7EBA35CE,"Simultaneously Inpainting in Image and Transformed Domains",0.123232323232,0.122895622896
7CC331A3,"Shared hardware, high throughput implementation of 2D 4×4 and 8×8 integer transform for H.264/AVC high-profile coders",0.138492063492,0.0958994708995
7EEBB6AE,"Combined DWT-DCT Digital Image Watermarking",0.123232323232,0.138888888889
75366101,"Guidelines on Genetic Evaluation and Management of Lynch Syndrome: A Consensus Statement by the US Multi-Society Task Force on Colorectal Cancer",0.169444444444,0.116861424705
81781466,"A computation-distortion optimized framework for efficient DCT-based video coding",0.158333333333,0.122895622896
800BAA62,"Fast algorithms for the discrete cosine transform",0.358441558442,0.545454545455
7D7E0483,"Optimizing Adequacy of Bowel Cleansing for Colonoscopy: Recommendations From the US Multi-Society Task Force on Colorectal Cancer",0.158333333333,0.102884352394
7D73096C,"Adaptive cosine transform coding of images in perceptual domain",0.158333333333,0.114898989899
8098379A,"Multimedia Courseware Copyright Notification and Protection Based on DCT",0.177777777778,0.183333333333
7E0D4299,"Comments on "Discrete Cosine Transform"",0.116666666667,0.0954545454545
5E16EA97,"A fast video copy detection approach by dynamic programming",0.144155844156,0.11246031746
7F385CB0,"A Fast Arbitrary Factor Video Resizing Algorithm",0.363492063492,0.336805555556
80839439,"Concurrent error detection in fast unitary transform algorithms",0.577777777778,0.7
7A242EFF,"New fast algorithm for multidimensional type-IV DCT",0.358441558442,1.0
7EFC7B63,"DCT algorithms for VLSI parallel implementations",0.360714285714,0.571428571429
8091CF52,"Three-dimensional DCT/WT compression using motion vector segmentation for low bit-rate video coding",0.383333333333,0.250793650794
7B1900CE,"New equalisation approach for maximising data rate in discrete multi tone systems",0.185416666667,0.131000348857
814301D1,"Optimized quadtree for Karhunen-Loeve transform in multispectral image coding",0.139583333333,0.134259259259
7FD86923,"The GenLOT: generalized linear-phase lapped orthogonal transform",0.2,0.142857142857
7F71C50C,"A Model to Determine Colorectal Cancer Risk Using Common Genetic Susceptibility Loci",0.116666666667,0.11601004038
785681BB,"No-reference analysis of decoded MPEG images for PSNR estimation and post-processing",0.116883116883,0.112103174603
76F91B24,"Content-based video transcoding in compressed domain",0.123232323232,0.10101010101
7E3A5229,"DCT-Based Gabor Transform for Long or Infinite Sequences",0.111188811189,0.0839160839161
7F334F22,"A Novel Synchronization Invariant Audio Watermarking Scheme Based on DWT and DCT",0.123232323232,0.119292929293
7CBA1C9B,"A publicly verifiable lossless watermarking scheme for copyright protection and ownership assertion",0.177777777778,0.119545454545
8114BE80,"The application of subspace preconditioned LSQR algorithm for solving the electrocardiography inverse problem",0.358333333333,0.248665223665
80810C30,"Fast computation of the discrete cosine transform and the discrete Hartley transform",0.179166666667,0.137445887446
7B30FE30,"SNAIL Regulates Interleukin-8 Expression, Stem Cell–Like Activity, and Tumorigenicity of Human Colorectal Carcinoma Cells",0.20625,0.109258855057
80889B13,"Using DCT Features for Printing Technique and Copy Detection",0.116666666667,0.112373737374
80B22AF4,"A scrambling method for Motion JPEG videos enabling moving objects detection from scrambled videos",0.123232323232,0.134722222222
7D6AD8E2,"Semi-fragile watermarking algorithm for image tampers localization and recovery",0.350108225108,0.29746031746
8031909A,"Transform image coding with global thresholding: application to baseline JPEG",0.158333333333,0.134259259259
7D0E6999,"Design and Implementation of a Field Programmable CRC Circuit Architecture",0.117261904762,0.0990476190476
7ED7A54F,"Reduced-Reference Image Quality Assessment Using Reorganized DCT-Based Image Representation",0.13125,0.128174603175
793705AE,"Sampling rate conversion based on DFT and DCT",0.147916666667,0.161111111111
7D93AFCF,"An Efficient FFT Processor for DAB Receiver Using Circuit-Sharing Pipeline Design",0.163492063492,0.135615079365
7F5E7F1A,"Comparison of DVB-H Link Layer FEC Decoding Strategies in a Mobile Fading Channel",0.158630952381,0.115538033395
7C584F1A,"Colonoscopy utilization and outcomes 2000 to 2011",0.150505050505,0.155555555556
800A9B11,"Channel estimation iterative algorithm for OFDM systems based on windowed fourth Discrete Cosine Transform",0.366666666667,0.269638694639
7D72C810,"An algorithm for calculation of the discrete cosine transform by paired transform",0.366666666667,0.44696969697
7E47A0DE,"Pipelined Cyclic Redundancy Check (CRC) Calculation",0.179166666667,0.137445887446
7CEF5F13,"A fragile watermark error detection scheme for wireless video communications",0.363492063492,0.221121933622
80D15121,"VLSI architectures for field programmable gate arrays: a case study",0.142361111111,0.101355820106
7624A6F0,"Low power field programmable gate array implementation of fast digital signal processing algorithms: characterisation and manipulation of data locality",0.366666666667,0.191056670602
789DF65C,"Rate-distortion optimization of the image compression algorithm based on the warped discrete cosine transform",0.585714285714,0.42117003367
7FA11F65,"Transform-domain adaptive filters: an analytical approach",0.133333333333,0.0982142857143
7FE82525,"MicroRNA-124 inhibits cancer cell growth through PTB1/PKM1/PKM2 feedback cascade in colorectal cancer",0.111188811189,0.0776886512181
7E688CC1,"A Two-Stage Rate Control Mechanism for RDO-Based H.264/AVC Encoders",0.10101010101,0.0981481481481
6847C5CC,"Risk of Neoplasia After Colectomy in Patients With Inflammatory Bowel Disease: A Systematic Review and Meta-analysis",0.111188811189,0.0818903318903
7FA4E568,"Features for robust face-based identity verification",0.123232323232,0.100673400673
755A11AE,"Minimization of Error in Pitch Detection algorithm using Discrete Fractional Cosine Transform",0.363492063492,0.269318181818
7E2E8338,"Robust detection of DCT-domain watermarks using alpha-stable models",0.116666666667,0.118560606061
80514B8C,"Extrapolation for compressed coefficient's band-pass delay time characteristics by using genetic-algorithm on the DCT",0.149206349206,0.118001443001
7E6FD3E0,"A DCT-based adaptive compression algorithm customized for radar imagery",0.585714285714,0.465833333333
7A39F667,"An improved algorithm for face recognition using wavelet and facial parameters",0.366964285714,0.262694250194
784BB3B1,"MYH mutations in patients with attenuated and classic polyposis and with young-onset colorectal cancer without polyps",0.106547619048,0.0714366515837
814DA50D,"Mutation Spectrum and Risk of Colorectal Cancer in African American Families with Lynch Syndrome",0.116666666667,0.0834830202477
80E705EB,"HW/SW Codesign of the H. 263 Video Coder",0.10101010101,0.0972222222222
7FA41638,"Image compression based on the neural network art",0.350505050505,0.299829059829
7C221F2E,"Macrophage migration inhibitory factor promotes intestinal tumorigenesis.",0.14126984127,0.121825396825
7E04D19C,"Symmetric realization of DCT for multi-dimensional data compression",0.350505050505,0.400673400673
81521389,"Recognizing facial images using Gabor Wavelets, DCT-Neural Network, Hybrid Spatial Feature Interdependence Matrix",0.1375,0.12178030303
7DFC4E5D,"Postprocessing of images by filtering the unmasked coding noise",0.150297619048,0.136408730159
75B6539F,"Stat3 Is a Negative Regulator of Intestinal Tumor Progression in ApcMin Mice",0.111188811189,0.0945414673046
7F411E8F,"Hidden messages in heavy-tails: DCT-domain watermark detection using alpha-stable models",0.13125,0.119848484848
7F20C8C7,"Crossover codeword algorithm for iteration control",0.339691558442,0.322727272727
58DD0226,"Image Coding and Compression with Sparse 3D Discrete Cosine Transform",0.383333333333,0.342171717172
7041B311,"Wireless image transmission using multiple-description based concatenated codes",0.147916666667,0.15
802F9913,"Hybrid transform coding scheme for medical image application",0.158333333333,0.123421717172
5B20BCD5,"Proposing self mutation of hybrid wavelet transform with Cosine-Kekre, Cosine-Sine & Cosine-Walsh for image compression",0.35625,0.287606837607
7E948553,"A current-mode ADC with adaptive quantization",0.119735819736,0.111111111111
7B97B8D9,"Immune Response Against Frameshift-Induced Neopeptides in HNPCC Patients and Healthy HNPCC Mutation Carriers",0.106547619048,0.0817307692308
79C52E24,"Intraepithelial Effector (CD3+)/Regulatory (FoxP3+) T-Cell Ratio Predicts a Clinical Outcome of Human Colon Carcinoma",0.149206349206,0.095674001924
76DE4296,"Population-based family-history-specific risks for colorectal cancer: a constellation approach",0.133333333333,0.0936831550802
7AFED2C0,"Simulation scheme of dusk scene using piece-wise multiple regression based on time-series color-block images",0.144155844156,0.123558386058
7C210BA2,"DCT and DWT-based image watermarking by using subsampling",0.123232323232,0.155555555556
7BF7C2FC,"Adverse events requiring hospitalization within 30 days after outpatient screening and nonscreening colonoscopies.",0.195833333333,0.143855218855
75882E40,"Colonoscopic findings in first-degree relatives of patients with colorectal cancer: a population-based screening program",0.123232323232,0.0943998811646
7D3F5580,"Design and cryptanalysis of transform-based analog speech scramblers",0.136219336219,0.12031968032
7884B314,"Connective tissue growth factor inhibits metastasis and acts as an independent prognostic marker in colorectal cancer.",0.128282828283,0.101355466429
812530AD,"Multiframe blocking-artifact reduction for transform-coded video",0.113997113997,0.126984126984
7B76E75E,"Comparative Survey of the DCT and the Wavelet Transforms for Image Compression",0.3625,0.340277777778
7E19344D,"A new algorithm to compute the DCT and its inverse",0.358441558442,0.417989417989
70EE301B,"CMOS VLSI implementation of the 2D-DCT with linear processor arrays",0.138492063492,0.112433862434
80B841BD,"A Cauchy-density-based rate controller for H.264/AVC in low-delay environments",0.10101010101,0.0960113960114
7F7A017E,"Biorthogonal and nonuniform lapped transforms for transform coding with reduced blocking and ringing artifacts",0.169047619048,0.13088023088
7EF09892,"Content-based image retrieval for Alzheimer's disease detection",0.0959595959596,0.0884920634921
7DB7EA6B,"Pitch Estimation Based on a Harmonic Sinusoidal Autocorrelation Model and a Time-Domain Matching Scheme",0.116666666667,0.11303030303
7F93E7A3,"Associative processors for video coding applications",0.158333333333,0.131944444444
7F51A342,"Modeling of 3-D DCT coefficients for fast video encoding",0.123232323232,0.107052669553
77C78E92,"Radiographic staging practices of newly diagnosed colorectal cancer vary according to medical specialty",0.177777777778,0.135200746965
7ECA3E1E,"Encoding and Progressive Transmission of Still Pictures in NTSC Composite Format Using Transform Domain Methods",0.147916666667,0.126138940425
78E5A938,"Rectal bleeding and diminutive colon polyps",0.0991071428571,0.0668650793651
7D35A104,"Multiplierless Approximation of Fast DCT Algorithms",0.358441558442,0.541666666667
7FCA07D3,"A two-level pipelined systolic array chip for computing the discrete cosine transform",0.123232323232,0.107052669553
80268540,"Investigation into programmability for layer 2 protocol frame delineation architectures",0.0861888111888,0.0810966810967
7F2B6CFF,"Efficient rate allocation for progressive image transmission via unequal error protection over finite-state Markov channels",0.377777777778,0.240423465423
7E20427A,"Efficient hardware implementation of an image compressor for wireless capsule endoscopy applications",0.158333333333,0.101686507937
7F4A98A7,"Novel no-reference image blur metric based on block-based discrete cosine transform statistics",0.123232323232,0.118010878011
7FC8622C,"Real-time parallel and fully pipelined two-dimensional DCT lattice structures with application to HDTV systems",0.158333333333,0.105788655789
7EEA8C32,"Dual domain method for single image dehazing and enhancing",0.123232323232,0.106060606061
7C1B12E7,"Projected National Impact of Colorectal Cancer Screening on Clinical and Economic Outcomes and Health Services Demand",0.157142857143,0.115835084034
7DF5FB0F,"A re-investigation of scalar quantization for mobile speech transmission",0.163492063492,0.159259259259
8175CF8E,"Applying Statistics Ogive to Semi-Fragile Authentication of JPEG Images for Communication System",0.185416666667,0.134311059311
7F4F4F87,"Abstract-An efficient single-pass adaptive bandwidth compression , 11. COSINE TRANSFORM REPRESENTATION technique using the discrete cosine transform is described. The coding The two-dimensional discrete cosine transform of a se-",0.35625,0.199968213605
80AB85D6,"Reduction of blocking artifacts in image and video coding",0.139583333333,0.124609187109
7AF43C5C,"Design, analysis and experimental evaluation of block based transformation in MFCC computation for speaker recognition",0.2125,0.154097754098
7C6E7DCD,"Mutant KRAS promotes hyperplasia and alters differentiation in the colon epithelium but does not expand the presumptive stem cell pool.",0.116666666667,0.103221916972
2D057E55,"Behavioural modelling of dynamic frequency scaling with prediction of the integrated circuit temperature",0.135227272727,0.108792001649
796D8987,"A fast cosine transform in one and two dimensions",0.116666666667,0.0954545454545
7A4F4C8C,"Zero-quantised discrete cosine transform prediction technique for video encoding",0.144155844156,0.107157287157
7D25C6A1,"Best wavelet packet bases in a rate-distortion sense",0.1375,0.0996121933622
799018EE,"Comparison of volumes of convex bodies in real, complex, and quaternionic spaces",0.1375,0.114583333333
7D8A3784,"Optical flow approximation based motion object extraction for MPEG-2 video stream",0.1375,0.116053391053
7EE3E148,"Image Watermarking based on Genetic Algorithm",0.358441558442,0.437037037037
7F41FFF9,"A Modified Split-Radix FFT With Fewer Arithmetic Operations",0.150694444444,0.166666666667
78C4087F,"Domain Specific Reconfigurable Processing Core Architecture for Digital Filtering Applications",0.158333333333,0.105800865801
7A83D942,"Risk of Intestinal Cancer in Inflammatory Bowel Disease: A Population-Based Study From Olmsted County, Minnesota",0.133333333333,0.0804890137873
7CFFB75B,"Adaptive Block-size Transform based Just-Noticeable Difference model for images/videos",0.123232323232,0.134006734007
7AF5C619,"A new formulation for the Karhunen-Loeve expansion",0.127083333333,0.100961538462
78C148B8,"Drift analysis and drift reduction for multiresolution hybrid video coding",0.144155844156,0.11078042328
7CC13817,"A new rate control scheme for H.263 video transmission",0.147916666667,0.11595959596
7CD5DCC6,"Microsatellite Instability in Colorectal Cancer",0.116666666667,0.0794117647059
7D630B46,"A real-time and parametric parallel video compression architecture using FPGA",0.350505050505,0.29468975469
7ADF7562,"High-Performance Architecture of 4×4/8×8 DCT and Quantization Circuit for Unified Video CODEC",0.123232323232,0.0900793650794
7D583D93,"Diagnostic Yield Improves With Collection of 2 Samples in Fecal Immunochemical Test Screening Without Affecting Attendance",0.166964285714,0.13218482906
808D0AB2,"DCT-Based Channel Estimation Method for MIMO-OFDM Systems",0.120643939394,0.109508547009
7CE7EB6C,"Parametrized and reusable VLSI macro cells for the low-power realization of 2-D discrete-cosine-transform",0.111188811189,0.0837218337218
78DA4D46,"Robust and reversible digital image watermarking technique based on RDWT-DCT-SVD",0.123232323232,0.137037037037
80D62FDF,"Join Size Estimation Over Data Streams Using Cosine Series",0.123232323232,0.109532828283
7B55BC8E,"Unified array architecture for discrete cosine transform, sine transform and their inverses",0.123232323232,0.09613997114
8096085E,"Optimal block-overlapping synthesis transforms for coding images and video at very low bitrates",0.123232323232,0.107638888889
0548000D,"Adaptive Deblocking of Images with DCT Compression",0.350505050505,0.555555555556
7D2A897E,"On-chip compression for HDR image sensors",0.323232323232,0.39417989418
7F09D1D3,"Comparative Analysis of Blind Digital Image Watermarking Utilising Dual Encryption Technique in Frequency Domains",0.144155844156,0.126819212533
801C0E13,"Stereo disparity computation in the DCT domain using genetic algorithms",0.366666666667,0.282386363636
7EEBE3AF,"Efficient algorithm for early detecting all-zero DCT blocks in H.264 video encoding",0.558441558442,0.46746031746
7B2E94F1,"Shift-Register-Based Data Transposition for Cost-Effective Discrete Cosine Transform",0.123232323232,0.0951178451178
7717977A,"Image restoration by cosine transform-based iterative regularization",0.123232323232,0.0981481481481
623D202F,"Knowledge and predictors of dysplasia surveillance performance in inflammatory bowel diseases in Australia",0.154166666667,0.10299581371
811CB8F6,"The discrete fractional cosine and sine transforms",0.111188811189,0.0909090909091
7DA07465,"A unified approach to fast image registration and a new curvature based registration technique",0.139691558442,0.136061507937
7E9131E4,"A Reconfigurable DCT Architecture for Multimedia Applications",0.129166666667,0.134920634921
7ED9896C,"Down-sampling in DCT domain using linear transform with double-sided multiplication for image/video transcoding",0.111188811189,0.120779220779
8042D96B,"A concatenated coding technique for partial response channels",0.158333333333,0.129166666667
8043E398,"Tree-Structured Compressive Sensing With Variational Bayesian Analysis",0.144155844156,0.121428571429
7F3059FC,"High throughput CORDIC-based systolic array design for the discrete cosine transform",0.144155844156,0.114959114959
7FC2B1C0,"Fast algorithm for the 3-D DCT-II",0.358441558442,1.0
7E076D33,"DCT-Based Iris Recognition",0.0839160839161,0.0748663101604
7EF3D942,"Study on rate-quantization models based on main DCT coefficient distribution models",0.135227272727,0.11813973064
8124768C,"Block Convolution Using Discrete Trigonometric Transforms and Discrete Fourier Transform",0.116666666667,0.115064102564
7FB5EBF2,"Implementation of video codec with programmable parallel DSP",0.11626984127,0.114959114959
76481B8F,"COX-2 inhibition as a tool to treat and prevent colorectal cancer",0.133333333333,0.119621848739
7DC5B924,"Variable block-size transform image coder",0.123232323232,0.0972222222222
80593702,"Visual Quality Enhancement in DCT-Domain Spatial Downscaling Transcoding Using Generalized DCT Decimation",0.13125,0.140793650794
7E009883,"Discrete cosine transform–based local adaptive filtering of images corrupted by nonstationary noise",0.149206349206,0.127886002886
809D0932,"VLSI architectures for digital image coding",0.158333333333,0.116402116402
697D5D8D,"Spatial Video Watermarking Based on Stability of DC Coefficients",0.123232323232,0.110404040404
78E5F55A,"A lapped directional transform for spectral image analysis and its application to restoration and enhancement",0.158333333333,0.125793650794
7E5FC508,"Hardware support of JPEG",0.150505050505,0.2
714498CC,"Prime factor decomposition of the discrete cosine transform and its hardware realization",0.128282828283,0.0862049062049
781B875E,"A new approach to combine texture compression and filtering",0.3625,0.347916666667
5861DB81,"2-D discrete cosine transform (DCT) on meshes with hierarchical control modes",0.123232323232,0.0982323232323
7B3FF7EE,"Equivalency of Fecal Immunochemical Tests and Colonoscopy in Familial Colorectal Cancer Screening",0.124786324786,0.0974287150758
585DC6C5,"Isomap and Neural Networks Based Image Registration Scheme",0.136219336219,0.131197691198
7F1631E5,"A hybrid data compression scheme using quaternary decomposition and selective multistage vector quantization",0.350505050505,0.220391414141
7E52B4A5,"Practical Evaluation of Illumination Watermarking Technique Using Orthogonal Transforms",0.163492063492,0.15
77A5BD13,"When does impact become impactful?",0.2,0.161904761905
7A05BF0E,"Recovering DC Coefficients in Block-Based DCT",0.102855477855,0.128787878788
77988EDA,"Fast Algorithms for the 2-D Discrete Cosine Transform",0.358441558442,0.545454545455
7F67BF57,"Blind Watermarking Algorithm Based on DCT for Color Images",0.358441558442,0.352777777778
7DB4D092,"An improved early detection algorithm for all-zero blocks in H.264 video encoding",0.358441558442,0.28746031746
80AEDBE3,"A Self-Resilience Digital Image Watermark Based on Relational Database",0.123232323232,0.123611111111
5936EA0B,"Efficient Compressed Domain Target Image Search and Retrieval",0.163492063492,0.117869167869
7F1842D2,"Implementation of parallel LFSR-based applications on an adaptive DSP featuring a pipelined configurable Gate Array",0.158333333333,0.136626984127
7FB3537B,"Transform Coding Techniques for Lossy Hyperspectral Data Compression",0.350505050505,0.334027777778
83750BA8,"Face Verification Using Multiple Localized Face Features",0.116666666667,0.108951048951
7E3FE717,"Parallel CRC Logic Optimization Algorithm for High Speed Communication Systems",0.39375,0.310384615385
812158D0,"An End-to-End Embedded Approach for Multicast/Broadcast of Scalable Video over Multiuser CDMA Wireless Networks",0.135227272727,0.106944444444
7CAD3E5D,"Hereditary nonpolyposis colorectal cancer in young colorectal cancer patients: High-risk clinic versus population-based registry",0.106547619048,0.0710784313725
7E076B5E,"A Novel Programmable Parallel CRC Circuit",0.106547619048,0.075
7713C432,"Efficient Schemes for Compressed-Domain Image Resizing",0.123232323232,0.10101010101
7F2D9441,"Incomplete Polyp Resection During Colonoscopy—Results of the Complete Adenoma Resection (CARE) Study",0.158333333333,0.125081699346
80EC628B,"Coherent steganography using Segmentation and DCT",0.158333333333,0.15
7D0DBCDE,"Iris Recognition Using Discrete Cosine Transform and Artificial Neural Networks",0.123232323232,0.123232323232
7D06B057,"Low Complexity and Fast Computation for Recursive MDCT and IMDCT Algorithms",0.366666666667,0.453703703704
7670E68C,"Hiding depth information into H.264 compressed video using reversible watermarking",0.123232323232,0.142664742665
5CDA378B,"DCT Block Conversion for H.264/AVC Video Transcoding",0.125694444444,0.12037037037
7A596B6F,"Predicting human gaze using quaternion DCT image signature saliency and face detection",0.128282828283,0.107536907537
7E9C4A75,"Face Recognition using PCA on Enhanced Image for Single Training Images",0.177777777778,0.131675731676
781655CB,"Medical image compression using 3-D Hartley transform",0.350505050505,0.345634920635
766B57EC,"Colorectal Carcinomas With CpG Island Methylator Phenotype 1 Frequently Contain Mutations in Chromatin Regulators",0.116666666667,0.0919233544234
73BEBDC2,"32-bit cyclic redundancy codes for Internet applications",0.158333333333,0.107796717172
70891284,"Memory-Efficiency and High-Speed Architectures for Forward and Inverse DCT with Multiplierless Operation",0.10101010101,0.0884920634921
7D09CB03,"Optimization of HW/SW Co-Design: Relevance to Configurable Processor and FPGA Technology",0.121933621934,0.115575396825
81484EBE,"Quadtree image compression using sub-band DCT features and Kohonen neural networks",0.350505050505,0.302626262626
7E3D393C,"System-Level Energy Optimization for Error-Tolerant Image Compression",0.328977272727,0.328258547009
