7CD18461,"Strengths and limits of Beta distributions as a means of reconstructing the true single-channel current in patch clamp time series with fast gating.",0.126984126984,0.10341991342
7C779A34,"Airborne vector gravimetry using precise, position-aided inertial measurement units",0.121933621934,0.159126984127
7E3BCCFB,"The integration of simple Markov model in solving single line production system",0.133333333333,0.137892662893
80F0AD4F,"The Markov selection model for concurrent speech recognition",0.145454545455,0.12031968032
636A62B0,"Mining longest repeating subsequences to predict world wide web surfing",0.0958333333333,0.135884353741
805A0E31,"Web Navigation Prediction Using Multiple Evidence Combination and Domain Knowledge",0.34375,0.276875901876
7E38B6E8,"Markov model based time series similarity measuring",0.103282828283,0.151753801754
80D027C7,"Dynamic Markov Model for reliability evaluation of power electronic systems",0.121933621934,0.0982720982721
80E2D8BD,"The impact of data send rate, node velocity and transmission range on QoS parameters of OLSR and DYMO MANET routing protocols.",0.120941558442,0.105206830207
780B0413,"The exponential multidimensional demographic projection model",0.182692307692,0.295454545455
76E04116,"Performance evaluation of an adaptive-rate MPEG encoder matching IntServ traffic constraints",0.121933621934,0.131553631554
7B10DF84,"Formal Modeling Techniques for Ambient Assisted Living",0.0959595959596,0.136111111111
78744637,"Real-Time 3-D Human Body Tracking using Variable Length Markov Models",0.0959595959596,0.157601657602
7A4BFF1D,"Inositol trisphosphate receptor and ion channel models based on single-channel data",0.113005050505,0.134784197284
76CEEB51,"Cost-effectiveness achieved through changing the composition of renal replacement therapy in Japan",0.101388888889,0.161447811448
7C7DEAA3,"Stochastic approach to determine spatial patterns of lizard community on a desert island",0.10625,0.128839143313
7CD3B1FE,"Examination of Genome Homogeneity in Prokaryotes Using Genomic Signatures",0.0975135975136,0.139121989122
61717FF3,"A hybrid wind speed forecasting model based on phase space reconstruction theory and Markov model: A case study of wind farms in northwest China",0.14375,0.11604978355
791F8799,"A methodology for analyzing the transient availability and survivability of a system with repairable components",0.0839160839161,0.1337995338
7C79B952,"Customized warranty offering for configurable products",0.118181818182,0.139926739927
7CA38AF4,"Common flaws exist in published cost-effectiveness models of pharmacologic stroke prevention in atrial fibrillation",0.119155844156,0.157204700062
77466E78,"Reliability Modeling Using SHARPE",0.0804195804196,0.19696969697
7CD86F45,"Cost-Effectiveness Analysis of Extended Duration Anticoagulation with Rivaroxaban to Prevent Recurrent Venous Thromboembolism",0.101388888889,0.143737373737
7CE341E4,"A Study on the Simulation of Daily Precipitation Using Multivariate Kernel Density Estimation",0.106060606061,0.13083028083
7EA559D2,"Visual speech synthesis by modelling coarticulation dynamics using a non-parametric switching state-space model",0.145454545455,0.152952999382
7FCAB6B7,"Analysis of memory and incremental redundancy ARQ schemes over a nonstationary channel",0.118055555556,0.125
808EC71B,"Learning temporal structure for task based control",0.108333333333,0.195
7DCD6598,"Detecting coevolving amino acid sites using Bayesian mutational mapping",0.0959595959596,0.158559218559
7FDB57B9,"Markov modeling of minimally invasive surgery based on tool/tissue interaction and force/torque signatures for evaluating surgical skills",0.127678571429,0.140473068598
77823E01,"Characterization of intermedia synchronization and its effects on the performance of an ATM multiplexer loaded by multimedia traffic",0.120941558442,0.119845779221
7D3785B2,"Information Extraction using Sequencing with Large Label Sets",0.156060606061,0.178114478114
7F9B5E92,"Accurate modeling of repair time in two-machine production lines",0.133333333333,0.112222222222
7CDDB3EC,"Costs and consequences of clopidogrel versus aspirin for secondary prevention of ischaemic events in (high-risk) atherosclerotic patients in Sweden: a lifetime model based on the CAPRIE trial and high-risk CAPRIE subpopulations",0.145833333333,0.118813396571
7EF01A49,"Automated analysis of phased-mission reliability",0.0975135975136,0.150673400673
753A6991,"Splice sites prediction of Human genome using length-variable Markov model and feature selection",0.346428571429,0.233510933511
75A5A146,"A Markov process in clinical dentistry: the prosthodontic cycle",0.121933621934,0.106878306878
75943ACE,"An Evaluation of CPU Efficiency Under Dynamic Quantum Allocation",0.119155844156,0.111255411255
7EEE6E67,"An abstraction-guided simulation approach using Markov models for microprocessor verification",0.101388888889,0.132362844128
7F081857,"Detecting regime changes with a mobile robot using multiple models",0.1125,0.151136363636
6FEE9CA4,"Endpoint detection of sio 2 plasma etching using expanded hidden markov model",0.09375,0.144658912516
7A477E2E,"Modeling long‐term persistence in hydroclimatic time series using a hidden state Markov Model",0.103282828283,0.128411865912
7B56C386,"Prediction of many new exons and introns in Plasmodium falciparum chromosome 2",0.309294871795,0.258717948718
7DACE395,"Reconstructing pedigrees: some identifiability questions for a recombination-mutation model",0.545454545455,0.331168831169
7B2EC380,"US Cost Effectiveness of Darunavir/Ritonavir 600/100 mg bid in Treatment-Experienced, HIV-Infected Adults with Evidence of Protease Inhibitor Resistance Included in the TITAN Trial",0.15625,0.147115006206
75D994CF,"Simulating vegetation dynamics and land use in a mire landscape using a Markov model",0.121933621934,0.125689449439
8071D886,"Geometric Run Length Packet Channel Models Applied in DVB-H Simulations",0.113005050505,0.139069264069
7FF1C85F,"Protein secondary structure prediction using three neural networks and a segmental semi Markov model",0.327777777778,0.256515706516
7D67388E,"Mining interest navigation patterns based on hybrid markov model",0.111805555556,0.144885669886
7BEF6E5E,"Commentary: Markov models of medical prognosis",0.106060606061,0.133477633478
7A092F8D,"Pharmacological management of overactive bladder : a systematic and critical review of published economic evaluations.",0.121933621934,0.111408730159
7CB634ED,"Assessing Cost‐Effectiveness of Sealant Placement in Children",0.0959595959596,0.131481481481
76B503E4,"A new nonstationary LMS algorithm for tracking Markovian time varying systems",0.10101010101,0.169658119658
80441649,"Identification of transcription factor binding sites with variable-order Bayesian networks",0.120941558442,0.117995430495
6D52F72D,"Reliability Measure of Hardware Redundancy Fault-Tolerant Digital Systems with Intermittent Faults",0.121933621934,0.0973563473563
75F63956,"Constructing the equilibrium ensemble of folding pathways from short off-equilibrium simulations",0.101388888889,0.135753367003
78B9FFFA,"Comparing Three Software Tools for Implementing Markov Models for Health Economic Evaluations",0.119155844156,0.131693306693
7B021A25,"Detection of TCP covert channel based on Markov model",0.125,0.146027583528
7E6DD976,"QSAR for anti-RNA-virus activity, synthesis, and assay of anti-RSV carbonucleosides given a unified representation of spectral moments, quadratic, and topologic indices",0.142361111111,0.145923520924
7E29E24B,"Online Detection of Fire in Video",0.129464285714,0.130952380952
7E6971E4,"Performance analysis of a dynamic handoff scheme in wireless networks with heterogeneous call arrival processes",0.121933621934,0.103940330503
7A4670AF,"A Comparative Evaluation of Designs for Reliable Memory Systems",0.121933621934,0.110500610501
804A9036,"A Markov model of the cost-effectiveness of human-derived follicle-stimulating hormone (FSH) versus recombinant FSH using comparative clinical trial data",0.113005050505,0.124372849373
780F5B47,"Individualizing Therapy to Prevent Long-term Consequences of Estrogen Deficiency in Postmenopausal Women",0.0874125874126,0.131818181818
7DCB6F00,"Compactly supported radial covariance functions",0.0959595959596,0.175925925926
7C3C3907,"Simulation of Hourly Precipitation using Nonhomogeneous Markov Chain Model and Derivation of Rainfall Mass Curve using Transition Probability",0.111805555556,0.139314620565
7A592646,"Real-time 3-D human body tracking using learnt models of behaviour",0.0893939393939,0.171515151515
76CFD7D7,"Improvement of group performance of job distributed mobile robots by an emotionally biased control system",0.134920634921,0.12036358703
75104811,"Transient analysis of large Markov models with absorbing states using regenerative randomization",0.106060606061,0.139338835767
7FCEA521,"Basing population genetic inferences and models of molecular evolution upon desired stationary distributions of DNA or protein sequences",0.156565656566,0.165239205239
7E2E1620,"Optimal estimation of training interval for channel equalization",0.139583333333,0.131904761905
7A7C48EA,"Measuring the cost-effectiveness of lipid-lowering drugs in the elderly:",0.0804195804196,0.170454545455
758542EA,"Automatic evaluation of air mission routes with respect to combat survival",0.119155844156,0.132096474954
7B71A682,"Co-evolution Is Incompatible with the Markov Assumption in Phylogenetics",0.0848214285714,0.178418803419
79671B6F,"Distributed learning with biogeography-based optimization: Markov modeling and robot control",0.0958333333333,0.148931623932
7E01E9F8,"Solving dependability/performability irreducible Markov models using regenerative randomization",0.106060606061,0.175233100233
78AE870F,"The mstate package for estimation and prediction in non- and semi-parametric multi-state and competing risks models",0.323232323232,0.28771043771
76E3DE82,"Numerical evaluation of observed sojourn time distributions for a single ion channel incorporating time interval omission",0.121933621934,0.11755952381
7963CE81,"Nonparametric Inference for a Class of Semi-Markov Processes with Censored Observations",0.18253968254,0.178075396825
599D6A06,"Hybrid predictors for next location prediction",0.316666666667,0.392307692308
7C14F371,"A new Markov model for Web access prediction",0.307692307692,0.312791375291
7F1EF167,"Human activity detection from RGBD images",0.139583333333,0.134259259259
7E3238DC,"Recognition of User Intentions for Interface Agents with Variable Order Markov Models",0.136111111111,0.100455100455
7DBF6696,"Prediction of student actions using weighted Markov models",0.358333333333,0.291860916861
7674DE65,"On the Representability of Complete Genomes by Multiple Competing Finite-Context (Markov) Models",0.0893939393939,0.150291375291
7D742E76,"Effect of Remote Back-Up Protection System Failure on the Optimum Routine Test Time Interval of Power System Protection",0.138392857143,0.116340603841
6A6F8D86,"Reasoning about Software Architectures with Contractually Specified Components",0.0861888111888,0.127467532468
80DD7B84,"The Dynamic Analysis and Prediction of Stock Markets through the Latent Markov Model",0.344155844156,0.252118252118
80E78193,"Deterministic process-based generative models for characterizing packet-level bursty error sequences",0.116883116883,0.143668831169
755A2D5D,"Estimation of natural history parameters of breast cancer based on non-randomized organized screening data: subsidiary analysis of effects of inter-screening interval, sensitivity, and attendance rate on reduction of advanced cancer",0.132142857143,0.121345983356
7E83EB7E,"Markov model for dynamic behavior of ranging errors in indoor geolocation systems",0.116883116883,0.130078255078
7B557445,"Reliability analysis of nuclear component cooling water system using semi-Markov process model",0.116883116883,0.141142807809
7E4779F5,"A generalized wavelet transform for Fourier analysis: the multiresolution Fourier transform and its application to image and audio signal analysis",0.131944444444,0.11456043956
7C5B27DC,"Modeling word occurrences for the compression of concordances",0.126984126984,0.120086580087
795154B7,"Cost effectiveness of carvedilol for heart failure",0.119155844156,0.0982683982684
7E0611DA,"Efficient discovery of unusual patterns in time series",0.139583333333,0.125694444444
7F797646,"Information integration via hierarchical and hybrid bayesian networks",0.146428571429,0.151322751323
7887DC15,"Interpolated Markov Models for Eukaryotic Gene Finding",0.0820221445221,0.150233100233
7CE49A26,"A computer program to estimate the parameters of covariate dependent higher order Markov model",0.133838383838,0.10489996115
6D6846BF,"Steganalysis using partially ordered Markov models",0.0804195804196,0.150291375291
7C2E1012,"Using a VOM model for reconstructing potential coding regions in EST sequences",0.107954545455,0.145652958153
7F348BB3,"Adaptive Bit Partitioning for Multicell Intercell Interference Nulling With Delayed Limited Feedback",0.108333333333,0.140086580087
790A9743,"Validity of the Aalen–Johansen estimators of stage occupation probabilities and Nelson–Aalen estimators of integrated transition hazards for non-Markov models",0.127678571429,0.103050344717
7EABF526,"Models of forest dynamics based on roles of tree species",0.103282828283,0.141356421356
7D82755B,"Response: Re: Pharmacogenomic Variation of CYP2D6 and the Choice of Optimal Adjuvant Endocrine Therapy for Postmenopausal Breast Cancer: A Modeling Analysis",0.119949494949,0.0942467663056
7F29282F,"A latent Markov model for detecting patterns of criminal activity",0.139583333333,0.1318997669
772745D9,"Generic Markov models for availability estimation and failure characterization in petroleum refineries",0.12987012987,0.0985056610057
80A25F39,"Reliability analysis of large fault trees using the Vesely failure rate",0.121933621934,0.142096990311
80FCA921,"Routine test interval decision for protective systems based on probabilistic approach",0.129464285714,0.150518925519
7DFED71E,"A safety-related digital input system based on the analysis of the architectural constraints",0.113997113997,0.149511599512
7FF4658C,"A Markovian approach for best-fit channel selection in cognitive radio networks",0.121933621934,0.108293650794
79A65CC0,"2D MI-DRAGON: A new predictor for protein–ligands interactions and theoretic-experimental studies of US FDA drug-target network, oxoisoaporphine inhibitors for MAO-A and human parasite proteins",0.121933621934,0.0965209393781
80B9C020,"Data Mining for Hierarchical Model Creation",0.121933621934,0.107052669553
7A6704D0,"A Model for Correlated Rician Fading Channels Based on a Finite Queue",0.107954545455,0.146212121212
7C058232,"Clinical Effectiveness and Cost Effectiveness of Tailoring Chronic Hepatitis C Treatment with Peginterferon Alpha-2b Plus Ribavirin to HCV Genotype and Early Viral Response: A Decision Analysis Based on German Guidelines",0.113005050505,0.124834887335
7D8D2F51,"Maximum entropy direct models for speech recognition",0.147727272727,0.120454545455
774D20F2,"Input encoding method for identifying transcription start sites in RNA polymerase II promoters by neural networks",0.119047619048,0.12293040293
7E2165F3,"A Markov Model for MIMO Channel Condition Number with Application to Dual-Mode Antenna Selection",0.121933621934,0.10749330035
7BC83AD5,"A Transitional Model for Longitudinal Binary Data Subject to Nonignorable Missing Data",0.118181818182,0.169292929293
756398B0,"Modeling stroke management: a qualitative review of cost-effectiveness analyses",0.113005050505,0.152777777778
7C4A6D7C,"Estimating the stage‐specific numbers of HIV infection using a markov model and back‐calculation",0.0861888111888,0.153566433566
7F348538,"Modular modeling and analysis of a distributed production system with distant specialised maintenance",0.133333333333,0.139849039849
7E3577D5,"Generating downscaled weather data from a suite of climate models for agricultural modelling applications",0.113005050505,0.125577200577
7D733D4C,"Performance of a wireless access protocol on correlated Rayleigh-fading channels with capture",0.12987012987,0.121031746032
76CA1A83,"Modeling steady-state and transient behaviors of user mobility: formulation, analysis, and application",0.121933621934,0.122278184778
7FD6A399,"Analysis of pilot symbol assisted modulation in fading channels using finite state Markov models",0.120941558442,0.13780436735
80B2ED9C,"Integrated reliability metrics to assess fault tolerant control system",0.119155844156,0.122039864897
5F39BC93,"Predicting Page Occurrence in a Click-Stream Data: Statistical and Rule-Based Approach",0.126984126984,0.113650793651
78AF85BB,"The cost-effectiveness of Maze procedures using ablation techniques at the time of mitral valve surgery",0.119155844156,0.125885225885
7D14B009,"Contextual on-board learning and prediction of vehicle destinations",0.318181818182,0.321428571429
7B09BD2A,"Cost-Effectiveness of Strategies to Improve HIV Testing and Receipt of Results: Economic Analysis of a Randomized Controlled Trial",0.116883116883,0.146078643579
7C465CB0,"Description of interacting channel gating using a stochastic Markovian model",0.126893939394,0.188762626263
785A4968,"A Structured path-based approach for computing transient rewards of large CTMCs",0.0884615384615,0.130303030303
7EC91705,"Parameterized Reliability Prediction for Component-Based Software Architectures",0.313461538462,0.315584415584
5E3CFF11,"BI-POMDP: Bounded, Incremental, Partially-Observable Markov-Model Planning",0.104166666667,0.1875
787C9C7E,"Learning probabilistic deformation models from image sequences",0.100505050505,0.145252525253
795285A5,"Risk of spacecraft on-orbit obsolescence: Novel framework, stochastic modeling, and implications",0.123688811189,0.112121212121
7E9C97C8,"Cost implications of treatment non‐completion in a forensic personality disorder service",0.15625,0.132154882155
7FB808C7,"Voicing-aware parametric speech quality models over VoIP networks",0.15625,0.131755050505
5C64A0E8,"Learning topological maps with weak local odometric information",0.118181818182,0.201587301587
80846A31,"Conditional Random Fields Feature Subset Selection Based on Genetic Algorithms for Phosphorylation Site Prediction",0.344155844156,0.294784580499
76E9551E,"Finding surprising patterns in a time series database in linear time and space",0.128472222222,0.153174603175
7E8549A3,"An introduction to Markov modelling for economic evaluation.",0.116883116883,0.136507936508
7E214F98,"Wideband Autonomous Cognitive Radios: Spectrum Awareness and PHY/MAC Decision Making",0.138095238095,0.119404761905
7ECB6752,"Markov channel model for MIMO systems and its applications for efficient error control",0.119155844156,0.110114885115
7F7A65E1,"Screen-and-treat strategies for albuminuria to prevent cardiovascular and renal disease: Cost-effectiveness of nationwide and targeted interventions based on analysis of cohort data from the Netherlands",0.115277777778,0.142205988456
80A974C1,"Career-path analysis using drifting Markov models (DMM) and self-organizing maps",0.0975135975136,0.171356421356
7F986B1F,"Dynamic Change in Landscape Pattern of Shen-Fu Connection Area Based on Markov Model",0.125,0.127749854312
8047C741,"Interval-availability distribution of 2-state systems with exponential failures and phase-type repairs",0.121933621934,0.107722832723
7D83E160,"Error resilient image transport in wireless sensor networks",0.126984126984,0.0959885022385
805C7DA0,"Minimum classification error learning for sequential data in the wavelet domain",0.297546897547,0.271887239744
77752985,"Error Detection and Reconfigurationin Reliable Ethernet Train Networks",0.130456349206,0.100891690009
7D684294,"Applications of SPICE simulation software to the study of reliability and availability in electrical engineering education",0.119155844156,0.104814013147
7ED73AF2,"Semi-Markov kMeans Clustering and Activity Recognition from Body-Worn Sensors",0.133333333333,0.123917748918
77476F4A,"The Representation of Social Processes by Markov Models",0.127678571429,0.108922327672
7BAE02C0,"Using independent open-to-closed transitions to simplify aggregated Markov models of ion channel gating kinetics",0.106060606061,0.141266719392
7D012229,"Treatment strategies aiming at remission in early rheumatoid arthritis patients: starting with methotrexate monotherapy is cost-effective.",0.0991161616162,0.160148358586
80609A54,"Bounding steady-state availability models with group repair and phase type repair distributions",0.119047619048,0.118791085458
7E685031,"APPLYING MACHINE LEARNING METHODS FOR TIME SERIES FORECASTING",0.132936507937,0.148072562358
7F15BF06,"An efficient simulator to land mobile satellite channels",0.104166666667,0.128273809524
785BFEF9,"Modeling demand rate and imperfect proof-test and analysis of their effect on system safety",0.119949494949,0.117626817627
753B2F04,"A Maximum Likelihood Approach to Continuous Speech Recognition",0.147727272727,0.122727272727
81508ED7,"Modelling and analysis of detection time trade-offs for channel searching in cognitive radio networks",0.121527777778,0.108854166667
75955306,"Power system state forecasting using fuzzy-Viterbi Algorithm",0.106060606061,0.138151200651
7E8A9968,"A hybrid approach for web information extraction",0.122727272727,0.130303030303
44F7392D,"A robust system for counting people using an infrared sensor and a camera",0.10625,0.153891941392
7DD743C1,"Error-rate evaluation of linear equalization and decision feedback equalization with error propagation",0.133333333333,0.135152545867
7D19A0FB,"Evaluating Estimates of Markov Models of Sequence Evolution through Simulation",0.122222222222,0.126599326599
804AD709,"Markov models of major depression for linking psychiatric epidemiology to clinical practice",0.116883116883,0.128268398268
7F89C669,"Generating structured music for bagana using quality metrics based on Markov models",0.110714285714,0.174681799682
7ABB00FC,"Error prediction in Markov models of building/HVAC systems",0.344155844156,0.327672327672
7DA11374,"Local/global fault diagnosis of Event-Driven Systems based on Bayesian Network and Timed Markov Mode",0.121933621934,0.136046245421
7A0CFEA2,"Analysis of the performances of the first-order two-state Markov model using solar radiation properties",0.106060606061,0.129418200847
79A153F1,"A semi-Markov model for binary longitudinal responses subject to misclassification",0.0820221445221,0.124747474747
7733A8A3,"Web site personalization based on link analysis and navigational patterns",0.111805555556,0.140145502646
7DE74DD2,"Cost-Utility Analysis of Orthoptic Screening in Kindergarten: A Markov Model Based on Data From Germany",0.113997113997,0.125708492896
0470AF93,"State transition analysis to detect malicious program behavior",0.121933621934,0.124603174603
766B927F,"Cost effectiveness of pharmacotherapy for the prevention of migraine: a Markov model application.",0.119155844156,0.10050306836
80621074,"Dempster–Shafer fusion of multisensor signals in nonstationary Markovian context",0.122222222222,0.122895622896
598184BF,"A Study of Saccade Transition for Attention Segregation and Task Strategy in Laparoscopic Surgery",0.120941558442,0.104602143888
803204BF,"Inferring search behaviors using partially observable Markov (POM) model",0.116883116883,0.150506636221
7AA863AC,"The Economic Implications of Non-Adherence after Renal Transplantation",0.130357142857,0.175
7FA2F43D,"Non-pharmaceutical prevention of hip fractures – a cost-effectiveness analysis of a community-based elderly safety promotion program in Sweden",0.149206349206,0.109833099907
78DE7ADF,"On some aspects of the management of a stochastically developing forest",0.107954545455,0.152777777778
7EF169D5,"Looping suffix tree-based inference of partially observable hidden state",0.141025641026,0.201587301587
7FECE37B,"Exact distribution of a pattern in a set of random sequences generated by a Markov source: applications to biological data",0.121527777778,0.125946969697
5B7CF470,"Cryptanalysis of randomized arithmetic codes based on markov model",0.103896103896,0.150266400266
815FD5FF,"Connectionist probability estimation in the DECIPHER speech recognition system",0.15625,0.118566433566
7AA0502F,"Satellite Channel Markov Model of Ka-band based on Principal Component",0.106060606061,0.160037878788
77C383DA,"Evaluating reliability of WSN with sleep/wake-up interfering nodes",0.0875,0.130303030303
7F5E056C,"Modeling Interaction Using Learnt Qualitative Spatio-Temporal Relations and Variable Length Markov Models",0.121933621934,0.147558790416
7A32FC1B,"An intrinsic model of coregionalization that solves variance inflation in collocated cokriging",0.0909090909091,0.130681818182
04E86C48,"Morphological features help POS tagging of unknown words across language varieties",0.116666666667,0.148737373737
7561F307,"Pharmacoeconomics of Angiotensin II Antagonists in Type 2 Diabetic Patients with Nephropathy: Implications for Decision Making",0.156655844156,0.117762445887
7D8862FD,"GeneMarkS: a self-training method for prediction of gene starts in microbial genomes. Implications for finding sequence motifs in regulatory regions.",0.330555555556,0.224213564214
78AD17F6,"Exact bit error probabilities and packet error statistics for SVD transmission over time-varying dual-branch MIMO systems obtained by a Markov model",0.127678571429,0.117564657565
58628757,"Active shape model based segmentation and tracking of facial regions in color images",0.102777777778,0.126199494949
5E05220A,"Discrete sequence prediction with commented Markov models",0.311188811189,0.314685314685
58A777D9,"Extending Context Spaces Theory by Predicting Run-Time Context",0.13125,0.151753246753
