7F14F768,"A Generalized Analytic Performance Model of Distributed Systems that Perform N Tasks Using P Fault-Prone Processors",0.107954545455,0.164849039849
798EDB6A,"Decision-Analytic Models to Simulate Health Outcomes and Costs in Heart Failure: A Systematic Review",0.121933621934,0.110103264791
75D5A714,"Exact Performance Estimates for Multiprocessor Memory and Bus Interference",0.119949494949,0.113507625272
7E8D9E91,"On Mining Moving Patterns for Object Tracking Sensor Networks",0.109027777778,0.181812169312
7FA234B8,"Packet error statistics of LOS broadband fixed wireless access channels",0.121933621934,0.123204110704
81794877,"The distribution of dairy farm size in Poland: a Markov approach based on information theory",0.15,0.132196275946
758E346F,"Predictive Tabla Modelling Using Variable-length Markov and Hidden Markov Models",0.0804195804196,0.148951048951
772BDC3E,"Bayesian traffic dynamics and packet loss prediction for video over IP networks",0.331168831169,0.23537414966
806F9EAE,"Behavior Detection Using Confidence Intervals of Hidden Markov Models",0.1125,0.138014763015
7EEA8AFC,"An optimal checkpointing-strategy for real-time control systems under transient faults",0.119155844156,0.100778388278
7F30A606,"Using Markov Models to Assess the Performance of a Health and Community Care System",0.110227272727,0.131736473403
7F36F835,"Diagnosing and Predicting Inflation in Poland with Application of Markov Switching Models and Future Inflation Indicator",0.120941558442,0.113397574648
80A12DB3,"A new information theoretic test of the Markov property of block errors in fading channels",0.157142857143,0.121623862249
81781ABB,"Combining ENSO forecasts: A feasibility study",0.104945054945,0.145941558442
7DA0D886,"Analytical Models for Architecture-Based Software Reliability Prediction: A Unification Framework",0.330555555556,0.247306397306
5D54C94E,"Learning A* underestimates: Using inference to guide inference",0.141025641026,0.287698412698
722D7452,"A Markov Model for Analyzing Polytomous Outcome Data",0.106060606061,0.161616161616
803E4458,"A Markov model of heteroskedasticity, risk, and learning in the stock market",0.116883116883,0.149783549784
814BCE27,"The German Cervical Cancer Screening Model: development and validation of a decision-analytic model for cervical cancer screening in Germany",0.120941558442,0.103313598167
7883AECC,"Transitions to cigarette smoking during adolescence",0.0975135975136,0.150673400673
7D859C84,"A discriminative latent variable chinese segmenter with hybrid word/character information",0.118181818182,0.2
7E9243F5,"Estimating the health benefits and costs associated with ezetimibe coadministered with statin therapy compared with higher dose statin monotherapy in patients with established cardiovascular disease: results of a Markov model for UK costs using data registries.",0.0959595959596,0.128655449489
7832B934,"Availability-aware provisioning strategies for differentiated protection services in wavelength-convertible WDM mesh networks",0.121933621934,0.10937950938
7A316A23,"Evaluating Recruitment Strategies Using Fuzzy Set Theory in Stochastic Manpower Planning",0.140277777778,0.159532828283
7D7B6449,"Forecasts of tropical Pacific SST and sea level using a Markov model",0.103896103896,0.132768025625
7BB89E59,"A higher order Markov model for analyzing covariate dependence",0.133838383838,0.155788655789
7C97E1F3,"A Class of Latent Markov Models for Capture–Recapture Data Allowing for Time, Heterogeneity, and Behavior Effects",0.106060606061,0.126092657343
79E4649D,"Estimation and tests for a longitudinal regression model based on the Markov chain",0.0991758241758,0.131180724038
7F3F43D8,"Robust speech recognition over mobile and IP networks in burst-like packet loss",0.150505050505,0.122626262626
7AB806B5,"Colorectal cancer screening comparing no screening, immunochemical and guaiac fecal occult blood tests: A cost‐effectiveness analysis",0.126984126984,0.136122782446
07027B17,"Context-driven predictions",0.307692307692,1.0
7E2EF646,"Gene Clustering via Integrated Markov Models Combining Individual and Pairwise Features",0.0820221445221,0.126456876457
7C95A4BA,"A three state Markov model for discrimination learning",0.120941558442,0.101423576424
7EF929F6,"Fast simulation of diversity Nakagami fading channels using finite-state Markov models",0.106060606061,0.129301254301
7D19E0E1,"Estimating dementia-free life expectancy for Parkinson's patients using Bayesian inference and microsimulation.",0.15,0.16662846957
7B97F457,"Collective suffix tree-based models for location prediction",0.316666666667,0.318560606061
803B0651,"Bayesian Approach With Hidden Markov Modeling and Mean Field Approximation for Hyperspectral Data Analysis",0.125,0.102939124368
802AF8D6,"Error statistics in data transmission over fading channels",0.121933621934,0.116178266178
7E9BD4BE,"Complexity reduction of Markov channel models for wireless networks using graph theory",0.148214285714,0.143103655604
787121A3,"On Reduced Amino Acid Alphabets for Phylogenetic Inference",0.149572649573,0.16094017094
7F0D6A5E,"In search of the small ones: improved prediction of short exons in vertebrates, plants, fungi and protists",0.344155844156,0.20481000481
78C45C46,"State transition probabilities in bridge deterioration based on Weibull sojourn times",0.127678571429,0.130498321123
7D30AFD0,"Mismatched source transition probability matrix for adaptive MAP decoding in MPEG-4 imagery wireless transmission systems",0.125,0.106542069042
59D027F2,"An information theoretic web site navigability classification",0.135227272727,0.121507936508
7B195F48,"COMPLEX ENVELOPE THREE‐STATE MARKOV MODEL BASED SIMULATOR FOR THE NARROW‐BAND LMS CHANNEL",0.106060606061,0.127376789877
80DD4372,"Random-Walk Computation of Similarities between Nodes of a Graph with Application to Collaborative Recommendation",0.335227272727,0.265476190476
7CED6E94,"Unsupervised topic identification by integrating linguistic and visual information based on hidden Markov models",0.135227272727,0.170404595405
7E3D5B0C,"Economic Evaluation of Lifestyle Interventions for Preventing Diabetes and Cardiovascular Diseases",0.116883116883,0.146288515406
7667FFCA,"Prediction Models for Serviceability Deterioration of Stormwater Pipes",0.316666666667,0.267348484848
78164044,"Using decision analysis to determine the cost-effectiveness of intensity-modulated radiation therapy in the treatment of intermediate risk prostate cancer",0.106060606061,0.139262583821
7F8DE13E,"Using Markov Chains for Link Prediction in Adaptive Web Sites",0.316666666667,0.249169283098
79C9BEB3,"Optimal assignment of treatments to health states using a Markov decision model: an introduction to basic concepts.",0.113005050505,0.125048100048
759AFA1F,"State-Transition Modeling: A Report of the ISPOR-SMDM Modeling Good Research Practices Task Force-3",0.121933621934,0.121957671958
7EC15CF2,"A configurable statistical lossless compression core based on variable order Markov modeling and arithmetic coding",0.129166666667,0.139452214452
78E8CF32,"Analyzing Effect of Demand Rate on Safety of Systems with Periodic Proof-tests",0.109848484848,0.146490546491
76FCFA64,"Markovian Forecast Processes",0.12987012987,0.142857142857
7B81BF15,"A cost-effectiveness evaluation of two continuous-combined hormone therapies for the management of moderate-to-severe vasomotor symptoms.",0.121933621934,0.10936008436
7C5832D7,"A Novel Method to Characterize User Sessions of Educational Software",0.0982323232323,0.131944444444
7FEAB94E,"Intensive lifestyle changes or metformin in patients with impaired glucose tolerance: Modeling the long-term health economic implications of the diabetes prevention program in Australia, France, Germany, Switzerland, and the United Kingdom",0.15,0.0999641698171
7A490353,"Markov models of occupational mobility: Theoretical development and empirical support. Part 2: Continuously operative job systems",0.127678571429,0.112808223523
7EC690BE,"Petri-net based performance-evaluation of distributed homogeneous task systems",0.104166666667,0.183814102564
6CE50C5B,"A new approach to solve dynamic fault trees",0.116883116883,0.138839285714
7E08B50D,"Bayesian classifiers for detecting HGT using fixed and variable order markov models of genomic signatures",0.128787878788,0.154458041958
776B5CC3,"Is routine duplex ultrasound surveillance after carotid endarterectomy cost-effective?",0.0857142857143,0.141666666667
7FDB99AB,"Using social network analysis tools in ecology: Markov process transition models applied to the seasonal trophic network dynamics of the Chesapeake Bay.",0.121933621934,0.13434428819
810600AC,"Markov Models in Medical Decision Making A Practical Guide",0.106060606061,0.138566433566
809707E3,"A New Approach for Facial Expression Recognition Based on Burial Markov Model",0.0954545454545,0.130497280497
84C09870,"Day care versus inpatient management of nausea and vomiting of pregnancy: cost utility analysis of a randomised controlled trial",0.115277777778,0.133235051985
755EAEDD,"A Location Management Scheme Using Direction Characteristics of Mobile Terminals in Mobile Communication Networks",0.136111111111,0.129586771253
7BB761FD,"Using Coxian Phase-Type Distributions to Identify Patient Characteristics for Duration of Stay in Hospital",0.136111111111,0.159812409812
750DBF9E,"Speech separation using speaker-adapted eigenvoice speech models",0.150505050505,0.187070707071
79E544CF,"Different strategies for screening and prevention of type 2 diabetes in adults: cost effectiveness analysis",0.119155844156,0.107650265493
0060A616,"Sequence MMSE Source Decoding Over Noisy Channels Using the Residual Redundancies",0.111111111111,0.142466329966
7F603AAF,"Data compression using dynamic Markov modelling",0.100505050505,0.142455322455
7F009A21,"A Markov Selection Split Reservation Protocol for WDM Optical Networks without Wavelength Conversion",0.12987012987,0.106070913214
7DCE929E,"Multiple learning modes in the development of performance on a rule-based category-learning task",0.113005050505,0.156111111111
7E4BF910,"A channel representation method for the study of hybrid retransmission-based error control",0.127678571429,0.117328042328
80BCAA67,"State‐space size considerations for disease‐progression models",0.129166666667,0.14696969697
77286713,"Experimental implications of a Markov model for sedimentation",0.120192307692,0.139277389277
5B335684,"History Dependent Recommender Systems Based on Partial Matching",0.0875,0.170085470085
77929E56,"Comparison of Rate Control versus Rhythm Control for Management of Atrial Fibrillation in Patients with Coexisting Heart Failure: A Cost‐Effectiveness Analysis",0.121933621934,0.112304593555
7981BFD8,"Modelling the effect of breast cancer screening on related mortality using French data",0.0959595959596,0.140137517711
7E9B289C,"A VOM based gene-finder that specializes in short genes",0.0744047619048,0.222222222222
7AAB3FE9,"Cost Effectiveness of Ibandronate for the Prevention of Fractures in Inflammatory Bowel Disease-Related Osteoporosis: Cost-Utility Analysis Using a Markov Model",0.119155844156,0.116032856033
78180B31,"A programming tool to generate multi-site daily rainfall using a two-stage semi parametric model",0.0935606060606,0.153548237477
78577E65,"Passage-time computation and aggregation strategies for large semi-Markov processes",0.127678571429,0.120941558442
7A225F13,"Markov model for analyzing the residual static strength of a fiber-reinforced composite",0.0959595959596,0.140637140637
6FD8647B,"Markov Model Based Mobile Clickstream Analysis with Sub-day, Day and Week-Scale Transitions",0.106060606061,0.139083139083
7FF667D8,"Neyman-pearson detection of gauss-Markov signals in noise: closed-form error exponentand properties",0.144345238095,0.131349206349
810C674B,"Correcting Classification Error in Income Mobility",0.121933621934,0.131178266178
7AF06FDC,"Saddlepoint approximation for semi-Markov processes with application to a cardiovascular randomised study",0.135822510823,0.140238095238
7F84DD95,"Analysis of migration models of biogeography-based optimization using Markov theory",0.124786324786,0.146198246198
7CAC841B,"Hattendorff's theorem for non-smooth continuous-time Markov models I: Theory",0.124175824176,0.127672327672
7711DE73,"Statistical analysis of the eigenspace components of the two-dimensional, symmetric rank-two strain rate tensor derived from the space geodetic measurements (ITRF92-ITRF2000 data sets) in central Mediterranean and Western Europe",0.127678571429,0.112233368483
7E51FFB8,"A real-time hand tracker using variable-length Markov models of behaviour",0.0893939393939,0.124003774004
7B72FB95,"State probability of a series-parallel repairable system with two-types of failure states",0.127678571429,0.0975274725275
76BA1C33,"Cost effectiveness of chemoprevention for prostate cancer with dutasteride in a high-risk population based on results from the REDUCE Clinical trial",0.113005050505,0.130750313593
79F1E415,"PROKARYOTE PHYLOGENY WITHOUT SEQUENCE ALIGNMENT: FROM AVOIDANCE SIGNATURE TO COMPOSITION DISTANCE",0.119155844156,0.0979270729271
79D9442A,"A five-parameter Markov model for simulating the paths of sedimenting particles",0.107954545455,0.125067987568
77D5160A,"Are lifestyle interventions in primary care cost-effective?--An analysis based on a Markov model, differences-in-differences approach and the Swedish Bjorknas study.",0.107954545455,0.155067771734
7E5F090D,"DIFtree: a software package for the analysis of dynamic fault tree models",0.121933621934,0.103081409331
816ACD91,"Scoring function for DNA-drug docking of anticancer and antiparasitic compounds based on spectral moments of 2D lattice graphs for molecular dynamics trajectories.",0.125992063492,0.141829004329
7DD9BE8A,"Wireless Fading Channel Models: from Classical to Stochastic Differential Equations",0.120941558442,0.112824675325
5EA0244F,"Reliability of mesh and torus topologies in the presence of faults",0.119155844156,0.098556998557
8013273D,"Estimating rate constants from single ion channel currents when the initial distribution is known",0.118055555556,0.15714686548
772EDB8B,"Detecting the Coevolution of Biosequences – An Example of RNA Interaction Prediction",0.346428571429,0.366964285714
7C04762F,"Finding the genes in genomic DNA",0.0744047619048,0.162698412698
7E4C90F1,"Using Markov models for web site link prediction",0.316666666667,0.278765678766
76C24AD0,"A segmentation concept for positron emission tomography imaging using multiresolution analysis",0.121933621934,0.14025297619
7BC10F56,"Deformable Markov model templates for time-series pattern matching",0.0875,0.129458041958
7E88D7B8,"UWB Channel Modeling: A Markovian Formulation Based on Degradation Level Concept",0.118055555556,0.135989010989
8085DB8D,"Sleep Control for Tracking in Sensor Networks",0.0959595959596,0.12468975469
792B2509,"Microbial gene identification using interpolated Markov models",0.106060606061,0.1418997669
7EBF944B,"Activity recognition using semi-Markov models on real world smart home datasets",0.133333333333,0.131818181818
7D4E713D,"On the Markovian approximation for block-errors in DS-CDMA transmissions over slow fading channels with multicarrier transmit diversity",0.125,0.1168997669
6C07427C,"Comparing probabilistic models for melodic sequences",0.0839160839161,0.143939393939
78703CF3,"Evaluating the markov assumption for web usage mining",0.125405844156,0.125622710623
7AAFB9B6,"Sequence comparisons using multiple sequences detect three times as many remote homologues as pairwise methods",0.102777777778,0.146608946609
7F53F81C,"Predicting the threshold of pulse-train electrical stimuli using a stochastic auditory nerve model: the effects of stimulus noise",0.111805555556,0.131291085458
7BC69AFE,"Estimation of Sojourn Time in Chronic Disease Screening Without Data on Interval Cases",0.127678571429,0.123313492063
7E7F0BD8,"Economic analysis of a phase III clinical trial evaluating the addition of total androgen suppression to radiation versus radiation alone for locally advanced prostate cancer (Radiation Therapy Oncology Group protocol 86-10)",0.125992063492,0.0955874774152
7E2D44E2,"Performance evaluation of frequency planning schemes in OFDMA-based networks",0.121933621934,0.134331409331
75A4C154,"Economic evaluation of irbesartan in combination with hydrochlorothiazide in the treatment of hypertension in Greece",0.121933621934,0.0953757571405
76CFFFE8,"Is universal screening for thyroid disease in pregnancy a cost-effective strategy?",0.0839160839161,0.157316017316
7C9B27B7,"Poverty dynamics corrected for measurement error",0.116883116883,0.12961038961
7DC07278,"Adaptive terminal to base station assignment in BFWA systems",0.0940170940171,0.133943833944
7ADAC005,"Diagnosis of Performance Faults in LargeScale MPI Applications via Probabilistic Progress-Dependence Inference",0.177489177489,0.164682539683
5C2535CD,"An Integrated Deterministic and Nondeterministic Inference Algorithm for Sequential Labeling",0.326495726496,0.402777777778
80647EBF,"Improved buffer control of Fano decoders using channel memory",0.115277777778,0.154242979243
5F65D824,"Augmenting Gesture Animation with Motion Capture Data to Provide Full-Body Engagement",0.12987012987,0.141617063492
7F54C0DC,"The 4M (mixed memory Markov Model) algorithm for finding genes in prokaryotic genomes",0.108333333333,0.129531579532
7C597D7E,"Multiband segmentation based on a hierarchical Markov model",0.0820221445221,0.146124708625
5C0F33AC,"Using Multiattribute Prediction Suffix Graphs for Spanish Part-of-Speech Tagging",0.331168831169,0.389880952381
790A74A2,"An integrated model for next page access prediction",0.307692307692,0.311417748918
80A367E8,"Simulation of real-world vehicle missions using a stochastic Markov model for optimal design purposes",0.106060606061,0.124604562105
7DAA82B4,"Performance evaluation of cluster-based target tracking protocols for wireless sensor networks",0.12987012987,0.10662202381
80F6961E,"Labelling the Structural Parts of a Music Piece with Markov Models",0.103896103896,0.129220779221
7DD2BAAB,"Combined Markov Model for Packet Loss Characterization in UMTS Channels",0.120941558442,0.136646224146
7C174AE8,"Optimal and suboptimal shape tracking based on multiple switched dynamic models",0.0893939393939,0.176262626263
7A9A4576,"Description and Prediction of the Development of Metabolic Syndrome: A Longitudinal Analysis Using a Markov Model Approach",0.347222222222,0.229141845809
796D0468,"Use of lexical and syntactic techniques in recognizing handwritten text",0.124206349206,0.130158730159
7616423F,"Combining a Budgetary-Impact Analysis and a Cost-Effectiveness Analysis Using Decision-Analytic Modelling Techniques",0.101388888889,0.167592592593
7F150819,"Minimizing Costs While Meeting Safety Requirements: Modeling Deterministic (Imperfect) Staggered Tests Using Standard Markov Models for SIL Calculations",0.123214285714,0.154941701817
7DEC51CC,"Scheduling in wireless cellular networks under probabilistic channel information",0.135227272727,0.139722222222
78BC7807,"Assigning phrase breaks from part-of-speech sequences.",0.1125,0.139204545455
809E06A2,"A New Method for Modeling and Evaluation of the Probability of Attacker Success",0.130456349206,0.124592999593
7B9A082C,"The probability of error detection in sequential circuits using random test vectors",0.310714285714,0.252380952381
7AB087A4,"Multiple primary tumours: incidence estimation in the presence of competing risks",0.0875,0.130303030303
7F8D3B50,"Learning Behaviour Models of Human Activities",0.133333333333,0.19696969697
8023A4BA,"VOMBAT: prediction of transcription factor binding sites using variable order Bayesian trees.",0.369047619048,0.254295183983
78F7FA4E,"Prophylactic splenectomy and cholecystectomy in mild hereditary spherocytosis: analyzing the decision in different clinical scenarios",0.108333333333,0.14803030303
8153DFA3,"Modeling and analyzing the effects of periodic inspection on the performance of safety-critical systems",0.10101010101,0.132601657602
7D9BDA5E,"Generalized approach for modeling minimally invasive surgery as a stochastic process using a discrete Markov model",0.116883116883,0.147764735265
751DEFC9,"Computational chemistry study of 3D‐structure‐function relationships for enzymes based on Markov models for protein electrostatic, HINT, and van der Waals potentials",0.125,0.131526806527
8135A687,"Dependability analysis of systems with on-demand and active failure modes, using dynamic fault trees",0.121933621934,0.133950251138
79898E11,"Economic Impact and Long-Term Graft Outcomes of Mycophenolate Mofetil Dosage Modifications Following Gastrointestinal Complications in Renal Transplant Recipients",0.121933621934,0.119708994709
7BAC6BED,"Dynamic fault tree analysis using Monte Carlo simulation in probabilistic safety assessment",0.127678571429,0.140844671202
814495FC,"Performability analysis using semi-Markov reward processes",0.116883116883,0.169552669553
02A727D0,"Integrated detection, estimation, and guidance in pursuit of a maneuvering target",0.136805555556,0.135648148148
7770F0F1,"Hidden-articulator Markov models for speech recognition",0.145454545455,0.114685314685
76FD7375,"Channel Allocation Scheme for Handoff Control in Wireless Ad Hoc Network with Group Mobility",0.131944444444,0.107798729049
7C7C2B02,"Pharmacoeconomic Analyses Using Discrete Event Simulation",0.145833333333,0.180555555556
7B5C7882,"Selecting and implementing phase approximations for semi-Markov models",0.108333333333,0.151893939394
7F87FD28,"Image categorization by learning with context and consistency",0.10101010101,0.151515151515
7F7C8B65,"Cost‐effectiveness analysis in colorectal cancer using a semi‐Markov model",0.0975135975136,0.148544266191
7B904FEA,"Transformations that Preserve Detailed Balance in Markov Models",0.10101010101,0.12397047397
7F6293CC,"Loss classification in optical burst switching networks using machine learning techniques: improving the performance of TCP",0.11875,0.164285714286
8033838C,"Comparing Stochastic Approaches to Spoken Language Understanding in Multiple Languages",0.116666666667,0.197222222222
79DD7CA8,"Cost-effectiveness of ranibizumab compared with pegaptanib in neovascular age-related macular degeneration",0.0875,0.175
7E6F0B7C,"A Model-Based Approach to the Analysis of Patterns of Length of Stay in Institutional Long-Term Care",0.142361111111,0.123148148148
7E64C798,"Modeling the relationships between land use and land cover on private lands in the Upper Midwest, USA",0.127678571429,0.107637154512
5AFC6916,"State aggregation in higher order markov chains for finding online communities",0.139583333333,0.133693092622
7E111CA2,"Bayesian Variable Order n-gram Language Model based on Hierarchical Pitman-Yor Processes",0.15,0.180086580087
7A05A757,"Varenicline: A Pharmacoeconomic Review of its Use as an Aid to Smoking Cessation",0.121933621934,0.138975468975
78F5FEE0,"Development of dual-retrieval processes in recall: Learning, forgetting, and reminiscence",0.183441558442,0.147142857143
75C90C0F,"Gene prediction and gene classes in Arabidopsis thaliana",0.323232323232,0.27094017094
7D594FC7,"Markov Encoding for Detecting Signals in Genomic Sequences",0.116666666667,0.1468997669
75D1952A,"Fast Markovian method for dynamic safety analysis of process plants",0.124206349206,0.107301587302
7CB11C0D,"A First Order Markov Model for Use in the Human Services",0.128787878788,0.117693417693
7E4719AD,"Phylogenetics by likelihood: Evolutionary modeling as a tool for understanding the genome",0.0875,0.137619047619
7AF7BB37,"An Appraisal of Methods for the Analysis of Longitudinal Ordinal Response Data with Random Dropout Using a Nonhomogeneous Markov Model",0.114583333333,0.12512950013
7DD5B33E,"Cost-effectiveness of ranibizumab compared with photodynamic treatment of neovascular age-related macular degeneration",0.101388888889,0.153703703704
8090CBAF,"Likelihood for Generally Coarsened Observations from Multistate or Counting Process Models",0.119155844156,0.159794372294
769C66A6,"Full-Coverage Web Prediction based on Web Usage Mining and Site Topology",0.346428571429,0.256802721088
7F294D9E,"Buprenorphine Prescription Compliance: An Original Observational and Longitudinal Study",0.126893939394,0.130555555556
06E42C7D,"Discovery of Significant Usage Patterns from Clusters of Clickstream Data",0.142361111111,0.125694444444
7DABFA0C,"Developing high-level reliability languages using a general intermediate domain",0.0804195804196,0.169696969697
7E44A96E,"Enhancing security using mobility-based anomaly detection in cellular mobile networks",0.104482323232,0.146688959189
75359126,"Where to treat the older patient? Can Markov models help us better understand the relationship between hospital and community care?",0.11875,0.152693602694
77A2FC6A,"Approximating stationary measures of structured continuous-time Markov models using matrix diagrams",0.0874125874126,0.137567987568
7E108A1C,"Abstraction Augmented Markov Models",0.0875,0.130303030303
64DDC74F,"Dependability of IT Systems in Emergency Situations – Theory and Practice",0.149206349206,0.1203000703
7825B413,"Using observation ageing to improve markovian model learning in QoS engineering",0.106060606061,0.195526695527
6D72A4C0,"Investigation of the multimedia adaptive threshold strategy for mobile integrated services networks",0.131944444444,0.118548465423
7697CD10,"Unsaturated Throughput Analysis of IEEE 802.11 in Presence of Non Ideal Transmission Channel and Capture Effects",0.119155844156,0.108792001649
7ADA5F26,"Stochastic entropy QSAR for the in silico discovery of anticancer compounds: Prediction, synthesis, and in vitro assay of new purine carbanucleosides",0.358333333333,0.23192125335
806718B5,"A FPGA based coprocessor for gene finding using Interpolated Markov Model (IMM)",0.0820221445221,0.208527583528
