7AE04577,"Effects of stochastic channel gating and distribution on the cardiac action potential",0.136111111111,0.12521043771
8106427C,"Exploring peer heterogeneity: Towards understanding and application",0.106060606061,0.166515151515
7A2C7957,"Cost Effectiveness of Ultrasound and Bone Densitometry for Osteoporosis Screening in Post-Menopausal Women",0.120941558442,0.0933576839827
7D0FB23C,"Markov Model Based Jamming and Anti-Jamming Performance Analysis for Cognitive Radio Networks",0.106060606061,0.124624854312
7CD6EC5C,"Efficient mobile phone Chinese optical character recognition systems by use of heuristic fuzzy rules and bigram Markov language models",0.138095238095,0.0986097236097
7F66FBF2,"Energy Efficient Sensor Scheduling with a Mobile Sink Node for the Target Tracking Application",0.111111111111,0.125736416361
7D7214B6,"New cross-Layer design approach to ad hoc networks under Rayleigh fading",0.119949494949,0.11595959596
7FC78760,"Traffic specifications for the transmission of stored MPEG video on the Internet",0.120941558442,0.112539081289
80E3968D,"Using hidden multi-state Markov models with multi-parameter volcanic data to provide empirical evidence for alert level decision-support",0.109027777778,0.14976967477
78F94C3E,"Estimation in a model for a semi-Markov process with covariates under right-censoring",0.119155844156,0.111255411255
7EC9B41E,"Generating a New Model for Predicting the Next Accessed Web Page in Web Usage Mining",0.119155844156,0.125912183055
7AD598EC,"On predictive modeling for optimizing transaction execution in parallel OLTP systems",0.121428571429,0.113956043956
10858314,"A dynamic load balancing strategy for channel assignment using selective borrowing in cellular mobile environment",0.110227272727,0.141117909868
7FA7ACFF,"ECF estimation of Markov models where the transition density is unknown",0.103282828283,0.132601657602
7CC46B3F,"Stochastic molecular descriptors for polymers. 2. Spherical truncation of electrostatic interactions on entropy based polymers 3D-QSAR",0.119155844156,0.128266971124
7D9AF245,"Using Two-Dimensional Markov Models and the Effective-Capacity Approach for Cross-Layer Design in AMC/ARQ-Based Wireless Networks",0.106060606061,0.126555389055
5FBF2500,"Learning predictive models from massive, semantically disparate data",0.0959595959596,0.178451178451
7A87F5CE,"Cross-Layer Design of Combining HARQ with Adaptive Modulation and Coding for Nakagami-m Fading Channels",0.108333333333,0.140614478114
7F0BA60E,"MIMO channel capacity modeling using Markov models",0.107954545455,0.161363636364
7EBE7861,"Cost effectiveness of 5-alpha reductase inhibitors for the prevention of prostate cancer in multiple patient populations.",0.121933621934,0.0922749635985
7A8FBA09,"Mining user access patterns with traversal constraint for predicting web page requests",0.13125,0.129421768707
729A396F,"A Latent Markov Model to Correct for Measurement Error",0.116883116883,0.127672327672
7E2D3C0B,"Identification of independent modules in fault trees which contain dependent basic events",0.145833333333,0.145337301587
76E03C78,"Markov cohort simulation study reveals evidence for sex-based risk difference in intensive care unit patients",0.121527777778,0.101783216783
7D055FA2,"Kernel-based discriminative learning algorithms for labeling sequences, trees, and graphs",0.126984126984,0.133372414622
7BC255F7,"A HMM-based adaptive fuzzy inference system for stock market forecasting",0.196428571429,0.162137862138
785FA1D3,"Which screening strategy using BMD measurements would be most cost effective for hip fracture prevention in elderly women? A decision analysis based on a Markov model",0.116883116883,0.158475849547
78113483,"Choice between Semi‐parametric Estimators of Markov and Non‐Markov Multi‐state Models from Coarsened Observations",0.125,0.132138694639
7789EE4A,"On the equality of usual and amemiya's partially generalized least squares estimator",0.0875,0.12380952381
79FF4124,"Model-based performance evaluation of distributed checkpointing protocols",0.12987012987,0.132275132275
7A310B97,"Novel 2D maps and coupling numbers for protein sequences. The first QSAR study of polygalacturonases; isolation and prediction of a novel sequence from Psidium guajava L.",0.325,0.181530590621
79206D15,"Two fundamental questions about protein evolution",0.545833333333,0.392307692308
7ECC05B5,"Spoken language understanding using the Hidden Vector State Model",0.116666666667,0.179834054834
7742D5C7,"Fecal DNA testing compared with conventional colorectal cancer screening methods: a decision analysis",0.113005050505,0.140934290383
5946BD52,"Predicting Mean Service Execution Times of Software Components Based on Markov Models",0.110227272727,0.128881303881
803F8043,"Farm Structural Change in German Regions - An Empirical Analysis using Micro and Macro Data",0.115277777778,0.133400329829
81754437,"Understanding Human Behavior Using a Language Modeling Approach",0.138095238095,0.193253968254
7C845417,"Locating proteins in the cell using TargetP, SignalP and related tools.",0.0744047619048,0.153003663004
782FD091,"Heterogeneous marital behavior in Belgium 1970 and 1977: an application of the semi-Markov model to period data",0.121933621934,0.107248075998
81333B28,"Multitarget detection/tracking for monostatic ground penetrating radar: application to pavement profiling",0.108333333333,0.140833333333
752C00EB,"Benefit of carotid endarterectomy for symptomatic and asymptomatic severe carotid artery stenosis: a Markov model based on data from randomized controlled trials",0.113005050505,0.147653735154
5BD2EE85,"Adjusted Viterbi training for hidden Markov models",0.0804195804196,0.135708041958
8175357B,"Prediction of translation initiation site for microbial genomes with TriTISA",0.325,0.274285714286
7E4613D4,"Lexical access to large vocabularies for speech recognition",0.145454545455,0.106718500797
7EC60278,"A Statistical Based Part of Speech Tagger for Urdu Language",0.166666666667,0.183181818182
7EF88CEA,"Accurate approximation of ARQ packet delay statistics over Markov channels with finite round-trip delay",0.131944444444,0.113283475783
7E4388E7,"Statistical estimation by a linear combination of two given statistics",0.0959595959596,0.155341880342
7516BC5A,"The performance advantage of applying compression to the memory system",0.108333333333,0.137231287231
77C5E5B7,"SAR image segmentation using generalized pairwise Markov chains",0.0959595959596,0.144533475783
7BD2C6DC,"Packet-loss-resilient Internet video streaming",0.103896103896,0.135119047619
78752A97,"Evolutionary Profiles Derived from the QR Factorization of Multiple Structural Alignments Gives an Economy of Information",0.137121212121,0.176587301587
7A93F333,"Alternative decision modelling techniques for the evaluation of health care technologies: Markov processes versus discrete event simulation",0.145833333333,0.126978576979
77AB5867,"Comparing Methods of Data Synthesis: Re-Estimating Parameters of an Existing Probabilistic Cost-Effectiveness Model",0.10101010101,0.151875901876
810E8846,"Image and video compression algorithms based on recovery techniques using mean field annealing",0.106060606061,0.160237293571
7D2630AA,"Say EM’ for Selecting Probabilistic Models for Logical Sequences",0.0839160839161,0.170454545455
76B1D8D4,"Learning variable-length Markov models of behavior",0.116883116883,0.161005661006
79A02BD4,"The branching order of mammals: phylogenetic trees inferred from nuclear and mitochondrial molecular data.",0.133838383838,0.124272486772
6E14E1E6,"Spatial patterns of shrub cover after different fire disturbances in the Pyrenees",0.127678571429,0.102602258852
7E9A431F,"Accounting for Extensive Secondary Information to Improve Watertable Mapping",0.118181818182,0.175992063492
7D1DC33C,"Application of a new probabilistic model for recognizing complex patterns in glycans",0.11875,0.126893939394
79B440F7,"Clinical trial optimization: Monte Carlo simulation Markov model for planning clinical trials recruitment.",0.106060606061,0.129766414141
78BE5F1B,"A Multistate Model for Bivariate Interval‐Censored Failure Time Data",0.121933621934,0.113997113997
7ECD2258,"Blood Pressure Lowering and Life Expectancy Based on a Markov Model of Cardiovascular Events",0.145833333333,0.130259324009
7D899C13,"Model Averaging in the Presence of Structural Uncertainty about Treatment Effects: Influence on Treatment Decision and Expected Value of Information",0.135227272727,0.126957070707
80879ACD,"Stochastic Petri nets for the reliability analysis of communication network applications with alternate-routing",0.136111111111,0.111216329966
7FE26E35,"Bayesian choice among Markov models of ion channels using Markov chain Monte Carlo",0.126893939394,0.13328511766
7D7F4346,"Bayesian Segmental Models with Multiple Sequence Alignment Profiles for Protein Secondary Structure and Contact Map Prediction",0.34375,0.210822510823
7998AE4E,"Statistical analysis of geodetic deformation (strain rate) derived from the space geodetic measurements of BIFROST Project in Fennoscandia",0.127678571429,0.130725623583
76678A3C,"Hattendorff’s theorem for non-smooth continuous-time Markov models II: Application",0.120941558442,0.108922327672
766CCA4D,"Modeling and Analysis of Fault Detection and Fault Tolerance in Wireless Sensor Networks",0.130456349206,0.104567500401
7DDA0C14,"Analysis of self-stabilizing clock synchronization by means of stochastic Petri nets",0.121933621934,0.0972805788982
758DD04F,"Communication receivers based on Markov models of the fading channel",0.133333333333,0.144886363636
7ECC04F2,"Two-Stage user mobility modeling for intention prediction for location-based services",0.333333333333,0.265151515152
815E6E72,"Probabilistic Algebraic Analysis of Fault Trees With Priority Dynamic Gates and Repeated Events",0.145833333333,0.11085244121
625B8268,"Integrating recommendation models for improved web page prediction accuracy",0.545454545455,0.406685906686
78C857CE,"Inferring search behaviors using partially observable markov model with duration (POMD)",0.119155844156,0.155268540983
7A22832C,"Markov models of occupational mobility: Theoretical development and empirical support. Part 1: Careers†",0.127678571429,0.113975468975
7A617012,"An expanded GSLIB cokriging program allowing for two Markov models",0.0959595959596,0.151026751027
79BB0C1C,"Collocated Cokriging Based on Merged Secondary Attributes",0.0875,0.211111111111
760561D3,"Performance analysis of network and database transactions flow in a CIM system",0.119949494949,0.124793956044
5A773B36,"Exploring spatial vegetation dynamics using logistic regression and a multinomial logit model",0.0959595959596,0.148352573353
797599DB,"A cost-utility analysis of once daily solifenacin compared to tolterodine in the treatment of overactive bladder syndrome.",0.0956196581197,0.124444444444
7E32441B,"Incorporating process demand into models for assessment of safety system performance",0.144345238095,0.122516719392
76EE931F,"Cost Effectiveness of Darunavir/Ritonavir 600/100 mg bid in Treatment-Experienced, Lopinavir-Naive, Protease Inhibitor-Resistant, HIV-Infected Adults in Belgium, Italy, Sweden and the UK",0.147727272727,0.0901638938404
756F1886,"Fuse cutout allocation in radial distribution system considering the effect of hidden failures",0.121933621934,0.100608296932
7A2FFDEC,"MODELING ECOLOGICAL PROCESSES ACROSS SCALES",0.119155844156,0.136507936508
7ABF1301,"The influence of waiting times on cost-effectiveness: a case study of colorectal cancer mass screening",0.115277777778,0.141033496732
7630A0A3,"Cost Utility of Sirolimus versus Tacrolimus for the Primary Prevention of Graft Rejection in Renal Transplant Recipients in Mexico",0.133333333333,0.0957558066933
7C5B8E27,"Modeling and analysis of the packet-level loss process in wireless channels",0.119155844156,0.104133597884
7993B302,"A Web page prediction model based on click-stream tree representation of user behavior",0.346428571429,0.293921356421
7656E072,"Two matrix-based proofs that the linear estimator Gy is the best linear unbiased estimator",0.0959595959596,0.138888888889
7598E4EF,"Grouping/degrouping point process, a point process driven by geometrical and topological properties of a partition in regions",0.121933621934,0.109272671773
7F22336C,"Distributions of statistics used for the comparison of models of sequence evolution in phylogenetics",0.102777777778,0.129026529027
8041A6B8,"A Generalized Timed Petri Net Model for Performance Analysis",0.10101010101,0.128282828283
7FA4699C,"Learning your identity and disease from research papers: information leaks in genome wide association study",0.128282828283,0.136545244879
7BC2CF76,"EM procedures using mean field-like approximations for Markov model-based image segmentation",0.135822510823,0.154701779702
77994DF2,"Well-being Analysis of Phasor Measurement Unit Using Markov Model and Event Tree",0.145833333333,0.145498350855
7D94A83A,"Improving Web Page Prediction Using Default Rule Selection",0.344155844156,0.286961451247
79F1D20C,"Incorporating margin status information in treatment decisions for women with ductal carcinoma in situ: a decision analysis",0.135227272727,0.11797979798
803D11F1,"Buried Markov models for speech recognition",0.145454545455,0.141748251748
7D080031,"Wireless link simulations using multi-level Markov models",0.103282828283,0.129129435379
79A859C5,"NUMERIC AND EXACT SOLUTIONS OF THE NONLINEAR CHAPMAN–KOLMOGOROV EQUATION: A CASE STUDY FOR A NONLINEAR SEMI-GROUP MARKOV MODEL",0.123214285714,0.104433066933
7E034834,"Channel-state based scheduling in wireless sensor networks for reliable transmission",0.113005050505,0.135747354497
7D16F82B,"Performance Evaluation of Multiple-Relay Cooperative ARQ Strategies for Mobile Networks",0.121933621934,0.113997113997
814B8EF5,"Markov Model Based Disk Power Management for Data Intensive Workloads",0.113005050505,0.137071262071
7EE9C68D,"Haplotype inference based on Hidden Markov Models in the QTL-MAS 2010 multi-generational dataset",0.15,0.1868997669
7C176E63,"Nonparametric inference based on panel count data",0.156565656566,0.19094017094
7E60849D,"On verifying a first-order Markovian model for the multi-threshold success/failure process for Rayleigh channel",0.116883116883,0.152191558442
7EE73749,"Co-evolution is Incompatible with the Markov Assumption in Phylogenetics",0.0848214285714,0.178418803419
781925F9,"Human Action Segmentation and Recognition Using Discriminative Semi-Markov Models",0.133333333333,0.15303030303
7F0F0FD1,"Using Markov Models to Find Interesting Patient Pathways",0.0820221445221,0.163388694639
7EAA49C2,"Estimating the Extent of Tracking in Interval‐Censored Chain‐Of‐Events Data",0.0959595959596,0.156944444444
7EC351C0,"Estimation of Operating Characteristics for Dependent Diagnostic Tests Based on Latent Markov Models",0.0991758241758,0.139155289155
75FC9D1D,"A Systematic Model Specification Procedure for an Illness-Death Model without Recovery",0.12987012987,0.111688311688
795B4EED,"Using a five-state model for fitting amplitude histograms from MaxiK channels: beta-distributions reveal more than expected.",0.113005050505,0.182431457431
7095B8E1,"Understanding State Space Organization in Recurrent Neural Networks with Iterative Function Systems Dynamics",0.10625,0.126430860806
76A52360,"Markov and Neural Network Models for Prediction of Structural Deterioration of Storm-Water Pipe Assets",0.323232323232,0.219412531913
7E0E0D8B,"Hidden Markov random field model selection criteria based on mean field-like approximations",0.140873015873,0.141889856176
77A82973,"Pharmacokinetic–pharmacodynamic modeling of fostamatinib efficacy on ACR20 to support dose selection in patients with rheumatoid arthritis (RA)",0.116883116883,0.125657081014
7DFD408F,"Modeling Changes in Maintenance Activities through Fine-Tuning Markov Models of Ageing Equipment",0.133333333333,0.120296370296
77DB19F4,"Comparison of Markov model and fault tree approach in determining initiating event frequency for systems with two train configurations",0.145833333333,0.134305088851
7FA39165,"Markov Model Assessment of Subjects' Clinical Skill Using the E-Pelvis Physical Simulator",0.13125,0.145404595405
812601C3,"Architectural-level risk analysis using UML",0.0975135975136,0.178451178451
78F63B9C,"Cost Effectiveness of Nasal Calcitonin in Postmenopausal Women: Use of Cochrane Collaboration Methods for Meta-Analysis Within Economic Evaluation",0.124206349206,0.107841810967
7AA596E6,"Reformulating Markovian processes for learning and memory from a hazard function framework",0.126984126984,0.143604411462
7E648701,"Optimization of Markov Models with Evolutionary Strategies Based on Exact and Approximate Analysis Techniques",0.101388888889,0.129026529027
68024695,"Inducing hidden Markov models to model long-term dependencies",0.0959595959596,0.129121989122
7DAEE108,"Formalisation of transformation-based learning",0.113997113997,0.126984126984
5EB45AA6,"Integrated Building Heating, Cooling and Ventilation Control",0.0958333333333,0.129487179487
5D83DD1C,"Predicting users' requests on the WWW",0.118181818182,0.124066558442
7FB592E2,"An Overview of Markov Chain Methods for the Study of Stage-Sequential Developmental Processes.",0.134920634921,0.110776260776
7971C978,"An analysis of a use bit page replacement algorithm",0.119155844156,0.115238095238
7D8F98D9,"Markov model aided decoding for image transmission using soft-decision-feedback",0.113005050505,0.158896658897
7C216EF5,"Discrete Time Non-Homogeneous Semi-Markov Reliability Transition Credit Risk Models and the Default Distribution Functions",0.125,0.110549943883
7B0B31F3,"Utility of genotyping of Mycobacterium tuberculosis in the contact investigation: A decision analysis",0.125,0.103717769159
7F7079FE,"The approximate analysis of reliability of large-scale parallel communication networks with various subsystem configuration",0.136111111111,0.115151515152
5FB4BF16,"On the theory and applications of sequence based estimation of independent binomial random variables",0.1375,0.158207070707
812F777E,"An Empirical Study of Two Approaches to Sequence Learning for Anomaly Detection",0.102083333333,0.165
80171B00,"Modelling Internet End-to-End Loss Behaviors: A Congestion Control Perspective",0.124206349206,0.120105820106
5DE776C3,"The Real Nature of Credit Rating Transitions",0.125,0.125
81359B39,"Research on secrecy capacity oriented relay selection for mobile cooperative networks",0.121933621934,0.11990311276
80680E65,"Two Cache Replacement Algorithms Based on Association Rules and Markov Models",0.105555555556,0.123756798757
142E20DE,"Cost-Analyses Studies in Barrett’s Esophagus: What Is Their Utility?",0.0870879120879,0.145421245421
5EE9C627,"The Peres-Shields Order Estimator for Fixed and Variable Length Markov Models with Applications to DNA Sequence Similarity.",0.133838383838,0.116094707761
7CFF37FE,"Unsupervised frequency tracking beyond the Nyquist frequency using Markov chains",0.0875,0.153792735043
7196CC78,"On the Spectrum Handoff for Cognitive Radio Ad Hoc Networks without Common Control Channel",0.126893939394,0.106028693529
78991499,"Prediction of SPI Drought Class Transitions Using Markov Chains",0.333333333333,0.282496438746
816A5796,"Performance analysis of a controlled database unit subject to decision errors and control delays",0.135822510823,0.120982142857
77676000,"A Data-Driven Predictive Approach for Drug Delivery Using Machine Learning Techniques",0.108441558442,0.134075448361
79D462C0,"Computing cumulative measures of stiff Markov chains using aggregation",0.10625,0.148110916861
7852BB29,"A speech recognition method based on the sequential multi-layer perceptrons",0.320404040404,0.347070707071
59945C19,"A Method to Improve the Performance of Translation Start Site Detection and Its Application for Gene Finding",0.127678571429,0.123095238095
7E3AE077,"StressTest: an automatic approach to test generation via activity monitors",0.136111111111,0.129841269841
7F119526,"Improved loss calculations at an ATM multiplexer",0.108333333333,0.126515151515
7C191EFC,"Unified drug–target interaction thermodynamic Markov model using stochastic entropies to predict multiple drugs side effects",0.119155844156,0.128003478003
78D86314,"A Markov model for switching regressions",0.0820221445221,0.124747474747
813E5C77,"Discriminative human action segmentation and recognition using semi-Markov model",0.133333333333,0.15303030303
79DAC74A,"Modelling a Spontaneously Reported Side Effect by Use of a Markov Mixed-Effects Model",0.116883116883,0.12683982684
771C7435,"Stemming resource-poor Indian languages",0.116666666667,0.208333333333
76A259C5,"Is B-type natriuretic peptide-guided heart failure management cost-effective?",0.116883116883,0.173024891775
8093C144,"Within a smoking-cessation program, what impact does genetic information on lung cancer need to have to demonstrate cost-effectiveness?",0.133333333333,0.17381989833
7876C658,"Using Markov models to incorporate serial dependence in studies of vegetation change.",0.292222222222,0.235006043339
80F56F63,"Generating and Evaluating Musical Harmonizations That Emulate Style",0.0959595959596,0.167777777778
7C6EC647,"In silico discovery of enzyme-substrate specificity-determining residue clusters.",0.133333333333,0.133333333333
7F8329E1,"Learning first-order Markov models for control",0.0893939393939,0.150291375291
5D96BF37,"Markov Tree Prediction on Web Cache Prefetching",0.316666666667,0.288717948718
7BB3773E,"Stochastic Algorithms for Markov Models Estimation with Intermittent Missing Data",0.106060606061,0.137231287231
7B3BA4D5,"Evolution of a time dependent Markov model for training and recruitment decisions in manpower planning",0.119155844156,0.109745501412
7F9C3070,"Bayesian variational approximation for the joint detection estimation of brain activity in fMRI",0.15,0.120111832612
786BF9F2,"A Markov model for interspike interval distributions of auditory cortical neurons that do not show periodic firings",0.106060606061,0.161315536316
8107FBFD,"THE ESTIMATION OF POVERTY DYNAMICS USING DIFFERENT MEASUREMENTS OF HOUSEHOLD INCOME",0.119155844156,0.129480043766
7EAC4F97,"Cost-Effectiveness Analysis of CT Colonography for Colorectal Cancer Screening Program to Working Age in Japan",0.111111111111,0.133915441176
772A13CE,"Unify QSAR approach to antimicrobials. Part 1: Predicting antifungal activity against different species",0.139583333333,0.116515151515
7B2D057A,"Coordinating mobile robot group behavior using a model of interaction dynamics",0.134920634921,0.144959802103
7F1180BD,"Accurate and Fast Simulation of Channel Noise in Conductance-Based Model Neurons by Diffusion Approximation",0.126893939394,0.109590806019
78E2794D,"Routine treatment of insulin-dependent diabetic patients with ACE inhibitors to prevent renal failure: An economic evaluation",0.116883116883,0.150733525734
7CD81D92,"Economic evaluation of ezetimibe combined with simvastatin for the treatment of primary hypercholesterolaemia",0.116883116883,0.143849206349
7EE767C1,"Joint velocity estimation and symbol detection in non-stationary fading channels by particle filtering",0.129464285714,0.110667903525
79D6F30E,"HBBA : Hybrid Algorithm for Buffer Allocation in Tandem Production Lines",0.133333333333,0.109121989122
7D7DC07E,"Characterization of Single Channel Currents Using Digital Signal Processing Techniques Based on Hidden Markov Models",0.123214285714,0.152642727643
7D379A7D,"Robust part-of-speech tagging using a hidden Markov model",0.0804195804196,0.175291375291
824FC04F,"Methods Used in Economic Evaluations of Chronic Kidney Disease Testing — A Systematic Review",0.121933621934,0.148072562358
7E63D3E5,"An interpolated Markov model polishes Gibbs sampling's ability in detecting regulatory elements",0.0959595959596,0.125563325563
7E2807E1,"A Mixed Markov model for change detection in aerial photos with large time differences",0.121527777778,0.101640423069
7545182C,"The cost effectiveness and cost utility of valsartan in chronic heart failure therapy in Italy: a probabilistic markov model.",0.119155844156,0.0900610752883
80008ABB,"Label Disambiguation and Sequence Modeling for Identifying Human Activities from Wearable Physiological Sensors",0.136111111111,0.134302205731
81438285,"Learning significant locations and predicting user movement with GPS",0.108333333333,0.153571428571
7A791658,"Asymptotic theory for the Cox semi-Markov illness-death model",0.107692307692,0.145454545455
766F533C,"Progress in protein structure prediction: Assessment of CASP3",0.316287878788,0.275233100233
7D7AE36C,"An Algorithm to Compute the Character Access Count Distribution for Pattern Matching Algorithms",0.111805555556,0.131397306397
7EC3DB9C,"Modeling the 802.11e Enhanced Distributed Channel Access Function",0.113005050505,0.138161375661
7830FF45,"Multi-agent activity recognition using observation decomposedhidden Markov models",0.133333333333,0.14729020979
7F327DE6,"Cost-effectiveness of Four Immunomodulatory Therapies for Relapsing-Remitting Multiple Sclerosis: A Markov Model Based on Long-term Clinical Data",0.0959595959596,0.129102379102
78C777D8,"Wavelet-based protocols for ion channel electrophysiology",0.119047619048,0.113095238095
75820F18,"Data-Driven Channel Modeling Using Spectrum Measurement",0.116883116883,0.191964285714
7D7ACA93,"Identifying bacterial genes and endosymbiont DNA with Glimmer",0.10101010101,0.128968253968
80A3CB1D,"Defect level estimation for pseudorandom testing using stochastic analysis",0.106060606061,0.171111111111
77D6D781,"Investigating purchasing-sequence patterns for financial services using Markov, MTD and MTDg models",0.111805555556,0.164546102046
7D80D2E2,"An introduction to hidden Markov models",0.091958041958,0.150291375291
