Paper ID,Title,Sim1,Sim2
79B71C36,"Neighbor Cardinality Estimation with Low-Power Transceivers: Implementation and Experimental Results",0.145,0.123888888889
7BC3262B,"Permittivity Estimation Using Coupling of Commercial Ground Penetrating Radars",0.123181818182,0.159916472416
5BF4D758,"The Dynamics and the Uncertainty of Delays at Signals",0.120793650794,0.112797619048
7E4814BC,"Diffusion kurtosis imaging: Robust estimation from DW-MRI using homogeneous polynomials",0.27117003367,0.29212962963
7B5C3CD1,"Estimation of diurnal air temperature using MSG SEVIRI data in West Africa",0.152222222222,0.15266955267
80723C5C,"Estimating the Rate of Erosion of a Silty Sand Treated with Lignosulfonate",0.113015873016,0.132222222222
7EDC8BBD,"Effect of form and of quality of feed on the concentrations of purine derivatives in urinary spot samples, daily microbial N supply and predictability of intake",0.153015873016,0.117275246121
8144F719,"A Nonparametric Density Estimation Method for Brand Choice Using Scanner Data",0.131753246753,0.144506287363
807C78EC,"Ionospheric effects in SAR interferometry: An analysis and comparison of methods for their estimation",0.10531968032,0.110642135642
7BD747F0,"An experimental malabsorption syndrome induced by neomycin",0.112051282051,0.125
75B8DC9A,"Travel time estimation for urban road networks using low frequency probe vehicle data",0.129444444444,0.12797979798
78549024,"The Minimum Risk Principle That Underlies the Criteria of Bounded Component Analysis",0.140793650794,0.137868480726
80A2EF3A,"Quipu: A Statistical Model for Predicting Hardware Resources",0.117070707071,0.107722832723
802AF2FE,"A mobile vision system for robust multi-person tracking",0.266524216524,0.330555555556
8155CD9C,"Capacity, bandwidth and available bandwidth concepts for wireless ad hoc networks",0.128975468975,0.106000348857
7E1F5B14,"Battery state estimation using Unscented Kalman Filter",0.1068997669,0.132467532468
5D5F806C,"Vessels traffic estimation through image processing applied to acquisitions by hydrophones",0.149126984127,0.149376417234
810CF633,"Somatotopic distortion of tactile temporal interval estimation",0.132222222222,0.106481481481
7E8300EF,"Robust shadow and illumination estimation using a mixture model",0.273021885522,0.264971139971
7F03AB0D,"Modeling reverberation time series for shallow water clutter environments",0.307222222222,0.246825396825
7E7606CF,"Effects of facial alignment for age estimation",0.140404040404,0.118560606061
803EBDE0,"An effective lifestyle intervention in overweight children: One-year follow-up after the randomized controlled trial on “Obeldicks light”",0.15746031746,0.172619047619
76B133FF,"On the Expected Likelihood Approach for Assessment of Regularization Covariance Matrix",0.11746031746,0.126587301587
7F8CE152,"Linear MMSE MIMO Channel Estimation with Imperfect Channel Covariance Information",0.131197691198,0.116031746032
594030A5,"Image denoising using wavelet transform and wiener filter based on log energy distribution over Poisson-Gaussian noise model",0.140324675325,0.155237439328
7C2C26B1,"Location, Location, Location",0.108181818182,0.125
805B78B3,"Fast tag searching protocol for large-scale RFID systems",0.11303030303,0.174747474747
7D6CB25E,"Data Estimation in Sensor Networks Using Physical and Statistical Methodologies",0.122626262626,0.136784511785
81679456,"Nonminimum-phase equalization and its subjective importance in room acoustics",0.145404040404,0.123232323232
7D5977DE,"Learning effective human pose estimation from inaccurate annotation",0.108414918415,0.169191919192
7C70A856,"Direction finding in partly calibrated uniform linear arrays with unknown gains and phases",0.122626262626,0.157744107744
7FBB93BF,"A very efficient time and frequency synchronization method for OFDM systems operating in AWGN channels",0.139365079365,0.126927437642
80FEC582,"Memory subsystem simulation in software TLM/T models",0.116197691198,0.114682539683
7FD1F9F5,"Far-Field Speaker Recognition",0.275252525253,0.555555555556
78C905DE,"Remote estimation of chl- a concentration in turbid productive waters — Return to a simple two-band NIR-red model?",0.144444444444,0.117777777778
7E6528A4,"Estimation-based ILC applied to a parallel kinematic robot",0.0958333333333,0.208333333333
7FE1EA30,"Statistical model for link lengths in optical transport networks",0.152222222222,0.143055555556
843B04BB,"Analyzing the non-functional requirements to improve accuracy of software effort estimation through case based reasoning",0.155086580087,0.178571428571
79CD1D8D,"Time Series Analysis for Congestion Detection in TCP/AQM Networks",0.112626262626,0.118518518519
7A28077F,"A Decentralized Stay-Time Based Occupant Distribution Estimation Method for Buildings",0.136753246753,0.175396825397
7DE80EA5,"Monaural sound-source-direction estimation using the acoustic transfer function of an active microphone",0.127626262626,0.144841269841
762F0C95,"Probabilistic gaze estimation without active personal calibration",0.129121989122,0.116666666667
7D92320E,"Relative pitch estimation of multiple instruments",0.129696969697,0.113636363636
814408C1,"Directional descriptors using zernike moment phases for object orientation estimation in underwater sonar images",0.137546897547,0.135165528916
789AFDB2,"Use of generalized linear models in analyzing the catch and effort data on the western king prawn Penaeus latisulcatus Kishinouye in the Gulf St. Vincent, Australia",0.146349206349,0.14015984016
80BB95F2,"Predictive Control With Novel Virtual-Flux Estimation for Back-to-Back Power Converters",0.128975468975,0.110524891775
7FABD516,"State estimation for batch distillation operations with a novel extended Kalman filter approach",0.135238095238,0.113011063011
766500AC,"Children's Understanding of Instructions Presented in Noise and Reverberation",0.316666666667,0.287581699346
80E3478F,"Blind separation of instantaneous mixture of sources based on order statistics",0.141587301587,0.153511303511
7F2CA5CB,"Estimation of EEG during Voluntary Movement by Using Kalman Smoother Based BMFLC",0.125238095238,0.178296703297
7E87AB9C,"Optimal transmit power allocation in wireless sensor networks performing field reconstruction",0.128975468975,0.126588689089
80C8AE58,"3Deflicker from motion",0.104848484848,0.111111111111
751443FD,"A submicromolar assay for nonpolar acids in plasma and depot fat.",0.112455322455,0.090404040404
77E65E70,"Intrinsic Filtering on Lie Groups With Applications to Attitude Estimation",0.147936507937,0.125324675325
5E4A380A,"On the human pose recovery based on a single view",0.122137862138,0.192063492063
8025CB78,"Cooperative federated filtering approach for enhanced position estimation and sensor fault tolerance in ad-hoc vehicle networks",0.144126984127,0.115528298862
82BD401C,"The determination of serum cholesterol.",0.176767676768,0.222610722611
734C645A,"Carrier signal injection based sensorless control of permanent magnet synchronous machines without the need of magnetic polarity identification",0.320555555556,0.239337822671
7E29E79B,"Image-based pose estimation for 3-D modeling in rapid, hand-held motion",0.122626262626,0.0981481481481
79BEC26B,"Estimation of heritabilities, genetic correlations, and breeding values of four traits that collectively define hip dysplasia in dogs",0.149126984127,0.142107583774
77AE7346,"Rewriting systems over similarity and generalized pseudometric spaces and their properties",0.129126984127,0.140939153439
802C40C2,"Learning a Tracking and Estimation Integrated Graphical Model for Human Pose Tracking",0.122051282051,0.166666666667
8003218C,"A comparative study on time delay estimation in reverberant and noisy environments",0.128888888889,0.108888888889
7E4192AC,"Power constrained linear estimation of correlated sources in hierarchical wireless sensor networks",0.130793650794,0.102320695178
8067F7DC,"FSM-based Wi-Fi power estimation method for smart devices",0.135324675325,0.127976190476
7F31D2FB,"Estimation of Critical Headways at Unsignalized Intersections: A Microscopic Approach",0.118888888889,0.0963383838384
81CDF907,"Local minima-free adaptive tdoa estimation for acoustic sources in presence of high spatial aliasing",0.123181818182,0.102777777778
7A249BDC,"Allometric equations for accurate estimation of above-ground biomass in logged-over tropical rainforests in Sarawak, Malaysia",0.11303030303,0.0879148629149
7CB8FBE5,"Photometric Stereo in the Wild",0.128975468975,0.10989010989
7E18BEE7,"Efficient MMSE Estimation and Uncertainty Processing for Multienvironment Robust Speech Recognition",0.290939153439,0.271494708995
822AFE12,"An L1/2-norm based efficient block level rate estimation model for HEVC",0.144444444444,0.158333333333
7578669C,"FTV for 3-D Spatial Communication",0.141666666667,0.2
7D349B27,"Estimation of component concentrations in biological systems via Interval Analysis",0.147222222222,0.127083333333
7D44DC22,"Motion invariance and custom blur from lens motion",0.122546897547,0.119378306878
80EAD143,"Estimation abilities of large numerosities in Kindergartners",0.139365079365,0.123511904762
77592393,"Guided execution of hybrid similarity-measures for registration of partially overlapped aerial imagery",0.120952380952,0.131944444444
7AD40D55,"Blood pyruvic and α-ketoglutaric acids in thiamine deficiency",0.0934343434343,0.0891955266955
7BE98FB1,"Testing Estimator's Credibility - Part II: Other Tests*",0.149126984127,0.143571428571
5AD5CBC3,"The use of the nylon bag technique for the evaluation of feedstuffs.",0.112878787879,0.126515151515
7F218E21,"Angular resolution limit for deterministic correlated sources",0.12341991342,0.133441558442
811616AE,"A general efficient method for chaotic signal estimation",0.135793650794,0.117063492063
80139893,"Distributed Structural Relaxation of XPath Queries",0.123585858586,0.14537037037
775DB6AC,"A two-stage approach to blind spatially-varying motion deblurring",0.124848484848,0.185185185185
81D5CD0C,"Ensemble Classifier for Combining Stereo Matching Algorithms",0.120471195471,0.148695054945
7D6FBD60,"Blind Separation of Noisy Multivariate Data Using Second-Order Statistics: Remote-Sensing Applications",0.137546897547,0.164213564214
80A5C130,"Methods for estimation of daily and lactation milk yields from alternative milk recording scheme in Holstein and Simmental cattle breeds",0.126753246753,0.0994751082251
7C5B292A,"Fast noise PSD estimation based on blind channel identification",0.295788655789,0.336904761905
7ACEE304,"Energy Management in IaaS Clouds: A Holistic Approach",0.127157287157,0.101443001443
771AAF3A,"Estimation in an Integer-Valued Autoregressive Process with Negative Binomial Marginals (NBINAR(1))",0.129121989122,0.125
068FB9BF,"Chapter 12 - Joint Source-Channel Coding and Decoding",0.122137862138,0.119588744589
5B81D3CF,"A SON solution for sleeping cell detection using low-dimensional embedding of MDT measurements",0.146904761905,0.162074829932
75A59D0F,"Channel selection measures for multi-microphone speech recognition",0.111344211344,0.13746031746
80ECBE79,"Prefiltered Pisarenko frequency estimator for multiple real-valued sinusoids",0.131515151515,0.116666666667
5E0F597C,"Joint DOA and fundamental frequency estimation methods based on 2-D filtering",0.125238095238,0.164880952381
80311264,"TanDEM-X Pol-InSAR Inversion for Mangrove Canopy Height Estimation",0.0868997668998,0.0893939393939
7509AE2E,"Towards multi-microphone speech dereverberation using spectral enhancement and statistical reverberation models",0.425783475783,0.453703703704
7FED6ABC,"Cross-Layer Monitoring in Transparent Optical Networks",0.122626262626,0.105555555556
7E78142E,"Least‐squares estimation of transition probabilities from aggregate data",0.125,0.113888888889
8030C073,"New Insights Into the MVDR Beamformer in Room Acoustics",0.133737373737,0.116161616162
7EAC245B,"Hierarchical Bayesian analysis to incorporate age uncertainty in growth curve analysis and estimates of age from length: Florida manatee (Trichechus manatus) carcasses",0.159444444444,0.143546499796
5FBA9B99,"Fault Detection for Systems With Multiple Unknown Modes and Similar Units and Its Application to HVAC",0.158333333333,0.140939153439
775930F6,"An ultramicro method for the determination of total serum cholesterol.",0.204935064935,0.202672327672
75F59ABB,"Ultrasonic velocity measurements for butyl acetate+hydrocarbon mixtures",0.137777777778,0.119444444444
5ABB2536,"Facts and fiction in spectral analysis of stationary stochastic processes",0.286111111111,0.309848484848
7CCCC9E8,"Diffusion LMS Over Multitask Networks",0.108888888889,0.0997150997151
7EE7C52A,"A Machine Learning Approach to End-to-End RTT Estimation and its Application to TCP",0.12341991342,0.152308802309
7F36D52A,"Efficient Decision-Directed Channel Estimation for OFDM Systems with Transmit Diversity",0.126753246753,0.104274891775
8020820B,"Feasibility of real-time soil state and flux characterization for wastewater reuse using an embedded sensor network data assimilation approach",0.127626262626,0.125038850039
7B4B4F13,"Articulated pose estimation with parts connectivity using discriminative local oriented contours",0.140404040404,0.164285714286
72839E0F,"Towards the automatic motion recovery using single-view image sequences acquired from bike",0.128975468975,0.168996083282
5EF9F67E,"Global connectivity control for spatially interacting multi-robot systems with unicycle kinematics",0.142222222222,0.151666666667
755A9A8E,"Light Field Scale-Depth Space Transform for Dense Depth Estimation",0.140555555556,0.119047619048
79DA8E0C,"Neural networks as `software sensors' in enzyme production",0.145404040404,0.123232323232
76869532,"The possible rôle of α-tocopherol in the respiratory chain I. The identification and quantitative determination of α-tocopherol in respiratory chain preparations",0.295788655789,0.369696969697
7D527482,"Security evaluation of a perceptual image hashing scheme based on virtual watermark detection",0.144126984127,0.154117063492
811D5638,"Sparse estimation of the hemodynamic response functionin functional near infrared spectroscopy",0.113333333333,0.0944444444444
7CF9EEDD,"Determining Image Origin and Integrity Using Sensor Noise",0.142142857143,0.181184291899
803809E0,"Speech Signal Enhancement Based on Adaptive Multi-resolution Form of SVD",0.132222222222,0.165088383838
797C7864,"Assessing Expected Accuracy of Probe Vehicle Travel Time Reports",0.122546897547,0.134334415584
7C29B91C,"Digestibility of starch in Penaeus vannamei: in vivo and in vitro study on eight samples of various origin.",0.144126984127,0.119511599512
5C7EFA7A,"Gray-box extremum-seeking control for real-time optimization of uncertain nonlinear systems",0.127222222222,0.112037037037
5E294CFB,"Least squares support vector machine based lithium battery capacity prediction",0.119292929293,0.124016955267
8040414A,"Proposal and performance analysis of a novel preamble-based SNR estimation algorithm",0.127626262626,0.113888888889
7FBBCB3C,"Multiple sound sources tracking method based on Subspace Tracking",0.144126984127,0.175566893424
7D6BD61D,"Hybrid Indoor Positioning Approaches Based on WSN and RFID",0.105674603175,0.214814814815
7AFDFFFF,"Automatic Bird Species Filtering Using a Multimodel Approach",0.124444444444,0.164444444444
73CC46EB,"Indoor scene structure analysis for single image depth estimation",0.144365079365,0.116011303511
7FF883D5,"Review of position-sensorless operation of brushless permanent-magnet machines",0.103585858586,0.109006734007
8111DA5B,"Geoacoustic parameter extraction using reverberation data from the 2000 boundary characterization experiment on the Malta plateau",0.304444444444,0.223810757144
785AC29E,"Angle of Arrival Measurement Using Multiple Static Monopole Antennas",0.137777777778,0.173611111111
7738C20B,"Compensating for Orientation Mismatch in Robust Wi-Fi Localization Using Histogram Equalization",0.452777777778,0.450340136054
783F33F8,"Fourier Transform-Based Modified Phasor Estimation Method Immune to the Effect of the DC Offsets",0.144126984127,0.139333682191
5B1C3CC3,"Evaluation of speech inverse filtering techniques using a physiologically based synthesizer",0.153888888889,0.196180555556
7E8CD08F,"General-Purpose Methodology for Estimating Link Travel Time with Multiple-Point Detection of Traffic",0.130404040404,0.120526695527
7E110416,"Information analysis in passive radar networks for target tracking",0.127626262626,0.104360916861
7A310810,"Empirical study towards a leading indicator for cost of formal software verification",0.120788655789,0.100252525253
76510233,"Estimation of the groundwater pollution potential on an agricultural watershed",0.117070707071,0.101388888889
80C429B3,"Nonlinear Least Squares Methods for Joint DOA and Pitch Estimation",0.138571428571,0.119047619048
7A083EF8,"Improving length-based weight estimates by adding a body habitus (obesity) icon",0.160404040404,0.152579365079
7EFF89C4,"Small target detection using an optimization-based filter",0.119545454545,0.160037878788
7926E3D7,"A Novel In Situ Efficiency Estimation Algorithm for Three-Phase IM Using GA, IEEE Method F1 Calculations, and Pretested Motor Data",0.141587301587,0.131626984127
7C6A9B09,"Quantitative Methodology for Determination of Cost Contingency in International Projects",0.201666666667,0.193506493506
800C41F1,"A Pre-Whiten Method for Active Sonar in Reverberation Background",0.306753246753,0.340659340659
7DC89D4E,"Crowd behaviours analysis in dynamic visual scenes of complex environment",0.128181818182,0.113181818182
00F8E262,"Estymacja odporna a efektywność szacunku na podstawie badania mikroprzedsiębiorstw",0,0
751E35D7,"Use of high resolution SAR images for modeling watershed response in semi-arid regions",0.142308802309,0.129701779702
77CDC441,"Experimental investigation of the angular dependence of low-frequency seabed reverberation",0.300404040404,0.414285714286
8008C59F,"Robustness and risk-sensitive filtering",0.108181818182,0.166666666667
80222A53,"Implicit numerical integration in hybrid simulation with iteration strategy for experimental substructures",0.151904761905,0.134126984127
7A5127EA,"Attempts to arrive at a clinical estimation of the vitamin A standard in outpatients.",0.146349206349,0.154701779702
8165FD8F,"Positioning Based on 2-D Angle of Arrival Estimation",0.117070707071,0.181944444444
80D2CFFE,"Collaborative target tracking using distributed Kalman filtering on mobile sensor networks",0.122626262626,0.16672979798
7FE8C116,"Application of Support Vector Machines in Assessing Conceptual Cost Estimates",0.131919191919,0.127334570192
80240E39,"Optimal parameter estimation in heterogeneous clutter for high resolution polarimetric SAR data",0.122626262626,0.0992929292929
7DD5791F,"On periodic pulse interval analysis with outliers and missing observations",0.147142857143,0.17380952381
7D82F246,"IA^3: An Interference Aware Allocation Algorithm for Multicore Hard Real-Time Systems",0.121363636364,0.0998106060606
5EFF934A,"Source term estimation using convex optimization",0.118585858586,0.143737373737
812FC104,"A2C: Anti-Attack Counters for Traffic Measurement",0.118181818182,0.118233618234
800D8AC3,"Mathematical formulation of RFID tag floor based localization and performance analysis for tag placement",0.169292929293,0.152076318743
75351F2F,"Two-Level Ambient Oscillation Modal Estimation From Synchrophasor Measurements",0.118181818182,0.12037037037
7BA1F3D0,"A spatially variant motion blur removal technique for single image deblurring",0.131197691198,0.126587301587
79AAC54E,"Construction crew design processes",0.107303807304,0.126893939394
78794439,"Estimating physical soil parameters for sample plots of large-scale forest inventories",0.114848484848,0.108333333333
7B5FDB8B,"Tracking people interacting with objects",0.134126984127,0.191964285714
8037BA66,"The Origin-Destination Matrix Estimation Problem : Analysis and Computations",0.10746031746,0.11246031746
77E4ABCB,"Freeway Traffic Speed Estimation with Single-Loop Outputs",0.104848484848,0.0937373737374
80C062A2,"Task-based control of articulated human pose detection for OpenVL",0.124848484848,0.12037037037
79CCF4EA,"Real-Time Parameter Estimation in the Frequency Domain",0.117070707071,0.0986111111111
7D00A9FC,"A Novel, Balanced, and Energy-Efficient Training Method for Receive Antenna Selection",0.130086580087,0.134920634921
80015C46,"On exact Kalman filtering of polynomial systems",0.105054945055,0.1
83D48359,"Iterative windowed parameter estimation of multiple superimposed damped exponentials in noise",0.123888888889,0.121666666667
8003DF48,"Speed estimation with single loop detector using typical effective vehicle length",0.150404040404,0.146486846487
843B1D03,"Wide-band source localization based on spatio-temporal structure of data",0.173333333333,0.197777777778
7FEA5A47,"Consistent estimation of the dimensionality in sliced inverse regression",0.133737373737,0.115277777778
7A831AA0,"On the Accuracy of Phasor Angle Measurements in Power Networks",0.126349206349,0.134920634921
7D422210,"A novel blind estimation algorithm",0.127626262626,0.106481481481
75113EC6,"A Low Sample Size Estimator for K Distributed Noise",0.160238095238,0.148683261183
5FA172D4,"Distributed RF sensing using software-defined radios",0.104518814519,0.190233100233
7D2EF0BE,"Simple Method for Confined-Aquifer Parameter Estimation",0.107157287157,0.109325396825
7A46F499,"Regularization Based Iterative Point Match Weighting for Accurate Rigid Transformation Estimation",0.288888888889,0.264285714286
8189E417,"UWB channel estimation based on compressed sensing using dual-kernel dictionaries",0.119523809524,0.200892857143
804ECFBE,"Hyperspectral Anomaly Detection With Kurtosis-Driven Local Covariance Matrix Corruption Mitigation",0.123888888889,0.107222222222
7EB33E94,"Accurate Machine-Learning-Based On-Chip Router Modeling",0.120622710623,0.121428571429
7F277814,"Improved Frequency Synchronization Method for MB-OFDM Ultra-Wideband Communications",0.128975468975,0.119742063492
7C9C38E3,"Depth-Integrated Estimation of Dissolved Oxygen in a Lake",0.115252525253,0.0981481481481
76BFAC06,"Robust speech recognition using the modulation spectrogram",0.278703703704,0.296296296296
7844FB6E,"Estimation in a linear regression model under the Kullback–Leibler loss and its application to model selection",0.132222222222,0.124376417234
7E4ADC43,"Smart Trend-Traversal: A Low Delay and Energy Tag Arbitration Protocol for Large RFID Systems",0.118181818182,0.0903457653458
59AB5873,"LongMemory, Count Data, Time Series Modelling for Financial Application",0.131197691198,0.124272486772
7BD55B18,"Rates of Improvement by Progeny Testing in Dairy Herds of Various Sizes1",0.135555555556,0.121937321937
7D220BBB,"An Adaptive Dynamic Phasor Estimator Considering DC Offset for PMU Applications",0.146349206349,0.139682539683
7E478305,"Towards an energy estimator for fault tolerance protocols",0.135642135642,0.131601731602
79B8D52F,"Acoustic signature identification using distributed diffusion adaptive networks",0.306666666667,0.307744107744
7EBDAA01,"A Literature Survey of Reverberation Modeling: With Emphasis on Bellhop Compatibility for Operational Applications",0.313571428571,0.223759920635
7A36DA3C,"Robust Frequency-Hopping Spectrum Estimation Based on Sparse Bayesian Method",0.271031746032,0.331904761905
7AEF7F87,"Regression from local features for viewpoint and pose estimation",0.123956043956,0.109325396825
7FB1D79B,"Broad-band synthetic aperture sonar",0.092149321267,0.0741758241758
80E14FD9,"Identification of Time-Varying Intrinsic and Reflex Joint Stiffness",0.32,0.433333333333
7868B4A5,"New Results for Feature-Domain Reverberation Modeling",0.297070707071,0.403703703704
7D12160B,"On High Performance MIMO Communications with Imperfect Channel Knowledge",0.163571428571,0.160714285714
8094C159,"Maximum-likelihood channel estimation in block fading amplify-and-forward relaying networks",0.11746031746,0.118253968254
7D7D728A,"Reducing the error in mobile location estimation using robust window functions",0.285648148148,0.262847222222
7F2E9DC5,"Probabilistic Estimation of Network Size and Diameter",0.140404040404,0.140277777778
7C16D031,"Multi-innovation least squares identification methods based on the auxiliary model for MISO systems",0.126753246753,0.154126984127
0E0D5D0A,"Propagation of Computational Uncertainty Using the Modern Design of Experiments",0.133975468975,0.165238095238
7FE8CBD6,"Cooperative fingerprint-based indoor localization using Self-Organizing Maps",0.161515151515,0.252525252525
76BE3C27,"Pulling Things out of Perspective",0.118571428571,0.164285714286
7F2D697A,"A pointing system based on acoustic position estimation and gravity sensing",0.119848484848,0.137349555207
7AAA574A,"Quantum neural network for State of Charge estimation",0.127626262626,0.100694444444
7C607C5D,"Two-layer generative models for estimating unknown gait kinematics",0.117070707071,0.115277777778
7F654764,"Real time state of charge prediction using Kalman Filter",0.123585858586,0.144781144781
817A3F3D,"Head pose estimation: Classification or regression?",0.104935064935,0.104274891775
7F661830,"Effects of bilingualism, noise, and reverberation on speech perception by listeners with normal hearing",0.34,0.247970779221
800BC2C7,""Principal component inverse" algorithm for detection in the presence of reverberation",0.308181818182,0.266203703704
7A594E5B,"DOA estimation of multi-band signals using a compressed sensing technique",0.132222222222,0.158333333333
7E4BA20B,"Design and performance test of relative navigation of a low cost inertial SLAM",0.120788655789,0.111321548822
809FFF43,"A CSI Estimation Method for Wireless Relay Network",0.111197691198,0.101026751027
5B2B355A,"Prediction-error-method-based adaptive feedback cancellation in hearing aids using pitch estimation",0.137777777778,0.162698412698
