Paper ID,Title,Sim1,Sim2
7896DF23,"An optimal combination of a hydrological model and PSI to estimate land subsidence driven by piezometric level changes",0.151753246753,0.129725829726
75F8E969,"The Efficiency of Sampling Techniques for NTD Reporting",0.113181818182,0.141477272727
80E1A839,"MMSE and ML estimation of chaotic sequences with coded signs with applications in coding discrete-time analog signals",0.138571428571,0.115826633684
7BBDBA8F,"Validation of SCS Method for Runoff Estimation",0.149783549784,0.150086580087
7FC959AC,"BETA-NORMAL DISTRIBUTION AND ITS APPLICATIONS",0.108891108891,0.142857142857
7D3926C2,"Sparse algorithms and bounds for statistically and computationally efficient robust estimation",0.265025252525,0.324810606061
78F26D5D,"Time delay estimation between two biosignals using system identification",0.302222222222,0.290277777778
6C0F69FF,"Multivariate Stochastic Volatility",0.128181818182,0.166666666667
7780B74F,"A loosely coupled architecture for networked control systems",0.123181818182,0.105303030303
7B03BB92,"Digestibility of wet cage layer excreta and an excreta-supplemented diet by cattle as determined by two methods",0.144126984127,0.13520247114
5DBAD46C,"Rice phenology estimation based on statistical models for time-series SAR data",0.122626262626,0.144444444444
7F161D90,"Current density reconstruction from EEG based on a time varying nonlinear physiological model",0.128888888889,0.173015873016
5935DB80,"Semi-blind Doppler spread tracking and channel equalization for green wireless MIMO systems",0.153571428571,0.146249781964
7EE577A3,"Optimal estimation and sequential channel equalization algorithms for chaotic communications systems",0.145,0.129365079365
76479438,"A CONDITIONAL LEAST SQUARES APPROACH TO BILINEAR TIME SERIES ESTIMATION",0.123888888889,0.110515873016
7B2B9612,"Facial Age Estimation by Learning from Label Distributions",0.146753246753,0.189880952381
7C8C47F1,"Adaptive multi-lag for synthetic aperture vector flow imaging",0.118174603175,0.101884920635
7DC89D57,"A Multi-Gesture Interaction System Using a 3-D Iris Disk Model for Gaze Estimation and an Active Appearance Model for 3-D Hand Pointing",0.144126984127,0.136327561328
8057FB57,"Allometric models for non-destructive leaf area estimation of Jatropha curcas",0.115555555556,0.0928418803419
714CF06B,"FPGA Implementation of the HySime Algorithm for the Determination of the Number of Endmembers in Hyperspectral Data",0.191197691198,0.200793650794
780CCC94,"Measurements and estimations of photosynthetically active radiation in Beijing",0.130404040404,0.1
810426C1,"An Iterated Extended Risk-Sensitive Filters for Nonlinear Filtering Problems",0.115252525253,0.134006734007
7C44CB21,"Closed-Form Expressions for the Exact Cramer-Rao Bounds of Timing Recovery Estimators from BPSK and Square-QAM Transmissions",0.144126984127,0.122757335257
7E5864C2,"Combined Affine Geometric Transformations and Spatially Dependent Radiometric Deformations: A Decoupled Linear Estimation Framework",0.120788655789,0.136111111111
5F768B7B,"Tools & methods for software effort estimation using use case points model — A review",0.140086580087,0.139288993834
59C6E38D,"Simplicity or flexibility? Complementary Filter vs. EKF for orientation estimation on mobile devices",0.155324675325,0.133802308802
7A3FAFF0,"Compressed channel sensing",0.112857142857,0.197619047619
7E0AF3A2,"Fast inter mode decision based on textural segmentation and correlations for multiview video coding",0.150793650794,0.166439909297
7D345039,"Multichannel equalization in subbands",0.121666666667,0.2
7C9352F7,"Saliency Based Ulcer Detection for Wireless Capsule Endoscopy Diagnosis",0.203181818182,0.19103951604
5CE8B96A,"On random walk based graph sampling",0.124848484848,0.201388888889
80279338,"A hybrid data fusion based cooperative localization approach for cellular networks",0.169292929293,0.1875
7E6B4C9A,"Signal Processing With Compressive Measurements",0.140555555556,0.145833333333
7DF82BA3,"Cooperative control based on distributed estimation of network connectivity",0.140404040404,0.170555555556
7C94949A,"Statistical analysis of polynomial phase signals affected by multiplicative and additive noise",0.145,0.145
7E9583C6,"Target Doppler estimation using wideband frequency modulated signals",0.140793650794,0.148871366729
7E36C706,"Distributed opportunistic scheduling with two-level probing",0.2,0.2
00E429FF,"Application of a process-based model as a predictive tool for erosion loss in ungauged basins.",0.130793650794,0.104701779702
8271FFAF,"Design and experiment of frequency offset estimation and compensation in high-speed underwater acoustic communication",0.141666666667,0.117517006803
59A9B595,"Structural results for partially nested LQG systems over graphs",0.126666666667,0.107407407407
7C66C353,"MODELS FOR RIGHT-TURN-ON-RED AND THEIR EFFECTS ON INTERSECTION DELAY",0.0970707070707,0.0982323232323
7F308833,"Regression From Uncertain Labels and Its Applications to Soft Biometrics",0.122857142857,0.119155844156
7B4E6FA8,"Simulation and implementation of State-of-Charge estimation of power lithium-ion battery using energy method",0.140324675325,0.13933982684
7FF1C21F,"Accuracy Analysis of the Multicycle Synchrophasor Estimator Provided by the Interpolated DFT Algorithm",0.137698412698,0.151904761905
5A39DB46,"A SIMPLIFIED METHOD FOR THE ESTIMATION OF TOTAL CHOLESTEROL IN SERUM AND DEMONSTRATION OF ITS SPECIFICITY",0.133975468975,0.105022292522
5B40AE4D,"Age estimation via unsupervised neural networks",0.140404040404,0.131481481481
7777EDF3,"Smartphone-based indoor position and orientation tracking fusing inertial and magnetic sensing",0.130238095238,0.163571428571
7DB10FC7,"The Impact of Irrelevant and Misleading Information on Software Development Effort Estimates: A Randomized Controlled Field Experiment",0.13595959596,0.110069444444
7F980C5B,"Joint Time, Frequency and Sampling Clock Synchronization for OFDM-Based Systems",0.129444444444,0.126256613757
79AB99C6,"Analysis and Real-Time Prediction of Local Incident Impact on Transportation Networks",0.129444444444,0.114444444444
7E6B43B6,"A Method For Fine Resolution Frequency Estimation From Three DFT Samples",0.125238095238,0.111991341991
7E0464FE,"GLRT-Based Detection-Estimation for Undersampled Training Conditions",0.109121989122,0.133333333333
7593948B,"Coded focal stack photography",0.121666666667,0.1125
5CADA935,"Comparison of the parameter estimation for the induction machine dynamic model using instantaneous measurements at standstill and during start-up",0.133737373737,0.134175084175
7ECC7225,"Joint Dereverberation and Residual Echo Suppression of Speech Signals in Noisy Environments",0.143333333333,0.129166666667
7BA3BD28,"Efficient tracking of heart rate under physical exercise from photoplethysmographic signals",0.132222222222,0.113888888889
7D6E5F47,"Field measurement of the sheltering effect of vegetation on erodible land surfaces",0.125,0.12012987013
7F00AAB6,"A subcarrier-phase control based peak power reduction method for coded space division multiplexed OFDM systems",0.146904761905,0.15157967033
7DC573B2,"Detection of Small-Scale Primary Users in Cognitive Radio Networks",0.147222222222,0.128258547009
7DB1F3D9,"A new minimal solution to the relative pose of a calibrated stereo camera with small field of view overlap",0.130793650794,0.109174952032
805404E8,"Spatial Random Tree Grammars for Modeling Hierarchal Structure in Images with Regions of Arbitrary Shape",0.144126984127,0.12863327149
76EDCCB7,"Estimating project overheads rate in bidding: DSS approach using neural networks",0.13595959596,0.163265306122
59FC0FC6,"Method for evaluation of trustworthiness of oscillometric blood pressure measurements",0.13088023088,0.133477633478
80005038,"Improved range-free localization methods for wireless sensor networks",0.185642135642,0.167522292522
807BB765,"Eye gaze estimation from a single image of one eye",0.12341991342,0.0985714285714
5AC68697,"Real-time handheld indoor positioning device based on RFID Heron-bilateration location estimation and IMU angular-driven navigation reckoning",0.13,0.161904761905
7F3AD87E,"Accurate and Efficient Traffic Monitoring Using Adaptive Non-Linear Sampling Method",0.137546897547,0.186031746032
75B434A9,"Real time head pose estimation with random regression forests",0.125404040404,0.0998484848485
77AD3E04,"Direction of arrival tracking of an underwater acoustic source using particle filtering: Real data experiments",0.126666666667,0.135209235209
7E09C4AC,"Robust non-parametric statistics method for joint angle-Doppler estimation in non-Gaussian clutter",0.271815221815,0.285642135642
8158D1F7,"Least-squares estimation: from Gauss to Kalman",0.0796703296703,0.0833333333333
7E69448D,"Distributed Detection Over Gaussian Multiple Access Channels With Constant Modulus Signaling",0.127137862138,0.137572150072
79D74E4D,"Impact of license plate restriction policy on emission reduction in Hangzhou using a bottom-up approach",0.129121989122,0.130952380952
7E47F5FE,"Passive Network Performance Estimation for Large-Scale, Data-Intensive Computing",0.127626262626,0.107638888889
7558B770,"Improving the consistency of vocal tract shape estimation",0.150404040404,0.158181818182
5BE048E7,"Mean shift based direction finding and separation of multiple sources using microphone array in the presence of spatial aliasing",0.130793650794,0.168401547947
7CA0D3A8,"All-distances sketches, revisited: HIP estimators for massive graphs analysis",0.142777777778,0.131018518519
81554170,"Joint Synchronization and Channel Estimation for OFDM Transmissions over Doubly Selective Channels",0.131197691198,0.124603174603
78B44C74,"Initial rotor position estimation of permanent magnet synchronous machines using square-wave voltage injection with a single current sensor",0.115555555556,0.116722783389
7E06EB88,"Effects of suppressing steady-state portions of speech on intelligibility in reverberant environments",0.143333333333,0.126262626263
75D6778E,"The Estimation of an Origin-Destination Matrix from Traffic Counts",0.104848484848,0.0986111111111
7D4F3CE4,"An Advanced Single-Image Visibility Restoration Algorithm for Real-World Hazy Scenes",0.141363636364,0.124810606061
7D44C792,"Safety Impacts of Differential Speed Limits for Trucks and Passenger Cars on Rural Interstate Highways: A Modified Empirical Bayes Approach",0.149126984127,0.111871966417
80373B29,"Delay Model for Right-Turn Lanes at Signalized Intersections with Uniform Arrivals and Right Turns on Red",0.133015873016,0.109331409331
80FE6531,"Design for Bit Error Rate estimation of high speed serial links",0.127626262626,0.100462962963
7D258084,"Supervised High-Resolution Dual-Polarization SAR Image Classification by Finite Mixtures and Copulas",0.139365079365,0.128083028083
7CBD749B,"A Comparison of Volume Scattering Strength Data with Model Calculations based on Quasisynoptically Collected Fishery Data",0.153571428571,0.158694083694
80DC8EB9,"UWB joint TOA and DOA estimation",0.0887179487179,0.0916666666667
802F7336,"Apparent metabolizable energy of crude glycerin originating from different sources in broiler chickens.",0.108717948718,0.107796370296
80767FCA,"A Pilot Study on BSN-Based Ubiquitous Energy Expenditure Monitoring",0.127222222222,0.105404040404
761F83EC,"Bayesian approaches for identification of the complex modulus of viscoelastic materials.",0.302222222222,0.328282828283
7B30FE66,"A Learning Framework for Age Rank Estimation Based on Face Images With Scattering Transform",0.146753246753,0.160590027257
83A77718,"Wideband DOA estimation for uniform linear arrays based on the co-array concept",0.128975468975,0.167658730159
75FA0A26,"A non-destructive method for estimating above-ground forest biomass in threatened woodlands.",0.130793650794,0.130158730159
5FB77BAC,"Application of extended Kalman filter to parameter estimation of doubly-fed induction generators in variable-speed wind turbine systems",0.125238095238,0.0934113272349
7E57CC29,"A Channel Estimation Scheme for Amplify-and-Forward OFDM Relay Networks",0.11341991342,0.107864357864
7A5B42F9,"Prefilter-Based Reconfigurable Reconstructor for Time-Interleaved ADCs With Missing Samples",0.122137862138,0.238095238095
7767CF3D,"Earthmoving Productivity Estimation using Linear Regression Techniques",0.124848484848,0.153333333333
7FAC3B4A,"Traffic parameter estimation on motorway networks by combination of filtering techniques",0.110404040404,0.111458333333
8028577C,"FPGA Implementation of the Multilayer Neural Network for the Speed Estimation of the Two-Mass Drive System",0.137777777778,0.114351851852
7F5006A4,"Asymptotic Distribution of a Simple Linear Estimator for VARMA Models in Echelon Form",0.140086580087,0.127886002886
7E3D826E,"The estimation of Line Spectral Frequencies trajectories based on Unscented Kalman Filtering",0.262373737374,0.266666666667
78C92D5C,"A simplified procedure for the estimation of arginine in plasma and urine using arginase.",0.130404040404,0.146666666667
7FA01280,"Performance Analysis of Cognitive Radio Systems With Imperfect Channel Sensing and Estimation",0.128975468975,0.129016221873
7EDB28F3,"Dynamic pricing with multiple products and partially specified demand distribution",0.128571428571,0.113571428571
7C0ACB0B,"Evaluation of Decay Times from Noisy Room Responses with Pure-Tone Excitation",0.135555555556,0.109696969697
776E1B5A,"Dynamical Approach for Real-Time Monitoring of Agricultural Crops",0.105674603175,0.0981481481481
7AED396E,"Experimental demonstration of a GMPLS-enabled impairment-aware lightpath restoration scheme",0.115396825397,0.101851851852
7F70C491,"Distributed linear discriminant analysis",0.1118997669,0.1625
5B62B22C,"Pose estimation of robotic end-effectors under low speed motion using EKF with inertial and SE(3) measurements",0.13595959596,0.158888888889
7994E179,"Multi-level inference by relaxed dual decomposition for human pose segmentation",0.115555555556,0.0960113960114
80024A1B,"Enhanced TOA-based indoor-positioning algorithm for mobile LTE cellular systems",0.118566433566,0.122619047619
7EA0DB1C,"A New Method for Measuring Packet Loss Probability Using a Kalman Filter",0.135793650794,0.164744382602
8143D912,"Research on Road Friction Coefficient Estimation Algorithm Based on Extended Kalman Filter",0.13,0.134185606061
76EC3271,"Noise power estimation based on the probability of speech presence",0.146904761905,0.15731292517
7F9CE87B,"A speech direction finder",0.100233100233,0.128787878788
7C751DBE,"Improving Wi-Fi Based Indoor Positioning Using Bluetooth Add-Ons",0.118717948718,0.243333333333
757C5DA7,"399. The estimation of vitamin A in butter: A critical study of methods",0.128975468975,0.105642135642
7DA80ECD,"LUT-Based Power Macromodeling Technique for DSP Architectures",0.113975468975,0.119588744589
5D4E6BA8,"Improved linear least squares estimation using bounded data uncertainty",0.138975468975,0.195105820106
766DD882,"Hierarchical least squares identification methods for multivariable systems",0.126753246753,0.10873015873
7F2A8FE3,"Estimating the Effective Sample Size to Select Independent Measurements in a Reverberation Chamber",0.318571428571,0.28231292517
7BE98F8F,"An automated method for microvascular blood flow analysis based on spatiotemporal images",0.129935064935,0.157677970178
76EE1CED,"THE ESTIMATION OF THIOLS AND DISULPHIDES IN BARLEY",0.0820512820513,0.0833333333333
806A5135,"Pade approximations to matched filter amplitude probability functions",0.125555555556,0.135404040404
7E41411A,"Exploring aligned complementary image pair for blind motion deblurring",0.128975468975,0.150793650794
7D1649B9,"Hyperspectral Image Denoising Using a Spatial–Spectral Monte Carlo Sampling Approach",0.127137862138,0.19246031746
7F9D9380,"Unscented transformation for depth from motion-blur in videos",0.116197691198,0.126322751323
7DFD62D4,"Lithium Polymer Battery State-of-Charge Estimation Based on Adaptive Unscented Kalman Filter and Support Vector Machine",0.131919191919,0.123424723425
7974C43E,"From a novel classification of the battery state of charge estimators toward a conception of an ideal one",0.148658008658,0.125
76594533,"Computer-Integrated System for Estimating the Costs of Building Projects",0.110238095238,0.114404761905
76758F52,"Pushing the Limits of Sparse Support Recovery Using Correlation Information",0.142308802309,0.17358276644
75435C45,"Assessing Whole-Body Absorption Cross Section For Diffuse Exposure From Reverberation Chamber Measurements",0.304126984127,0.236607142857
5FE96B8D,"A Time–Frequency Masking Based Random Finite Set Particle Filtering Method for Multiple Acoustic Source Detection and Tracking",0.128975468975,0.169885361552
7D2252D7,"LocaToR: Locating Passive RFID Tags with the Relative Neighborhood Graph",0.146349206349,0.11746031746
814FED0F,"The Improved Ensemble Kalman Filter for Multisensor Target Tracking",0.111212121212,0.143939393939
795630FA,"How many viewers does a cable network need? A survival analysis of cable networks.",0.130404040404,0.138194444444
7D66061C,"Risk-based sensor management for integrated detection and estimation",0.129935064935,0.110524891775
80A83F40,"Empirical Bayes estimation of the parameter for logarithm gamma distribution",0.135324675325,0.109194139194
816748F5,"NLOS Mitigation Using Linear Programming in Ultrawideband Location-Aware Networks",0.127626262626,0.170138888889
5C7CCA62,"Pulse-doppler signal processing with quadrature compressive sampling",0.128571428571,0.123214285714
791403DE,"Analyzing the Impact of a Fatality Index on a Discrete, Interurban Mode Choice Model with Latent Safety, Security, and Comfort",0.148181818182,0.145757575758
816547F2,"GMP-Based Channel Estimation for Single-Carrier Transmissions over Doubly Selective Channels",0.119523809524,0.127976190476
7E89F11D,"Blind SNR Estimation of Gaussian-Distributed Signals in Nakagami Fading Channels",0.123571428571,0.112797619048
751D7511,"Minimax Adaptive Generalized Ridge Regression Estimators",0.125384615385,0.141666666667
80B8BE55,"SNR-Adaptive Stream Weighting for Audio-MES ASR",0.275252525253,0.555555555556
7D0B00F3,"FUN3D Manual: 12.8",0.2,0
785974A2,"A dedicated guided-search displacement algorithm for cardiovascular strain imaging",0.120952380952,0.118055555556
8171B168,"Robust FIR Filters for Linear Continuous-Time State-Space Models With Uncertainties",0.274146224146,0.285642135642
7DD9369E,"Robust frequency synchronization for an OFDMA uplink system disturbed by a Cognitive Radio system interference",0.277513227513,0.218247184914
7BD92BEC,"Statistical Electromagnetics: Complex Cavities",0.106033966034,0.0909090909091
7B9FAA6F,"Determination of thermal diffusivity of Lyoner type sausages during water bath cooking and cooling",0.200404040404,0.157034632035
7FCB340F,"Analysis of belief propagation for hardware realization",0.0974553224553,0.113005050505
810BC19A,"Enhancement of reverberant speech using LP residual",0.129121989122,0.203703703704
7CEAF321,"Approximate Dynamic Programming for Communication-Constrained Sensor Network Management",0.131197691198,0.117469336219
79058BB8,"Single channel noise reduction based on an auditory filterbank",0.12436008436,0.181547619048
808C9425,"Bayesian age estimation on face images",0.146753246753,0.129274891775
5E05665F,"Consistent Estimation of Agent Based Models",0.133737373737,0.173611111111
8083B96C,"Performance comparison of TOA and TDOA based location estimation algorithms in LOS environment",0.137222222222,0.146825396825
7ACB3553,"Travel Time Estimation with Correlation Analysis of Single Loop Detector Data",0.127626262626,0.106048465423
7C091933,"Quick shift segmentation guided single image haze removal algorithm",0.131753246753,0.12941304727
5C16B65F,"Parameter extraction for bass guitar sound models including playing styles",0.144444444444,0.148101281435
7CFB6D65,"SPI proceedings: BER simulation for high-speed serial links with crosstalk, noise, ISI and Jitter using Quasi-Analytical Method",0.131991341991,0.138447971781
80C03167,"Residue carrier frequency offset estimation using cyclic prefix in OFDM systems",0.131515151515,0.143301936159
58D6905C,"Prior parameter estimation for Ising-MRF-based sonar image segmentation by local center-encoding",0.126753246753,0.106547619048
8078467E,"Mean travel speed estimation using GPS data without ID number on inner city road",0.135793650794,0.134069749695
6FE0B1CF,"Distribution Localization Estimation Algorithm in Wireless Sensor Networking",0.149783549784,0.142059329559
7EDF1D56,"A blind carrier frequency offset estimation scheme for OFDM systems with constant modulus signaling",0.137777777778,0.119183902517
7F367B29,"Bayesian deblurring with integrated noise estimation",0.120788655789,0.104166666667
812F526F,"Orthogonal Functional Expansion Method of Optical Flow for Large Displacement",0.12436008436,0.119047619048
7BA4FA3B,"Binaural Cues and Consonant Perception in Reverberation and Noise",0.308956043956,0.334821428571
7DF08215,"Multi-source DOA estimation in a reverberant room",0.1068997669,0.0871212121212
77596653,"High-Resolution AoA Estimation for Hybrid Antenna Arrays",0.122626262626,0.0925925925926
7DF8A2C1,"On the impact of propagation disturbances on SAR Tomography: Analysis and compensation",0.107303807304,0.123015873016
8140B97C,"Stochastic Processes With Random Contexts: A Characterization and Adaptive Estimators for the Transition Probabilities",0.156666666667,0.127525252525
7AA7FB1A,"Perception of Consonants in Reverberation and Noise by Adults Fitted With Bimodal Devices",0.333571428571,0.266898577613
7FFBE3D8,"Improving audio source localization by learning the precedence effect",0.181111111111,0.206481481481
7562DD07,"VITAMIN VALUES OF GARDEN‐TYPE PEAS PRESERVED BY FROZEN‐PACK METHOD. I. ASCORBIC ACID (VITAMIN C)",0.118268398268,0.12431616003
7F2ABC09,"2-D DOA estimation of quasi-stationary signals based on Khatri-Rao subspace approach",0.132222222222,0.155555555556
7ED316EA,"A combined approach for QoS-guaranteed and low-power video decoding",0.127626262626,0.115740740741
7E2623C0,"Improved phase vocoder time-scale modification of audio",0.131197691198,0.117989417989
8200B610,"Joint space and time domain processing for DOA estimation",0.148333333333,0.122222222222
7512F241,"Tire-Road Friction-Coefficient Estimation",0.0796703296703,0.0833333333333
7F482997,"Invariance of the first difference in ARFIMA models",0.128975468975,0.126322751323
79F619A1,"Rotor position and speed estimation of interior permanent magnet synchronous motor using Unscented Kalman Filter",0.118181818182,0.118560606061
7FFF969F,"An analysis of GPS sampling rates required in travel time estimation",0.122070707071,0.150240384615
82296F2E,"A byzantine attack defender for censoring-enabled cognitive radio networks",0.146349206349,0.124389499389
7E54E6AD,"Dense Reconstruction Using 3D Object Shape Priors",0.136515151515,0.177083333333
7CF9B854,"A source subspace tracking array of microphones for double talk situations",0.130793650794,0.127329416615
80A34FBC,"Optimal bayes joint decision and estimation",0.13380952381,0.123015873016
7F4CA65B,"Error rate estimation of finite-length low-density parity-check codes decoded by soft-decision iterative algorithms",0.13595959596,0.12037037037
7675A326,"The beta generalized Pareto distribution with application to lifetime data",0.126118326118,0.13474969475
811427DA,"Eddy Current Effects on Rotor Position Estimation and Magnetic Pole Identification of PMSM at Zero and Low Speeds",0.3,0.240151515152
7DABEA46,"A metric approach toward point process divergence",0.129121989122,0.122222222222
755E816F,"Reduction of snapshots for MIMO radar detection by block/group orthogonal matching pursuit",0.123333333333,0.107051282051
808043F3,"Simultaneous Detection and Estimation Approach for Speech Enhancement",0.1318997669,0.119444444444
7F652CFF,"Range-based geolocation in fading environments",0.102070707071,0.133928571429
813ECD7E,"Segment Training Based Individual Channel Estimation in One-Way Relay Network with Power Allocation",0.146349206349,0.141454224788
6EFD1867,"Speech enhancement by nonlinear multiband envelope filtering",0.131919191919,0.122895622896
8165EBB1,"Road traffic estimation with signal matching in mobile phone using large-size database",0.124444444444,0.135185185185
813CAB03,"The performance of two classes of active sonar detectors in a shallow water environment",0.132222222222,0.104823879824
78CCCFC7,"Software testing sizing in incremental development: A case study",0.130238095238,0.141402116402
583A8E05,"Estimating structure of indoor scene from a single full-view image",0.128975468975,0.127886002886
5EC7B4BD,"Audio time-scale modification using a hybrid time-frequency domain approach",0.126178266178,0.174603174603
7D1C70C0,"LPS self-calibration method using a mobile robot",0.12341991342,0.186507936508
7FC7248F,"Analysis of partial FFT demodulation for doppler distorted OFDM signals",0.143571428571,0.12619047619
7A89CB67,"Hyperspectral imaging for nondestructive determination of internal qualities for oil palm (Elaeis guineensis Jacq. var. tenera).",0.218333333333,0.174873737374
7F2BF52B,"Astronomical spectra denoising based on simplified SURE-LET wavelet thresholding",0.118888888889,0.181481481481
75608A7C,"Optimum design of crossbreeding experiments. III. Efficiency of designs without all purebreds.",0.133571428571,0.125170068027
7F0D11AC,"Loquendo - Politecnico di Torino's 2008 NIST speaker recognition evaluation system",0.29595959596,0.289841269841
7C7E19DC,"Modeling global solar radiation using Particle Swarm Optimization (PSO)",0.118585858586,0.147558922559
805EDDC2,"Estimate of cyclostationary PLC channels by a modified Self-Organizing Map",0.12341991342,0.111255411255
80881E7D,"Localization of nonlinear loads in electric systems through harmonic source estimation",0.166666666667,0.143333333333
