Paper ID,Title,Sim1,Sim2
77084942,"Picture quality evaluation strategy using a watermarking technique",0.172883597884,0.147757335257
7FDFC525,"Using fractal compression scheme to embed a digital signature into an image",0.148484848485,0.144444444444
770F7363,"Directional Based Watermarking Scheme Using A Novel Data Embedding Approach",0.422685185185,0.508333333333
7BE06745,"A Software Watermarking for Java Programs",0.110383597884,0.117989417989
71BA749E,"High-capacity reversible data hiding by Maximum-span pixel Pairing on ordered dithered halftone images",0.179828042328,0.13112244898
7CD9A7B3,"An Improved Orthogonal Dirty-Paper Coding Method for Watermarking Applications",0.158405483405,0.128571428571
7B309F51,"RopSteg: program steganography with return oriented programming",0.130026455026,0.135793650794
7F9EEAE1,"Image Error Concealment and Quality Access Control Based on Data Hiding and Cryptography",0.290939153439,0.203089133089
0BF35F31,"A Study on Protection of Iris and fingerprint Data Based on Digital Watermarking in Mid-Frequency Band",0.289087301587,0.250566893424
860AEEBD,"Comparative analyses of YCbCr color space and CIELab color space based on DWT and SVD",0.283994708995,0.272156084656
8156ABDE,"Data hiding method for broadcasting system",0.165740740741,0.156666666667
7D4AF215,"A Novel Watermarking Algorithm Based on Feature Points and SVD",0.259447496947,0.321314102564
775C875D,"Image splicing detection based on image quality and analysis of variance",0.283994708995,0.230262445887
5EE94867,"Optimal selective correlation detector for spread-spectrum watermarking systems",0.162962962963,0.12037037037
7685359C,"A real time watermarking of grayscale images without altering it's content",0.151262626263,0.177777777778
18A24B6D,"Προστασία πνευματικών δικαιωμάτων πολυμεσικής πληροφορίας με χρήση ψηφιακής υδατοσήμανσης",0,0
7D0D6FEF,"Simultaneous Calculation of DFT and IDFT of Real Two-Dimensional Sequences and Its Application in Digital Image Watermark",0.311183261183,0.297142857143
78A9E2AF,"An overview of attacks against digital watermarking and their respective countermeasures",0.172883597884,0.128815628816
6060A6E8,"Robust audio watermarking scheme via QIM of correlation coefficients using LWT and QR decomposition",0.171031746032,0.1575
5D92C9F1,"Comparative analysis of LSB, DCT and DWT for Digital Watermarking",0.148336385836,0.125
5E8C4AA6,"Quaternion Frequency Watermarking Algorithm for Color Images",0.10867003367,0.107626262626
61DC9428,"A general attack method for steganography removal using Pseudo-CFA re-interpolation",0.158405483405,0.161991341991
13C2189B,"A Color Image Watermarking Technique by Embedding a Fresnel-Transformed Pattern",0.114099326599,0.11595959596
7CCF3CB6,"A New Sequential Multiple Watermarking Scheme",0.139407814408,0.0801282051282
759C2003,"Anti-protocol Attacks Digital Watermarking Based on Media-Hash and SVD",0.26567044067,0.571428571429
8176AE91,"Reversible Integer Color Transform",0.152046102046,0.111111111111
7A4729DC,"Research in DRM architecture based on watermarking and PKI",0.266061253561,0.412037037037
77FC2985,"A Technology of Printing Forgery Prevention for Certificates Based on Fingerprint Information",0.302976190476,0.288265306122
7B8959C2,"Secure access control to hidden data by biometric features",0.158796296296,0.14594017094
6D89BA3E,"Efficient Watermarking Schemes for Speaker Verification Guaranteeing Non-repudiation",0.147416472416,0.0998106060606
8627CBCE,"A Functional Taxonomy for Software Watermarking",0.148005698006,0.10101010101
7D3421CE,"The Digital Image Watermarking Algorithm Based on Dopplerlet Transform",0.26654040404,0.408333333333
7732C945,"A technical demonstration of Lola, the robot entertainer",0.160058922559,0.112037037037
792B704B,"Information Hiding Algorithm Based on Stentiford Visual Attention Model",0.302976190476,0.315277777778
7958994C,"Digital image watermarking using steerable pyramid transform and uncorrelated color space",0.167201779702,0.171825396825
7516E3F4,"Secure multimedia objects management in medical information system",0.20205026455,0.169444444444
77C1F2F5,"Information Hiding Technology in Electronic Notes System",0.196031746032,0.188888888889
7C96A9E4,"Privacy Preservation in SAT (Single Authentication Through)",0.314087301587,0.327380952381
7832897C,"A watermark embedding and extracting method for printed documents",0.294642857143,0.373214285714
77499EA1,"A Secure Content Distribution Based on Chaotic Desynchronization",0.269907407407,0.3375
835ADCF8,"Intellectual Property Cores: Protection designs for CE products.",0.190740740741,0.146296296296
812CAFE7,"Security of cass data hiding scheme under the scenarios of KMA and WOA",0.158796296296,0.14212962963
7E79A6FE,"A novel digital image watermarking scheme using blind source separation",0.175462962963,0.189583333333
7DF166DE,"An image watermark algorithm based on discrete cosine transform block classifying",0.419318181818,0.376360544218
5AE632C8,"Informed position based watermarking",0.273484848485,0.455555555556
1417BC3A,"Analysis and Improvement of Formulas for Evaluating Similarity Degree of Digital Watermarks: Analysis and Improvement of Formulas for Evaluating Similarity Degree of Digital Watermarks",0.344907407407,0.27886002886
76B8C2B3,"Steganography: A Class of Algorithms having Secure Properties",0.168716931217,0.181547619048
78BFCCC5,"New model of correspondent verification in telecommunication digital channels",0.154966329966,0.0991161616162
7902BA5F,"A New Fractal Watermarking Scheme Based on Image Normalization",0.264225589226,0.323611111111
7B4876BD,"Copyright protection for multimedia data based on asymmetric cryptographic techniques",0.283796296296,0.269781144781
2E7F56DA,"The Protection System of Digital Contents using a Frame Filter Information based on Public Key",0.314087301587,0.260008818342
76D41F13,"The DWT Group Fingerprinting Scheme",0.14623015873,0.15
7ADBC798,"Pseudonoise Sequence Generation with Improved Imperceptibility for Audio Watermarking",0.158796296296,0.112037037037
7CF223C2,"Halftone Image Watemarking",0.093265993266,0.0916666666667
79D99F05,"Watermark detection algorithm in multimedia using statistical decision theory",0.305429292929,0.264971139971
766B0A58,"A watermarking energy estimating model in wavelet domain",0.119191919192,0.108181818182
7E1118F4,"Digital watermarking using local contrast-based texture masking",0.163035113035,0.195767195767
777AD8B0,"A Four Stages Protocol Designed to Protect Copyright in Digital Museum",0.15957977208,0.149444444444
85E0D525,"Semi visible watermarking scheme based on DWT and PCA",0.257012432012,0.391414141414
7BB7D822,"A Study of Watermarking Data Transmission Scheme for BPSK-OFDM Based LED Communication System",0.283994708995,0.253968253968
7C653477,"A robust digital watermarking scheme by use of integral imaging technique",0.162373737374,0.107954545455
5A5ED28C,"Audio watermarking by spreading echo in time domain using pseudo noise gray sequence",0.17380952381,0.158249158249
32B7D7D7,"FEATURE POINT DETECTION USING K-HARRIES TECHNIQUE OVER SECURE IMAGE WATERMARKING",0.148484848485,0.129234654235
80E6004C,"Geometric Distortion in Image and Video Watermarking. Robustness and Perceptual Quality Impact",0.175661375661,0.118590668591
75F1ECD2,"High efficient adaptive block based error concealment for digital images with data hiding",0.283994708995,0.275170068027
5B6986E9,"System Security Track Chair’s Message",0.180429292929,0.189583333333
71AF9595,"스테레오 영상의 소유권 보호를 위한 워터마킹 기법",0,0
858B1E5E,"Watermarking and fingerprinting for electronic music delivery",0.172294372294,0.152525252525
6C12CC91,"신분증 위변조 방지를 위한 이미지 워터마킹",0,0
5C38868B,"A DWT-SVD based digital watermarking technique for copyright protection",0.281018518519,0.345643939394
79310E6E,"Watermarking schemes using the addition property among DCT coefficients",0.165939153439,0.156904761905
7B7F1B15,"The Modulation Method Based on Reed-Solomon Code for Watermarking",0.282142857143,0.344444444444
76761DD2,"Mini track: 'ethical, legal and economic issues in the digital economy: intellectual property rights, piracy, trust, security and privacy'",0.198947811448,0.127682811016
5EE6D1A2,"Safe Transmission of Text Files through a New Audio Steganography Technique",0.165939153439,0.118975468975
5ACB290B,"Digital watermarking capacity analysis in wavelet domain",0.155429292929,0.103977272727
83A6680E,"카메라 폰 상에서 사용자 인증을 위한 디지털 워터마킹 기법",0,0
78699DAD,"An FPGA-based intellectual property protection method at physical design level",0.186574074074,0.153333333333
7F648266,"A robust watermarking algorithm for copyright protection",0.169907407407,0.138888888889
793F28B5,"An Algorithmic Digital Audio Watermarking in Perceptual Domain Using Direct Sequence Spread Spectrum",0.172294372294,0.150336700337
09EACCF1,"A New Hybrid Watermarking Algorithm for Images in Frequency Domain",0.160058922559,0.109027777778
7815D986,"A novel fast and robust digital image watermarking using Bee Algorithm",0.155429292929,0.149273504274
79441B20,"Design and Fabrication FM-VMS using Watermarking Method",0.190740740741,0.2125
77B78F9C,"Three-Dimensional Mesh Model Watermarking Algorithm",0.148336385836,0.104166666667
5A404CCC,"A private watermarking for halftone image by stochastic error diffusion",0.162373737374,0.108333333333
7BF411FA,"Digital Rights Management - from the guest editors",0.155892255892,0.0986111111111
79E1097D,"Sequential Multiple Signature Scheme Based on Wavelet Domain Digital Watermarking",0.260858585859,0.274848484848
7F039CEA,"Steganalysis of Data Hiding for Two-Dimensional Engineering Graphics Based on Characters Statistic",0.289087301587,0.305555555556
750D9696,"Reverse concatenated watermark codes",0.274470899471,0.358630952381
5EAE207F,"Fusing digital audio watermarking and authentication in diverse signal domains",0.322558922559,0.343333333333
76A4BE3E,"A new colour image watermarking scheme using Cellular Automata Transform and Schur decomposition",0.153114478114,0.133564814815
756A7AF7,"A hybrid watermarking scheme using Contourlet transform and fuzzy logic",0.139407814408,0.16452991453
765F74DD,"Chaos based authentication watermarking scheme for combined video and audio data",0.425,0.377380952381
636AC748,"A content authentication scheme of H.264 video based on compressed",0.425,0.5625
75CFB2A9,"Analysis and comparison of holographic and traditional digital image watermarking in DWT domain",0.155429292929,0.109027777778
781D251A,"Watermarked cardiac CT image segmentation using deformable models and the Hermite transform",0.153114478114,0.147777777778
79DA8760,"Binary Image Watermarking Through Blurring, Biased Binarization",0.148484848485,0.121428571429
79D6E757,"New watermark scheme for copyright protection of the stereovision system using adaptive disparity matching algorithm",0.315151515152,0.272916666667
83ACAB61,"Horizontal pairwise reversible watermarking",0.266666666667,0
772BCB89,"A robust watermarking algorithm based on time-frequency analysis in S transformation domain",0.26654040404,0.29
77AE6DDC,"Probability algorithm of digital watermark's relationship and analysis",0.321031746032,0.307142857143
59C8D1D8,"Neural network based system for optimal watermark embodiment in audio signals",0.456818181818,0.435185185185
7BB611C7,"Robust logo embedding technique for copyright protection",0.193055555556,0.159848484848
169B44E3,"Low Power Block-Based Watermarking Algorithm(Application Information Security)",0.191865079365,0.15
7EDB14C1,"Privacy Disclosure: Personal Information and Images on Social Networking Sites in Taiwan",0.199007936508,0.140674603175
08D91173,"Barcode Pattern Image Watermark Using Triplet",0.301262626263,0.381060606061
7C81AE5E,"A New Watermarking Protocol of Copyright Protection",0.176851851852,0.152777777778
7F7E5B0B,"Blind grayscale logo watermarking based on image fusion principles",0.290740740741,0.308181818182
592C36F3,"Improving fixed-point implementation of QR decomposition by rounding-to-nearest",0.127972027972,0.1375
76B1A18A,"Near Perfect Correlation Functions Based on Zero-Sum Projections",0.269907407407,0.331730769231
7A83EDB9,"Self-Authentication Mechanism with Recovery Ability for Digital Images",0.160648148148,0.104861111111
7574A370,"Performance and area efficient transpose memory architecture for high throughput adaptive signal processing systems",0.213888888889,0.141121031746
791E1019,"A New Histogram Based Image Watermarking Scheme Resisting Geometric Attacks",0.27705026455,0.302142857143
10985DB0,"Wavelet-based Electronic Watermarking Algorithm for Digital Holography Interference Patterns",0.160058922559,0.0923611111111
7522CAD9,"A wavelet networks approach for image image watermarking",0.265013227513,0.283181818182
860BE992,"Robust and Sensitive Watermarking Scheme for Colored Image",0.148484848485,0.0916666666667
78BECE4B,"JP3D compressed-domain watermarking of volumetric medical data sets",0.158796296296,0.125
5D94517E,"Watermarking Algorithm that is Adaptive on Geometric Distortion in consequence of Restoration Pattern Matching",0.165740740741,0.160894660895
7D4F875F,"Damageless Information Hiding using Neural Network on YCbCr Domain",0.184920634921,0.228333333333
7BFCE540,"A Secure Quantization-Based Watermarking Scheme Using An Improved Statistical Model in the Wavelet Domain",0.149747474747,0.138181818182
7EE7C101,"Nonparametric algorithm for local frequency estimation of multidimensional signals",0.203240740741,0.149305555556
7BFA053F,"State encoding watermarking for field authentication of sequential circuit intellectual property",0.314087301587,0.285119047619
7B732F51,"Reducing Host Interference from Spread Spectrum Watermarking",0.155413105413,0.122222222222
78C81735,"Optimizations using the genetic algorithm for reversible watermarking",0.148336385836,0.183080808081
7799EBD3,"An Improved Scheme for Digital Watermarking Using Functional Link Artificial Neural Network",0.158796296296,0.163194444444
72F5D9CF,"Java 프로그램에 적용가능한 소프트웨어 워터마킹",0.101461038961,0.142857142857
80BB68E0,"Better privacy and security in e-commerce: using elliptic curve-based zero knowledge proofs",0.170568783069,0.140646258503
7A54F223,"Turbo codes behavior over near impulsive noisy channels: Audio watermark detection case",0.325661375661,0.274410774411
771390AB,"Digital Watermarking Algorithm Based on Wavelet Analysis",0.262694250194,0.335227272727
738CC07F,"영상 압축에 강인한 변질검증 워터마킹에 관한 연구",0,0
2DD997F1,"Standard Deviation-Based Image Fidelity Measure for Digital Watermarking",0.153114478114,0.0981481481481
5ABDA969,"Research of digital watermarking based on wavelet transform",0.262694250194,0.405303030303
7D804D42,"Video applications on hyper-threading technology",0.134391534392,0.144841269841
22E6CA22,"A New Content Broadcasting System Applying Watermarking Technique",0.165740740741,0.154848484848
6CEE1A13,"Log-scaling magnitude modulated water-marking scheme",0.118518518519,0.125
5D78259B,"An extension of DHSPT to color half-tone images",0.12904040404,0.15
77AA2A2D,"A high performance video frame extractor for omni media monitoring system",0.177976190476,0.116666666667
75E26031,"Design and research on the platform of network manufacture product electronic trading",0.190740740741,0.132431457431
854020F4,"위치보간기를 이용한 3D 애니메이션 워터마킹",0,0
5AB94F56,"A Watermarking Algorithm of Database Based on Improved Sharing Secret Scheme",0.290151515152,0.303888888889
78532487,"Robust optical watermarking technique by optimizing the size of pixel blocks of orthogonal transform",0.160704110704,0.13088023088
7F10E6AA,"Protecting GIS Data Using Cryptography and Digital Watermarking",0.158796296296,0.166515151515
59D09CF0,"Wytwarzanie znaku wodnego w czasie rzeczywistym",0.0904882154882,0.1
7B9B0502,"Low-bit-rate video watermarking using temporally extended differential energy watermarking (DEW) algorithm",0.177976190476,0.168055555556
7BC320CD,"Watermarking electronic text documents containing justified paragraphs and irregular line spacing",0.161503774004,0.161970899471
7DACC92D,"Picture quality evaluation strategy using a watermarking technique",0.172883597884,0.147757335257
7B5B1FC2,"A protection system for web server resources",0.144907407407,0.138737373737
2D997B0F,"Digital Watermarking of 2D Vector Map Data for the Accuracy and Topology of the Data",0.160648148148,0.104255698006
59B42AE3,"Digital Color Image Watermarking for HVS(Human Visual System) using Daubechies wavelet",0.160058922559,0.152070707071
78AD0C1E,"Geometrically Invariant Image Watermarking via Robust Perceptual Hashes",0.149747474747,0.0954545454545
743BABED,"깊이 및 텍스쳐 영상 기반의 3D 입체 영상을 위한 워터마킹 알고리즘",0,0
71DDA6FD,"Data hiding in MPEG-2 bit stream domain",0.130291005291,0.125555555556
7824EFEF,"A new measure of image scrambling degree based on statistical hypothesis testing",0.551388888889,0.508333333333
7BA382FE,"A Blind Associative Watermarking Technique Using Self-Embedding",0.14357031857,0.212121212121
75C415DD,"Software watermark algorithm based on Chinese remainder theorem",0.433796296296,0.421296296296
5D13B237,"A fragile watermarking based on the triplet of wavelet coefficients",0.260858585859,0.320454545455
59EF0024,"A robustness and audibility analysis of a temporal envelope modulating audio watermark",0.311574074074,0.268981481481
7A2DFC39,"Researches on digital image watermarking algorithm in DWT domain with chaotic encryption",0.155429292929,0.115
7717F362,"Embedding distortion modeling for non-orthonormal wavelet based watermarking schemes",0.257012432012,0.266414141414
76B8447D,"Reversible Watermarking for Digital Audio Based on Cochlear Delay Characteristics",0.282142857143,0.340277777778
81118E8C,"Active Content Fingerpriting",0.158796296296,0.125
7AD56A28,"Attacks on Kuribayashi's Fingerprinting Scheme",0.096225996226,0.113095238095
816DD49B,"Prototype for protection of important e-documents base on digital watermarking",0.167003367003,0.122895622896
765A29C3,"Universal watermark estimation scheme based on error probabilities",0.432142857143,0.410383597884
7D506BC7,"Two-layer fragilewatermarking method for enhanced tampering localisation",0.151262626263,0.0923076923077
58E2023C,"Digital Watermarking of Virtual Machine Images",0.153114478114,0.105555555556
6DE3A051,"Reaching the Interactive Customer: Interactive Audio",0.171031746032,0.2
7A6DB944,"An audio/video crypto — Adaptive optical steganography technique",0.154559329559,0.116883116883
72D27F66,"資料隱藏技術應用於 H.263 視訊編碼之錯誤偵測",0,0
80B3058A,"A digital watermarking algorithm against dithering attack based on Watson perceptual pattern",0.274146224146,0.315793650794
7AF3DD56,"A watermarking scheme for natural language documents",0.18367003367,0.142063492063
799DA557,"Particle Swarm Optimization based parameter optimization technique in medical information hiding",0.311772486772,0.237563131313
7D780B54,"Efficient reversible image watermarking by using dynamical prediction-error expansion",0.149747474747,0.174747474747
66048E4F,"Double random scrambling algorithm based on subblocks for image hiding",0.273484848485,0.328333333333
78B45434,"A Fragile ROI-Based Medical Image Watermarking Technique with Tamper Detection and Recovery",0.148484848485,0.0912878787879
8018D5E1,"Measuring error on 3D meshes using pixel division",0.155429292929,0.178333333333
798BC029,"Extending and analysis of digital image authentication watermarking scheme",0.311111111111,0.301666666667
09BE2201,"DIGITAL WATERMARKING UNTUK PENGENAL KEPEMILIKAN FILE VIDEO",0.171031746032,0.145833333333
4B41F721,"原音周波数に基づくオクターブ類似性の検証 (第43回可視化情報シンポジウム 講演論文集) -- (オーガナイズドセッション 心理情報と可視化Ⅱ)",0,0
7A7017F5,"A Robust EMD-Like Stegnographic Scheme",0.139407814408,0.0833333333333
799FBF66,"SVD-based robust watermarking using fractional cosine transform",0.146500721501,0.216666666667
7C3DA24F,"Digital watermarking scheme for extremely high-resolution printing images",0.162572150072,0.10873015873
7DDB2CE2,"Image authentication technology based on semi-fragile scrambling watermarking",0.422222222222,0.55625
7B04F412,"Watermark detection on quantized transform coefficients using product bernoulli distributions",0.301262626263,0.264177489177
78416D62,"Statistical Steganalysis of Four Photo Themes before Embedding",0.186772486772,0.175925925926
78E6803F,"Spread spectrum image data hiding in the encrypted discrete cosine transform coefficients",0.172685185185,0.113383838384
772D93E0,"Genetic Watermarking with Block-Based DCT Clustering",0.152046102046,0.111111111111
774A1ACF,"Error correction coding of nonlinear side-informed watermarking schemes",0.158405483405,0.110524891775
7F7AF165,"A study on frame encryption for protecting IPTV contents",0.135119047619,0.135793650794
21E754DD,"Performance Analysis of Digital Image Watermarking Techniques using Zernike Moments and Discrete Cosine Transform",0.165740740741,0.139177489177
764ECEC6,"Cyclostationary Signature Detection in Multipath Rayleigh Fading Environments",0.103240740741,0.0970707070707
769F85F7,"Toward a multi-feature approach to Content-Based Copy Detection",0.245227920228,0.400673400673
7CA214E8,"Uniform Selection of Vertices for Watermark Embedding in 3-D Polygon Mesh Using IEEE754 Floating Point Representation",0.311574074074,0.23297008547
7DBEC227,"Efficiency of data structures for detecting overlaps in digital documents",0.17123015873,0.136970899471
76568ACC,"Performance analysis of high dynamic range image watermarking based on quantization index modulation",0.269907407407,0.214930555556
78396006,"Simplified MAP Detector for Binary Fingerprinting Code Embedded by Spread Spectrum Watermarking Scheme",0.182804232804,0.137085137085
7BD8026B,"Robust Network Covert Communications Based on TCP and Enumerative Combinatorics",0.272883597884,0.339691558442
7BE76747,"A dual digital audio watermarking algorithm based on LWT",0.289087301587,0.430555555556
77F11662,"Error detection scheme for the H.264/AVC using the RD optimized motion vector constraints",0.177976190476,0.141717657343
80B47607,"Word length based zero-watermarking algorithm for tamper detection in text documents",0.282142857143,0.245696763554
7693E322,"A progressive QIM to cope with SVD-based blind image watermarking in DWT domain",0.158796296296,0.14375
05F66876,"Technical Section: Topology authentication for CAPD models based on Laplacian coordinates",0.418448218448,0.399966931217
7BFE0685,"Digital watermarking in parametric slant transform domain",0.146500721501,0.1
7BEB1EA9,"Study on reversible visible watermarking scheme for digital images",0.153114478114,0.0981481481481
78C916D3,"Analyze the Digital Watermarking Security Demands for the Facebook Website",0.171027583528,0.130303030303
7D2D6E39,"Watermarking attack: BOWS contest",0.0972943722944,0.10873015873
7C406F17,"A Decision Theoretic Approach to Data Leakage Prevention",0.301262626263,0.328258547009
18D3214F,"アダマール基底と輝度画像の Wavelet 係数の直交性を用いた電子透かし法",0.087567987568,0.0909090909091
5E197ED1,"Notice of Retraction The blind watermarking model of the vector geospatial data based on DFT of QIM",0.27962962963,0.23956043956
7E6CAF24,"A Trust Model based DRM technology on Distributed P2P and IPv6 Networks",0.276851851852,0.274074074074
811A5C13,"Spatial noise shaping based on human visual sensitivity and its application to image coding",0.269516594517,0.257204700062
5CB52DD1,"Implementation of real-time management system to control intruder trace-back system",0.160058922559,0.158888888889
7A2AE889,"Fast optimum decoding for nonadditive readable watermarking",0.266666666667,0.125
76AF0D48,"Optimal detection of multiplicative watermarks in Laplacian channels",0.303114478114,0.400673400673
82EF0475,"재난방송 서비스를 위한 T-DMB 시스템 기반의 부가정보 전송 기법 연구",0,0
755B53A9,"Real-Time Compressed- Domain Video Watermarking Resistance to Geometric Distortions",0.177976190476,0.120643939394
79A7FB7D,"Image Watermarking Based on Wavelet-Based Contourlet Packet Transform with Best Tree",0.269907407407,0.328977272727
797E0C7D,"Optimization on digital watermarking algorithm based on SVD-DWT",0.259447496947,0.405303030303
75B4B61F,"Investigation of digital hologram watermarking with double binary phase encoding",0.153561253561,0.122008547009
76AEA30E,"Dirty Paper Coding with a Finite Input Alphabet",0.182407407407,0.150694444444
7C0F09A8,"Robust Audio Watermarking in Frequency Domain for Copyright Protection",0.184920634921,0.133888888889
788AB82E,"Three-dimensional image quality measurement for the benchmarking of 3D watermarking schemes",0.179828042328,0.123214285714
78F46777,"A robust watermarking scheme for stereoscopic video frames",0.171031746032,0.116666666667
71755F99,"Reversible image watermarking on prediction errors by balance the capacity of negative and positive histogram",0.162962962963,0.105555555556
7060F069,"Radon/ridgelet signature for image authentication",0.248947811448,0.4
0ADAAFAB,"Notes on Privacy Enhanced Protocol for Digital Watermark",0.313756613757,0.300793650794
770FC63C,"A New Scheme for Data Hiding on Halftone Images",0.158796296296,0.145
7AFC71CF,"A blind watermarking method based on cellular automata transform domain",0.264225589226,0.327777777778
7FF0AEAF,"A unified technique for robust digital watermarking of colour images using data mining and DCT",0.160648148148,0.139546102046
5D99E77A,"Robust digital watermarking system for still images",0.155429292929,0.1125
