Paper ID,Title,Sim1,Sim2
78948592,"Dynamic QoS Evaluation of Multimedia Contents in Wireless Networks by “Double-Boomerang” Watermarking",0.168716931217,0.118975468975
754EAF4C,"Crim's content-based audio copy detection system for TRECVID 2009",0.128637566138,0.123421717172
794D2176,"Semi fragile watermarking using Gaussian mixture model for malicious image attacks",0.168716931217,0.145905483405
760345CF,"Secure fingerprint embedding based on modified GDFT based parametric transform",0.272614885115,0.511904761905
7551008A,"Recent advancement in audio steganography",0.172883597884,0.154761904762
83A56A60,"A ROBUST VIDEO WATERMARKING BASED ON DWT FRAMEWORK AGAINST TRANSCODING",0.282142857143,0.416666666667
0CF2D684,"Steganografia ja kuvien digitaalinen vesileimaus",0,0
5B5A7EA2,"DWT-Based Watermarking Using 2DLDA for Color Images",0.153114478114,0.181481481481
5DC48BD7,"셀룰라 오토마타 변환을 이용한 정지영상 보호 방법",0,0
849F0377,"기하학적 구조 및 위치 보간기를 이용한 3D 애니메이션 워터마킹",0,0
80AD862E,"Collusion-resistant fingerprints based on the use of superimposed codes in real vector spaces",0.297883597884,0.282661782662
813AA32A,"A new visible watermarking technique applied to CMOS image sensor",0.153114478114,0.158838383838
7DEA670C,"A Novel Fractional Discrete Cosine Transform Based Reversible Watermarking for Biomedical Image Applications",0.269516594517,0.335714285714
7B7731EC,"Digital Watermarking of Spectral Images Using DWT-SVD",0.148484848485,0.216666666667
76289FB5,"A semi-blind logo watermarking scheme for color images by comparison and modification of DFT coefficients",0.131355218855,0.12380952381
6F60F4F6,"Some theoretical bounds on the capacity of watermarking channels with geometrical distortions",0.167003367003,0.117171717172
816A7D8A,"Perceptual DFT Watermarking With Improved Detection and Robustness to Geometrical Distortions",0.154377104377,0.0976430976431
838A4E3C,"Multi-Layer Reversible Data-Hiding Scheme on 3D Mesh Models",0.139407814408,0.0833333333333
79F86E65,"Algorithm of Digital Watermark Based on Wavelet",0.41654040404,0.553977272727
7F0740CB,"Watermarking in H.264/AVC Compressed Domain Using CAVLC",0.146500721501,0.211111111111
81D1C538,"Component-based digital watermarking of Chinese texts",0.154034391534,0.125
7792F14A,"FFT Based Blind Watermarking Algorithm for Three Dimensional Motion Picture",0.290939153439,0.350694444444
6C72D677,"Adaptive Invisible Watermarking Model for Securing Ownership Rights of Digital Images using SIFT features in Bi-orthogonal Wavelet domain",0.167201779702,0.135233285233
75C21191,"Combining Multilevel Manipulation Estimation with Content-Based Authentication Watermarking",0.289351851852,0.368055555556
7EB49260,"Optimal DWT-SVD Domain Image Watermarking Using Multi-objective Evolutionary Algorithms",0.155429292929,0.164583333333
5968359D,"An adaptive image watermarking scheme for color images using S-CIELAB",0.153114478114,0.145555555556
75EB2545,"Reversible transformations may improve the quality of reversible watermarking",0.168716931217,0.164285714286
82AAE781,"植基於數位浮水印之H.264/AVC視訊內容驗證機制",0,0
833C61F1,"A robust digital watermarking algorithm based on framelet and SVD",0.259447496947,0.5625
7D0DE7E8,"Aspects of a Watermark Solution",0.24788961039,0.396011396011
00A667C6,"High Capacity Digital Watermarking Systems",0.153445165945,0.1125
6013E88A,"Reconstruction of missing blocks in image transmission by using self-embedding",0.163035113035,0.185257335257
7FF5D1FB,"A new wavelet content-based watermarking technique",0.145901320901,0.0909090909091
755FCAE3,"Feature Based Video Watermarking Resistant to Geometric Distortions",0.283405483405,0.335227272727
788089A4,"A Data Hiding Scheme on Word Documents Using Multiple-Base Notation System",0.182142857143,0.15376984127
77FA4AA3,"A Fragile Watermarking algorithm based on fractal compression and differentials record theory",0.280627705628,0.251907814408
7CA3CED0,"A modified moment-based image watermarking method robust to cropping attack",0.158405483405,0.127380952381
79052231,"Framework for media data and owner authentication based on cryptography, watermarking, and biometric authentication",0.422222222222,0.438446969697
7908D9FE,"Intelligent Decoding for Mean Quantization Based Audio Watermarking in the Wavelet Transform Domain",0.260858585859,0.279848484848
783DF00A,"A lifting based system for optimal image compression in the wavelet domain",0.267803030303,0.249873737374
7BFF95CE,"Data hiding using adaptive embedding in two dimensional histogram approach",0.311574074074,0.347222222222
7F03DAA5,"High capacity image watermarking in the joint spatio-frequency domain",0.148484848485,0.1
7B6FE080,"A Video Zero-Watermark Algorithm against RST Attacks",0.134391534392,0.144841269841
599A9F45,"A Novel Audio Scrambling Algorithm in Variable Dimension Space",0.179828042328,0.159126984127
759618E3,"The Source Identification Game: An Information-Theoretic Perspective",0.130429292929,0.144444444444
789613E4,"3D Animation Watermarking Scheme using Orientation Interpolator",0.163035113035,0.167658730159
7BE9A263,"Feature point-based 3D mesh watermarking that withstands the cropping attack",0.114281551782,0.130952380952
060F039E,"Supporting Digital Watermarks with Error-Correcting Codes",0.321031746032,0.5
78939CA2,"Frequency domain infrared watermarking for printed CMYK image",0.13367003367,0.140277777778
786E3FF2,"Motion-estimation-based registration of geometrically distorted images for watermark recovery",0.30404040404,0.29
759B41AE,"An investigation of robustness in nonlinear audio watermarking",0.171031746032,0.118233618234
795A36E1,"Notice of Violation of IEEE Publication Principles Enhanced Blowfish algorithm using bitmap image pixel plotting for security improvisation",0.179828042328,0.144811207311
7D3FAB53,"Parametrically controlled stochastically seeded clustered halftones: design strategies and applications",0.173484848485,0.179931972789
790FF1B8,"A Digital Watermarking Algorithm Based on Wavelet Packet Transform and BP Neural Network",0.276851851852,0.293181818182
21FFEAF3,"モノクロ画像を対象とした透かし埋め込み方式についての検討 (映像表現&コンピュータグラフィックス)",0,0
7A711FB2,"Differential forensics of DC-DM based watermarking",0.254354904355,0.555555555556
7A246D9F,"Message Passing Using the Cover Text as Secret Key",0.185984848485,0.190740740741
7CC12FDF,"Data Hiding in Halftone Images using Error Diffusion Halftoning with Adaptive Thresholding",0.176851851852,0.15119047619
83F16ACC,"An efficient audio watermark by autocorrelation methods",0.321031746032,0.422222222222
7BC65E40,"Secret Restoration Algorithms for the Image Data",0.165740740741,0.110227272727
7A3887CD,"Halftone image watermarking based on visual cryptography",0.259595959596,0.316666666667
5F8D2F85,"A Practical Multipurpose Color Image Watermarking Algorithm for Copyright Protection and Image Authentication",0.319318181818,0.246825396825
7ACD5612,"Adaptive Client-Side LUT-Based Digital Watermarking",0.266666666667,0
5DC77264,"3D mesh watermarking using subdivision surface representation",0.163035113035,0.18253968254
81C859AF,"Information securitY - The SCAN - Secure processor with crypto-biometrics capabilities",0.13835978836,0.138005050505
7F3386E1,"Image watermarking based on fuzzy inference filter",0.264225589226,0.323611111111
7716FE56,"5/3 integer wavelet transform for images based on Visual C++",0.260858585859,0.39696969697
8011AD14,"Distributed Cutting Algorithm of Remote Sensing Images on Internet",0.156691919192,0.160984848485
7B31380C,"Public key watermarking issue",0.157744107744,0.111111111111
79FB585B,"Image authentication by watermarking with error correction based on wavelet transform",0.422222222222,0.401136363636
7BA265F2,"Combining the Neural Network and the Chaotic Map to Construct Blind Digital Watermarking Scheme",0.160648148148,0.163888888889
783DA281,"Homomorphic image encryption",0.10021043771,0.1125
59838367,"Statistically Secure Extension of Anti-collusion Code Fingerprinting",0.180952380952,0.136507936508
7D5F7C09,"A WAV Format Audio Digital Watermarking Algorithm Based on HAS",0.290151515152,0.414583333333
7C3A9059,"LEAN: laser-etched aqua number",0.146500721501,0.0916666666667
7E42C5C9,"Image watermarking based on wavelet transform using threshold selection",0.26654040404,0.329848484848
7B179ECC,"A robust digital watermarking scheme based on integer wavelet using compound encryption",0.27117003367,0.261002886003
7A60E2AA,"Image Integrity Authentication Scheme Based on Fixed Point Theory",0.418055555556,0.352655677656
7F0C15FB,"Image Protection by Intersecting Signatures",0.142929292929,0.154166666667
7B327A50,"Multipurpose watermarking scheme using essentially non-oscillatory point-value decomposition",0.139407814408,0.159722222222
750CB247,"DWT-based multiple watermarking for privacy and security of digital images in e-commerce",0.151262626263,0.0920512820513
806479A0,"Digital watermarking in digital images",0.148484848485,0.1
6FA91B41,"An Exploration of Rights Management Technologies Used in the Music Industry",0.177976190476,0.14103951604
750B5921,"The Algorithm of Color Image Watermarking Based on SIFT",0.27117003367,0.334027777778
593C3179,"Ultra-Low Overhead Dynamic Watermarking on Scan Design for Hard IP Protection",0.176262626263,0.166666666667
0B09571B,"Wavelet Domain Watermark Algorithm Based on Median Filtering",0.419318181818,0.463181818182
5DC63CD6,"Segmentation of speakers during emergency call with watermarking technique",0.10021043771,0.0967676767677
06C82574,"Αναζήτηση 3Δ αντικειμένων με βάση το περιεχόμενο",0,0
7582578D,"The domain block video watermarking scheme based on video sequences' characteristics and DCT",0.289285714286,0.230357142857
79775EA8,"Reversible watermarking using edge based difference modification",0.28167989418,0.34246031746
7A63199D,"On an optimal robust digital image watermarking based on SVD using differential evolution algorithm",0.279828042328,0.340238095238
7E434F94,"An intelligent watermarking algorithm based on Genetic Programming",0.259447496947,0.416666666667
26450E67,"A Study on Direct Audio detection From Second time's Video",0.175661375661,0.117171717172
7208B7F0,"A robust spread-spectrum watermarking method using two-level quantization",0.148484848485,0.172222222222
76B863A5,"A conceptual model on the application of digital watermarking",0.154559329559,0.113095238095
7BAB921C,"A Novel Robust Watermarking Method for Certificates Based on DFT and Hough Transforms",0.26712962963,0.408333333333
770E4CD8,"Watermarking security part one: Theory",0.126924001924,0.10873015873
7C106C0A,"Catch the mark: Teaching data hiding by gaming",0.140939153439,0.137092999593
78D94D80,"2D approaches to 3D watermarking: state-of-the-art and perspectives",0.301262626263,0.55
7BBBED4C,"An improved blind watermarking method in frequency domain for image authentication",0.306944444444,0.256018518519
7AD54CFD,"A study of influence between digital watermarking and steganography",0.163035113035,0.121693121693
80F36B21,"A new spatial decomposition scheme for image content-based watermarking",0.148484848485,0.0819444444444
7624504D,"The video water marking scheme based on MPEG-4 motion vector",0.283994708995,0.257814407814
778A56AB,"A telemedicine protocol based on watermarking evidence for identification of liabilities in case of litigation",0.281481481481,0.246428571429
7A7E050D,"Robust Digital Watermarking Algorithm on Combination of Fractal and Wavelet",0.165740740741,0.113636363636
7C90FC89,"Signal processing for smart cards",0.171693121693,0.142857142857
7AA480AF,"All frequency band DWT-SVD robust watermarking technique for color images in YUV color space",0.167201779702,0.115708101422
7AD53006,"Multiple watermarking on digital medical images for tamper detection and integrity control",0.158796296296,0.106755050505
7D4FA2A1,"Study on the forming mechanism and safeguard procedures of Electrical Fast Transient Burst",0.167003367003,0.112820512821
5F39A4E7,"Secure hybrid multibit multiplicative watermarking for media distribution over mobile Internet",0.155429292929,0.105303030303
7FDC3438,"An Electronic Seal Based on Wavelet Transform Solution",0.265488215488,0.323232323232
7FF711DA,"DWTC: A Dual Watermarking Scheme Based on Threshold Cryptography for Web Document",0.290796703297,0.301904761905
80EC1DB2,"Low power implementation of audio watermarking using chirp spread spectrum technique",0.161574074074,0.141877104377
7B9E9805,"Wafer management between coat/developer track and immersion lithography tool",0.146759259259,0.139083139083
808B8ACB,"Hiding Facial Information in Color Image",0.184920634921,0.198611111111
803800D0,"Interpolation based image watermarking resisting to geometrical attacks",0.305952380952,0.327142857143
78466098,"A digital image watermarking scheme based on singular value decomposition and principal component analysis",0.26654040404,0.218727106227
774A408D,"A robust digital video watermark algorithm based on DCT domain",0.439087301587,0.478333333333
7C8D2CF9,"ImQual: a web-service dedicated to image quality evaluation and metrics benchmark",0.153439153439,0.133399470899
6C3FC579,"Data hiding in the bit stream domain for MPEG-2 coded video sequences exploiting space and frequency masking",0.167328042328,0.143903318903
7619220F,"DCT-domain robust data hiding using chaotic sequence",0.158796296296,0.222916666667
7F322998,"Digital Image Watermarking Program",0.148484848485,0.1
7EBD3877,"Processing Certificate of Authorization with Watermark in Security",0.275066137566,0.307222222222
80308DDC,"An experimental study on failure diagnosis of water supply network by immune system",0.169907407407,0.118402777778
024A3210,"Security Improvement of a Transformed-key Asymmetric Watermarking System",0.101473063973,0.105303030303
7D225450,"Spread transform watermarking for video sources",0.1424001924,0.152525252525
81FD3282,"Culturally induced information impactedness: a prescription for failure in software ventures",0.191865079365,0.168518518519
792C986D,"Audio forensic marking for music streaming service",0.240476190476,0.227380952381
7FDC5A62,"Digital watermarking using cascading transform",0.266666666667,0.266666666667
777C878D,"Tamper-Localization Watermarking with Systematic Error Correcting Code",0.177976190476,0.163888888889
760029CE,"Robust digital watermarking using random casting method",0.151262626263,0.177777777778
5E2BA996,"Video authentication using spatio-temporal signature for surveillance system",0.322685185185,0.306018518519
7F770201,"Fractal Based Fragile Watermark",0.412373737374,0.7
78496841,"A watermark algorithm based on SVD and image geometric correction",0.419318181818,0.463181818182
767B3257,"Linguistically informed digital fingerprints for text",0.161503774004,0.144841269841
6C965306,"Digital watermarking : An approach based on Hilbert transform",0.410042735043,0.7
76B83DF7,"A Verifiable and Traceable Secondhand Digital Media Market Protocol",0.183796296296,0.152777777778
7620F837,"Robust Software Watermarking for Protecting Three Dimension Applications Developed Using jMonkey Engine",0.163035113035,0.177045969903
5FB46120,"RST invariant digital image watermarking based on a new phase-only filtering method",0.259595959596,0.4
5955A255,"Reversible Zero-Bit Watermark Based on Chaotic Encryption",0.41654040404,0.708333333333
59A91FE6,"The influence of watermark properties on the quality of a watermarked image",0.275072150072,0.295793650794
7B8DCDFA,"A new lossless watermarking scheme based on fuzzy integral and DCT domain",0.257611832612,0.394444444444
14DDE0ED,"A Digital Image Watermarking Method Using Interval Arithmetic(Digital Signal Processing)",0.20284992785,0.185238095238
5C669DE4,"Security for Video Surveillance with Privacy",0.129100529101,0.115277777778
598CEB5D,"C12. A Zernike Moment Based Rotational Invariant Watermarking Scheme",0.269907407407,0.402777777778
7ACD6033,"Technical Challenges for Digital Watermarking",0.152046102046,0.111111111111
7A0F852B,"Data Provenance with Watermarks for Usage Control Monitors at Disaster Recovery",0.262235449735,0.237193362193
004CB16B,"A Comparative Study on Fingerprint Protection Using Watermarking Techniques",0.176461038961,0.168975468975
760A63FD,"Optimal detector for an additive watermarking scheme based on human auditory system",0.259447496947,0.329861111111
76C5525A,"A blind information hiding scheme based on optimum embedding strategy",0.296031746032,0.35
78DE0840,"Industrial fabrication of an optical security device for document protection using plasmon resonant transmission through a thin corrugated metallic film embedded on a plastic foil",0.186111111111,0.152182539683
75A89435,"Incorporating Watson's perceptual model into patchwork watermarking for digital images",0.153114478114,0.110404040404
8092899B,"Blind Wavelet Based Logo Watermarking Resisting to Cropping",0.288157213157,0.330086580087
06AE1993,"Performance Improvement Scheme of T-DMB Watermarking Technique Using Convolutional Codes",0.17380952381,0.144191919192
7FBECC15,"Color digital watermark method based on non-symmetry and anti-packing pattern representation model",0.417003367003,0.359523809524
75828080,"Shedding light on some possible remedies against watermark desynchronization: a case study",0.163425925926,0.125330687831
5A9B8857,"A Chaotic Sequence Watermarking Algorithm for Infrared Image",0.155429292929,0.108333333333
7AF7F1AA,"Feature based blind approach for robust watermarking",0.405280830281,0.694444444444
780F9039,"Digital Watermarking Scheme Based on Chaotic Encryption and DWT",0.259447496947,0.402777777778
75661D96,"Dual watermarking based on Multiple parameter fractional Fourier transform and LSB technique",0.258527583528,0.316958041958
7B6A727A,"Intelligent embedding and decoding scheme for real time audio processing",0.180952380952,0.123571428571
7B5AFBF3,"Quantizer characteristics important for quantization index modulation",0.151851851852,0.0944444444444
7CFF266B,"On the Watermark String in the Davey-MacKay Construction",0.260984848485,0.425925925926
80F968AA,"A new robust blind DWT-SVD based digital image watermarking",0.259595959596,0.55
7EF1C0E8,"A collaborated computing system for load sharing with P2P environments: a study for the algorithm analysis in the digital watermark filter evaluation",0.311574074074,0.209956709957
802C0110,"Arbitrarily dirty paper coding and applications",0.163035113035,0.132275132275
7D653F00,"Perceptual Image Watermarking Algorithm Based on Magic Squares Scrambling in DWT",0.26654040404,0.310384615385
17E95D82,"Design and mathematical analysis of new spread spectrum watermarking schemes",0.180892255892,0.132070707071
7B36EA16,"Wavelet Digital Watermarking Algorithm on the Basis of SVD Decomposition",0.165740740741,0.100852272727
77452DF6,"Resisting Cropping Robust Adaptive Watermarking Embedding and Extracting Algorithm Based on Multi-address",0.259447496947,0.336904761905
5AF8EB72,"A Robust Digital Fingerprinting Mechanism for Digital Copyright Protection",0.174537037037,0.136408730159
802C271B,"Panorama de los ataques en los modelos 3D",0.078490953491,0.0833333333333
761AB649,"A new watermarking approach based on BP network in wavelet domain",0.422685185185,0.463181818182
751A81CE,"Scheme of Electronic Seal Based on Public Key Infrastructure",0.258874458874,0.318560606061
5DDB3549,"Multiresolution Watermarking for MPEG-4 2D Mesh Animation(Information Security)",0.13835978836,0.153703703704
7D614DA4,"Design of Document Access Control Mechanism on Cloud Services",0.13287037037,0.129024216524
7EFA09A2,"Polynomial complexity optimal detection of certain multiple-access systems",0.162962962963,0.113636363636
7DEDD190,"A non-blind watermarking on 3D model in spatial domain",0.146500721501,0.0916666666667
83C632B3,"효율적 워터마킹을 위한 웨이블릿 기반 RGB 채널 분석",0,0
7FC14760,"Error resilient MPEG-2 video coding schemes based on three layer error control coding",0.289087301587,0.243055555556
77F88AB3,"Error Concealment Using a Halftone Watermarking Technique",0.155429292929,0.146515151515
7C453A91,"Digital Audio Watermarking Algorithm based on Neural Networks",0.289087301587,0.354166666667
73A0BBE8,"Bounded Gaussian fingerprints and the gradient collusion attack [multimedia fingerprinting applications]",0.172492784993,0.144208965638
59F78E6A,"Hash Functions and Other Topics",0.184920634921,0.155303030303
7BFFBD8D,"Use of adaptive models in watermark identification",0.315151515152,0.340277777778
78FA0B91,"A novel fragile watermark applying in verification",0.297416472416,0.474747474747
7F643641,"A Digital Audio Multi-Watermarking Algorithm Based on Improved Quantization",0.259447496947,0.402777777778
753ED529,"Semi-fragile watermarking algorithm based on bi-watermarking technology",0.259447496947,0.416666666667
31D77BB5,"A Watermarking Algorithm of 3D Mesh Model Using Spherical Parameterization",0.148336385836,0.180555555556
7CE2176A,"A novel JADE based robust digital watermarking algorithm",0.27117003367,0.331755050505
095657B9,"Detection of image alternation and image ID by two digital watermark methods with error correction",0.308207070707,0.20322671156
78CFC1E3,"A Novel Authentication Mechanism for Improving the Creditability of DRM System",0.309126984127,0.371527777778
79578343,"Digital Copyright Protection Scheme Based on JUNA Lightweight Digital Signatures",0.281018518519,0.295
80B42F9E,"Application of Digital Watermark and Mobile Agent in Copyright Protection System",0.322685185185,0.28373015873
78822CD3,"An implement of fast hiding data into H.264 bitstream based on intra-prediction coding",0.287962962963,0.311904761905
7A1F1589,"A Robust Feature-Based Image Watermarking Scheme",0.148484848485,0.0916666666667
77BE6EB7,"VQ-BASED GRAY WATERMARK EMBEDDING SCHEME WITH GENETIC INDEX ASSIGNMENT",0.308207070707,0.295
77F5A311,"Multimedia systems security",0.0982263107263,0.1125
7D4608AF,"Efficient archiving of documents with protection of their authentic content",0.177976190476,0.144841269841
80D493DD,"On Optimal Watermarking Schemes in Uncertain Gaussian Channels",0.149268324268,0.0972222222222
7B481BAE,"Image Digital Watermarking Algorithm Based on Arnold Scrambling and Wavelet Transform",0.26654040404,0.328977272727
765BB34E,"An active attack on chaotic based text zero-watermarking",0.26567044067,0.571428571429
75D9BEAF,"Progressive watermarking on 3D meshes",0.146500721501,0.1
814E4916,"Brokerage architecture for stock photo industry",0.0959114959115,0.0992929292929
7F102D78,"Applying dual digital watermarking technology in digital rights management",0.155429292929,0.163194444444
8491316F,"General watermarking model and its applications",0.154559329559,0.113095238095
7B27E1E0,"Hybrid Additive Multi-watermarking Decoder",0.147558922559,0.111111111111
782B1653,"A novel DWT-SVD based watermarking scheme",0.250518925519,0.541666666667
75F2D135,"A comparative study on insertion strategies in MPEG-4 AVC watermarking",0.18955026455,0.148148148148
7A65607A,"Gray-level image watermarking with high capacity based on spread transform",0.260858585859,0.322727272727
7681E6B4,"Encryption Scheme Based on Invertible Watermarking",0.259447496947,0.402777777778
794345AD,"Genetic Algorithm-Backpropagation Network Hybrid Architecture for Grayscale Image Watermarking in DCT Domain",0.160648148148,0.109027777778
7BC8E51E,"Compression-compatible digital watermark algorithm for authenticity verification and localization",0.311574074074,0.287626262626
8153875B,"LSB Algorithm Research Based on Chaos",0.26654040404,0.3375
0061EF07,"Advanced techniques in digital watermarking and data hiding for still images",0.172685185185,0.120643939394
7B4B4BBB,"Research of Digital Watermarking Based on DWT and Holography Image",0.26654040404,0.322916666667
14BA0CA5,"Digital Watermarking using Wavelet Packet Transform",0.160058922559,0.183080808081
5F5020C6,"Time-axis based video watermarking resisting to geometrical attacks",0.292063492063,0.363095238095
7A8DFB61,"Reversible video watermarking based on histogram modification of motion compansated prediction error",0.289087301587,0.275462962963
768B2FAD,"Optimal watermarking rate allocation in variable bit-rate compression",0.158796296296,0.102777777778
79A24D56,"Audio-watermarking based ownership verification system using enhanced DWT-SVD technique",0.280627705628,0.297168109668
7C33EF4B,"Attacking the IDS learning processes",0.147558922559,0.156944444444
79859576,"A New Watermarking Algorithm for 3D Stereoscopic Image based on Depth and texture images",0.27117003367,0.256018518519
7239BE88,"Robust image watermarking research based on DCT transform",0.26654040404,0.408333333333
7645CD7E,"Video watermarking for mobile phone applications",0.180952380952,0.136507936508
5D487B9F,"CAS를 이용한 IPTV 콘텐츠의 저작권 보호 기법",0,0
5D086796,"Rotation and scale insensitive image watermarking",0.155892255892,0.103703703704
7F4CE0B7,"Color Watermarking Algorithm Based on Modified QFFT and DCT",0.27117003367,0.412037037037
7B8C5C4E,"Audio watermarking using frequency hopping method",0.171031746032,0.182222222222
80C8252C,"Analysis and Simulation on SVD-Based 3D Mesh Digital Watermark Algorithm",0.305429292929,0.34375
8043D48C,"Information Hiding Techniques: A Tutorial Review",0.184920634921,0.189393939394
59C320C6,"Block based digital watermarking using singular value decomposition on color images",0.272883597884,0.260960666318
796E46F7,"A New Blind Detection Method Based on Channel Reliability Estimates for Robust Watermarking",0.274537037037,0.229134754135
7AFC337C,"Performance analysis of multiplicative distortion-compensated quantized projection",0.155429292929,0.111195054945
