Paper ID,Title,Sim1,Sim2
7D30672F,"A quantified fidelity criterion for parameter-embedded watermarking of audio archives",0.112235449735,0.106481481481
7ABB487D,"Reversible visible watermarking for H.264/AVC encoded video",0.171031746032,0.183333333333
259D14A0,"A Digital Watermark Method Using the Wavelet Transform for Video Data(Special Section on Cryptography and Information Security)",0.336183261183,0.23920995671
79F6AE75,"A Model for the Electronic Representation of Bank Checks",0.163035113035,0.107052669553
319F4E6F,"Naveen.S.Hampannavar et.al / International Journal of Engineering and Technology (IJET) FPGA implementation of DWT for Audio Watermarking Application",0.172492784993,0.127142857143
56F2D315,"Visual cryptography for color images by dithering techniques",0.153114478114,0.117070707071
7C0D5D87,"Feature-based watermark localization in digital capture systems",0.308207070707,0.340277777778
756479A2,"A public key watermarking based on hyper-chaotic cellular neural network",0.271759259259,0.412037037037
7B019250,"Contents-based digital image protection using 2-D cellular automata transforms",0.167003367003,0.177777777778
7621C86B,"QIM data hiding for tamper detection and correction in digital images using wavelet transform",0.172685185185,0.142532467532
8025B042,"Digital watermarking algorithm based on block singular value decomposition and BP network",0.283994708995,0.25538003663
5F7E5CE2,"A watermarking scheme using image object recognition",0.148484848485,0.154166666667
7A779D93,"A novel image watermarking scheme using Extreme Learning Machine",0.153114478114,0.145555555556
83921AE3,"Lossless Text Compression Technique with LSB Technique to Hide Secret Message inside an Image (CLSB)",0.18367003367,0.149747474747
7658B967,"Low-complexity video watermarking scheme resisting geometric distortions",0.172294372294,0.120941558442
79C2BB23,"Robust lossless watermarking based on circular interpretation of bijective transformations for the protection of medical databases",0.297095959596,0.313333333333
802891A4,"RST invariant video watermarking based on log-polar mapping and phase-only filtering",0.282142857143,0.430555555556
794E908C,"Capacity of Additive Colored Noise Watermarking Channel with Perceptual Distortion Measure",0.153114478114,0.122558922559
77B6ACE6,"A satellite image watermarkig scheme based on perspective distance",0.259595959596,0.320833333333
7A050AFF,"Pattern defect study using cover material film in immersion lithography",0.163425925926,0.136351495726
80B3202F,"Improving embedding capacity with minimum degradation of stego-image",0.151262626263,0.154166666667
79EB4594,"DCT-Based Video Watermarking Transcoding Technique",0.124470899471,0.128787878788
0278F1A2,"Image Processing Oriented to Security Optimization",0.131289081289,0.126753246753
7DCB42E1,"Intrusive and non-intrusive watermarking",0.266666666667,0
3BCC1392,"Optical Watermark Based On Digital Printing",0.42413003663,0.714285714286
7DEDC973,"Generation of digital signature from multi-feature biometric traits for digital right management control",0.170568783069,0.118015873016
7CB2F687,"Content Based Image Hashing Robust to Geometric Transformations",0.272685185185,0.293571428571
7BCE3A31,"A self-adaptive blind detection color watermarking algorithm based on wavelet contrast",0.276851851852,0.238275613276
811CA979,"An attack on the Hwang-Chang-Hwang watermarking scheme",0.096225996226,0.113095238095
81036BBC,"디지털 워터마킹을 위한 DCT 기반 칼라 채널 분석",0,0
01D0EFD4,"Security in CAI Materials by Embedding Digital Watermarks",0.303561253561,0.347916666667
7582F8F3,"Bi-level image watermarking for image authentication surviving JPEG lossy compression",0.304166666667,0.323333333333
75B16759,"A novel digital image transforming method and its watermarking scheme",0.148484848485,0.133333333333
85F2AB6F,"Performance analysis of information hiding",0.152248677249,0.160416666667
79AED387,"Blockwise image watermarking system with selective data embedding in wavelet transform domain",0.164225589226,0.117929292929
1101DEE2,"Remote physical signatures and stamps (RPSS): A simple scheme based on digital watermarking and public key cryptography",0.266524216524,0.248148148148
782E0EBC,"Research of digital watermarking based on wavelet transform",0.262694250194,0.405303030303
7B972A2C,"A hybrid image watermarking scheme based on SVD and DCT",0.259595959596,0.394444444444
7BA033D2,"Reversible watermarking algorithm in application for medical images",0.158405483405,0.122619047619
692972E1,"Securing images online: a protection mechanism that does not involve watermarking",0.167003367003,0.193518518519
8486156A,"홀로그램을 이용한 위치기반 워터마킹",0,0
5A72F133,"Novel robust video watermarking algorithm based on adaptive modulation",0.289087301587,0.302777777778
7FA88CF0,"Text watermarking algorithm based on the stroke of Chinese characters",0.274074074074,0.284848484848
7C51859A,"Intellectual property protection (IPP) using obfuscation in C, VHDL, and Verilog coding",0.172685185185,0.157016594517
625A7172,"Optimizing PSNR for Image Watermarking Using Summation Quantization on DWT Coefficients",0.162962962963,0.158333333333
7B7B81FA,"A mesh-based robust digital watermarking technique against geometric attacks",0.154559329559,0.116883116883
258EC092,"An Efficient Quantization Watermarking on the Lowest Wavelet Subband( Digital Signal Processing)",0.20284992785,0.141774891775
5F683D14,"DWT image watermarking algorithm based on scrambling algorithm",0.26654040404,0.32
7FC397E0,"A Novelty Approach for Image Data Hiding Based on Frequency Watermark",0.572685185185,0.472569444444
75FF694D,"A Robust Watermarking Algorithm against Geometric Distortions",0.151583139083,0.107954545455
79451ABC,"Software watermark research based on Portable Execute File",0.426851851852,0.472222222222
7B9B6E15,"Spread transform capacities for image media using complex wavelets",0.156691919192,0.140025252525
7FBC0D7C,"General Gaussian Watermarking Model Research and Application",0.154559329559,0.117063492063
79C07204,"TDA Tabanli Referans mge ile Sayisal Damgalama Digital Watermarking with SVD Based Reference Image",0.274074074074,0.422222222222
594D51A8,"Enhanced spread spectrum image watermarking with compression-encryption technique",0.107816257816,0.107157287157
76441826,"A DC-based Approach to Robust Watermarking with Hamming-Code",0.228296703297,1.0
7E6EF41C,"SoW: A hybrid DWT-SVD based secured image watermarking",0.259595959596,0.340625
79A21A23,"A blind audio watermarking algorithm robust against synchronization attacks",0.180952380952,0.144841269841
7F649746,"A novel steganography method via various animation effects in PowerPoint files",0.167201779702,0.115793650794
2347783F,"Steganografie a komprese kvantováním vektorů II.",0.0835275835276,0.0909090909091
78D6C3DE,"Optimality of SCS watermarking",0.0904882154882,0.1
7C9A1287,"Medical image integrity control using joint encryption and watermarking techniques",0.165740740741,0.147558922559
0282131C,"Invisible Digital Watermarking of Remotely Sensed Satellite Images - A New Approach",0.305892255892,0.365277777778
77A5DE8C,"Blind Error-Free Detection of Transform-Domainwatermarks",0.085236985237,0.0909090909091
8096BE52,"A novel content preserving watermarking scheme for multipectral images",0.158796296296,0.139583333333
775CF77B,"A novel anti-geometric-attacking watermarking algorithm based on Harris feature points",0.259447496947,0.321314102564
07607A6F,"Fast communication: Analyzing and removing SureSign watermark",0.31455026455,0.492063492063
58817603,"A blind watermarking algorithm based on wavelet lifting transform",0.262694250194,0.405303030303
7C443E89,"The New Blockwise Algorithm for Large-Scale Images Robust Watermarking",0.155429292929,0.1125
5CD1E0D2,"Optimized spread spectrum watermarking for fading-like collusion attack",0.122757335257,0.117693417693
7A8DE4E7,"Design and implementation of hardware based watermarking solutions for CMOS image sensors",0.292003367003,0.254761904762
844593C7,"A New Measure of Watermarking Security Applied on DC-DM QIM",0.148484848485,0.172222222222
58490144,"Semantically Extended Digital Watermarking Model for Multimedia Content",0.163425925926,0.129861111111
767922AD,"Watermarking Based on Complemented MLCA and 2D CAT",0.235462751081,0.533333333333
808D07AE,"A Compression-Resistant Invisible Watermarking Scheme for H.264",0.139407814408,0.0833333333333
79F9C355,"Biomedical Image Storage, Retrieval and Visualization Based-on Open Source Project",0.17784992785,0.122631072631
7AF5A606,"Time Identification of Electronic Documents",0.167201779702,0.117989417989
78CD4F03,"Collaborative Networking for Dynamic QoS Management in 3G Communications by "Boomerang" Watermarking",0.153114478114,0.0951178451178
7B469B1A,"Scalable protection for MPEG-4 fine granularity scalability",0.167003367003,0.122895622896
797436CD,"A Novel Synchronisation Approach for Digital Image Watermarking Based on Scale Invariant Feature Point Detector",0.424537037037,0.32593482906
7C0854E0,"Wavelet-based 3D mesh model watermarking",0.078490953491,0.0833333333333
5BF6AEFF,"Digital watermark: technique, application and improvement as a copyright-protecting method for RS and cartographic data",0.318716931217,0.234369202226
777DBD5B,"New gray-scale watermarking algorithm of color images based on Quaternion Fourier Transform",0.272685185185,0.254503367003
7C746459,"Dynamic stochastic resonance-based improved watermark extraction from audio signal",0.199873737374,0.208333333333
053C902F,"A Digital Watermarking Method for Java Class Files",0.165939153439,0.123214285714
77D60E9D,"Image authentication and tampering localization based on watermark embedding in the wavelet domain",0.572685185185,0.446085858586
858EC899,"Key indexes of the effectiveness of mask surface treatments",0.168716931217,0.120793650794
7949858F,"Detecting code theft via a static instruction trace birthmark for Java methods",0.194841269841,0.146329365079
770CDB45,"A Watermarking Method for Embedding Short Information Split into Audio and Video Signals",0.205892255892,0.17
7BB90659,"Regression of SVM based robust watermarking algorithm",0.262694250194,0.405303030303
5EFE03F5,"Adaptive Image Blind Watermarking Method Based on Zerotree of Wavelet",0.260858585859,0.322727272727
79E7E9FC,"Robust Watermark Using the Auxiliary Information",0.334920634921,0.527777777778
802D4C8C,"Robust digital watermarking in DFT and LPM domain",0.146500721501,0.1
806F8D6A,"Reversible watermarking without underflow and overflow problems",0.146500721501,0.1
75EBF828,"Novel angle quantization index modulation scheme for image watermarking",0.171296296296,0.112962962963
7E370227,"A Robust Blind Water Marking for 3D Meshes Using Distribution of Scale Coefficients in Irregular Wavelet Analysis",0.167592592593,0.139646464646
7C863C70,"Authorized MPEG-4 video fruition via watermarking recovering and smart card certification",0.172294372294,0.143590668591
6EC2B50A,"Overview of intense beam-driven relativistic backward wave oscillators and their use in high power microwave effects studies",0.17962962963,0.128377525253
7F826E31,"Robust digital image watermarking based on normalization and the two dimensional complex wavelet transform",0.264225589226,0.325505050505
76193DBB,"BCH Code-Based Robust Audio Watermarking Algorithm in the DWT Domain",0.177976190476,0.130555555556
82B487DB,"IMPLEMENTASI BLIND WATERMARKING DALAM APLIKASI M-TICKETING BERBASISKAN JAVA",0.101461038961,0.142857142857
7AB20846,"Spread spectrum watermark based on wavelet transform for still digital image",0.417003367003,0.398821548822
7C9FD9D7,"Wavelet-based watermarking for copy rights protection",0.110521885522,0.12037037037
5BE65B58,"Robust watermarking using orthonormal code spreading in the DWT domain [image watermarking]",0.172294372294,0.158181818182
7680ACC4,"A Robust Evolutionary Based Digital Image Watermarking Technique in DCT Domain",0.259595959596,0.322727272727
58B17918,"Robust digital watermarking based on fractal dimension in color images",0.264225589226,0.330555555556
7DDEEE5E,"A new ROI and block based watermarking scheme using DWT",0.267532467532,0.331904761905
7FBEA0BC,"Understanding Challenges in Preserving and Reconstructing Computer-Assisted Medical Decision Processes",0.167003367003,0.184444444444
7B8AEF5C,"Semi-Fragile Watermarking Scheme for Authentication of MPEG-1/2 Coded Videos",0.273611111111,0.354166666667
7B2840BC,"Ownership Proofs of Digital Works Based on Secure Multiparty Computation",0.286970899471,0.299365079365
7A033E49,"Key generation for static visual watermarking by machine learning",0.160648148148,0.112037037037
80D4CD4B,"Audio Digital Signature Algorithm with Tamper Detection",0.155429292929,0.105303030303
2FCC3818,"A Wavelet-based Blind Watermarking Scheme Using Pixel Correlation of Low Sub-band",0.158796296296,0.166666666667
7889C24F,"Digital Watermarking Technique in Wavelet Domain for Protecting Copyright of Contents",0.160257335257,0.124945887446
7C7064FE,"Recoverable image watermarking based on halftoning for content authentication",0.415277777778,0.7
7B83ADD7,"Experiment of Tamper Detection and Recovery Watermarking in PACS",0.0890831390831,0.0893939393939
593C1770,"A New Geometric-Transf ormation Robustand Practical Embedding Scheme forWatermarking 2D Vector Maps intheGraph Spectral Domain",0.15113035113,0.107606837607
7E3208AC,"A Synchronous Fragile Watermarking Scheme for Erroneous Q-DCT Coefficients Detection",0.147416472416,0.0914141414141
772EFE12,"CV-SIFT Algorithm for Image Detection",0.10021043771,0.105303030303
78DD4E28,"A Software Watermarking Algorithm Based on Stack-State Transition Graph",0.289087301587,0.300555555556
7F114CFB,"Detecting Hidden Information from a Spread Spectrum Watermarked Signal by Genetic Algorithm",0.191865079365,0.155404040404
84CD2B61,"Securing Digital Images over the Internet Using a Robust Watermarking Scheme",0.149747474747,0.161515151515
7CDE0E9E,"Fragile audio watermarking scheme based on sample mean sequence",0.282142857143,0.3375
7A39D225,"A geometrically resilient robust image watermarking scheme using deformable multi-scale transform",0.148484848485,0.172222222222
7762B2A2,"Encryption for High Efficiency Video Coding with video adaptation capabilities",0.177976190476,0.137235449735
778F4B4D,"Using DCT coefficients flipping for information hiding in still images",0.19880952381,0.191666666667
7F4816B1,"A new image scrambling algorithm",0.155429292929,0.158333333333
7834CEBB,"End-to-End QoS Provision and Control in Wireless Communication Systems by Means of Digital Watermarking Signal Processing",0.171693121693,0.126322751323
7FFC7530,"Reversible binary image data hiding by run-length histogram modification",0.172685185185,0.125555555556
790A69E1,"A Robust High-Capacity Watermarking Algorithm",0.148336385836,0.125
798971EC,"Data hiding in angle quantization",0.126124338624,0.125
79575A08,"Watermark performance contrast between contourlet and non-subsampled contourlet transform",0.265013227513,0.408333333333
5C4D38BC,"A study of biorthogonal wavelets in digital watermarking",0.149268324268,0.10101010101
5AF66FAC,"A Study on the Performance of the Watermarking with Wavelet Transform",0.0978956228956,0.100673400673
6A7CE98D,"Quality Estimation of Video Transmitted over an Additive WGN Channel based on Digital Watermarking and Wavelet Transform",0.288624338624,0.260379303236
7C0D3559,"A Robust Chaos-Based Watermarking for Copyright Protection",0.169907407407,0.145833333333
7E7CD895,"Security challenges during VLSI test",0.100657213157,0.0941798941799
6B12DA5A,"Private and blind digital fingerprinting schemes based upon complete complementary codes",0.292063492063,0.348214285714
10E55B18,"IHC評価基準における圧縮率と加法電子透かし法の最適なパラメータとの関係 (マルチメディア情報ハイディング・エンリッチメント)",0,0
7BC2BE1D,"Content-Based Rotary Kiln Flame Image Retrieval",0.149747474747,0.0893939393939
78934DD0,"Primal sketch based visual entropy model for digital watermarking",0.264672364672,0.323611111111
02F0305D,"Using the discrete wavelet transform to Haar'd code a blind digital watermark",0.299747474747,0.397727272727
8116C248,"PSO-based robust watermarking of AVS-encoded video",0.171031746032,0.166666666667
7A0092E7,"Genetic Hash Algorithm",0.151583139083,0.107954545455
7585A26E,"Watermarking signal fusion in multimodal biometrics",0.151262626263,0.0857142857143
79F24567,"A simple and secure watermarking protocol",0.160978835979,0.166666666667
76563046,"An interleaving approach of enhancing the performance of RS codes in two dimensional space",0.325661375661,0.273881673882
7E5A00DB,"An IP Protection Algorithm by Watermarking Multiple Scan Chains Based on Minimum Correlation Degree of Vectors",0.283796296296,0.224104020979
8598C039,"Authenticating Super-Resolved Image and Enhancing Its PSNR Using Watermark",0.301262626263,0.33746031746
004D95BE,"A Blind Watermarking Algorithm using CABAC for H.264/AVC Main Profile",0.169516594517,0.200396825397
5C96EE7C,"A cryptographically secure image watermarking scheme",0.148484848485,0.0916666666667
76B61584,"Zero-Watermark Scheme Based on Audio's Statistical Character",0.282142857143,0.333333333333
7AE7528E,"SVD based image manipulation detection",0.264225589226,0.325505050505
016C2719,"A critical analysis of the use of IP as a form of information warfare against the developing world",0.205952380952,0.13985260771
7F055FF1,"Efficient coherent phase quantization for audio watermarking",0.153114478114,0.0972222222222
725A49B7,"Multiple sequence families with efficient hardware architecture for use in spread spectrum watermarking",0.17037037037,0.112987012987
78C95834,"An video watermarking algorithm based on wavelet domain",0.289087301587,0.296515151515
7C6A7863,"Relational Database Watermarking Algorithm Based on Comparison Table",0.290151515152,0.309444444444
5DB67556,"Data Hiding in Film Grain",0.127976190476,0.125694444444
58FCB652,"Digital watermarking : First International Workshop, IWDW 2002, Seoul, Korea, November 21-22, 2002 : revised papers",0.170161782662,0.130714285714
80E03305,"Data security in medical information system",0.189087301587,0.15
77C7B3EF,"Spread Spectrum-Based Image Watermarking Resistant to Rotation and Scaling Using Radon Transform",0.151262626263,0.183333333333
79C5F11A,"Processing encrypted signals: a new frontier for multimedia security",0.20284992785,0.160476190476
7B89F1A8,"A Improve Robust Watermarking Algorithm for Binary Images",0.155429292929,0.1125
09D0FD75,"A Novel Digital Image Protection using Cellular Automata Transform",0.167003367003,0.177777777778
61BCD9A0,"評価用RAW動画の撮影と新たな動画電子透かしシステムの提案 (マルチメディア情報ハイディング・エンリッチメント)",0,0
76B11473,"Automatic recording agent for digital video server",0.187698412698,0.150108225108
774AD586,"A Nonlinear Detector for Optimal DCT-Domain Watermark Detection",0.297416472416,0.400673400673
7ECBA359,"QR 코드를 이용한 디지털 워터마크 생성 방법 연구",0,0
7FED48E1,"Digital Image of Restoring Image Based on (7,4)Hamming Code",0.292063492063,0.279365079365
782D6E47,"Halftone visual cryptography",0.141391941392,0.0833333333333
7AFB82AD,"Image Watermarking Robust to Four-Color Printing and Fragile to High Resolution Copy",0.162572150072,0.119742063492
76DC4275,"A detection algorithm of hydrophobic levels based on triangle module operator",0.276851851852,0.236291486291
6FA3F4F7,"Copyright for Images with Chaotic Sequence",0.156018518519,0.108333333333
7820A4F3,"Facial region watermarking robust against rotation, scaling and translation attacks",0.18955026455,0.160793650794
7B244AA8,"Video object watermarking using 3D-Walsh Hadamard transform and Arnold transform",0.196031746032,0.25
7848CA3D,"Chaotic Watermarking System for Audio Based on Wavelet Packet",0.287572150072,0.301515151515
6F237917,"An integrated algorithm with watermarking and compression",0.108058608059,0.125
5D0833B1,"An Approach to Anti-counterfeit of Identity Document Based on Digital Watermarking and Digital Signature",0.427976190476,0.473571428571
81050343,"Implementation of Real Time DMB Encryption on PMP for Copyright Protection",0.169907407407,0.123333333333
80F2E5CD,"An optimized watermarking technique based on DE in DWT-SVD domain",0.263157213157,0.325505050505
78F19D5F,"A digital image watermarking of self-recovery base on the SPIHT algorithm",0.160058922559,0.112037037037
79214814,"A blind JPEG image watermarking in the DCT domain",0.112235449735,0.108333333333
793FE11D,"The Digital Image Watermarking Algorithm Based on Dopplerlet Transform",0.26654040404,0.408333333333
7CE0E537,"Selective weighting on wavelet coefficients for blind image watermarking system",0.156691919192,0.101363636364
80C2A0E5,"Performance Enhancement for DWT-HMM Image Watermarking with Content-Adaptive Approach",0.246043771044,0.322727272727
5A775407,"A new detecting scheme for blind images watermarking",0.163425925926,0.104861111111
5BBA2E66,"Image watermarking based on image normalization",0.264225589226,0.327777777778
007D2492,"Digital Watermarking Technique for Ownership Claim using Buyer Signature",0.167201779702,0.150144300144
09C60694,"Computer Generated Hologram for SemiFragile Watermarking with Encrypted Images",0.131818181818,0.1375
84EC7E3A,"A NONOBLIVIOUS WATERMARKING SCHEME FOR EMBEDDING SPREAD SPECTRUM-LIKE WATERMARKS IN THE WAVELET DOMAIN USING HVS CHARACTERISTICS",0.302525252525,0.265367965368
7B34D8D7,"An improved image least significant bit replacement method",0.153114478114,0.103703703704
5EC4E48B,"A Parallel Watermarking application on a G",0.154559329559,0.116883116883
816C67FD,"Digital watermarking in video broadcasting using a random walk method: Towards proprietorship",0.17380952381,0.152651515152
5ED93361,"Multimedia Digital Watermarking Detection System Based on Watermark",0.408527583528,0.553977272727
75265B47,"Watermarking: A copyright protection tool",0.119318181818,0.134259259259
78254EF5,"Fast Information Retrieval Method from Printed Images Considering Mobile Devices",0.193253968254,0.162987012987
5DD43EB2,"An adaptive fragile audio watermarking based on MDFT",0.282142857143,0.583333333333
8355CECF,"A new displaying technology for information hiding using temporally brightness modulated pattern",0.19880952381,0.19212962963
7BF26BE7,"Perceptual-Shaping Comparison of DWT-Based Pixel-Wise Masking Model with DCT-Based Watson Model",0.12322029822,0.117777777778
795A6D5C,"A Blind Watermarking Algorithm Based on Lifting Wavelet Transform and Scrambling Technology",0.262694250194,0.306818181818
80981B69,"An Anti-attack Watermarking Based on Synonym Substitution for Chinese Text",0.268392255892,0.405303030303
7C6FF1E0,"171Image Verification through Smoothness",0.0921976171976,0.0954545454545
5B729218,"Video watermarking combining with hybrid coding scheme",0.171031746032,0.166666666667
794703B8,"A robust digital watermarking scheme based on ICA",0.250518925519,0.541666666667
5DEEF25A,"A new time-frequency based fragile watermarking scheme for image authentication",0.415277777778,0.545833333333
7D22338C,"Performance Analysis of T-DMB TxID with Variable Watermarking Level",0.165740740741,0.116666666667
77AC9A1B,"Digital image ownership verification based on spatial correlation of colors",0.278312890813,0.258279220779
7A8364B5,"Research for adaptive audio information hiding approach based on DWT",0.44880952381,0.541666666667
5E5F463B,"Local watermarks based on Krawtchouk moments",0.419907407407,0.708333333333
75AD9136,"A Robust Image Watermarking Method Based on Adaptive Feature Points Detection",0.259595959596,0.241860916861
85F94FC7,"Optical and Digital Technique for Watermark Detection",0.297416472416,0.393939393939
7A8F02DC,"Gray Image Watermark Algorithm in Integer Wavelet Transform Domain",0.311574074074,0.254503367003
75C147F7,"D-mago: A novel visual entity for storing emotional feeling with visual imprint",0.184920634921,0.145643939394
788F560A,"Design of an H.264/SVC resilient watermarking scheme",0.108252858253,0.166666666667
7BB90B47,"Dual-Watermarking by QR-code Applications in Image Processing",0.131415343915,0.128571428571
7AAF0C51,"2D vector map watermarking based on spatial relations",0.271759259259,0.328258547009
7C8C014D,"Researches on Text Image Watermarking Scheme Based on the Structure of Character Glyph",0.276461038961,0.230206698064
5EF18B12,"A Digital Image Watermarking Method Based on Labeled Bisecting Clustering Algorithm",0.27117003367,0.287222222222
7D433556,"Text Watermarking Using Combined Image-plus-Text Watermark",0.306812169312,0.427083333333
7B0FC28F,"Traitor-tracing aided by compressed SURF image features",0.149747474747,0.131060606061
762E1AD8,"Digital watermarking method for tamper detection and recovery of JPEG images",0.148484848485,0.0935606060606
7620409E,"A Robust Digital Watermarking Algorithm Based on Digital Image Security",0.26654040404,0.33125
75820270,"A Method of Data Embedding and Extracting for Information Retrieval Considering Mobile Devices",0.193253968254,0.166571969697
7E353B59,"On the evaluation of wavelet filter banks for wavelet-based image watermarking",0.10484006734,0.103585858586
5D089DB9,"A multilevel image-adaptive digital watermarking algorithm based on chaotic sequences and ICA",0.26654040404,0.408333333333
76959501,"The optimum fuzzy logic approach for biomedical data classification",0.311574074074,0.336195054945
791EFFCD,"Adaptive Lagrange constraints neural network under multisensing",0.158796296296,0.107954545455
76F84643,"A B_Spline Based Image Compression and Watermarking Technique",0.259595959596,0.318560606061
08BAD9D7,"SPATIAL DOMAIN ROBUST IMAGE WATERMARKING SCHEME",0.148484848485,0.0944444444444
