Paper ID,Title,Sim1,Sim2
7D1CD266,"Interrogating the changing inequalities constituting ‘popular’ ‘deviant’ and ‘ordinary’ subjects of school/subculture in Ireland: moments of new migrant student recognition, resistance and recuperation",0.155086580087,0.151446280992
7770F30B,"Same, but different: Within London's ‘static’ class structure and the missing antagonism",0.0985858585859,0.0934027777778
58E9A72E,"How Can the Intersections between Gender, Class, and Sexuality Be Translated to an Empirical Agenda?",0.0906493506494,0.124778396207
7CB40FBE,"Class and employment",0.0906493506494,0.1
7848596E,"Why is there a lack of central funding for enterprise education at Further Education Colleges?",0.154848484848,0.180735930736
79461B0B,"When convenience is inconvenient: ‘healthy’ family foodways and the persistent intersectionalities of gender and class",0.0906493506494,0.136666666667
7BB09D00,"Class and Voting in the 1996 Australian Federal Election",0.152705627706,0.192063492063
5FBC37FD,"Aspects-classes integration testing strategy: an incremental approach",0.125238095238,0.148214285714
8031D86D,"Keywords given by authors of scientific articles in database descriptors",0.100252525253,0.150252525253
7B04DB91,"‘Mugging up’ versus ‘exposure’: international schools and social mobility in Hyderabad, India",0.0906493506494,0.0775641025641
8134CB55,"Fundamental ideas for a parallel computing course",0.276587301587,0.348611111111
7F4F7E64,"Analysis and improvement of runoff generation in the land surface scheme CLASS and comparison with field measurements from China",0.163737373737,0.116631516632
7E582DE2,"Class and Other Identifications in Managerial Careers: The Case of the Lemon Dress",0.136753246753,0.125396825397
782EE0C3,"Simulation of alpine tundra surface microclimates using the Canadian Land Surface Scheme: II. Energy balance and surface microclimatology",0.127308802309,0.122006781098
7EEE586C,"Class, Individualization and Perceived (Dis)advantages: Not Either/Or But Both/And?",0.0906493506494,0.138414918415
