Paper ID,Title,Sim1,Sim2
7FA900E3,"Servo Performance Enhancement of Motion System via a Quantization Error Estimation Method—Introduction to Nanoscale Servo Control",0.170562770563,0.142464325798
7942BC3A,"Adaptive friction compensation of servo mechanisms",0.113888888889,0.111111111111
7F9CFE71,"A coordinated control algorithm based on the caster-like motion for a car transportation system -iCART-",0.181991341991,0.191869588745
7EC8609A,"Steering Limitations for a Vehicle Pulling Passive Trailers",0.0949300699301,0.161363636364
801A780E,"Next generation actuators leading breakthroughs",0.127157287157,0.181944444444
7E1164E4,"An approach to acceleration estimation using FPGA",0.0967857142857,0.194444444444
80CD7FFD,"Running and turning control of a quadruped robot with compliant legs in bounding gait",0.105555555556,0.165873015873
804F938D,"Dual-loop adaptive decoupling control for single wheeled robot: Based on Neural PID controller",0.107070707071,0.165404040404
7E18C17E,"Effect of different training modes on ground reaction forces during robot assisted floor walking and stair climbing",0.142142857143,0.143849206349
7D57BD9E,"Learning for the Control of Dynamical Motion Systems",0.160173160173,0.233630952381
8028B9A8,"Command State-Based Modifiable Walking Pattern Generation on an Inclined Plane in Pitch and Roll Directions for Humanoid Robots",0.137546897547,0.11801497114
7B95FF93,"A Methodology for the Evaluation of Travel Techniques for Immersive Virtual Environments",0.109523809524,0.111178266178
7F59F151,"Comparison of two types of PM linear synchronous servo and miniature motor with air-cored film coil",0.116197691198,0.115426587302
7F5FA5DF,"Development of humanoid robot action control system using independent microprocessors",0.130086580087,0.151252319109
7B849450,"Human-Inspired Multi-Contact Locomotion with AMBER2",0.097619047619,0.125
80D8BE57,"Turning of a Short-Length Cable Using Flapping Fin Propulsion",0.125952380952,0.203333333333
7E5AB113,"Pmxedings of the 1993 IEEE(RSJ International Conference on Intelligent Robots and System Thermal Path Following Robot Vehicle: Sensor Design and",0.126118326118,0.14558531746
7DC567CD,"Sensorless Tilt Compensation for a Three-Axis Optical Pickup Using a Sliding-Mode Controller Equipped With a Sliding-Mode Observer",0.102051282051,0.144781144781
8082E11F,"Falling motion control for humanoid robots while walking",0.153823953824,0.213888888889
7D0C9C82,"Mixed Initiative Control of Autonomous Vehicles",0.108333333333,0.125
80C81B20,"Adaptive compliance control of electrically-driven manipulators",0.12,0.125
7F862516,"Experimental study of two robot arms manipulating large objects",0.139285714286,0.137698412698
80AB91EE,"A path-space search algorithm for motion planning with uncertainties",0.228804528805,0.26380952381
815394FF,"Image-based visual servo control of aerial robotic systems using linear image features",0.114935064935,0.152386964887
81CC6D48,"Modal System Design of Multirobot Systems by Interaction Mode Control",0.132467532468,0.135770975057
7F46B6ED,"Control of an electrostrictive actuator using Newton's method",0.108585858586,0.154292929293
7A966840,"Magnetic levitation with unlimited omnidirectional rotation range",0.124848484848,0.140740740741
7F67A368,"Stability and control of robotic manipulators during contact/noncontact task transition",0.128333333333,0.125555555556
8080D226,"Development of an FPGA-Based Motion Control ASIC for Robotic Manipulators",0.160238095238,0.170833333333
8093399D,"Indoor navigation with uncertainty using sensor-based motions",0.157375957376,0.238095238095
7E683243,"Symbolic control for underactuated differentially flat systems",0.11341991342,0.133928571429
80D2C387,"Self-collision avoidance and angular momentum compensation for a biped humanoid robot",0.110622710623,0.10746031746
7CF356F0,"Wideband Force Control by Position-Acceleration Integrated Disturbance Observer",0.132222222222,0.142777777778
7DE2FED9,"Real-time planning of humanoid robot's gait for force controlled manipulation",0.188888888889,0.217592592593
7F2FB9B4,"Amphibious 3D active cord mechanism "HELIX" with helical swimming motion",0.17380952381,0.16746031746
7F3B6A8B,"Comparison between two actuation schemes for underactuated brachiation robots",0.122222222222,0.118737373737
78F2B1BD,"Comments on "Sliding-mode motion/force control of constrained robots",0.113888888889,0.134259259259
5DDFC4B2,"Control of a quadrotor helicopter using visual feedback",0.11341991342,0.171130952381
803FBF0A,"Design and development of an electric-powered stair-climbing wheelchair",0.0964502164502,0.111255411255
80BAD215,"Smart and physically-based navigation in 3D geovirtual environments",0.109523809524,0.133928571429
7DCB6CC0,"Robust adaptive motion control for Remotely Operated Vehicles with velocity constraints",0.156601731602,0.161666666667
73F55D7F,"Experimental verification of a strategy for impact control",0.103174603175,0.106755050505
7E76560B,"Exact synthesis of biological pattern generation: a circulant paradigm",0.130238095238,0.140277777778
7E8C28F3,"Investigation of the effects on stability of foot rolling motion based on a simnle walking model",0.146986346986,0.175438142105
7DABA423,"Existence of feedbacks from sensing to action for stable grasping and dexterous manipulation by multi-fingered robot hands",0.14126984127,0.1411751443
7F400F49,"Locomotion of a biped robot with compliant ankle joints",0.108888888889,0.103258547009
7EE0D015,"Adaptive Vision and Force Tracking Control for Constrained Robots",0.108888888889,0.108207070707
80663919,"Offline and online trajectory generation with sequential physical constraints",0.135471195471,0.155555555556
7DCE684B,"Analysis of bionic hydrofoil propulsive performance",0.114682539683,0.126322751323
7EF360E0,"Virtual decomposition based control for generalized high dimensional robotic systems with complicated structure",0.12,0.172420634921
7D85C898,"Autonomous Navigation of Mobile Robots Using Optimal Control of Finite State Automata",0.120793650794,0.149272486772
7DCEF10A,"Formation control of mobile agents using local potential functions",0.131753246753,0.185238095238
7EB5BC9A,"Precise positioning control of a micropositioning system with nonminimum-phase plant",0.11341991342,0.148214285714
789F42ED,"Robust nonlinear motion control for AUVs",0.146986346986,0.229166666667
7DB63F57,"Robust Adaptive Constrained Motion Tracking Control of Piezo-Actuated Flexure-Based Mechanisms for Micro/Nano Manipulation",0.161904761905,0.178240740741
812E0572,"Remarks on ISS and formation control",0.125081585082,0.163888888889
7AAC0A81,"Measuring and predicting resolution in nanopositioning systems",0.137546897547,0.157142857143
7E0672DF,"Fuzzy controller for wall-climbing microrobots",0.0845454545455,0.0909090909091
7E9AE078,"Haptic broadcasting of grasping operation by multilateral control",0.103174603175,0.152777777778
7F8F25B9,"An open-loop stepper motor driver based on FPGA",0.104273504274,0.159722222222
7E96F9E7,"Compensation of unmodeled puma manipulator dynamics",0.111666666667,0.0838293650794
7DAFBF05,"Adaptive control for frictional robot contact tasks on uncertain surface slopes",0.138888888889,0.134259259259
7D3666D7,"Implementation of force control on redundant robot",0.111111111111,0.114583333333
7FBEAE4F,"Landing posture control of a generalized 5-RDOF twin-body system via methods of input-output linearization and PD control",0.114935064935,0.13985260771
81079B01,"Simultaneous design of membership functions and rule sets for fuzzy controllers using genetic algorithms",0.158658008658,0.181601731602
7EAD7CAA,"Formation Control of Underactuated Surface Vessels using the Null-Space-Based Behavioral Control",0.140086580087,0.172222222222
7FAA4695,"The dynamic analysis of the backward swimming mode for biomimetic carangiform robotic fish",0.119280719281,0.121909340659
7E0CE03C,"Multi-locomotion robot-energy based motion control for dexterous brachiation",0.148804528805,0.222916666667
8118C92D,"Exploring scalar fields using multiple sensor platforms: Tracking level curves",0.118506493506,0.17306547619
7D0E1166,"A method for co-evolving morphology and walking pattern of biped humanoid robot",0.108888888889,0.128108465608
7CFF84DA,"Large motion control of mobile manipulators including vehicle suspension characteristics",0.16341991342,0.17766955267
7C6EDF49,"Motion control of liquid container considering an inclined transfer path",0.166991341991,0.167328042328
7BB82C5D,"3-D self-assembling and actuation of electrostatic microstructures",0.114285714286,0.166666666667
7E90ECF9,"The virtual COM joints approach for whole-body rh-1 motion",0.156904761905,0.186111111111
8158E48A,"Omni-directional robot and adaptive control method for off-road running",0.107070707071,0.106036324786
7FAC27BE,"Online dynamical retouch of motion patterns towards animatronic humanoid robots",0.155642135642,0.167361111111
7A1BEAE6,"Seam tracking and visual control for robotic arc welding based on structured light stereovision",0.118571428571,0.166865079365
814275EE,"The Twente humanoid head",0.0878787878788,0.0954545454545
80A4D670,"A distributed reconfigurable control law for escorting and patrolling missions using teams of unicycles",0.153823953824,0.191418650794
7D6578BC,"Constrained motion planning for the airpath of a Diesel HCCI engine",0.235238095238,0.228888888889
8013CCEF,"A PbD approach for learning pseudo-periodic robot trajectories over curved surfaces",0.131666666667,0.180555555556
8078250B,"Passive-Based Walking Robot",0.0909401709402,0.105555555556
7D83A242,"Self-tuning of robot program primitives",0.104848484848,0.111111111111
8045958B,"Fuzzy PD+ control for robot manipulators",0.113888888889,0.12037037037
7DA7A375,"High-accuracy visual/PSD hybrid servoing of robotic manipulator",0.111666666667,0.125
7FE1BE57,"Emulation of robots interacting with environment",0.105555555556,0.146527777778
7E75EFBD,"A Darboux-Frame-Based Formulation of Spin-Rolling Motion of Rigid Objects With Point Contact",0.177380952381,0.155086580087
81770CEF,"Bouncing monopod with bio-mimetic muscular-skeleton system",0.0964502164502,0.171428571429
810E3D58,"Behavior modification for continuous locomotion of brachiation-type mobile robot",0.113888888889,0.12037037037
7B9D4348,"A Study on Straight-Line Tracking and Posture Control in Electric Bicycle",0.113888888889,0.117222222222
7FBAEE31,"Stable PD and Internal Force Control of Omnidirectional Wheeled Mobile Manipulators",0.111666666667,0.125555555556
7EFB762F,"A complete solution to asymmetric S-curve motion profile: Theory & experiments",0.154126984127,0.179292929293
7FB6B905,"Motion planning for nonlinear underactuated vehicles using H ∞ techniques",0.23841991342,0.278333333333
7D5EB91E,"Transport of an object by six pre-attached robots interacting via physical links",0.303896103896,0.329365079365
7EE19DBB,"Twice: a tilting angle amplification system for parallel robots",0.111197691198,0.124531024531
80A8C326,"The Robot Arm Distributed Digital Control Calculation",0.122222222222,0.13594017094
7C0168AF,"A simple hybrid fuzzy PD controller",0.0891341991342,0.0954545454545
7E610011,"Rehabilitation Robot Cell for Multimodal Standing-Up Motion Augmentation",0.155642135642,0.145555555556
7DC327DA,"Reference Trajectory Generation for Force Tracking Impedance Control by Using Neural Network-based Environment Estimation",0.135471195471,0.174563492063
7E4B2BA2,"A knowledge based control strategy for a biped",0.131666666667,0.163181818182
8002146B,"Closed loop low-velocity regulation of hybrid stepping motors amidst torque disturbances",0.146349206349,0.161772486772
800EE1B2,"Cross-Coupled Control for Three-Axis Turntable Target Tracking System",0.116991341991,0.165178571429
7D648BDD,"A new dynamic point specification approach to optimise surface mount placement machine in printed circuit board assembly",0.135476190476,0.121933621934
7FFD5853,"Control of contact conditions for manipulation with multiple robotic systems",0.121753246753,0.123214285714
7E904848,"Underwater glider motion control",0.148268398268,0.180555555556
7E27131F,"Deadzone compensation in motion control systems using neural networks",0.171601731602,0.202976190476
80C4DF92,"Cooperative Control for Formations of Mobile Robots under the Nonholonomic Constraints",0.127157287157,0.134027777778
7E66345D,"A robust multiestimation based stable adaptive control scheme for a tandem of master-slave robotic manipulators with force reflection",0.111666666667,0.143037518038
7A320F19,"Optimizing Learning Convergence Speed and Converged Error for Precision Motion Control",0.157375957376,0.199514991182
7F6F5B68,"Virtual attractive-repulsive potentials for cooperative control of second order dynamic vehicles on the Caltech MVWT",0.116666666667,0.121527777778
757680B2,"Robotic automatic assembly system for random operating condition",0.122077922078,0.126984126984
79931960,"A sliding walk method for humanoid robots using ZMP feedback control",0.120793650794,0.153902116402
77A766C1,"Real-time NURBS interpolation using FPGA for high speed motion control",0.146986346986,0.223333333333
80172733,"Robust internal loop compensator design for motion control of precision linear motor",0.164213564214,0.153902116402
802AAEB4,"Dynamic rolling, locomotion planning, and control of an icosahedral modular robot",0.188888888889,0.194444444444
7D5001FE,"Auto-calibration based control for independent metering of hydraulic actuators",0.105555555556,0.189814814815
7CF28C73,"Design and control of a fish-inspired multimodal swimming robot",0.11746031746,0.125992063492
8012242C,"Adaptive hybrid force-position control for redundant manipulators",0.111666666667,0.125
7F4212BA,"The CPG control algorithm for a climbing worm robot",0.11746031746,0.133975468975
7D13BC04,"Lateral control of autonomous vehicle for public urban mobility systems",0.122077922078,0.133928571429
7F022613,"Robust Vertical/Lateral/Longitudinal Control of an Helicopter with Constant Yaw-Attitude",0.1,0.104166666667
7D218F20,"Sensorless torque estimation in multidegree-of-freedom flexible systems",0.12119047619,0.144841269841
7D2A5EB1,"Transient Control of Electro-Hydraulic Fully Flexible Engine Valve Actuation System",0.131904761905,0.120905483405
80D4FECF,"Adaptive control of cyclic movements as muscles fatigue using functional neuromuscular stimulation",0.105952380952,0.151587301587
7EE1C8D2,"Modeling of Sawyer planar sensor and motor dependence on planar yaw angle rotation",0.124365079365,0.109764194139
80919051,"Stability analysis and robust control of a biped robot with four links and three actuators",0.295238095238,0.265013227513
80974321,"Removing the singularities of serial manipulators by transforming the workspace",0.111666666667,0.183333333333
7D53A9DB,"Dynamic Analysis on Fingers of the Underwater Multi-fingered Robot Hand",0.103823953824,0.105158730159
80A9B256,"Robust sliding mode based impedance control",0.124042624043,0.193571428571
7D406609,"Physics-based modeling of an anthropomimetic robot",0.0918925518926,0.105555555556
812275F1,"Formation control of robotic swarms based on sonar sensing",0.124935064935,0.166865079365
804CA47B,"Experiments in adaptive model-based force control",0.103174603175,0.115740740741
803CDC34,"A novel method for learning policies from constrained motion",0.146986346986,0.19595959596
7DA822F9,"Optimal Speed Control of Mobile Node for Data Collection in Sensor Networks",0.198333333333,0.219047619048
80B5DB7C,"Stair-Climbing Control of Humanoid Robot using Force and Accelerometer Sensors",0.108333333333,0.150925925926
7FC8E798,"Cooperative Control for Ocean Sampling: The Glider Coordinated Control System",0.121753246753,0.127976190476
80599C4D,"Real-time selection and generation of fall damage reduction actions for humanoid robots",0.142308802309,0.136281179138
7FF410FC,"Control characteristics of two humans in cooperative task and its application to robot control",0.153333333333,0.15404040404
7E7DD07A,"Manipulator control based on a disturbance observer in the operational space",0.151666666667,0.176851851852
7EBD9B72,"Real-Time Collision Avoidance in the Environment with Moving Obstacles",0.109523809524,0.16246031746
7DE4C3CD,"Seam tracking and welding speed control of mobile robot for lattice type welding",0.108888888889,0.116273849607
809B0B77,"Research on trajectory tracking of a parallel robot based on neural network PID control",0.137546897547,0.154818594104
7DCB15FB,"A Qualitative Visual Servoing to ensure the Visibility Constraint",0.088547008547,0.181481481481
7EF9499E,"Sliding mode method based vibration control of flexible arms",0.126118326118,0.166609977324
80EB733C,"Continuous integration of motion components using motion copying system",0.170562770563,0.21706864564
7DE69D74,"Adaptive robust precision motion control of linear motors with electromagnetic nonlinearity compensation",0.153823953824,0.152777777778
7E899D01,"Configuration control of 7 DOF arms",0.11341991342,0.122619047619
7EC9BB35,"Experimental Research of a Passive Multiple Trailer System for Backward Motion Control",0.170562770563,0.153048340548
77BB17AA,"Sensory state machines for physically-based animation",0.108333333333,0.111111111111
7FA91B6E,"Experimental investigation on high-performance coordinated motion control of high-speed biaxial systems for contouring tasks",0.175324675325,0.163265306122
7FF3F09C,"Learning motion dynamics to catch a moving object",0.170562770563,0.21619047619
7FF35BB3,"Neuro-adaptive motion control with velocity observer in operational space formulation",0.162222222222,0.15867003367
80EA710A,"Intelligent robotic manipulation with hybrid position/force control in an uncalibrated workspace",0.108333333333,0.111111111111
7F305B49,"Arm-manipulator coordination for load sharing using reflexive motion control",0.160173160173,0.200396825397
7CEAD7FF,"Development of a ball type of underwater robot",0.0909401709402,0.101388888889
807E59A4,"High accuracy motion control of linear motor drive wire-EDM machines",0.156601731602,0.16746031746
7D1E6729,"Simulating Human Lifting Motions Using Fuzzy-Logic Control",0.146986346986,0.248333333333
80A2CB73,"Modeling and Control of a 3-DOF pendulum-like manipulator",0.111666666667,0.116666666667
8105548E,"Tracking and set-point VFO control for an articulated mobile robot with on-axle hitched trailer",0.107070707071,0.144255050505
5DCABCAB,"Flocking in target pursuit for multi-agent systems with partial informed agents",0.129365079365,0.154365079365
7F3CC9FF,"Micro-positioning of linear-piezoelectric motors based on a learning nonlinear PID controller",0.090101010101,0.178451178451
7D05DC74,"Differentially Flat Design of Bipeds Ensuring Limit-Cycles",0.101601731602,0.192063492063
7EC11CAD,"Cooperative motion control of a robot and a human",0.153823953824,0.189814814815
017E7EEC,"Motion control and trajectory tracking control for a mobile robot via disturbance observer",0.179682539683,0.157936507937
8037882C,"Progress in spatial robot juggling",0.0883760683761,0.100673400673
7CFD60A8,"Power assist system for omni-directional transport wheelchair using fuzzy reasoning",0.143896103896,0.164687693259
812D56A7,"Motion generation for humanoid robots with automatically derived behaviors",0.187070707071,0.208888888889
7B202F8F,"${ \mmb{\eta } }^{3}$ -Splines for the Smooth Path Generation of Wheeled Mobile Robots",0.133975468975,0.14537037037
7D119927,"Dynamic impact shot control with VSC servo",0.11746031746,0.12251984127
7E651232,"UKEMI: falling motion control to minimize damage to biped humanoid robot",0.157864357864,0.175793650794
7FD16E33,"An EtherCAT based control system for human-robot cooperation",0.125324675325,0.186011904762
7D576217,"Fuzzy systems for slippage control of a pruning robot",0.12380952381,0.124365079365
7CED9735,"Learning nonlinear multi-variate motion dynamics for real-time position and orientation control of robotic manipulators",0.173571428571,0.17925170068
8160A3C4,"Side translation by simultaneous shuffle turn for humanoid robots",0.105404040404,0.135404040404
77A01AA0,"B-spline neural network design using improved differential evolution for identification of an experimental nonlinear process",0.161904761905,0.194642857143
7DC62FA8,"Adaptive control for constrained robots without using regressor",0.105555555556,0.189814814815
656B73C6,"Tool-point control of a planar hydraulically actuated manipulator with compensation of non-actuated degree of freedom",0.120324675325,0.130952380952
80E12A20,"A Differential State-Space Approach to Simultaneous Emulation of Uncertainties and Disturbances in Voltage-Controlled Brushless Motors",0.137546897547,0.135793650794
7EA3C187,"A robotic catapult based on the closed elastica with a high stiffness endpoint and its application to swimming tasks",0.124531024531,0.179138321995
762C83D4,"Neuromuscular control of reactive behaviors for undulatory robots",0.128888888889,0.14537037037
79DF94E4,"Cross-Coupled Adaptive Feedrate Control for Multiaxis Machine Tools",0.108333333333,0.125
7FE2C916,"Dynamic skill-based software architecture for locomotion control in shape reconfigurable mobile robots",0.108333333333,0.122685185185
807DE9C8,"Research on a novel R-θ wafer-handling robot",0.102541902542,0.126984126984
7F5D1478,"Network-Based Coordinated Motion Control of Large-Scale Transportation Vehicles",0.171601731602,0.195833333333
80727B70,"High-performance induction motor control via input-output linearization",0.108888888889,0.112037037037
7EFE0578,"1-DOF dynamic pitching robot that independently controls velocity, Angular velocity, and direction of a ball: Contact models and motion planning",0.235642135642,0.188246097337
59B27257,"A high-level control mechanism for human locomotion based on parametric frame space interpolation",0.140555555556,0.169444444444
7BAC11DA,"Control of mechanical motion systems with non-collocation of actuation and friction: A Popov criterion approach for input-to-state stability and set-valued nonlinearities",0.175324675325,0.157589285714
7EC3E8E0,"Levenberg-Marquardt Based Neural Network Control for a Five-fingered Prosthetic Hand",0.12031968032,0.185416666667
7E24557B,"Online walking gait generation with adaptive foot positioning through Linear Model Predictive control",0.12031968032,0.157138694639
750A6C4F,"Development of Multi Degrees-of-Freedom Bilateral Forceps Robot System Using FPGA",0.103116883117,0.15746031746
7EC01C6C,"Control of a mobile robot with passive multiple trailers",0.107070707071,0.102588383838
7FA43538,"Modeling neural control of robotic fish with pectoral fins using a CPG-based network",0.12031968032,0.166987179487
7D57F943,"Modeling and set point control of closed-chain mechanisms: theory and experiment",0.117222222222,0.126479076479
7F557AFE,"Wheel rolling constraints and slip in mobile robots - simulation results",0.135238095238,0.136569779427
7E89BF75,"Design of a collaborative wheelchair with path guidance assistance",0.144935064935,0.151753246753
80334F7B,"Design and analysis of a kind of biomimetic continuum robot",0.126118326118,0.126118326118
7F846CDB,"Motion control of 7-DOF arms: the configuration control approach",0.166991341991,0.158531746032
7DBEA0BF,"Proprioceptive control of a hybrid legged-wheeled robot",0.105555555556,0.118055555556
7D29F4F8,"High-Stroke Motion Modelling and Voltage/Frequency Proportional Control of a Stick-Slip Microsystem",0.153804528805,0.194444444444
7F4B1CBD,"A robot must be better than a human driver: an application of fuzzy intervals",0.144444444444,0.177777777778
80DF4914,"Realistic Visual and Haptic Rendering for Biological-Cell Injection",0.0867857142857,0.1
7DF4D3DB,"The flexible two-wheeled self-balancing robot intelligence controlling based on Boltzmann",0.110404040404,0.198737373737
81ED2AE5,"Coordinated motion control of robot arm based on virtual internal model",0.153823953824,0.176753801754
7F322F1C,"Motion control of the rabbit ankle joint using a flat interface nerve electrode",0.155642135642,0.151703678266
787E38E9,"Motion control analysis of a parallel robot assisted minimally invasive surgery/microsurgery system (PRAMiSS)",0.170562770563,0.184193121693
7BA22900,"Path Manifold-based Kinematic Control of Wheeled Mobile Robots Considering Physical Constraints",0.113888888889,0.132407407407
7DD29BAE,"Mobile robot navigation in an unknown environment",0.11746031746,0.126322751323
7EE1B859,"Exploiting robot redundancy in collision detection and reaction",0.120238095238,0.140013227513
802A184B,"Whole-body motion control for capturing a tumbling target by a free-floating space robot",0.162222222222,0.177947845805
7B773DA3,"Intelligent optimal control of robotic manipulators using neural networks",0.131753246753,0.195833333333
7DF5F81F,"A novel multi-DOF precision positioning methodology using two-axis Hall-effect sensors",0.101495726496,0.169273504274
78E0285A,"Adaptive recurrent cerebellar model articulation controller for linear ultrasonic motor with optimal learning rates",0.106582306582,0.143338143338
7EEC05FE,"Motion Suspension System for Humanoids in case of Emergency; Real-time Motion Generation and Judgment to suspend Humanoid",0.180238095238,0.16259018759
80415FC4,"Switched Homography-Based Visual Control of Differential Drive Vehicles with Field-of-View Constraints",0.120238095238,0.138571428571
5E4A0594,"Development of a bipedal humanoid robot-control method of whole body cooperative dynamic biped walking",0.109444444444,0.137222222222
7F856766,"Design, Fabrication, and Visual Servo Control of an XY Parallel Micromanipulator With Piezo-Actuation",0.121031746032,0.130456349206
803CD316,"Analysis and design of the integrated controller for precise motion systems",0.170562770563,0.169913419913
7F9FE28F,"Development of the FES system with neural network + PID controller for the stroke",0.135324675325,0.11094619666
