Paper ID,Title,Sim1,Sim2
814FFE14,"Small Marsokhod configuration",0.0834523809524,0.1
80F15044,"A joint space formulation for compliant motion control of robot manipulators",0.167222222222,0.15867003367
7BA47901,"CAN-based synchronized motion control for induction motors",0.155642135642,0.167361111111
81BE64F0,"Dynamic control of 3-D rolling contacts in two-arm manipulation",0.105952380952,0.14375
7DB4D0FE,"Optimal motion generation of a flexible macro-micro manipulator using genetic algorithm based upon object space centered spherical coordinate",0.180238095238,0.22328042328
7DB2D3E8,"Bifurcation in vehicle dynamics and robust front wheel steering control",0.108333333333,0.119109461967
80BC6386,"Impedance control of a spatial redundant manipulator used for relaxing muscle fatigue",0.12,0.165476190476
7BA2F4D3,"A system for engineering animation with automatic motion control",0.170562770563,0.17380952381
7F5BDE50,"Stable and high performance teleoperation with time domain passivity control: reference energy following scheme",0.131178266178,0.140788840789
7FEF2ED7,"Development of 4-DOF manipulator using mechanical impedance adjuster",0.123333333333,0.163181818182
7E503C99,"Compliant motion control for robust robotic surface finishing",0.166753246753,0.184027777778
7EF86935,"EMG-based control of an exoskeleton robot for human forearm and wrist motion assist",0.175642135642,0.157727920228
5F3F613E,"Predictive Control for Behavior Generation of Omni-directional Robots",0.127157287157,0.14537037037
7E1A979E,"Kinematic analysis and synthesis of the human arm motion during a manipulation task",0.170238095238,0.16163003663
77D0A4C5,"Model Predictive Control for Spacecraft Rendezvous and Docking: Strategies for Handling Constraints and Case Studies",0.113888888889,0.126992143659
7E1A8E8E,"Slip detection and control using tactile and force sensors",0.113888888889,0.150925925926
811DDD24,"One-leg jumping with virtual spring principle",0.0981623931624,0.112037037037
7F0B4468,"The evolution of robotics research",0.131904761905,0.128815628816
7E5224FF,"A Test-Bed for Visual Servo Control of Artificial Muscle Micro-Robot with Parallel Architecture",0.108333333333,0.111111111111
7D80D718,"Adaptive force ripple suppression in iron-core permanent magnet linear motors",0.114444444444,0.114444444444
78EF8172,"Defining a neural network controller structure for a rubbertuator robot",0.140086580087,0.163737373737
8165319D,"A biped locomotion strategy for the quadruped robot Sony ERS-210",0.105555555556,0.109006734007
804C200D,"An optimization-based approach for design and analysis of stable 2.5D visual servoing under sensor and actuator constraints",0.110238095238,0.124470899471
81619649,"Control and cohesion of energetic swarms",0.10119047619,0.126322751323
806F7FBF,"Coordinated Adaptive Robust Contouring Controller Design for an Industrial Biaxial Precision Gantry",0.11341991342,0.124609187109
8062B0D7,"A fuzzy logic based coordinated control strategy for a cabledriven clamming device",0.11341991342,0.157016594517
8098F31F,"Coordinated-motion control of heavy-duty industrial machines with redundancy",0.111904761905,0.130952380952
7FE0ADB1,"Development of vision-based autonomous robotic fish and its application in water-polo-attacking task",0.103003663004,0.127564102564
7D2403BC,"Visual Servoing Path Planning via Homogeneous Forms and LMI Optimizations",0.173162393162,0.209027777778
7CD806C7,"Fuzzy Modeling Using Chaotic Particle Swarm Approaches Applied to a Yo-yo Motion System",0.16880952381,0.211061507937
7E6977BD,"Sensorless Position Control Using Feedforward Internal Force for Completely Restrained Parallel-Wire-Driven Systems",0.115238095238,0.163161375661
7F584F1A,"Coordinated collective motion of Groups of autonomous mobile robots: analysis of Vicsek's model",0.206349206349,0.196368446368
806D371D,"Temporal stabilization of discrete movement in variable environments: An attractor dynamics approach",0.113181818182,0.10958994709
7CEBD2C0,"Control of Ground Interaction at the Zero-Moment Point for Dynamic Control of Humanoid Robots",0.128571428571,0.118716931217
7637119F,"Action Control of Soccer Robots Based on Simulated Human Intelligence",0.122222222222,0.162037037037
7FD2A5EC,"Enabling humanoid musical interaction and performance",0.101733821734,0.167989417989
7102F25D,"A mobile manipulator",0.111666666667,0.125
7D7E5C8F,"Non-contact impedance control for redundant manipulators using visual information",0.140086580087,0.19
8101057D,"Decentralized Coordinated Motion Control of Two Hydraulic Actuators Handling a Common Object",0.170562770563,0.20205026455
81486F5E,"PID-Like Neural Network Nonlinear Adaptive Control for Uncertain Multivariable Motion Control Systems",0.171601731602,0.185238095238
7FC50DE7,"A Multi-threads Architecture for the Motion Coordination of a Heterogeneous Multi-robot System",0.160173160173,0.181547619048
7F2D8E9D,"Optimization of sequential attractor-based movement for compact behaviour generation",0.127137862138,0.141666666667
7D05353C,"Optimal Control of an Under-Actuated System for Landing With Desired Postures",0.11341991342,0.160714285714
7F5B567A,"The parameterization of all disturbance observers for time-delay plants with any input and output disturbances",0.155793650794,0.160185185185
790A79F9,"Singularity-Free Kinematically Redundant Planar Parallel Mechanisms With Unlimited Rotational Capability",0.108333333333,0.125
753CBEBC,"Non-vector space approach for nanoscale motion control",0.161666666667,0.1875
80F8ABE0,"Robust motion/force control of uncertain holonomic/nonholonomic mechanical systems",0.11341991342,0.133928571429
7E40059D,"Passivity-based Control of Visual Feedback Systems with Dynamic Movable Camera Configuration",0.12380952381,0.124365079365
7F836A25,"Robust control of redundant manipulators with constraints using a general reduced order model",0.12,0.157034632035
7D465830,"An approach for fuzzy-PI control of mobile robot with wheels",0.113888888889,0.113005050505
8154DCF0,"Cooperative Filters and Control for Cooperative Exploration",0.108333333333,0.111111111111
8010D458,"Optimal biped walking with a complete dynamical model",0.0768462909639,0.170454545455
75860A14,"Nonlinear filters for the generation of smooth trajectories",0.145086580087,0.163888888889
7D2E878C,"Kinematic design of a 6-DOF parallel manipulator with decoupled translation and rotation",0.123571428571,0.125992063492
8130241F,"Biomimetic motion control system using CPG for a multi link mobile robot",0.160173160173,0.195105820106
7F6BBB4F,"A multi-task fuzzy control for underwater welding manipulator",0.113181818182,0.113636363636
80817E39,"Passive compliant quadruped robot using Central Pattern Generators for locomotion control",0.105555555556,0.161111111111
7E23DC7A,"On the robustness and performance of disturbance observers for second-order systems",0.140793650794,0.138015873016
813141A8,"Motion control of a robot arm using joint torque sensors",0.171753246753,0.181623931624
7614F7E6,"Magnetic robotic manoeuvring of gastrointestinal video capsules: preliminary phantom tests",0.289935064935,0.323208041958
7CF3005D,"Modularity development and control of an underwater manipulator for AUV",0.115,0.116666666667
7DF4A7F6,"Synthesis of Motor Motion Curves for Intermittent Indexing Tables with Minimized Positioning Time",0.187222222222,0.164384920635
80C28751,"Avoiding deadlocks of mobile robots in narrow passages of environments populated with moving obstacles",0.111111111111,0.182986111111
80266DE6,"Towards agile animated characters",0.0768462909639,0.128787878788
813D476E,"Nonlinear PD Synchronized Control for Parallel Manipulators",0.111666666667,0.1375
7EB93668,"Force-assembly with friction",0.097619047619,0.125
76D68274,"Safe breakwater-following control of an autonomous underwater vehicle with non-zero forward velocity",0.108333333333,0.114583333333
81563587,"Cooperative control of two mobile manipulators transporting objects on the slope",0.132467532468,0.150793650794
8039A2FF,"Robust Motion Control of High Precision Mechanical Servo Systems with Parameter Uncertainties",0.160173160173,0.149943310658
7F7B9129,"Decentralized centroid estimation for multi-agent systems in absence of any common reference frame",0.112931512932,0.145304232804
7D4E3DF4,"Torque sensorless control in multidegree-of-freedom manipulator",0.111666666667,0.125
7FA4AB35,"Coefficient sensitivity of polynomial-predictive FIR differentiators: design for short word length",0.127936507937,0.124365079365
7F9C1ECF,"Experimental research of the chained form manipulator",0.123571428571,0.126322751323
75840551,"Motion Control of an Outdoor Patrol Robot using a Single Laser Range Finder",0.155642135642,0.165625
7D9FB67A,"Balance control of a piped robot combining off-line pattern with real-time modification",0.113888888889,0.141203703704
7D7AC40E,"Backstepping control design for motion coordination of self-propelled vehicles",0.166991341991,0.170238095238
80B5ADDF,"Distributed Kinematic Inversion Technique for Self-Reconfigurable Modular Robots",0.112222222222,0.144444444444
7D5C9E0B,"Stability Analysis and Experimental Validation of a Motion-Copying System",0.115324675325,0.127678571429
7D1D07B5,"Output feedback control of rigid robots using dynamic neural networks",0.140324675325,0.172883597884
7C63AD20,"Adaptive control of redundant robot manipulators with sub-task objectives*",0.113888888889,0.12037037037
7DC83055,"Experimental comparison of several posture estimation solutions for biped robot Rabbit",0.117222222222,0.109953703704
80D958E5,"Control simulation of a six DOF parallel-serial robot for femur fracture reduction",0.11746031746,0.114682539683
814CA607,"Estimation of an affine motion",0.146986346986,0.229166666667
8116B556,"A design of adaptive H ∞ control for positioning mechanism system with input nonlinearities",0.150714285714,0.149546485261
7DAC0B8D,"Motion and force control of cooperative robotic manipulators with passive joints",0.15841991342,0.158888888889
809BF7AE,"A Hybrid Motion Model for Aiding State Estimation in Dynamic Quadrupedal Locomotion",0.148268398268,0.167929292929
7F3E60B7,"System design for forearm support-type lift assist system (FOLAS): An intuitively-operated power assist system without wearing",0.143896103896,0.179365079365
7DC765E7,"Control synthesis and adaptation for an underactuated autonomous underwater vehicle",0.125,0.135416666667
7EBE632A,"Rejection of Limit Cycles Induced From Disturbance Observers in Motion Control",0.17746031746,0.173759920635
81614699,"Nonlinear Target Impedance Design and Its Use in Robot Compliant Motion Control with Time Delay Estimation",0.190793650794,0.158293650794
81380780,"Nonlinear tracking control of autonomous underwater vehicles",0.108333333333,0.166666666667
73F244C3,"Modeling and input shaping control of a micro coaxial radio-controlled helicopter carrying a suspended load",0.11341991342,0.151339285714
80AA74D2,"Motion Control IC for X-Y Table based on SoPC Technology",0.162137862138,0.20205026455
756F20FA,"Input coupling analysis and optimal design of a 3-DOF compliant micro-positioning stage",0.130709290709,0.162142857143
59E15AA6,"Languages, behaviors, hybrid architectures, and motion control",0.185,0.206666666667
808CA5EA,"Task-induced symmetry and reduction in kinematic systems with application to needle steering",0.130086580087,0.160383597884
7E01ADA4,"Four and two wheel transformable dynamic mobile platform",0.0875,0.107954545455
75AF09AE,"Short primary linear drive designed for synchronous and induction operation in different sections",0.117857142857,0.146904761905
7FB890D1,"A flexible link manipulator as a force measuring and controlling unit",0.142142857143,0.172883597884
81580CDA,"Analysis of algorithms for velocity estimation from discrete position versus time data",0.16380952381,0.154308390023
7E9F3D8E,"Modeling and Control of a Dual Stage Actuator Hard Disk Drive",0.11746031746,0.121494708995
02A4F265,"Dual-drive gantry stage decoupling control based on a coupling model",0.108333333333,0.15386002886
7F9E3E48,"Behavior-based control of a non-holonomic robot in pushing tasks",0.122222222222,0.163194444444
7E4E3BDF,"Motion control of electric vehicle based on cornering stiffness estimation with yaw-moment observer",0.160642135642,0.200396825397
7E7D6652,"Visual servoing of an under-actuated dynamic rigid-body system: an image-based approach",0.108116883117,0.133928571429
8095D9B2,"Dynamic Obstacle Avoidance in uncertain environment combining PVOs and Occupancy Grid",0.109523809524,0.145304232804
7E87C42D,"Asymmetric trajectory planning for vacuum robot motion",0.250793650794,0.244444444444
80288144,"Internal force-based impedance control for cooperating manipulators",0.12,0.166666666667
7E282D53,"Driving control of electric power assisted wheelchair based on neural network learning of human characteristics",0.123116883117,0.165219656886
806C12E7,"Continuous guidance for the docking of autonomous vehicles using active task-space sensing",0.136753246753,0.176666666667
7F7E8A12,"Grasp planning based on dynamics shaping",0.166785714286,0.239134199134
7EA31368,"Uncalibrated visual tracking control without visual velocity",0.097619047619,0.166666666667
7D4F399A,"An impedance control strategy for cooperative manipulation",0.122619047619,0.126893939394
80BECBEE,"Incremental Learning for Mapping Image Variations to Actions",0.114285714286,0.133333333333
75CF23D1,"Haptic force control based on impedance/admittance control aided by visual feedback",0.11341991342,0.181216931217
807E74A2,"Fractional order impedance control by particle swarm optimization",0.128571428571,0.128439153439
809E906B,"Extended impedance control of redundant manipulators using joint space decomposition",0.14,0.169047619048
7DB4B90C,"Control of a planar underactuated biped on a complete walking cycle",0.110709290709,0.122619047619
7D09E111,"Open motion control: A model based development platform for rapid prototyping",0.15841991342,0.184595959596
5F3E0B15,"Motion control for human animation",0.146986346986,0.194444444444
6057C034,"Avoiding dynamic singularities in Cartesian motions of free-floating manipulators",0.15841991342,0.229166666667
7E25AAF3,"Design of a decoupled 2-DOF translational parallel micro-positioning stage",0.109523809524,0.133928571429
7D5E7376,"A Solution to the Accuracy/Robustness Dilemma in Impedance Control",0.116666666667,0.121527777778
7E67D20D,"Omnidirectional supervisory control of a multilegged vehicle using periodic gaits",0.108333333333,0.177083333333
7E43A522,"Adaptive sliding mode control for autonomous surface vessel",0.128658008658,0.143571428571
7F5C9A9C,"Motion controller design and embedded realization for Mecanum wheeled omnidirectional robots",0.164213564214,0.155964405964
75CD9ADD,"Actuation of a robotic fish caudal fin for low reaction torque",0.133333333333,0.127051282051
7E2D5B8F,"Design and evolution of a piezoelectrically actuated miniature swimming vehicle",0.136904761905,0.131904761905
7F130D0A,"A Lagrangian network for kinematic control of redundant robot manipulators",0.133975468975,0.140277777778
7DD1B73C,"3D motion control of 2 links (5 D.O.F.) underactuated manipulator named AcroBOX",0.33841991342,0.356666666667
7723FEAC,"Identification and control of systems with friction using accelerated evolutionary programming",0.296753246753,0.308531746032
7518D4F7,"An Interactive Treadmill Under a Novel Control Scheme for Simulating Overground Walking by Reducing Anomalous Force",0.105555555556,0.155447330447
801645FE,"Satellite berthing experiment with a two-armed space robot",0.133888888889,0.136111111111
7D51461B,"Linear Parameter-Varying Iterative Learning Control With Application to a Linear Motor System",0.130086580087,0.175793650794
815934BC,"Robotic yoyo playing with visual feedback",0.106582306582,0.196428571429
8087397B,"Disturbance Torque and Motion State Estimation Using Low Resolution Position Interfaces",0.188571428571,0.173494098494
75ED7442,"Swing-Up Control for a 3-DOF Gymnastic Robot With Passive First Joint: Design and Analysis",0.120793650794,0.124365079365
8030192F,"Motion preference learning",0.146986346986,0.185185185185
7D7E8409,"Decentralized coordinated control of a vehicle network for deployment in sweep coverage",0.161753246753,0.175396825397
7D2B4256,"Decoupled Visual Servoing from a set of points imaged by an omnidirectional camera",0.153823953824,0.172222222222
807F5727,"Robust compliant motion for manipulators, part I: The fundamental concepts of compliant motion",0.171666666667,0.211574074074
7FE16268,"Development of a new humanoid robot WABIAN-2",0.0909401709402,0.105555555556
7DA9ED6F,"A timing model for vision-based control of industrial robot manipulators",0.113888888889,0.112626262626
7D79ACFF,"Identification and hybrid impedance control of human skin muscle by multi-fingered robot hand",0.130555555556,0.113492063492
8088BFCC,"Modeling, design, and control of flexible manipulator arms: a tutorial review",0.132142857143,0.121103896104
7FB035DF,"Stiffness discrimination with visual and proprioceptive cues",0.0981623931624,0.1125
7DA6B450,"Anti-swing control of underactuated overhead crane system using multiple Lyapunov functions",0.122077922078,0.166991341991
7DB44A91,"Switching Control of Mobile Robots for Autonomous Navigation in Unknown Environments",0.11746031746,0.140793650794
7E60DF69,"Analysis of gait control of wall-climbing caterpillar robot",0.11746031746,0.118975468975
7F636B38,"Rate-constrained multi-hypothesis motion-compensated prediction for video coding",0.295471195471,0.419191919192
7DB057F0,"An event-driven architecture for controlling behaviors of the office conversant mobile robot, Jijo-2",0.127626262626,0.161910774411
7F0849D4,"Slip observer for walking on a low friction floor",0.119444444444,0.144444444444
7FA87E43,"Terrain-adaptive control to reduce landing impact force for human-carrying biped robot",0.105555555556,0.159444444444
7C405E8F,"Biomimetic Motion Control System Based on a CPG for an Amphibious Multi-Link Mobile Robot",0.160173160173,0.189424001924
7DAD1C9B,"An exoskeletal robot for human shoulder joint motion assist",0.17746031746,0.168888888889
7DDC152F,"Measuring stiffness of organs using 2-DOF haptic surgical forceps robots",0.100233100233,0.166077441077
7CFEA111,"A method for cooperative robot actions through multi-stage construction of action intelligence",0.122222222222,0.137235449735
7CA87061,"Velocity control of a washing machine: A mechatronic approach",0.116666666667,0.125
7D4AD202,"Electromagnetic Actuator Control: A Linear Parameter-Varying (LPV) Approach",0.113888888889,0.12037037037
800796E8,"Model adaptive hybrid dynamic control for constrained motion systems",0.160173160173,0.160642135642
79D31B17,"Animation of dynamic legged locomotion",0.097619047619,0.125
7E0A97DA,"Biomimetic Micro Underwater Vehicle with Oscillating Fin Propulsion: System Design and Force Measurement",0.146349206349,0.162641723356
7EA76C44,"Architecture for electronic control unit tasks in automotive engine control",0.133658008658,0.130753968254
7E99FCA9,"A strategy for fine motion manipulation of robots using kinematic constraints",0.160642135642,0.182281144781
78CC2904,"On the Robot Compliant Motion Control",0.153823953824,0.189814814815
586908D5,"Parallel Stochastic Optimization for Humanoid Locomotion Based on Neural Rhythm Generator",0.108888888889,0.158888888889
7CBBFDE9,"Steering control algorithm for efficient drive of a mobile robot with steerable omni-directional wheels",0.11746031746,0.143789081289
7D44590F,"Frequency domain analysis of second order sliding modes",0.119280719281,0.141137566138
80A28CEE,"Multiple impedance control for object manipulation",0.122619047619,0.138888888889
80DE9619,"Neuromorphic walking gait control",0.097619047619,0.166666666667
7F60431E,"Genetic Programming for Articulated Figure Motion",0.328804528805,0.511111111111
76249BE6,"Bilateral Motion Control for Reproduction of Real World Force Sensation based on the Environmental Model",0.166991341991,0.170193001443
816BFA23,"High-Performance Tracking Controller for Discrete Plant Using Nonlinear Sliding Surface",0.107619047619,0.194318181818
7C490820,"Teleoperation controller design using H ∞ -optimization with application to motion-scaling",0.108181818182,0.183441558442
7CEFEB7C,"Exploration and map-building under uncertainty with multiple heterogeneous robots",0.115728715729,0.112433862434
7E784159,"Planning multi-robot grasping motions",0.146986346986,0.224747474747
7E40C882,"An amphibious snake-like robot: Design and motion experiments on ground and in water",0.17380952381,0.153902116402
7E56C6D9,"Swedish Wheeled Omnidirectional Mobile Robots: Kinematics Analysis and Control",0.11746031746,0.123412698413
80A60703,"Self-organizing intelligent system and its application for hard disk drive control",0.130086580087,0.140476190476
80E9D03C,"Minimizing cross-talk in high-precision motion systems using data-based dynamic decoupling",0.160173160173,0.252380952381
7EB21B08,"Robot motions in a dynamic environment",0.146986346986,0.229166666667
7EEBE92A,"Motion control components' algorithms on a chip for driving module",0.160476190476,0.151422387137
7D4AF99C,"A Realization of Haptic Skill Database by Bilateral Motion Control",0.148804528805,0.168181818182
7A8E2F4A,"Motion-copying system based on velocity information for motion reproduction",0.170562770563,0.212896825397
7DB3BD25,"Robust adaptive control of uncertain force/motion constrained nonholonomic mobile manipulators",0.111666666667,0.12037037037
7F9F6C97,"Admittance Design for Assembly of Polyhedral Parts with Modeling Errors",0.111904761905,0.110582010582
7FEC2AE6,"End point tracking for a moving object with several attention regions by composite vision system",0.132467532468,0.150713484047
81D48FF0,"Delayless differentiation algorithm and its efficient implementation for motion control applications",0.162137862138,0.163161375661
8175B045,"Modified Learning of T-S Fuzzy Neural Network Control for Autonomous Underwater Vehicles",0.129935064935,0.162222222222
7EBF7121,"Autonomous motorcycles for agile maneuvers, part I: Dynamic modeling",0.146666666667,0.144848484848
7F594F64,"Systemic properties of robotic manipulators during compliant task execution and their impact on controller design",0.135476190476,0.125628736343
7B6BA96A,"Adaptive Polar-Space Motion Control for Embedded Omnidirectional Mobile Robots with Parameter Variations and Uncertainties.",0.157864357864,0.151124338624
7F334204,"Friction compensation of a retrofit milling machine through a fuzzy logic controller combined with neural network-based feedforward control",0.111666666667,0.126294191919
7E3B47A3,"Evaluation of manipulator dynamics based on optimal controller",0.123571428571,0.152705627706
8012B036,"Fuzzy logic self-motion planning and robust adaptive control for tip-over avoidance of redundant mobile modular manipulators",0.195,0.223214285714
7AE34A9A,"Dynamic control of a flexible macro-micro manipulator based on rigid dynamics with flexible state sensing",0.111666666667,0.139682539683
803A15FC,"Multivariable Frequency-Domain Identification of Industrial Robots",0.102606837607,0.118055555556
7CEC5770,"An embedded fuzzy controller for a behavior-based mobile robot with guaranteed performance",0.107070707071,0.104377104377
8000D494,"Robot motion control based on joint torque sensing",0.162137862138,0.241666666667
80827422,"Periodic forcing, dynamics and control of underactuated spacecraft and underwater vehicles",0.108333333333,0.108134920635
7F2AAF5F,"Distributed formation control with permutation symmetries",0.122137862138,0.15
7FE44126,"Impact model and control of two cooperating planar manipulators",0.117222222222,0.140404040404
7E724463,"Noncontact impedance control for redundant manipulators",0.12,0.138888888889
80BBF532,"A flexible spine human-form robot-development and control of the posture of the spine",0.097619047619,0.111111111111
7EB405FD,"Application of a Disturbance Observer for a Relative Position Control System",0.140793650794,0.140939153439
7D6E8A04,"Choice of image features for depth-axis control in image based visual servo control",0.107070707071,0.138446969697
7D6CAF9F,"Second-Order Iterative Learning Control for Scaled Setpoints",0.0991341991342,0.118055555556
7F722814,"Autonomous Surface Vehicle Docking Manoeuvre with Visual Information",0.140086580087,0.166515151515
814D1687,"Inverse kinematics analysis for the arm of a mobile humanoid robot based on the closed-loop algorithm",0.126118326118,0.140170940171
5D6D3476,"Design and control of fully flexible valve actuation systems for camless engines",0.130086580087,0.128048340548
7ED93480,"Robotic arm control inspired by human muscle tension effect under the gravity",0.124848484848,0.126527044384
8154BEB6,"Planning 3-D Collision-Free Dynamic Robotic Motion Through Iterative Reshaping",0.146986346986,0.291666666667
811A2F69,"Robust motion control for nonholonomic constrained mechanical systems: sliding mode approach",0.166991341991,0.178174603175
7F006355,"Kinematic analysis and control of an omnidirectional mobile robot in rough terrain",0.118975468975,0.110642135642
7DC0D814,"Policy Gradient Learning for a Humanoid Soccer Robot",0.119769119769,0.157864357864
80020193,"Performance of pinching motions of two multi-DOF robotic fingers with soft-tips",0.151026751027,0.173611111111
7DF210A3,"Infinite-Mode Networks for Motion Control",0.158414918415,0.219444444444
8066D474,"Adaptive control of redundant robot manipulators with sub-task objectives",0.115404040404,0.118055555556
8009F620,"Adaptive high-precision control of positioning tables-theory and experiments",0.103174603175,0.14537037037
7B6E8496,"Human scale haptic interaction with a reactive virtual human in a realtime physics simulator",0.11746031746,0.10496031746
