Paper ID,Title,Sim1,Sim2
7F57EC1F,"A Multistage Position/Force Control for Constrained Robotic Systems With Friction: Joint-Space Decomposition, Linearization, and Multiobjective Observer/Controller Synthesis Using LMI Formalism",0.120238095238,0.139329805996
7DD61D58,"A robust MPC/ISM hierarchical multi-loop control scheme for robot manipulators",0.113888888889,0.113005050505
80C42D52,"A new method for position control of planar 3-Dof underactuated robots",0.110404040404,0.111805555556
812FC1C1,"Quadruped robot obstacle negotiation via reinforcement learning",0.112844932845,0.130158730159
80D08B44,"Optimal Vibratory Stick-Slip Transport",0.0964502164502,0.142857142857
7E816B64,"A parametric study of flapping wing performance using a robotic flapping wing",0.103010878011,0.180050505051
7D70A689,"Force feedback from micro environment considering nominal mass of disturbance observer",0.145714285714,0.142800453515
7D988B65,"Terrain feature localization for mobile robots in outdoor environments",0.113888888889,0.107070707071
7EDCF647,"A method of deciding force feedback gain against external force for biped robot",0.126118326118,0.151927437642
5EB8DA3E,"Analysis and experimental validation of force bandwidth for force control",0.109523809524,0.123346560847
7D2A0C2E,"The switching algorithm for the design of crane controller",0.10341991342,0.118506493506
7FEF8867,"Adaptive backstepping control using recurrent neural network for linear induction motor drive",0.137546897547,0.168716931217
76A8F6BC,"Movable Range-Finding Sensor System and Precise Automated Landing of Quad-Rotor MAV",0.0964502164502,0.126322751323
7FE6C041,"Shady3D: A Robot that Climbs 3D Trusses",0.0801407742584,0.137037037037
801C3334,"Chaotic neural network applied to two-dimensional motion control",0.158414918415,0.247916666667
80D6BCE4,"Biped walking control based on hybrid position/force control",0.097619047619,0.208333333333
7DB6F47C,"An experiment in integrated exploration",0.0752824746633,0.0972222222222
8067EC51,"Exact steering with arbitrarily bounded input for a class of driftless dynamics",0.158414918415,0.220952380952
80228686,"Real-time combinatorial tracking of a target moving unpredictably among obstacles",0.0995115995116,0.169047619048
7EA7FFEE,"Hybrid PD/PID controller design for two-link flexible manipulators",0.123571428571,0.119588744589
7F658CB6,"Dynamics Model of Paramecium Galvanotaxis for Microrobotic Application",0.103003663004,0.101481851482
7A08C566,"Functional Mode Estimation Using Principal Component Analysis of Grasping/Manipulating Motion",0.157375957376,0.215476190476
7DA4EA3D,"A framework for robot control with active vision using a neural network based spatial representation",0.128975468975,0.176199494949
7CEF6FDB,"Modelling and motion simulation of an underwater glider with independently controllable main wings",0.158658008658,0.161904761905
7941A881,"Fuzzy controller design for synchronous motion in a dual-cylinder electro-hydraulic system",0.170562770563,0.177489177489
7DDD8562,"Three-dimensional motion coordination in a time-invariant flowfield",0.146986346986,0.229166666667
7E4BA439,"Active guidance of a handheld micromanipulator using visual servoing",0.12031968032,0.266666666667
802373AA,"Robust sliding mode control for uncertain discrete-time systems with time delay",0.126118326118,0.141137566138
7DF75155,"A proximate-time-optimal-control design and its application to a hard disk drive dual-stage actuator system",0.130086580087,0.138558201058
78C4299E,"Shadow robot for teaching motion",0.153823953824,0.169552669553
78E6C54D,"Medical mechatronics—An application to haptic forceps",0.107619047619,0.133333333333
78ABB025,"A Motion-Control Chip to Generate Velocity Profiles of Desired Characteristics",0.128333333333,0.163181818182
81077807,"Control of Modular Robot with Parameter Estimation Using Genetic Algorithms",0.11746031746,0.153439153439
7A11AB21,"Extended Kalman and Particle Filtering for sensor fusion in motion control of mobile robots",0.16246031746,0.159523809524
7E4EB7A6,"Contact consistent control framework for humanoid robots",0.105555555556,0.109006734007
7D47B034,"Development of a new kind of microrobot in pipe",0.0906493506494,0.0969696969697
7D7FA189,"Single view depth estimation based formation control of robotic swarms: Obstacle avoidance, simulation, and practical issues",0.130709290709,0.15082972583
807F1DDF,"Inversion of flexible manipulator dynamics via the trajectory pattern method",0.123333333333,0.127645502646
7FED9985,"On specifying and performing visual tasks with qualitative object models",0.147619047619,0.171753246753
7DE265C1,"A Maximum Entropy Based Scalable Algorithm for Resource Allocation Problems",0.109523809524,0.158068783069
7E774A2D,"Portability and applicability of virtual fixtures across medical and manufacturing tasks",0.136666666667,0.14246031746
589723A6,"Mobile Robot Motion Control from Demonstration and Corrective Feedback",0.166991341991,0.181547619048
80BFDBE6,"Design of a Digital Servo Control IC for Permanent Magnet Synchronous Motors with Linear Hall Sensors",0.120238095238,0.118898809524
0160B73B,"Sensor-Based Motion Control for Mobile Robots",0.153823953824,0.189814814815
5CB36CBD,"Feedback of reaction force in haptics",0.106582306582,0.126322751323
7E1103D2,"High-step climbing by a crawler robot DIR-2 - realization of automatic climbing motion -",0.153823953824,0.152861952862
7DFEDD73,"A robust model reference adaptive control of robot system based on TMS320C3X chips",0.116991341991,0.146141556856
839163C6,"Sequential Monte Carlo Inverse Kinematics",0.119280719281,0.119047619048
8143BA40,"A Novel Manipulator for 3D Ultrasound Guided Percutaneous Needle Insertion",0.135324675325,0.179464285714
7FDADFCC,"Robot's motion decision-making system in unknown environment and its application to a mobile robot",0.175324675325,0.165013227513
7F13D107,"A novel acceleration profile for the motion control of capsubots",0.151026751027,0.204861111111
7EB3DBD6,"A new variable structure PID-controller design for robot manipulators",0.136904761905,0.136408730159
7F321CEA,"Level-Ground Walk Based on Passive Dynamic Walking for a Biped Robot with Torso",0.102222222222,0.148888888889
7E266518,"Minimum control-switch motions for the snakeboard: a case study in kinematically controllable underactuated systems",0.166991341991,0.181547619048
78A16868,"Practical controller design for precision positioning, independent of friction characteristic",0.124848484848,0.126797739298
811F4E6E,"Optimal Object Configurations to Minimize the Positioning Error in Visual Servoing",0.113162393162,0.160714285714
7D6787A7,"Adaptive Control of Two-Axis Motion Control System Using Interval Type-2 Fuzzy Neural Network",0.171601731602,0.209920634921
80A40E91,"Automatic weight learning for multiple data sources when learning from demonstration",0.160238095238,0.225
79707A9D,"Optimum motion control of palletizing robots based on iterative learning",0.153823953824,0.202777777778
5A2979FE,"Contact motion in unknown environment",0.153804528805,0.194444444444
80E233EC,"A velocity measurement method for acceleration control",0.120952380952,0.134444444444
801A78B0,"DSP-Based Digital Torque/Motion Control of DC Motors for Direct-Drive Industrial Robotic Applications",0.122222222222,0.119925213675
80B3164D,"Design Principles for Energy-Efficient Legged Locomotion and Implementation on the MIT Cheetah Robot",0.11746031746,0.108573429372
7CF1A4CD,"Contouring control of a parallel mechanism based on equivalent errors",0.120238095238,0.170238095238
799698BE,"An Improvement of Speed Control Performances of a Two-Mass System using a Universal Approximator",0.118975468975,0.156216931217
7D519266,"Spatial-based adaptive iterative learning control of nonlinear rotary systems with spatially periodic parametric variation",0.118975468975,0.178075396825
7FDCA3F3,"A Modular and High-Precision Motion Control System With an Integrated Motor",0.160173160173,0.175793650794
8084AD72,"The Utilization of Reconfigurable Hardware to Implement Digital Controllers: a Review",0.127626262626,0.151363636364
7DA62160,"Model Based Position-Force-Vision Sensor Fusion for Robot Compliant Motion Control",0.160642135642,0.175685425685
804C4823,"Design for control-a concurrent engineering approach for mechatronic systems design",0.111688311688,0.139285714286
798D2B58,"Motion Control of Industrial Robot by Considering Vibration Suppression and Fast Path Tracking",0.16746031746,0.149652777778
7FF80E4D,"Human-machine cooperative telemanipulation with motion and force scaling using task-oriented virtual tool dynamics",0.156601731602,0.195701058201
802D91AF,"A bio-inspired robotic locomotion system based on conducting polymer actuators",0.11341991342,0.167201779702
7FCB069F,"A stiffness control of a manipulator using a fuzzy model",0.111666666667,0.168560606061
81226F40,"Nonlinear adaptive motion control for manipulators with compliant joints",0.15841991342,0.170833333333
589F28C8,"Backstepping control of a rigid body",0.111666666667,0.125
7FE3BCD5,"Editing dynamic properties of captured human motion",0.146986346986,0.242063492063
7F157E71,"Cooperative Load Transport: A Formation-Control Perspective",0.10937950938,0.132275132275
7E4FEF63,"Research on a Real-time Interpolator DSPs Based for NURBS",0.0900331041508,0.238095238095
7EAC2B3F,"Output regulation of the ball and plate system with a nonlinear velocity observer",0.121031746032,0.121263656978
77A77A18,"Asynchronous Multilateral Control for Simplified Walking Haptic System",0.116753246753,0.154464285714
7F3A452F,"Hybrid type of underwater micro biped robot with walking and swimming motions",0.160642135642,0.150555555556
80391C5F,"Running pattern generation of humanoid biped in the three-dimensional space and its realization",0.133333333333,0.151515151515
7E869777,"Fluid Dynamic Analysis of an ICPF Actuated Fish-like Underwater Microrobot with 3 DOF",0.0900331041508,0.154761904762
7C4DC4E1,"A MODEL-FREE APPROACH FOR ACCURATE JOINT MOTION CONTROL IN HUMANOID LOCOMOTION",0.153804528805,0.177083333333
7D1E8B8C,"Feedback control of a wheeled snake mechanism with the Transverse Function approach",0.128896103896,0.122023809524
75E6CF81,"Static Friction Compensation for Enhancing Motor Control Precision",0.105555555556,0.116402116402
81318048,"Optimal motion planning of a one-legged hopping robot",0.235642135642,0.314814814815
7F6B5592,"Dynamic visual servoing with image moments for a quadrotor using a virtual spring approach",0.115709290709,0.164682539683
7F843AF4,"General ZMP Preview Control for Bipedal Walking",0.104523809524,0.122619047619
7D3E3C40,"Second order sliding mode motion control of rigid robot manipulators",0.16746031746,0.169907407407
7F338559,"Power assist control by repulsive compliance control of electric wheelchair",0.133506493506,0.134794372294
7D683D03,"An Active Disturbance Rejection Based Approach to Vibration Suppression in Two‐Inertia Systems",0.143571428571,0.171995464853
8103CDAB,"Realization of micromanipulating Gough-Stewart platforms with desired dynamics",0.0934149184149,0.0957792207792
80DF1147,"Micropositioning of a weakly calibrated microassembly system using coarse-to-fine visual servoing strategies",0.0985014985015,0.191774891775
76D7794D,"Model-based control for ultrasonic motors",0.105555555556,0.118055555556
80158E51,"Dynamic Models for Control System Design of Integrated Robot and Drive Systems",0.125324675325,0.128349824778
7F720FF2,"Title Multi Degrees of Freedom Maglev System with Permanent Magnet Motion Control",0.164213564214,0.152876984127
7D44DD11,"FPGA-Based Adaptive Backstepping Sliding-Mode Control for Linear Induction Motor Drive",0.11746031746,0.119742063492
7F859D0A,"The study of accurate digital control for precision AC servo table",0.125555555556,0.125
7ED74376,"An adaptive recurrent-neural-network motion controller for X-Y table in CNC Machine",0.161363636364,0.178977272727
805E1A24,"Pseudoerror-based self-organizing neuro-fuzzy system",0.0964502164502,0.142857142857
5E355817,"Periodic motion control by modulating CPG parameters based on time-series recognition",0.146986346986,0.19212962963
7EF0E034,"Manipulability Enhancement by an Impedance Parameter Tuning for a Remote Ultrasound Diagnostic System",0.131904761905,0.137244897959
7E2CB507,"Integrated Direct/Indirect Adaptive Robust Control of Hydraulic Manipulators With Valve Deadband",0.111666666667,0.126893939394
7D909205,"Observer-corrector control design for robots with destabilizing unmodeled dynamics",0.11746031746,0.140079365079
6CC4372C,"Adaptive gait pattern control of a quadruped locomotion robot",0.108888888889,0.122222222222
7FF42F6E,"Lightweight Procedural Animation With Believable Physical Interactions",0.109523809524,0.133928571429
7F44FBBA,"User-controlled physics-based animation for articulated figures",0.112619047619,0.1625
7D21C0C7,"Development of a dexterous cable driven spine mechanism for humanoid robots",0.125555555556,0.121494708995
7FFCD79C,"The effects of joint flexibility on robot motion control based on joint torque positive feedback",0.164935064935,0.189058956916
810BE22A,"Motion Control of Omni-Directional Three-Wheel Robots by Brain-Emotional-Learning-Based Intelligent Controller",0.153823953824,0.165088383838
7D8BB572,"Online omnidirectional walking patterns generation for biped robot",0.128975468975,0.134027777778
7FCC423B,"Comparison of real environmental models for reproduction of force sensation in bilateral motion control",0.166991341991,0.146887239744
80D5A920,"Distributed Control System for a Humanoid Robot",0.11341991342,0.135793650794
7DDE7E72,"An overview of the encoding tools in the MPEG-4 reference software",0.121031746032,0.135714285714
7CF21B28,"Evaluation of Low-Level Controllers for an Orthopedic Surgery Robotic System",0.119769119769,0.112012987013
5C247AE7,"Fuzzy control of a benchmark problem: a computing with words approach",0.114285714286,0.14212962963
7E115437,"Design, Implementation, and Force Modeling of Quadrupole Magnetic Tweezers",0.1084004884,0.113015873016
80EB875C,"Nonholonomic dynamic rolling control of reconfigurable 5R closed kinematic chain robot with passive joints",0.11246031746,0.168716931217
7ECAC5B4,"Locally controllable manipulation by stable pushing",0.0917857142857,0.1875
80E45465,"A Strategy-driven Framework for Multi-Robot Cooperation System",0.125324675325,0.125541125541
8011279A,"Redundancy Optimization of Hyper Redundant Robots Based on Movability and Assistability",0.11246031746,0.16246031746
7DEB4529,"How can human motion prediction increase transparency?",0.168804528805,0.191774891775
7FF41E20,"An integrated architecture for robot motion planning and control in the presence of obstacles with unknown trajectories",0.253571428571,0.210714285714
7CF8CFC3,"Control of a Snake Robot for Ascending and Descending Steps",0.108333333333,0.155423280423
7EBE5A32,"Modeling and control of a hydraulic unit for direct yaw moment control in an automobile",0.113506493506,0.121103896104
7EF528DA,"A new formulation of the extended Jacobian method and its use in mapping algorithmic singularities for kinematically redundant manipulators",0.135,0.136447811448
7D4ABC4D,"Seamless Execution of Action Sequences",0.117857142857,0.136507936508
77B7E4EF,"Self-adaptive interval type-2 neural fuzzy network control for PMLSM drives",0.130709290709,0.155952380952
79ACA6CD,"Human body animation: a survey",0.12,0.125
7D88EC54,"High-Precision Position Control of a Linear-Switched Reluctance Motor Using a Self-Tuning Regulator",0.122222222222,0.156018518519
80207746,"Bolt and screw assemblage through collaborative kinematics operation of two modular robots based on the position feedback",0.137546897547,0.152821869489
7DE3919C,"Mobile robot helper",0.0965079365079,0.105555555556
7E78131B,"Development of a biped robot with toes to improve gait pattern",0.108888888889,0.132407407407
7E62354B,"On modeling, identification, and control of a heavy-duty electrohydraulic harvester manipulator",0.12,0.108333333333
7C8EAEA9,"Effect of sampling jitter and control jitter on positioning error in motion control systems",0.192380952381,0.171904761905
7DFF01FF,"Dynamics and control of whole arm grasps",0.097619047619,0.0910651848152
7DBFFFF6,"Distant human motion programming of hexapods with the help of stereoscopic visualization",0.33341991342,0.346666666667
7E0A0005,"Neural network based adaptive impedance control of constrained robots",0.142308802309,0.187222222222
795903F5,"Frequency domain based nonlinear feed forward control design for friction compensation",0.110622710623,0.141121031746
5FC22D80,"Three Examples of Learning Robots",0.108888888889,0.189814814815
7EF46A9F,"Simultaneous Physiological Motion Cancellation and Depth Adaptation in Flexible Endoscopy",0.153804528805,0.167222222222
7A500BF2,"Robust Lateral Motion Control of Electric Ground Vehicles With Random Network-Induced Delays",0.16341991342,0.166666666667
7E322E40,"A particle-swarm-optimized fuzzy-neural network for voice-controlled robot systems",0.133506493506,0.151322751323
7FAFF423,"Trajectory Tracking Control for a new Generation of Fire Rescue Turntable Ladders",0.137546897547,0.158994708995
7A645B81,"High accuracy motion control of linear motor drive wire-EDM machines.",0.156601731602,0.16746031746
808A097F,"Robust Tracking and Vibration Suppression for a Two-Inertia System by Combining Backstepping Approach With Disturbance Observer",0.138015873016,0.145634920635
7F595F9F,"Robust dynamics wavelet-based cerebellar model articulation controller design for linear ultrasonic motors",0.119769119769,0.108345358345
80A65969,"Dynamic analysis and human analogous control of a pipe crawling robot",0.11746031746,0.145793650794
769F99B7,"Dynamics and unification of animation control",0.103174603175,0.108134920635
7DB49D79,"Model-Reference Control Approach to Obstacle Avoidance for a Human-Operated Mobile Robot",0.118975468975,0.118975468975
7F61A5F5,"Advanced motion control in robotics",0.146986346986,0.178418803419
8092FDBF,"Cross-Ball: A new morphogenetic self-reconfigurable modular robot",0.0801407742584,0.111111111111
7E36CD3B,"Swarm-based object manipulation using redundant manipulator analogs",0.139285714286,0.16746031746
8059C0A9,"Path planning with incremental roadmap update for large environments",0.184523809524,0.223214285714
774ECA1F,"Improving contouring accuracy by tuning gains for a bi-axial CNC machine",0.118506493506,0.164285714286
7EBDA80F,"Learning strategies for sensor-based manipulation tasks",0.100119047619,0.178977272727
76ABA975,"Cost-efficient drilling using industrial robots with high-bandwidth force feedback",0.12380952381,0.168253968254
796B55D0,"Motion control of electromechanical servo-devices with permanent-magnet stepper motors",0.153823953824,0.163194444444
7D79340C,"Model-based dynamic positioning of underwater robotic vehicles: theory and experiment",0.126111111111,0.131755050505
7B713F8D,"Testing motion controllers robustness by emulating electrical and mechanical parameter variations of motor drives",0.164213564214,0.154915223665
7F9A7F58,"Motion regulation of redundantly actuated omni-directional Wheeled Mobile Robots with internal force control",0.153823953824,0.165249433107
80F9B5EA,"Exploiting Task Intervals for Whole Body Robot Control",0.145,0.166666666667
81736DD0,"Sliding-Mode Enhanced Adaptive Motion Tracking Control of Piezoelectric Actuation Systems for Micro/Nano Manipulation",0.175324675325,0.183673469388
7DB7D89E,"Optimal yaw-rate control for electric vehicles with active front-rear steering and four-wheel driving-braking force distribution",0.113888888889,0.116666666667
80A53011,"Trajectory tracking control of a Macro-Micro welding robot based on the vision navigation",0.11746031746,0.163445681303
7DA9371B,"Decentralized H ∞ filtering in a multi-agent system",0.1084004884,0.167989417989
7E031C71,"Evaluation of telerobotic shared control for efficient manipulation of single-cells in microinjection",0.109523809524,0.133928571429
7C27A909,"Optimal fast tracking observer bandwidth of the linear extended state observer",0.108888888889,0.153888888889
7F5E1429,"Orbital stabilization of a pre-planned periodic motion to swing up the Furuta pendulum: Theory and experiments",0.157864357864,0.167929292929
7FDB9921,"Analysis and Simulation of Speed Control for Two-Mass Resonant System",0.125324675325,0.135714285714
7E1D753F,"Task skill transfer of 3-prong plug manipulation",0.122222222222,0.127777777778
807B4CB7,"Manipulator motion control in operational space using joint velocity inner loops",0.165,0.186904761905
7FEBFCDA,"Design and Dynamic Walking Control of Humanoid Robot Blackmann",0.11746031746,0.157242063492
7D33D4AC,"Quintic G/sup 2/-splines for the iterative steering of vision-based autonomous vehicles",0.103888888889,0.118055555556
7DD65996,"Generalized impedance control of robot for assembly tasks requiring compliant manipulation",0.138888888889,0.167361111111
805E3864,"A Stabilization Control of Bilateral System With Time Delay by Vibration Index—Application to Inverted Pendulum Control",0.118975468975,0.134700176367
7FDD19CD,"Clustered-architecture motion control system utilizing IEEE 1394b communication network",0.186753246753,0.216865079365
7FF4C007,"The sensor-control Jacobian as a basis for controlling calibration-free robots",0.115728715729,0.195767195767
59701E00,"Friction Model Validation in Sliding and Presliding Regimes with High Resolution Encoders",0.113095238095,0.137770562771
8156075E,"Integrated vision and force control in suspended cell injection system: Towards automatic batch biomanipulation",0.161991341991,0.145859387526
7E22ACB0,"Adaptive teleoperation systems design",0.111688311688,0.142857142857
5A8D06E7,"Robot control as a service — Towards cloud-based motion planning and control for industrial robots",0.235642135642,0.210317460317
7869AA2C,"Nonlinear control of mechatronic systems with permanent-magnet DC motors",0.11341991342,0.113972832723
5B7A40F4,"Sliding Mode Motion Control Strategies for Rigid Robot Manipulators",0.160642135642,0.164225589226
810529D8,"Slow resonance ratio control for vibration suppression and disturbance rejection in torsional system",0.165714285714,0.151686507937
80D8199C,"Magnetic fish-robot based on multi-motion control of a flexible magnetic actuator",0.105555555556,0.189814814815
7E9ED4A7,"Low-voltage analog current-mode Central Pattern Generator circuit for robotic chewing locomotion using 130nanometer CMOS technology",0.11746031746,0.146329365079
7A23D3E8,"Adaptive Robust Dynamic Balance and Motion Controls of Mobile Wheeled Inverted Pendulums",0.153823953824,0.169733044733
7949D01C,"Lazy auctions for multi-robot collision avoidance and motion control under uncertainty",0.157375957376,0.16335978836
7EFC99F1,"A Reset State Estimator Using an Accelerometer for Enhanced Motion Control With Sensor Quantization",0.15841991342,0.157323232323
8114A65D,"The simulation and the design of a 6-DOF parallel micromechanism",0.101733821734,0.132275132275
7721DD50,"Robust fuzzy neural network controller with nonlinear disturbance observer for two-axis motion control system",0.19746031746,0.171887239744
8026F9B2,"Data-based feed-forward control in MIMO motion systems",0.160173160173,0.200396825397
7BCD903C,"Real-time Ethernet networks for motion control",0.161212121212,0.187310606061
804B3C8F,"Empirical validation of a new visual servoing strategy",0.0917857142857,0.107954545455
778BB9F3,"On the Mechanics of Functional Asymmetry in Bipedal Walking",0.100952380952,0.100641025641
7E0B33D5,"A Course in Simulation and Demonstration of Humanoid Robot Motion",0.168975468975,0.175793650794
8027A6E2,"Line following guidance control: Application to the Charlie unmanned surface vehicle",0.16,0.171428571429
76921D54,"Brief paper: A globally stable saturated desired compensation adaptive robust control for linear motor systems with comparative experiments",0.120793650794,0.133503401361
7DA1983B,"The first humanoid robot that has the same size as a human and that can lie down and get up",0.105555555556,0.208796296296
7DD8C86F,"Motion control of biped robots using a single-chip drive",0.164213564214,0.209126984127
79665D0C,"Benefits of acceleration measurement in velocity estimation and motion control",0.168804528805,0.158621933622
7D6B0AFE,"Enhancing the reactive capabilities of integrated planning and control with Cooperative Extended Kohonen Maps",0.191666666667,0.202976190476
7EEA3FB1,"Fish-like underwater microrobot with 3 DOF",0,0
7FAE5ABC,"A realtime pattern generator for biped walking",0.108888888889,0.162037037037
762D0696,"Online Minimum-acceleration Trajectory Planning with the Kinematic Constraints",0.187619047619,0.255555555556
80CE5956,"Motion/force/image control of a diagnostic ultrasound robot",0.11746031746,0.126322751323
810FF109,"Rehabilitation system with 3-D exercise machine for upper limb",0.108116883117,0.111904761905
7E7011AC,"Control performance in the horizontal plane of a fish robot with mechanical pectoral fins",0.111111111111,0.100330687831
752C7B27,"Interactive control of physically-valid aerial motion: application to VR training system for gymnasts",0.181991341991,0.176461038961
80AAD1F4,"Design and development of research platform for perception-action integration in humanoid robot: H6",0.120238095238,0.127447089947
7F8B02EE,"Moving horizon control for biped robots without reference trajectory",0.125793650794,0.163161375661
75498C99,"On the design of the feedforward compensator in two-degree-of-freedom controllers",0.0997835497835,0.116883116883
7F846FF9,"Model Predictive Controller with a Fixed Compensator for an Electromechanical Valve",0.0865967365967,0.0909090909091
7650A78B,"Neural network learning of robot arm impedance in operational space",0.148888888889,0.138746438746
7D6B3C4D,"Motorcycle modeling for high-performance maneuvering",0.0687081339713,0.128787878788
